text,title,id,terms,administration,organization,mechanism,year,cost,funding
"Enhancing Quality in Pediatrics Sepsis with Shock Prediction and Early Electronic Decision Support (EQUIP with SPEED) PROJECT SUMMARY / ABSTRACT  Pediatric septic shock is a leading cause of childhood death, in which morbidity-free survival depends on timely diagnosis and treatment. Although the medical community, general public and state legislatures have increasingly recognized that delays in diagnosing septic shock in children are an important cause of preventable morbidity, there are no validated predictive models to improve early sepsis diagnosis in children. The candidate, Dr. Halden Scott, is a pediatric emergency physician at Children's Hospital Colorado and the University of Colorado School of Medicine. She has critically evaluated early diagnostic strategies in an Electronic Health Record (EHR)-derived pediatric sepsis registry that she designed that will support the proposed research. She is seeking to develop into an independent health services researcher, through the proposed mentored research with the following goals: 1) Derive and test models to predict septic shock in an existing EHR-derived dataset, comparing models derived with two modern modeling techniques; 2) create an EHR decision support tool for the early recognition of septic shock; 3) conduct a pilot implementation trial of decision support in community and academic pediatric emergency care settings within the Children's Hospital Colorado network. This implementation and feasibility data will inform a future multicenter pragmatic trial of computerized decision support in diagnosis of pediatric septic shock, which Dr. Scott will propose in an R01 application before the end of the K award. Dr. Scott's research trajectory is facilitated and enriched by strong institutional clinical, informatics and administrative support, and her involvement in the Pediatric Emergency Care Applied Research Network and international sepsis guidelines committees.  This award would support Dr. Scott's career development goals: acquire skills in predictive modeling, the use of health information technology in learning health systems, and pragmatic trials. Dr. Scott's nationally renowned mentors will support these goals: Dr. Kempe, expert in pragmatic trials, program evaluation and implementation research; Dr. Fairclough, expert in statistics and modeling; Dr. Kahn, expert in research and clinical informatics. Additional advisors contribute expertise in machine learning, clinical pediatric emergency research, critical care and sepsis. This proposal responds to AHRQ priorities: improving health care quality through information systems, improving safety and quality by synthesizing evidence, and focuses on AHRQ priority populations including children and those with chronic care needs. The research, mentorship and training plan proposed are ideally suited to provide Dr. Scott with the skills needed to develop into an independent health services researcher focused on improving the quality of care for pediatric emergency conditions, particularly sepsis, through the use of health information technology in learning health systems, and conduct of pragmatic trials to test implementation of evidence-based practice in emergency settings. Project Narrative / Public Health Relevance  Pediatric septic shock, a leading cause of childhood death, is often recognized late, causing preventable morbidity, and improved early diagnostic approaches would improve the timeliness of sepsis diagnosis, accelerate treatment and improve outcomes. This proposal will provide mentored research training to use predictive modeling to improve early diagnosis of pediatric sepsis, and test the delivery of clinical decision support to clinicians through the electronic health record in an implementation trial. This proposal responds to the AHRQ priorities of improving health care quality through use of information systems, improving safety and quality of care by synthesizing and communicating evidence to health care professionals, advances knowledge generation in a learning health system and focuses on AHRQ priority populations including children and those with chronic care needs.",Enhancing Quality in Pediatrics Sepsis with Shock Prediction and Early Electronic Decision Support (EQUIP with SPEED),9985019,[' '],AHRQ,UNIVERSITY OF COLORADO DENVER,K08,2020,148539,292134808
"Enhancing Quality in Pediatrics Sepsis with Shock Prediction and Early Electronic Decision Support (EQUIP with SPEED) PROJECT SUMMARY / ABSTRACT  Pediatric septic shock is a leading cause of childhood death, in which morbidity-free survival depends on timely diagnosis and treatment. Although the medical community, general public and state legislatures have increasingly recognized that delays in diagnosing septic shock in children are an important cause of preventable morbidity, there are no validated predictive models to improve early sepsis diagnosis in children. The candidate, Dr. Halden Scott, is a pediatric emergency physician at Children's Hospital Colorado and the University of Colorado School of Medicine. She has critically evaluated early diagnostic strategies in an Electronic Health Record (EHR)-derived pediatric sepsis registry that she designed that will support the proposed research. She is seeking to develop into an independent health services researcher, through the proposed mentored research with the following goals: 1) Derive and test models to predict septic shock in an existing EHR-derived dataset, comparing models derived with two modern modeling techniques; 2) create an EHR decision support tool for the early recognition of septic shock; 3) conduct a pilot implementation trial of decision support in community and academic pediatric emergency care settings within the Children's Hospital Colorado network. This implementation and feasibility data will inform a future multicenter pragmatic trial of computerized decision support in diagnosis of pediatric septic shock, which Dr. Scott will propose in an R01 application before the end of the K award. Dr. Scott's research trajectory is facilitated and enriched by strong institutional clinical, informatics and administrative support, and her involvement in the Pediatric Emergency Care Applied Research Network and international sepsis guidelines committees.  This award would support Dr. Scott's career development goals: acquire skills in predictive modeling, the use of health information technology in learning health systems, and pragmatic trials. Dr. Scott's nationally renowned mentors will support these goals: Dr. Kempe, expert in pragmatic trials, program evaluation and implementation research; Dr. Fairclough, expert in statistics and modeling; Dr. Kahn, expert in research and clinical informatics. Additional advisors contribute expertise in machine learning, clinical pediatric emergency research, critical care and sepsis. This proposal responds to AHRQ priorities: improving health care quality through information systems, improving safety and quality by synthesizing evidence, and focuses on AHRQ priority populations including children and those with chronic care needs. The research, mentorship and training plan proposed are ideally suited to provide Dr. Scott with the skills needed to develop into an independent health services researcher focused on improving the quality of care for pediatric emergency conditions, particularly sepsis, through the use of health information technology in learning health systems, and conduct of pragmatic trials to test implementation of evidence-based practice in emergency settings. Project Narrative / Public Health Relevance  Pediatric septic shock, a leading cause of childhood death, is often recognized late, causing preventable morbidity, and improved early diagnostic approaches would improve the timeliness of sepsis diagnosis, accelerate treatment and improve outcomes. This proposal will provide mentored research training to use predictive modeling to improve early diagnosis of pediatric sepsis, and test the delivery of clinical decision support to clinicians through the electronic health record in an implementation trial. This proposal responds to the AHRQ priorities of improving health care quality through use of information systems, improving safety and quality of care by synthesizing and communicating evidence to health care professionals, advances knowledge generation in a learning health system and focuses on AHRQ priority populations including children and those with chronic care needs.",Enhancing Quality in Pediatrics Sepsis with Shock Prediction and Early Electronic Decision Support (EQUIP with SPEED),9747879,[' '],AHRQ,UNIVERSITY OF COLORADO DENVER,K08,2019,148539,292134808
"HYBRID ONTOLOGY AND MACHINE LEARNING BASED METHODS USING EMR DATA FOR EFFECTIVE CLINICAL DECISION SUPPORT (CDS); A SEPSIS CASE STUDY USING ICU DATA ﻿    DESCRIPTION (provided by applicant):  Our research is focused on the use of advanced ontological models as a foundation for computerized Clinical Decision Support (CDS) systems that link hospitalized patient data routinely captured in electronic medical records (EMRs) with medical knowledge to effectively influence timely awareness and treatment choices by clinicians. Our phase 1 goal is to demonstrate how our advanced CDS technology has the potential to improve preventable mortality outcomes associated with sepsis in ICU patients. We distinguish two types of CDS algorithms available today for detecting and/or predicting sepsis using EMR data: 1) evidence-based ""knowledge-driven"" detection algorithms; and 2) data-driven ""predictive"" algorithms based on machine learning (ML) techniques. Recent studies indicate currently available CDS tools do not reduce risk of death in hospitalized patients. We believe this may be because diseases such as sepsis are time-sensitive, complex syndromes and also due to the challenges of computerized reuse of unstructured EMR data. Our sepsis ontology models this complexity to: a) provide enhanced knowledge-driven sepsis risk- stratified cohort classifications that help guide interventions; b) support accurate natural language processing (NLP) of free text clinical notes to enhance real-time sepsis risk detection; and c) improve the accuracy of data- driven prediction models when used in conjunction with ML training algorithms. Our CDS is based on proprietary cluster computing technology we call ""VFusion"" designed to efficiently deal with the generation and practical use of large, application domain-specific ontologies. Our sepsis ontology employs a family of upper level ontologies, combined with granular evidence-based domain ontologies, configurable rule sets (e.g. first order logic-based), and required components of reference terminologies. Our research will use openly available ICU patient data to establish statistical detection/prediction performance metrics using this ontology in 2 modes of use: 1) as a knowledge-based screening tool to detect subtle signs of sepsis in individualized hospitalized patients; 2) used in conjunction with ML to improve data-driven predictive performance. We will measure specificity/sensitivity, and positive/negative predictive power of our hybrid ontology-based technology to demonstrate dramatically improved performance over existing CDS algorithms. In Phase II we plan a retrospective demonstration with a much larger sample of patients to include non-ICU patients in collaboration with a major healthcare system. Our product vision is an early inpatient sepsis detection algorithm with high accuracy embodied as a ""plug-in application"" compatible with any modern EMR platform in use at a client hospital effective in both ICU and non-ICU care settings.         PUBLIC HEALTH RELEVANCE:  Even with the advent of powerful, new computer medical record technologies used in hospitals, the risk of death has not been reduced in hospitalized patients. The goal of this research effort is to combine medical record systems with advanced cognitive technologies that are commonly used today in products such as the iPhone ""Siri"" to improve clinician awareness and decisions that will dramatically reduce preventable mortality. Our initial use case will be the management of sepsis--=the leading cause of death in non-coronary intensive care units in hospitals                ",HYBRID ONTOLOGY AND MACHINE LEARNING BASED METHODS USING EMR DATA FOR EFFECTIVE CLINICAL DECISION SUPPORT (CDS); A SEPSIS CASE STUDY USING ICU DATA,9046860,"['Address', 'Age', 'Algorithms', 'Antibiotic Resistance', 'Antibiotic Therapy', 'Antibiotics', 'Awareness', 'Caring', 'Case Study', 'Cause of Death', 'Cellular Phone', 'Cessation of life', 'Classification', 'Client', 'Clinical', 'Clinical Decision Support Systems', 'Code', 'Cognitive', 'Collaborations', 'Comorbidity', 'Complex', 'Computerized Medical Record', 'Computers', 'Data', 'Data Set', 'Detection', 'Diagnostic', 'Disease', 'Disease Progression', 'Early Diagnosis', 'Early treatment', 'Family', 'Foundations', 'Generations', 'Goals', 'Healthcare Systems', 'Hospitals', 'Hour', 'Hybrids', 'Infection', 'Inpatients', 'Intensive Care Units', 'Intervention', 'Knowledge', 'Laboratories', 'Letters', 'Link', 'Logic', 'Machine Learning', 'Manuals', 'Measurement', 'Measures', 'Medical', 'Medical Records', 'Methods', 'Modeling', 'Mortality Determinants', 'Natural Language Processing', 'Ontology', 'Organ', 'Outcome', 'Patients', 'Performance', 'Phase', 'Physiological', 'Plug-in', 'Protocols documentation', 'Recording of previous events', 'Research', 'Retrospective Studies', 'Risk', 'Risk Factors', 'Sampling', 'Semantics', 'Sensitivity and Specificity', 'Sepsis', 'Septic Shock', 'Severities', 'Source', 'Specificity', 'Syndrome', 'System', 'Techniques', 'Technology', 'Terminology', 'Text', 'Time', 'Training', 'Validation', 'Vendor', 'Vision', 'antimicrobial', 'base', 'cluster computing', 'cohort', 'computerized', 'design', 'diagnostic accuracy', 'effective therapy', 'evidence base', 'improved', 'knowledge base', 'mortality', 'predictive modeling', 'public health relevance', 'screening', 'tool']",NLM,"COMPUTER TECHNOLOGY ASSOCIATES, INC.",R43,2015,149100,0
"Objective Evaluation of Variation in Sepsis Incidence, Mortality, and Care PROJECT ABSTRACT Sepsis is a leading cause of death, disability, and cost to the healthcare system. Increasing recognition of the devastating burden of sepsis has prompted national performance improvement initiatives and efforts to benchmark the quality of sepsis care. However, efforts to track sepsis incidence, outcomes, and quality have been hindered by the lack of reliable surveillance tools. The candidate, Dr. Chanu Rhee, has thus led recent efforts to develop a novel method for identifying sepsis through electronic health records (EHRs) using objective clinical markers of infection and concurrent organ dysfunction. He has demonstrated that this method is less susceptible to changing diagnosis and coding practices over time than administrative claims data, the traditional method of surveillance, and can be applied to diverse EHR systems in different healthcare systems. The overall goal of this proposal is to build on this work to improve the ability of researchers, clinical organizations, and policy makers to evaluate variation in sepsis incidence, outcomes, and care and thus identify targets for improvement and inform better prevention and treatment strategies. These themes fit with AHRQ's mission to improve health care quality and patient safety, and are reflected in the Specific Aims: 1) Develop and validate a disease severity prediction model for risk-adjustment of sepsis outcomes based on data routinely captured in electronic health records, 2) Evaluate interhospital and intrahospital unit-level variation in sepsis incidence and outcomes using objective EHR-data versus claims codes and identify factors associated with worse outcomes, and 3) Evaluate the impact of lactate testing on clinical outcomes in patients with suspected sepsis. This project will leverage “big data” with granular clinical information from more than 200 academic and community hospitals and 4 million inpatient encounters, providing the capacity to adjust for multiple confounders, analyze important patient subgroups, and make robust conclusions that are widely generalizable to the nation. The candidate, Dr. Chanu Rhee, MD, MPH, is a junior faculty member in the Department of Population Medicine at Harvard Medical School and a dual-certified critical care and infectious disease physician at Brigham and Women's Hospital. This K08 proposal will capitalize on Dr. Rhee's rich clinical background, foundational training in epidemiology, biostatistics, and public health, and previous research experience with sepsis epidemiology and surveillance using EHR clinical data. Dr. Rhee's immediate goals during this award period are to 1) acquire skills in using “big data” in healthcare and handling missing data, 2) learn advanced methods in prediction modeling and mixed-effects logistic regression, 3) learn propensity score analysis and comparative effectiveness research skills, 4) improve communication, research leadership, and grant writing skills, and 5) participate in ongoing training in ethical research conduct. These goals will be accomplished through a combination of active mentoring; formal didactic coursework; immersive research training; practical experience; and collaborations with internationally recognized sepsis and infectious disease experts, public health officials, and the Hospital Corporation of America, the largest inpatient private healthcare system in the world. Throughout the K08 award period, he will continue to establish himself as a national thought leader on sepsis epidemiology, surveillance, and quality while preparing for his transition to independence. Dr. Rhee's multidisciplinary and experienced mentorship team, combined with the superb research environment of the Harvard Medical School Department of Population Medicine, provides the support and training experience necessary to achieve his long-term goal of becoming an independently funded health services researcher focusing on using big data to improve disease surveillance, prevention, and quality of care for sepsis and infections in critically ill patients. PROJECT NARRATIVE   The devastating burden of sepsis on our society has prompted national performance improvement initiatives, but efforts to measure sepsis rates, outcomes, and quality of care are hindered by the lack of reliable surveillance methods.  The candidate, Dr. Chanu Rhee, has led recent efforts to develop a novel method for identifying sepsis through electronic health records using objective clinical markers of infection and concurrent organ dysfunction rather than administrative claims codes, which are prone to variability in diagnosis and coding practices and changing billing incentives over time. The overall goal of this proposal is to build on this work and improve the capacity of researchers, clinical organizations, and policy makers to evaluate variation in sepsis incidence, outcomes, and care patterns across hospitals using electronic health record data, and thus identify targets for improvement and inform better sepsis prevention and treatment strategies.  ","Objective Evaluation of Variation in Sepsis Incidence, Mortality, and Care",9742497,[' '],AHRQ,"HARVARD PILGRIM HEALTH CARE, INC.",K08,2019,149472,14964406
"Objective Evaluation of Variation in Sepsis Incidence, Mortality, and Care PROJECT ABSTRACT Sepsis is a leading cause of death, disability, and cost to the healthcare system. Increasing recognition of the devastating burden of sepsis has prompted national performance improvement initiatives and efforts to benchmark the quality of sepsis care. However, efforts to track sepsis incidence, outcomes, and quality have been hindered by the lack of reliable surveillance tools. The candidate, Dr. Chanu Rhee, has thus led recent efforts to develop a novel method for identifying sepsis through electronic health records (EHRs) using objective clinical markers of infection and concurrent organ dysfunction. He has demonstrated that this method is less susceptible to changing diagnosis and coding practices over time than administrative claims data, the traditional method of surveillance, and can be applied to diverse EHR systems in different healthcare systems. The overall goal of this proposal is to build on this work to improve the ability of researchers, clinical organizations, and policy makers to evaluate variation in sepsis incidence, outcomes, and care and thus identify targets for improvement and inform better prevention and treatment strategies. These themes fit with AHRQ's mission to improve health care quality and patient safety, and are reflected in the Specific Aims: 1) Develop and validate a disease severity prediction model for risk-adjustment of sepsis outcomes based on data routinely captured in electronic health records, 2) Evaluate interhospital and intrahospital unit-level variation in sepsis incidence and outcomes using objective EHR-data versus claims codes and identify factors associated with worse outcomes, and 3) Evaluate the impact of lactate testing on clinical outcomes in patients with suspected sepsis. This project will leverage “big data” with granular clinical information from more than 200 academic and community hospitals and 4 million inpatient encounters, providing the capacity to adjust for multiple confounders, analyze important patient subgroups, and make robust conclusions that are widely generalizable to the nation. The candidate, Dr. Chanu Rhee, MD, MPH, is a junior faculty member in the Department of Population Medicine at Harvard Medical School and a dual-certified critical care and infectious disease physician at Brigham and Women's Hospital. This K08 proposal will capitalize on Dr. Rhee's rich clinical background, foundational training in epidemiology, biostatistics, and public health, and previous research experience with sepsis epidemiology and surveillance using EHR clinical data. Dr. Rhee's immediate goals during this award period are to 1) acquire skills in using “big data” in healthcare and handling missing data, 2) learn advanced methods in prediction modeling and mixed-effects logistic regression, 3) learn propensity score analysis and comparative effectiveness research skills, 4) improve communication, research leadership, and grant writing skills, and 5) participate in ongoing training in ethical research conduct. These goals will be accomplished through a combination of active mentoring; formal didactic coursework; immersive research training; practical experience; and collaborations with internationally recognized sepsis and infectious disease experts, public health officials, and the Hospital Corporation of America, the largest inpatient private healthcare system in the world. Throughout the K08 award period, he will continue to establish himself as a national thought leader on sepsis epidemiology, surveillance, and quality while preparing for his transition to independence. Dr. Rhee's multidisciplinary and experienced mentorship team, combined with the superb research environment of the Harvard Medical School Department of Population Medicine, provides the support and training experience necessary to achieve his long-term goal of becoming an independently funded health services researcher focusing on using big data to improve disease surveillance, prevention, and quality of care for sepsis and infections in critically ill patients. PROJECT NARRATIVE   The devastating burden of sepsis on our society has prompted national performance improvement initiatives, but efforts to measure sepsis rates, outcomes, and quality of care are hindered by the lack of reliable surveillance methods.  The candidate, Dr. Chanu Rhee, has led recent efforts to develop a novel method for identifying sepsis through electronic health records using objective clinical markers of infection and concurrent organ dysfunction rather than administrative claims codes, which are prone to variability in diagnosis and coding practices and changing billing incentives over time. The overall goal of this proposal is to build on this work and improve the capacity of researchers, clinical organizations, and policy makers to evaluate variation in sepsis incidence, outcomes, and care patterns across hospitals using electronic health record data, and thus identify targets for improvement and inform better sepsis prevention and treatment strategies.  ","Objective Evaluation of Variation in Sepsis Incidence, Mortality, and Care",9532741,[' '],AHRQ,"HARVARD PILGRIM HEALTH CARE, INC.",K08,2018,149472,14964406
