text,title,id,terms,administration,organization,mechanism,year,cost,funding
"Sepsis Early Prediction and Subphenotype Illumination Study (SEPSIS) PROJECT SUMMARY Sepsis, defined as life-threatening organ dysfunction in response to infection, is a devastating condition that contributes to up to half of hospital deaths and over $24 billion in healthcare costs in the U.S. annually. Over 750,000 patients develop sepsis in the U.S. each year, and survivors suffer long-term cognitive impairment and physical disability. Historically, sepsis research has focused on patients who are already critically ill. However, up to 50% of patients with sepsis receive their care on the inpatient wards, and only 10% of patients with sepsis are initially diagnosed in the intensive care unit (ICU). Because early intervention improves outcomes in sepsis, it is important to optimize the detection and treatment of sepsis outside the ICU.  The current sepsis paradigm has several problems. The first problem is that early identification of infection relies on clinician intuition, and caregivers often disagree regarding which patients are infected. This leads to delays in therapy and increased mortality in some patients and unnecessary therapies and adverse medication side effects in others. A second problem is that there is a lack of accurate tools to risk stratify infected patients outside the ICU after they are identified. Some patients with infection are treated outside the ICU and are later discharged home, while others develop life-threatening complications and die in the hospital. Accurate risk stratification of infected patients would bring additional critical care resources to the bedside of the high-risk patients that need them most. A third problem with the current sepsis paradigm is that it is often treated as a one-size-fits-all syndrome. However, patients with sepsis have a wide range of clinical presentations and outcomes due to the complex interactions between patient risk factors, the infectious organism, and the host immune response. These data suggest that the impact of timely and more aggressive interventions on outcomes may differ based on a patient's clinical phenotype. Identifying important subphenotypes of infected patients is critical to delivering more personalized care at the bedside.  The purpose of this project is to use data from the electronic health record and statistical modeling techniques to identify high-risk infected patients and important new subphenotypes of this syndrome. In Aim 1, we will develop a novel tool for identifying infected patients outside the ICU using modern machine learning techniques. In Aim 2, we will develop a tool for risk stratifying infected patients outside the ICU using machine learning methods. Finally, in Aim 3 we will use cluster analysis techniques to determine whether the benefit of early and more aggressive interventions varies based on clinical phenotype. Our project will provide clinicians with powerful new tools to identify high-risk infected patients and important new subphenotypes of this common and deadly syndrome. This work will help to deliver early, life-saving care to the bedside of septic patients and lead to future interventional trials aimed at decreasing preventable death. PROJECT NARRATIVE Sepsis, defined as life-threatening organ dysfunction in response to infection, is a devastating condition that contributes to up to half of hospital deaths and over $24 billion in costs in the US. The purpose of this project is to use data from the electronic health record and statistical modeling techniques to identify high-risk infected patients and determine which subgroups of patients benefit most from early and more aggressive interventions. This work will result in novel algorithms to identify high-risk infected patients that can be implemented in the electronic health record to decrease preventable death.",Sepsis Early Prediction and Subphenotype Illumination Study (SEPSIS),9673189,"['Address', 'Advisory Committees', 'Algorithm Design', 'Algorithms', 'Anti-inflammatory', 'Area', 'Caregivers', 'Caring', 'Centers for Disease Control and Prevention (U.S.)', 'Cessation of life', 'Characteristics', 'Clinical', 'Cluster Analysis', 'Complex', 'Critical Care', 'Critical Illness', 'Data', 'Data Set', 'Detection', 'Deterioration', 'Diagnosis', 'Early Diagnosis', 'Early Intervention', 'Early identification', 'Early treatment', 'Electronic Health Record', 'Functional disorder', 'Future', 'Goals', 'Grant', 'Health Care Costs', 'Heart Arrest', 'Home environment', 'Hospitals', 'Immune response', 'Impaired cognition', 'Infection', 'Infectious Agent', 'Inpatients', 'Intensive Care Units', 'Intervention', 'Intervention Trial', 'Intuition', 'Knowledge', 'Label', 'Lead', 'Life', 'Lighting', 'Logistic Regressions', 'Machine Learning', 'Manuals', 'Medicine', 'Methods', 'Modeling', 'Modernization', 'Organ', 'Outcome', 'Patient risk', 'Patients', 'Pharmaceutical Preparations', 'Physically Handicapped', 'Probability', 'Publishing', 'Research', 'Resources', 'Risk', 'Risk Factors', 'Risk stratification', 'Savings', 'Sepsis', 'Severity of illness', 'Statistical Models', 'Subgroup', 'Survivors', 'Syndrome', 'Techniques', 'Time', 'Validation', 'Variant', 'Work', 'base', 'clinical phenotype', 'cohort', 'cost', 'electronic data', 'high risk', 'improved', 'improved outcome', 'learning strategy', 'machine learning algorithm', 'mortality', 'novel', 'patient subsets', 'personalized care', 'preventable death', 'random forest', 'response', 'septic patients', 'side effect', 'tool', 'ward']",NIGMS,UNIVERSITY OF CHICAGO,R01,2019,29604,246330700
"Using Big Data to Understand Sepsis in an Immunocompromised Population PROJECT SUMMARY/ABSTRACT Through this proposal, I will develop and evaluate a sepsis prediction tool targeted to allogeneic hematopoietic cell transplant (HCT) recipients. Allogeneic HCT recipients are an immunocompromised population that is disproportionately affected by sepsis, a life-threatening dysregulated immunologic response to an infection. While it is well established that early detection and treatment of sepsis with fluids and broad-spectrum antibiotics reduce the risk of mortality, recent data suggests early broad-spectrum antibiotic use in allogeneic HCT recipients may have microbiota-mediated detrimental effects on morbidity and mortality. Because of the risks associated with both missed and falsely identified sepsis events among allogeneic HCT recipients, early and accurate sepsis diagnosis is crucial. However, sepsis is generally challenging to diagnose and is made more complicated in allogeneic HCT recipients by the fact that sepsis presents differently following transplantation and common complications of the transplant procedure present like sepsis. In previous work, we demonstrated that current sepsis clinical criteria have low predictive value among allogeneic HCT recipients and concluded that population specific prediction tools are needed. Recently developed single algorithm, machine learning sepsis prediction tools have shown promising results in general, immuno-competent populations. However, few studies have tested the ability of machine learning workflows to predict sepsis in high-risk, immunocompromised patients, such as allogeneic HCT recipients. Additionally, current sepsis prediction tools rely on the assumption that the true relationship between the predictors and the outcome is contained within a single algorithm. This proposed work has two main objectives. The first is to develop an automated sepsis prediction tool for allogeneic HCT recipients using a state-of-the-art ensemble-based machine learning workflow (the super learner) that relaxes the single algorithm assumption of current sepsis prediction tools. The second is to estimate the utility of this tool in comparison to currently available tools in both traditional (accuracy methods) and novel ways (mathematical modeling of health outcomes). Both aims will be completed with the ultimate goal of improving sepsis prediction among allogeneic HCT recipients and in such, reducing sepsis related mortality and inappropriate antibiotic use among this hard to diagnose population. Further, this research will advance the methodological discussion around the usefulness of machine learning prediction tools in clinical practice and the use of ensemble modeling for prediction of rare, high-case fatality diseases. Such advances have the potential to improve the prediction of health outcomes beyond sepsis and reduce the burden of treatable diseases among immunocompromised populations. PROJECT NARRATIVE Sepsis is a life-threatening dysregulated host response to an infection that disproportionately affects allogeneic hematopoietic cell transplant (HCT) recipients. Early detection and appropriate antibiotic therapy have been shown to reduce the risk of mortality in patients with sepsis, but clinical criteria currently recommended in sepsis detection have poor predictive value among HCT recipients. This project consists of the development of an automated, population-specific sepsis diagnostic tool and an estimate of the health implications of tool implementation.",Using Big Data to Understand Sepsis in an Immunocompromised Population,10064529,"['Address', 'Admission activity', 'Adopted', 'Adult', 'Affect', 'Algorithms', 'Allogenic', 'American', 'Antibiotic Therapy', 'Antibiotics', 'Bacteremia', 'Big Data', 'Cancer Patient', 'Clinical', 'Clinical Data', 'Code', 'Collection', 'Complex', 'Data', 'Detection', 'Development', 'Diagnosis', 'Diagnostic', 'Disease', 'Early Diagnosis', 'Early treatment', 'Event', 'Frequencies', 'General Population', 'Goals', 'Health', 'Hospital Mortality', 'Hospitals', 'Immune response', 'Immunocompetent', 'Immunocompromised Host', 'Infection', 'Inflammatory Response', 'Intensive Care Units', 'Life', 'Liquid substance', 'Machine Learning', 'Mediating', 'Medical Records', 'Methodology', 'Methods', 'Modeling', 'Morbidity - disease rate', 'Organ failure', 'Outcome', 'Paper', 'Patients', 'Population', 'Predictive Value', 'Procedures', 'Publishing', 'Research', 'Research Personnel', 'Risk', 'Sensitivity and Specificity', 'Sepsis', 'Speed', 'Staphylococcus aureus', 'Streptococcus', 'System', 'Systemic Inflammatory Response Syndrome', 'Techniques', 'Testing', 'Time', 'Transplant Recipients', 'Transplantation', 'United States', 'Validation', 'Work', 'accurate diagnosis', 'base', 'cancer care', 'clinical practice', 'data cleaning', 'hematopoietic cell transplantation', 'high risk', 'improved', 'machine learning method', 'markov model', 'mathematical model', 'microbiota', 'mortality', 'mortality risk', 'neural network', 'novel', 'outcome prediction', 'patient population', 'predictive modeling', 'predictive tools', 'random forest', 'tool', 'treatment guidelines']",NHLBI,UNIVERSITY OF WASHINGTON,F31,2020,45082,533302350
"Digital High Resolution Melt and Machine Learning for Rapid and Specific Diagnosis in Neonatal Sepsis Project Summary Blood culture sensitivity in neonates is poor but is the “Gold Standard” for the diagnosis of sepsis. Universal genotyping of pathogen genomic sequences using High Resolution Melt (U-HRM) provides a simple, low cost, rapid, and modern alternative to blood culture testing. By measuring the fluorescence of an intercalating dye as PCR-amplified pathogen DNA fragments are heated and disassociate, sequence defined melt curves are generated with single-nucleotide resolution in a closed-tube reaction. We have advanced U- HRM into a digital PCR format (U-dHRM), where DNA sequences that are present in mixtures are individually amplified and identified as is needed for polymicrobial infections. We have also established unique signature melt curves for 37 bacterial species that commonly infect older children and adults and automatically identify them using machine learning technology. With the goal of creating an accurate and valid test for the timely diagnosis of neonatal sepsis, we will advance this technology to identify unique fungal, viral, and bacterial HRM signatures along with antibiotic resistance genes with an accuracy of 99-100% on minimal blood volume (1mL). Our aims are: Aim 1. Optimize and assess the U-dHRM platform for neonatal bacteremia diagnosis by expand our bacterial database (13 additional bacteria) to detect causes of >99% of neonatal bacterial infections, expand our antibiotic resistance gene database to include five clinically actionable genes, and assessing the performance of the system for bacteremia diagnosis in mock and clinical whole blood samples; Aim 2. Advance the U-dHRM platform for simultaneous detection of fungal and viral pathogens by upgrading our optical system to enable expansion to fungal and viral detection in a high-throughput format, multiplexing the assay to expand to viral and fungal pathogens causing >99% non-bacterial infections, and conducting analytical validation of the multiplexed platform using mock whole blood samples; and Aim 3. Advance the machine learning algorithm for detection of emerging pathogens by developing and integrating an anomaly detection algorithm for reporting emerging pathogens that are not included in our database and validating the algorithm using data generated in Aims 1 and 2. Thus, this proposal directly addresses the funding call by applying a multidisciplinary approach to overcome the biomedical challenge of rapidly diagnosis sepsis, a hidden public health disaster. Project Narrative Digital High Resolution Melting (dHRM) of DNA combined with machine learning creates unique “fingerprints"" for microbes and antibiotic resistance, allowing for faster and more precise detection and treatment of pathogen(s) causing sepsis. This project will advance and test the clinical performance of dHRM technology in the diagnosis of neonatal sepsis. Our goal is to rapidly and accurately identify pathogens and their resistance markers to facilitate accurate antimicrobial therapy, reducing antibiotic overuse in non-infected infants.",Digital High Resolution Melt and Machine Learning for Rapid and Specific Diagnosis in Neonatal Sepsis,9794293,"['Address', 'Adult', 'Algorithms', 'Antibiotic Resistance', 'Antibiotics', 'Bacteremia', 'Bacteria', 'Bacterial Antibiotic Resistance', 'Bacterial Infections', 'Biological Assay', 'Birth Weight', 'Blood', 'Blood Volume', 'Blood specimen', 'Child', 'Clinical', 'DNA', 'DNA Sequence', 'Data', 'Databases', 'Detection', 'Diagnosis', 'Diagnostic', 'Disasters', 'Dyes', 'Emerging Technologies', 'Exposure to', 'Fingerprint', 'Fluorescence', 'Funding', 'Genes', 'Genome', 'Genotype', 'Goals', 'Gold', 'Hour', 'Immune response', 'Individual', 'Infection', 'Machine Learning', 'Measures', 'Microbe', 'Modernization', 'Neonatal', 'Nucleotides', 'Optics', 'Organism', 'Patients', 'Performance', 'Predisposition', 'Public Health', 'RNA', 'Reaction', 'Reporting', 'Research', 'Resistance', 'Resolution', 'Sampling', 'Sepsis', 'Symptoms', 'System', 'Technology', 'Testing', 'Therapeutic', 'Time', 'Training', 'Tube', 'United States', 'Validation', 'Variant', 'Very Low Birth Weight Infant', 'Viral', 'Whole Blood', 'Woman', 'antimicrobial', 'base', 'circulating DNA', 'clinically actionable', 'clinically relevant', 'cost', 'diagnosis standard', 'digital', 'early onset', 'interdisciplinary approach', 'intrapartum', 'machine learning algorithm', 'melting', 'microbial', 'neonatal sepsis', 'neonate', 'overtreatment', 'pathogen', 'pathogen genome', 'pathogen genomics', 'pathogenic fungus', 'pathogenic virus', 'point of care', 'premature', 'rapid diagnosis', 'resistance gene', 'sample collection', 'septic', 'therapy resistant', 'viral detection']",NIAID,"UNIVERSITY OF CALIFORNIA, SAN DIEGO",R01,2019,58207,524978793
"Merging Temporal Changes in Clinical Informatics, Transcriptomics, and Cytokine Profiles to Understand the Host Response to Bacteremia As an ICU physician and an immunologist, I have devoted my research career to understanding sepsis,  a disease that affects nearly 2 million people annually in the USA. Sepsis is a life-threatening  condition that arises when the body's response to infection injures its own tissues. Great strides  have been made towards improving the clinical care of the septic patient, but the mortality rate  remains >20% for several reasons: First, each sepsis-causing pathogen, be it bacterial, viral, or  fungal, carries its own virulence factors that affect the host response, but unfortunately, much  research has focused on studying septic patients as a group, rather than distinguishing patients  based on microbiologic cause. Second, researchers often study patients once they manifest  sepsis-induced organ failure yet many people sustain infections due to common sepsis  pathogens, like Staphylococcus aureus, but never develop sepsis; understanding the ""appropriate""  response to a pathogen is critical to understanding the ""inappropriate"" response of  sepsis. Finally, much sepsis research occurs in silos; clinician researchers focus on the  electronic medical record, while basic scientists analyze biologic data. Too often, these  groups do not collaborate to share information, even though understanding the biologic  significance of clinical data may be of great value. To address these issues, I propose a unique  approach to understand the host response to infection that incorporates both biologic data and  clinical electronic medical record (EMR) data from patients with S. aureus bacteremia.  By limiting analysis of the host response to infections caused by a single pathogen at a single  site, we can control for the variability induced by pathogen-specific factors. In addition,  by studying all patients with S. aureus bacteremia, and not simply those patients with  sepsis, we can understand both the appropriate host response as well as the inappropriate host  response that characterizes the development of sepsis. With our bank of samples collected from S.  aureus bacteremia patients we will analyze both cellular mRNA transcripts and plasma  protein/cytokine levels, collected at different time points from each patient. We will  combine the results of these analyses with clinical data found in the EMR to provide a correlation  between the biology of the host response and its clinical manifestations. Our per-patient  data, then, will have unprecedented granularity which we can then use to apply machine learning  techniques to identify multi-faceted endotypes that predict outcomes (such as mortality). Once we  have built these endotype models, we will validate them using pilot data collected from newly  enrolled patients with either S. aureus or E. coli bacteremia. This approach will allow  us to identify factors common to the dysregulated host response across all infections, as well as  those that may be specific to the type of infection. Understanding both the  appropriate and the inappropriate host response to infection, and understanding which  aspects of the host response are pathogen-specific (and which are not) will allow development  of novel therapies for this devastating disease. The mortality rate due to severe sepsis exceeds 20%, yet in spite of 3 decades of research, we  still have a very limited understanding of the dysregulated host response that drives  this mortality. I will use my experience as a PhD-trained immunologist and ICU physician to  study the host response to the two most common causes of bacteremia in hospitalized patients, S.  aureus and E. coli. Understanding both appropriate and dysregulated host responses to infections as  manifested in both biological and clinical data will allow me to develop precision therapy to treat  this deadly disease.","Merging Temporal Changes in Clinical Informatics, Transcriptomics, and Cytokine Profiles to Understand the Host Response to Bacteremia",10022505,"['Acute', 'Address', 'Affect', 'Allergic', 'Award', 'Bacteremia', 'Bioinformatics', 'Biological', 'Biological Assay', 'Biology', 'Blood', 'Blood specimen', 'Clinical', 'Clinical Data', 'Clinical Informatics', 'Computerized Medical Record', 'Consent', 'Data', 'Data Set', 'Detection', 'Development', 'Diagnosis', 'Diagnostic', 'Disease', 'Doctor of Philosophy', 'Enrollment', 'Escherichia coli', 'Functional disorder', 'Funding', 'Gene Expression', 'Goals', 'Hour', 'Immune', 'Immune Targeting', 'Immune response', 'Immunologist', 'Infection', 'Inflammatory Response', 'Knowledge', 'Laboratories', 'Leukocytes', 'Life', 'Machine Learning', 'Measures', 'Mediating', 'Messenger RNA', 'Microbiology', 'Modeling', 'Nature', 'Organ', 'Organ failure', 'Patients', 'Pharmaceutical Preparations', 'Physicians', 'Plasma', 'Plasma Proteins', 'Precision therapeutics', 'Proteins', 'Research', 'Research Personnel', 'Sampling', 'Scientist', 'Sepsis', 'Site', 'Staphylococcus aureus', 'Subgroup', 'Supportive care', 'Techniques', 'Technology', 'Time', 'Tissues', 'Training', 'Transcript', 'Validation', 'Viral', 'Virulence Factors', 'Work', 'base', 'biobank', 'career', 'clinical care', 'clinically significant', 'comorbidity', 'cytokine', 'experience', 'improved', 'improved outcome', 'insight', 'machine learning method', 'mortality', 'novel', 'novel therapeutics', 'outcome prediction', 'pathogen', 'patient subsets', 'personalized therapeutic', 'prospective', 'response', 'septic', 'septic patients', 'transcriptome sequencing', 'transcriptomics']",NHLBI,KAISER FOUNDATION RESEARCH INSTITUTE,R03,2020,79000,111231681
