text,title,id,terms,administration,organization,mechanism,year,cost,funding
"Sepsis Early Prediction and Subphenotype Illumination Study (SEPSIS) PROJECT SUMMARY Sepsis, defined as life-threatening organ dysfunction in response to infection, is a devastating condition that contributes to up to half of hospital deaths and over $24 billion in healthcare costs in the U.S. annually. Over 750,000 patients develop sepsis in the U.S. each year, and survivors suffer long-term cognitive impairment and physical disability. Historically, sepsis research has focused on patients who are already critically ill. However, up to 50% of patients with sepsis receive their care on the inpatient wards, and only 10% of patients with sepsis are initially diagnosed in the intensive care unit (ICU). Because early intervention improves outcomes in sepsis, it is important to optimize the detection and treatment of sepsis outside the ICU.  The current sepsis paradigm has several problems. The first problem is that early identification of infection relies on clinician intuition, and caregivers often disagree regarding which patients are infected. This leads to delays in therapy and increased mortality in some patients and unnecessary therapies and adverse medication side effects in others. A second problem is that there is a lack of accurate tools to risk stratify infected patients outside the ICU after they are identified. Some patients with infection are treated outside the ICU and are later discharged home, while others develop life-threatening complications and die in the hospital. Accurate risk stratification of infected patients would bring additional critical care resources to the bedside of the high-risk patients that need them most. A third problem with the current sepsis paradigm is that it is often treated as a one-size-fits-all syndrome. However, patients with sepsis have a wide range of clinical presentations and outcomes due to the complex interactions between patient risk factors, the infectious organism, and the host immune response. These data suggest that the impact of timely and more aggressive interventions on outcomes may differ based on a patient's clinical phenotype. Identifying important subphenotypes of infected patients is critical to delivering more personalized care at the bedside.  The purpose of this project is to use data from the electronic health record and statistical modeling techniques to identify high-risk infected patients and important new subphenotypes of this syndrome. In Aim 1, we will develop a novel tool for identifying infected patients outside the ICU using modern machine learning techniques. In Aim 2, we will develop a tool for risk stratifying infected patients outside the ICU using machine learning methods. Finally, in Aim 3 we will use cluster analysis techniques to determine whether the benefit of early and more aggressive interventions varies based on clinical phenotype. Our project will provide clinicians with powerful new tools to identify high-risk infected patients and important new subphenotypes of this common and deadly syndrome. This work will help to deliver early, life-saving care to the bedside of septic patients and lead to future interventional trials aimed at decreasing preventable death. PROJECT NARRATIVE Sepsis, defined as life-threatening organ dysfunction in response to infection, is a devastating condition that contributes to up to half of hospital deaths and over $24 billion in costs in the US. The purpose of this project is to use data from the electronic health record and statistical modeling techniques to identify high-risk infected patients and determine which subgroups of patients benefit most from early and more aggressive interventions. This work will result in novel algorithms to identify high-risk infected patients that can be implemented in the electronic health record to decrease preventable death.",Sepsis Early Prediction and Subphenotype Illumination Study (SEPSIS),9472356,"['Address', 'Adverse effects', 'Advisory Committees', 'Algorithm Design', 'Algorithms', 'Anti-inflammatory', 'Area', 'Caregivers', 'Caring', 'Centers for Disease Control and Prevention (U.S.)', 'Cessation of life', 'Characteristics', 'Clinical', 'Cluster Analysis', 'Complex', 'Critical Care', 'Critical Illness', 'Data', 'Data Set', 'Detection', 'Deterioration', 'Diagnosis', 'Early Diagnosis', 'Early Intervention', 'Early identification', 'Early treatment', 'Electronic Health Record', 'Functional disorder', 'Future', 'Goals', 'Grant', 'Health Care Costs', 'Heart Arrest', 'Home environment', 'Hospitals', 'Immune response', 'Impaired cognition', 'Infection', 'Infectious Agent', 'Inpatients', 'Intensive Care Units', 'Intervention', 'Intervention Trial', 'Intuition', 'Knowledge', 'Label', 'Lead', 'Life', 'Lighting', 'Logistic Regressions', 'Machine Learning', 'Manuals', 'Medicine', 'Methods', 'Modeling', 'Modernization', 'Organ', 'Outcome', 'Patient risk', 'Patients', 'Pharmaceutical Preparations', 'Physically Handicapped', 'Probability', 'Publishing', 'Research', 'Resources', 'Risk', 'Risk Factors', 'Risk stratification', 'Savings', 'Sepsis', 'Severity of illness', 'Statistical Models', 'Subgroup', 'Survivors', 'Syndrome', 'Techniques', 'Time', 'Validation', 'Variant', 'Work', 'base', 'clinical phenotype', 'cohort', 'cost', 'electronic data', 'forest', 'high risk', 'improved', 'improved outcome', 'learning strategy', 'mortality', 'novel', 'patient subsets', 'personalized care', 'preventable death', 'response', 'septic patients', 'tool', 'ward']",NIGMS,UNIVERSITY OF CHICAGO,R01,2018,385792,246330700
"Sepsis Early Prediction and Subphenotype Illumination Study (SEPSIS) PROJECT SUMMARY Sepsis, defined as life-threatening organ dysfunction in response to infection, is a devastating condition that contributes to up to half of hospital deaths and over $24 billion in healthcare costs in the U.S. annually. Over 750,000 patients develop sepsis in the U.S. each year, and survivors suffer long-term cognitive impairment and physical disability. Historically, sepsis research has focused on patients who are already critically ill. However, up to 50% of patients with sepsis receive their care on the inpatient wards, and only 10% of patients with sepsis are initially diagnosed in the intensive care unit (ICU). Because early intervention improves outcomes in sepsis, it is important to optimize the detection and treatment of sepsis outside the ICU.  The current sepsis paradigm has several problems. The first problem is that early identification of infection relies on clinician intuition, and caregivers often disagree regarding which patients are infected. This leads to delays in therapy and increased mortality in some patients and unnecessary therapies and adverse medication side effects in others. A second problem is that there is a lack of accurate tools to risk stratify infected patients outside the ICU after they are identified. Some patients with infection are treated outside the ICU and are later discharged home, while others develop life-threatening complications and die in the hospital. Accurate risk stratification of infected patients would bring additional critical care resources to the bedside of the high-risk patients that need them most. A third problem with the current sepsis paradigm is that it is often treated as a one-size-fits-all syndrome. However, patients with sepsis have a wide range of clinical presentations and outcomes due to the complex interactions between patient risk factors, the infectious organism, and the host immune response. These data suggest that the impact of timely and more aggressive interventions on outcomes may differ based on a patient's clinical phenotype. Identifying important subphenotypes of infected patients is critical to delivering more personalized care at the bedside.  The purpose of this project is to use data from the electronic health record and statistical modeling techniques to identify high-risk infected patients and important new subphenotypes of this syndrome. In Aim 1, we will develop a novel tool for identifying infected patients outside the ICU using modern machine learning techniques. In Aim 2, we will develop a tool for risk stratifying infected patients outside the ICU using machine learning methods. Finally, in Aim 3 we will use cluster analysis techniques to determine whether the benefit of early and more aggressive interventions varies based on clinical phenotype. Our project will provide clinicians with powerful new tools to identify high-risk infected patients and important new subphenotypes of this common and deadly syndrome. This work will help to deliver early, life-saving care to the bedside of septic patients and lead to future interventional trials aimed at decreasing preventable death. PROJECT NARRATIVE Sepsis, defined as life-threatening organ dysfunction in response to infection, is a devastating condition that contributes to up to half of hospital deaths and over $24 billion in costs in the US. The purpose of this project is to use data from the electronic health record and statistical modeling techniques to identify high-risk infected patients and determine which subgroups of patients benefit most from early and more aggressive interventions. This work will result in novel algorithms to identify high-risk infected patients that can be implemented in the electronic health record to decrease preventable death.",Sepsis Early Prediction and Subphenotype Illumination Study (SEPSIS),9291082,"['Address', 'Adverse effects', 'Advisory Committees', 'Algorithm Design', 'Algorithms', 'Anti-Inflammatory Agents', 'Anti-inflammatory', 'Area', 'Caregivers', 'Caring', 'Centers for Disease Control and Prevention (U.S.)', 'Cessation of life', 'Characteristics', 'Clinical', 'Cluster Analysis', 'Complex', 'Critical Care', 'Critical Illness', 'Data', 'Data Set', 'Detection', 'Deterioration', 'Diagnosis', 'Early Diagnosis', 'Early Intervention', 'Early identification', 'Early treatment', 'Electronic Health Record', 'Functional disorder', 'Future', 'Goals', 'Grant', 'Health Care Costs', 'Heart Arrest', 'Home environment', 'Hospitals', 'Immune response', 'Impaired cognition', 'Infection', 'Infectious Agent', 'Inpatients', 'Intensive Care Units', 'Intervention', 'Intervention Trial', 'Intuition', 'Knowledge', 'Label', 'Lead', 'Life', 'Lighting', 'Logistic Regressions', 'Machine Learning', 'Manuals', 'Medicine', 'Methods', 'Modeling', 'Modernization', 'Organ', 'Outcome', 'Patient risk', 'Patients', 'Pharmaceutical Preparations', 'Physically Handicapped', 'Probability', 'Publishing', 'Research', 'Resources', 'Risk', 'Risk Factors', 'Risk stratification', 'Savings', 'Sepsis', 'Severity of illness', 'Statistical Models', 'Subgroup', 'Survivors', 'Syndrome', 'Techniques', 'Time', 'Validation', 'Variant', 'Work', 'base', 'clinical phenotype', 'cohort', 'cost', 'electronic data', 'forest', 'high risk', 'improved', 'improved outcome', 'learning strategy', 'mortality', 'novel', 'personalized care', 'response', 'septic', 'tool', 'ward']",NIGMS,UNIVERSITY OF CHICAGO,R01,2017,417445,246330700
"Digital High Resolution Melt and Machine Learning for Rapid and Specific Diagnosis in Neonatal Sepsis Project Summary Blood culture sensitivity in neonates is poor but is the “Gold Standard” for the diagnosis of sepsis. Universal genotyping of pathogen genomic sequences using High Resolution Melt (U-HRM) provides a simple, low cost, rapid, and modern alternative to blood culture testing. By measuring the fluorescence of an intercalating dye as PCR-amplified pathogen DNA fragments are heated and disassociate, sequence defined melt curves are generated with single-nucleotide resolution in a closed-tube reaction. We have advanced U- HRM into a digital PCR format (U-dHRM), where DNA sequences that are present in mixtures are individually amplified and identified as is needed for polymicrobial infections. We have also established unique signature melt curves for 37 bacterial species that commonly infect older children and adults and automatically identify them using machine learning technology. With the goal of creating an accurate and valid test for the timely diagnosis of neonatal sepsis, we will advance this technology to identify unique fungal, viral, and bacterial HRM signatures along with antibiotic resistance genes with an accuracy of 99-100% on minimal blood volume (1mL). Our aims are: Aim 1. Optimize and assess the U-dHRM platform for neonatal bacteremia diagnosis by expand our bacterial database (13 additional bacteria) to detect causes of >99% of neonatal bacterial infections, expand our antibiotic resistance gene database to include five clinically actionable genes, and assessing the performance of the system for bacteremia diagnosis in mock and clinical whole blood samples; Aim 2. Advance the U-dHRM platform for simultaneous detection of fungal and viral pathogens by upgrading our optical system to enable expansion to fungal and viral detection in a high-throughput format, multiplexing the assay to expand to viral and fungal pathogens causing >99% non-bacterial infections, and conducting analytical validation of the multiplexed platform using mock whole blood samples; and Aim 3. Advance the machine learning algorithm for detection of emerging pathogens by developing and integrating an anomaly detection algorithm for reporting emerging pathogens that are not included in our database and validating the algorithm using data generated in Aims 1 and 2. Thus, this proposal directly addresses the funding call by applying a multidisciplinary approach to overcome the biomedical challenge of rapidly diagnosis sepsis, a hidden public health disaster. Project Narrative Digital High Resolution Melting (dHRM) of DNA combined with machine learning creates unique “fingerprints"" for microbes and antibiotic resistance, allowing for faster and more precise detection and treatment of pathogen(s) causing sepsis. This project will advance and test the clinical performance of dHRM technology in the diagnosis of neonatal sepsis. Our goal is to rapidly and accurately identify pathogens and their resistance markers to facilitate accurate antimicrobial therapy, reducing antibiotic overuse in non-infected infants.",Digital High Resolution Melt and Machine Learning for Rapid and Specific Diagnosis in Neonatal Sepsis,9693150,"['Address', 'Adult', 'Algorithms', 'Antibiotic Resistance', 'Antibiotics', 'Bacteremia', 'Bacteria', 'Bacterial Antibiotic Resistance', 'Bacterial Infections', 'Biological Assay', 'Birth Weight', 'Blood', 'Blood Volume', 'Blood specimen', 'Child', 'Clinical', 'DNA', 'DNA Sequence', 'Data', 'Databases', 'Detection', 'Diagnosis', 'Diagnostic', 'Disasters', 'Dyes', 'Emerging Technologies', 'Exposure to', 'Fingerprint', 'Fluorescence', 'Funding', 'Genes', 'Genome', 'Genotype', 'Goals', 'Gold', 'Hour', 'Immune response', 'Individual', 'Infection', 'Machine Learning', 'Measures', 'Microbe', 'Modernization', 'Neonatal', 'Nucleotides', 'Optics', 'Organism', 'Patients', 'Performance', 'Predisposition', 'Public Health', 'RNA', 'Reaction', 'Reporting', 'Research', 'Resistance', 'Resolution', 'Sampling', 'Sepsis', 'Symptoms', 'System', 'Technology', 'Testing', 'Therapeutic', 'Time', 'Training', 'Tube', 'United States', 'Validation', 'Variant', 'Very Low Birth Weight Infant', 'Viral', 'Whole Blood', 'Woman', 'antimicrobial', 'base', 'circulating DNA', 'clinically actionable', 'clinically relevant', 'cost', 'diagnosis standard', 'digital', 'early onset', 'interdisciplinary approach', 'intrapartum', 'machine learning algorithm', 'melting', 'microbial', 'neonatal sepsis', 'neonate', 'overtreatment', 'pathogen', 'pathogen genome', 'pathogen genomics', 'pathogenic fungus', 'pathogenic virus', 'point of care', 'premature', 'rapid diagnosis', 'resistance gene', 'sample collection', 'septic', 'therapy resistant', 'viral detection']",NIAID,"UNIVERSITY OF CALIFORNIA, SAN DIEGO",R01,2019,423601,524978793
"Digital High Resolution Melt and Machine Learning for Rapid and Specific Diagnosis in Neonatal Sepsis Project Summary Blood culture sensitivity in neonates is poor but is the “Gold Standard” for the diagnosis of sepsis. Universal genotyping of pathogen genomic sequences using High Resolution Melt (U-HRM) provides a simple, low cost, rapid, and modern alternative to blood culture testing. By measuring the fluorescence of an intercalating dye as PCR-amplified pathogen DNA fragments are heated and disassociate, sequence defined melt curves are generated with single-nucleotide resolution in a closed-tube reaction. We have advanced U- HRM into a digital PCR format (U-dHRM), where DNA sequences that are present in mixtures are individually amplified and identified as is needed for polymicrobial infections. We have also established unique signature melt curves for 37 bacterial species that commonly infect older children and adults and automatically identify them using machine learning technology. With the goal of creating an accurate and valid test for the timely diagnosis of neonatal sepsis, we will advance this technology to identify unique fungal, viral, and bacterial HRM signatures along with antibiotic resistance genes with an accuracy of 99-100% on minimal blood volume (1mL). Our aims are: Aim 1. Optimize and assess the U-dHRM platform for neonatal bacteremia diagnosis by expand our bacterial database (13 additional bacteria) to detect causes of >99% of neonatal bacterial infections, expand our antibiotic resistance gene database to include five clinically actionable genes, and assessing the performance of the system for bacteremia diagnosis in mock and clinical whole blood samples; Aim 2. Advance the U-dHRM platform for simultaneous detection of fungal and viral pathogens by upgrading our optical system to enable expansion to fungal and viral detection in a high-throughput format, multiplexing the assay to expand to viral and fungal pathogens causing >99% non-bacterial infections, and conducting analytical validation of the multiplexed platform using mock whole blood samples; and Aim 3. Advance the machine learning algorithm for detection of emerging pathogens by developing and integrating an anomaly detection algorithm for reporting emerging pathogens that are not included in our database and validating the algorithm using data generated in Aims 1 and 2. Thus, this proposal directly addresses the funding call by applying a multidisciplinary approach to overcome the biomedical challenge of rapidly diagnosis sepsis, a hidden public health disaster. Project Narrative Digital High Resolution Melting (dHRM) of DNA combined with machine learning creates unique “fingerprints"" for microbes and antibiotic resistance, allowing for faster and more precise detection and treatment of pathogen(s) causing sepsis. This project will advance and test the clinical performance of dHRM technology in the diagnosis of neonatal sepsis. Our goal is to rapidly and accurately identify pathogens and their resistance markers to facilitate accurate antimicrobial therapy, reducing antibiotic overuse in non-infected infants.",Digital High Resolution Melt and Machine Learning for Rapid and Specific Diagnosis in Neonatal Sepsis,9596299,"['Address', 'Adult', 'Algorithms', 'Antibiotic Resistance', 'Antibiotics', 'Bacteremia', 'Bacteria', 'Bacterial Antibiotic Resistance', 'Bacterial Infections', 'Biological Assay', 'Birth Weight', 'Blood', 'Blood Volume', 'Blood specimen', 'Child', 'Clinical', 'DNA', 'DNA Sequence', 'Data', 'Databases', 'Detection', 'Diagnosis', 'Diagnostic', 'Disasters', 'Dyes', 'Emerging Technologies', 'Exposure to', 'Fingerprint', 'Fluorescence', 'Funding', 'Genes', 'Genome', 'Genomics', 'Genotype', 'Goals', 'Gold', 'Hour', 'Immune response', 'Individual', 'Infant', 'Infection', 'Machine Learning', 'Measures', 'Microbe', 'Modernization', 'Neonatal', 'Nucleotides', 'Optics', 'Organism', 'Patients', 'Performance', 'Predisposition', 'Public Health', 'RNA', 'Reaction', 'Reporting', 'Research', 'Resistance', 'Resolution', 'Sampling', 'Sepsis', 'Symptoms', 'System', 'Technology', 'Testing', 'Therapeutic', 'Time', 'Training', 'Tube', 'United States', 'Validation', 'Variant', 'Very Low Birth Weight Infant', 'Viral', 'Whole Blood', 'Woman', 'antimicrobial', 'base', 'circulating DNA', 'clinically actionable', 'clinically relevant', 'cost', 'diagnosis standard', 'digital', 'early onset', 'interdisciplinary approach', 'intrapartum', 'melting', 'microbial', 'neonatal sepsis', 'neonate', 'overtreatment', 'pathogen', 'pathogen genome', 'point of care', 'premature', 'rapid diagnosis', 'resistance gene', 'sample collection', 'septic', 'therapy resistant', 'viral detection']",NIAID,"UNIVERSITY OF CALIFORNIA, SAN DIEGO",R01,2018,437420,524978793
