text,title,id,project_number,terms,administration,organization,mechanism,year,funding,score
"Adiposity-obesity-related subgroups discovery and metabolomics analysis for chronic kidney disease Project Summary Chronic kidney disease (CKD) is prevalent in the U.S. population and is a major cause of end-stage renal disease (ESRD), cardiovascular disease morbidity, and mortality. Current gaps exist in characterizing the heterogeneity of CKD population. Obesity further increases the risks of adverse outcomes among people with impaired kidney function. However, the mechanism between obesity and CKD is not fully understood, and numerous studies have observed “obesity paradox” or survival advantage being associated with higher body fat among advanced CKD patients. In this context, the Chronic Renal Insufficiency Cohort (CRIC) Study provides an ideal opportunity to study the mechanism of CKD with its rich clinical information and population characteristics, as well as its availability of non-targeted high-dimensional metabolomics data. To better understand the “adiposity-obesity-related” (AOR) mechanisms of CKD and to discover novel biomarkers, we propose to identify distinct subgroups based on AOR attributes and to perform metabolomics analysis on the identified subgroups and CKD outcomes. The overall goal of this research and the training plan is to execute three studies as the subjects of a doctoral dissertation in metabolomics analysis and CKD epidemiology. First, in Aim 1, we will identify latent AOR subgroups in the CRIC CKD population using the data-driven approach of consensus clustering. We will also evaluate the utility and the independent risk discrimination performance of the AOR subgroups with key CKD outcomes (CKD progression, CVD, and death), using Cox regression model with adjustment for known CKD risk factors. Next, in Aim 2, we will perform metabolomics analysis and identify metabolites and metabolomic patterns that are associated with the different AOR subgroups. In response to the statistical challenges in analyzing the high-dimensional metabolomics data, we will implement both the machine learning random-forest algorithm and the conventional univariate and multivariate regression analysis. Finally, in Aim 3, we will investigate the relationship between CKD outcomes and the metabolites and metabolomic patterns identified in Aim 2, using Cox regression model, extended by pathway analysis and mediation analysis. Mining high-dimensional metabolomics data with AOR phenotypes in the CRIC Study holds promise to expand our knowledge of pathophysiology and molecular characterization of CKD. Future studies can be built upon these findings to improve more effective and personalized CKD management in the setting of the obesity epidemic. A rigorous curriculum including didactic and experiential learning in biomedical data mining, statistics, and advanced epidemiology will round out the applicant's training, preparing her to be an independent and collaborative investigator and a kidney disease epidemiologist at the completion of his PhD. Project Narrative Chronic kidney disease (CKD) and its risk factors of obesity, diabetes, and hypertension are prevalent in the United States. To better understand the mechanism between adiposity-obesity-related CKD mechanism, the proposed research will implement machine learning algorithms, and identify distinct patient subgroups and discover novel CKD biomarkers, using the clinical and high-dimensional metabolomics data from a diverse cohort of CKD patients. The findings of our study hold promise to expand our knowledge of pathophysiology and molecular characterization of CKD, and facilitate personalized disease management.",Adiposity-obesity-related subgroups discovery and metabolomics analysis for chronic kidney disease,9834239,F31DK122683,"['Active Learning', 'Adult', 'Affect', 'Albuminuria', 'Algorithms', 'Biological Markers', 'Blood Pressure', 'Body fat', 'Cardiovascular Diseases', 'Cessation of life', 'Characteristics', 'Chronic Kidney Failure', 'Chronic Kidney Insufficiency', 'Clinical', 'Cohort Studies', 'Consensus', 'Data', 'Data Analyses', 'Diabetes Mellitus', 'Discrimination', 'Disease', 'Disease Management', 'Disease Outcome', 'Disease Progression', 'Doctor of Philosophy', 'Educational Curriculum', 'End stage renal failure', 'Epidemiologist', 'Epidemiology', 'Fatty acid glycerol esters', 'Functional disorder', 'Future', 'Glomerular Filtration Rate', 'Glucose', 'Glycosylated hemoglobin A', 'Goals', 'Height', 'Heterogeneity', 'Hypertension', 'Impairment', 'Insulin Resistance', 'Kidney', 'Kidney Diseases', 'Knowledge', 'Kynurenine', 'Machine Learning', 'Measurement', 'Mediation', 'Mediator of activation protein', 'Metabolic', 'Methods', 'Mining', 'Modeling', 'Molecular', 'Morbidity - disease rate', 'Multivariate Analysis', 'Obesity', 'Obesity Epidemic', 'Outcome Assessment', 'PTH gene', 'Pathway Analysis', 'Pathway interactions', 'Patient risk', 'Patients', 'Pattern', 'Performance', 'Pharmaceutical Preparations', 'Phenotype', 'Population', 'Population Characteristics', 'Regression Analysis', 'Renal function', 'Research', 'Research Personnel', 'Research Training', 'Risk', 'Risk Factors', 'Specimen', 'Subgroup', 'Techniques', 'Training', 'Troponin T', 'Tryptophan', 'United States', 'Weight', 'adverse outcome', 'base', 'cohort', 'data mining', 'fibroblast growth factor 23', 'high dimensionality', 'improved', 'machine learning algorithm', 'metabolomics', 'mortality', 'multidimensional data', 'novel', 'novel marker', 'patient subsets', 'personalized management', 'population based', 'preservation', 'random forest', 'response', 'statistics', 'targeted biomarker', 'tool']",NIDDK,UNIVERSITY OF PENNSYLVANIA,F31,2019,45016,0.044735570006561455
"Anatomy Directly from Imagery: General-purpose, Scalable, and Open-source Machine Learning Approaches Project Summary The form (or shape) and function relationship of anatomical structures is a central theme in biology where abnor- mal shape changes are closely tied to pathological functions. Morphometrics has been an indispensable quan- titative tool in medical and biological sciences to study anatomical forms for more than 100 years. Recently, the increased availability of high-resolution in-vivo images of anatomy has led to the development of a new generation of morphometric approaches, called statistical shape modeling (SSM), that take advantage of modern computa- tional techniques to model anatomical shapes and their variability within populations with unprecedented detail. SSM stands to revolutionize morphometric analysis, but its widespread adoption is hindered by a number of sig- niﬁcant challenges, including the complexity of the approaches and their increased computational requirements, relative to traditional morphometrics. Arguably, however, the most important roadblock to more widespread adop- tion is the lack of user-friendly and scalable software tools for a variety of anatomical surfaces that can be readily incorporated into biomedical research labs. The goal of this proposal is thus to address these challenges in the context of a ﬂexible and general SSM approach termed particle-based shape modeling (PSM), which automat- ically constructs optimal statistical landmark-based shape models of ensembles of anatomical shapes without relying on any speciﬁc surface parameterization. The proposed research will provide an automated, general- purpose, and scalable computational solution for constructing shape models of general anatomy. In Aim 1, we will build computational and machine learning algorithms to model anatomies with complex surface topologies (e.g., surface openings and shared boundaries) and highly variable anatomical populations. In Aim 2, we will introduce an end-to-end machine learning approach to extract statistical shape representation directly from im- ages, requiring no parameter tuning, image pre-processing, or user assistance. In Aim 3, we will provide intuitive graphical user interfaces and visualization tools to incorporate user-deﬁned modeling preferences and promote the visual interpretation of shape models. We will also make use of recent advances in cloud computing to enable researchers with limited computational resources and/or large cohorts to build and execute custom SSM work- ﬂows using remote scalable computational resources. Algorithmic developments will be thoroughly evaluated and validated using existing, fully funded, large-scale, and constantly growing databases of CT and MRI images lo- cated on-site. Furthermore, we will develop and disseminate standard workﬂows and domain-speciﬁc use cases for complex anatomies to promote reproducibility. Efforts to develop the proposed technology are aligned with the mission of the National Institute of General Medical Sciences (NIGMS), and its third strategic goal: to bridge biology and quantitative science for better global health through supporting the development of and access to computational research tools for biomedical research. Our long-term goal is to increase the clinical utility and widespread adoption of SSM, and the proposed research will establish the groundwork for achieving this goal. Project Narrative This project will develop general-purpose, scalable, and open-source statistical shape modeling (SSM) tools, which will present unique capabilities for automated anatomy modeling with less user input. The proposed tech- nology will introduce a number of signiﬁcant improvements to current SSM approaches and tools, including the support for challenging modeling problems, inferring shapes directly from images (and hence bypassing the seg- mentation step), parallel optimizations for speed, and new user interfaces that will be much easier and scalable than the current tools. The proposed technology will constitute an indispensable resource for the biomedical and clinical communities that will enable new avenues for biomedical research and clinical investigations, provide new ways to answer biologically related questions, allow new types of questions to be asked, and open the door for the integration of SSM with clinical care.","Anatomy Directly from Imagery: General-purpose, Scalable, and Open-source Machine Learning Approaches",9803774,R01AR076120,"['Address', 'Adoption', 'Age', 'Algorithms', 'Anatomic Models', 'Anatomic Surface', 'Anatomy', 'Area', 'Biological', 'Biological Process', 'Biological Sciences', 'Biological Testing', 'Biology', 'Biomedical Research', 'Brain', 'Bypass', 'Cardiology', 'Cessation of life', 'Clinical', 'Clinical Data', 'Cloud Computing', 'Collection', 'Communities', 'Complex', 'Complex Analysis', 'Computational Technique', 'Computer Simulation', 'Computer software', 'Computers', 'Custom', 'Data', 'Data Set', 'Databases', 'Development', 'Disease', 'Felis catus', 'Funding', 'Generations', 'Geometry', 'Goals', 'Human', 'Ice', 'Image', 'Imagery', 'Injury', 'Intuition', 'Laboratory Research', 'Learning', 'Machine Learning', 'Magnetic Resonance Imaging', 'Mathematical Computing', 'Measures', 'Medical', 'Medicine', 'Mission', 'Modeling', 'Modernization', 'Modification', 'Morphogenesis', 'National Institute of General Medical Sciences', 'Occupations', 'Online Systems', 'Organism', 'Orthopedics', 'Pathologic', 'Population', 'Reproducibility', 'Research', 'Research Personnel', 'Resolution', 'Science', 'Scientist', 'Shapes', 'Site', 'Software Engineering', 'Software Tools', 'Specialist', 'Speed', 'Statistical Data Interpretation', 'Structure', 'Supervision', 'Surface', 'Techniques', 'Technology', 'Time', 'Training', 'Variant', 'Visual', 'Visualization software', 'Work', 'base', 'biomedical resource', 'clinical care', 'clinical investigation', 'clinically relevant', 'cohort', 'computerized tools', 'computing resources', 'deep learning', 'experience', 'flexibility', 'global health', 'graphical user interface', 'image archival system', 'image processing', 'imaging Segmentation', 'in vivo imaging', 'innovation', 'machine learning algorithm', 'model development', 'multidisciplinary', 'open source', 'particle', 'preference', 'software development', 'tool', 'usability', 'user-friendly']",NIAMS,UNIVERSITY OF UTAH,R01,2019,631809,0.061075237558442276
"SenseWhy: Overeating in Obesity Through the Lens of Passive Sensing PROJECT SUMMARY/ABSTRACT Medical professionals have recently put to rest the idea that there is an ideal weight loss diet for everyone. One cause for obesity is overeating, but we do not know what patterns and behaviors contribute to this problematic habit. Defining problematic eating behaviors that lead to energy imbalance is essential for treating obesity. Studies typically focus on a single putative causal mechanism of overeating such as stress or craving, not addressing the multiple features that co-occur with overeating. Hence, the factors that predict overeating episodes remain unknown, as do which of them contribute to an individual's consistency and variability of overeating. Given recent advancements in passive sensing, we now have the potential to detect problematic eating using seamlessly captured physiological features such as number of feeding gestures and swallows, and heart rate variability. Collecting detectable and predictable features that identify overeating will hone in on the patterns that interventionists may optimally target to help populations with obesity understand their eating habits and ultimately improve their ability to self-regulate their eating behaviors. Location-scale models will map the factors that most contribute to habit formation within subjects, providing interventionists with essential targets to guide behavior. The first aim is to collect sensor-based and ecological momentary assessment data (to assess factors not yet detectable through sensing) from adults with obesity and apply machine learning algorithms to identify a subset of features that detect overeating, as validated against ground truth of videotaped eating episodes and 24 hour dietary recall. Participants will wear a passive sensing sensor suite and respond to random and event-triggered prompts regarding each eating episode. Then, machine learning will determine the optimal feature subset that detect overeating episodes using Gradient Boosting Machines. In the second aim, hierarchical clustering techniques will cluster overeating episodes into theoretically meaningful and clinically known problematic behaviors related to overeating. The final aim is to build statistical models that explain the effect of detectable and clinically-known problematic features on new habit formation. These models will lay a foundation for optimization studies to discover evidence-based decision rules that can guide timely interventions to treat obesity by preventing overeating, and maintaining healthy eating behaviors. PROJECT NARRATIVE Obesity affects more than a third of American adults. Weight loss regimens rely on self-monitoring, but many people struggle to exercise this skill due to difficulty of execution and small perceived short-term benefit. Wearable passive sensors allow us to learn an individual's problematic eating behaviors more easily. Analyzing sensor data then enables us to identify the essential factors that describe and even predict overeating, and ultimately provide personalized care that supports maintenance of healthy eating behaviors.",SenseWhy: Overeating in Obesity Through the Lens of Passive Sensing,9613247,K25DK113242,"['Adult', 'Affect', 'Alcohol consumption', 'Algorithms', 'American', 'Appetitive Behavior', 'Award', 'Behavior', 'Behavioral Medicine', 'Behavioral Sciences', 'Body Weight decreased', 'Calories', 'Chronic Disease', 'Clinical', 'Computers', 'Cues', 'Custom', 'Data', 'Data Analytics', 'Deglutition', 'Detection', 'Diet', 'Diet Habits', 'Dietitian', 'Eating', 'Eating Behavior', 'Ecological momentary assessment', 'Energy Intake', 'Etiology', 'Event', 'Exercise', 'Family', 'Feeding behaviors', 'Food Access', 'Fostering', 'Foundations', 'Friends', 'Gestures', 'Goals', 'Habits', 'Health Care Costs', 'Healthy Eating', 'Heart Rate', 'Hour', 'Hyperphagia', 'Impulsivity', 'Individual', 'Intake', 'Intervention', 'Knowledge', 'Lead', 'Learning', 'Life', 'Location', 'Machine Learning', 'Maintenance', 'Maps', 'Mastication', 'Measures', 'Medical', 'Methods', 'Modeling', 'Monitor', 'Moods', 'Neck', 'Obesity', 'Participant', 'Patient Recruitments', 'Patient Self-Report', 'Pattern', 'Phenotype', 'Physiological', 'Population', 'Predictive Factor', 'Public Health', 'Records', 'Regimen', 'Research Personnel', 'Rest', 'Role', 'Running', 'Scientist', 'Sensitivity and Specificity', 'Smoking', 'Statistical Methods', 'Statistical Models', 'Stress', 'Techniques', 'Technology', 'Time', 'Training', 'Videotape', 'Wrist', 'adaptive intervention', 'adult obesity', 'algorithmic methodologies', 'base', 'computer science', 'craving', 'emotional eating', 'evidence base', 'experience', 'feeding', 'heart rate variability', 'hedonic', 'improved', 'learning strategy', 'lens', 'machine learning algorithm', 'novel', 'obesity treatment', 'personalized care', 'predictive modeling', 'prevent', 'psychologic', 'response', 'sensor', 'skills', 'social', 'substance abuse treatment', 'theories', 'wearable device', 'wearable technology']",NIDDK,NORTHWESTERN UNIVERSITY AT CHICAGO,K25,2019,165108,0.06513914119663038
"A Machine Learning Approach for Predicting Early Childhood Obesity Among WIC Participating Families PROJECT SUMMARY Early childhood obesity continues to be a clinical and public health challenge in the United States; almost a third of children ages 2-to-5 years old are either overweight or obese. Children who are overweight during early childhood are at least 5 times more likely than normal weight children to be overweight/obese as adults. Non- Hispanic blacks (NHB) have double and Hispanics have triple the rates of obesity compared to non-Hispanic whites (NHW) and Asians (10.4%,15.6%, 5.2%, and 5.0%, respectively). Once established, obesity and its comorbid medical conditions are difficult to treat and usually persist throughout adulthood. Thus, preventing its development as early as possible in life is critical to reduce the health care costs associated with obesity- related chronic diseases such as type 2 diabetes and cardiovascular disease. Current evidence suggests that pregnancy, infancy and early childhood may be critical time periods in the development of overweight/obesity throughout the lifespan but many knowledge gaps remain. These gaps include understanding factors that contribute to high risk for excessive weight gain during gestation, infancy and early childhood which may also partially explain differential response to intervention strategies. Moreover, risk for the development of overweight and obesity during these critical developmental periods appear to be increased in children from racial and ethnic minority and low socioeconomic status backgrounds, but there is a paucity of studies in the literature that include these groups. To better understand how early life factors impact the onset of childhood obesity by age 5, this study will utilize data from the Special Supplemental Nutrition Program for Women, Infants, and Children (WIC) program in Miami Dade County (MDC), Florida. Specifically, we will examine the relationship between pregnancy (maternal weight, gestational diabetes, smoking, alcohol/substance use) and early life (initiation, exclusive and duration of breastfeeding, time of introduction to solid food) risk/ protective factors and child body mass index percentile and z score at age 5. Covariates include mother's race/ethnicity, education level and household income. Statistical models will be evaluated using machine learning-cross validation techniques. This approach has not been previously applied to the obesity science to examine pregnancy and early life obesity risk/protective factors. The analyses take advantage of a robust secondary data set that is arguably one of the most diverse in the country; the WIC program currently services almost half of the nation's mothers babies and young children (as does the local program for MDC) who are from predominantly low income and ethnically diverse backgrounds. The findings from this study will inform the development of obesity prevention interventions targeting pregnancy, prenatal and early childhood developmental periods. Project Narrative The proposed research will increase the understanding of pregnancy and early life obesity risk factors and how these factors vary by ethnic group in low income families, addressing a critical gap in the literature. This study will utilize machine learning-cross validation techniques to ensure the external reliability and validity of our statistical models. Study results generated here will inform the development and delivery of pregnancy and early life obesity prevention interventions and actionable recommendations for pediatric and family clinical care delivered to diverse families.",A Machine Learning Approach for Predicting Early Childhood Obesity Among WIC Participating Families,9870787,F31DK116533,"['5 year old', 'Address', 'Adolescent obesity', 'Adult', 'Affect', 'Age', 'Age-Months', 'Alcohol or Other Drugs use', 'Alcohols', 'Asians', 'Behavior', 'Behavioral', 'Belief', 'Body mass index', 'Breast Feeding', 'Cardiovascular Diseases', 'Child', 'Childhood', 'Chronic', 'Chronic Disease', 'Clinical', 'Comorbidity', 'Country', 'County', 'Data', 'Data Set', 'Databases', 'Development', 'Educational Background', 'Ensure', 'Environment', 'Ethnic Origin', 'Ethnic group', 'Exclusive Breastfeeding', 'Family', 'Fatty acid glycerol esters', 'Florida', 'Food', 'Food Supplements', 'Genetic', 'Gestational Diabetes', 'Health Care Costs', 'Health behavior', 'High Prevalence', 'Hispanics', 'Household', 'Income', 'Infant', 'Intake', 'Intervention', 'Knowledge', 'Life', 'Life Cycle Stages', 'Literature', 'Longevity', 'Low income', 'Machine Learning', 'Measures', 'Medical', 'Metabolic', 'Methodology', 'Methods', 'Minority Groups', 'Modeling', 'Morbidity - disease rate', 'Mothers', 'Non-Insulin-Dependent Diabetes Mellitus', 'Not Hispanic or Latino', 'Nursery Schools', 'Obesity', 'Overweight', 'Performance', 'Perinatal', 'Population', 'Pregnancy', 'Prevalence', 'Preventive Intervention', 'Public Health', 'Race', 'Recommendation', 'Reporting', 'Research', 'Risk', 'Risk Factors', 'Sample Size', 'Science', 'Services', 'Smoke', 'Smoking', 'Socioeconomic Status', 'Solid', 'Special Supplemental Nutrition Program for Women, Infants, and Children', 'Specific qualifier value', 'Statistical Models', 'System', 'Techniques', 'Time', 'United States', 'Validation', 'Validity and Reliability', 'Weight', 'Weight Gain', 'Woman', 'adult obesity', 'clinical care', 'critical developmental period', 'design', 'early childhood', 'early onset', 'ethnic disparity', 'ethnic diversity', 'ethnic minority population', 'federal poverty level', 'feeding', 'healthy weight', 'high risk', 'infancy', 'low socioeconomic status', 'lower income families', 'maternal cigarette smoking', 'maternal weight', 'minority children', 'mortality', 'obesity development', 'obesity in children', 'obesity prevention', 'obesity risk', 'predictive modeling', 'prenatal', 'prevent', 'programs', 'protective factors', 'racial and ethnic disparities', 'racial minority', 'relating to nervous system', 'response', 'sex', 'statistics', 'systematic review']",NIDDK,UNIVERSITY OF MIAMI SCHOOL OF MEDICINE,F31,2019,38616,0.032179135799104315
