text,title,id,project_number,terms,administration,organization,mechanism,year,funding,score
"Regulators of Cancer Immunotherapy Response PROJECT SUMMARY Despite enormous success in treating several types of cancer, immune checkpoint blocker (ICB) therapy still only shows efficacies in a subset of patients. Identifying novel regulators of immunotherapy response as well as improving the response rate of cancer immunotherapies remain open questions. Recently, we used CRISPR screens in mouse models to investigate T-cell infiltration, proliferation, and killing efficacy, and identified PBAF of the SWI/SNF chromatin remodeling complex as one novel regulator of T-cell mediated cytotoxicity. We also developed a computational model, TIDE, to identify gene signatures of CD8 T-cell dysfunction in immune hot tumors and T-cell exclusion in immune cold tumors. The resulting signatures, computed from tumor profiles in non-immunotherapy setting, show promising results in predicting melanoma and lung cancer patient response to immune checkpoint blockade based on pre-treatment tumor expression profiles. This proposed project aims to improve the TIDE biomarkers, identify novel regulators, and elucidate their mechanisms underlying ICB response. In Aim 1, we will develop machine learning approaches on large collection of clinical tumor transcriptome profiles from non-ICB settings to refine the TIDE predictive biomarker of ICB response, and develop a web server to comprehensively evaluate different ICB response biomarkers in all the available ICB cohorts. In Aim 2, we will conduct in vivo CRISPR screens in mouse syngeneic tumor models to identify cancer-cell intrinsic regulators of ICB response, which can serve as novel targets to improve ICB response. In Aim 3, we will elucidate the mechanism underlying two novel regulators of ICB response and characterize their effects on the tumor immune microenvironment using single-cell RNA-seq, single-cell ATAC- seq, and computational modeling. Our investigative team has combined expertise in computational methodology immunotherapy. immunology and big data mining, functional genomics profiling Our proposed studies, if successfully executed, and translational benefits to cancer immunotherapy. and screening, cancer immunology and could provide new insights into cancer PROJECT NARRATIVE Cancer immunotherapies have emerged over the last decade as highly promising approaches for cancer treatment, although only subsets of patients respond to immunotherapies. We propose to integrate computational modeling with functional genomics techniques to refine the immunotherapy response biomarkers, identify novel regulators of immunotherapy response, and elucidate their underlying mechanisms, with the potential to improve immunotherapy response.",Regulators of Cancer Immunotherapy Response,9818071,R01CA234018,"['4T1', 'ATAC-seq', 'Antigen Presentation', 'Big Data', 'Biological Markers', 'Biological Response Modifiers', 'CD8-Positive T-Lymphocytes', 'CRISPR screen', 'CRISPR/Cas technology', 'CT26', 'Cancer Immunology Science', 'Cell-Mediated Cytolysis', 'Cells', 'Chromatin Remodeling Factor', 'Clinical', 'Clustered Regularly Interspaced Short Palindromic Repeats', 'Collection', 'Colon Carcinoma', 'Computational Biology', 'Computer Simulation', 'Computing Methodologies', 'Custom', 'Data', 'Development', 'Exclusion', 'Expression Profiling', 'Functional disorder', 'Gene Expression', 'Genes', 'Hodgkin Disease', 'Immune', 'Immune System Diseases', 'Immunologic Markers', 'Immunology', 'Immunotherapy', 'Individual', 'Infiltration', 'Interferon Type II', 'Knock-out', 'Libraries', 'Lung Neoplasms', 'Machine Learning', 'Malignant Neoplasms', 'Malignant neoplasm of lung', 'Mediating', 'Microsatellite Instability', 'Minority', 'Modeling', 'Molecular', 'Mus', 'Mutation', 'Names', 'PDCD1LG1 gene', 'Patients', 'Performance', 'Regulator Genes', 'Renal carcinoma', 'Sampling', 'Screening for cancer', 'Statistical Models', 'T-Lymphocyte', 'Techniques', 'Training', 'Tumor Escape', 'Tumor-infiltrating immune cells', 'anti-CTLA4', 'anti-PD-1', 'base', 'cancer cell', 'cancer immunotherapy', 'cancer therapy', 'cancer type', 'cohort', 'cytokine', 'data mining', 'deep learning', 'epigenomics', 'functional genomics', 'genetic signature', 'genome-wide', 'genomic profiles', 'immune checkpoint blockade', 'immune checkpoint blockers', 'improved', 'in vivo', 'insight', 'learning strategy', 'machine learning algorithm', 'malignant breast neoplasm', 'melanoma', 'mouse model', 'neoplastic cell', 'novel', 'patient response', 'patient subsets', 'predictive marker', 'response', 'response biomarker', 'single-cell RNA sequencing', 'success', 'transcriptome', 'treatment response', 'tumor', 'web server']",NCI,DANA-FARBER CANCER INST,R01,2019,497881,0.05051973914678464
"Multi-scale data integration frameworks to improve cancer outcomes ﻿    DESCRIPTION (provided by applicant)    The purpose of this K01 proposal is to develop innovative Big Data methodologies to improve cancer outcomes. I am a board-certified hematologist-oncologist completing a PhD in biomedical informatics at Stanford University. This proposal builds on my background and research in developing integrative analysis methods for multi-scale data. It also leverages the exceptional environment at Stanford for advanced training in machine learning, distributed computing, and longitudinal study analysis. Under the mentorship of my team of experts I will enhance my methodologies for improving knowledge discovery in cancer. Cancer research abounds with multi-scale data, from imaging to multi-modal molecular data, such as genomic, epigenomic, transcriptomic, and proteomic. Prediction models of clinical outcomes, including survival and therapeutic response, could capitalize on the richness of information that the data embody. In practice, however, the lack of effective methods for data integrative analysis leaves much of the latent knowledge untapped. For example, imaging data are routinely obtained for diagnostic purposes, but often underutilized in integrative analysis of cancer outcomes. By establishing inter-data correlations, imaging data have the potential to become noninvasive proxies for biopsy-acquired molecular data. Furthermore, traditional methods of data analysis have limited ability to extract knowledge from multi-scale data, which are large, heterogeneous, and exhibit complex inter-data interactions. This project outlines specific approaches to enhance knowledge extraction through integrative analyses that: (1) directly relates imaging data to molecular data, and (2) provides biomedical decision support (prediction of clinical outcomes) from multi-scale data. It applies these approaches to the analysis of brain and colorectal cancers. The training aims of the proposal are designed to further the research objectives by: (1) incorporating advanced machine learning skills to enhance information capture from each data source, (2) boosting computational efficiency and overall performance of the developed methodologies to ensure scalability, and (3) adapting methodologies to a longitudinal clinical study. The proposed project has the capacity to make a significant clinical impact by establishing the role of imaging data as a surrogate for molecular data, delineating potential therapeutic targets, and generating predictive markers for clinical outcomes. Importantly, these methodologies have a high potential to be generalizable to other cancers. Data from this project will cumulatively form the basis for an R01 proposal aimed at examining the optimal analysis of longitudinal multi-scale data to determine the minimum set of data needed to achieve maximum knowledge. The proposed work, designed for completion within the award period, will build on my research skills, generate preliminary data, forge productive collaborative relationships, and enable me to compete for R01 funding. In summary, this K01 will accelerate my career development and support launching my career as an independent physician-scientist in cancer data science research. PUBLIC HEALTH RELEVANCE    If successful, this study of brain and colon cancers will produce new ways of analyzing biomedical data that researchers can apply to other cancers to discover better diagnostic and outcome prediction tools, as well as treatments. One method uses imaging data to infer molecular information, including potential therapies, without biopsy. Another analyzes many different sources of biomedical data to find markers that indicate onset, survival likelihood, and treatment response in cancer.",Multi-scale data integration frameworks to improve cancer outcomes,9613818,K01ES026832,"['Applied Research', 'Award', 'Big Data', 'Big Data to Knowledge', 'Biological Markers', 'Biology', 'Biopsy', 'Cancer Diagnostics', 'Cause of Death', 'Clinical', 'Clinical Informatics', 'Clinical Markers', 'Clinical Research', 'Colon Carcinoma', 'Colorectal Cancer', 'Complex', 'Data', 'Data Analyses', 'Data Correlations', 'Data Science', 'Data Set', 'Data Sources', 'Diagnostic', 'Diagnostic Imaging', 'Disease Progression', 'Doctor of Philosophy', 'Ensure', 'Environment', 'Exhibits', 'Family-Based Registry', 'Funding', 'Genomics', 'Glioblastoma', 'Glioma', 'Goals', 'Hematologist', 'Heterogeneity', 'Image', 'Informatics', 'Institution', 'Intuition', 'Investments', 'Knowledge', 'Knowledge Discovery', 'Knowledge Extraction', 'Learning Skill', 'Longitudinal Studies', 'Machine Learning', 'Malignant Neoplasms', 'Malignant neoplasm of brain', 'Maps', 'Mentors', 'Mentorship', 'Methodology', 'Methods', 'Modality', 'Modeling', 'Molecular', 'Molecular Profiling', 'Oncologist', 'Outcome', 'Pathway interactions', 'Patients', 'Performance', 'Physicians', 'Proteomics', 'Proxy', 'Research', 'Research Personnel', 'Risk Factors', 'Role', 'Scientist', 'Site', 'Source', 'The Cancer Genome Atlas', 'Therapeutic', 'Training', 'Universities', 'Variant', 'Work', 'anticancer research', 'base', 'biomedical informatics', 'cancer genetics', 'cancer subtypes', 'career', 'career development', 'cluster computing', 'cohort', 'colon cancer patients', 'computer framework', 'data integration', 'design', 'epigenomics', 'falls', 'follow-up', 'genetic epidemiology', 'improved', 'improved outcome', 'innovation', 'learning strategy', 'longitudinal analysis', 'molecular imaging', 'multimodality', 'new therapeutic target', 'novel', 'oncology', 'outcome prediction', 'predict clinical outcome', 'predictive marker', 'predictive modeling', 'public health relevance', 'quantitative imaging', 'skills', 'statistics', 'stem', 'supervised learning', 'targeted treatment', 'therapeutic target', 'tool', 'transcriptomics', 'treatment response']",NIEHS,STANFORD UNIVERSITY,K01,2019,188952,0.00559642165118164
"Development of a Prognostic Compound Immunoscore for Head and Neck Cancer PROJECT SUMMARY  Knowledge from the recent clinical trials suggests that over 80% of head and neck cancer (HNC) are hypo-immunogenic cold tumors and non-responsive to immune checkpoint receptors (ICR) blockade. With the emerging combinatorial strategies for cold cancer, precise identification of this group of tumors is essential for the selection of optimal treatment protocols. However, there is no consistent algorithm available to assess the global immune profile of HNC. Most of the current immunoscore methods are based on immunohistochemical (IHC) staining of a limited panel of biomarkers, which prevents a precise annotation of the landscape of tumor- infiltrating lymphocytes (TIL). The IHC method is technically sensitive, and may present inter-institutional and inter-pathologists variations. Moreover, the current immunoscore only emphasizes on a few T-cell subsets, and does not integrate cancer genomic features that modulate tumor response to immune killing. In fact, strong evidence suggests that the type I interferon (IFN-I) pathway plays a fundamental role in HNC response to effector immune cells. Thus, leveraging global TIL profiles and cancer genomic features offers an unprecedented opportunity to classify HNC based on its immunogenicity. The current robust methods for cellular deconvolution are sensitive to outliers, which are frequently observed in the whole tumor RNA-Seq datasets. Our recent studies show that a novel machine learning tool Fast And Robust DEconcolution of Expression Profiles (FARDEEP), which adaptively detects and removes outliers, exhibits superior accuracy in immune cell deconvolution. In precise alignment with the FOA, the overarching hypothesis of this project is that a compound immunoscore integrating FARDEEP-assisted TIL deconvolution and cancer genomics can effectively identify cold HNC. To achieve this goal, our two immediate next steps are: **(1) We will develop a robust model-free approach to identify TIL-driving oncogenic pathways; **(2) We will construct a compound immunoscore integrating cancer genomic features and TIL profiles to identify cold HNC. These studies will develop a novel “statistical methodology appropriate for analyzing genome-wide data” and provide “statistical analysis of existing genome-wide data” for an NIDCR priority disease. This project will refine a robust and novel immune-cell deconvolution machine learning tool and characterize central oncogenic pathways that shift the TIL landscape. The new immunogenomics algorithms will streamline the immunoscoring method to effectively stratify HNC and contribute to the precision selection of combinatorial treatments. PUBLIC HEALTH RELEVANCE  The immune microenvironment holds strong potential to complement the current head and neck cancer (HNC) staging system for more effective patient stratification. But the current immunoscores, which depict the infiltration of some subsets of T cells, are limited by the number of evaluated immune-cell subsets and exclusion of biomarkers for cancer sensitivity to immune killing. In this project, we will refine our unique robust methods to integrate global tumor-infiltrating immune cells with cancer genomics, constructing a compound immunoscore for the precise identification of hypo-immunogenic HNC.",Development of a Prognostic Compound Immunoscore for Head and Neck Cancer,9766266,R03DE027399,"['Algorithms', 'Automobile Driving', 'Cancer Vaccines', 'Cells', 'Clinic', 'Clinical Trials', 'Complement', 'Data', 'Data Set', 'Development', 'Dimensions', 'Disease', 'Engineering', 'Exclusion', 'Exhibits', 'Expression Profiling', 'Gene Expression', 'Genes', 'Glean', 'Goals', 'Group Identifications', 'Head and Neck Cancer', 'Head and Neck Squamous Cell Carcinoma', 'Immune', 'Immunity', 'Immunogenomics', 'Immunohistochemistry', 'Infiltration', 'Institution', 'Interferon Type I', 'Interferon Type II', 'Interferons', 'Knowledge', 'Learning', 'Lymphocyte Subset', 'Machine Learning', 'Malignant Neoplasms', 'Methodology', 'Methods', 'Modeling', 'Mutate', 'Mutation', 'National Institute of Dental and Craniofacial Research', 'Oncogenic', 'Outcome', 'Pathologist', 'Pathway interactions', 'Patients', 'Play', 'Population', 'Receptor Inhibition', 'Receptor Signaling', 'Role', 'Selection for Treatments', 'Signal Transduction', 'Squamous cell carcinoma', 'Staging System', 'Stains', 'Statistical Data Interpretation', 'T-Lymphocyte Subsets', 'Techniques', 'Time', 'Treatment Protocols', 'Tumor-Infiltrating Lymphocytes', 'Tumor-infiltrating immune cells', 'Variant', 'Weight', 'base', 'biomarker panel', 'cancer biomarkers', 'cancer genomics', 'checkpoint receptors', 'chemoradiation', 'combinatorial', 'genome-wide', 'genome-wide analysis', 'immune checkpoint', 'immunogenic', 'immunogenicity', 'inhibitor/antagonist', 'inter-institutional', 'novel', 'optimal treatments', 'patient stratification', 'prevent', 'prognostic', 'prognostic performance', 'public health relevance', 'receptor expression', 'recruit', 'response', 'statistics', 'tool', 'transcriptome sequencing', 'tumor']",NIDCR,UNIVERSITY OF MICHIGAN AT ANN ARBOR,R03,2019,161997,0.04751541939828377
"Dissecting Therapeutic Resistance and Progression in Metastatic Melanoma Through Clinical Computational Oncology Project Summary  The development of targeted therapy (BRAF/MEKi) and immune checkpoint blockade (ICB) targeting the co-inhibitory receptors CTLA-4 and PD-1 have revolutionized the treatment of metastatic melanoma. However, only a subset of patients maintain durable responses, and many people experience substantial side effects of therapy. Predicting therapeutic response in individual patients remains a critical and unresolved issue. Furthermore, the series of key genomic and epigenetic events driving progression and resistance to therapy is incompletely understood. The guiding hypothesis of this proposal is that (a) resistance to ICB and targeted therapy is mediated by tumor intrinsic and extrinsic mechanisms, some of which may be elucidated by systematic multi-modal molecular characterization of the tumor and tumor microenvironment; and (b) applying modern machine-learning and statistical approaches to molecular and clinical data from patient tumors will inform development of new therapeutic approaches and predictive models to improve patient care.  Identifying and validating predictors of intrinsic resistance to BRAF/MEKi and ICB across large human cohorts has been limited to date. Aim 1 of this proposal applies genomic and transcriptomic characterization of pre-treatment tumors to large cohorts of patients treated with BRAF/MEKi, PD-1i, and CTLA-4i in order to discover and to validate molecular and clinical markers of response and resistance. Machine learning approaches will integrate these markers into parsimonious models predicting response. A differential analysis using mutual information will be conducted to reveal markers that predict differential response to therapy.  A significant proportion of patients do not respond or maintained sustained responses to immunotherapy, and there is a critical need to characterize the acquisition or selection of drivers that confer resistance to immunotherapy. Aim 2 of this proposal develops algorithms using molecular characterization of longitudinally collected tumor samples across multiple anatomic sites to discover genomic and epigenetic drivers of progression and resistance to immunotherapy using phylogenetic analysis as the backbone of discovery.  Finally, the ability to detect novel tumor driver mutations present at low frequencies is strongly dependent on cohort size. Aim 3 of this proposal leverages all genomically characterized melanomas to perform a meta- analysis using state-of-the-art and novel algorithms to discover novel driver mutations present at low frequencies with a focus on tumor subsets that lack known targetable drivers.  These studies will expand the actionable landscape of genomic and epigenetic alterations in metastatic melanoma, advance our understanding of intrinsic and acquired resistance to targeted and immunotherapies in melanoma, and establish a framework to predict response in individual patients, which may impact patient care in melanoma and have applicability in other disease settings. Project Narrative  New targeted and immunotherapies have revolutionized the treatment and extended the prognosis of metastatic melanoma, but only a subset of patients have durable responses, and our ability to predict who will benefit from which treatment is limited. Further, the specific alterations driving tumor progression and resistance to therapy are not well characterized, but may inform the development of new therapeutic targets and combination therapies. This proposal aims to integrate molecular data from patient tumor samples and their clinical context to predict response to targeted and immunotherapies, and dissect the drivers of progression and resistance to therapy in individual patients.",Dissecting Therapeutic Resistance and Progression in Metastatic Melanoma Through Clinical Computational Oncology,9788340,K08CA234458,"['Algorithms', 'Automobile Driving', 'BRAF gene', 'Binding', 'Biological', 'Biological Markers', 'CTLA4 gene', 'Classification', 'Clinical', 'Clinical Data', 'Clinical Markers', 'Combined Modality Therapy', 'Computational Biology', 'Data', 'Development', 'Disease', 'Epigenetic Process', 'Event', 'Frequencies', 'Genomics', 'Goals', 'Human', 'Immunotherapy', 'Light', 'Machine Learning', 'Mediating', 'Meta-Analysis', 'Metastatic Melanoma', 'Modernization', 'Molecular', 'Multiple Anatomic Sites', 'Mutation', 'NF1 mutation', 'Pathway interactions', 'Patient Care', 'Patient-Focused Outcomes', 'Patients', 'Phylogenetic Analysis', 'Prediction of Response to Therapy', 'Resistance', 'SLEB2 gene', 'Sampling', 'Series', 'Site', 'Standardization', 'Tail', 'Therapeutic', 'Time', 'Vertebral column', 'actionable mutation', 'clinical biomarkers', 'clinically relevant', 'cohort', 'experience', 'immune checkpoint blockade', 'improved', 'individual patient', 'insight', 'longitudinal analysis', 'melanoma', 'molecular marker', 'multimodality', 'new therapeutic target', 'novel', 'novel therapeutic intervention', 'oncology', 'outcome forecast', 'patient subsets', 'predicting response', 'predictive marker', 'predictive modeling', 'receptor', 'response', 'response biomarker', 'side effect', 'targeted treatment', 'therapy resistant', 'transcriptomics', 'tumor', 'tumor microenvironment', 'tumor progression']",NCI,DANA-FARBER CANCER INST,K08,2019,228089,0.04808574631373678
"Proteogenomic Data Analysis for Cancer Systems Biology and Clinical Translation PROJECT SUMMARY It has become feasible to generate deep quantitative data for many of the molecules that are functional in cells, making it possible to survey a large number of tumors measuring genomic alterations and changes to transcripts, proteins and metabolites. It is, however, not clear what is the best way to integrate these data sets to extract as much information as possible about the biology that drives the cancer and how to best disrupt the tumor growth. Our proposed Proteogenomic Data Analysis Center for Cancer Systems Biology and Clinical Translation will develop new methods for better analyzing and integrating these data sets. In addition to developing statistical and machine learning methods, we also emphasize visual exploration of the data, and we will implement interactive web browser based visualization that will allow researchers to easily explore these vast data sets and gain novel insights by being able to quickly switch between summary information and details of the raw data. PROJECT NARRATIVE The mission of the proposed data analysis center is to leverage high dimensional large-scale data from tumor samples to identify new avenues for the development of clinical prognostics and therapeutics for cancer. This mission will be realized through analysis, integration and visualization of multi-omic datasets including genomic, transcriptomic, and proteomic data collected from patient samples to develop predictive models, and during drug treatment of patient derived xenografts and cell lines to validate mechanisms.",Proteogenomic Data Analysis for Cancer Systems Biology and Clinical Translation,9768977,U24CA210972,"['Amino Acid Sequence Databases', 'Amino Acids', 'Architecture', 'Biological', 'Biology', 'Cancer Center', 'Cell Line', 'Cell Nucleus', 'Cells', 'Classification', 'Clinical', 'Collaborations', 'Communities', 'Consensus', 'DNA Sequence Alteration', 'Data', 'Data Analyses', 'Data Analytics', 'Data Set', 'Data Sources', 'Databases', 'Experimental Designs', 'Formulation', 'Gene Expression', 'Gene Family', 'Gene Proteins', 'Genes', 'Genetic Transcription', 'Genome', 'Genomics', 'Goals', 'Imagery', 'Individual', 'Internet', 'Knowledge', 'Knowledge Discovery', 'Libraries', 'Machine Learning', 'Malignant Neoplasms', 'Mass Spectrum Analysis', 'Measurement', 'Measures', 'Methods', 'Mission', 'Modeling', 'Monitor', 'Mutation', 'Neoplasm Metastasis', 'Pathway Analysis', 'Pathway interactions', 'Patients', 'Pattern', 'Peptides', 'Pharmaceutical Preparations', 'Pharmacotherapy', 'Phenotype', 'Phosphoproteins', 'Phosphorylation', 'Primary Neoplasm', 'Procedures', 'Process', 'Proteins', 'Proteome', 'Proteomics', 'Quantitative Trait Loci', 'Research', 'Research Personnel', 'Resources', 'Sampling', 'Set protein', 'Signal Pathway', 'Surveys', 'Systems Biology', 'Therapeutic', 'Time', 'Transcript', 'Variant', 'Visual', 'Work', 'Xenograft procedure', 'actionable mutation', 'assay development', 'base', 'candidate identification', 'candidate marker', 'causal variant', 'clinical development', 'clinical phenotype', 'clinical translation', 'cohort', 'computerized data processing', 'computerized tools', 'data pipeline', 'experimental study', 'genomic data', 'high dimensionality', 'insight', 'learning strategy', 'multiple omics', 'novel', 'outcome forecast', 'personalized medicine', 'precision medicine', 'precision oncology', 'predictive modeling', 'prognostic', 'protein biomarkers', 'protein kinase inhibitor', 'protein metabolite', 'proteogenomics', 'response', 'tool', 'tool development', 'trait', 'transcriptome', 'transcriptomics', 'treatment choice', 'tumor', 'tumor growth']",NCI,NEW YORK UNIVERSITY SCHOOL OF MEDICINE,U24,2019,602582,0.04102029763828666
