text,title,id,project_number,terms,administration,organization,mechanism,year,funding,score
"Integrative framework for identifying dysregulated mechanisms in the tumor-immune microenvironment Project Summary/Abstract Current cancer therapies provide targeted treatments attacking specific cells, however, tumor cells are heterogeneous and evolving. To develop personalized treatments, we need to understand the composition of cell types in the tumor and the disrupted regulatory mechanisms that lead to cancer stem cells (CSCs). CSCs are resistant to standard therapies and have the ability to form new tumors leading to relapse and metastasis. Immunotherapies harnessing the immune system can be particularly successful in targeting CSCs, however, their mechanisms of action are not well understood. I hypothesize that an unbiased study of the complex tumor microenvironment containing elusive resistant CSCs and interacting immune populations can be achieved with high-dimensional genome-wide data, such as state-of-the-art single-cell resolution transcriptional integrated with epigenetic measurements, using Bayesian statistical tools that are ideal for distinguishing technical noise from biological heterogeneity and integrating different data types. I capitalize on our previous work in collaboration with the Alexander Rudensky Lab on characterizing immune cell populations in breast cancer tumors, using a computational method we developed in the Dana Pe’er Lab for clustering cells in single-cell transcriptomic data while simultaneously normalizing cells and correcting batch effects. In my PhD work, I showed the power of incorporating epigenetic data in inferring regulatory programs. Hence, in my K99 mentored phase, I aim to develop a computational framework for integrating epigenetic data with single-cell transcriptomic data to infer leukemic stem cells and dysregulated mechanisms in Acute Myeloid Leukemia in collaboration with Ross Levine (Aim 1). I have chosen AML as it involves enrichment of epigenetic mutations and the normal hematopoiesis system is well-characterized and would serve as a reference. As an independent investigator in the R00 phase, I will extend this framework to infer CSCs and dysregulations in the tumor as well as composition of immune cells and their reprogramming in under-characterized solid tumors, in collaboration with Benjamin Neel and others in my future institute (Aim 2). I then aim to use this toolbox to study the impact of immunotherapy treatments on the tumor-immune microenvironment in collaboration with Catherine Wu and my future institute (Aim 3). We expect that our results lead to insights into regulatory mechanisms that are disrupted in cancer and drive heterogeneous populations. We would also infer mechanisms of action of immunotherapies in the tumor-immune microenvironment. This proposal describes a training plan to advance my career to an independent investigator at the interface of machine learning and cancer biology. During the K99 phase, I will be supported by an outstanding and interdisciplinary team of advisors and collaborators with expertise in all aspects of the proposed research. Together with institutional support from Memorial Sloan Kettering Cancer Center and formal coursework and training, I will bridge my knowledge gap in cancer biology and gain the communication and leadership skills vital for my transition. Project Narrative  Cancer treatments lead to favorable outcomes only in a subset of patients due to significant heterogeneity in tumor cells. To develop treatments tailored to each patient and the composition of cell types in each tumor, we need to characterize the complex populations of tumor cells and their dysregulated mechanisms. I propose that an unbiased characterization can be achieved with an interdisciplinary framework of single-cell resolution transcriptional and epigenetic measurements, that are integrated with principled computational tools.",Integrative framework for identifying dysregulated mechanisms in the tumor-immune microenvironment,9582884,K99CA230195,"['ATAC-seq', 'Accounting', 'Acute Myelocytic Leukemia', 'Address', 'Affect', 'Automobile Driving', 'Bayesian Modeling', 'Bone Marrow', 'Cancer Biology', 'Cancer Immunology Science', 'Cancer Patient', 'Cells', 'Chronic Myeloid Leukemia', 'Clustered Regularly Interspaced Short Palindromic Repeats', 'Collaborations', 'Communication', 'Complex', 'Computing Methodologies', 'Data', 'Data Set', 'Development', 'Diagnosis', 'Doctor of Philosophy', 'Donor Lymphocyte Infusion', 'Epigenetic Process', 'Epithelium', 'Equilibrium', 'Faculty', 'Foundations', 'Future', 'Genetic Transcription', 'Hematopoiesis', 'Hematopoietic Neoplasms', 'Hematopoietic System', 'Heterogeneity', 'Immune', 'Immune system', 'Immunotherapy', 'Impairment', 'Institutes', 'Knowledge', 'Lead', 'Leadership', 'Learning', 'Machine Learning', 'Malignant Neoplasms', 'Malignant neoplasm of ovary', 'Mammalian Oviducts', 'Measurement', 'Memorial Sloan-Kettering Cancer Center', 'Mentors', 'Mentorship', 'Methods', 'Modeling', 'Mutation', 'Neoplasm Metastasis', 'Noise', 'Outcome', 'Outcomes Research', 'Patients', 'Phase', 'Population', 'Population Heterogeneity', 'Relapse', 'Research', 'Research Personnel', 'Resistance', 'Resolution', 'Sampling', 'Serous', 'Solid Neoplasm', 'System', 'Techniques', 'Time', 'Training', 'Treatment Failure', 'Work', 'base', 'biological heterogeneity', 'cancer heterogeneity', 'cancer stem cell', 'cancer therapy', 'career', 'cell type', 'cohort', 'computer framework', 'computerized tools', 'genome-wide', 'heuristics', 'high dimensionality', 'improved', 'individualized medicine', 'insight', 'interest', 'leukemic stem cell', 'longitudinal analysis', 'malignant breast neoplasm', 'mutant', 'neoplastic cell', 'novel', 'patient subsets', 'personalized medicine', 'programs', 'response', 'self-renewal', 'single cell analysis', 'single cell technology', 'single-cell RNA sequencing', 'skills', 'stem cell population', 'success', 'therapy design', 'therapy resistant', 'tool', 'transcriptomics', 'tumor', 'tumor heterogeneity', 'tumor microenvironment', 'tumorigenesis']",NCI,SLOAN-KETTERING INST CAN RESEARCH,K99,2018,134632,0.041515293249729884
"Targeting Tumors with NF1 Loss ﻿    DESCRIPTION (provided by applicant):  Genomic information can allow investigators to devise precision therapies that target molecular lesions specific to a patient's cancer. One of the molecular lesions present in many malignant tumors is loss of the NF1 tumor suppressor, which is a driver in neurofibromatosis type 1 (NF1), one of the most frequently inherited genetic disorders. NF1 exhibits a broad clinical spectrum including benign nervous system tumors called neurofibromas, low-grade astrocytomas, pheochromocytoma, and juvenile myelomonocytic leukemia. Plexiform neurofibromas (PN) occur in deep nerves and can degenerate into malignant peripheral nerve sheath tumors (MPNSTs), chemo- and radiation-resistant sarcomas with a dismal 20% five-year survival rate. In NF1 carriers, the lifetime risk is 30% for PN and 8-15% for MPNST. NF1 mutations are also found in sporadic tumors including glioblastoma multiforme (GBM), melanoma, pheochromocytoma, ovarian, uterine, and lung cancers. Furthermore, in animal models and human tumor lines NF1 loss has been shown to drive GBM. A targeted molecular therapy designed to inhibit tumor-initiating and -promoting cells would substantially advance our ability to treat tumors that develop as a result of NF1 loss. Using complementary screening platforms, we identified small molecules that selectively killed or stopped the growth of cells carrying a mutation in NF1 as well as their molecular targets. In this application we focus on our top small molecule leads and the power of our model systems to test the hypothesis that aggressive neurological cancers that are known to be driven by NF1 loss and for which no cure exists, including PN, MPNST and GBM, will respond to molecules that we identified as synthetic lethal with NF1 loss. For this, we will determine pharmacokinetic properties of our top small molecule leads and, where needed, conduct structure-activity relationship studies to improve kinetics and/or reduce toxicity in order to test their efficacy in pre-clinical models of PN and GBM. We will leverage our model systems to define the mechanisms of action of our small molecule leads and add to our pipeline drugs in clinical trials that share the same targets. In addition to mutational inactivation, some GBM tumors exhibit down-regulation of the NF1 protein. Our lead compounds also stopped the growth of human GBM and neuroblastoma cells with low NF1 protein in vitro, supporting the broad application of the small molecule leads that we have identified. To capture tumors that have lost NF1 by any mechanism, we constructed an RNA-based classifier, which is capable of identifying downstream transcriptomic effects that indicate NF1 inactivation in GBM, using machine learning. We will apply the RNA-based classifier, along with targeted sequencing of NF1, to identify additional patient derived xenograft (PDX) GBM tumors that have an inactivating mutation of NF1 or molecular signatures of NF1 loss and test their response to our lead compounds in pre-clinical models. We expect that this work will provide new targets and therapeutic leads for aggressive neurological cancers driven by NF1 loss. PUBLIC HEALTH RELEVANCE:  The work described in this proposal aims to find the Achilles heel of aggressive neurological cancers driven by NF1 loss for which no cure exists. These cancers include neurofibromas, malignant peripheral nerve sheath tumors, glioblastoma (GBM), and neuroblastomas, all with dismal 5-year survival rates. Our multidisciplinary approach to develop an innovative conduit for identifying new targets with potential to cure such malignancies addresses an unmet clinical need.",Targeting Tumors with NF1 Loss,9525436,R01NS095411,"['Address', 'Animal Model', 'Astrocytoma', 'Benign', 'Biochemical', 'Bioinformatics', 'Biological Assay', 'Biological Markers', 'Biological Models', 'Blood', 'Cancer Patient', 'Cells', 'Chemicals', 'Clinical', 'Clinical Trials', 'Data', 'Dose', 'Down-Regulation', 'Drug Kinetics', 'Drug Targeting', 'Embryo', 'Exhibits', 'Future', 'Genetic', 'Genomics', 'Glioblastoma', 'Growth', 'Hereditary Disease', 'Homologous Gene', 'Human', 'In Vitro', 'Juvenile Myelomonocytic Leukemia', 'Kinetics', 'Lead', 'Lesion', 'Machine Learning', 'Malignant Neoplasms', 'Malignant neoplasm of lung', 'Malignant neoplasm of ovary', 'Methods', 'Molecular', 'Molecular Profiling', 'Molecular Target', 'Monitor', 'Mus', 'Mutation', 'NF1 gene', 'Nerve', 'Nervous System Neoplasms', 'Neuroblastoma', 'Neurofibromatoses', 'Neurofibromatosis 1', 'Neurofibromatosis Type 1 Protein', 'Neurofibrosarcoma', 'Neurologic', 'Pathway interactions', 'Patients', 'Pharmaceutical Preparations', 'Pheochromocytoma', 'Plexiform Neurofibroma', 'Pre-Clinical Model', 'Precision therapeutics', 'Property', 'RNA', 'Research', 'Research Personnel', 'Schwann Cells', 'Structure-Activity Relationship', 'Survival Rate', 'Testing', 'The Cancer Genome Atlas', 'The Jackson Laboratory', 'Therapeutic', 'Toxic effect', 'Tumor Initiators', 'Tumor Suppressor Proteins', 'Uterine Cancer', 'Work', 'Xenograft Model', 'Xenograft procedure', 'Yeast Model System', 'Yeasts', 'base', 'cancer cell', 'cell growth', 'efficacy testing', 'human model', 'improved', 'in vivo', 'innovation', 'interdisciplinary approach', 'lead optimization', 'lifetime risk', 'malignant neurologic neoplasms', 'melanoma', 'molecular targeted therapies', 'mouse model', 'neoplastic cell', 'neuroblastoma cell', 'neurofibroma', 'novel', 'preclinical efficacy', 'progenitor', 'public health relevance', 'radioresistant', 'response', 'response biomarker', 'sarcoma', 'screening', 'small molecule', 'stem', 'success', 'targeted sequencing', 'targeted treatment', 'therapy design', 'tool', 'transcriptome', 'transcriptomics', 'tumor']",NINDS,DARTMOUTH COLLEGE,R01,2018,541146,0.04752969870502473
"Pre-cancer atlases of cutaneous and hematologic origin (PATCH Center) SUMMARY-ABSTRACT  The overall goal of this proposal is to construct two pre-cancer atlases (PCAs) from highly accessible pre- malignant diseases that impose high burdens on human health (i) one focused on progression of pre- melanoma lesions to invasive cancer and (ii) a second on progression from clonal hematopoiesis (CHIP) to myeloid neoplasms. Both of these involve expansion of specific clones in normal and diseased niches as shaped by complex interactions among immune and pre-cancer cells. The resulting Atlases developed by the Center for Pre-cancer Atlases of Cutaneous and Hematologic Origin (PATCH Center) present complementary technical challenges, avenues to scientific discovery, and opportunities for the development of precision prevention strategies and therapies. The key goal in both cases is to precisely delineate and understand the molecular mechanisms driving progression from pre-malignant to malignant disease, to identify high risk individuals, prioritize particular therapies and serve as the foundation for precision prevention clinical trials. This will be achieved by integrated characterization of single cell genotype and cell states using high-plex tissue imaging and omic characterization of cross-sectional and well-controlled longitudinal patient cohorts.  Aim 1 will establish an administrative core responsible for scientific management of the Center, coordination with HTAN members and dissemination of Atlases under the direction of an internal Executive Committee with three subcommittees. Aim 2 will establish a Biospecimen Unit under the leadership of pathologists, oncologists and a surgeon. The DFCI Pasquarello Tissue Repository will provide highly annotated hematological specimens for image-based and omic characterization of CHIP; the BWH dermatopathologic tissue repository will provide annotated FFPE samples for melanoma precursors. These services will also play a key role in prospective sample acquisition and analysis. Aim 3 will establish a Characterization Unit directed by an oncologist and pathologist to perform and integrate single-cell genomics, multiplex flow cytometry and high- plex imaging using two methods reduced to practice within the Center: tissue-based cyclic immunofluorescence (t-CyCIF) and DNA exchange imaging (DEI). The Characterization Unit will also validate reagents and associate all primary results with appropriate metadata, protocols and reagent specifications. Aim 4 will establish a Data Analysis Unit enlisting systems and computational biologists and data scientists to manage all aspects of data acquisition, interpretation and visualization. This is expected to be the most technically challenging aspect of the Atlas projects. The Data Analysis Unit will release Phase I/II atlases each in preliminary and final stages to facilitate collaborative and crowd-sourced approaches to algorithm development. The resulting human browsable and machine-readable atlases are expected to yield new scientific discoveries, demonstrate the feasibility and utility of new technologies and help to reduce the incidence of life-threatening cancers of the skin and blood. NARRATIVE Construction of Pre-Cancer Atlases comprising detailed spatial and molecular data on cell state and omic data in melanoma and clonal hematopoiesis will join together the two primary means of diagnosing human cancer: histology and genetics. The atlases we construct will help to identify patients with pre-cancer skin lesions and blood conditions at risk of progressing to malignancy at a sufficiently early stage that aggressive disease can be prevented.",Pre-cancer atlases of cutaneous and hematologic origin (PATCH Center),9627416,U2CCA233262,"['Algorithms', 'Antibodies', 'Area', 'Atlases', 'Automobile Driving', 'Back', 'Benchmarking', 'Biological Assay', 'Biopsy', 'Blood', 'Bone Marrow', 'Cancer Histology', 'Cell Line', 'Cells', 'Cellular Morphology', 'Clinical', 'Clinical Data', 'Code', 'Collaborations', 'Collection', 'Communication', 'Complex', 'Computer Vision Systems', 'Computers', 'Computing Methodologies', 'Cutaneous', 'DNA', 'DNA sequencing', 'Data', 'Data Analyses', 'Data Science', 'Databases', 'Development', 'Diagnosis', 'Disease', 'Disease Progression', 'Engineering', 'Enrollment', 'Ensure', 'FAIR principles', 'Fee-for-Service Plans', 'Flow Cytometry', 'Formalin', 'Foundations', 'Freezing', 'Funding', 'Genetic', 'Genomics', 'Genotype', 'Goals', 'Head', 'Health', 'Hematopoiesis', 'Hematopoietic Neoplasms', 'Histologic', 'Human', 'Image', 'Imagery', 'Immune', 'Immunofluorescence Immunologic', 'Incidence', 'Individual', 'Industrialization', 'Laboratories', 'Lead', 'Leadership', 'Lesion', 'Life', 'Link', 'Liquid substance', 'Machine Learning', 'Malignant - descriptor', 'Malignant Neoplasms', 'Maps', 'Metadata', 'Methods', 'Molecular', 'Monitor', 'Myeloproliferative disease', 'Oncologist', 'Paraffin Embedding', 'Pathologist', 'Patients', 'Performance', 'Periodicity', 'Pharmacology', 'Phase', 'Physicians', 'Play', 'Positioning Attribute', 'Premalignant', 'Prevention strategy', 'Prevention therapy', 'Prevention trial', 'Prospective cohort', 'Protocols documentation', 'Readability', 'Reagent', 'Research Personnel', 'Risk', 'Running', 'Sampling', 'Scientist', 'Services', 'Skin Cancer', 'Software Engineering', 'Solid', 'Specimen', 'Standardization', 'Stromal Cells', 'Surgeon', 'System', 'Technology', 'Testing', 'Time', 'Time Series Analysis', 'Tissue imaging', 'Tissues', 'Tumor Tissue', 'Validation', 'Visualization software', 'Work', 'base', 'cancer invasiveness', 'cell type', 'cohort', 'computing resources', 'crowdsourcing', 'data acquisition', 'data submission', 'data visualization', 'deep neural network', 'dimensional analysis', 'genetic analysis', 'high dimensionality', 'high risk', 'image visualization', 'individual patient', 'individualized prevention', 'insight', 'knowledge base', 'laser capture microdissection', 'learning strategy', 'melanoma', 'member', 'neoplastic', 'new technology', 'prevent', 'prevention clinical trial', 'prospective', 'repository', 'skin lesion', 'tumor microenvironment']",NCI,HARVARD MEDICAL SCHOOL,U2C,2018,6918530,0.004369696335253775
"(PQ2) PD-L1/PD-1 signals in aged hosts undergoing cancer immunotherapy This proposal combines a team with expertise in aging, tumor immunology, tumor immunotherapy, specific genetically modified animal models and early phase clinical trials with a computational team having great expertise in analyzing and modeling aging of the immune system. We will study age effects on PD-L1/PD-1 signaling in the host and the tumor focusing on melanoma with some bladder cancer work, two tumors that are highly responsive to αPD-1 and/or αPD-L1 as proofs-of-concept, and residing in distinct anatomic compartments. In Aim 1 we study tumor PD-L1 intrinsic effects on αPD-L1 and αPD-1 treatment in melanoma and bladder cancer using transplantable B16 and inducible Nras/Cdk2n melanoma models, and transplantable MB49 and BBN-induced tumors for bladder cancer studies. We also use novel melanoma and BC models with tumor cell- specific PD-L1KO. We study 3 cohorts of elderly versus younger humans getting αPD-L1 or αPD-1 for melanoma or bladder cancer for human validation. We measure high-dimensional cell phenotypes and signaling responses, proteins and genes to maximize the information collected from human samples and mice using 23-color FACS, CyTOF, Luminex, Nanostring and other approaches. In Aim 2 we use all the above models and analytic strategies in young and aged PD-L1KO mice and WT or bone marrow chimeras to test hematopoietic and non- hematopoietic (host) PD-L1 signals in treatment outcomes in melanoma and bladder cancer. In Aim 3 the Systems Immunology team will use their innovative and successful computational modeling to identify age- related co-predictors of immunotherapy response and to identify candidate mechanisms for responders and non- responders. We will define a trajectory of immune system aging in mice at ultra-high resolution by performing a systems level integrative analysis of aging in Collaborative Cross and BL6 mice tracked in a combined longitudinal and cross-sectional study. This trajectory will be used to understand how tumor response and treatment outcomes vary as a function of age, and to build a simple, low parameter (i.e., easily testable and clinically translated), predictive models of treatment response. We will test insights by analyzing immune data from aged versus young patients undergoing αPD-L1 and αPD-1 cancer immunotherapy in novel machine learning approaches that we pioneered to identify insights from mouse data that are relevant to humans. Coupling this disease information with the healthy human aging trajectory that we recently defined will allow us to adapt our mouse data to predict optimal treatments in humans based on chronological and immune aging. This combined trans-disciplinary approach will identify common age-related disabilities that reduce PD-L1/PD-1 based immunotherapy responses and suggest tailored treatments for optimal efficacy that could later be tested in validation sets. These data can also be applied to other types of immunotherapy as we will also test. Cancer is a disease of the aged, but therapies are generally modeled in the young. We study age effects on cancer immunotherapy in response to PQ2 to develop ways to optimize cancer immunotherapy in aged patients most at risk. We focus on the PD-L1/PD-1 axis that is the cornerstone of the most successful cancer immunotherapies to date.",(PQ2) PD-L1/PD-1 signals in aged hosts undergoing cancer immunotherapy,9592156,R01CA231325,"['Address', 'Affect', 'Age', 'Aging', 'Anatomy', 'Animal Model', 'Antineoplastic Agents', 'Appearance', 'Bladder Neoplasm', 'Blocking Antibodies', 'Bone Marrow', 'Cancer Model', 'Cancer Patient', 'Cells', 'Chimera organism', 'Chronology', 'Clinical', 'Clinical Trials', 'Color', 'Comorbidity', 'Complement', 'Computer Simulation', 'Coupling', 'Cross-Sectional Studies', 'Data', 'Detection', 'Disease', 'Effectiveness', 'Elderly', 'Genes', 'Genetically Modified Animals', 'Hematopoietic', 'Human', 'Immune', 'Immune System Diseases', 'Immune system', 'Immunity', 'Immunology', 'Immunotherapy', 'Individual', 'Longitudinal Studies', 'Machine Learning', 'Malignant Neoplasms', 'Malignant neoplasm of urinary bladder', 'Measures', 'Metabolism', 'Modeling', 'Morphologic artifacts', 'Mus', 'Organ', 'Outcome', 'PDCD1LG1 gene', 'Patients', 'Pharmaceutical Preparations', 'Phase', 'Phenotype', 'Preclinical Testing', 'Prediction of Response to Therapy', 'Proteins', 'Publishing', 'Regulatory T-Lymphocyte', 'Research', 'Risk', 'Risk Factors', 'SLEB2 gene', 'Sampling', 'Signal Transduction', 'System', 'Systems Biology', 'T-Lymphocyte Subsets', 'Testing', 'Translating', 'Transplantation', 'Treatment Efficacy', 'Treatment Protocols', 'Treatment outcome', 'Tumor Immunity', 'Validation', 'Work', 'age effect', 'age related', 'aged', 'base', 'cancer immunotherapy', 'cell dimension', 'cohort', 'dimensional analysis', 'disability', 'high dimensionality', 'human disease', 'immune checkpoint', 'immune function', 'improved', 'individual patient', 'individualized medicine', 'innovation', 'insight', 'mathematical model', 'melanoma', 'metagenome', 'mouse model', 'nano-string', 'neoplasm immunotherapy', 'neoplastic cell', 'novel', 'optimal treatments', 'preclinical study', 'prediction algorithm', 'predictive modeling', 'responders and non-responders', 'response', 'tool', 'treatment optimization', 'treatment response', 'treatment strategy', 'tumor', 'tumor immunology', 'tumor microenvironment', 'ultra high resolution']",NCI,UNIVERSITY OF TEXAS HLTH SCIENCE CENTER,R01,2018,582917,0.03274245025256791
