text,title,id,project_number,terms,administration,organization,mechanism,year,funding,score
"Topology of Cancer Evolution and Heterogeneity ﻿    DESCRIPTION (provided by applicant): In solid tumors, current limitations in our ability to identify the cell(s) of origin, track the dynamics of tumor subclonal architecture over space and time, and predict drug sensitivities in a mechanistic fashion pose significant challenges to our ability to develop effective treatments and undermine the utility of available therapies, particularly in tumors that become resistant. In this proposal, we argue that approaches based in mathematics and physics are well suited for addressing these critical problems. Historically, the physical sciences have been successful in solving fundamental scientific problems by producing reductionist models that enable the development of conceptual premises, technological breakthroughs that enable new kinds of measurements, and mathematical tools that can accurately represent and predict future activity. In this new Columbia University Physical Sciences-Oncology Center for Topology of Cancer Evolution and Heterogeneity (CUPS-OC), our goal is to develop, validate, and deliver a set of complementary mathematical, technological, and computational approaches that will provide the cancer research community with a framework for unraveling complexity in solid tumors, with the long-term aim of improving diagnosis and treatment. More specifically, the Center's primary research focus will be to study evolution and heterogeneity of solid tumors at the single cell level, by developing lineage tracing techniques in organoid and in vivo systems, single cell sequencing in primary tumors, and emerging genomics-based approaches for identifying targeted therapies. These experimental approaches will be supported by the development of novel, robust, and effective mathematical and computational approaches based in the field of topology, which offers unique and powerful methods for addressing the essential challenge of interpreting the high-dimensional data sets that state-of-the- art genomics technologies generate. In addition, we will promote the integration of physical science approaches into cancer research by both training new researchers and engaging established researchers working at the intersection of the physical sciences and cancer biology. Each of the projects and cores will address technical, mathematical, and biological challenges, contributing to the global enterprise of cancer research and to the development of a broader network of interdisciplinary researchers committed to advancing the field. If successful, we will be able to provide the scientific community with experimentally validated geometric and topological structures of causal inference of clonal evolution, single cell genomic protocols for fast and reliable uncovering of clonal heterogeneity, experimentally validated machine learning approaches for predicting drug sensitivities, and a strong multi-institutional, interdisciplinary program that creates bridges between researchers in pure mathematics, the technology sector, and cancer research.         PUBLIC HEALTH RELEVANCE: Cancer heterogeneity has been postulated as a major evolutionary force behind drug resistance. The Columbia University Physical Sciences-Oncology Center for Topology of Cancer Evolution and Heterogeneity (CUPS-OC) will develop quantitative approaches to understand, study and find potential novel therapeutic approaches for the treatment of solid tumors.        Average Scores of the Components:    Overall:			2.7    Project 1:			2.7    Project 2:			2.3    Project 3:			4.3    Resource Core 1:		2.2    Education and Outreach:	2.9            ",Topology of Cancer Evolution and Heterogeneity,8866149,U54CA193313,"['Address', 'Architecture', 'Area', 'Biological', 'Biological Sciences', 'Cancer Biology', 'Cells', 'Chronic Myeloid Leukemia', 'Clinical', 'Clonal Evolution', 'Collaborations', 'Communities', 'Complex', 'Computer Analysis', 'Consensus', 'Data', 'Data Set', 'Development', 'Diagnosis', 'Drug resistance', 'Education and Outreach', 'Educational workshop', 'Event', 'Evolution', 'Experimental Models', 'Foundations', 'Future', 'Genetic', 'Genomic approach', 'Genomics', 'Goals', 'Hematologic Neoplasms', 'Heterogeneity', 'Human', 'Institution', 'Logic', 'Machine Learning', 'Malignant Neoplasms', 'Mathematics', 'Measurement', 'Methods', 'Modeling', 'Molecular Profiling', 'Mutation', 'New York', 'Operative Surgical Procedures', 'Organoids', 'Penetrance', 'Physics', 'Pilot Projects', 'Primary Neoplasm', 'Protocols documentation', 'Radiation therapy', 'Recurrence', 'Research', 'Research Personnel', 'Research Project Grants', 'Resistance', 'Resources', 'Role', 'Route', 'Scientist', 'Solid Neoplasm', 'Structure', 'System', 'Techniques', 'Technology', 'Theoretical model', 'Therapeutic', 'Time', 'Training', 'Universities', 'Work', 'anticancer research', 'base', 'bcr-abl Fusion Proteins', 'chemotherapy', 'clinically relevant', 'computerized tools', 'design', 'drug sensitivity', 'effective therapy', 'imprint', 'improved', 'in vivo', 'interdisciplinary approach', 'leukemia', 'mathematical methods', 'metropolitan', 'novel', 'novel therapeutic intervention', 'oncology', 'outcome forecast', 'patient population', 'physical science', 'pressure', 'prognostic', 'programs', 'public health relevance', 'single cell sequencing', 'success', 'targeted treatment', 'tool', 'traditional therapy', 'treatment planning', 'tumor', 'tumor progression']",NCI,COLUMBIA UNIVERSITY HEALTH SCIENCES,U54,2015,1990894,0.0510412413040887
"An integrated approach to dissect the functional network of large non-coding RNA PROJECT SUMMARY Recent studies revealed that the human genome encodes thousands of lncRNAs with little proteincoding capacity. LncRNAs were shown to play important roles in cancer and are potentially a new class of therapeutic targets for cancer. However, the function of the vast majority of lncRNAs in cancer remains unknown. LncRNA function often depends on its physical interactions with protein complexes. They can also influence the abundance of other mRNAs that are targeted by the same microRNAs by competing for microRNA binding, i.e., serving as competing endogenous RNA (ceRNA). Advances in genomic technologies, especially those based on next generation sequencing (NGS), provide unparalleled opportunities to characterize the functional networks of lncRNA in cancer. However, analysis and integration of different types of genomic datasets to generate testable hypotheses is challenging, and systematic approaches to characterize lncRNA function in cancer are lacking. This application describes the development of computational methods and integrative genomic strategies for systematically dissecting the functional network of lncRNA in cancer, and a combination of computational and experimental approaches to unravel several important functional networks of lncRNA in prostate cancer. Specifically, it will (1) develop a computational method for repurposing the publically available array-based data to interrogate lncRNA expression in tumor samples and utilize an integrative genomic strategy to predict lncRNAs that may be important for tumorigenesis/tumor suppression in prostate cancer via analysis of lncRNA expression profiles, clinical information and somatic genomic alteration profiles of tumor samples, (2) identify the lncRNAs that are associated with EZH2 or direct transcriptional targets of EZH2 repression that are important for prostate tumorigenesis or tumor suppression, and (3) identify the ceRNAs of AR and PTEN that mediate prostate tumorigenesis or tumor suppression. In addition to its scientific proposal, this application proposes a comprehensive training program for preparing an independent investigator in the fields of computational genomics, noncoding RNA and cancer, who develops cutting-edge computational methods, and uses a combination of computational and experimental approaches to understand structure-function relationship of noncoding RNA and the function of noncoding RNA and RNA-protein interaction in cancer. While the candidate of this application has received extensive training in biophysics, statistics, machine learning and computational genomics, this career development award will allow him to develop his experimental skills, especially those next-generation sequencing-based techniques and molecular biology experiments in human cell lines. Dr. Liu, Professor of Biostatistics and Computational Biology and Dr. Brown, Professor of Medicine will mentor the candidate in the excellent training environment of Dana Farber Cancer Institute, a part of Harvard Medical School community. A committee of experienced computational and cancer biologists will also advise him on both scientific research and career development. The proposed study is to decipher lncRNA function in cancer using a combination of novel computational methods and high-throughput experimental technologies. The proposed research will result in publically available bioinformatic resources for studying lncRNA function in cancer, a greater understanding of IncRNA function in prostate cancer, and will help to discover novel therapeutic target of lncRNA for treating prostate cancer.",An integrated approach to dissect the functional network of large non-coding RNA,8994367,R00CA175290,"['Algorithms', 'Androgen Receptor', 'Base Pairing', 'Binding', 'Bioinformatics', 'Biometry', 'Biophysics', 'Categories', 'Cell Line', 'Clinical', 'Communities', 'Computational Biology', 'Computing Methodologies', 'DNA Sequence Alteration', 'Dana-Farber Cancer Institute', 'Data', 'Data Analyses', 'Data Set', 'Databases', 'Development', 'Environment', 'Exons', 'Genomic approach', 'Genomics', 'Human Cell Line', 'Human Genome', 'Immunoprecipitation', 'K-Series Research Career Programs', 'Machine Learning', 'Malignant Neoplasms', 'Malignant neoplasm of prostate', 'Mediating', 'Medicine', 'Mentors', 'Messenger RNA', 'Methods', 'MicroRNAs', 'Modeling', 'Molecular Biology Techniques', 'Molecular Profiling', 'PTEN gene', 'Play', 'Prostatic Neoplasms', 'RNA', 'RNA immunoprecipitation sequencing', 'RNA-Protein Interaction', 'Repression', 'Research', 'Research Personnel', 'Resources', 'Ribonucleoproteins', 'Role', 'Sampling', 'Structure-Activity Relationship', 'Technology', 'Training', 'Training Programs', 'Tumor Suppression', 'Untranslated RNA', 'base', 'career development', 'chromatin immunoprecipitation', 'experience', 'human EZH2 protein', 'mRNA Expression', 'medical schools', 'new therapeutic target', 'next generation sequencing', 'novel', 'professor', 'prostate carcinogenesis', 'protein complex', 'research and development', 'research study', 'skills', 'statistics', 'therapeutic target', 'transcriptome sequencing', 'tumor', 'tumorigenesis']",NCI,UNIVERSITY OF TX MD ANDERSON CAN CTR,R00,2015,249000,-0.02020390737025462
"SPORE in Skin Cancer The incidence of melanoma has risen dramatically in recent years, but no therapy has improved overall survival for the majority of patients with unresectable metastatic disease. The University of Pittsburgh Cancer Institute (UPCI) Melanoma and Skin Cancer Program (MSCP) will continue to conduct a Specialized Program of Research Excellence (SPORE) to improve our understanding of molecular and immunologic mechanisms of cancer progression and to validate prognostic and predictive biomarkers for personalized treatment of advanced melanoma and cutaneous T cell lymphoma (CTCL). Of our 4 Projects, 1 is continued from the prior funding period, and 3 new projects have been derived from developmental research conducted in the last period; 1 of the prior SPORE projects will be continued with independent ROI funding. Our highly integrated approach leverages complementary expertise in melanoma, oncology, dermatology, immunology, biostatistics, bioinformatics, machine learning, genomics, proteomics, and biomarker discovery to test hypotheses central to the improvement of therapeutic outcome in skin cancers. Regardless of clinical outcomes, these Projects will also generate urgently needed mechanistic data to inform development of new therapeutic strategies and pathways through which to monitor relapse and progression. Our 4 Projects will evaluate: (1) the prognostic and predictive value of the pro-inflammatory response and markers of immune suppression in relation to ipilimumab and interferon (IFN)¿ adjuvant therapy (leveraging an Eastern Cooperative Oncology Group-led adjuvant trial); (2) an engineered, 3-antigen dendritic cell vaccine and IFN¿ boost in patients with metastatic melanoma; (3) the safety and efficacy of vemurafenib modulation of immunotherapy with IFN¿2b in patients with metastatic melanoma; and (4) an entirely new personalized microneedle vaccination technology in patients with melanoma and CTCL. The Administrative Core (A) coordinates the clinical research and provides scientific and fiscal oversight of the entire SPORE. The Biospecimen Core (B) is housed in the UPCI Immunologic Monitoring and Cellular Products Laboratory, where all tissue banking, biospecimen processing, and immune assays are conducted. The Biostatistics Core (C) and Informatics Core (D) support all projects with data analysis and management, respectively. We will continue to solicit, review, and fund applications for the career development and developmental research programs, which in the prior funding period led to the design of a new full project in this application (Project 3)  and the promotion of career development recipients to co-investigators and a project leader. The goal of this application is to use a multi-disciplinary approach to improve outcomes in skin cancer and in particular, metastatic melanoma, a disease with a 15% 5-year survival rate. We will improve treatment and outcomes for skin cancer patients by identifying new ways to treat the disease based on the biology of the individual patient's tumor and new biomarkers that predict risk and response to therapy to prevent recurrence based on an individual patient's genetics and the tumor impact upon the microenvironment.",SPORE in Skin Cancer,8919260,P50CA121973,"['Adjuvant', 'Adjuvant Study', 'Adjuvant Therapy', 'Adverse effects', 'Antigens', 'Apoptotic', 'BRAF gene', 'Bioinformatics', 'Biological Assay', 'Biological Markers', 'Biology', 'Biometry', 'Biostatistics Core', 'Blocking Antibodies', 'CTLA4 gene', 'Cancer Burden', 'Cancer Patient', 'Cell Death', 'Clinical', 'Clinical Research', 'Combined Modality Therapy', 'Communities', 'Cutaneous', 'Cutaneous Melanoma', 'Data', 'Data Analyses', 'Dendritic Cell Vaccine', 'Dermatology', 'Development', 'Disease', 'Dose', 'Eastern Cooperative Oncology Group', 'Engineering', 'Faculty', 'Funding', 'Genes', 'Genetic', 'Genomics', 'Goals', 'Housing', 'Immune', 'Immune response', 'Immunization', 'Immunologic Monitoring', 'Immunologics', 'Immunology', 'Immunosuppression', 'Immunotherapeutic agent', 'Immunotherapy', 'In Situ', 'Incidence', 'Individual', 'Inflammation', 'Inflammatory Response', 'Informatics', 'Interferon Alfa-2b', 'Interferons', 'International', 'Laboratories', 'Length', 'Machine Learning', 'Metastatic Melanoma', 'Modality', 'Molecular', 'Monitor', 'Organ', 'Outcome', 'Pathway interactions', 'Patients', 'Phase', 'Predictive Value', 'Process', 'Proteomics', 'Recurrence', 'Relapse', 'Research', 'Research Infrastructure', 'Research Personnel', 'Resource Informatics', 'Resources', 'Risk', 'Role', 'Safety', 'Skin Cancer', 'Skin Carcinoma', 'Specialized Program of Research Excellence', 'Survival Rate', 'T-Cell Lymphoma', 'T-Lymphocyte', 'Technology', 'Testing', 'Therapeutic', 'Tissue Banking', 'Tissue Banks', 'Translational Research', 'Translations', 'Treatment outcome', 'Tumor Immunity', 'University of Pittsburgh Cancer Institute', 'Unresectable', 'Vaccination', 'Vaccines', 'Viral Vector', 'base', 'career development', 'chemotherapeutic agent', 'data management', 'design', 'dosage', 'effective therapy', 'high risk', 'immunogenic', 'immunogenicity', 'improved', 'in vivo', 'inflammatory marker', 'inhibitor/antagonist', 'melanoma', 'new technology', 'novel', 'novel therapeutics', 'novel vaccines', 'oncology', 'personalized medicine', 'pre-clinical', 'predictive marker', 'prevent', 'prognostic', 'prognostic value', 'programs', 'research and development', 'response', 'therapeutic target', 'tumor', 'tumor progression']",NCI,UNIVERSITY OF PITTSBURGH AT PITTSBURGH,P50,2015,2185000,0.04070031987065596
"Targeting Tumors with NF1 Loss ﻿    DESCRIPTION (provided by applicant):  Genomic information can allow investigators to devise precision therapies that target molecular lesions specific to a patient's cancer. One of the molecular lesions present in many malignant tumors is loss of the NF1 tumor suppressor, which is a driver in neurofibromatosis type 1 (NF1), one of the most frequently inherited genetic disorders. NF1 exhibits a broad clinical spectrum including benign nervous system tumors called neurofibromas, low-grade astrocytomas, pheochromocytoma, and juvenile myelomonocytic leukemia. Plexiform neurofibromas (PN) occur in deep nerves and can degenerate into malignant peripheral nerve sheath tumors (MPNSTs), chemo- and radiation-resistant sarcomas with a dismal 20% five-year survival rate. In NF1 carriers, the lifetime risk is 30% for PN and 8-15% for MPNST. NF1 mutations are also found in sporadic tumors including glioblastoma multiforme (GBM), melanoma, pheochromocytoma, ovarian, uterine, and lung cancers. Furthermore, in animal models and human tumor lines NF1 loss has been shown to drive GBM. A targeted molecular therapy designed to inhibit tumor-initiating and -promoting cells would substantially advance our ability to treat tumors that develop as a result of NF1 loss. Using complementary screening platforms, we identified small molecules that selectively killed or stopped the growth of cells carrying a mutation in NF1 as well as their molecular targets. In this application we focus on our top small molecule leads and the power of our model systems to test the hypothesis that aggressive neurological cancers that are known to be driven by NF1 loss and for which no cure exists, including PN, MPNST and GBM, will respond to molecules that we identified as synthetic lethal with NF1 loss. For this, we will determine pharmacokinetic properties of our top small molecule leads and, where needed, conduct structure-activity relationship studies to improve kinetics and/or reduce toxicity in order to test their efficacy in pre-clinical models of PN and GBM. We will leverage our model systems to define the mechanisms of action of our small molecule leads and add to our pipeline drugs in clinical trials that share the same targets. In addition to mutational inactivation, some GBM tumors exhibit down-regulation of the NF1 protein. Our lead compounds also stopped the growth of human GBM and neuroblastoma cells with low NF1 protein in vitro, supporting the broad application of the small molecule leads that we have identified. To capture tumors that have lost NF1 by any mechanism, we constructed an RNA-based classifier, which is capable of identifying downstream transcriptomic effects that indicate NF1 inactivation in GBM, using machine learning. We will apply the RNA-based classifier, along with targeted sequencing of NF1, to identify additional patient derived xenograft (PDX) GBM tumors that have an inactivating mutation of NF1 or molecular signatures of NF1 loss and test their response to our lead compounds in pre-clinical models. We expect that this work will provide new targets and therapeutic leads for aggressive neurological cancers driven by NF1 loss.         PUBLIC HEALTH RELEVANCE:  The work described in this proposal aims to find the Achilles heel of aggressive neurological cancers driven by NF1 loss for which no cure exists. These cancers include neurofibromas, malignant peripheral nerve sheath tumors, glioblastoma (GBM), and neuroblastomas, all with dismal 5-year survival rates. Our multidisciplinary approach to develop an innovative conduit for identifying new targets with potential to cure such malignancies addresses an unmet clinical need.            ",Targeting Tumors with NF1 Loss,9037783,R01NS095411,"['Accounting', 'Address', 'Animal Model', 'Astrocytoma', 'Benign', 'Biochemical', 'Bioinformatics', 'Biological Assay', 'Biological Markers', 'Biological Models', 'Blood', 'Cancer Patient', 'Cells', 'Chemicals', 'Clinical', 'Clinical Trials', 'Data', 'Dose', 'Down-Regulation', 'Drug Kinetics', 'Drug Targeting', 'Embryo', 'Exhibits', 'Future', 'Gene Expression Profile', 'Genetic', 'Genomics', 'Glioblastoma', 'Growth', 'Hereditary Disease', 'Homologous Gene', 'Human', 'In Vitro', 'Inherited', 'Juvenile Myelomonocytic Leukemia', 'Kinetics', 'Lead', 'Lesion', 'Machine Learning', 'Malignant Neoplasms', 'Malignant neoplasm of lung', 'Malignant neoplasm of ovary', 'Methods', 'Molecular', 'Molecular Profiling', 'Molecular Target', 'Monitor', 'Mus', 'Mutation', 'NF1 gene', 'Nerve', 'Nervous System Neoplasms', 'Neuroblastoma', 'Neurofibromatoses', 'Neurofibromatosis 1', 'Neurofibromatosis Type 1 Protein', 'Neurofibrosarcoma', 'Neurologic', 'Pathway interactions', 'Patients', 'Pharmaceutical Preparations', 'Pheochromocytoma', 'Plexiform Neurofibroma', 'Pre-Clinical Model', 'Property', 'RNA', 'Research', 'Research Personnel', 'Schwann Cells', 'Structure-Activity Relationship', 'Survival Rate', 'Testing', 'The Cancer Genome Atlas', 'The Jackson Laboratory', 'Therapeutic', 'Toxic effect', 'Tumor Suppressor Proteins', 'Uterine Cancer', 'Work', 'Xenograft Model', 'Xenograft procedure', 'Yeast Model System', 'Yeasts', 'base', 'cancer cell', 'cell growth', 'clinical efficacy', 'efficacy testing', 'improved', 'in vivo', 'innovation', 'interdisciplinary approach', 'killings', 'lifetime risk', 'malignant neurologic neoplasms', 'melanoma', 'mouse model', 'neoplastic cell', 'neuroblastoma cell', 'neurofibroma', 'new therapeutic target', 'novel', 'pre-clinical', 'progenitor', 'public health relevance', 'radioresistant', 'response', 'sarcoma', 'screening', 'small molecule', 'stem', 'success', 'targeted sequencing', 'targeted treatment', 'therapy design', 'tool', 'transcriptomics', 'tumor']",NINDS,DARTMOUTH COLLEGE,R01,2015,572285,0.04752969870502473
