text,title,id,project_number,terms,administration,organization,mechanism,year,funding,score
"Elective Induction of Labor and Pregnancy Outcomes DESCRIPTION (provided by investigator): Background and goals: Each year in the US, up to 490,000 pregnant women undergo elective induction, an intervention to bring on labor without a medical reason. Whether this causes risks to the woman or fetus is unclear. Only one recent clinical trial studied elective induction before 41 weeks of fetal gestation, and it found no difference in outcomes compared to letting the pregnancy continue (expectant management). Observational studies have found more cesarean delivery after induction, but most compared induction to spontaneous labor at the same gestational age, which is not the genuine clinical alternative. Instead, elective induction should be compared to the true alternative, expectant management. Most studies were too small to study uncommon but important outcomes, and none looked at whether risks differ by the mother's race/ethnicity or obesity. Our goal is to compare outcomes for elective induction at 38, 39 or 40 weeks' gestation versus expectant management, to help pregnant women and their providers make more informed decisions. Methods: A multiphase retrospective study of births from 2001 to 2011 will be conducted in two integrated health care systems. In Phase 1, the eligible population (206,000 singleton births) will be identified and classified by their apparent induction and outcome status based on electronic health plan and birth certificate data. In Phase 2, we will conduct 8000 brief medical record reviews to determine true exposure status (elective induction vs. expectant management). In Phase 3, we will review 3500 records in depth for true outcome status and risk factors. Phases 2 and 3 will oversample women with elective induction or rare outcomes, improving our power to address these specific aims: Aim 1: Compare the risk of the following outcomes after elective induction at 38, 39 or 40 weeks' gestation versus expectant management: cesarean delivery, postpartum hemorrhage, chorioamnionitis, neonatal intensive care unit stay, shoulder dystocia, low Apgar score, stillbirth, and neonatal death; and Aim 2: Examine how risks vary by the mother's race/ethnicity, parity, and pre-pregnancy obesity. Secondary analyses will develop an algorithm to more accurately identify elective inductions from electronic data. Impact: This research will compare elective labor induction at 38, 39 or 40 weeks' gestation to expectant management to provide new information about its risks or benefits for the mother and fetus. Our results could immediately affect clinical practice by helping women and providers make more informed choices together. They will also provide a solid foundation for practice guidelines and policy making. PUBLIC HEALTH RELEVANCE: Many pregnant women undergo elective induction (bringing on labor without a medical reason), but there is little good information about whether this is risk for the mother or fetus. Few studies have compared elective induction to the true alternative, letting the pregnancy continue, with birth at a later date; and it is not known whether risks diffe by the mother's race/ethnicity or obesity. The study would fill these critical knowledge gaps, and findings could immediately shape clinical practice.",Elective Induction of Labor and Pregnancy Outcomes,8887237,R01HD071986,"['Address', 'Affect', 'Algorithms', 'Apgar Score', 'Birth', 'Birth Certificates', 'California', 'Childbirth', 'Clinical', 'Clinical Trials', 'Computerized Medical Record', 'Data', 'Data Collection', 'Discipline of obstetrics', 'Dystocia', 'Electronics', 'Ethnic Origin', 'Event', 'Fetus', 'Foundations', 'Future', 'Gestational Age', 'Goals', 'Health', 'Health Planning', 'Health Services Research', 'Infant Health', 'Integrated Health Care Systems', 'Intensive Care Units', 'Intervention', 'Knowledge', 'Medical', 'Medical Records', 'Meta-Analysis', 'Methods', 'Mothers', 'Natural Language Processing', 'Neonatal', 'Neonatal Intensive Care Units', 'Obesity', 'Observational Study', 'Outcome', 'Phase', 'Physician&apos', 's Practice Patterns', 'Policy Making', 'Population', 'Population Heterogeneity', 'Postpartum Hemorrhage', 'Practice Guidelines', 'Pregnancy', 'Pregnancy Outcome', 'Pregnant Women', 'Provider', 'Race', 'Randomized Clinical Trials', 'Records', 'Research', 'Research Design', 'Research Personnel', 'Retrospective Studies', 'Risk', 'Risk Estimate', 'Risk Factors', 'Shapes', 'Shoulder', 'Solid', 'System', 'Uncertainty', 'Washington', 'Wing', 'Woman', 'adverse outcome', 'base', 'clinical practice', 'clinically relevant', 'design', 'electronic data', 'fetal', 'health care delivery', 'improved', 'intraamniotic infection', 'neonatal death', 'parity', 'pregnant', 'stillbirth', 'tool', 'trend']",NICHD,KAISER FOUNDATION HEALTH PLAN OF WASHINGTON,R01,2015,769163,0.031865322047894
"Genome analysis based on the integration of DNA sequence and shape  Title: Genome analysis based on the integration of DNA sequence and shape PI: Rohs, Remo (USC); Co-I: Noble, William Stafford (UW); Co-I: Tullius, Thomas D. (BU) PROJECT SUMMARY Current techniques for genome analysis are mainly based on the one-dimensional DNA sequence, comprised of the letters A, C, G, and T. However, proteins recognize DNA as a three-dimensional (3D) object. Nuances in DNA shape at single nucleotide resolution play a crucial role in the binding specificity of transcription factors (TFs), including those involved in embryonic development and human cancer. This project involves the development of a battery of tools for genome analysis, through the integration of information derived from the DNA sequence and the 3D structure of DNA, or ""DNA shape"". The basis for these novel tools is a high- throughput (HT) method for the prediction of multiple features of local DNA shape at the genomic scale. Data will be made available to the community in the UCSC Genome Browser track format through a web server interface. These tools will enable users to analyze the shape of any number or length of DNA sequences, including whole genomes and the effect of DNA methylation. HT shape predictions will be validated based on X-ray crystallography, NMR spectroscopy, and hydroxyl radical cleavage data. Predictions will be combined with ORChID, an ENCODE project that infers DNA minor groove geometry from hydroxyl radical cleavage experiments. The HT method will be used to study how paralogous TFs select different target sites in vivo despite sharing core-binding motifs or having similar binding properties in vitro. To study this question, we will investigate the effect of flanking sequences on multiple structural features of TF binding sites (TFBSs). The initial focus of this study will be homeodomains and basic helix-loop-helix (bHLH) TFs. Other protein families will later be included and used to construct a comprehensive TFBS database that provides shape features for binding motifs derived from JASPAR and other motif databases. Structural effects of single nucleotide polymorphisms (SNPs) will also be analyzed. Some SNPs are associated with deleterious functions, whereas others have no apparent effect. The HT shape prediction method will be used to predict the function of SNPs in non-coding regions based on DNA shape. We will correlate quantitative effects of SNPs on DNA structure with expression quantitative trait loci (eQTLs) and genome-wide association study (GWAS) signals, to develop a predictive tool for the functional effect of SNPs. The HT shape prediction approach will be used to design DNA sequences with different AT/GC contents but similar shapes. The relative contributions of sequence and shape to binding will be tested with analytic models including multiple linear regression (MLR) and support vector regression (SVR). For systems in which the integration of sequence and shape proves advantageous, novel motif finding tools will be developed based on an extended alphabet that combines sequence with informative structural features, selected by machine learning and feature selection approaches. Sequence+shape motifs will be tested by motif scanning, compared to sequence-only motifs, and integrated into the MEME Suite. The goal of this sequence-shape integration is to increase the accuracy of finding in vivo TFBSs in the genome. PUBLIC HEALTH RELEVANCE: Protein-DNA recognition is a critical yet poorly understood component of gene regulation. This proposal will connect the fields of DNA sequence and structure analysis, which so far have been developed in parallel but largely disconnected from each other. Integration of the one-dimensional DNA sequence at a genome-wide scale with the three-dimensional DNA structure at atomic resolution will lead to the development of novel genome analysis tools and will advance our understanding of genome function, leading to fundamentally new insights into the mechanisms of gene regulation and its impact on human disease.            ",Genome analysis based on the integration of DNA sequence and shape,8632246,R01GM106056,"['Affect', 'Affinity', 'Algorithms', 'BHLH Protein', 'Base Pairing', 'Base Sequence', 'Benchmarking', 'Binding', 'Binding Sites', 'Biological Process', 'ChIP-on-chip', 'ChIP-seq', 'Characteristics', 'Communities', 'Computational algorithm', 'DNA', 'DNA Binding', 'DNA Databases', 'DNA Methylation', 'DNA Sequence', 'DNA Structure', 'DNA-Binding Proteins', 'DNase-I Footprinting', 'Data', 'Data Analyses', 'Databases', 'Deoxyribonuclease I', 'Development', 'Drosophila genus', 'Embryonic Development', 'Family', 'Functional RNA', 'Gene Expression Regulation', 'Genetic Transcription', 'Genome', 'Genome Scan', 'Genomics', 'Geometry', 'Goals', 'Guanine + Cytosine Composition', 'Helix-Turn-Helix Motifs', 'Human', 'Hybrids', 'Hydroxyl Radical', 'In Vitro', 'Internet', 'Lead', 'Length', 'Letters', 'Linear Regressions', 'Machine Learning', 'Malignant Neoplasms', 'Measurement', 'Measures', 'Methods', 'Methylation', 'Mining', 'Minor Groove', 'Modeling', 'Molecular Biology', 'NMR Spectroscopy', 'Nucleotides', 'Pilot Projects', 'Play', 'Process', 'Property', 'Protein Binding', 'Protein Family', 'Proteins', 'Publishing', 'Quantitative Trait Loci', 'Relative (related person)', 'Resolution', 'Role', 'Scanning', 'Sequence Analysis', 'Shapes', 'Signal Transduction', 'Single Nucleotide Polymorphism', 'Site', 'Specificity', 'Structure', 'System', 'Techniques', 'Technology', 'Testing', 'Training', 'Validation', 'Variant', 'Width', 'X-Ray Crystallography', 'Yeasts', 'base', 'design', 'flexibility', 'genetic evolution', 'genome analysis', 'genome wide association study', 'genome-wide', 'homeodomain', 'human disease', 'in vivo', 'insight', 'member', 'novel', 'novel strategies', 'public health relevance', 'research study', 'three dimensional structure', 'tool', 'transcription factor', 'vector']",NIGMS,UNIVERSITY OF SOUTHERN CALIFORNIA,R01,2014,334303,0.03638376445377781
"CRCNS: Cytoskeletal Mechanisms of Dendrite Arbor Shape Development     DESCRIPTION (provided by applicant): Background: Dendritic arbor shape and functional properties emerge from the interaction of many complex developmental processes. It is now accepted that multiple local-level interactions of cytoskeleton elements direct the growth and development of the dendrite arbor. However, the specific mechanisms that control developmental acquisition of final functional dendritic properties are largely unknown. Addressing this fundamental question requires novel data driven systems-biology tools to study developmental and biophysical mechanisms in the same neuronal model. A tightly-knit collaboration between molecular genetics, quantitative morphometry, and mathematical simulation can for the first time enable large-scale studies capable of achieving holistic understanding of the mechanisms underlying emergent features of the arbor. Project Goals: The main neuroscientific goal of this project is to understand how multiple local interactions of cytoskeleton components during differentiation define mature dendritic arbor shape and its functional integrative properties, using Drosophila sensory neurons as a model. The technological goal of this project is to develop a novel investigative approach that integrates and extends previously separate approaches from developmental biology & genetics, in vivo confocal imaging & electrophysiology, computer vision, and neuroanatomical modeling. Specific Aims: We propose 3 tightly integrated specific aims. Aim 1: use genetic manipulations and electrophysiological recordings to model the role of cytoskeletal organization and dynamics as a fundamental determinant of emergent dendrite arbor shape and function. Aim 2: Implement advanced 4D multi-parameter imaging protocols and automated algorithms to reconstruct the arbor, and quantify spatial and temporal associations among multiple sub-cellular components. Aim 3: using automated reconstructions & measurements from aim 2, statistically characterize the structural and cytoskeletal features of dendrite arbors, and stochastically simulate the growth and electrotonic properties of anatomically realistic virtual neuronal analogues. The data from aim 3 will feed back novel hypotheses to be tested by a subsequent repetition of the (aim 1 - aim 2 - aim 3) cycle. Approach: We will focus on a single model system - Drosophila dendritic arborization (da) sensory neurons. More specifically, we will investigate class I and class IV da neuron arborization based upon their radically distinct dendritic morphologies (simple vs. complex) and underlying cytoskeletal organizations. We will make fusion constructs of cytoskeleton components with spectrally distinct fluorescent proteins. These will be used in transgenic Drosophila in order to quantitatively measure the distribution of F-actin, microtubules, and microtubule polarity within the dendrite arbor throughout its development in vivo using confocal multi-fluor imaging. The resulting images will be processed by automated quantitative computer vision algorithms that will accurately extract the topology of the dendritic arbor, and it changes over time. We will use the resulting maps in neuroanatomical stochastic simulations to establish the links between the emergent morphometrics of the dendrite and specific cytoskeleton features at various developmental stages. Intellectual Merit: From a neurogenetics perspective, this project will pioneer the use of cytoskeletal features as putative fundamental determinants in statistical neuroanatomical models. These determinants will be linked to morphological determinants. From a computational perspective, this project will advance the state of the art in automated algorithms for delineating neuroanatomy (and its morphological dynamics) by deploying core technologies for large-scale multi-parameter studies, and result in an effective interfacing of automated reconstruction and simulation technologies. With this innovation, model predictions can be tested by molecular biological techniques, and findings of statistical models can be used to inform molecular models of dendrite arbor development. Educational Impact: This project will result in a cross-disciplinary training of post-doctoral fellows, graduate students, undergraduate students and high school interns. It will result in practical insight on ways to conduct cutting-edge systems-level scientific research overcoming disciplinary boundaries and using best-available collaborative tools. The trainees from this program will be uniquely positioned to develop the broader field of imaging-driven integrative systems neurobiology. It will expose minority and K-12 students to a new world of trans-disciplinary research that is indicative of the future. Broader Impacts: The combined body of molecular, imaging, and computational tools and datasets from this research will be disseminated widely, and made available to a broad class of investigators for adoption in the study of other major neuroscience problems. This project will serve as a new model for computationally enabled neuroscience research that achieves a long-desired synergy between the wet lab and computation.             n/a",CRCNS: Cytoskeletal Mechanisms of Dendrite Arbor Shape Development,8697162,R01NS086082,"['Address', 'Adoption', 'Affect', 'Afferent Neurons', 'Algorithms', 'Anatomic Models', 'Back', 'Biological', 'Biological Models', 'Biophysical Process', 'Characteristics', 'Coal', 'Collaborations', 'Collection', 'Complex', 'Computer Simulation', 'Computer Vision Systems', 'Computer software', 'Confocal Microscopy', 'Cytoskeletal Modeling', 'Cytoskeleton', 'Data', 'Data Set', 'Dendrites', 'Development', 'Developmental Biology', 'Developmental Process', 'Discipline', 'Drosophila genus', 'Drosophila melanogaster', 'Electrophysiology (science)', 'Elements', 'F-Actin', 'Future', 'Goals', 'Growth', 'Growth and Development function', 'Image', 'Knowledge', 'Link', 'Maps', 'Measurement', 'Measures', 'Microtubules', 'Minority', 'Modeling', 'Molecular', 'Molecular Biology', 'Molecular Genetics', 'Molecular Models', 'Morphology', 'Nervous system structure', 'Neurites', 'Neuroanatomy', 'Neurobiology', 'Neurons', 'Neurosciences', 'Neurosciences Research', 'Positioning Attribute', 'Principal Investigator', 'Process', 'Property', 'Proteins', 'Protocols documentation', 'Research', 'Research Personnel', 'Resources', 'Role', 'Series', 'Shapes', 'Signal Transduction', 'Simulate', 'Staging', 'Statistical Models', 'Structure', 'Students', 'Synapses', 'System', 'Systems Biology', 'Techniques', 'Technology', 'Testing', 'Time', 'Transgenic Organisms', 'Trees', 'analog', 'base', 'computerized tools', 'data sharing', 'developmental genetics', 'developmental neurobiology', 'digital', 'feeding', 'genetic manipulation', 'graduate student', 'high school', 'in vivo', 'innovation', 'insight', 'molecular imaging', 'molecular modeling', 'morphometry', 'neurogenetics', 'next generation', 'novel', 'open source', 'post-doctoral training', 'programs', 'reconstruction', 'relating to nervous system', 'research study', 'role model', 'simulation', 'tool', 'undergraduate student', 'virtual']",NINDS,GEORGIA STATE UNIVERSITY,R01,2014,333533,0.032408700502213436
"Neural Basis of Shape from Texture     DESCRIPTION (provided by applicant): People often need to judge the shapes and movements of 3-D objects from a distance. Images on the retinae are 2-D, but pattern and motion information contain cues about 3-D shapes. Building on our previous work we expect to make significant progress in understanding 3-D shape perception from these cues, and thus offer a prototype for how the brain extracts information from the world to infer environmental properties. When surfaces have texture patterns, deformations of these patterns in retinal images provide clues for the brain to judge 3-D shape. When signals from the eyes reach the first cortical area V1, they are processed by neurons that are selectively tuned to orientations and spatial frequencies. We parsed texture deformations into orientation flows and spatial frequency gradients, to show that particular orientation flows evoke percepts of specific 3-D shapes, whereas frequency gradients provide cues to relative depth. These results led to models of how later cortical neurons could extract texture patterns and signal 3-D shapes. We now propose to extend our approach beyond static objects. When objects change shape (e.g. by bending, coiling, or contracting) as they move (e.g. walk, tumble, crawl, hop, slide, or swim), changes in the retinal image create patterns of local velocities that provide additional cues to 3-D shape. Since any retinal image can result from projections of many different 3-D objects, the brain relies on prior assumptions to infer the correct shape. Previous studies have only looked at rigid objects and used shape inference models based either on the brain assuming that the object is rigid or that faster points are nearer. We will use novel stimuli that put these prior assumptions in conflict, and thus examine how the brain potentiates a prior. This section will culminate in a model for choosing between conflicting assumptions, something that is often required in perception and cognition. Next, we will use randomly deforming non-rigid 3-D waves to examine how global shape properties, e.g. symmetry, influence perceived object motions by selectively combining disparate outputs of motion sensitive neurons. These results will unveil interactions between the form and motion cortical systems. Finally, we will examine observers' percepts of dynamic shape changes that require more sophisticated analyses of retinal velocity patterns. Neurons in the motion sensitive cortical area MT respond to 1-D motion shear and compression/divergence, so we will extract these qualities and combine them into 2-D velocity patterns of divergence, rotation, and deformation. Neural filters formed by these patterns will be used to explain perceived changes in 3-D shapes. We will base our filters on responses of MT and later cortical neurons to our stimuli, measured in a parallel project. We will thus present the first neural model that can explain observers' percepts of both rigid and non-rigid textured objects. The performance of our model will be compared against the best computer-vision models on motion-capture data from real deforming objects. We expect this project to introduce new ideas, methods and results for understanding visual perception of 3-D shapes and its deficits in neurological patients.          Shape is probably the most important cue for recognizing objects, so neurological disorders related to shape- perception would severely impair the ability of such patients to function autonomously. This project will identify how the brain constructs correct and incorrect shape percepts of 3-D objects from texture and motion information. In addition, people with amblyopia, strabismus and convergence-insufficiency often have deficient stereo vision, so they find texture and motion information to be particularly useful in perceiving 3-D shapes, hence our work on separating velocity information into object motion, object shape, and shape deformation may be particularly useful to these people.                ",Neural Basis of Shape from Texture,8658075,R01EY013312,"['3-Dimensional', 'Amblyopia', 'Attention', 'Bayesian Analysis', 'Biological', 'Brain', 'Cognition', 'Complex', 'Computer Simulation', 'Computer Vision Systems', 'Conflict (Psychology)', 'Contracts', 'Convergence Insufficiency', 'Cues', 'Data', 'Development', 'Discrimination', 'Eye', 'Eye Movements', 'Frequencies', 'Geometry', 'Head Movements', 'Image', 'Learning', 'Light', 'Measurement', 'Measures', 'Methods', 'Modeling', 'Motion', 'Movement', 'Neurologic', 'Neurons', 'Output', 'Patients', 'Pattern', 'Perception', 'Performance', 'Process', 'Property', 'Psychophysics', 'Relative (related person)', 'Resolution', 'Retina', 'Retinal', 'Rotation', 'Shapes', 'Signal Transduction', 'Simulate', 'Slide', 'Space Perception', 'Staging', 'Stimulus', 'Strabismus', 'Stream', 'Surface', 'Swimming', 'System', 'Testing', 'Texture', 'Translating', 'Variant', 'Vision', 'Visual', 'Visual Perception', 'Walking', 'Work', 'analog', 'area MT', 'area V1', 'base', 'design', 'movie', 'nervous system disorder', 'neural model', 'novel', 'object motion', 'object shape', 'prototype', 'relating to nervous system', 'research study', 'response', 'sample fixation']",NEI,STATE COLLEGE OF OPTOMETRY,R01,2014,354693,0.08289728948714321
