text,title,id,project_number,terms,administration,organization,mechanism,year,funding,score
"Role of Inflammatory Processes in Reward Network Alterations in Obesity ﻿    DESCRIPTION (provided by applicant): The main theme of this proposal is the identification of brain signatures associated with hedonic eating behaviors (HEB) and the role of inflammatory mediators in shaping these brain signatures. I will also evaluate the feasibility of using a targeted intervention (Cognitive Behavioral Therapy [CBT]) to counteract the hypothesized alterations within the extended reward network in this subgroup of obese subjects. This area of study is significant because increases in the hedonic component of food intake, which are no longer driven by homeostatic needs, are likely to play an important pathophysiological role in some obese individuals, but the mechanisms that bias the brain towards this alteration in ingestive behavior are incompletely understood. Here I will use inflammatory gene expression profiles to show that adverse experiences alter brain signatures within the extended reward network through the process of neuroinflammation. The proposal begins by characterizing brain signatures related to HEB. Then gene expression profiles as measured by peripheral blood mononuclear cells and plasma cytokines are identified and correlated with brain signatures and HEB. CBT will be used to investigate the therapeutic effect linked to strengthening inhibitory influences of prefrontal regions within the extended reward network, and reducing increased sympathetic nervous system modulation of the immune system, thereby offering a cost effective way of counteracting HEB. Advanced and sophisticated multivariate analytic techniques will be used to integrate the data from multiple neuroimaging sources, gene profiles, and behavioral data in order to determine the unique variance of adverse environmental factors in determining signatures associated with HEB. This may serve as a sensitive measure of central biomarkers in obesity related to HEB. A model that accounts for sex and race differences will increase the validity of the model, and will help identify disadvantaged groups who are at increased risk for obesity associated with HEB. I have a background in psychology and seek the following training goals from this award: (1) knowledge in the pathophysiology of obesity; (2) genomic analysis techniques including bioinformatics techniques; (3) knowledge and expertise in metabolomics data analysis; (4) specific expertise in diffusion tensor MRI analysis; (5) advanced data driven multivariate techniques using topological network and system biological analytical techniques (e.g. cluster and classification analysis); and (6) expertise in applying behavioral therapy to obesity. The work environment at the Center for Neurobiology of Stress provides an excellent infrastructure for training in neuro-genetic investigations of obesity. I will attend courses, workshops, and meetings in order to obtain a comprehensive understanding of the underlying biological sequelae of obesity. Regular individual and group meetings with mentors (Mayer [primary], Pisegna, Li, Cole, Labus, Naliboff [co-mentors]) have been set up. I plan to apply for a R03 grant by Year 3 and a R01 grant by Year 5. Long term, I plan to establish an independent research career in brain-gut interactions associated with health disparities in obesity. PUBLIC HEALTH RELEVANCE    With obesity becoming a major health epidemic in the United States, and with concerns being raised about the validity and effectiveness of obesity treatments, this project investigates increases in the hedonic related food addiction component of food intake which are no longer driven by homeostatic needs, and are thus likely to play an important pathophysiological role in some obese individuals. In order for effective and personalized obesity treatments to be developed for hedonic ingestion, this project addresses a comprehensive biopsychosocial bidirectional brain-immune mechanistic model that characterizes the influence of adverse environment factors on prefrontal inhibitory control of brain signatures in the extended reward network, while accounting for sex and race differences. Using advanced automated and mathematical analytic techniques allows to integrate information from multimodal neuroimaging data and metadata sets (genomics, clinical behaviors, psychosocial environmental factors), in order to provide a powerful and sensitive biomarker that will increase biological readouts of hedonic eating behaviors and thus bring to the forefront those disadvantaged groups and individuals who are at increased risk for this type of obesity",Role of Inflammatory Processes in Reward Network Alterations in Obesity,9265841,K23DK106528,"['Accounting', 'Address', 'Adjuvant Therapy', 'Adult', 'Adverse event', 'Algorithms', 'American', 'Amygdaloid structure', 'Anatomy', 'Anterior', 'Anti-Inflammatory Agents', 'Anti-inflammatory', 'Area', 'Award', 'Behavior', 'Behavior Therapy', 'Behavioral', 'Bioinformatics', 'Biological', 'Biological Markers', 'Brain', 'Brain region', 'Cardiovascular Diseases', 'Classification', 'Clinical', 'Clinical Data', 'Cognitive Therapy', 'Data', 'Data Analyses', 'Development', 'Diet', 'Diffusion', 'Disadvantaged', 'Disease', 'Eating', 'Eating Behavior', 'Educational workshop', 'Effectiveness', 'Emotions', 'Environment', 'Environmental Risk Factor', 'Epidemic', 'Feeding behaviors', 'Food Intake Regulation', 'Functional disorder', 'Gene Expression', 'Genes', 'Genetic', 'Genomics', 'Goals', 'Grant', 'Group Meetings', 'Health', 'Hypothalamic structure', 'Immune', 'Immune system', 'Individual', 'Inflammation Mediators', 'Inflammatory', 'Ingestion', 'Insula of Reil', 'Intervention', 'Investigation', 'Knowledge', 'Life Style', 'Link', 'Machine Learning', 'Magnetic Resonance Imaging', 'Mathematics', 'Measures', 'Mentors', 'Metadata', 'Modeling', 'Modification', 'Molecular', 'Molecular Profiling', 'Neurobiology', 'Neuronal Plasticity', 'Nucleus Accumbens', 'Obesity', 'Operative Surgical Procedures', 'Pathway interactions', 'Patients', 'Peripheral', 'Peripheral Blood Mononuclear Cell', 'Pharmacological Treatment', 'Plasma', 'Play', 'Process', 'Property', 'Psychology', 'Race', 'Research', 'Resistance', 'Rest', 'Rewards', 'Risk', 'Role', 'Satiation', 'Sex Characteristics', 'Signal Transduction', 'Socioeconomic Status', 'Source', 'Stress', 'Structure', 'Subgroup', 'Substance abuse problem', 'Sympathetic Nervous System', 'Techniques', 'Testing', 'Therapeutic Effect', 'Thinness', 'Training', 'Training and Infrastructure', 'Transcriptional Regulation', 'United States', 'Up-Regulation', 'Weight', 'addiction', 'bariatric surgery', 'base', 'behavior measurement', 'biological systems', 'biopsychosocial', 'brain shape', 'career', 'collaborative environment', 'cost effective', 'cytokine', 'emotion regulation', 'emotional eating', 'food addiction', 'food craving', 'global health', 'health disparity', 'hedonic', 'immunoregulation', 'indexing', 'meetings', 'metabolomics', 'mind control', 'multimodality', 'neurobiological mechanism', 'neuroimaging', 'neuroinflammation', 'obesity risk', 'obesity treatment', 'psychosocial', 'public health relevance', 'racial difference', 'social']",NIDDK,UNIVERSITY OF CALIFORNIA LOS ANGELES,K23,2017,202512,0.05743519640419894
"Genome Wide Association Study for Childhood Obesity DESCRIPTION (provided by applicant): Obesity is a major risk factor for type 2 diabetes, which in turn has serious complications including accelerated development of cardiovascular disease. The prevalence of obesity in children and adults in the United States has increased by more than 30% over the past decade.  We previously successfully argued in our application for the R01 HD056465 award that distillation of the genetic component in this complex phenotype should thus be easier to determine in children, where environmental exposure and impact has been for a relatively short period of their lifetime; indeed the resulting work did pan out to be successful in this regard. We carried out a non-hypothesis-driven study that was directed at uncovering genes and genetic variants that predispose to childhood obesity by conducting a genome-wide association study (GWAS) using a high density tag-SNP array. Employing a powered two-stage study design in a consortium setting, where cases were defined as being in the e95th percentile of BMI, we identified novel association signals which we subsequently replicated. This NICHD funded study was ultimately published in Nature Genetics (with the PI as senior author) and received widespread press attention, including with CNN, Time and the front page of USA Today.  The Children's Hospital of Philadelphia is now poised to determine additional genetic factors conferring risk to the pathogenesis of childhood obesity through the leveraging of new ultra-high-throughput sequencing technology, and also allow for fine-mapping of the already uncovered loci to determine the actual causal mechanism of action. Combining our accurately phenotyped cohort, which represents the largest pediatric obesity DNA collection in the world, with access to familial childhood obesity, availability of existing genome wide singl nucleotide polymorphism genotypes and the application of whole exome sequencing, this renewal application of R01 HD056465 proposes to broaden the list of novel genetic loci that are associated with this trait in order to get further insights in to the genetic etiology of common pediatric obesity.  We are well positioned to extend our knowledge of the genetic etiology of childhood obesity. It is unclear if these additional variants are common in the population, a set o private mutations in families or a mixture of both. Irrespective of the nature of the variant(s) we are well positioned to look for both types of event, with common variants detectable through leveraging the GWAS dataset of well powered cohorts and private mutations detectable through whole exome sequencing of many multi-case pedigrees. This represents a major follow-up to the Principal Investigator's original grant application and this renewal will allow for adding extr value to the already substantial findings made funded by the original grant. PUBLIC HEALTH RELEVANCE: The prevalence of obesity in children and adults in the United States has increased by more than 30% over the past decade. We are seeking to renew R01 HD056465 to expand on the successful findings made previously and to further characterize the genetic etiology of childhood obesity and pediatric BMI trajectory. Combining our recruited accurately phenotyped and largest pediatric obesity cohort in the world, access to familial childhood obesity, availability of existing genome wide single nucleotide polymorphism genotypes and the application of whole exome sequencing, this renewal proposes to broaden the list of novel genetic loci that are associated with this trait.",Genome Wide Association Study for Childhood Obesity,9294850,R01HD056465,"['Adult', 'Applications Grants', 'Attention', 'Award', 'Body mass index', 'Cardiovascular Diseases', 'Child', 'Childhood', 'Collection', 'Complex', 'Copy Number Polymorphism', 'DNA', 'Data Set', 'Development', 'Disease', 'Environmental Exposure', 'Environmental Impact', 'Event', 'Family', 'Family member', 'Funding', 'Genetic', 'Genetic Polymorphism', 'Genetic Predisposition to Disease', 'Genotype', 'Grant', 'High-Throughput Nucleotide Sequencing', 'Knowledge', 'Maps', 'Mutation', 'National Institute of Child Health and Human Development', 'Nature', 'Non-Insulin-Dependent Diabetes Mellitus', 'Normal Statistical Distribution', 'Nucleotides', 'Obesity', 'Pathogenesis', 'Pediatric Hospitals', 'Phenotype', 'Philadelphia', 'Population', 'Positioning Attribute', 'Prevalence', 'Principal Investigator', 'Privatization', 'Publishing', 'Recruitment Activity', 'Research Design', 'Risk', 'Risk Factors', 'Role', 'SNP array', 'Sampling', 'Signal Transduction', 'Single Nucleotide Polymorphism', 'Technology', 'Time', 'United States', 'Variant', 'Weight', 'Work', 'cohort', 'density', 'exome sequencing', 'follow-up', 'genetic pedigree', 'genetic variant', 'genome wide association study', 'genome-wide', 'insight', 'longitudinal analysis', 'novel', 'obesity in children', 'public health relevance', 'rare variant', 'risk variant', 'targeted sequencing', 'trait']",NICHD,CHILDREN'S HOSP OF PHILADELPHIA,R01,2017,655087,0.05033502759952552
"Optical Body Composition and Health Assessment ﻿    DESCRIPTION (provided by applicant):1 Of all markers of human health, the most intuitive is body shape but based on quantitative evidence.  2 Anthropometry and regional composition measures such as waist circumference (WC), waist to hip ratio  3 (WHR), and visceral adipose tissue area (VAT) are better predictors of obesity-related diseases and mortality  4 risk than body mass index (BMI). Dual-energy X-ray absorptiometry (DXA) can quantify regional adiposity in  5 more detail than the above measures but is underutilized for many reasons including potential harm from  6 ionizing radiation, cost, and training. A study is needed to take advantage of rapid technological developments  7 in the ""quantified self movement"" to better describe phenotypes of body shape and its relation to metabolic  8 risks. The candidate developed in this proposal is 3D optical whole body scanning. If successful, sophisticated  9 obesity phenotype profiles could be constructed to clarify the underlying associations of body composition with 10 disease, genetics, lifestyle exposures, metabolomics, and be highly assessable using self-assessment 11 technology. Whole body 3D imaging technology is already so accessible that it can be done with video games 12 such as the Microsoft Xbox Kinect, and consumer cameras. 13 The long term goal of the Optical Body Shape and Health Assessment Study is 1) to provide phenotype 14 descriptors of health using body shape, and 2) to provide the tools to visualize and quantify body shape in 15 research, clinical practice, and personal health assessment. Our overall approach is to first derive predictive 16 models of how body shape relates to regional and total body composition (subcutaneous fat, visceral fat, 17 muscle mass, lean mass, and percent fat), and then show how our 3DO body composition estimates are 18 associated to important metabolic risk factors. Our central hypothesis is that 3DO measures of body 19 composition with shape classification better predict metabolic risk factors than anthropometry or DXA body 20 composition alone. Our specific aims are: 1. Identify the unique associations of body shape to body 21 composition indices in a population that represents the variance of sex, age, BMI, and ethnicity found 22 in the US population; 2. Describe the precision and accuracy of 3DO scans to monitor change in body 23 composition and metabolic health interventions; and 3. Estimate the level of association of 3DO to 24 common health indicators including metabolic risk factors by gender, race, age, and BMI. In an 25 exploratory aim, we investigate holistic, high-resolution descriptors of 3D body shape as direct 26 predictors of body composition and metabolic risk using statistical shape models and Latent Class 27 Analysis. By the end of this study, we expect to have models of the shape and composition suitable for self- 28 assessment technologies that are capable of representing over 95% of the shape variance in the US 29 population, and how these models relate to important metabolic status and body composition. The positive 30 impact will be the immediate applicability to clinicians and individuals for personalized risk assessment. PUBLIC HEALTH RELEVANCE: The proposed research is relevant to public health because they have the potential to provide a better understanding of who is at high risk of metabolic diseases because of a poor metabolic profile. Thus, the advances proposed are expected to have a high impact to the health and wellbeing of all US citizens because metabolic diseases, such as obesity and its complications, are currently the number one killers of adults. This is relevant to the part of NIH's mission which focuses on the prevention of disease by supporting research in the diagnosis of human diseases.",Optical Body Composition and Health Assessment,9273519,R01DK109008,"['Adipose tissue', 'Adult', 'Age', 'Animals', 'Anorexia Nervosa', 'Anthropometry', 'Area', 'Blood Pressure', 'Body Composition', 'Body Weight decreased', 'Body mass index', 'Body measure procedure', 'Classification', 'Computer Vision Systems', 'Data', 'Descriptor', 'Development', 'Devices', 'Diabetes Mellitus', 'Diagnosis', 'Disease', 'Dual-Energy X-Ray Absorptiometry', 'Ethnic Origin', 'Fatty acid glycerol esters', 'Gender', 'Genetic', 'Glucose', 'Goals', 'Health', 'High Density Lipoprotein Cholesterol', 'Human', 'Image', 'Imaging technology', 'Individual', 'Insulin Resistance', 'International', 'Intervention', 'Intuition', 'Ionizing radiation', 'Life Style', 'Measures', 'Medical Imaging', 'Metabolic', 'Metabolic Diseases', 'Methodology', 'Mission', 'Modeling', 'Monitor', 'Movement', 'National Health and Nutrition Examination Survey', 'Obesity', 'Obesity associated disease', 'Optics', 'Outcome', 'Phenotype', 'Population', 'Public Health', 'Race', 'Research', 'Research Personnel', 'Research Support', 'Resolution', 'Risk', 'Risk Assessment', 'Risk Factors', 'Sampling', 'Scanning', 'Self Assessment', 'Shapes', 'Technology', 'Technology Assessment', 'Thinness', 'Three-Dimensional Imaging', 'Training', 'Triglycerides', 'United States National Institutes of Health', 'Video Games', 'Visceral', 'Waist-Hip Ratio', 'bariatric surgery', 'base', 'clinical practice', 'cost', 'disorder prevention', 'high risk', 'human disease', 'indexing', 'insulin sensitivity', 'metabolic profile', 'metabolomics', 'mortality', 'muscle form', 'optical imaging', 'predictive modeling', 'public health relevance', 'sensor', 'sex', 'subcutaneous', 'tool', 'waist circumference', 'whole body imaging']",NIDDK,"UNIVERSITY OF CALIFORNIA, SAN FRANCISCO",R01,2017,651796,0.1631640120534018
"Shape up! Kids Project Summary/Abstract Of all markers of pediatric health, the most intuitive is body shape. Human and animal studies indicate that weight loss/gain correlates closely with increasing/decreasing insulin sensitivity, respectively. Anthropometry and regional composition measures such as waist circumference, waist to hip ratio (WHR), and visceral adipose tissue area are better predictors of obesity-related diseases and mortality risk than pediatric body mass index Z-score. Dual-energy X-ray absorptiometry can quantify regional adiposity in more detail than these measures but is underutilized for many reasons including the sensitivity to children to ionizing radiation, cost, and training. A study is needed to take advantage of rapid technological developments in optical technology to better describe phenotypes of pediatric body shape and its relation to metabolic risks (obesity, “failure to thrive”) and bone density and size. If successful, sophisticated obesity phenotype profiles could be constructed to clarify the underlying associations of body composition with disease, genetics, lifestyle exposures, metabolomics, and be highly assessable using self-assessment technology. The long term goal of the Shape Up! Kids Study is 1) to provide pediatric phenotype descriptors of health using body shape, and 2) to provide the tools to visualize and quantify body shape in research, clinical practice, and personal health assessment. Our overall approach is to first derive predictive models of how body shape relates to regional and total body composition (subcutaneous fat, visceral fat, muscle mass, lean mass, and percent fat) and bone mineral density (BMD) over a wide range of ages (5 to 18 years), weights and heights, stratified by sex, and ethnicity. Our central hypothesis is that optical estimates with shape classification of soft tissue composition and bone density better predict fracture and metabolic risk factors than anthropometry (WC, WHR, and BM) alone. The Investigators will highly leverage existing data from the National Health and Nutrition Examination Survey and Bone Mineral Density in Children Study. Our specific aims are: 1) Identify the unique associations of body shape to body composition and bone density indices in a pediatric population that represents the variance found in the US population, 2) Describe the precision and accuracy of optical scans to monitor change in body composition, bone density, 3) Estimate the level of association of optical scans to common health indicators including metabolic risk factors. Our exploratory aim is to investigate holistic, high-resolution descriptors of 3D body shape as direct predictors of body composition and metabolic risk using statistical shape models and Latent Class Analysis. By the end of this study, we expect to have models of the shape and composition suitable for self-assessment technologies that are capable of representing over 95% of the shape variance in the US pediatric population, and to define how these models relate to important metabolic status indicators. The positive impact of these outcomes will be the immediate applicability to other researcher studies and clinicians using the automated tools and models developed here for 3D optical images. PROJECT NARRATIVE  The proposed research is relevant to public health because they have the potential to provide a better understanding of what children are at high risk of metabolic consequences of obesity. Thus, the advances proposed are expected to have a high impact to the health and wellbeing of all US citizens because metabolic diseases, such as obesity and its complications, are currently the number one killers of adults, and are becoming epidemic in children as well. This is relevant to the part of NIH's mission which focuses on the prevention of disease by supporting research in the diagnosis of human diseases.",Shape up! Kids,9220287,R01DK111698,"['Adipose tissue', 'Adult', 'Age', 'Algorithms', 'Animals', 'Anthropometry', 'Area', 'Blood Pressure', 'Body Composition', 'Body Surface', 'Body Weight decreased', 'Body mass index', 'Body measure procedure', 'Bone Density', 'Child', 'Childhood', 'Classification', 'Clinical', 'Computer Vision Systems', 'Data', 'Descriptor', 'Development', 'Diabetes Mellitus', 'Diagnosis', 'Disease', 'Dual-Energy X-Ray Absorptiometry', 'Epidemic', 'Epidemiology', 'Ethnic Origin', 'Failure to Thrive', 'Fatty acid glycerol esters', 'Fracture', 'Gender', 'Genetic', 'Glucose', 'Goals', 'Health', 'High Density Lipoprotein Cholesterol', 'Human', 'Image', 'Imaging technology', 'Insulin Resistance', 'International', 'Intervention', 'Intuition', 'Ionizing radiation', 'Life Style', 'Liver', 'Measures', 'Medical Imaging', 'Metabolic', 'Metabolic Diseases', 'Methodology', 'Mission', 'Modeling', 'Monitor', 'Movement', 'Muscle', 'National Health and Nutrition Examination Survey', 'Obesity', 'Obesity associated disease', 'Optics', 'Outcome', 'Pediatric Radiology', 'Phenotype', 'Population', 'Public Health', 'Race', 'Research', 'Research Personnel', 'Research Support', 'Resolution', 'Risk', 'Risk Factors', 'Safety', 'Scanning', 'Self Assessment', 'Shapes', 'Technology', 'Technology Assessment', 'Thinness', 'Three-Dimensional Imaging', 'Training', 'Triglycerides', 'United States National Institutes of Health', 'Visceral', 'Waist-Hip Ratio', 'Weight', 'bone', 'clinical practice', 'cost', 'disorder prevention', 'handheld mobile device', 'high risk', 'human disease', 'indexing', 'insulin sensitivity', 'metabolomics', 'mortality', 'muscle form', 'optical imaging', 'predictive modeling', 'sensor', 'sex', 'soft tissue', 'subcutaneous', 'tool', 'waist circumference']",NIDDK,"UNIVERSITY OF CALIFORNIA, SAN FRANCISCO",R01,2017,703842,0.16493056040958232
