text,title,id,project_number,terms,administration,organization,mechanism,year,funding,score
"Yale SPORE in Skin Cancer DESCRIPTION (provided by applicant): The Yale SPORE in Skin Cancer program is focused on two skin cancers, basal cell carcinoma (BCC) and melanoma. The goals are to conduct epidemiologic and genetic studies on early onset basal cell carcinoma (Project 1), establish novel high-throughput prognostic and diagnostic tools for melanomas (Projects 2 and 4), and introduce novel targeted therapies to treat melanoma (Projects 2 and 3). The new approaches include genome-wide monitoring of melanoma tumor responses to epigenetic modifiers (Project 2); the use of high-density protein microarrays (ProtoArrays) to interrogate serological responses in sera from melanoma patients (Project 4); and novel epigenetic modifier and immune modulation therapy for melanoma (Projects 2 and 3, respectively). The SPORE includes Administration, Specimen Resource and Bioinformatics/Biostatistics Cores to support the studies of SPORE investigators. Developmental Research and Career Development Award Programs are proposed. The Yale SPORE in Skin Cancer will be an integral part of the Yale Comprehensive Cancer Center (YCCC), Yale New Haven Hospital, and the Dermatology, Pathology and Epidemiology/Public Health Departments that collectively will provide the patient populations, specimens and other resources and support systems needed for the SPORE activities. There is a full commitment from the Dean of Yale School of Medicine and the Director of the YCCC/Chairman of Dermatology to support the SPORE with a plan for cost sharing. The major Translational Results expected are: a) Guidelines for preventive interventions aimed at reducing the incidence of early and total BCC that will diminish the management costs of the most common skin cancer; b) The introduction of new molecular tools for assessing responses to novel epigenetic modifiers; c) The introduction of new ways of assessing melanoma patients employing serological markers; d) The application of new approaches to personalize melanoma chemo- and immunotherapy; e) The establishment of a composite databases for skin cancers that includes specimens tracking, clinical information, high throughput proteomics and genomics. The database program will be compatible with caBIG and will be available on the web for the benefit of the wider community of investigators and clinicians; f) The creation of new translational bioinformatics tools (predictive statistics and artificial intelligence) required to analyze global and highly complex information derived from different sources and different platforms. n/a",Yale SPORE in Skin Cancer,7664628,P50CA121974,[' '],NCI,YALE UNIVERSITY,P50,2009,2233298,0.03370932367084607
"Genotype and phenotype predictors in therapy response in renal cell carcinoma     DESCRIPTION (provided by applicant): Therapy of renal cell carcinoma (RCC) has been transformed in recent years by the efficacy of targeted agents that inhibit kinases involved in critical cellular signaling pathways and VEGF, a primary driver of tumor angiogenesis. However, patient response to these therapeutics is highly variable and currently cannot be predicted based on clinical or pathological data or available laboratory/genetic testing. The goal of this proposal is to develop predictors of therapeutic response for patients with the most common subtype of RCC, clear cell (ccRCC), based on novel tests. Our approach is based primarily on the hypothesis that the targeted agents used in ccRCC therapy - bevacizumab, sunitinib and sorafenib - inhibit tumor vessel activation and that the activation status and stability of tumor vessels are major determinants of response. We also hypothesize that the phenotype of ccRCC tumor vessels is linked to the molecular pathobiology of the tumor cells. In particular, as these drugs also can inhibit tumor cell signaling and modulate their behavior, ccRCC tumor cell signaling, HIF-1/HIF-2 (hypoxia-inducible factor) expression and VHL function are potential determinants of response. To examine parameters of vascular phenotype, tumor cell phenotype and VHL genotype as predictors of response to therapy, ccRCC specimens will undergo multiplex immunostaining for the appropriate biomarker antigens and be analyzed by a novel computer-assisted image analysis system that objectively quantifies analyte staining on a cellular (cytometric) basis as well as by traditional pixel-based analysis. These studies will be performed on tumors of ccRCC patients treated with single-agent bevacizumab, sunitinib or sorafenib in ongoing multi-institutional phase II (ECOG2804) and phase III (ECOG2805) clinical trials, using tumor blocks from a subset of 90, 170 and 170 appropriate ccRCC patients for therapy with the respective drugs. The specific aims of this proposal are (Aim 1) to analyze the vascular and endothelial cell activation phenotype and vessel pericyte coverage in ccRCC tumors; (Aim 2) to analyze tumor cell signaling, HIF phenotype and VHL genotype in ccRCC tumors; and (Aim 3) to correlate parameters quantified in the prior aims for relationships to each other, to therapeutic outcome and to develop parsimonious predictive models of therapeutic response using biostatistical and bioinformatics approaches. The results of these studies should allow identification of the most appropriate drugs for treating individual patients with ccRCC and assist in the rational development of second-line and combination drug therapies. Beyond ccRCC, the targeted agents under study are used in the therapy of an ever expanding number of cancers, and the response predictors developed for ccRCC, where these agents are best studied because they are used as single-agents, may be useful for predicting response of these other cancers to combination therapy incorporating the targeted agents. PUBLIC HEALTH RELEVANCE: Novel targeted cancer therapy agents have shown success in the treatment of kidney cancer (renal cell carcinoma), a cancer that is increasing in incidence and newly diagnosed in over 50,000 Americans a year. Studies in this project will characterize the tumor blood vessel characteristics and genetic defect of renal cell carcinomas and correlate them with therapeutic response to identify factors that can predict whether they will respond to treatment. Discovering features of kidney cancer that predict therapeutic response can then be used to stratify patients to different therapies in the future   and will provide lessons that are likely to be applicable to many other cancers being treated with the same novel drugs.           Novel targeted cancer therapy agents have shown success in the treatment of kidney cancer (renal cell carcinoma), a cancer that is increasing in incidence and newly diagnosed in over 50,000 Americans a year. Studies in this project will characterize the tumor blood vessel characteristics and genetic defect of renal cell carcinomas and correlate them with therapeutic response to identify factors that can predict whether they will respond to treatment. Discovering features of kidney cancer that predict therapeutic response can then be used to stratify patients to different therapies in the future and will provide lessons that are likely to be applicable to many other cancers being treated with the same novel drugs.",Genotype and phenotype predictors in therapy response in renal cell carcinoma,7662800,R01CA135509,"['Address', 'Algorithms', 'American', 'Angiogenesis Inhibitors', 'Angiogenesis Promoter', 'Antigens', 'Apoptosis', 'BAY 54-9085', 'Behavior', 'Bioinformatics', 'Biological', 'Biological Markers', 'Blood Vessels', 'Cell Proliferation', 'Cells', 'Characteristics', 'Clear Cell', 'Cleaved cell', 'Clinical', 'Clinical Trials', 'Clinical Trials Cooperative Group', 'Combination Drug Therapy', 'Combined Modality Therapy', 'Computer-Assisted Image Analysis', 'Data', 'Development', 'Drug usage', 'Eastern Cooperative Oncology Group', 'Endothelial Cells', 'Foundations', 'Future', 'Genetic screening method', 'Genotype', 'Goals', 'Human', 'Image Analysis', 'Incidence', 'Individual', 'Laboratories', 'Link', 'Machine Learning', 'Malignant Neoplasms', 'Measurement', 'Metastatic Renal Cell Cancer', 'Molecular', 'Multivariate Analysis', 'Mus', 'Mutation', 'Neoplasms in Vascular Tissue', 'Newly Diagnosed', 'Organ', 'Outcome', 'Pathogenesis', 'Patients', 'Pattern', 'Pericytes', 'Pharmaceutical Preparations', 'Phase', 'Phenotype', 'Phosphotransferases', 'Quantitative Microscopy', 'Renal Cell Carcinoma', 'Renal carcinoma', 'Reporting', 'Resistance', 'STAT3 gene', 'Signal Pathway', 'Signal Transduction', 'Solid', 'Specimen', 'Staining method', 'Stains', 'Stress', 'System', 'Systems Analysis', 'Testing', 'Therapeutic', 'Therapeutic Agents', 'Tumor Angiogenesis', 'VHL mutation', 'Vascular Endothelial Cell', 'Vascular Endothelial Growth Factor Receptor', 'Vascular Endothelial Growth Factor Receptor-2', 'Vascular Endothelial Growth Factors', 'angiogenesis', 'bHLH-PAS factor HLF', 'base', 'bevacizumab', 'c-myc Genes', 'cancer therapy', 'caspase-3', 'cell behavior', 'human FRAP1 protein', 'mutant', 'neoplastic cell', 'novel', 'novel therapeutics', 'predictive modeling', 'public health relevance', 'response', 'success', 'tool', 'tumor']",NCI,UNIVERSITY OF PENNSYLVANIA,R01,2009,508622,0.0624841059614809
"Yale SPORE in Skin Cancer  DESCRIPTION (provided by applicant): The Yale SPORE in Skin Cancer program is focused on two skin cancers, basal cell carcinoma (BCC) and melanoma. The goals are to conduct epidemiologic and genetic studies on early onset basal cell carcinoma (Project 1), establish novel high-throughput prognostic and diagnostic tools for melanomas (Projects 2 and 4), and introduce novel targeted therapies to treat melanoma (Projects 2 and 3). The new approaches include genome-wide monitoring of melanoma tumor responses to epigenetic modifiers (Project 2); the use of high-density protein microarrays (ProtoArrays) to interrogate serological responses in sera from melanoma patients (Project 4); and novel epigenetic modifier and immune modulation therapy for melanoma (Projects 2 and 3, respectively). The SPORE includes Administration, Specimen Resource and Bioinformatics/Biostatistics Cores to support the studies of SPORE investigators. Developmental Research and Career Development Award Programs are proposed. The Yale SPORE in Skin Cancer will be an integral part of the Yale Comprehensive Cancer Center (YCCC), Yale New Haven Hospital, and the Dermatology, Pathology and Epidemiology/Public Health Departments that collectively will provide the patient populations, specimens and other resources and support systems needed for the SPORE activities. There is a full commitment from the Dean of Yale School of Medicine and the Director of the YCCC/Chairman of Dermatology to support the SPORE with a plan for cost sharing. The major Translational Results expected are: a) Guidelines for preventive interventions aimed at reducing the incidence of early and total BCC that will diminish the management costs of the most common skin cancer; b) The introduction of new molecular tools for assessing responses to novel epigenetic modifiers; c) The introduction of new ways of assessing melanoma patients employing serological markers; d) The application of new approaches to personalize melanoma chemo- and immuno- therapy; e) The establishment of a composite databases for skin cancers that includes specimens tracking, clinical information, high throughput proteomics and genomics. The database program will be compatible with caBIG and will be available on the web for the benefit of the wider community of investigators and clinicians; f) The creation of new translational bioinformatics tools (predictive statistics and artificial intelligence) required to analyze global and highly complex information derived from different sources and different platforms.          n/a",Yale SPORE in Skin Cancer,7454471,P50CA121974,[' '],NCI,YALE UNIVERSITY,P50,2008,2233298,0.034415577918808976
"Yale SPORE in Skin Cancer  DESCRIPTION (provided by applicant): The Yale SPORE in Skin Cancer program is focused on two skin cancers, basal cell carcinoma (BCC) and melanoma. The goals are to conduct epidemiologic and genetic studies on early onset basal cell carcinoma (Project 1), establish novel high-throughput prognostic and diagnostic tools for melanomas (Projects 2 and 4), and introduce novel targeted therapies to treat melanoma (Projects 2 and 3). The new approaches include genome-wide monitoring of melanoma tumor responses to epigenetic modifiers (Project 2); the use of high-density protein microarrays (ProtoArrays) to interrogate serological responses in sera from melanoma patients (Project 4); and novel epigenetic modifier and immune modulation therapy for melanoma (Projects 2 and 3, respectively). The SPORE includes Administration, Specimen Resource and Bioinformatics/Biostatistics Cores to support the studies of SPORE investigators. Developmental Research and Career Development Award Programs are proposed. The Yale SPORE in Skin Cancer will be an integral part of the Yale Comprehensive Cancer Center (YCCC), Yale New Haven Hospital, and the Dermatology, Pathology and Epidemiology/Public Health Departments that collectively will provide the patient populations, specimens and other resources and support systems needed for the SPORE activities. There is a full commitment from the Dean of Yale School of Medicine and the Director of the YCCC/Chairman of Dermatology to support the SPORE with a plan for cost sharing. The major Translational Results expected are: a) Guidelines for preventive interventions aimed at reducing the incidence of early and total BCC that will diminish the management costs of the most common skin cancer; b) The introduction of new molecular tools for assessing responses to novel epigenetic modifiers; c) The introduction of new ways of assessing melanoma patients employing serological markers; d) The application of new approaches to personalize melanoma chemo- and immuno- therapy; e) The establishment of a composite databases for skin cancers that includes specimens tracking, clinical information, high throughput proteomics and genomics. The database program will be compatible with caBIG and will be available on the web for the benefit of the wider community of investigators and clinicians; f) The creation of new translational bioinformatics tools (predictive statistics and artificial intelligence) required to analyze global and highly complex information derived from different sources and different platforms.          n/a",Yale SPORE in Skin Cancer,7255523,P50CA121974,[' '],NCI,YALE UNIVERSITY,P50,2007,2233300,0.034415577918808976
"Yale SPORE in Skin Cancer  DESCRIPTION (provided by applicant): The Yale SPORE in Skin Cancer program is focused on two skin cancers, basal cell carcinoma (BCC) and melanoma. The goals are to conduct epidemiologic and genetic studies on early onset basal cell carcinoma (Project 1), establish novel high-throughput prognostic and diagnostic tools for melanomas (Projects 2 and 4), and introduce novel targeted therapies to treat melanoma (Projects 2 and 3). The new approaches include genome-wide monitoring of melanoma tumor responses to epigenetic modifiers (Project 2); the use of high-density protein microarrays (ProtoArrays) to interrogate serological responses in sera from melanoma patients (Project 4); and novel epigenetic modifier and immune modulation therapy for melanoma (Projects 2 and 3, respectively). The SPORE includes Administration, Specimen Resource and Bioinformatics/Biostatistics Cores to support the studies of SPORE investigators. Developmental Research and Career Development Award Programs are proposed. The Yale SPORE in Skin Cancer will be an integral part of the Yale Comprehensive Cancer Center (YCCC), Yale New Haven Hospital, and the Dermatology, Pathology and Epidemiology/Public Health Departments that collectively will provide the patient populations, specimens and other resources and support systems needed for the SPORE activities. There is a full commitment from the Dean of Yale School of Medicine and the Director of the YCCC/Chairman of Dermatology to support the SPORE with a plan for cost sharing. The major Translational Results expected are: a) Guidelines for preventive interventions aimed at reducing the incidence of early and total BCC that will diminish the management costs of the most common skin cancer; b) The introduction of new molecular tools for assessing responses to novel epigenetic modifiers; c) The introduction of new ways of assessing melanoma patients employing serological markers; d) The application of new approaches to personalize melanoma chemo- and immuno- therapy; e) The establishment of a composite databases for skin cancers that includes specimens tracking, clinical information, high throughput proteomics and genomics. The database program will be compatible with caBIG and will be available on the web for the benefit of the wider community of investigators and clinicians; f) The creation of new translational bioinformatics tools (predictive statistics and artificial intelligence) required to analyze global and highly complex information derived from different sources and different platforms.          n/a",Yale SPORE in Skin Cancer,7127372,P50CA121974,"['antigens', 'clinical research', 'epigenetics', 'melanoma', 'neoplasm /cancer', 'skin neoplasms', 'spores']",NCI,YALE UNIVERSITY,P50,2006,2300000,0.034415577918808976
"EVOLUTIONARY DYNAMICS OF BARRETT'S ESOPHAGUS NEOPLASIA    DESCRIPTION  (Applicant's  Description):    The  cell  lineages  in neoplastic       tissues are evolving under the twin dynamics of mutation and clonal expansion.       This  is the basis for both its virulence and our difficulties in treating it.       We  hypothesize  that a subset of the mutations observed in the progression to       cancer  confer  beneficial  selective  effects  on  the cell.  Furthermore, we       hypothesize  that  the  interactions  between  these clonal populations in and       around  the neoplastic tissue determine the progression to cancer.  The aim of       this  project  is  to  identify  these  selective  mutations  and to infer the       interactions  between the mutant clones in Barrett's Esophagus that eventually       lead  to  the development of esophageal adenocarcinoma.  This analysis will be       based  on loss of heterozygosity data, promoter methylation, single nucleotide       polymorphisms,  and  gene  expression  data  for homogeneous subpopulations of       cells  sampled  from  neoplastic  tissue in patients with Barrett's Esophagus.       The  tissue  samples  come  from  biopsies of selected patients in the Seattle       Barrett's  Esophagus  Project  (N=285).   Data mining will be used to identify       mutations  that  are associated with clonal expansion as well as inhibition of       neighboring  clones.    The  order  of  genetic  events  in the progression to       esophageal adenocarcinoma will be determined by phylogenetic reconstruction of       the  cell lineages in the neoplastic tissue of each patient.  Machine learning       techniques,  such  as the EM algorithm, will be employed to infer missing data       and the effects of unsampled mutations. Computational modeling will be used to       generate   comparison  data  for  null  hypotheses  as  well  as  to  generate       experimental  predictions from our understanding of the progression to cancer.       This  is  the first step in my long-term career goal to contribute to medicine       through the use of computational and theoretical methods.  Working at the Fred       Hutchinson  Cancer  Research  Center  will  facilitate  the transition from my       background  in  computer  science  and  evolutionary theory, to an independent       research  program  based on the analysis of cellular and molecular dynamics of       cancer.  The challenge of this project is the integration of diverse molecular       and  epidemiological  data  into  a coherent and detailed understanding of the       progression to cancer in the neoplasm of a model system.                                                                                                                                                                                                       n/a",EVOLUTIONARY DYNAMICS OF BARRETT'S ESOPHAGUS NEOPLASIA,6886821,K01CA089267,"['Barretts esophagus', 'adenocarcinoma', 'cell cell interaction', 'clinical research', 'gene expression', 'gene mutation', 'human subject', 'loss of heterozygosity', 'mathematical model', 'microarray technology', 'model design /development', 'neoplasm /cancer genetics', 'neoplastic growth', 'neoplastic process', 'telomere']",NCI,WISTAR INSTITUTE,K01,2005,158490,0.021975377762113623
"Validating and Translating Array Signatures    DESCRIPTION (provided by applicant)   In the area of cancer, microarray analysis is being used to identify specific differences between normal and disease tissues. Such efforts are leading to the identification of small gene sets, or signatures, that can provide key information for classifying cancer types. We propose here a mechanism for translating these discoveries into cost-effective, quantitative assays based on the use of highly multiplexed, universal-primer-driven rtPCR (UP-rtPCR). In this proposal we will demonstrate and validate the combined use of artificial neural network analysis for identification of small gene signatures and UP-rtPCR technology for translating these signatures into high throughput assays for use in research and clinical settings. Success will be measured by the ability of this approach to differentiate 4 types of small, round, blue-cell tumors. This work will be performed in collaboration with Drs. Javed Khan and Gary Fogel.            n/a",Validating and Translating Array Signatures,6836381,R43CA110542,"['RNA', 'artificial intelligence', 'bioengineering /biomedical engineering', 'bioinformatics', 'computational biology', 'gene expression', 'high throughput technology', 'human genetic material tag', 'microarray technology', 'neoplasm /cancer classification /staging', 'neoplasm /cancer diagnosis', 'neoplasm /cancer genetics', 'polymerase chain reaction', 'technology /technique development']",NCI,"ALTHEA TECHNOLOGIES, INC.",R43,2004,99999,0.0008837711860296783
"Aptamer Development for Cancer Diagnosis and Management DESCRIPTION (provided by applicant): Early diagnosis of disease allows for more effective therapy and better clinical outcomes.  In cancer, extensive effort has gone toward development of screening and diagnostic techniques for early detection of disease. Despite this effort, the probability of single-analyte assays providing the ""silver bullet"" to address these problems for any specific tumor is vanishingly small. A more comprehensive approach that is more likely to succeed is the development of an integrated molecular diagnostic system using multiplexed assays of cancer-related biomarkers coupled with data analysis using bioinformatics-based algorithms. The development of multiplexed assays to improve quality of patient life is a major goal of SomaLogic. SomaLogic's proprietary nucleic-acid based capture agents, photoaptamers, yield quantitative analysis of proteins found in complex biological samples. Using data generated with this assay platform, we expect to develop predictive biomedical algorithms for the diagnosis and management of a variety of diseases, including cancer.   The specific objective of this Phase I proposal is to develop an initial set of photoaptamers targeted to proteins and/or protein complexes that have been associated with a wide variety of solid tumors, i.e., proteinases, proteinase inhibitors, and proteinase-inhibitor complexes, which can then be used to screen clinical samples from patients with a variety of solid tumor types and stages of disease. The specific aims of the proposed research are to: 1) develop a set of well-defined photoaptamers specific for 20 proteinases, antiproteinases and proteinase-antiproteinase complexes that are believed to be associated with invasion and metastasis of solid tumors; 2) develop a photoaptamer microarray assay (""proteomics chip"") for the measurement of at least 20 cognate proteins or protein complexes in serum or plasma; and 3) evaluate the ranges for these proteins or protein complexes in serum and plasma obtained from normal subjects.   The overall objective of our research efforts in cancer is to develop CLIA-compatible assays and algorithm-based analysis systems for the monitoring of patients at risk for or diagnosed with various malignancies using aptamers directed against proteins that are either generally associated (proteinases, antiproteinases, adhesion molecules chemokines and/or chemokine receptors) or specifically associated (known cell markers, tissue specific proteins, transcriptional regulators, etc.) with solid tumors. n/a",Aptamer Development for Cancer Diagnosis and Management,6785751,R43CA108005,"['artificial intelligence', 'bioengineering /biomedical engineering', 'bioinformatics', 'biomarker', 'chemical binding', 'chemical synthesis', 'computational biology', 'computer program /software', 'early diagnosis', 'endopeptidases', 'enzyme complex', 'enzyme inhibitors', 'mathematics', 'microarray technology', 'molecular oncology', 'neoplasm /cancer diagnosis', 'oligonucleotides', 'proteomics', 'technology /technique development']",NCI,"SOMALOGIC, INC.",R43,2004,99853,-6.807385451187185e-05
