text,title,id,project_number,terms,administration,organization,mechanism,year,funding,score
"Population genomics of adaptation Project Summary Malaria that results from Plasmodium falciparum is among the most globally devastating human diseases. The principle vector of malaria, mosquitoes of the Anopheles gambiae species complex, are thus central targets for controlling the human health burden of Plasmodium. For nearly two decades, there have been large-scale, coordinated efforts to diminish mosquito populations, generally through spraying and insecticide treated bed nets. Indeed such control efforts have now led to a nearly 50% decrease in the rates of malaria infection in many parts of sub-Saharan Africa. At present, however, control efforts of A. gambiae are being threatened by evolutionary responses within mosquitos: A. gambiae populations have shown increases in insecticide resistance as well as behavioral adaptations that allow mosquitos to avoid spraying all together. Thus adaptation of mosquitos to the control efforts themselves is currently a risk to maintain the gains made in the fight against malaria. In this proposal we lay out an integrated population genomic approach for systematically identifying regions of the A. gambiae genome that are evolving adaptively in response to ongoing control efforts. Our approach centers upon state-of-the-art supervised machine learning techniques that we have recently introduced for finding the signatures of selective sweeps in genomes (Schrider and Kern, 2016), coupled with the large-scale population genomic datasets currently in production by the Ag1000G consortium. Project Narrative Malaria is a mosquito-borne infectious disease that has enormous impacts on human health globally. For the past 16 years, large gains have been made in decreasing the rate of malaria transmission through control of its mosquito vector Anopheles gambiae; unfortunately at present these control efforts are in danger of collapse due to the evolution of insecticide resistance in the mosquitos. We aim to discover the genomic targets of such resistance through the development of sophisticated population genomic approaches and their application to state-of- the-art genome sequence datasets from Anopheles gambiae.",Population genomics of adaptation,9554999,R01GM117241,"['Affect', 'Africa South of the Sahara', 'Anopheles Genus', 'Anopheles gambiae', 'Awareness', 'Back', 'Beds', 'Behavioral', 'Catalogs', 'Cessation of life', 'Chromosomes', 'Classification', 'Complex', 'Coupled', 'Culicidae', 'Data', 'Data Set', 'Dependence', 'Detection', 'Development', 'Distant', 'Equipment and supply inventories', 'Evolution', 'Frequencies', 'Funding', 'Genome', 'Genomic approach', 'Genomics', 'Geography', 'Goals', 'Health', 'Human', 'Individual', 'Insecticide Resistance', 'Insecticides', 'Link', 'Location', 'Machine Learning', 'Malaria', 'Methodology', 'Methods', 'Mosquito-borne infectious disease', 'Mutation', 'Pattern', 'Phase', 'Plasmodium', 'Plasmodium falciparum', 'Population', 'Prevalence', 'Production', 'Recording of previous events', 'Research', 'Residual state', 'Resistance', 'Risk', 'Sampling', 'Supervision', 'Techniques', 'Time', 'Variant', 'Work', 'deep learning', 'deep neural network', 'fight against', 'genomic data', 'global health', 'human disease', 'learning strategy', 'malaria infection', 'malaria transmission', 'markov model', 'novel', 'recurrent neural network', 'resistance allele', 'response', 'tool', 'vector', 'vector control', 'vector mosquito']",NIGMS,"RUTGERS, THE STATE UNIV OF N.J.",R01,2018,18944,0.1015812552719257
"Digital High Resolution Melt and Machine Learning for Rapid and Specific Diagnosis in Neonatal Sepsis Project Summary Blood culture sensitivity in neonates is poor but is the “Gold Standard” for the diagnosis of sepsis. Universal genotyping of pathogen genomic sequences using High Resolution Melt (U-HRM) provides a simple, low cost, rapid, and modern alternative to blood culture testing. By measuring the fluorescence of an intercalating dye as PCR-amplified pathogen DNA fragments are heated and disassociate, sequence defined melt curves are generated with single-nucleotide resolution in a closed-tube reaction. We have advanced U- HRM into a digital PCR format (U-dHRM), where DNA sequences that are present in mixtures are individually amplified and identified as is needed for polymicrobial infections. We have also established unique signature melt curves for 37 bacterial species that commonly infect older children and adults and automatically identify them using machine learning technology. With the goal of creating an accurate and valid test for the timely diagnosis of neonatal sepsis, we will advance this technology to identify unique fungal, viral, and bacterial HRM signatures along with antibiotic resistance genes with an accuracy of 99-100% on minimal blood volume (1mL). Our aims are: Aim 1. Optimize and assess the U-dHRM platform for neonatal bacteremia diagnosis by expand our bacterial database (13 additional bacteria) to detect causes of >99% of neonatal bacterial infections, expand our antibiotic resistance gene database to include five clinically actionable genes, and assessing the performance of the system for bacteremia diagnosis in mock and clinical whole blood samples; Aim 2. Advance the U-dHRM platform for simultaneous detection of fungal and viral pathogens by upgrading our optical system to enable expansion to fungal and viral detection in a high-throughput format, multiplexing the assay to expand to viral and fungal pathogens causing >99% non-bacterial infections, and conducting analytical validation of the multiplexed platform using mock whole blood samples; and Aim 3. Advance the machine learning algorithm for detection of emerging pathogens by developing and integrating an anomaly detection algorithm for reporting emerging pathogens that are not included in our database and validating the algorithm using data generated in Aims 1 and 2. Thus, this proposal directly addresses the funding call by applying a multidisciplinary approach to overcome the biomedical challenge of rapidly diagnosis sepsis, a hidden public health disaster. Project Narrative Digital High Resolution Melting (dHRM) of DNA combined with machine learning creates unique “fingerprints"" for microbes and antibiotic resistance, allowing for faster and more precise detection and treatment of pathogen(s) causing sepsis. This project will advance and test the clinical performance of dHRM technology in the diagnosis of neonatal sepsis. Our goal is to rapidly and accurately identify pathogens and their resistance markers to facilitate accurate antimicrobial therapy, reducing antibiotic overuse in non-infected infants.",Digital High Resolution Melt and Machine Learning for Rapid and Specific Diagnosis in Neonatal Sepsis,9596299,R01AI134982,"['Address', 'Adult', 'Algorithms', 'Antibiotic Resistance', 'Antibiotics', 'Bacteremia', 'Bacteria', 'Bacterial Antibiotic Resistance', 'Bacterial Infections', 'Biological Assay', 'Birth Weight', 'Blood', 'Blood Volume', 'Blood specimen', 'Child', 'Clinical', 'DNA', 'DNA Sequence', 'Data', 'Databases', 'Detection', 'Diagnosis', 'Diagnostic', 'Disasters', 'Dyes', 'Emerging Technologies', 'Exposure to', 'Fingerprint', 'Fluorescence', 'Funding', 'Genes', 'Genome', 'Genomics', 'Genotype', 'Goals', 'Gold', 'Hour', 'Immune response', 'Individual', 'Infant', 'Infection', 'Machine Learning', 'Measures', 'Microbe', 'Modernization', 'Neonatal', 'Nucleotides', 'Optics', 'Organism', 'Patients', 'Performance', 'Predisposition', 'Public Health', 'RNA', 'Reaction', 'Reporting', 'Research', 'Resistance', 'Resolution', 'Sampling', 'Sepsis', 'Symptoms', 'System', 'Technology', 'Testing', 'Therapeutic', 'Time', 'Training', 'Tube', 'United States', 'Validation', 'Variant', 'Very Low Birth Weight Infant', 'Viral', 'Whole Blood', 'Woman', 'antimicrobial', 'base', 'circulating DNA', 'clinically actionable', 'clinically relevant', 'cost', 'diagnosis standard', 'digital', 'early onset', 'interdisciplinary approach', 'intrapartum', 'melting', 'microbial', 'neonatal sepsis', 'neonate', 'overtreatment', 'pathogen', 'pathogen genome', 'point of care', 'premature', 'rapid diagnosis', 'resistance gene', 'sample collection', 'septic', 'therapy resistant', 'viral detection']",NIAID,"UNIVERSITY OF CALIFORNIA, SAN DIEGO",R01,2018,437420,0.08152963407038248
"FAST platform for same-shift, complete antibiotic menu antibiotic susceptibility testing The goal of this Phase I SBIR proposal is to demonstrate utility to all major pathogenic bacterial strains of SeLux’s rapid, low-cost, phenotypic antibiotic susceptibility test (AST) system (fast-AST or FAST). Utilizing existing optical detectors and standard dried antibiotic microplates, and avoiding pitfalls of metabolic probes, FAST will potentially transform therapy of infections by significantly accelerating AST, thereby facilitating treatment with the optimal antibiotic. Aim 1 will apply FAST to hundreds of samples of pathogenic bacterial strains, while developing and optimizing a predictive algorithm for clinical utility. Aim 2 will extend the FAST platform to slow-growing strains and species as well. SeLux has demonstrated FAST to exceed FDA 510(k) requirements for minimum inhibitory concentration determinations for 25+ strains of Staphylococcus aureus and Escherichia coli with full antibiotic panels. Completion of the proposed aims will expand FAST to all major clinically-relevant, non-fastidious bacterial pathogens. SeLux’s interdisciplinary team has expertise in nanosensing, microbiology, and algorithm design and is buttressed by distinguished experts in Clinical Microbiology, Infectious Disease, and Machine Learning. The new paradigm in clinical medicine is value-based healthcare, which requires rapid and accurate diagnoses leading to optimal patient treatment. Nowhere is this more important than in treating infections, where doctors are currently forced to overprescribe broad-spectrum antibiotics during an agonizing 48+ hour wait for antibiotic susceptibility test (AST) results. The novel, rapid, low-cost AST platform described in this proposal promises to reduce this delay in treatment by as much as 30 hours. This advance would be transformative for the treatment of infections because current over-use of broad-spectrum antibiotics not only harms individual patients but is a primary contributor to the growing epidemic of antibiotic resistance.","FAST platform for same-shift, complete antibiotic menu antibiotic susceptibility testing",9464993,R43AI136125,"['Agreement', 'Algorithm Design', 'Algorithms', 'Amplifiers', 'Antibiotic Resistance', 'Antibiotic Therapy', 'Antibiotic susceptibility', 'Antibiotics', 'Bacterial Antibiotic Resistance', 'Biological Assay', 'Blinded', 'Blood', 'Centers for Disease Control and Prevention (U.S.)', 'Chemicals', 'Clinical', 'Clinical Medicine', 'Clinical Microbiology', 'Combating Antibiotic Resistant Bacteria', 'Communicable Diseases', 'Detection', 'Development', 'Devices', 'Diagnostic', 'End Point Assay', 'Engineering', 'Ensure', 'Epidemic', 'Escherichia coli', 'Funding', 'Goals', 'Grant', 'Healthcare', 'Hour', 'Human', 'In Vitro', 'Infection', 'Institutes', 'Invaded', 'Laboratories', 'Length of Stay', 'Machine Learning', 'Metabolic', 'Methods', 'Microbiology', 'Minimum Inhibitory Concentration measurement', 'Optics', 'Pathogenicity', 'Patient Care', 'Patients', 'Phase', 'Phenotype', 'Plague', 'Positioning Attribute', 'Privatization', 'Quality of Care', 'Reagent', 'Recovery', 'Regulatory Affairs', 'Sampling', 'Sampling Studies', 'Scientist', 'Small Business Innovation Research Grant', 'Speed', 'Staphylococcus aureus', 'System', 'Test Result', 'Testing', 'Vancomycin', 'Work', 'accurate diagnosis', 'base', 'clinically relevant', 'combat', 'commercialization', 'cost', 'cost effectiveness', 'design', 'detector', 'individual patient', 'instrument', 'nanosensors', 'novel', 'optimal treatments', 'pathogen', 'performance tests', 'prediction algorithm', 'prototype', 'rapid diagnosis']",NIAID,"SELUX DIAGNOSTICS, INC.",R43,2018,298851,0.04172024709530716
"Dissecting Therapeutic Resistance and Progression in Metastatic Melanoma Through Clinical Computational Oncology Project Summary  The development of targeted therapy (BRAF/MEKi) and immune checkpoint blockade (ICB) targeting the co-inhibitory receptors CTLA-4 and PD-1 have revolutionized the treatment of metastatic melanoma. However, only a subset of patients maintain durable responses, and many people experience substantial side effects of therapy. Predicting therapeutic response in individual patients remains a critical and unresolved issue. Furthermore, the series of key genomic and epigenetic events driving progression and resistance to therapy is incompletely understood. The guiding hypothesis of this proposal is that (a) resistance to ICB and targeted therapy is mediated by tumor intrinsic and extrinsic mechanisms, some of which may be elucidated by systematic multi-modal molecular characterization of the tumor and tumor microenvironment; and (b) applying modern machine-learning and statistical approaches to molecular and clinical data from patient tumors will inform development of new therapeutic approaches and predictive models to improve patient care.  Identifying and validating predictors of intrinsic resistance to BRAF/MEKi and ICB across large human cohorts has been limited to date. Aim 1 of this proposal applies genomic and transcriptomic characterization of pre-treatment tumors to large cohorts of patients treated with BRAF/MEKi, PD-1i, and CTLA-4i in order to discover and to validate molecular and clinical markers of response and resistance. Machine learning approaches will integrate these markers into parsimonious models predicting response. A differential analysis using mutual information will be conducted to reveal markers that predict differential response to therapy.  A significant proportion of patients do not respond or maintained sustained responses to immunotherapy, and there is a critical need to characterize the acquisition or selection of drivers that confer resistance to immunotherapy. Aim 2 of this proposal develops algorithms using molecular characterization of longitudinally collected tumor samples across multiple anatomic sites to discover genomic and epigenetic drivers of progression and resistance to immunotherapy using phylogenetic analysis as the backbone of discovery.  Finally, the ability to detect novel tumor driver mutations present at low frequencies is strongly dependent on cohort size. Aim 3 of this proposal leverages all genomically characterized melanomas to perform a meta- analysis using state-of-the-art and novel algorithms to discover novel driver mutations present at low frequencies with a focus on tumor subsets that lack known targetable drivers.  These studies will expand the actionable landscape of genomic and epigenetic alterations in metastatic melanoma, advance our understanding of intrinsic and acquired resistance to targeted and immunotherapies in melanoma, and establish a framework to predict response in individual patients, which may impact patient care in melanoma and have applicability in other disease settings. Project Narrative  New targeted and immunotherapies have revolutionized the treatment and extended the prognosis of metastatic melanoma, but only a subset of patients have durable responses, and our ability to predict who will benefit from which treatment is limited. Further, the specific alterations driving tumor progression and resistance to therapy are not well characterized, but may inform the development of new therapeutic targets and combination therapies. This proposal aims to integrate molecular data from patient tumor samples and their clinical context to predict response to targeted and immunotherapies, and dissect the drivers of progression and resistance to therapy in individual patients.",Dissecting Therapeutic Resistance and Progression in Metastatic Melanoma Through Clinical Computational Oncology,9646469,K08CA234458,"['Adverse effects', 'Algorithms', 'Automobile Driving', 'BRAF gene', 'Binding', 'Biological', 'Biological Markers', 'Classification', 'Clinical', 'Clinical Data', 'Clinical Markers', 'Combined Modality Therapy', 'Computational Biology', 'Cytotoxic T-Lymphocyte-Associated Protein 4', 'Data', 'Development', 'Disease', 'Epigenetic Process', 'Event', 'Frequencies', 'Genomics', 'Goals', 'Human', 'Immunotherapy', 'Light', 'Machine Learning', 'Mediating', 'Meta-Analysis', 'Metastatic Melanoma', 'Modality', 'Modernization', 'Molecular', 'Multiple Anatomic Sites', 'Mutation', 'NF1 mutation', 'Pathway interactions', 'Patient Care', 'Patient-Focused Outcomes', 'Patients', 'Phylogenetic Analysis', 'Prediction of Response to Therapy', 'Resistance', 'SLEB2 gene', 'Sampling', 'Series', 'Site', 'Standardization', 'Tail', 'Therapeutic', 'Time', 'Vertebral column', 'actionable mutation', 'clinical biomarkers', 'clinically relevant', 'cohort', 'experience', 'immune checkpoint blockade', 'improved', 'individual patient', 'insight', 'longitudinal analysis', 'melanoma', 'molecular marker', 'new therapeutic target', 'novel', 'novel therapeutic intervention', 'oncology', 'outcome forecast', 'patient subsets', 'predicting response', 'predictive marker', 'predictive modeling', 'receptor', 'response', 'response biomarker', 'targeted treatment', 'therapy resistant', 'transcriptomics', 'tumor', 'tumor microenvironment', 'tumor progression']",NCI,MASSACHUSETTS GENERAL HOSPITAL,K08,2018,68267,0.12737255834848019
"Microscopy-Based Antimicrobial Susceptibility Testing (MAST) Antibiotic resistance is compromising our ability to treat bacterial infections. Clinical microbiology laboratories guide appropriate treatment through antimicrobial susceptibility testing (AST) of patient bacterial isolates. However, increasingly, pathogens are developing resistance to a broad range of antimicrobials, requiring AST of less commonly used or recently introduced agents for which no commercially available or FDA-cleared testing methods exist. Agar and broth dilution are gold standard methods for AST that can be used to test any antimicrobial; however, labor and technical complexity precludes their use in hospital-based clinical laboratories. Therefore, bacterial isolates often must be sent to a reference laboratory with a 4-6 day delay in results. Furthermore, even standard methods require overnight incubation prior to readout. Therefore, there exists a significant AST testing gap in which current methodologies cannot adequately address the need for rapid results in the face of unpredictable susceptibility profiles. Our laboratory has recently verified inkjet printer-based digital dispensing technology as a novel platform to facilely perform reference AST for any antimicrobial at will. In this proposal, we aim to combine this methodology with advanced microscopy to leapfrog traditional AST capabilities through: (1) development of a method for microscopic imaging of bacterial replication on a solid-phase, 384-well microplate AST format, thereby allowing determination of susceptibility for any drug at will in 4 hours and (2) development and application of advanced image analysis for automated susceptibility calls. This new platform is designated MAST for microscopy-based antimicrobial susceptibility testing. The clinical diagnostic performance of the platform will be optimized against an AST reference method for accuracy and precision using a large panel of well-characterized clinical isolates. We anticipate establishing a prototype platform that will address the AST testing gap and thereby help our health system more effectively address the antimicrobial resistance threat. With the emergence of multi-drug resistant bacteria, it is no longer possible to accurately predict which antimicrobials will be effective against life-threatening bacterial illness. Testing bacteria directly for response available therapies may take several days. Therefore, a new technology platform called MAST is proposed to allow us to determine which antibiotics can treat a bacteria infection in a matter of hours and thereby address our current, clinically unacceptable antimicrobial testing gap.",Microscopy-Based Antimicrobial Susceptibility Testing (MAST),9455026,R21AI130434,"['Address', 'Agar', 'Algorithms', 'Antibiotic Resistance', 'Antibiotics', 'Antimicrobial Resistance', 'Antimicrobial susceptibility', 'Bacteria', 'Bacterial Infections', 'Biological Neural Networks', 'Clinical', 'Clinical Microbiology', 'Development', 'Diagnostic tests', 'Goals', 'Gold', 'Growth', 'Health system', 'Hospitals', 'Hour', 'Image', 'Image Analysis', 'Individual', 'Infection', 'Laboratories', 'Life', 'Machine Learning', 'Methodology', 'Methods', 'Microscopic', 'Microscopy', 'Monitor', 'Multiple Bacterial Drug Resistance', 'Nutrient', 'Patients', 'Performance', 'Pharmaceutical Preparations', 'Phase', 'Phenotype', 'Predisposition', 'Printing', 'Regimen', 'Resistance', 'Resistance development', 'Solid', 'Supervision', 'Surface', 'Technology', 'Test Result', 'Testing', 'antimicrobial', 'base', 'biomaterial compatibility', 'clinical diagnostics', 'digital', 'direct application', 'microscopic imaging', 'new technology', 'next generation', 'novel', 'pathogen', 'performance tests', 'prototype', 'response']",NIAID,BETH ISRAEL DEACONESS MEDICAL CENTER,R21,2018,263805,0.05889894756960388
