text,title,id,project_number,terms,administration,organization,mechanism,year,funding,score
"Clinicopathologic and Genetic Profiling through Machine Learning and Natural Language Processing for Precision Lung Cancer Management PROJECT SUMMARY/ABSTRACT Lung cancer is the second-most common type of cancer and the leading cause of cancer death in men and women. Among the different types of lung cancer, non-small cell lung cancer (NSCLC) is the most common type and it constitutes 85% to 90% of all lung cancer cases. Current cancer research has shown that multiple somatic mutations affect the sensitivity of patients to various drugs used for NSCLC treatment. These mutations are essential factors for determining the most effective, “personalized” treatment for each NSCLC patient; however, most NSCLC patients develop resistance to these targeted therapies in their first year of treatment. Many mechanisms of this resistance are still unknown. Designing and prescribing better targeted therapies for NSCLC patients requires further understanding, particularly with respect to the relationship between NSCLC tumors’ pathological and clinical findings, genetic profiles, and targeted therapy responses/resistance. Currently, there is no computational method to connect observations and findings from pathology reports, medical records, somatic mutations, and the targeted therapy resistance. This project provides a plan to build a novel computational method to identify statistically significant associations between the pathological findings of NSCLC tumors and the presence of clinically-actionable somatic mutations. Furthermore, these associations, in combination with an innovative set of feature analysis from pathology reports and electronic medical records, will be leveraged to build and validate a machine-learning model to identify NSCLC patients with clinically-actionable somatic mutations. Finally, the associated clinical, pathological, and genetic findings for NSCLC patients will be used in a new machine-learning framework to predict patients’ time-to-resistance to targeted therapies. The required data to build and validate the proposed models in this project will be obtained through a collaboration with the Department of Pathology’s Laboratory for Clinical Genomics and Advanced Technologies at Dartmouth-Hitchcock Medical Center. In addition to internal validation, the investigators in this proposal established a collaboration with the Department of Pathology at the University of Vermont Medical Center to apply and validate the developed models on an external data source. Upon successful implementation of this bioinformatics approach, the developed models will be able to reveal statistically significant links between clinical and pathological findings, clinically-actionable somatic mutations, and targeted-therapy responses for a better understanding of NSCLC tumor development and treatment. The proposed approach will provide an accurate, fast, and inexpensive pre- selection method for screening NSCLC patients with clinically-actionable mutations for translational research and precision medicine. Furthermore, the proposed machine-learning method to identify NSCLC patients’ resistance to targeted therapies will help healthcare providers to select the best treatment strategies for these patients, improve their health outcomes, and establish this precision medicine paradigm for other types of cancer. PROJECT NARRATIVE Resistance to targeted therapies severely limits the ability to treat non-small cell lung cancer (NSCLC) patients. This project proposes a novel computational approach to find statistically-significant links between pathological and clinical findings, clinically-actionable mutations, and targeted-therapy responses for NSCLC patients. The outcomes of this proposal can assist healthcare providers to identify the most effective strategy for NSCLC treatment, improve public health, and promote precision medicine.",Clinicopathologic and Genetic Profiling through Machine Learning and Natural Language Processing for Precision Lung Cancer Management,9726144,R01CA249758,"['Affect', 'Architecture', 'Attention', 'Bioinformatics', 'Biological Markers', 'Cancer Etiology', 'Cancer Patient', 'Cessation of life', 'Characteristics', 'Clinical', 'Clinical Data', 'Clinical Decision Support Systems', 'Collaborations', 'Colorectal Cancer', 'Computer Simulation', 'Computerized Medical Record', 'Computing Methodologies', 'DNA Sequence Alteration', 'Data', 'Data Set', 'Data Sources', 'Development', 'Drug resistance', 'Drug usage', 'Family', 'Foundations', 'Genetic', 'Genomics', 'Glioblastoma', 'Health', 'Health Personnel', 'Healthcare', 'Knowledge', 'Laboratories', 'Link', 'Machine Learning', 'Malignant neoplasm of lung', 'Measures', 'Medical', 'Medical Records', 'Medical center', 'Methodology', 'Methods', 'Modeling', 'Mutation', 'Natural Language Processing', 'Non-Small-Cell Lung Carcinoma', 'Ontology', 'Outcome', 'Pathologic', 'Pathology', 'Pathology Report', 'Pathway interactions', 'Patients', 'Pattern', 'Performance', 'Pharmaceutical Preparations', 'Public Health', 'Recording of previous events', 'Recurrence', 'Research Personnel', 'Resistance', 'Resistance development', 'Second Primary Cancers', 'Semantics', 'Smoking Status', 'Somatic Mutation', 'Statistical Methods', 'Technology', 'Testing', 'Time', 'Tissues', 'Translational Research', 'Tumor Pathology', 'Tweens', 'United States National Institutes of Health', 'Universities', 'Validation', 'Vermont', 'Woman', 'Work', 'actionable mutation', 'anticancer research', 'base', 'cancer cell', 'cancer therapy', 'cancer type', 'clinically actionable', 'demographics', 'design', 'electronic data', 'genetic profiling', 'improved', 'innovation', 'learning strategy', 'malignant breast neoplasm', 'melanoma', 'men', 'novel', 'personalized medicine', 'power analysis', 'precision medicine', 'resistance mechanism', 'response', 'screening', 'targeted cancer therapy', 'targeted treatment', 'treatment response', 'treatment strategy', 'tumor']",NCI,DARTMOUTH COLLEGE,R01,2019,375150,-0.024838189148194818
"POPULATION GENOMICS OF ADAPTATION Project Summary Malaria that results from Plasmodium falciparum is among the most globally devastating human diseases. The principle vector of malaria, mosquitoes of the Anopheles gambiae species complex, are thus central targets for controlling the human health burden of Plasmodium. For nearly two decades, there have been large-scale, coordinated efforts to diminish mosquito populations, generally through spraying and insecticide treated bed nets. Indeed such control efforts have now led to a nearly 50% decrease in the rates of malaria infection in many parts of sub-Saharan Africa. At present, however, control efforts of A. gambiae are being threatened by evolutionary responses within mosquitos: A. gambiae populations have shown increases in insecticide resistance as well as behavioral adaptations that allow mosquitos to avoid spraying all together. Thus adaptation of mosquitos to the control efforts themselves is currently a risk to maintain the gains made in the fight against malaria. In this proposal we lay out an integrated population genomic approach for systematically identifying regions of the A. gambiae genome that are evolving adaptively in response to ongoing control efforts. Our approach centers upon state-of-the-art supervised machine learning techniques that we have recently introduced for finding the signatures of selective sweeps in genomes (Schrider and Kern, 2016), coupled with the large-scale population genomic datasets currently in production by the Ag1000G consortium. Project Narrative Malaria is a mosquito-borne infectious disease that has enormous impacts on human health globally. For the past 16 years, large gains have been made in decreasing the rate of malaria transmission through control of its mosquito vector Anopheles gambiae; unfortunately at present these control efforts are in danger of collapse due to the evolution of insecticide resistance in the mosquitos. We aim to discover the genomic targets of such resistance through the development of sophisticated population genomic approaches and their application to state-of- the-art genome sequence datasets from Anopheles gambiae.",POPULATION GENOMICS OF ADAPTATION,9753261,R01GM117241,"['Affect', 'Africa South of the Sahara', 'Anopheles Genus', 'Anopheles gambiae', 'Awareness', 'Back', 'Beds', 'Behavioral', 'Catalogs', 'Cessation of life', 'Chromosomes', 'Classification', 'Complex', 'Coupled', 'Culicidae', 'Data', 'Data Set', 'Dependence', 'Detection', 'Development', 'Distant', 'Equipment and supply inventories', 'Evolution', 'Frequencies', 'Funding', 'Genome', 'Genomic approach', 'Genomics', 'Geography', 'Goals', 'Health', 'Human', 'Individual', 'Insecticide Resistance', 'Insecticides', 'Link', 'Location', 'Machine Learning', 'Malaria', 'Methodology', 'Methods', 'Mosquito-borne infectious disease', 'Mutation', 'Pattern', 'Phase', 'Plasmodium', 'Plasmodium falciparum', 'Population', 'Prevalence', 'Production', 'Recording of previous events', 'Research', 'Residual state', 'Resistance', 'Risk', 'Sampling', 'Techniques', 'Time', 'Variant', 'Work', 'deep neural network', 'fight against', 'genomic data', 'global health', 'human disease', 'learning strategy', 'malaria infection', 'malaria mosquito', 'malaria transmission', 'markov model', 'novel', 'recurrent neural network', 'resistance allele', 'response', 'supervised learning', 'tool', 'vector', 'vector control', 'vector mosquito']",NIGMS,UNIVERSITY OF OREGON,R01,2019,295000,0.1015812552719257
"Digital High Resolution Melt and Machine Learning for Rapid and Specific Diagnosis in Neonatal Sepsis Project Summary Blood culture sensitivity in neonates is poor but is the “Gold Standard” for the diagnosis of sepsis. Universal genotyping of pathogen genomic sequences using High Resolution Melt (U-HRM) provides a simple, low cost, rapid, and modern alternative to blood culture testing. By measuring the fluorescence of an intercalating dye as PCR-amplified pathogen DNA fragments are heated and disassociate, sequence defined melt curves are generated with single-nucleotide resolution in a closed-tube reaction. We have advanced U- HRM into a digital PCR format (U-dHRM), where DNA sequences that are present in mixtures are individually amplified and identified as is needed for polymicrobial infections. We have also established unique signature melt curves for 37 bacterial species that commonly infect older children and adults and automatically identify them using machine learning technology. With the goal of creating an accurate and valid test for the timely diagnosis of neonatal sepsis, we will advance this technology to identify unique fungal, viral, and bacterial HRM signatures along with antibiotic resistance genes with an accuracy of 99-100% on minimal blood volume (1mL). Our aims are: Aim 1. Optimize and assess the U-dHRM platform for neonatal bacteremia diagnosis by expand our bacterial database (13 additional bacteria) to detect causes of >99% of neonatal bacterial infections, expand our antibiotic resistance gene database to include five clinically actionable genes, and assessing the performance of the system for bacteremia diagnosis in mock and clinical whole blood samples; Aim 2. Advance the U-dHRM platform for simultaneous detection of fungal and viral pathogens by upgrading our optical system to enable expansion to fungal and viral detection in a high-throughput format, multiplexing the assay to expand to viral and fungal pathogens causing >99% non-bacterial infections, and conducting analytical validation of the multiplexed platform using mock whole blood samples; and Aim 3. Advance the machine learning algorithm for detection of emerging pathogens by developing and integrating an anomaly detection algorithm for reporting emerging pathogens that are not included in our database and validating the algorithm using data generated in Aims 1 and 2. Thus, this proposal directly addresses the funding call by applying a multidisciplinary approach to overcome the biomedical challenge of rapidly diagnosis sepsis, a hidden public health disaster. Project Narrative Digital High Resolution Melting (dHRM) of DNA combined with machine learning creates unique “fingerprints"" for microbes and antibiotic resistance, allowing for faster and more precise detection and treatment of pathogen(s) causing sepsis. This project will advance and test the clinical performance of dHRM technology in the diagnosis of neonatal sepsis. Our goal is to rapidly and accurately identify pathogens and their resistance markers to facilitate accurate antimicrobial therapy, reducing antibiotic overuse in non-infected infants.",Digital High Resolution Melt and Machine Learning for Rapid and Specific Diagnosis in Neonatal Sepsis,9693150,R01AI134982,"['Address', 'Adult', 'Algorithms', 'Antibiotic Resistance', 'Antibiotics', 'Bacteremia', 'Bacteria', 'Bacterial Antibiotic Resistance', 'Bacterial Infections', 'Biological Assay', 'Birth Weight', 'Blood', 'Blood Volume', 'Blood specimen', 'Child', 'Clinical', 'DNA', 'DNA Sequence', 'Data', 'Databases', 'Detection', 'Diagnosis', 'Diagnostic', 'Disasters', 'Dyes', 'Emerging Technologies', 'Exposure to', 'Fingerprint', 'Fluorescence', 'Funding', 'Genes', 'Genome', 'Genotype', 'Goals', 'Gold', 'Hour', 'Immune response', 'Individual', 'Infection', 'Machine Learning', 'Measures', 'Microbe', 'Modernization', 'Neonatal', 'Nucleotides', 'Optics', 'Organism', 'Patients', 'Performance', 'Predisposition', 'Public Health', 'RNA', 'Reaction', 'Reporting', 'Research', 'Resistance', 'Resolution', 'Sampling', 'Sepsis', 'Symptoms', 'System', 'Technology', 'Testing', 'Therapeutic', 'Time', 'Training', 'Tube', 'United States', 'Validation', 'Variant', 'Very Low Birth Weight Infant', 'Viral', 'Whole Blood', 'Woman', 'antimicrobial', 'base', 'circulating DNA', 'clinically actionable', 'clinically relevant', 'cost', 'diagnosis standard', 'digital', 'early onset', 'interdisciplinary approach', 'intrapartum', 'machine learning algorithm', 'melting', 'microbial', 'neonatal sepsis', 'neonate', 'overtreatment', 'pathogen', 'pathogen genome', 'pathogen genomics', 'pathogenic fungus', 'pathogenic virus', 'point of care', 'premature', 'rapid diagnosis', 'resistance gene', 'sample collection', 'septic', 'therapy resistant', 'viral detection']",NIAID,"UNIVERSITY OF CALIFORNIA, SAN DIEGO",R01,2019,423601,0.08152963407038248
"Digital High Resolution Melt and Machine Learning for Rapid and Specific Diagnosis in Neonatal Sepsis Project Summary Blood culture sensitivity in neonates is poor but is the “Gold Standard” for the diagnosis of sepsis. Universal genotyping of pathogen genomic sequences using High Resolution Melt (U-HRM) provides a simple, low cost, rapid, and modern alternative to blood culture testing. By measuring the fluorescence of an intercalating dye as PCR-amplified pathogen DNA fragments are heated and disassociate, sequence defined melt curves are generated with single-nucleotide resolution in a closed-tube reaction. We have advanced U- HRM into a digital PCR format (U-dHRM), where DNA sequences that are present in mixtures are individually amplified and identified as is needed for polymicrobial infections. We have also established unique signature melt curves for 37 bacterial species that commonly infect older children and adults and automatically identify them using machine learning technology. With the goal of creating an accurate and valid test for the timely diagnosis of neonatal sepsis, we will advance this technology to identify unique fungal, viral, and bacterial HRM signatures along with antibiotic resistance genes with an accuracy of 99-100% on minimal blood volume (1mL). Our aims are: Aim 1. Optimize and assess the U-dHRM platform for neonatal bacteremia diagnosis by expand our bacterial database (13 additional bacteria) to detect causes of >99% of neonatal bacterial infections, expand our antibiotic resistance gene database to include five clinically actionable genes, and assessing the performance of the system for bacteremia diagnosis in mock and clinical whole blood samples; Aim 2. Advance the U-dHRM platform for simultaneous detection of fungal and viral pathogens by upgrading our optical system to enable expansion to fungal and viral detection in a high-throughput format, multiplexing the assay to expand to viral and fungal pathogens causing >99% non-bacterial infections, and conducting analytical validation of the multiplexed platform using mock whole blood samples; and Aim 3. Advance the machine learning algorithm for detection of emerging pathogens by developing and integrating an anomaly detection algorithm for reporting emerging pathogens that are not included in our database and validating the algorithm using data generated in Aims 1 and 2. Thus, this proposal directly addresses the funding call by applying a multidisciplinary approach to overcome the biomedical challenge of rapidly diagnosis sepsis, a hidden public health disaster. Project Narrative Digital High Resolution Melting (dHRM) of DNA combined with machine learning creates unique “fingerprints"" for microbes and antibiotic resistance, allowing for faster and more precise detection and treatment of pathogen(s) causing sepsis. This project will advance and test the clinical performance of dHRM technology in the diagnosis of neonatal sepsis. Our goal is to rapidly and accurately identify pathogens and their resistance markers to facilitate accurate antimicrobial therapy, reducing antibiotic overuse in non-infected infants.",Digital High Resolution Melt and Machine Learning for Rapid and Specific Diagnosis in Neonatal Sepsis,9794293,R01AI134982,"['Address', 'Adult', 'Algorithms', 'Antibiotic Resistance', 'Antibiotics', 'Bacteremia', 'Bacteria', 'Bacterial Antibiotic Resistance', 'Bacterial Infections', 'Biological Assay', 'Birth Weight', 'Blood', 'Blood Volume', 'Blood specimen', 'Child', 'Clinical', 'DNA', 'DNA Sequence', 'Data', 'Databases', 'Detection', 'Diagnosis', 'Diagnostic', 'Disasters', 'Dyes', 'Emerging Technologies', 'Exposure to', 'Fingerprint', 'Fluorescence', 'Funding', 'Genes', 'Genome', 'Genotype', 'Goals', 'Gold', 'Hour', 'Immune response', 'Individual', 'Infection', 'Machine Learning', 'Measures', 'Microbe', 'Modernization', 'Neonatal', 'Nucleotides', 'Optics', 'Organism', 'Patients', 'Performance', 'Predisposition', 'Public Health', 'RNA', 'Reaction', 'Reporting', 'Research', 'Resistance', 'Resolution', 'Sampling', 'Sepsis', 'Symptoms', 'System', 'Technology', 'Testing', 'Therapeutic', 'Time', 'Training', 'Tube', 'United States', 'Validation', 'Variant', 'Very Low Birth Weight Infant', 'Viral', 'Whole Blood', 'Woman', 'antimicrobial', 'base', 'circulating DNA', 'clinically actionable', 'clinically relevant', 'cost', 'diagnosis standard', 'digital', 'early onset', 'interdisciplinary approach', 'intrapartum', 'machine learning algorithm', 'melting', 'microbial', 'neonatal sepsis', 'neonate', 'overtreatment', 'pathogen', 'pathogen genome', 'pathogen genomics', 'pathogenic fungus', 'pathogenic virus', 'point of care', 'premature', 'rapid diagnosis', 'resistance gene', 'sample collection', 'septic', 'therapy resistant', 'viral detection']",NIAID,"UNIVERSITY OF CALIFORNIA, SAN DIEGO",R01,2019,58207,0.08152963407038248
"Engineering a diagnostic platform for rapid breath-based respiratory pathogen identification and treatment monitoring Project Summary Acute respiratory infections (ARIs) are caused by a number of bacterial, viral, and fungal pathogens and pathogen identification is needed to administer the correct treatment. However, due to the lagtime in standard biochemical assays and antimicrobial susceptibility testing, clinicians have come to depend on broad-spectrum, empirical treatment which contributes to both drug resistance and patient death. The goal of this project is to develop a breath test for rapid pathogen identification and treatment monitoring in ARI to facilitate more immediate, targeted treatment in the clinic. The current proposal is focused on bacterial pathogen identification with future goals to expand to viral and fungal pathogens. Substrate cleavage assays are currently used to query bacterial protease activity and can be used to rapidly and accurately classify bacteria down to the species level. Leveraging the protease-responsive nanosensor platform in the Bhatia lab, the goal of this proposal is to develop inhalable multiplexed nanosensors that release volatile reporters into the breath in response to infection- associated proteases in the lung. From there, we can generate breath “fingerprints” for pathogens common in ARIs such as ventilator-associated pneumonia (VAP) (P. aeruginosa, S. aureus, K. pneumoniae, E. coli, S. pneumoniae, and H. influenzae). Furthermore, changes in proteolytic activity after the start of antimicrobial treatment can be used to generate a “good response” and “poor response” breath signature for more timely evaluation of drug efficacy. To this end, the specific aims of this project are the following: (1) establish a volatile- barcoding system for peptide substrates (2) build and validate an inhalable multiplexed system of protease nanosensors for pathogen identification and (3) investigate use of multiplexed protease nanosensors for monitoring response to antibiotic treatment. Aim 1 will be completed by identifying volatile reporter candidates that can be attached to peptide substrates without deleterious effects on cleavage kinetics, protease specificity, and breath signal. Once identified, volatile reporters will be isotope-labeled to create a panel of reporters with similar volatility differing only by mass. Peptides with orthogonal susceptibility to host and pathogen proteases will then be identified in Aim 2 by screening a peptide library against bacterial culture supernatants and bronchioalveolar lavage from infected mice. Peptides will then be barcoded using the VOC mass labels designed in Aim 1 and then formulated into inhalable nanosensors by attachment to a nanoparticle core. The resulting nanosensor panel will be delivered via intratracheal injection into mice infected with one of the six VAP pathogens. Machine learning will be used to generate a statistical classifier to identify pathogens based on reporter levels in breath and will be used to further identify reporter signatures for good and poor response to antibiotic treatment. Successful completion of these aims would result in a diagnostic platform that can potentially be expanded for rapid identification of an exhaustive list of respiratory pathogens, including viral and fungal pathogens. Rapid identification of the cause of respiratory infection is necessary to prescribe the correct drugs for treatment. In the following work, we propose to develop tiny, inhalable bacteria sensors for a breathalyzer test that would enable rapid identification of infectious bacteria in the lung. This would allow the correct drugs to be prescribed and prevent antibiotic overuse which contributes to the growing problem of drug resistance.",Engineering a diagnostic platform for rapid breath-based respiratory pathogen identification and treatment monitoring,9805608,K99EB028311,"['Acute respiratory infection', 'Aftercare', 'Animals', 'Antibiotic Therapy', 'Antibiotics', 'Antimicrobial susceptibility', 'Bacteria', 'Bacterial Pneumonia', 'Biochemical', 'Biological Assay', 'Blinded', 'Blood', 'Breath Tests', 'Breathalyzer Tests', 'Bronchoalveolar Lavage', 'Cessation of life', 'Chemicals', 'Classification', 'Clinic', 'Clinical', 'Data', 'Detection', 'Diagnosis', 'Diagnostic', 'Diagnostic tests', 'Disease', 'Drug Evaluation', 'Drug resistance', 'Early Diagnosis', 'Engineering', 'Enzymes', 'Escherichia coli', 'Esters', 'Fingerprint', 'Fluorocarbons', 'Future', 'Goals', 'Haemophilus influenzae', 'Hydroxyl Radical', 'Immune response', 'In Vitro', 'Infection', 'Inhalation', 'Injections', 'Isotope Labeling', 'Kinetics', 'Klebsiella pneumonia bacterium', 'Label', 'Leukocyte Elastase', 'Libraries', 'Ligands', 'Liposomes', 'Lung', 'Machine Learning', 'Mass Spectrum Analysis', 'Measures', 'Methods', 'Monitor', 'Mus', 'Patients', 'Peptide Hydrolases', 'Peptide Library', 'Peptides', 'Pharmaceutical Preparations', 'Pharmacotherapy', 'Predisposition', 'Property', 'Pseudomonas aeruginosa', 'Randomized', 'Reporter', 'Research Personnel', 'Resistance', 'Respiratory Tract Infections', 'Sensitivity and Specificity', 'Signal Transduction', 'Specificity', 'Sputum', 'Staphylococcus aureus', 'Streptococcus pneumoniae', 'Survival Rate', 'System', 'Testing', 'Time', 'Tissues', 'Validation', 'Work', 'antimicrobial', 'antimicrobial drug', 'base', 'biomaterial compatibility', 'classification algorithm', 'cohort', 'design', 'drug efficacy', 'exhaustion', 'extracellular', 'in vivo', 'mouse model', 'nanoparticle', 'nanosensors', 'outcome forecast', 'pathogen', 'pathogenic bacteria', 'pathogenic fungus', 'pathogenic virus', 'portability', 'pressure', 'prevent', 'random forest', 'resistant strain', 'respiratory', 'response', 'screening', 'sensor', 'targeted treatment', 'thioester', 'urinary', 'vapor', 'ventilator-associated pneumonia', 'volatile organic compound']",NIBIB,MASSACHUSETTS INSTITUTE OF TECHNOLOGY,K99,2019,87484,0.035768110454291714
