text,title,id,project_number,terms,administration,organization,mechanism,year,funding,score
"Mobile Genetic Elements and Clinical Outcomes in Staphylococcus aureus Bacteremia Project Summary Antimicrobial resistance (AMR) and its impact on health has been recognized as one of the most serious public health threats facing society. Significantly, the vast majority of acquired AMR genes are carried on mobile genetic elements (MGEs), which include plasmids, insertion sequences, and transposons. One of the most important hospital and community-associated pathogens harboring resistance genes is Staphylococcus aureus, which causes more than 80,000 infections and 11,000 deaths each year in the United States. S. aureus readily acquire MGEs, which encompass more than 20% of the genome for most strains, and these elements have been central to the establishment and broad spread of resistance to antibiotics such as oxacillin and vancomycin. Additionally, S. aureus is capable of causing a wide range of infections, including bacteremia, with a mortality rate up to 30%. Utilizing an unparalleled collection of S. aureus strains from a cohort of patients in Central and South America with bacteremia, I seek to develop a framework for the identification and comparison of circulating MGEs through the use of bacterial phylogenetics, clinical epidemiology, and machine learning. This dataset will serve as the foundation for my training to become an independent scientist. To begin interrogating this exceptional strain collection, we have generated Illumina short-read whole genome sequencing data on 1,087 S. aureus bacteremia isolates to identify MGEs, and will leverage novel ultra-long read sequencing methodologies to fully characterize the position and variations of these elements. The three aims within this proposal are designed to elucidate the role of MGEs in driving the genetic diversification of endemic S. aureus clades, and identify if they serve as adaptation hotspots when put under selective pressure from the host immune system or antibiotics. First, I will characterize the repertoire of MGEs within this large cohort of isolates and apply gene-order and Bayesian time-measured phylogenetics to identify the predominant MGEs within each clade and how frequently they are acquired and lost. Second, I will assess the MGE diversity within isolates collected serially from the same individual. I hypothesize these MGEs will be the primary variation points and will be more important than single nucleotide polymorphisms (SNPs) to the adaptation to selective pressures such as antibiotics. Third, I will identify the clinical (age, BMI, and present comorbidities) and genomic (SNPs, MGEs, and genes) features that are predictive of the 30-day mortality in the predominant clades of S. aureus within our dataset. I theorize these genetic and clinical signatures will be different for each clade as they possess different repertoires of MGEs. The Center for Antimicrobial Resistance and Microbial Genomics in The University of Texas Health Sciences Center at Houston has a firm commitment to understanding and reducing AMR and AMR infections. This provides an exceptional environment to conduct my research elucidating the role of MGEs in the clinical outcomes of S. aureus bacteremia, and to develop as an investigator and participate in the training offered to make the transition to independence. Project Narrative Antimicrobial resistance (AMR) and its impact on health has been recognized as one of the most serious global public health threats facing our society. This proposal aims to clarify the role mobile genetic elements play in transmitting antimicrobial resistance and driving genetic diversity within endemic Staphylococcus aureus lineages causing bacteremia. Additionally, this research will provide the platform for the career development of a young scientist focused on bacterial phylogenetics, clinical epidemiology, and machine learning methods to tackle the dire consequences of AMR.",Mobile Genetic Elements and Clinical Outcomes in Staphylococcus aureus Bacteremia,10055522,K01AI148593,"['Age', 'Antibiotic Resistance', 'Antibiotics', 'Antimicrobial Resistance', 'Automobile Driving', 'Bacteremia', 'Bacterial Genome', 'Bypass', 'Carbon', 'Centers for Disease Control and Prevention (U.S.)', 'Central America', 'Cessation of life', 'Clinical', 'Clonal Expansion', 'Collection', 'Communities', 'Complex', 'DNA Insertion Elements', 'Data', 'Data Set', 'Detection', 'Development', 'Disease', 'Elements', 'Endocarditis', 'Environment', 'Evolution', 'Foundations', 'Gene Order', 'Genes', 'Genetic', 'Genetic Variation', 'Genome', 'Genomics', 'Geographic Locations', 'Geography', 'Health', 'Health Sciences', 'Horizontal Gene Transfer', 'Hospitals', 'Immune', 'Immune system', 'Individual', 'Infection', 'Laboratories', 'Light', 'Machine Learning', 'Measures', 'Methodology', 'Microbial Biofilms', 'Mobile Genetic Elements', 'Molecular Genetics', 'Outcome', 'Oxacillin', 'Patient Recruitments', 'Patient-Focused Outcomes', 'Patients', 'Phylogenetic Analysis', 'Phylogeny', 'Plasmids', 'Play', 'Population', 'Positioning Attribute', 'Public Health', 'Research', 'Research Personnel', 'Resistance', 'Resistance to infection', 'Role', 'Sampling', 'Science', 'Scientist', 'Sepsis', 'Single Nucleotide Polymorphism', 'Site', 'Skin Tissue', 'Societies', 'Soft Tissue Infections', 'South America', 'Staphylococcus aureus', 'Technology', 'Texas', 'Time', 'Training', 'Treatment Failure', 'United Nations', 'United States', 'United States National Institutes of Health', 'Universities', 'Vancomycin', 'Variant', 'Virulence', 'Virulence Factors', 'Work', 'beta-Lactams', 'career development', 'clinical epidemiology', 'clinically relevant', 'cohort', 'common treatment', 'comorbidity', 'design', 'fitness', 'genetic signature', 'genome sequencing', 'human pathogen', 'insight', 'machine learning method', 'methicillin resistant Staphylococcus aureus', 'microbial genomics', 'mortality', 'nanopore', 'novel', 'pathogen', 'predictive signature', 'pressure', 'random forest', 'reconstruction', 'resistance gene', 'tool', 'transmission process', 'whole genome']",NIAID,UNIVERSITY OF TEXAS HLTH SCI CTR HOUSTON,K01,2020,129870,0.06182416382265234
"Rapid fungal identification and antifungal susceptibility testing through quantitative, multiplexed RNA detection PROJECT SUMMARY / ABSTRACT  Timely diagnostics for fungal infections are sorely needed to guide effective therapy. Invasive fungal infections are increasing in prevalence, causing millions of deaths each year worldwide, and drug resistance poses a rising threat. Due in large part to slow, outmoded diagnostics that require days of culture to identify the pathogen and report its antifungal susceptibility profile, mortality from invasive fungal infections can exceed 40%. This in turn leads clinicians to rely on empiric and prophylactic use of antifungals that may be ineffective, cause needless toxicity, and select for resistance. Rapid precision diagnostic assays are critically needed to improve patient outcomes and guide efficient deployment of our limited antifungal arsenal.  To address this urgent public health need, in response to a specific funding opportunity announcement on “Advancing Development of Rapid Fungal Diagnostics” (PA-19-080), this proposal describes a strategy for rapid fungal identification and antifungal susceptibility testing based on RNA signatures. This approach relies on a novel paradigm for pathogen diagnostics, recently validated in bacteria and implemented on a simple, robust, quantitative, multiplexed fluorescent hybridization assay on the NanoString platform. Detection of highly abundant, conserved ribosomal RNA (rRNA) sequences enables broad-range, ultrasensitive pathogen identification. Meanwhile, quantifying key messenger RNA levels following antimicrobial exposure enables phenotypic antimicrobial susceptibility testing (AST), relying on the principle that cells that are dying or growth- arrested are transcriptionally distinct within minutes from those that are not (Bhattacharyya et al, Nature Medicine, in press). Because this approach to AST measures gene expression as an early phenotypic change in susceptible strains, it does not rely on foreknowledge of the genetic basis of resistance in order to classify susceptibility, and can thus be generalized to any pathogen-antimicrobial pair.  This proposal aims to first computationally design and experimentally validate a set of hybridization probes to uniquely recognize the 18S and 28S rRNA from each of 48 clinically significant fungal pathogens that together cause the vast majority of invasive fungal infections in humans. Preliminary data show that these rRNA targets are abundant enough to detect a single fungal cell without amplification, enabling ultrasensitive detection in <4 hours directly from clinical samples. Next, RNA-Seq will be used to profile transcriptional changes in 12 common fungal pathogens for which resistance has important clinical consequences in response to treatment with the three major classes of antifungals. Antifungal-responsive transcripts that best classify fungal isolates as susceptible or resistant will be chosen by adapting machine learning algorithms that were developed for this purpose in bacteria. Finally, both approaches will be piloted on simulated and real clinical fungal samples. Preliminary data suggest that these approaches can identify fungi within <4 hours from a primary sample, and deliver AST results within <6 hours of a positive fungal culture. PROJECT NARRATIVE Fungal infections are common, increasing in frequency and severity, and cause considerable morbidity and mortality. Early recognition of invasive fungal infection, and prompt initiation of effective antifungal therapy, are key to improving patient outcomes. This proposal aims to adapt a novel paradigm for rapid pathogen identification and antimicrobial susceptibility testing through the quantitative detection of RNA signatures to transform fungal diagnostics.","Rapid fungal identification and antifungal susceptibility testing through quantitative, multiplexed RNA detection",10034036,R01AI153405,"['Address', 'Advanced Development', 'Antibiotics', 'Antifungal Agents', 'Antifungal Therapy', 'Antimicrobial susceptibility', 'Aspergillus', 'Azoles', 'Bacteria', 'Bacterial Infections', 'Bacterial RNA', 'Biological Assay', 'Biopsy Specimen', 'Blood', 'Bronchoalveolar Lavage', 'Candida', 'Candida auris', 'Cells', 'Cessation of life', 'Class Zygomycetes', 'Classification', 'Clinical', 'Clinical Management', 'Clinical Microbiology', 'Collaborations', 'Data', 'Detection', 'Diagnosis', 'Diagnostic', 'Diagnostic tests', 'Drug resistance', 'Frequencies', 'Funding Opportunities', 'Gene Expression', 'Gene Expression Profile', 'Gene Expression Profiling', 'Genetic', 'Genetic Transcription', 'Genotype', 'Goals', 'Growth', 'Hour', 'Human', 'Immunoglobulin Variable Region', 'Measures', 'Medical', 'Medicine', 'Messenger RNA', 'Methods', 'Modeling', 'Morbidity - disease rate', 'Multi-Drug Resistance', 'Mycoses', 'Nature', 'Patient-Focused Outcomes', 'Patients', 'Pattern', 'Performance', 'Phenotype', 'Phylogenetic Analysis', 'Polyenes', 'Positioning Attribute', 'Predisposition', 'Prevalence', 'Public Health', 'RNA', 'RNA Sequences', 'RNA, Ribosomal, 28S', 'Reporting', 'Resistance', 'Ribosomal RNA', 'Sampling', 'Severities', 'Skin', 'Specimen', 'Speed', 'Sputum', 'Swab', 'Symptoms', 'Taxonomy', 'Test Result', 'Testing', 'Time', 'Toxic effect', 'Transcript', 'Urine', 'Work', 'antimicrobial', 'base', 'clinically significant', 'computational pipelines', 'design', 'diagnostic assay', 'effective therapy', 'efflux pump', 'experience', 'fungus', 'improved', 'machine learning algorithm', 'microbial', 'mortality', 'nano-string', 'novel', 'novel strategies', 'overexpression', 'pathogen', 'pathogenic fungus', 'patient population', 'personalized diagnostics', 'prophylactic', 'random forest', 'resistance mechanism', 'response', 'transcriptome sequencing', 'transcriptomics', 'treatment response']",NIAID,"BROAD INSTITUTE, INC.",R01,2020,645818,-0.021875128240956037
"NeoChip for specific and rapid identification of congenital CMV and neonatal HSV infections on minimal sample volume Project Summary  Congenital cytomegalovirus (cCMV) and neonatal herpes simplex virus (nHSV) impose major health threats on neonates. Although CMV and HSV are lifelong infections with periods of latency and reactivation, most maternal infections remain undiagnosed due to nonspecific or absent clinical symptoms. In the United States, a child is permanently disabled by cCMV infection every hour, even though 9 of 10 infants are asymptomatic after birth and remain undiagnosed. Invasive nHSV, on the other hand, is a rare neonatal infection that presents with a broad range of clinical symptoms, including those that may be life-threatening. Viral culture and DNA detection by polymerase chain reaction (PCR) have become the “Gold Standard” for the diagnosis of cCMV and nHSV infection, despite poor sensitivity of PCR assays in neonates and time consuming culture techniques (up to 5-7 days).  Universal genotyping of pathogen genomic sequences using High Resolution Melt (U-HRM) provides a simple, low cost, rapid, and modern alternative to viral cultures and PCR techniques. By measuring the fluorescence of an intercalating dye as PCR-amplified pathogen DNA or RNA fragments are heated and disassociate, sequence defined melt curves, or “fingerprints”, are generated with single-nucleotide resolution in a closed-tube reaction. These unique microbial “fingerprints” are then automatically identified and quantified using machine learning technology, with an accuracy of 99-100% on minimal blood volume (1 mL), in a platform called NeoChip. Presently, we have established unique signature melt curves for 40 bacterial species and antimicrobial resistance genes that commonly infect neonates. Additionally, NeoChip has been expanded to distinguish individually amplified melt curve signatures for multiple pathogen identification and quantification, as required for polymicrobial infection.  In this proposal, we will build out NeoChip’s comprehensive database by incorporating clinical strains of CMV and HSV with actionable antiviral resistance genes. Because NeoChip identifies variances in nucleic acid sequences, individual differentiation and quantification of CMV and HSV strains are possible. We will also translate the NeoChip for specific and rapid diagnosis of cCMV and nHSV infection in a large prospective clinical study of pregnant women and their offspring(s), as well as directly compare the platform to standard quantitative nucleic acid test (QNAT) assays, IgG/IgM antibody testing, and clinical outcome measures for statistical concordance (predictive value). Finally, we will validate and translate NeoChip for cCMV detection and clinical correlation using dried blood spot (DBS) samples for incorporation into standard universal newborn screening programs. NeoChip’s goal is to provide an accurate and valid test for the timely diagnosis of pathogen etiology (viral, bacterial, and fungal) in a single test with efficacy on broad tissue matrices and capacity to inform microbial resistance, thereby facilitating early administration of targeted antimicrobials and therapeutics. This proposal directly addresses the funding call by applying a multidisciplinary approach to address the biomedical challenges of rapidly and accurately diagnosing cCMV and nHSV to facilitate disease prognostication and early therapeutic or intervention programs. Project Narrative NeoChip combines real-time PCR, digital High Resolution Melting (dHRM) of DNA and RNA, and machine learning to create unique “fingerprints"" for microbes and antimicrobial resistance, allowing for faster and more precise detection of pathogen(s) causing neonatal infection. This project will build out NeoChip’s melt curve database to include clinically relevant strains of cytomegalovirus and herpes simplex virus infections, while concordantly assembling updated epidemiologic timelines and prevalence of perinatal CMV and HSV transmission. Our goals are to validate NeoChip for the rapid and specific diagnosis of congenital CMV and neonatal HSV infection on multiple tissue matrices and translate the NeoChip platform for incorporation into standard universal newborn screening for the diagnosis of congenital cytomegalovirus on dried blood spot samples.",NeoChip for specific and rapid identification of congenital CMV and neonatal HSV infections on minimal sample volume,10050866,R01HD099250,"['Address', 'Advocate', 'Antibiotics', 'Antibodies', 'Antimicrobial Resistance', 'Antiviral Agents', 'Antiviral resistance', 'Artificial Intelligence', 'Base Sequence', 'Biological', 'Biological Assay', 'Birth', 'Blinded', 'Blood', 'Blood Volume', 'Blood specimen', 'California', 'Child', 'Clinical', 'Clinical Research', 'Congenital herpes simplex', 'Consumption', 'Culture Techniques', 'Cytomegalovirus', 'DNA', 'Data', 'Databases', 'Detection', 'Diagnosis', 'Diagnostic', 'Disabled Persons', 'Disease', 'Dyes', 'Early Intervention', 'Early identification', 'Enrollment', 'Epidemiology', 'Etiology', 'Evaluation', 'Failure', 'Fingerprint', 'Fluorescence', 'Funding', 'Genome', 'Genotype', 'Goals', 'Gold', 'Health', 'Hour', 'Immunoglobulin G', 'Immunoglobulin M', 'Individual', 'Infant', 'Infection', 'Investigation', 'Laboratories', 'Life', 'Machine Learning', 'Measures', 'Methods', 'Microbe', 'Modality', 'Modernization', 'Molecular', 'Mothers', 'Neonatal', 'Neonatal Screening', 'Newborn Infant', 'Nucleic Acid Amplification Tests', 'Nucleotides', 'Outcome', 'Outcome Measure', 'Pathogen detection', 'Pathogenicity', 'Patients', 'Perinatal', 'Polymerase Chain Reaction', 'Predictive Value', 'Pregnant Women', 'Prevalence', 'RNA', 'Reaction', 'Reporting', 'Research', 'Research Personnel', 'Resistance', 'Resolution', 'Risk', 'Saliva', 'Sampling', 'Sensitivity and Specificity', 'Simplexvirus', 'Spottings', 'Symptoms', 'Techniques', 'Technology', 'Testing', 'Therapeutic', 'Therapeutic Intervention', 'Time', 'TimeLine', 'Tissues', 'Training', 'Translating', 'Tube', 'United States', 'Universities', 'Update', 'Urine', 'Variant', 'Viral', 'Viral Load result', 'Virus Diseases', 'accurate diagnosis', 'antimicrobial', 'base', 'biobank', 'clinical database', 'clinically relevant', 'congenital cytomegalovirus', 'cost', 'diagnosis standard', 'diagnostic biomarker', 'digital', 'intelligent algorithm', 'interdisciplinary approach', 'intervention program', 'machine learning algorithm', 'melting', 'microbial', 'multidisciplinary', 'neonatal infection', 'neonate', 'next generation sequencing', 'offspring', 'pathogen', 'pathogen genomics', 'pathogenic virus', 'point of care', 'postnatal', 'prevent', 'prognostic', 'prospective', 'rapid diagnosis', 'resistance gene', 'screening program', 'single molecule', 'tool', 'transmission process', 'viral detection']",NICHD,"UNIVERSITY OF CALIFORNIA, SAN DIEGO",R01,2020,671761,0.05848641141978061
"Integration of Evolution to Avoid Resistance in Structure Based Drug Design Integration of Evolution to Avoid Resistance in Structure Based Drug Design Many of the most deadly diseases that plague our society evolve quickly, challenging our therapeutic strategies. Drug resistance occurs as a result of this evolution when drug pressure changes the balance of molecular recognition events, selectively weakening inhibitor binding while maintaining the biological function of the therapeutic target. Disrupting the therapeutic target’s activity is necessary but not sufficient to avoid resistance. We hypothesize that the multi-dimensional landscape of resistance evolution can be elucidated through integration of experimental and computational data to reveal the key pathways and coupled molecular mechanisms to resistance. Furthermore, we hypothesize that this strategy can be incorporated into structure-based drug design to evaluate novel inhibitors.  Resistance occurs under gradual and persistent drug pressure, and interestingly the mutations are not limited to the active site of a drug target, but can occur throughout the enzyme to confer high levels of resistance. The molecular mechanism by which this resistance occurs is not clear. Our aim is to exploit the rich and versatile experimental data, integrating inhibitor potency and crystallographic structures with ensemble dynamics in an internally consistent manner using machine learning to elucidate both the molecular mechanisms of drug resistance and generate predictive models of inhibitor potency. Integration of Evolution to Avoid Resistance in Structure Based Drug Design Many of the most deadly diseases that plague our society evolve quickly, challenging our therapeutic strategies. Drug resistance occurs as a result of this evolution when drug pressure changes the balance of molecular recognition events, selectively weakening inhibitor binding while maintaining the biological function of the therapeutic target. We hypothesize that the multi- dimensional landscape of resistance evolution can be elucidated through integration of experimental and computational data to reveal the key pathways and coupled molecular mechanisms to resistance and thereby advance drug design.",Integration of Evolution to Avoid Resistance in Structure Based Drug Design,10051980,R01GM135919,"['Active Sites', 'Amino Acid Sequence', 'Binding', 'Binding Sites', 'Biological Models', 'Biological Process', 'Chemicals', 'Clinical', 'Complex', 'Coupled', 'Data', 'Data Set', 'Dihydrofolate Reductase', 'Disease', 'Distal', 'Drug Design', 'Drug Targeting', 'Drug resistance', 'Enzyme Inhibitor Drugs', 'Enzymes', 'Epidermal Growth Factor Receptor', 'Equilibrium', 'Event', 'Evolution', 'HIV', 'HIV-1 protease', 'Human', 'Machine Learning', 'Malignant Neoplasms', 'Maps', 'Modeling', 'Modification', 'Molecular', 'Mutation', 'Oncology', 'Pathogenicity', 'Pathway interactions', 'Performance', 'Pharmaceutical Preparations', 'Phosphotransferases', 'Plague', 'Protease Inhibitor', 'Protein Dynamics', 'Protein Tyrosine Kinase', 'Research', 'Resistance', 'Resistance profile', 'Site', 'Societies', 'Structure', 'Supervision', 'System', 'Testing', 'Therapeutic', 'Variant', 'Viral', 'Virus', 'base', 'bcr-abl Fusion Proteins', 'design', 'experience', 'improved', 'inhibitor/antagonist', 'insight', 'machine learning method', 'molecular dynamics', 'molecular recognition', 'novel', 'predictive modeling', 'pressure', 'resistance mechanism', 'resistance mutation', 'supervised learning', 'therapeutic target', 'tool']",NIGMS,UNIV OF MASSACHUSETTS MED SCH WORCESTER,R01,2020,659437,0.12894759863832767
