text,title,id,project_number,terms,administration,organization,mechanism,year,funding,score
"The Interdependency of Drug Resistance Evolution and Drug Design: HIV-1 Protease DESCRIPTION: Many of the most deadly diseases that plague our society evolve quickly, challenging most of our therapeutic strategies. The pressures of evolution will likely result in a variety of pathways for resistance to evolve. Drug resistance can be caused by a change in the balance of molecular recognition events that selectively weakens inhibitor binding but maintains the biological function of the therapeutic target. To reduce the likelihood of drug resistance, the interdependency of the target's function within the context of the biological system in which it exists must be elucidated. Disrupting the therapeutic target's activity is necessary but not sufficient for avoiding resistance. In this collaborative proposal we hypothesize that key pathways and coupled mechanisms confer drug resistance to therapeutic targets. We seek to define the sequence, structural and dynamic, and temporal evolutionary constraints of the interdependency of drug resistance: 1) to recognize the pathways by which resistance occurs and 2) to devise drug design strategies for developing a drug that is robust against resistance. HIV-1 Protease is the perfect case study! HIV evolves very quickly with on average a point mutation introduced in every third genome replicated. HIV protease inhibitors have the potential of being both very potent and robust to resistance. Protease inhibitors are the only HIV inhibitor class that are transition state analogs and can be evolutionarily constrained within the substrate envelope. Inhibitors that leverage both of these characteristics, such as Darunavir (DRV) and similar analogs, have the potential of being robust, nearly resistance proof inhibitors, to drug- naïve HIV infected patients. If HIV achieves resistance to these inhibitors it is only through complex pathways and combinations of mutations. Further elucidating these complex pathways will bring us closer to resistance-proof inhibitors. In this project our team will use and develop cutting-edge technology to follow the pathways of drug resistance selection, to elucidate the molecular basis for their interdependent patterns and incorporate these mechanisms into drug design strategies. Together we will make inroads into tackling drug resistance that would be impossible for any of us to individually achieve PUBLIC HEALTH RELEVANCE: Many of the most deadly diseases that plague our society evolve quickly, challenging most of our therapeutic strategies. The pressures of evolution will likely result in a variety of pathways for resistance to evolve. HIV evolves very quickly with on average a point mutation introduced in every third genome replicated. HIV protease inhibitors have the potential of being both very potent and robust to resistance. If HIV achieves resistance to these potent drugs it is only through complex pathways and combinations of mutations. In this project our team will use and develop cutting-edge technology to follow the pathways of drug resistance selection, to elucidate the molecular basis for their interdependent patterns and incorporate these mechanisms into drug design strategies",The Interdependency of Drug Resistance Evolution and Drug Design: HIV-1 Protease,9314781,P01GM109767,"['Active Sites', 'Affinity', 'Binding', 'Biochemical', 'Biological Process', 'Case Study', 'Cell Culture Techniques', 'Characteristics', 'Complex', 'Computational Technique', 'Coupled', 'Data', 'Disease', 'Drug Design', 'Drug resistance', 'Drug resistance pathway', 'Engineering', 'Enzyme Kinetics', 'Enzymes', 'Equilibrium', 'Event', 'Evolution', 'Genome', 'HIV', 'HIV Protease Inhibitors', 'HIV-1', 'HIV-1 protease', 'Health', 'Machine Learning', 'Methods', 'Minor', 'Molecular', 'Mutagenesis', 'Mutation', 'Pathway interactions', 'Patients', 'Pattern', 'Pattern Recognition', 'Peptide Hydrolases', 'Pharmaceutical Preparations', 'Physics', 'Plague', 'Point Mutation', 'Predisposition', 'Probability', 'Process', 'Protease Inhibitor', 'Quantitative Evaluations', 'Resistance', 'Resistance development', 'Resistance profile', 'Scheme', 'Site', 'Societies', 'Structure', 'Technology', 'Testing', 'Therapeutic', 'Thermodynamics', 'Variant', 'Viral', 'Viral Proteins', 'Virus', 'analog', 'base', 'biological systems', 'data integration', 'deep sequencing', 'design', 'fitness', 'genome sequencing', 'humanized mouse', 'improved', 'inhibitor/antagonist', 'molecular recognition', 'mouse model', 'novel', 'pressure', 'simulation', 'therapeutic target']",NIGMS,UNIV OF MASSACHUSETTS MED SCH WORCESTER,P01,2016,89751,0.12822905150094946
"Genomics-based prediction of antibiotic failure in S. aureus infections ﻿    DESCRIPTION (provided by applicant)    The Gram positive bacterium Staphylococcus aureus is both an asymptomatic human colonizer and a pathogen that can cause infections in multiple tissue sites, including blood, skin and soft tissue, bone, and internal organs. Methicillin resistant Staphylococcus aureus (MRSA) is a common cause of death by hospital infections (HA-MRSA) and is now also a common community acquired infection (CA-MRSA). Vancomycin (a glycopeptide antibiotic) is the most commonly prescribed drug to treat MRSA infections. High-level resistance (minimal inhibitory concentration (MIC) ≥16 μg/ml) to vancomycin encoded by the mobile vanA gene is rare due to a fitness burden on S. aureus. However, it is more common to encounter strains with mutations conferring intermediate resistance to vancomycin arising from selection during the course of antibiotic therapy. The genetic basis of these vancomycin intermediate S. aureus (VISA) and heterogeneous resistant (hVISA) (MIC 2-8 μg/ml) strains involves a large number of different genomic mutations that result in cell wall thickening through changes in cellular signaling and regulation. Routine phenotypic testing in clinical labs probably underestimates the incidence of VISA and hVISA. Due to the fact that mutations in several genes have been linked with VISA, genetic-based detection of intermediate vancomycin resistance has not been developed for routine clinical microbiological use. In our preliminary work, we created an extensive catalog of sequenced clinical and laboratory-selected VISA as well as databases of SNPs and genetic variation in thousands of public S. aureus genomes. In this work we plan to extend these studies toward development of a sequence-based testing protocol that could be used for large numbers of clinical strains. In Specific Aim 1 we plan to extend our knowledge of the mutations that cause VISA by sequencing a panel of 300 novel mutants strains spontaneously selected from 40 S. aureus parent genotypes. We estimate, based on the results of the preliminary data, that this number of strains will be sufficient identify mutations found in 95% of VISA strains. These data will be used for creation of a comprehensive VISA detection assay based on whole genome data with an accuracy of at least 95%. In Specific Aim 2 we will use the information learned from Aim 1 to create a multiplex PCR sequence test for VISA, VRSA and other resistance determinants of S. aureus based on the commercially available Fluidigm platform. We will ultimately aim to have an assay that can be used to monitor systemic MRSA infections, such as bacteremia, to detect development of VISA in its early stages in clinical specimens from the patient. The test will also be able to detect other S. aureus resistance phenotypes and call the genotype of the strain.             PUBLIC HEALTH RELEVANCE    Vancomycin is an antibiotic commonly used to treat methicillin resistant Staphylococcus aureus (MRSA) infections in chronically ill patients. The efficacy of this relatively cheap and well-tolerated therapy is compromised by mutations in the genome of the bacterium. In this project we propose to develop a genetic test based on a library of MRSA genome sequences with known antibiotic susceptibility level that identifies bacteria with diminished resistance to vancomycin.            ",Genomics-based prediction of antibiotic failure in S. aureus infections,9017369,R21AI121860,"['Address', 'Antibiotic Resistance', 'Antibiotic Therapy', 'Antibiotic susceptibility', 'Antibiotics', 'Bacteremia', 'Bacteria', 'Base Sequence', 'Biological Assay', 'Blood', 'Cataloging', 'Catalogs', 'Cause of Death', 'Cell Wall', 'Chronically Ill', 'Clinical', 'Community-Acquired Infections', 'Complex', 'Computer software', 'Data', 'Data Set', 'Databases', 'Detection', 'Development', 'Drug Prescriptions', 'Evolution', 'Failure', 'Frequencies', 'Genes', 'Genetic', 'Genetic Variation', 'Genetic screening method', 'Genome', 'Genomics', 'Genotype', 'Glycopeptide Antibiotics', 'Goals', 'Gram-Positive Bacteria', 'Healthcare', 'Human', 'Incidence', 'Infection', 'Intermediate resistance', 'Knowledge', 'Laboratories', 'Lead', 'Learning', 'Libraries', 'Link', 'Machine Learning', 'Methicillin', 'Modeling', 'Monitor', 'Mutation', 'Nosocomial Infections', 'Organ', 'Parents', 'Patients', 'Phenotype', 'Protocols documentation', 'Regulation', 'Resistance', 'Signal Transduction', 'Site', 'Skin Tissue', 'Specimen', 'Staging', 'Staphylococcus aureus', 'Testing', 'Tissues', 'Training', 'Treatment Failure', 'University Hospitals', 'Vancomycin', 'Vancomycin Resistance', 'Vancomycin-resistant S. aureus', 'Variant', 'Virulence', 'Work', 'base', 'bone', 'clinical sequencing', 'design', 'economic cost', 'fitness', 'genetic predictors', 'genetic variant', 'genome sequencing', 'interest', 'methicillin resistant Staphylococcus aureus', 'mortality', 'mutant', 'novel', 'pathogen', 'pleiotropism', 'public health relevance', 'soft tissue', 'tool', 'whole genome']",NIAID,EMORY UNIVERSITY,R21,2016,234000,0.09169254084934263
"Systems Biology of Microbiome-mediated Resilience to Antibiotic-resistant Pathogens ﻿    DESCRIPTION (provided by applicant): Infections caused by antibiotic-resistant bacterial pathogens are exceedingly common in immunocompromised hosts. Patients undergoing allogeneic hematopoietic stem cell transplantation (allo-HSCT) are particularly susceptible to these infections and are the patient population our studies will focus upon. Our goal is to extend and further develop systems biology approaches that our group has pioneered to identify mechanisms by which the intestinal microbiota confers resistance to infection by Vancomycin-resistant Enterococcus (VRE), antibiotic-resistant Klebsiella pneumoniae (arKp) and Clostridium difficile (C. diff). Aim 1 of our project is to establish a clinical database from the hospital recrds of allo-HSCT patients during their initial hospitalization that will include all laboratory values,vital signs, pharmacy data, dietary data, symptoms and physical exam findings. Aim 2 will expand our fecal bank by collecting fecal samples from approximately 160 allo-HSCT patients per year and determining the presence/absence of VRE, arKp and C. diff by culture and PCR. We will use NGS of 16S rRNA genes to determine microbiota composition on each sample, will perform metagenomic and RNA sequencing to determine the bacterial transcriptome and perform metabolomic analyses on a selected subset of fecal samples. Aim 3 is to extend our mathematical modeling to identify specific members of the microbiota, metabolic pathways and metabolic products that correlate with resistance to VRE or arKp expansion in the GI tract or are associated with resistance to C. diff infection. The clinical database will be used to establish correlations between clinical treatments or events and changes in the intestinal microbiota or the expression of bacterial metabolic pathways. Ultimately, the computational platforms developed in aim 3 will identify bacterial species or consortia that are associated with resistance to infection and Aim 4 will test these associations in germ-free mouse models. We will culture bacterial species associated with resistance, colonize mice with these protective bacteria and test for resistance against VRE, arKp and C. diff. Samples obtained from these experimental studies will be subjected to metagenomic and metabolomic analyses to further refine, in an iterative fashion, computational models developed in aim 3. Our proposed studies will develop new and extend existing computational models to identify bacterial species and molecular mechanisms that confer resistance to antibiotic-resistant bacterial infections.         PUBLIC HEALTH RELEVANCE: The normal bacteria inhabiting the human intestine provide a high level of resistance against antibiotic-resistant bacterial pathogens. We are investigating the intestinal flora of hospitalized patients and using mathematical modeling to identify bacterial species and their metabolic products that reduce the risk of infection by three prevalent antibiotic-resistant bacteria. These studies may lead to the development of new approaches to treat and prevent antibiotic-resistant infections.        ",Systems Biology of Microbiome-mediated Resilience to Antibiotic-resistant Pathogens,9108539,U01AI124275,"['Allogenic', 'Antibiotic Resistance', 'Antibiotic Therapy', 'Antibiotics', 'Bacteria', 'Bacterial Antibiotic Resistance', 'Bacterial Infections', 'Categories', 'Clinical', 'Clinical Treatment', 'Clostridium difficile', 'Collection', 'Computer Simulation', 'Data', 'Databases', 'Deposition', 'Development', 'Diet', 'Dietary intake', 'Enrollment', 'Event', 'Feces', 'Gastrointestinal tract structure', 'Germ-Free', 'Gnotobiotic', 'Goals', 'Growth', 'Hematopoietic Stem Cell Transplantation', 'Hospitalization', 'Hospitals', 'Human', 'Immune', 'Immunocompromised Host', 'Infection', 'Integration Host Factors', 'Intestinal Content', 'Intestines', 'Klebsiella pneumonia bacterium', 'Laboratories', 'Lead', 'Machine Learning', 'Measurable', 'Mediating', 'Medical Records', 'Memorial Sloan-Kettering Cancer Center', 'Metabolic', 'Metabolic Pathway', 'Metagenomics', 'Modeling', 'Modification', 'Molecular', 'Mus', 'Patient risk', 'Patients', 'Pharmaceutical Preparations', 'Pharmacy facility', 'Population', 'Predisposition', 'Resistance', 'Resistance to infection', 'Risk', 'Sampling', 'Systems Biology', 'Testing', 'Toxic effect', 'Transplantation', 'Uncertainty', 'Vancomycin Resistance', 'Vancomycin resistant enterococcus', 'antimicrobial drug', 'commensal microbes', 'computer studies', 'design', 'falls', 'gut microbiota', 'immune activation', 'mathematical model', 'member', 'metabolome', 'metabolomics', 'metagenome', 'metagenomic sequencing', 'microbiome', 'microbiota', 'microorganism interaction', 'mouse model', 'network models', 'novel', 'novel strategies', 'pathogen', 'patient population', 'physical symptom', 'prevent', 'public health relevance', 'rRNA Genes', 'research study', 'resilience', 'resistance mechanism', 'text searching', 'transcriptome', 'transcriptome sequencing', 'transcriptomics']",NIAID,SLOAN-KETTERING INST CAN RESEARCH,U01,2016,1722908,0.14955702489725858
"The Interdependency of Drug Resistance Evolution and Drug Design: HIV-1 Protease DESCRIPTION: Many of the most deadly diseases that plague our society evolve quickly, challenging most of our therapeutic strategies. The pressures of evolution will likely result in a variety of pathways for resistance to evolve. Drug resistance can be caused by a change in the balance of molecular recognition events that selectively weakens inhibitor binding but maintains the biological function of the therapeutic target. To reduce the likelihood of drug resistance, the interdependency of the target's function within the context of the biological system in which it exists must be elucidated. Disrupting the therapeutic target's activity is necessary but not sufficient for avoiding resistance. In this collaborative proposal we hypothesize that key pathways and coupled mechanisms confer drug resistance to therapeutic targets. We seek to define the sequence, structural and dynamic, and temporal evolutionary constraints of the interdependency of drug resistance: 1) to recognize the pathways by which resistance occurs and 2) to devise drug design strategies for developing a drug that is robust against resistance. HIV-1 Protease is the perfect case study! HIV evolves very quickly with on average a point mutation introduced in every third genome replicated. HIV protease inhibitors have the potential of being both very potent and robust to resistance. Protease inhibitors are the only HIV inhibitor class that are transition state analogs and can be evolutionarily constrained within the substrate envelope. Inhibitors that leverage both of these characteristics, such as Darunavir (DRV) and similar analogs, have the potential of being robust, nearly resistance proof inhibitors, to drug- naïve HIV infected patients. If HIV achieves resistance to these inhibitors it is only through complex pathways and combinations of mutations. Further elucidating these complex pathways will bring us closer to resistance-proof inhibitors. In this project our team will use and develop cutting-edge technology to follow the pathways of drug resistance selection, to elucidate the molecular basis for their interdependent patterns and incorporate these mechanisms into drug design strategies. Together we will make inroads into tackling drug resistance that would be impossible for any of us to individually achieve PUBLIC HEALTH RELEVANCE: Many of the most deadly diseases that plague our society evolve quickly, challenging most of our therapeutic strategies. The pressures of evolution will likely result in a variety of pathways for resistance to evolve. HIV evolves very quickly with on average a point mutation introduced in every third genome replicated. HIV protease inhibitors have the potential of being both very potent and robust to resistance. If HIV achieves resistance to these potent drugs it is only through complex pathways and combinations of mutations. In this project our team will use and develop cutting-edge technology to follow the pathways of drug resistance selection, to elucidate the molecular basis for their interdependent patterns and incorporate these mechanisms into drug design strategies",The Interdependency of Drug Resistance Evolution and Drug Design: HIV-1 Protease,8912508,P01GM109767,"['Active Sites', 'Affinity', 'Binding', 'Biochemical', 'Biological Process', 'Case Study', 'Cell Culture Techniques', 'Characteristics', 'Complex', 'Computational Technique', 'Coupled', 'Data', 'Disease', 'Drug Design', 'Drug resistance', 'Drug resistance pathway', 'Engineering', 'Enzyme Kinetics', 'Enzymes', 'Equilibrium', 'Event', 'Evolution', 'Genome', 'HIV', 'HIV Protease Inhibitors', 'HIV-1', 'Health', 'Machine Learning', 'Methods', 'Minor', 'Molecular', 'Mutagenesis', 'Mutation', 'Pathway interactions', 'Patients', 'Pattern', 'Pattern Recognition', 'Peptide Hydrolases', 'Pharmaceutical Preparations', 'Physics', 'Plague', 'Point Mutation', 'Predisposition', 'Probability', 'Process', 'Protease Inhibitor', 'Quantitative Evaluations', 'Relative (related person)', 'Resistance', 'Resistance development', 'Resistance profile', 'Scheme', 'Site', 'Societies', 'Structure', 'Technology', 'Testing', 'Therapeutic', 'Thermodynamics', 'Variant', 'Viral', 'Viral Proteins', 'Virus', 'analog', 'base', 'biological systems', 'data integration', 'deep sequencing', 'design', 'fitness', 'genome sequencing', 'improved', 'inhibitor/antagonist', 'molecular recognition', 'mouse model', 'novel', 'pressure', 'simulation', 'therapeutic target']",NIGMS,UNIV OF MASSACHUSETTS MED SCH WORCESTER,P01,2015,1560549,0.12822905150094946
"The Interdependency of Drug Resistance Evolution and Drug Design: HIV-1 Protease     DESCRIPTION: Many of the most deadly diseases that plague our society evolve quickly, challenging most of our therapeutic strategies. The pressures of evolution will likely result in a variety of pathways for resistance to evolve. Drug resistance can be caused by a change in the balance of molecular recognition events that selectively weakens inhibitor binding but maintains the biological function of the therapeutic target. To reduce the likelihood of drug resistance, the interdependency of the target's function within the context of the biological system in which it exists must be elucidated. Disrupting the therapeutic target's activity is necessary but not sufficient for avoiding resistance. In this collaborative proposal we hypothesize that key pathways and coupled mechanisms confer drug resistance to therapeutic targets. We seek to define the sequence, structural and dynamic, and temporal evolutionary constraints of the interdependency of drug resistance: 1) to recognize the pathways by which resistance occurs and 2) to devise drug design strategies for developing a drug that is robust against resistance. HIV-1 Protease is the perfect case study! HIV evolves very quickly with on average a point mutation introduced in every third genome replicated. HIV protease inhibitors have the potential of being both very potent and robust to resistance. Protease inhibitors are the only HIV inhibitor class that are transition state analogs and can be evolutionarily constrained within the substrate envelope. Inhibitors that leverage both of these characteristics, such as Darunavir (DRV) and similar analogs, have the potential of being robust, nearly resistance proof inhibitors, to drug- na¿ve HIV infected patients. If HIV achieves resistance to these inhibitors it is only through complex pathways and combinations of mutations. Further elucidating these complex pathways will bring us closer to resistance-proof inhibitors. In this project our team will use and develop cutting-edge technology to follow the pathways of drug resistance selection, to elucidate the molecular basis for their interdependent patterns and incorporate these mechanisms into drug design strategies. Together we will make inroads into tackling drug resistance that would be impossible for any of us to individually achieve         PUBLIC HEALTH RELEVANCE: Many of the most deadly diseases that plague our society evolve quickly, challenging most of our therapeutic strategies. The pressures of evolution will likely result in a variety of pathways for resistance to evolve. HIV evolves very quickly with on average a point mutation introduced in every third genome replicated. HIV protease inhibitors have the potential of being both very potent and robust to resistance. If HIV achieves resistance to these potent drugs it is only through complex pathways and combinations of mutations. In this project our team will use and develop cutting-edge technology to follow the pathways of drug resistance selection, to elucidate the molecular basis for their interdependent patterns and incorporate these mechanisms into drug design strategies                ",The Interdependency of Drug Resistance Evolution and Drug Design: HIV-1 Protease,8789525,P01GM109767,"['Active Sites', 'Affinity', 'Binding', 'Biochemical', 'Biological Process', 'Case Study', 'Cell Culture Techniques', 'Characteristics', 'Complex', 'Computational Technique', 'Coupled', 'Data', 'Disease', 'Drug Design', 'Drug resistance', 'Drug resistance pathway', 'Engineering', 'Enzyme Kinetics', 'Enzymes', 'Equilibrium', 'Event', 'Evolution', 'Genome', 'HIV', 'HIV Protease Inhibitors', 'HIV-1', 'Health', 'Machine Learning', 'Methods', 'Minor', 'Molecular', 'Mutagenesis', 'Mutation', 'Pathway interactions', 'Patients', 'Pattern', 'Pattern Recognition', 'Peptide Hydrolases', 'Pharmaceutical Preparations', 'Physics', 'Plague', 'Point Mutation', 'Predisposition', 'Probability', 'Process', 'Protease Inhibitor', 'Quantitative Evaluations', 'Relative (related person)', 'Resistance', 'Resistance development', 'Resistance profile', 'Scheme', 'Site', 'Societies', 'Structure', 'Technology', 'Testing', 'Therapeutic', 'Thermodynamics', 'Variant', 'Viral', 'Viral Proteins', 'Virus', 'analog', 'base', 'biological systems', 'data integration', 'deep sequencing', 'design', 'fitness', 'genome sequencing', 'improved', 'inhibitor/antagonist', 'molecular recognition', 'mouse model', 'novel', 'pressure', 'simulation', 'therapeutic target']",NIGMS,UNIV OF MASSACHUSETTS MED SCH WORCESTER,P01,2014,1710847,0.12822905150094946
