text,title,id,project_number,terms,administration,organization,mechanism,year,funding,score
"Automated domain adaptation for clinical natural language processing Project Summary Automatic extraction of useful information from clinical texts enables new clinical research tasks and new technologies at the point of care. The natural language processing (NLP) systems that perform this extraction rely on supervised machine learning. The learning process uses manually labeled datasets that are limited in size and scope, and as a result, applying NLP systems to unseen datasets often results in severely degraded performance. Obtaining larger and broader datasets is unlikely due to the expense of the manual labeling process and the difficulty of sharing text data between multiple different institutions. Therefore, this project develops unsupervised domain adaptation algorithms to adapt NLP systems to new data. Domain adaptation describes the process of adapting a machine learning system to new data sources. The proposed methods are unsupervised in that they do not require manual labels for the new data. This project has three aims. The first aim makes use of multiple existing datasets for the same task to study the differences in domains, and uses this information to develop new domain adaptation algorithms. Evaluation uses standard machine learning metrics, and analysis of performance is tightly bounded by strong baselines from below and realistic upper bounds, both based on theoretical research on machine learning generalization. The second aim develops open source software tools to simplify the process of incorporating domain adaptation into clinical text processing workflows. This software will have input interfaces to connect to methods developed in Aim 1 and output interfaces to connect with Apache cTAKES, a widely used open- source NLP tool. Aim 3 tests these methods in an end-to-end use case, adverse drug event (ADE) extraction on a dataset of pediatric pulmonary hypertension notes. ADE extraction relies on multiple NLP systems, so this use case is able to show how broad improvements to NLP methods can improve downstream methods. This aim also creates new manual labels for the dataset for an end-to-end evaluation that directly measures how improvements to the NLP systems lead to improvement in ADE extraction. Project Narrative Software systems that use machine learning to understand clinical text often suffer severe performance loss when they are applied to new data that looks different than the data that they originally learned from. In this project, we develop and implement methods that allow these systems to automatically adapt to the characteristics of a new data source. We evaluate these methods on the clinical research task of adverse drug event detection, which relies on many different variables found in the text of electronic health records.",Automated domain adaptation for clinical natural language processing,9768545,R01LM012918,"['Adult', 'Adverse drug event', 'Algorithms', 'Apache', 'Area', 'Characteristics', 'Childhood', 'Clinical', 'Clinical Informatics', 'Clinical Research', 'Colon Carcinoma', 'Communities', 'Computer software', 'Computers', 'Conceptions', 'Data', 'Data Set', 'Data Sources', 'Detection', 'Dimensions', 'Ecosystem', 'Educational process of instructing', 'Electronic Health Record', 'Evaluation', 'Human', 'Institution', 'Knowledge', 'Label', 'Language', 'Lead', 'Learning', 'Linguistics', 'Machine Learning', 'Malignant Neoplasms', 'Malignant neoplasm of brain', 'Manuals', 'Measurement', 'Measures', 'Medical', 'Methods', 'Modeling', 'Natural Language Processing', 'Network-based', 'Output', 'Pathology', 'Patients', 'Performance', 'Pharmaceutical Preparations', 'Population', 'Process', 'Pulmonary Hypertension', 'Radiology Specialty', 'Research', 'Software Tools', 'Source', 'Statistical Models', 'Structure', 'System', 'Testing', 'Text', 'TimeLine', 'Training', 'Update', 'Vision', 'Work', 'base', 'case finding', 'improved', 'learning strategy', 'malignant breast neoplasm', 'method development', 'natural language', 'neural network', 'new technology', 'news', 'novel', 'open source', 'point of care', 'side effect', 'social media', 'software systems', 'statistics', 'supervised learning', 'tool', 'tumor', 'unsupervised learning']",NLM,BOSTON CHILDREN'S HOSPITAL,R01,2019,383874,0.11884507508350087
"Temporal relation discovery for clinical text Project Summary / Abstract The current proposal continues the investigation on the topic of temporal relation extraction from the Electronic Medical Records (EMR) clinical narrative funded by the NLM since 2010 (Temporal Histories of Your Medical Events, or THYME; thyme.healthnlp.org). Through our efforts so far, we have defined the topic as an active area of research attracting attention across the world. Since its inception, the project has pushed the boundaries of this highly challenging task by investigating new computational methods within the context of the latest developments in the fields of natural language processing (NLP), machine learning (ML), artificial intelligence (AI) and biomedical informatics (BMI) resulting in 60+ publications/presentations. We have made our best performing methods available to the community open source as part of the Apache Clinical Text Analysis and Knowledge Extraction System (cTAKES; ctakes.apache.org). In 2015, 2016, 2017 and 2018, we organized an international shared task (Clinical TempEval) on the topic under the umbrella of the highly prestigious SemEval, thus inviting the international community to work with our THYME data and improve on our results. Clinical TempEval has been highly successful with many participants each year, resulting in new discoveries and many publications. We have made all our data along with our gold standard annotations available to the community through the hNLP Center (center.healthnlp.org).  The underlying theme of this renewal is novel methods for combining explicit domain knowledge (linguistic, semantic, biomedical ontological, clinical), readily available unlabeled data (health-related social media, EMRs), and modern machine learning techniques (e.g. neural networks) for temporal relation extraction from the EMR clinical narrative. Therefore, our renewal proposes a novel and much needed exploration of this line of research:  Specific Aim 1: Develop computational models for novel rich semantic representations such as the Abstract Meaning Representations to encapsulate a single, coherent, full-document graphical representation of meaning for temporal relation extraction  Specific Aim 2: Develop computational methods to infuse domain knowledge (linguistic, semantic, biomedical ontological, clinical) into modern machine learning techniques such as NNs for temporal relation extraction – through input representations, pre-trained vectors, or architectures  Specific Aim 3: Develop novel methods for combining labeled and unlabeled data from various sources (EMR, health-related social media, newswire) for temporal relation extraction from the clinical narrative  Specific Aim 4: Apply the best performing methods for temporal relation extraction developed in SA1-3 to temporally sensitive phenotypes for direct translational sciences studies. Dissemination efforts through publications and open source releases into Apache cTAKES. Project Narrative Temporal relations are of prime importance in biomedicine as they are intrinsically linked to diseases, signs and symptoms, and treatments. Understanding the timeline of clinically relevant events is key to the next generation of translational research where the importance of generalizing over large amounts of data holds the promise of deciphering biomedical puzzles. The goal of our current proposal is to automatically discover temporal relations from clinical free text and structured EMR data and create an aggregated patient-level timeline.",Temporal relation discovery for clinical text,9735964,R01LM010090,"['Address', 'Apache', 'Architecture', 'Area', 'Artificial Intelligence', 'Attention', 'Clinical', 'Cognitive', 'Communities', 'Complex', 'Computer Simulation', 'Computerized Medical Record', 'Computing Methodologies', 'Coupled', 'Data', 'Development', 'Disease', 'Encapsulated', 'Engineering', 'Event', 'Fostering', 'Foundations', 'Funding', 'Goals', 'Gold', 'Health', 'Image', 'International', 'Investigation', 'Knowledge', 'Knowledge Extraction', 'Label', 'Linguistics', 'Link', 'Machine Learning', 'Medical', 'Methods', 'Modernization', 'Natural Language Processing', 'Nature', 'Participant', 'Patient Care', 'Patients', 'Phenotype', 'Publications', 'Recording of previous events', 'Research', 'Semantics', 'Signs and Symptoms', 'Solid', 'Source', 'Speed', 'Structure', 'System', 'Techniques', 'Text', 'Thyme', 'Time', 'TimeLine', 'Training', 'Translational Research', 'Vision', 'Work', 'advanced disease', 'base', 'biomedical informatics', 'biomedical ontology', 'clinically relevant', 'cohesion', 'electronic data', 'electronic structure', 'epidemiology study', 'improved', 'individualized medicine', 'learning community', 'neural network', 'next generation', 'novel', 'open source', 'programs', 'relating to nervous system', 'social media', 'symptom treatment', 'vector']",NLM,BOSTON CHILDREN'S HOSPITAL,R01,2019,626851,0.0049894112858583466
"Leveraging Unlabeled and Pseudo Data for Clinical Information Extraction Project Summary/Abstract Electronic Health Records (EHRs) contain significant information that can benefit many downstream uses. However, most of this information is in unstructured narrative form and is inaccessible to computerized methods that rely on structured representations for exploring, retrieving, and presenting the information. Natural language processing (NLP) and information extraction (IE) open this trove of information to studies that would otherwise be without. Over the past decades, many IE systems have been developed. These systems have typically focused on one task at a time. In addition, most have studied only specific types of records, e.g., discharge summaries, and addressed their task on data from a single institution. Performances achieved by the state-of-the-art IE systems developed under these conditions ranged from 44% F-measure to 99% F-measure. This observed variation can be attributed to the nature of the tasks: some target entities like dates tend to be better represented in the data and also more rigidly stick to known patterns of expression as opposed to reasons for medication administration which are relatively sparse in the data and can show wider linguistic diversity. However, this may not be the only reason: the data used can also explain the performance variation. Narratives of EHRs vary in their style, format, and content going from one department to another, from one hospital to another. Even the same record type in two different hospitals can be very different in narrative style and pose different challenges for IE. Understanding IE performance therefore requires studies of multiple tasks on multiple record types that come from multiple institutions. One major bottleneck for evaluation of IE systems on such a large scale is annotation. The same bottleneck also limits system development. This proposal aims to address this bottleneck for both evaluation and development. It first generates a multi-institution corpus consisting of multiple record types from five institutions. It studies four different IE tasks that broadly represent IE in clinical records and can inform the field of IE as a whole: de-identification, clinical concept extraction, medication extraction, and adverse drug event extraction. Within the context of these IE tasks, the proposal then puts forward methods that learn from unlabeled or pseudo data that can help alleviate reliance on annotated data for development. It evaluates these methods both for performance and generalizability on multiple types of records from multiple institutions. As a result of these activities, this proposal generates de-identified data, annotations, methods, software, and machine learning models which it then makes available to the research community. Project Narrative Information extraction (IE) systems, i.e., natural language processing (NLP) systems that enable creation of accurate semantic representations of narratives, rely heavily on the availability of gold standard annotated corpora and vary significantly in their performance from task to task, and from data set to data set. We propose methods that augment gold standard data with unlabeled data that are more easily available, and pseudo data which can be derived from gold standard data. We study IE within the context of four tasks and evaluate IE systems enhanced with unlabeled and pseudo data for generalizability on a heterogeneous data set consisting of multiple record types from five institutions.",Leveraging Unlabeled and Pseudo Data for Clinical Information Extraction,9813134,R15LM013209,"['Accident and Emergency department', 'Address', 'Adverse drug event', 'Affect', 'Clinic', 'Clinical', 'Clinical Data', 'Communities', 'Computer software', 'Data', 'Data Set', 'Development', 'Discipline of Nursing', 'Electronic Health Record', 'Engineering', 'Evaluation', 'Frequencies', 'Gold', 'Growth', 'Healthcare', 'Hospitals', 'Institution', 'Israel', 'Knowledge', 'Label', 'Learning', 'Linguistics', 'Location', 'Machine Learning', 'Measures', 'Medical', 'Medical center', 'Methods', 'Modeling', 'Names', 'Natural Language Processing', 'Nature', 'Outcome', 'Pattern', 'Performance', 'Persons', 'Pharmaceutical Preparations', 'Plant Roots', 'Procedures', 'Psychiatry', 'Publications', 'Records', 'Reporting', 'Research', 'Resources', 'Route', 'Sampling', 'Semantics', 'Signs and Symptoms', 'Social Work', 'Structure', 'Supervision', 'System', 'Systems Development', 'Task Performances', 'Telephone', 'Test Result', 'Testing', 'Text', 'Thinness', 'Time', 'Training', 'Universities', 'Variant', 'Virginia', 'Washington', 'computerized', 'deep learning', 'dosage', 'field study', 'improved', 'learning strategy', 'medication administration', 'novel', 'open source', 'response', 'supervised learning', 'tool']",NLM,GEORGE MASON UNIVERSITY,R15,2019,414798,0.03293423045801562
"Using natural language processing and machine learning to identify potentially preventable hospital admissions among outpatients with chronic lung diseases Project Summary Patients living with chronic lung diseases (CLDs) are frequently admitted to the hospital for potentially preventable causes. Such admissions may be discordant with patient preferences and/or represent a low-value allocation of health system resources. To anticipate such admissions, existing clinical prediction models in this ﬁeld typically produce an “all-cause” risk estimate which, even if accurate, overlooks the actionable mechanisms behind admis- sion risk and therefore fails to identify a prescribed response. This limitation may explain the only modest – at best – reductions in hospital admissions and readmissions seen in most intervention bundles that have been tested in this population. An opportunity exists, therefore, to predict hospitalization risk while simultaneously identifying patient phenotypes (i.e. some constellation of social, demographic, clinical, and other characteristics) for which known preventive interventions exist. The proposed study seeks to overcome these limitations and capitalize on this opportunity by (1) conducting semi-structured interviews with hospitalized patients with CLDs, and their caregivers and clinicians, to directly identify modiﬁable risks and their associated phenotypes driving hospital ad- missions; (2) using natural language processing techniques (NLP) to build classiﬁcation models that will leverage nuanced narrative, social, and clinical information in the unstructured text of clinical encounter notes to identify patients with these phenotypes; and (3) building risk prediction model focused on actionable phenotypes with a wide-array of traditional regression and machine learning approaches while also incorporating large numbers of predictor variables from text data and accounting for time-varying trends. The candidate's preliminary work using basic NLP techniques to signiﬁcantly improve the discrimination of clinical prediction models in an inpatient population has motivated this methodologic approach. The rising burden and costs of hospitalizations associated with CLDs, and the increasing attention from federal payers, highlights the critical nature of this work. Completion of this research will build upon the candidate's past training, which includes a Masters of Science in Health Policy Research obtained with NHLBI T32 support, and will provide the experience, education, and mentorship to allow the candidate to become a fully independent investigator. Based on the candidate's tailored training plan, he will acquire advanced skills in mixed-methods research, NLP, and trial design all through coursework, close men- toring and supervision, and direct practice. The skills will position him ideally to submit successful R01s testing the deployment of the proposed clinical prediction models in real-world settings. The candidate's primary mentor, collaborators, and advisors will ensure adherence to the proposed timeline and goals and provide a support- ive environment for him to develop an independent research career testing the real-world deployment of clinical prediction models to reduce low-value and preference-discordant care for patients with CLDs. Project Narrative Every year many people living with chronic lung diseases are admitted to the hospital despite the fact that some of these admissions may have been prevented with early identiﬁcation and intervention prior to the hospitalization. Previous attempts at preventing such hospitalizations have been limited by their ability to both accurately identify those at risk, and because most risk models do not provide a reason for the likely admission. The proposed work draws directly on the experiences of patients with chronic lung diseases who are admitted to a hospital, and then uses cutting edge statistical and computer science techniques to use information in the electronic health record to accurately predict the risk and the likely reason for future hospital admissions.",Using natural language processing and machine learning to identify potentially preventable hospital admissions among outpatients with chronic lung diseases,9681485,K23HL141639,"['Accounting', 'Acute', 'Address', 'Adherence', 'Admission activity', 'Adult', 'Ambulatory Care', 'Attention', 'Automobile Driving', 'Bioinformatics', 'Caregivers', 'Caring', 'Characteristics', 'Chronic Obstructive Airway Disease', 'Chronic lung disease', 'Classification', 'Clinical', 'Communities', 'Comorbidity', 'Data', 'Data Set', 'Data Sources', 'Diagnosis', 'Discrimination', 'Early Intervention', 'Early identification', 'Education', 'Electronic Health Record', 'Ensure', 'Future', 'Goals', 'Health Policy', 'Health system', 'Home environment', 'Hospital Costs', 'Hospitalization', 'Hospitals', 'Inpatients', 'Interstitial Lung Diseases', 'Intervention', 'Interview', 'K-Series Research Career Programs', 'Machine Learning', 'Master of Science', 'Measures', 'Mentors', 'Mentorship', 'Methodology', 'Methods', 'Mission', 'Modeling', 'Monitor', 'National Heart, Lung, and Blood Institute', 'Natural Language Processing', 'Nature', 'Nurses', 'Outpatients', 'Palliative Care', 'Patient Care', 'Patient Preferences', 'Patients', 'Pennsylvania', 'Performance', 'Phenotype', 'Physicians', 'Policy Research', 'Population', 'Positioning Attribute', 'Preventive Intervention', 'Primary Health Care', 'Research', 'Research Methodology', 'Research Personnel', 'Resources', 'Risk', 'Risk Estimate', 'Social support', 'Structure', 'Supervision', 'Symptoms', 'Techniques', 'Testing', 'Text', 'Time', 'TimeLine', 'Training', 'United States', 'Universities', 'Validation', 'Work', 'administrative database', 'base', 'career', 'career development', 'computer science', 'cost', 'design', 'discrete data', 'end of life', 'experience', 'hospital readmission', 'improved', 'innovation', 'instrument', 'interest', 'model development', 'modifiable risk', 'novel', 'predictive modeling', 'preference', 'prevent', 'randomized trial', 'response', 'risk prediction model', 'skills', 'social', 'supportive environment', 'trend', 'trial design']",NHLBI,UNIVERSITY OF PENNSYLVANIA,K23,2019,195076,0.01853592214296923
"Semi-Automating Data Extraction for Systematic Reviews Summary ​Semi-Automating Data Extraction for Systematic Reviews (​Renewal) Evidence-based Medicine (EBM) aims to inform patient care using all available evidence. Realizing this aim in practice would require access to concise, comprehensive, and up-to-date structured summaries of the evidence relevant to a particular clinical question. Systematic reviews of biomedical literature aim to provide such summaries, and are a critical component of the EBM arsenal and modern medicine more generally. However, such reviews are extremely laborious to conduct. Furthermore, owing to the rapid expansion of the biomedical literature base, they tend to go out of date quickly as new evidence emerges. These factors hinder the practice of evidence-based care. In this renewal proposal, we seek to continue our ground-breaking efforts on developing, evaluating, and deploying novel machine learning (ML) and natural language processing (NLP) methods to automate or semi-automate the evidence synthesis process. This will extend our innovative and successful efforts developing RobotReviewer and related technologies under the current grant. Concretely, for this renewal we propose to move from extraction of clinically salient data elements from individual trials to synthesis of these elements across trials. Our first aim is to extend our ML and NLP models to produce (as one deliverable) a publicly available, continuously and automatically updated semi-structured evidence database, comprising extracted data for all evidence, both published and unpublished. Unpublished trials will be identified via trial registries. Taking this up-to-date evidence repository as a starting point, we then propose cutting-edge ML and NLP models that will generate first drafts of evidence syntheses, automatically. More specifically we propose novel neural cross-document summarization models that will capitalize on the semi-structured information automatically extracted by our existing models, in addition to article texts. These models will be deployed in a new version of RobotReviewer, called RobotReviewerLive, intended to be a prototype for “living” systematic reviews. To rigorously evaluate the practical utility of the proposed methodological innovations, we will pilot their use to support real, ongoing, exemplar living reviews. Semi-Automating Data Extraction for Systematic Reviews (​Renewal) Narrative We propose novel machine learning and natural language processing methods that will aid biomedical literature summarization and synthesis, and thereby support the conduct of evidence-based medicine (EBM). The proposed models and technologies will motivate core methodological innovations and support real-time, up-to-date, semi-automated biomedical evidence syntheses (“systematic reviews”). Such approaches are necessary if we are to have any hope of practicing evidence-based care in our era of information overload.",Semi-Automating Data Extraction for Systematic Reviews,9818711,R01LM012086,"['American', 'Automation', 'Caring', 'Clinical', 'Collection', 'Consumption', 'Data', 'Data Element', 'Databases', 'Development', 'Elements', 'Evaluation', 'Evidence Based Medicine', 'Evidence based practice', 'Feedback', 'Grant', 'Hybrids', 'Individual', 'Informatics', 'Internet', 'Literature', 'Machine Learning', 'Manuals', 'Measures', 'Medical Informatics', 'Metadata', 'Methodology', 'Methods', 'Modeling', 'Modern Medicine', 'Natural Language Processing', 'Outcome', 'Output', 'Paper', 'Patient Care', 'Population Intervention', 'Process', 'PubMed', 'Publications', 'Publishing', 'Registries', 'Reporting', 'Research', 'Resources', 'Risk', 'Stroke', 'Structure', 'Surveillance Methods', 'System', 'Technology', 'Text', 'Textbooks', 'Time', 'Training', 'United States National Institutes of Health', 'Update', 'Vision', 'Work', 'base', 'cardiovascular health', 'database structure', 'design', 'evidence base', 'improved', 'indexing', 'innovation', 'learning strategy', 'natural language', 'neural network', 'novel', 'open source', 'programs', 'prospective', 'prototype', 'recruit', 'relating to nervous system', 'repository', 'search engine', 'study characteristics', 'study population', 'success', 'systematic review', 'tool', 'usability', 'working group']",NLM,NORTHEASTERN UNIVERSITY,R01,2019,320194,0.03994004592220404
