text,title,id,project_number,terms,administration,organization,mechanism,year,funding,score
"NLP-enabled decision support for cervical cancer screening and surveillance     DESCRIPTION (provided by applicant): Although cervical cancer is preventable, it still continues to be a leading cause of death. Following the evidence- based guidelines for cervical cancer prevention is challenging for healthcare providers, due to which many patients do not receive the optimal preventive care. Clinical decision support (CDS) systems can potentially improve the care delivery. However, the current CDS systems only identify patients overdue for screening, and do not suggest the optimal screening interval. Moreover they do not help with surveillance of patients with abnormal screening results. This is because the existing systems lack the capability to process free- text clinical reports that contain information needed for applying the guidelines. Hence there is a critical need for natural language processing (NLP)-enabled CDS systems that can utilize discrete as well as free-text patient information for enhancing the decision support. Our long-term goal is to improve healthcare delivery of cervical cancer prevention with guideline based reminders. The central hypothesis is that NLP- enabled CDS system will significantly improve the quality of care delivery for cervical cancer prevention. The rationale is that use of NLP will improve granularity of the guideline implementation, which will in-turn enhance care delivery. As preliminary work we have developed an NLP-enabled CDS system that automatically interprets the patient information from the electronic health record and applies the national guidelines to compute the optimal recommendation for screening and surveillance. We have performed validation of the system in a non-clinical setting.1 In this application we will proceed towards deployment of the system in the clinical setting, and will carry out studies for measuring the impact on the quality of care delivery. In ai one, we will validate the system in the clinical setting and will optimize its usability and workflw integration. In aim two, we will test the hypothesis that reminders from the NLP-enabled CDS system to primary care providers will improve the quality of care delivery, by performing a one year intervention control study across four sites of a primary care practice. In aim three, we will test the hypothesis that reminders to non-adherent high-risk patients will improve their surveillance rates, by performing a randomized intervention study for three months. In this study, care coordinators will utilize the CDS system for sending reminders to patients that are non-adherent and at high risk due to abnormal screenings. The main contribution of this project will be knowledge about the effectiveness of NLP in enhancing the impact of CDS systems for cervical cancer prevention, and for clinical practice in general. This project is innovative because the CDS system will utilize NLP to generate screening reminders for normal patients and surveillance reminders for patients with abnormal findings. This is a major advancement over existing systems that can only identify patients for screening.         PUBLIC HEALTH RELEVANCE: The proposed research is relevant to public health because it will yield knowledge about the effectiveness of natural language processing (NLP) to enhance impact of CDS systems for cervical cancer prevention, and for clinical practice in general. This research will foster implementation of similar CDS systems across the nation for cervical cancer prevention and for other decision problems, which will improve the quality of healthcare delivery. Thus, the proposed research is relevant to AHRQ's mission to improve the quality, safety, efficiency, and effectiveness of health care for all Americans.            ",NLP-enabled decision support for cervical cancer screening and surveillance,8678798,R21HS022911,[' '],AHRQ,MAYO CLINIC ROCHESTER,R21,2014,145229,0.07282774762240084
"Scalable and Robust Clinical Text De-Identification Tools     DESCRIPTION (provided by applicant): Exploiting the full potential of information rich and rapidly growing repositories of patient clinical text is hampered by the absence of scalable and robust de-identification tools. Clinical text contains protected health information (PHI), and the Health Insurance Portability and Accountability Act (HIPAA) restricts research use of patient information containing PHI to specific, limited, IRB-approved projects. As a result, vast repositories of clinical text remain under-used by internal researchers, and are even less available for external transmission to outside collaborators or for centralized processing by state-of-the-art natural language processing (NLP) technologies. De-identification, which is the removal of PHI from clinical text, is challenging. Despite their availability for over a decade, commercially available automated systems are expensive, require local tailoring, and have not gained widespread market penetration. Manual methods are costly and do not scale, yet continue to be used despite the small amount of residual PHI they leave behind. Open source de-identification tools based on state-of-the-art machine learning technologies can perform at or above the level of manual approaches but also suffer from the residual PHI problem. Current de-identification approaches, then, also severely limit the use and mobility of clinical text while exposing patients to privacy risks. These approaches redact PHI, blacking it out or replacing it with symbols (e.g., ""Here for cardiac eval is Mr. **PT_NAME<AA>, a **AGE<60s> yo male with his son Doug ...""). Traditional approaches leave residual PHI (""Doug"" in this example) to be easily noticed by readers of the text, as it remains plainly visible among the prominent redactions. We developed and pilot tested an alternative approach we believe addresses the residual PHI problem. Our approach uses the strategy of concealing, rather than trying to eliminate, residual PHI. We call it the ""Hiding In Plain Sight"" (HIPS) approach. HIPS replaces all known PHI with ""surrogate"" PHI- fictional names, ages, etc.-that look real but do not refer to any actual patient. A HIPS version of the above text is: ""Here for cardiac eval is Mr. Jones, a 64 yo male with his son Doug ..."" where the name ""Jones"" and age ""64"" are fictional surrogates, but the name ""Doug"" is residual PHI. To a reader, the surrogates and the residual PHI are indistinguishable. This prevents the reader from detecting the latter, avoiding disclosure. Our preliminary studies suggest that HIPS can reduce the risk of disclosure of residual PHI by a factor of 10. This yields overall performance that far surpasses the performance attainable by manual methods, and is unlikely to be matched, we believe, by additional incremental improvements in PHI tagging models (i.e., efforts to reduce residual PHI). Our pilot studies indicate IRBs would welcome the HIPS approach if it were shown to be effective through rigorous evaluation. To expand usage of clinical text and enhance patient privacy, we propose to formalize rules of effective surrogate generation (Aim 1), extend related de-identification confidence scoring methods (Aim 2), and conduct rigorous efficacy testing of HIPS in diverse institutional settings (Aim 3).                  All known automated de-identification methods leave behind a small amount of residual protected health information (PHI), which presents a risk of disclosing patient privacy and creates barriers to more widespread internal use and external sharing of information-rich clinical text for broad research purpose. This project advances and evaluates the efficacy of a novel method, called the Hiding In Plain Sight (HIPS) approach, which conceals residual PHI by replacing all other instance of PHI found in a document with realistic appearing but fictitious surrogates. Rigorous efficacy testing is needed to confirm that HIPS surrogates effectively reduce risk of exposing patient privacy by concealing the small amount of residual PHI all known de-identification leave behind.",Scalable and Robust Clinical Text De-Identification Tools,8532984,R01LM011366,"['Address', 'Age', 'Applied Research', 'Cardiac', 'Clinical', 'Detection', 'Disclosure', 'Evaluation', 'Excision', 'Foundations', 'Generations', 'Health', 'Health Insurance Portability and Accountability Act', 'Healthcare', 'Human', 'Information Theory', 'Institutional Review Boards', 'Left', 'Machine Learning', 'Manuals', 'Marketing', 'Methods', 'Modeling', 'Monitor', 'Names', 'Natural Language Processing', 'Patients', 'Penetration', 'Performance', 'Pilot Projects', 'Plant Roots', 'Privacy', 'Process', 'Publishing', 'Reader', 'Reporting', 'Research', 'Research Personnel', 'Research Project Grants', 'Residual state', 'Risk', 'Scoring Method', 'Simulate', 'Son', 'Source', 'System', 'Technology', 'Testing', 'Text', 'Validation', 'Vision', 'Work', 'base', 'efficacy testing', 'male', 'novel', 'open source', 'patient privacy', 'prevent', 'programs', 'repository', 'software systems', 'tool', 'transmission process']",NLM,KAISER FOUNDATION HEALTH PLAN OF WASHINGTON,R01,2013,247288,0.07687752318613841
"Challenges in Natural Language Processing for Clinical Narratives     DESCRIPTION (provided by applicant): Narratives of electronic health records (EHRs) contain useful information that is difficult to automatically extract, index, search, or interpret. Clinical natural language processing (NLP) technologies for automatic extraction, indexing, searching, and interpretation of EHRs are in development; however, due to privacy concerns related to EHRs, such technologies are usually developed by teams that have privileged access to EHRs in a specific institution. Technologies that are tailored to a specific set of data from a given institution generate inspiring results on that data; however, they can fail to generalize to similar data from other institutions and even other departments from the same institution. Therefore, learning from these technologies and building on them becomes difficult.          In order to improve NLP in EHRs, there is need for head-to-head comparison of approaches that can address a given task on the same data set. Shared-tasks provide one way of conducting systematic head-to- head comparisons. This proposal describes a series of shared-task challenges and conferences, spread over a five year period, that promote the development and evaluation of cutting edge clinical NLP systems by distributing de-identified EHRs to the broad research community, under data use agreements, so that:      *	the state-of-the-art in clinical NLP technologies can be identified and advanced,      *	a set of technologies that enable the use of the information contained in EHR narratives becomes available, and      *	the information from EHR narratives can be made more accessible, for example, for clinical and medical research.          The scientific activities supporting the organization of the shared-task challenges are sponsored in part by Informatics for Integrating Biology and the Bedside (i2b2), grant number U54-LM008748, PI: Kohane.          This proposal aims to organize a series of workshops, conference proceedings, and journal special issues that will accompany the shared-task challenges in order to disseminate the knowledge generated by the challenges.                  Public health relevance: this proposal will address two main challenges related to the use of clinical narratives for research: availability of clinical records for research and identification of the state of the art in clinical natural language processing (NLP) technologies so that we can push the state of the art forward and so that future work can build on the past. Progress in clinical NLP will improve access to electronic health records for research, and for clinical applications, benefiting healthcare and public health.",Challenges in Natural Language Processing for Clinical Narratives,8538500,R13LM011411,"['Access to Information', 'Address', 'Agreement', 'Biology', 'Clinical', 'Clinical Research', 'Communities', 'Data', 'Data Set', 'Development', 'Distributed Systems', 'Educational workshop', 'Electronic Health Record', 'Evaluation', 'Future', 'Goals', 'Gold', 'Grant', 'Hand', 'Healthcare', 'Improve Access', 'Informatics', 'Institution', 'Journals', 'Knowledge', 'Learning', 'Medical Research', 'Natural Language Processing', 'Privacy', 'Public Health', 'Publications', 'Records', 'Research', 'Rest', 'Series', 'System', 'Systems Development', 'Targeted Research', 'Technology', 'Work', 'clinical application', 'data sharing', 'head-to-head comparison', 'improved', 'indexing', 'practical application', 'public health relevance', 'symposium']",NLM,STATE UNIVERSITY OF NEW YORK AT ALBANY,R13,2013,18400,0.060211451074268396
"Natural language processing for clinical and translational research     DESCRIPTION (provided by applicant): Rapid growth in the clinical implementation of large electronic medical records (EMRs) has led to an unprecedented expansion in the availability of dense longitudinal datasets for clinical and translational research. This growth is being fueled by recent federal legislation that provides generous financial incentives to institutions demonstrating aggressive application and ""meaningful use"" of comprehensive EMRs. Efforts are already underway to link these EMRs across institutions, and standardize the definition of phenotypes for large scale studies of disease onset and treatment outcome, specifically within the context of routine clinical care. However, a well-known challenge for secondary use of EMR data for clinical and translational research is that much of detailed patient information is embedded in narrative text. Natural Language Processing (NLP) technologies, which are able to convert unstructured clinical text into coded data, have been introduced into the biomedical domain and have demonstrated promising results. Researchers have used NLP systems to identify clinical syndromes and common biomedical concepts from radiology reports, discharge summaries, problem lists, nursing documentation, and medical education documents. Different NLP systems have been developed at different institutions and utilized to convert clinical narrative text into structured data that may be used for other clinical applications and studies. Successful stories in applying NLP to clinical and translational research have been reported widely. However, institutions often deploy different NLP systems, which produce various types of output formats and make it difficult to exchange information between sites. Therefore, the lack of interoperability among different clinical NLP systems becomes a bottleneck for efficient multi-site studies. In addition, many successful studies often require a strong interdisciplinary team where informaticians and clinicians have to work very closely to iteratively define optimal algorithms for clinical phenotypes. As intensive informatics support may not be available to every clinical researcher, the usability of NLP systems for end users is another important issue. The proposed project builds upon first-hand knowledge and experience across the research team in the use of NLP for clinical and translational research projects. There are several big informatics initiatives for clinical and translational research but those initiatives generally assume one shoe fits all and follow top-down approaches to develop NLP solutions. Complementary to those initiatives, we will use a bottom-up approach to handle interoperability and usability: i) we will obtain a common NLP data model and exchange format through empirical analysis of existing NLP systems and NLP results; ii) we will develop a user-centric NLP front end interface for NLP systems wrapped to be consistent with the proposed NLP data model and exchange format incorporating usability analysis into the agile development process. All deliverables will be distributed through the open health NLP (OHNLP) consortium which we intend to make it more open and inclusive.         PUBLIC HEALTH RELEVANCE: Rapid growth in the clinical implementation of large electronic medical records (EMRs) has led to an unprecedented expansion in the availability of dense longitudinal datasets for clinical and translational research. We propose the development of a novel framework to enable the use of clinical information embedded in clinical narratives for clinical and translational research.                ",Natural language processing for clinical and translational research,8505753,R01GM102282,"['Acceleration', 'Adopted', 'Adoption', 'Adverse drug effect', 'Algorithms', 'Architecture', 'Attention', 'Clinical', 'Clinical Investigator', 'Clinical Research', 'Code', 'Communities', 'Computerized Medical Record', 'DNA Databases', 'Data', 'Data Set', 'Development', 'Dictionary', 'Discipline of Nursing', 'Disease Association', 'Documentation', 'Elements', 'Exclusion Criteria', 'Genes', 'Genomics', 'Goals', 'Growth', 'Health', 'Informatics', 'Institution', 'Knowledge', 'Link', 'Logical Observation Identifiers Names and Codes', 'Manuals', 'Medical Education', 'Modeling', 'Natural Language Processing', 'Onset of illness', 'Output', 'Patients', 'Pharmacogenomics', 'Phenotype', 'Play', 'Process', 'Radiology Specialty', 'Reporting', 'Research', 'Research Personnel', 'Research Project Grants', 'Resources', 'Role', 'SNOMED Clinical Terms', 'Semantics', 'Shoes', 'Site', 'Solutions', 'Statutes and Laws', 'Structure', 'Syndrome', 'System', 'Technology', 'Text', 'Translational Research', 'Treatment outcome', 'Work', 'base', 'clinical application', 'clinical care', 'clinical phenotype', 'computer human interaction', 'data exchange', 'data modeling', 'experience', 'financial incentive', 'flexibility', 'human centered computing', 'interoperability', 'novel', 'open source', 'patient safety', 'public health relevance', 'rapid growth', 'success', 'tool', 'usability', 'user-friendly']",NIGMS,MAYO CLINIC ROCHESTER,R01,2013,630706,0.16996948380508578
"Temporal relation discovery for clinical text No abstract available  Relevance (max 2-3 sentences) Temporal relations are of prime importance in biomedicine as they are intrinsically linked to diseases, signs and symptoms, and treatments. Understanding the timeline of clinically relevant events is key to the next generation of translational research where the importance of generalizing over large amounts of data holds the promise of deciphering biomedical puzzles. The goal of our current proposal is to automatically discover temporal relations from clinical free text and create a timeline.",Temporal relation discovery for clinical text,8535820,R01LM010090,"['Algorithms', 'Artificial Intelligence', 'Automated Annotation', 'Brain Neoplasms', 'Clinic', 'Clinical', 'Clinical Data', 'Colon Carcinoma', 'Communities', 'Data', 'Development', 'Disease', 'Electronics', 'Evaluation', 'Event', 'Goals', 'Guidelines', 'Linguistics', 'Link', 'Machine Learning', 'Medical Records', 'Methods', 'Modeling', 'Natural Language Processing', 'Pathology Report', 'Performance', 'Process', 'Radiology Specialty', 'Reference Standards', 'Reporting', 'Research', 'Retrieval', 'Signs and Symptoms', 'System', 'Technology', 'Testing', 'Text', 'TimeLine', 'Translational Research', 'Vision', 'base', 'clinically relevant', 'computer science', 'data mining', 'indexing', 'new technology', 'next generation', 'open source', 'theories']",NLM,BOSTON CHILDREN'S HOSPITAL,R01,2013,663984,0.04219648988549893
"Utilizing social media as a resource for mental health surveillance     DESCRIPTION (provided by applicant):  Major depressive disorder is one of the most common debilitating illnesses in the United States, with a lifetime prevalence of 16.2%. Currently, nationwide mental health surveillance takes the form of large-scale telephone- based surveys. These surveys have high running costs and require teams of human telephone operators. Even the largest system, the Behavioral Risk Factor Surveillance System, reaches only 0.13% of the US population. Twitter (and other microblog services) offers a rich, if terse, multilingual source of real time data for public health surveillance. Natural Language Processing (NLP) provides techniques and resources to ""unlock"" data from text. We propose using Twitter and NLP as a cost-effective and flexible approach to augmenting current telephone- based surveillance methods for population level depression monitoring.         This grant application has two major strands. First, investigating ethical issues and challenges to privacy that emerge with the use of Twitter data for public health surveillance (Aim One). Second, developing techniques and resources for real-time public health surveillance for mental illness from Twitter (Aim Two &Aim Three). Aim One seeks to investigate and codify our responsibilities as researchers towards Twitter users by engaging with those users directly. With Aim Two, we will build and evaluate Natural Language Processing resources - algorithms, lexicons and taxonomies - to support the identification of depression symptoms in Twitter data. For Aim Three, we will build and evaluate Natural Language Processing modules and services that use Twitter as a data source for monitoring depression levels in the community. The significance of the proposed work lies in three areas. First, our investigations - both empirical and theoretical - will explore ethical issues in the use of Twitter for public health surveillance. This work has the potential to guide future research in the area. Second, in developing and evaluating algorithms and resources for identifying depression from tweets, we are contributing foundational work to the field of NLP. Third, developing these algorithms and resources will provide the bedrock for building social media based surveillance systems which will provide a cost effective means of augmenting current mental health surveillance practice. This proposal is innovative in both its application area (microblogs have not been used before for mental health surveillance), its focus on using NLP to identify depressive symptoms for public health, and in the central role that qualitative bioethical research will play in guiding the work.              Project Narrative The proposed research focuses on using advanced Natural Language Processing methods to mine microblog data - in this case, Twitter - for mental health surveillance (specifically, depression surveillance), in order to augment current telephone-based mental health surveillance systems. The research has public health at its core.",Utilizing social media as a resource for mental health surveillance,8510292,K99LM011393,"['Algorithms', 'Applications Grants', 'Area', 'Attitude', 'Behavioral Risk Factor Surveillance System', 'Broadcast Media', 'Cities', 'Cognitive', 'Communities', 'County', 'Data', 'Data Sources', 'Dental', 'Development', 'Disasters', 'Earthquakes', 'Electronic Health Record', 'Epidemiology', 'Ethical Issues', 'Ethics', 'Exercise', 'Guidelines', 'Health', 'Human', 'Influenza A Virus, H1N1 Subtype', 'Interview', 'Investigation', 'Linguistics', 'Location', 'Major Depressive Disorder', 'Mental Depression', 'Mental Health', 'Mental disorders', 'Methods', 'Mining', 'Monitor', 'Natural Language Processing', 'Participant', 'Phase', 'Play', 'Population', 'Population Surveillance', 'Prevalence', 'Privacy', 'Process', 'Psyche structure', 'Public Health', 'Recruitment Activity', 'Reporting', 'Research', 'Research Personnel', 'Resources', 'Role', 'Running', 'Scheme', 'Services', 'Smoking Status', 'Source', 'Surveillance Methods', 'Surveys', 'System', 'Taxonomy', 'Techniques', 'Telephone', 'Text', 'Time', 'United States', 'Update', 'Work', 'base', 'center for epidemiological studies depression scale', 'cost', 'cost effective', 'depressive symptoms', 'flexibility', 'innovation', 'lexical', 'social', 'syndromic surveillance', 'text searching', 'tool', 'ward']",NLM,"UNIVERSITY OF CALIFORNIA, SAN DIEGO",K99,2013,82800,0.016868970641295285
