text,title,id,project_number,terms,administration,organization,mechanism,year,funding,score
"Adapting Natural Language Processing Tools for Biosurveillance    DESCRIPTION (provided by applicant):       Early detection of disease outbreaks can decrease patient morbidity and mortality and minimize the spread of diseases. Early detection requires accurate classification of patient symptoms early in the course of their illness. One approach is biosurveillance, in which electronic symptom data are captured early in the course of illness, and analyzed for signals that might indicate an outbreak requiring investigation and response by the public health system. Emergency department (ED) patient records are particularly useful for biosurveillance, given their timely, electronic availability. ED data elements used in surveillance systems include the chief complaint (a brief description of the patient's primary symptom(s)), and triage nurses' note (also known as history of present illness).The chief complaint is the most widely used ED data element, because it is recorded electronically by the majority of EDs. One study showed that adding triage notes increased the sensitivity of biosurveillance case detection. The increased sensitivity is because the triage note increases the amount of data available: instead of one symptom in a chief complaint (e.g., fever), triage notes may contain multiple symptoms (e.g., ""fever, cough & shortness of breath for 12 hours""). Surveillance efforts are hampered, however, by the wide variability of free text data in ED chief complaints and triage notes. They often include misspellings, abbreviations, acronyms and other lexical and semantic variants that are difficult to group into symptom clusters (e.g., fever, temp 104, fvr, febrile). Tools are needed to address the lexical and semantic variation in symptom terms in ED data in order to improve biosurveillance. Natural language processing tools have been shown to facilitate concept extraction from more structured clinical data such as radiology reports, but there has been limited application of these techniques to free text ED triage notes. The project team developed the Emergency Medical Text Processor (EMT-P) to preprocess the chief complaint. EMT-P cleans and normalizes brief chief complaint entries and then extracts standardized concepts, but it is not sufficient in its current state to preprocess longer, more complex text passages such as triage notes. This proposed project will further strengthen biosurveillance by adapting EMT-P and other statistical and classical natural language processing tools to develop a system that extracts concepts from triage notes for biosurveillance.           Project Narrative Relevance: The public health system is responsible for monitoring large amounts of timely, electronic health data and needs more sophisticated tools to faciliate detection of, and response to, emerging infectious diseases and potential bioterrorism threats. The proposed project addresses this need by developing a system to extract relevant information from emergency department records.",Adapting Natural Language Processing Tools for Biosurveillance,7693117,G08LM009787,"['Abbreviations', 'Accident and Emergency department', 'Acute', 'Address', 'American', 'Avian Influenza', 'Bioterrorism', 'Bird Flu vaccine', 'Breathing', 'Classification', 'Clinical', 'Clinical Data', 'Clinical Research', 'Code', 'Collection', 'Communicable Diseases', 'Communities', 'Complex', 'Contracts', 'Coughing', 'Country', 'Data', 'Data Element', 'Data Quality', 'Detection', 'Diagnosis', 'Disease', 'Disease Outbreaks', 'Early Diagnosis', 'Electronic Health Record', 'Electronics', 'Emergency Medicine', 'Emergency Situation', 'Emerging Communicable Diseases', 'Epidemiologist', 'Evaluation', 'Event', 'Fever', 'Genetic Transcription', 'Goals', 'Gold', 'Health', 'Health Services', 'Health system', 'Hour', 'Intervention', 'Investigation', 'Manuals', 'Measures', 'Medical', 'Methods', 'Monitor', 'Morbidity - disease rate', 'Natural Language Processing', 'North Carolina', 'Nurses', 'Patients', 'Performance', 'Pertussis', 'Physicians', 'Predictive Value', 'Process', 'Public Health', 'Radiology Specialty', 'Recording of previous events', 'Records', 'Reporting', 'Sampling', 'Screening procedure', 'Semantics', 'Sensitivity and Specificity', 'Shortness of Breath', 'Signal Transduction', 'Smallpox', 'Structure', 'Symptoms', 'System', 'Techniques', 'Temperature', 'Text', 'Translating', 'Triage', 'Variant', 'acronyms', 'base', 'experience', 'improved', 'lexical', 'mortality', 'pandemic disease', 'population based', 'prototype', 'research to practice', 'response', 'satisfaction', 'syntax', 'tool']",NLM,UNIV OF NORTH CAROLINA CHAPEL HILL,G08,2009,145926,0.04288189507301627
"Natural Language Processing for Cancer Research Network Surveillance Studies    DESCRIPTION (provided by applicant): This application addresses Broad Challenge Area: (10) Information Technology for Processing Health Care Data and specific Challenge Topic: 10-CA-107 Expand Spectrum of Cancer Surveillance through Informatics Approaches. The proposed project launches a collaborative effort to advance adoption within the HMO Cancer Research Network (CRN) of ""industrial-strength"" natural language processing (NLP) systems useful for mining valuable, research-grade information from unstructured clinical text. Such text is available for processing, now in the electronic medical record (EMR) systems of affiliated CRN health plans. The proposed NLP methods   will create ongoing capacity to tap what has recently been described as ""a treasure trove of historical   unstructured data that provides essential information for the study of disease progression, treatment   effectiveness and long-term outcomes"" (5). The vision of advancing widespread NLP capacity across the CRN, as well as the approach we present here for implementing it, grew out of an in-depth strategic planning effort we completed in December 2008. That effort involved participants from six CRN sites guided by a blue-ribbon panel of NLP experts from three of the nation's leading centers of clinical NLP research: University of Pittsburgh Medical Center, Vanderbilt University, and Mayo Clinic. The vision is to deploy a powerful NLP system locally, manage it with newly hired and trained local NLP technical staff, and conduct NLP-based research projects initiated by local investigators, in consultation with higher-level external NLP experts. Our planning efforts suggest this collaborative model is feasible; we will test the model in the context of the proposed project. An important development in April 2009 yielded what we believe is a potentially transformative opportunity to accelerate adoption of NLP capacity in applied research settings: release of the open-source Clinical Text Analysis and Knowledge Extraction System (cTAKES) software. This software was the result of a collaborative effort between IBM and Mayo Clinic. Built on the same framework Mayo Clinic currently uses to process its repository of over 40 million clinical documents, cTAKES dramatically lowers the cost of adopting a comprehensive and flexible NLP system. Deployment and use of such systems was previously only feasible in institutions with large, academically-oriented biomedical informatics research programs.   Still, other deployment challenges and the need to acquire NLP training for local staff present residual   barriers to adopting comprehensive NLP systems such as cTAKES. In collaboration with five other CRN sites the proposed project mitigates these challenges in two ways: 1) it develops configurable open-source software modules needed to streamline and therefore reduce the cost of deploying cTAKES, and 2) it presents and tests a model for training local staff through hands-on NLP projects overseen by outside NLP expert consultants. The potential impact of this project is evident most clearly in the vast untapped opportunities for text mining represented in CRN-affiliated health plans, where EMR systems have been in place since at least 2005, and whose patients represent 4% of the U.S. population. Clinical text mining offers the potential to provide new or improved data elements for cancer surveillance and other types of research requiring information about patient functional status, medication side-effects, details of therapeutic approaches, and differential information about clinical findings. Another significant impact of this project is its plan to integrate into the cTAKES system   an open-source de-identification tool based on state of the art, best of breed NLP approaches developed by the MITRE Corporation. De-identification of clinical text will make it easier for researchers to get access to clinical text, and will also facilitate multi-site collaborations while protecting patient privacy. Finally, if successful, the NLP algorithm we propose as a proof-of-principle project at Group Health-which will classify sets of patient charts as either containing or not containing a diagnosis of recurrent breast cancer-could dramatically reduce the cost of research in this area; currently all recurrent breast cancer endpoints must be established through costly manual chart abstraction.   Novel aspects of the proposed project include its talented and transdisciplinary research team,   including national experts in NLP, and its resourceful strategy for building the technical resources and ""human capital"" needed to support an ongoing program of applied NLP research. Natural language processing is itself a highly innovative technology; when successfully established in multiple CRN in the future it will represent a watershed moment in the CRN's already impressive history of exploiting data systems to support innovative research. Newly hired staff positions total approximately 2.0 FTE in each project year, most of which we anticipate will be supported by ongoing new research programs after the proposed project concludes. Project narrative The proposed project develops new measurement technologies for extracting information about disease processes and treatment, currently documented only in clinical text, based on natural language processing approaches. Because these methods are generic they will potentially contribute to public health by advancing research in a wide variety of areas. The ""proof of principle"" algorithm developed in the project to identify recurrent breast cancer diagnoses will advance epidemiologic and clinical research pertaining to the 2.5 million women currently living with breast cancer.           Project narrative The proposed project develops new measurement technologies for extracting information about disease processes and treatment, currently documented only in clinical text, based on natural language processing approaches. Because these methods are generic they will potentially contribute to public health by advancing research in a wide variety of areas. The ""proof of principle"" algorithm developed in the project to identify recurrent breast cancer diagnoses will advance epidemiologic and clinical research pertaining to the 2.5 million women currently living with breast cancer.",Natural Language Processing for Cancer Research Network Surveillance Studies,7839706,RC1CA146917,"['Address', 'Adopted', 'Adoption', 'Adverse effects', 'Algorithms', 'Applied Research', 'Area', 'Arts', 'Bioinformatics', 'Breeding', 'Cancer Research Network', 'Charge', 'Clinic', 'Clinical', 'Clinical Data', 'Clinical Research', 'Collaborations', 'Complex', 'Comprehensive Health Care', 'Computer software', 'Computerized Medical Record', 'Consultations', 'Data', 'Data Element', 'Data Quality', 'Development', 'Diagnosis', 'Disease', 'Disease Progression', 'Doctor of Philosophy', 'Environment', 'Exercise', 'Future', 'Generic Drugs', 'Hand', 'Health', 'Health Planning', 'Health system plans', 'Healthcare', 'Human Resources', 'Individual', 'Informatics', 'Information Systems', 'Information Technology', 'Institution', 'Knowledge', 'Knowledge Extraction', 'Learning', 'Licensing', 'Life', 'Malignant Neoplasms', 'Manuals', 'Measurement', 'Medical center', 'Methods', 'Mining', 'Modeling', 'NCI Center for Cancer Research', 'Natural Language Processing', 'Operating System', 'Outcome', 'Participant', 'Patients', 'Pharmaceutical Preparations', 'Population', 'Positioning Attribute', 'Process', 'Public Health', 'Recording of previous events', 'Recurrence', 'Research', 'Research Infrastructure', 'Research Personnel', 'Research Project Grants', 'Residual state', 'Resources', 'Risk', 'Site', 'Solutions', 'Strategic Planning', 'System', 'Technology', 'Testing', 'Text', 'Therapeutic', 'Training', 'Treatment Effectiveness', 'Universities', 'Vision', 'Woman', 'base', 'biomedical informatics', 'breast cancer diagnosis', 'cost', 'design', 'experience', 'feeding', 'firewall', 'flexibility', 'functional status', 'human capital', 'improved', 'innovation', 'innovative technologies', 'malignant breast neoplasm', 'novel', 'open source', 'patient privacy', 'programs', 'repository', 'skills', 'software systems', 'surveillance study', 'text searching', 'tool']",NCI,KAISER FOUNDATION HEALTH PLAN OF WASHINGTON,RC1,2009,497857,0.09155052948220828
"Investigating the generalizability of natural language processing of EMR data    DESCRIPTION (provided by applicant):       The electronic medical record (EMR) offers impressive opportunities for increasing care quality, but challenges stand in the way of realizing this vision. For example, coded EMR data readily available for analysis typically are incomplete (due to the prevalence of free-text clinical notes in EMR implementations), and data from different EMRs are often incommensurate due to differences in standard vocabularies and system implementations. While informatics research has shown the feasibility of automatically coding specific aspects of clinical text using Natural Language Processing (NLP), challenges remain for translating these informatics developments into large-scale care quality assessments. To date, successful NLP solutions for automated quality assessment have tended to be applications that are specific to (a) the target problem or clinical focus, (b) the EMR data system, and (c) the person or team that implements the NLP solution. In this study, we propose to begin addressing the problem of implementation team specificity by developing, evaluating, and making freely available a generalizable NLP development tool suite. The tools will enable widespread adoption of NLP systems to extract and code data from free text clinical notes. The Knowledge Editing Toolkit will simplify development of problem-specific knowledge by helping the user define the rules, concepts, and terms that constitute a domain-specific knowledge module, thus allowing any informaticist to develop an NLP application. The NLP Application Validation Toolkit will allow rapid testing and evaluation of the application against a gold standard of independently-coded test records from any EMR. To evaluate the effects of the toolkits on NLP generalizability, we will have three clinical informaticists each build two NLP applications (for a total of six distinct applications). One of their applications will identify a constellation of common clinical signs or symptoms (e.g., ""persistent cough"") that are relatively discrete concepts using simple language terms for many different clinical purposes. Their second application will assess behavioral counseling (e.g., ""alcohol counseling""), which uses complex language constructs for dedicated clinical purposes. We will describe and evaluate the accuracy of the solutions against independently coded test sets of medical records. We will quantify and compare the difficulty of creating these solutions as measured by the time, number of iterations required to build the applications, and the number of concepts and rules employed, as well as analyze variability in content and accuracy of the solutions created. In addition, we will use qualitative techniques to assess the ease of using the development tools; the difficulty in learning the tools; and specific types of problems, limitations, and bugs encountered. Such an NLP development tool suite has the potential to allow simple, elegant, and reliably good NLP solutions regardless of the clinical problem domain or the person developing the solution.           n/a",Investigating the generalizability of natural language processing of EMR data,7691692,R21LM009728,"['Address', 'Adopted', 'Adoption', 'Affect', 'Alcohols', 'Architecture', 'Behavioral', 'Caring', 'Classification', 'Clinical', 'Clinical Data', 'Code', 'Complex', 'Computer Systems Development', 'Computerized Medical Record', 'Coughing', 'Counseling', 'Data', 'Databases', 'Development', 'Event', 'Gold', 'Healthcare Systems', 'Human Resources', 'Informatics', 'Information Systems', 'Information Technology', 'Institute of Medicine (U.S.)', 'Knowledge', 'Language', 'Learning', 'Measures', 'Medical Records', 'Modification', 'Natural Language Processing', 'Performance', 'Persons', 'Positioning Attribute', 'Prevalence', 'Process', 'Proliferating', 'Quality of Care', 'Records', 'Research', 'Running', 'Solutions', 'Source', 'Specificity', 'Structure', 'Symptoms', 'System', 'Techniques', 'Testing', 'Text', 'Time', 'Translating', 'United States National Academy of Sciences', 'Ursidae Family', 'Validation', 'Vision', 'Vocabulary', 'care delivery', 'cost', 'design', 'evaluation/testing', 'experience', 'health care quality', 'stem', 'success', 'tool', 'tool development', 'web site']",NLM,KAISER FOUNDATION RESEARCH INSTITUTE,R21,2009,177750,0.13382581914420133
"Investigating the generalizability of natural language processing of EMR data    DESCRIPTION (provided by applicant):       The electronic medical record (EMR) offers impressive opportunities for increasing care quality, but challenges stand in the way of realizing this vision. For example, coded EMR data readily available for analysis typically are incomplete (due to the prevalence of free-text clinical notes in EMR implementations), and data from different EMRs are often incommensurate due to differences in standard vocabularies and system implementations. While informatics research has shown the feasibility of automatically coding specific aspects of clinical text using Natural Language Processing (NLP), challenges remain for translating these informatics developments into large-scale care quality assessments. To date, successful NLP solutions for automated quality assessment have tended to be applications that are specific to (a) the target problem or clinical focus, (b) the EMR data system, and (c) the person or team that implements the NLP solution. In this study, we propose to begin addressing the problem of implementation team specificity by developing, evaluating, and making freely available a generalizable NLP development tool suite. The tools will enable widespread adoption of NLP systems to extract and code data from free text clinical notes. The Knowledge Editing Toolkit will simplify development of problem-specific knowledge by helping the user define the rules, concepts, and terms that constitute a domain-specific knowledge module, thus allowing any informaticist to develop an NLP application. The NLP Application Validation Toolkit will allow rapid testing and evaluation of the application against a gold standard of independently-coded test records from any EMR. To evaluate the effects of the toolkits on NLP generalizability, we will have three clinical informaticists each build two NLP applications (for a total of six distinct applications). One of their applications will identify a constellation of common clinical signs or symptoms (e.g., ""persistent cough"") that are relatively discrete concepts using simple language terms for many different clinical purposes. Their second application will assess behavioral counseling (e.g., ""alcohol counseling""), which uses complex language constructs for dedicated clinical purposes. We will describe and evaluate the accuracy of the solutions against independently coded test sets of medical records. We will quantify and compare the difficulty of creating these solutions as measured by the time, number of iterations required to build the applications, and the number of concepts and rules employed, as well as analyze variability in content and accuracy of the solutions created. In addition, we will use qualitative techniques to assess the ease of using the development tools; the difficulty in learning the tools; and specific types of problems, limitations, and bugs encountered. Such an NLP development tool suite has the potential to allow simple, elegant, and reliably good NLP solutions regardless of the clinical problem domain or the person developing the solution.           n/a",Investigating the generalizability of natural language processing of EMR data,7850343,R21LM009728,"['Address', 'Adopted', 'Adoption', 'Affect', 'Alcohols', 'Architecture', 'Behavioral', 'Caring', 'Classification', 'Clinical', 'Clinical Data', 'Code', 'Complex', 'Computer Systems Development', 'Computerized Medical Record', 'Coughing', 'Counseling', 'Data', 'Databases', 'Development', 'Event', 'Gold', 'Healthcare Systems', 'Human Resources', 'Informatics', 'Information Systems', 'Information Technology', 'Institute of Medicine (U.S.)', 'Knowledge', 'Language', 'Learning', 'Measures', 'Medical Records', 'Modification', 'Natural Language Processing', 'Performance', 'Persons', 'Positioning Attribute', 'Prevalence', 'Process', 'Proliferating', 'Quality of Care', 'Records', 'Research', 'Running', 'Solutions', 'Source', 'Specificity', 'Structure', 'Symptoms', 'System', 'Techniques', 'Testing', 'Text', 'Time', 'Translating', 'United States National Academy of Sciences', 'Ursidae Family', 'Validation', 'Vision', 'Vocabulary', 'care delivery', 'cost', 'design', 'evaluation/testing', 'experience', 'health care quality', 'stem', 'success', 'tool', 'tool development', 'web site']",NLM,KAISER FOUNDATION RESEARCH INSTITUTE,R21,2009,99971,0.13382581914420133
