text,title,id,project_number,terms,administration,organization,mechanism,year,funding,score
"Interactive machine learning methods for clinical natural language processing DESCRIPTION (provided by applicant): Growing deployments of electronic health records (EHRs) systems have made massive clinical data available electronically. However, much of detailed clinical information of patients is embedded in narrative text and is not directly accessible for computerized clinical applications. Therefore, natural language processing (NLP) technologies, which can unlock information in narrative document, have received great attention in the medical domain. Current state-of-the-art NLP approaches often involve building probabilistic models. However, the wide adoption of statistical methods in clinical NLP faces two grand challenges: 1) the lack of large annotated clinical corpora; and 2) the lack of methodologies that can efficiently integrate linguistic and domain knowledge with statistical learning. High-performance statistical NLP methods rely on large scale and high quality annotations of clinical text, but it is time-consuming and costly to create large annotated clinica corpora as it often requires manual review by physicians. Moreover, the medical domain is knowledge intensive. To achieve optimal performance, probabilistic models need to leverage medical domain knowledge. Therefore, methods that can efficiently integrate domain and expert knowledge with machine learning processes to quickly build high-quality probabilistic models with minimum annotation cost would be highly desirable for clinical text processing.    In this study, we propose to investigate interactive machine learning (IML) methods to address the above challenges in clinical NLP. An IML system builds a classification model in an iterative process, which can actively select informative samples for annotation based on models built on previously annotated samples, thus reducing the annotation cost for model development. More importantly, an IML system also involves human inputs to the learning process (e.g., an expert can specify important features for a classification task based on domain knowledge). Thus, IML is an ideal framework for efficiently integrating rule-based (via domain experts specifying features) and statistics-based (via different learning algorithms) approaches to clinical NLP. To achieve our goal, we propose three specific aims. In Aim 1, we plan to investigate different aspects of IML for word sense disambiguation, including developing new active learning algorithms and conducting cognitive usability analysis for efficient feature annotation by users. To demonstrate the broad uses of IML, we further extend IML approaches to two other important clinical NLP classification tasks: named entity recognition and clinical phenoytping in Aim 2. Finally we propose to disseminate the IML methods and tools to the biomedical research community in Aim 3. Project Narrative In this project, we propose to develop interactive machine learning methods to process clinical text stored in electronic health records (EHRs) systems. Such methods can efficiently integrate domain and expert knowledge with machine learning processes to quickly build high-quality probabilistic models with minimum annotation cost, thus improving performance of text processors. This technology will allow more accurate data extraction from clinical documents, thus to facilitate clinical research that rely on EHRs data.",Interactive machine learning methods for clinical natural language processing,9132834,R01LM010681,"['Abbreviations', 'Active Learning', 'Address', 'Adoption', 'Algorithms', 'Attention', 'Biomedical Research', 'Classification', 'Clinical', 'Clinical Data', 'Clinical Informatics', 'Clinical Research', 'Cognitive', 'Communities', 'Data', 'Data Set', 'Development', 'Disease', 'Educational workshop', 'Electronic Health Record', 'Face', 'Goals', 'Grant', 'Human', 'Hybrids', 'Knowledge', 'Label', 'Learning', 'Linguistics', 'Machine Learning', 'Manuals', 'Medical', 'Methodology', 'Methods', 'Modeling', 'Names', 'Natural Language Processing', 'Patients', 'Pattern', 'Performance', 'Pharmaceutical Preparations', 'Physicians', 'Process', 'Research', 'Research Personnel', 'Research Priority', 'Resources', 'Sampling', 'Source', 'Specific qualifier value', 'Statistical Methods', 'Statistical Models', 'System', 'Technology', 'Testing', 'Text', 'Time', 'United States National Library of Medicine', 'base', 'clinical application', 'clinical phenotype', 'cohort', 'computer human interaction', 'computerized', 'cost', 'experience', 'improved', 'learning strategy', 'model building', 'model development', 'novel', 'open source', 'real world application', 'statistics', 'success', 'tool', 'usability']",NLM,UNIVERSITY OF TEXAS HLTH SCI CTR HOUSTON,R01,2016,463405,0.10620838108366538
"Semi-structured Information Retrieval in Clinical Text for Cohort Identification DESCRIPTION (provided by applicant):  Natural Language Processing (NLP) techniques have shown promise for extracting data from the free text of electronic health records (EHRs), but studies have consistently found that techniques do not readily generalize across application settings. Unfortunately, most of the focus in applying NLP to real use cases has remained on a paradigm of single, well-defined application settings, so that generalizability to unseen use cases remains implicitly unaddressed. We propose to explicitly account for unseen application settings by adopting an information retrieval (IR) perspective with the objective of patient-level cohort identification. To do so, we introduce layered language models, an IR framework that enables the reuse of NLP-produced artifacts. Our long term goal is to accelerate investigations of patient health and disease by providing robust, user- centric tools that are necessary to process, retrieve, and utilize the free text of EHRs. The main goal of this proposal is to accurately retrieve ad hoc, realistic cohorts from clinical text at Mayo Clinic and OHSU, establishing methods, resources, and evaluation for patient-level IR. We hypothesize that cohort identification can be addressed in a generalizable fashion by a new IR framework: layered language models. We will test this hypothesis through four specific aims. In Aim 1, we will make medical NLP artifacts searchable in our layered language IR framework. This involves storing and indexing the NLP artifacts, as well as using statistical language models to retrieve documents based on text and its associated NLP artifacts. In Aim 2, we deal with the practical setting of ad hoc cohort identification, moving to patient-level (rather than document-level) IR. To accurately handle patient cohorts in which qualifying evidence may be spread over multiple documents, we will develop and implement patient-level retrieval models that account for cross- document relational and temporal combinations of events. In Aim 3, we will construct parallel IR test collections using EHR data from two sites; a diverse set of cohort queries written by multiple people toward various clinical or epidemiological ends; and assessments of which patients are relevant to which queries at both sites. Finally, in Aim 4, we refine and evaluate patient-level layered language IR on the ad hoc cohort identification task, making comparisons across the users, queries, optimization metrics, and institutions. We will draw additional extrinsic comparisons with pre-existing techniques, e.g., for cohorts from the Electronic Medical Records and Genonmics network. The expected outcomes of the proposed work are: (i) An open-source cohort identification tool, usable by clinicians and epidemiologists, that makes principled use of NLP artifacts for unseen queries; ii) A parallel test collection for cohort identification, includig two intra-institutional document collections, diverse test topics and user-produced text queries, and patient-level judgments of relevance to each query; and (iii) Validation of the reusability of medical NLP via the task of retrieving patient cohorts. PUBLIC HEALTH RELEVANCE:  With the widespread adoption of electronic medical records, one might expect that it would be simple for a medical expert to find things like ""patients in the community who suffer from asthma."" Unfortunately, on top of lab tests, medications, and demographic information, there are observations that a physician writes down as text - which are difficult for a computer to understand. Therefore, we aim to process text so that a computer can understand enough of it, and then search that text along with the rest of a patient's medical record; this will allow clinicians or researchers to find and study patients groups of interest.",Semi-structured Information Retrieval in Clinical Text for Cohort Identification,9115996,R01LM011934,"['Accounting', 'Address', 'Adopted', 'Adoption', 'Asthma', 'Clinic', 'Clinical', 'Collection', 'Communities', 'Computerized Medical Record', 'Computers', 'Data', 'Dictionary', 'Disease', 'Electronic Health Record', 'Epidemiologist', 'Epidemiology', 'Evaluation', 'Event', 'Evidence Based Medicine', 'Evolution', 'Goals', 'Health', 'Information Retrieval', 'Information Retrieval Systems', 'Institution', 'Interest Group', 'Investigation', 'Judgment', 'Language', 'Learning', 'Machine Learning', 'Measures', 'Medical', 'Medical Records', 'Methodology', 'Methods', 'Modeling', 'Modification', 'Morphologic artifacts', 'Names', 'Natural Language Processing', 'Outcome', 'Patient Recruitments', 'Patients', 'Performance', 'Pharmaceutical Preparations', 'Phase', 'Physicians', 'Process', 'Publishing', 'Qualifying', 'Records', 'Research', 'Research Personnel', 'Resources', 'Rest', 'Retrieval', 'Sampling', 'Semantics', 'Site', 'Smoke', 'Source', 'Specific qualifier value', 'Structure', 'System', 'Techniques', 'Testing', 'Text', 'Validation', 'Weight', 'Work', 'Writing', 'asthmatic patient', 'base', 'cohort', 'improved', 'indexing', 'novel', 'open source', 'profiles in patients', 'query optimization', 'syntax', 'text searching', 'tool']",NLM,MAYO CLINIC ROCHESTER,R01,2016,387966,0.116291562796388
"Natural language processing for clinical and translational research DESCRIPTION (provided by applicant): Rapid growth in the clinical implementation of large electronic medical records (EMRs) has led to an unprecedented expansion in the availability of dense longitudinal datasets for clinical and translational research. This growth is being fueled by recent federal legislation that provides generous financial incentives to institutions demonstrating aggressive application and ""meaningful use"" of comprehensive EMRs. Efforts are already underway to link these EMRs across institutions, and standardize the definition of phenotypes for large scale studies of disease onset and treatment outcome, specifically within the context of routine clinical care. However, a well-known challenge for secondary use of EMR data for clinical and translational research is that much of detailed patient information is embedded in narrative text. Natural Language Processing (NLP) technologies, which are able to convert unstructured clinical text into coded data, have been introduced into the biomedical domain and have demonstrated promising results. Researchers have used NLP systems to identify clinical syndromes and common biomedical concepts from radiology reports, discharge summaries, problem lists, nursing documentation, and medical education documents. Different NLP systems have been developed at different institutions and utilized to convert clinical narrative text into structured data that may be used for other clinical applications and studies. Successful stories in applying NLP to clinical and translational research have been reported widely. However, institutions often deploy different NLP systems, which produce various types of output formats and make it difficult to exchange information between sites. Therefore, the lack of interoperability among different clinical NLP systems becomes a bottleneck for efficient multi-site studies. In addition, many successful studies often require a strong interdisciplinary team where informaticians and clinicians have to work very closely to iteratively define optimal algorithms for clinical phenotypes. As intensive informatics support may not be available to every clinical researcher, the usability of NLP systems for end users is another important issue. The proposed project builds upon first-hand knowledge and experience across the research team in the use of NLP for clinical and translational research projects. There are several big informatics initiatives for clinical and translational research but those initiatives generally assume one shoe fits all and follow top-down approaches to develop NLP solutions. Complementary to those initiatives, we will use a bottom-up approach to handle interoperability and usability: i) we will obtain a common NLP data model and exchange format through empirical analysis of existing NLP systems and NLP results; ii) we will develop a user-centric NLP front end interface for NLP systems wrapped to be consistent with the proposed NLP data model and exchange format incorporating usability analysis into the agile development process. All deliverables will be distributed through the open health NLP (OHNLP) consortium which we intend to make it more open and inclusive. PUBLIC HEALTH RELEVANCE: Rapid growth in the clinical implementation of large electronic medical records (EMRs) has led to an unprecedented expansion in the availability of dense longitudinal datasets for clinical and translational research. We propose the development of a novel framework to enable the use of clinical information embedded in clinical narratives for clinical and translational research.",Natural language processing for clinical and translational research,9033918,R01GM102282,"['Acceleration', 'Adopted', 'Adoption', 'Adverse drug effect', 'Algorithms', 'Architecture', 'Attention', 'Clinical', 'Clinical Investigator', 'Clinical Research', 'Code', 'Communities', 'Computerized Medical Record', 'DNA Databases', 'Data', 'Data Set', 'Development', 'Dictionary', 'Discipline of Nursing', 'Disease', 'Documentation', 'Elements', 'Exclusion Criteria', 'Genes', 'Genomics', 'Goals', 'Growth', 'Health', 'Informatics', 'Institution', 'Knowledge', 'Link', 'Logical Observation Identifiers Names and Codes', 'Manuals', 'Medical Education', 'Modeling', 'Natural Language Processing', 'Onset of illness', 'Output', 'Patients', 'Pharmacogenomics', 'Phenotype', 'Play', 'Process', 'Radiology Specialty', 'Reporting', 'Research', 'Research Personnel', 'Research Project Grants', 'Resources', 'Role', 'SNOMED Clinical Terms', 'Semantics', 'Shoes', 'Site', 'Statutes and Laws', 'Structure', 'Syndrome', 'System', 'Technology', 'Text', 'Translational Research', 'Treatment outcome', 'Work', 'base', 'clinical application', 'clinical care', 'clinical phenotype', 'computer human interaction', 'data exchange', 'data modeling', 'experience', 'financial incentive', 'flexibility', 'human centered computing', 'interoperability', 'novel', 'open source', 'patient safety', 'rapid growth', 'success', 'tool', 'usability', 'user-friendly']",NIGMS,MAYO CLINIC ROCHESTER,R01,2016,562809,0.16996948380508578
"A Framework to Enhance Decision Support by Invoking NLP: Methods and Applications DESCRIPTION (provided by applicant): Electronic Health Records (EHRs) can improve the quality of healthcare delivery in the United States, by providing automated best-practice reminders to clinicians and patients. However such functionality is currently limited to narrow areas of clinical practice, as existing decision support systems can process only structured data, due to lack of a suitable framework and concerns about accuracy and portability. Preliminary work by the PI has shown that rule-based approach can be used to develop broad-domain reminder systems that can utilize free-text in addition to the structured data. The PI has developed prototype systems for cervical and colorectal cancer prevention. These systems consist of rule-based composite models of national guidelines, and rule-based Natural Language Processing (NLP) parsers. The NLP parsers extract the patient variables required for applying the guidelines. However further research is needed to extend the systems and to ensure their accuracy for clinical deployment. In the mentored phase, the PI will collaborate with clinicians to extend and iteratively optimize and validate the systems, and will make them available in open-source so that they can be adapted for deployment at other institutions (aim 1 - K99). In the independent phase, the PI will research methods to facilitate rapid development, deployment and cross- institutional portability of similar systems. Specifically, the PI will develp a hybrid design for the parsers and investigate domain adaptation and active learning methods, for reducing the manual effort for development and adaptation of the NLP parsers (aim 2 - R00). To enable other researchers to reuse the developed methodologies and software resources, a toolkit will be developed that will support the construction and deployment of similar systems (aim 3 - R00). The toolkit will consist of user-friendly tools and templates to replicate the processes engineered in the case studies, and will build on the SHARPn data normalization tooling and other open-source tools. The independent phase will be in collaboration with Intermountain Healthcare. The PI's career goal is to become a scientific leader in clinical informatics with a focus on optimizing clinical decision making. The PI has strong background in clinical medicine and medical informatics, and will receive mentoring from Drs. Hongfang Liu, Christopher Chute, Robert Greenes and Rajeev Chaudhry, who have complimentary areas of expertise. The mentored (K99) phase will be for 2 years at Mayo Clinic Rochester, wherein the PI will undertake courses on decision support and will get mentored training in NLP and health information standards. This will prepare the PI for independent research in R00 phase on portability and tooling. Completion of the proposed work will enable the PI to seek further funding for piloting clinical deployment of the developed systems, measuring their clinical impact, and for scaling the approach to other clinical domains and institutions. The career grant will enable the PI to establish himself as an independent investigator and to make significant contributions towards advancing clinical decision support for improving care delivery. PUBLIC HEALTH RELEVANCE STATEMENT The potential of Electronic Health Records (EHRs) to improve care delivery by providing best-practice reminders is unrealized, because reminder systems currently operate in narrow areas of clinical practice, as they can process only structured data. The proposed framework will enable construction of reminder systems that can encompass broader areas of practice, due to their capability to utilize free-text as well as structured EHR data. This pioneering research directly impacts public health by improving the quality of care through enhanced reminder functionality in the EHRs.",A Framework to Enhance Decision Support by Invoking NLP: Methods and Applications,9187058,R00LM011575,"['Active Learning', 'Address', 'Area', 'Caregivers', 'Caring', 'Case Study', 'Clinic', 'Clinical', 'Clinical Informatics', 'Clinical Medicine', 'Collaborations', 'Colorectal Cancer', 'Computer software', 'Computers', 'Data', 'Decision Support Systems', 'Development', 'Electronic Health Record', 'Engineering', 'Ensure', 'Fostering', 'Funding', 'Goals', 'Grant', 'Guidelines', 'Health', 'Health Care Costs', 'Healthcare', 'Hybrids', 'Institution', 'Language', 'Learning', 'Machine Learning', 'Malignant neoplasm of cervix uteri', 'Manuals', 'Measures', 'Medical Informatics', 'Mentors', 'Methodology', 'Methods', 'Modeling', 'Natural Language Processing', 'Outcome', 'Patients', 'Performance', 'Phase', 'Process', 'Public Health', 'Quality of Care', 'Reminder Systems', 'Research', 'Research Methodology', 'Research Personnel', 'Resources', 'Structure', 'System', 'Text', 'Training', 'United States', 'Validation', 'Work', 'base', 'care delivery', 'career', 'clinical application', 'clinical decision-making', 'clinical practice', 'colorectal cancer prevention', 'colorectal cancer screening', 'design', 'health care delivery', 'improved', 'learning strategy', 'open source', 'portability', 'prevent', 'prototype', 'public health relevance', 'tool', 'user-friendly']",NLM,MASSACHUSETTS GENERAL HOSPITAL,R00,2016,251021,0.04283800898379232
"Evidence-based Strategy and Tool to Simplify Text for Patients and Consumers ﻿    DESCRIPTION (provided by applicant): Lifespans continue to increase, chronic disease survival rates are drastically improved, and treatments are being discovered for a variety of illnesses. This rapidly changing scenario requires patients to participate in their recovery, understand written information and directions thereby calling upon patients to have increasingly more complex health literacy. However, time availability of practitioners or other resources to explain the required information has not increased to match. As a result, finding efficient means to improving patient health literacy is an increasingly important topic in healthcare. Increased health literacy may promote healthy lifestyle behaviors and increase access to health services by the population. It has been argued that for the Patient Protection and Affordable Care Act to be successful, more effort is needed to increase the health literacy of millions of Americans. Similarly, the Healthy People 2020 statement by the Department of Health and Human Services identified improving health literacy (HC/HIT-1) as an important national goal. The broad- long term objectives of this project are to contribute to increasing the health literacy of patients and health information consumers and provide caregivers an evidence-based tool for simplifying text. The most commonly used tool for estimating the difficulty of text is the readability formula. They are not sufficient, however, because there is no evidence to support a connection between their use and decreases in difficulty. This problem is addressed by using modern resources and techniques for discovering traits that make health-related text difficult and developing a tool to guide the simplification of text. . There are four specific aims of this project: 1) Identify differentiating features of easy versus difficult texts, 2) Design a simplification strategy using computer algorithms, 3) Measure the impact of simplification on perceived and actual text difficulty with online participants and a representative community sample, 4) Create free, online software that incorporates proven features algorithmically. Corpus analysis will be conducted to compare easy and difficult texts with each other and discover lexical, grammatical, semantic, and composition and discourse features typical for each. Then, simplification algorithms will be designed and developed relying on rule-based techniques to leverage available resources, e.g., vocabularies, or on machine learning approaches for discovering the best combinations of features for simplification. A representative writer will simplify text by relying on the suggestios provided by an online that tool that uses simplification algorithms. The effect of simplification wll be tested in comprehensive user studies to evaluate the effect on both actual and perceived difficulty. Features successfully shown to decrease text difficulty will be incorporated in an onlie software program designed to reduce text difficulty. PUBLIC HEALTH RELEVANCE: Improving health literacy is an important national goal and necessary trait for a healthy population. Providing understandable information is critical but few tools exist to help write understandable text. We aim to discover features indicative of difficult text, design translation algorithms and create a free, online software tool for rewriting health-related text with demonstrated impact on perceived and actual text difficulty",Evidence-based Strategy and Tool to Simplify Text for Patients and Consumers,9127807,R01LM011975,"['Address', 'Advocate', 'Affect', 'Affordable Care Act', 'Algorithms', 'American', 'Arizona', 'Behavior', 'Caregivers', 'Chronic Disease', 'Communities', 'Complement', 'Complex', 'Comprehension', 'Computational Linguistics', 'Computational algorithm', 'Computer software', 'Conflict (Psychology)', 'Data Set', 'Education', 'Education Projects', 'Ensure', 'Faculty', 'Feedback', 'Funding', 'Goals', 'Health', 'Health Promotion', 'Health Services Accessibility', 'Health behavior', 'Health education', 'Healthcare', 'Healthy People 2020', 'Lead', 'Longevity', 'Machine Learning', 'Measures', 'Medical', 'Medical Informatics', 'Medicine', 'Methods', 'Minority', 'Mullerian duct inhibiting substance', 'Natural Language Processing', 'Outcome', 'Participant', 'Patients', 'Pilot Projects', 'Population', 'Process', 'Public Health', 'Readability', 'Reader', 'Recovery', 'Recruitment Activity', 'Research', 'Research Design', 'Resources', 'Sampling', 'Semantics', 'Software Tools', 'Survival Rate', 'Techniques', 'Technology', 'Testing', 'Text', 'Time', 'Translations', 'Underserved Population', 'United States Dept. of Health and Human Services', 'Universities', 'Vocabulary', 'Work', 'Writing', 'base', 'college', 'combat', 'community based participatory research', 'cost effective', 'design', 'evidence base', 'health literacy', 'healthy lifestyle', 'improved', 'individual patient', 'lexical', 'programs', 'support tools', 'tool', 'trait', 'user-friendly', 'volunteer']",NLM,UNIVERSITY OF ARIZONA,R01,2016,362613,0.06577428900907868
