text,title,id,project_number,terms,administration,organization,mechanism,year,funding,score
"Temporal relation discovery for clinical text Project Summary / Abstract The current proposal continues the investigation on the topic of temporal relation extraction from the Electronic Medical Records (EMR) clinical narrative funded by the NLM since 2010 (Temporal Histories of Your Medical Events, or THYME; thyme.healthnlp.org). Through our efforts so far, we have defined the topic as an active area of research attracting attention across the world. Since its inception, the project has pushed the boundaries of this highly challenging task by investigating new computational methods within the context of the latest developments in the fields of natural language processing (NLP), machine learning (ML), artificial intelligence (AI) and biomedical informatics (BMI) resulting in 60+ publications/presentations. We have made our best performing methods available to the community open source as part of the Apache Clinical Text Analysis and Knowledge Extraction System (cTAKES; ctakes.apache.org). In 2015, 2016, 2017 and 2018, we organized an international shared task (Clinical TempEval) on the topic under the umbrella of the highly prestigious SemEval, thus inviting the international community to work with our THYME data and improve on our results. Clinical TempEval has been highly successful with many participants each year, resulting in new discoveries and many publications. We have made all our data along with our gold standard annotations available to the community through the hNLP Center (center.healthnlp.org).  The underlying theme of this renewal is novel methods for combining explicit domain knowledge (linguistic, semantic, biomedical ontological, clinical), readily available unlabeled data (health-related social media, EMRs), and modern machine learning techniques (e.g. neural networks) for temporal relation extraction from the EMR clinical narrative. Therefore, our renewal proposes a novel and much needed exploration of this line of research:  Specific Aim 1: Develop computational models for novel rich semantic representations such as the Abstract Meaning Representations to encapsulate a single, coherent, full-document graphical representation of meaning for temporal relation extraction  Specific Aim 2: Develop computational methods to infuse domain knowledge (linguistic, semantic, biomedical ontological, clinical) into modern machine learning techniques such as NNs for temporal relation extraction – through input representations, pre-trained vectors, or architectures  Specific Aim 3: Develop novel methods for combining labeled and unlabeled data from various sources (EMR, health-related social media, newswire) for temporal relation extraction from the clinical narrative  Specific Aim 4: Apply the best performing methods for temporal relation extraction developed in SA1-3 to temporally sensitive phenotypes for direct translational sciences studies. Dissemination efforts through publications and open source releases into Apache cTAKES. Project Narrative Temporal relations are of prime importance in biomedicine as they are intrinsically linked to diseases, signs and symptoms, and treatments. Understanding the timeline of clinically relevant events is key to the next generation of translational research where the importance of generalizing over large amounts of data holds the promise of deciphering biomedical puzzles. The goal of our current proposal is to automatically discover temporal relations from clinical free text and structured EMR data and create an aggregated patient-level timeline.",Temporal relation discovery for clinical text,9735964,R01LM010090,"['Address', 'Apache', 'Architecture', 'Area', 'Artificial Intelligence', 'Attention', 'Clinical', 'Cognitive', 'Communities', 'Complex', 'Computer Simulation', 'Computerized Medical Record', 'Computing Methodologies', 'Coupled', 'Data', 'Development', 'Disease', 'Encapsulated', 'Engineering', 'Event', 'Fostering', 'Foundations', 'Funding', 'Goals', 'Gold', 'Health', 'Image', 'International', 'Investigation', 'Knowledge', 'Knowledge Extraction', 'Label', 'Linguistics', 'Link', 'Machine Learning', 'Medical', 'Methods', 'Modernization', 'Natural Language Processing', 'Nature', 'Participant', 'Patient Care', 'Patients', 'Phenotype', 'Publications', 'Recording of previous events', 'Research', 'Semantics', 'Signs and Symptoms', 'Solid', 'Source', 'Speed', 'Structure', 'System', 'Techniques', 'Text', 'Thyme', 'Time', 'TimeLine', 'Training', 'Translational Research', 'Vision', 'Work', 'advanced disease', 'base', 'biomedical informatics', 'biomedical ontology', 'clinically relevant', 'cohesion', 'electronic data', 'electronic structure', 'epidemiology study', 'improved', 'individualized medicine', 'learning community', 'neural network', 'next generation', 'novel', 'open source', 'programs', 'relating to nervous system', 'social media', 'symptom treatment', 'vector']",NLM,BOSTON CHILDREN'S HOSPITAL,R01,2019,626851,0.048582506174994
"Enhanced Detection System for Healthcare-Associated Transmission of Infection ABSTRACT Despite recent progress in reducing the incidence of healthcare-associated infections (HAIs), the Centers for Disease Control and Prevention estimated that 722,000 HAIs occurred in U.S. acute care hospitals in 2011, resulting in 75,000 deaths. Current methods for detecting outbreaks in hospitals are rudimentary and likely to miss some outbreaks altogether and result in substantial delays in detection of others. There are two major developments in healthcare that have the potential to revolutionize how healthcare associated outbreaks of bacterial pathogens are identified and controlled in hospitals. First, the Affordable Care Act mandates use of the electronic medical record (EMR), which has led to its widespread use in healthcare. Second, the costs of bacterial whole genome sequencing (WGS) have declined substantially, which is making its use by infection programs increasingly feasible. In this application, we propose to establish and evaluate the impact of the Enhanced Detection System for Healthcare Association Transmission (EDS-HAT) at the University of Pittsburgh Medical Center (UPMC). EDS-HAT uses a combination of WGS and analysis of the EMR for enhanced outbreak detection. Our specific aims are to 1a): Determine the utility of EDS-HAT to identify HAT that is not identified through routine infection prevention practice, 1b): Improve the efficiency and reduce the cost of EDS-HAT by using the EMR to restrict the use of WGS, 2a): Measure reductions in HAIs following implementation of EDS-HAT, and 2b): Estimate the number of infections and deaths prevented and healthcare costs averted by EDS-HAT. For Aim 1a, EDS-HAT will be performed retrospectively while routine infection prevention practice (requests for molecular typing when an outbreak is suspected) continues, thus allowing a direct comparison of the two approaches. For Aim 1b, we will improve the efficiency and reduce the cost of EDS-HAT by using machine learning and data mining of the EMR to select isolates for WGS. For Aim 2a, we will monitor changes in HAI rates both before and after implementation of EDS-HAT in real time, which will occur at the beginning of year 3. Finally, for Aim 2b, we will perform clinical and budget impact analyses to determine the overall impact of EDS-HAT. To accomplish these aims, we have assembled a team with expertise in infectious diseases, outbreak investigation, infection prevention, microbial genomics and genomic epidemiology, machine learning and data mining, economic analysis and modeling, epidemiology, and biostatistics. EDS-HAT will likely lead to substantial reductions in infections, deaths, and healthcare costs and can serve as a model for how HAT is detected in hospitals. PROJECT NARRATIVE Outbreak detection in most hospitals uses outdated methods. The declining costs of whole genome sequencing (WGS) of bacterial pathogens and the wide-spread use of the electronic medical record (EMR) provide a unique opportunity to enhance outbreak detection in hospitals and therefore reduce the number of infections. Accordingly, we propose to establish the Enhanced Detection System for Healthcare Association Transmission (EDS-HAT), which uses routine WGS of bacterial pathogens and machine learning and data mining of the EMR to dramatically increase capacity to detect healthcare-associated outbreaks.",Enhanced Detection System for Healthcare-Associated Transmission of Infection,9765031,R01AI127472,"['Acinetobacter baumannii', 'Acute', 'Affordable Care Act', 'Bacterial Infections', 'Biometry', 'Budgets', 'Caring', 'Centers for Disease Control and Prevention (U.S.)', 'Cessation of life', 'Charge', 'Clinical', 'Clostridium difficile', 'Code', 'Communicable Diseases', 'Computerized Medical Record', 'Cost Savings', 'DNA Sequence', 'Data', 'Data Analyses', 'Detection', 'Development', 'Devices', 'Disease Outbreaks', 'Economics', 'Enterobacter aerogenes bacterium', 'Enterobacter cloacae', 'Enterococcus faecalis', 'Enterococcus faecium', 'Epidemiology', 'Escherichia coli', 'Event', 'Exposure to', 'Extended-spectrum β-lactamase', 'Genomics', 'Geographic Locations', 'Health Care Costs', 'Healthcare', 'Healthcare Systems', 'Hospitals', 'Incidence', 'Infection', 'Infection prevention', 'Intensive Care Units', 'Investigation', 'Klebsiella pneumonia bacterium', 'Machine Learning', 'Measures', 'Medical', 'Medical center', 'Methods', 'Microbiology', 'Modeling', 'Molecular', 'Monitor', 'Nosocomial Infections', 'Patients', 'Period Analysis', 'Pharmaceutical Preparations', 'Presbyterian Church', 'Prevention', 'Prevention program', 'Procedures', 'Pseudomonas aeruginosa', 'Records', 'Research', 'Source', 'Time', 'Universities', 'Validation', 'Vancomycin resistant enterococcus', 'bacterial genome sequencing', 'base', 'cost', 'data mining', 'enteric pathogen', 'foodborne outbreak', 'genome analysis', 'genome sequencing', 'genomic epidemiology', 'health care settings', 'healthcare-associated infections', 'improved', 'innovation', 'meetings', 'methicillin resistant Staphylococcus aureus', 'microbial', 'pathogen', 'pathogenic bacteria', 'prevent', 'programs', 'prospective', 'tool', 'transmission process', 'virtual', 'whole genome']",NIAID,UNIVERSITY OF PITTSBURGH AT PITTSBURGH,R01,2019,728162,0.10412815954384667
"Deep phenotyping in Electronic Health Records for Genomic Medicine PROJECT SUMMARY The overarching goal of the project is to establish a genomic medicine learning system to accelerate genomic knowledge discovery and application in electronic health records (EHRs). We will integrate deep characteristic phenotypes extracted from EHRs and evolving knowledge of genotype-phenotype associations to optimize the accuracy of variant interpretation and the cost-effectiveness of clinical genome/exome sequencing, and to accelerate the discovery of causal genes by constructing a dynamic genotype-phenotype knowledge network. Prior knowledge on phenotype-gene relationships and phenotypic information about patients can facilitate the identification of disease-causing mutations from thousands of genetic variants in the context of clinical genomic sequencing; however, how best to abstract phenotype information from notes in the EHRs of patients who are diagnosed with or evaluated for monogenetic disorders, standardize the computable representation of phenotypes, and utilize it in genomic interpretation remains unclear. Additionally, how to systematically compare phenotypes across diseases to discover new knowledge in human genetics remains a largely untapped area with great promise. To address these challenges, we will develop and validate scalable and portable open-source natural language processing (NLP) methods for automated and accurate abstraction of characteristic phenotype concepts (e.g., “j-shaped sella turcica” and “short stature”) from EHR narratives. We will then develop a phenotype-driven scoring system called EHR-Phenolyzer to predict the likely candidate genetic variants associated with the phenotypes for patients with genomic sequencing and a high probability of a monogenic condition. On this basis, we will develop a probabilistic disease diagnosis and knowledge discovery system using rich and deep EHR phenotypes, and evaluate these methods for genomic diagnosis and discovery using large- scale clinical exome sequencing data. Ultimately, these methods will support efficient, effective, and scalable genomic diagnostics, and facilitate the implementation of genome-guided precision medicine in clinical practice. NARRATIVE We will develop novel informatics methods to abstract characteristic phenotypes from electronic health records (EHRs) for patients diagnosed with or evaluated for monogenetic disorders, enable the interoperability of computable characteristic phenotypes with existing phenotype-genotype association knowledge such as OMIM and ClinVar, and improve the efficiency and effectiveness of genomic diagnostics.",Deep phenotyping in Electronic Health Records for Genomic Medicine,9786822,R01LM012895,"['Address', 'Adopted', 'Age', 'Area', 'Benchmarking', 'Candidate Disease Gene', 'Characteristics', 'Clinical', 'Clinical Research', 'Clinical effectiveness', 'Computer software', 'Data', 'Data Science', 'Data Set', 'Data Sources', 'Diagnosis', 'Diagnostic', 'Disease', 'Effectiveness', 'Electronic Health Record', 'Event', 'Genes', 'Genetic Diseases', 'Genome', 'Genomic medicine', 'Genomics', 'Genotype', 'Goals', 'Human', 'Human Genetics', 'Informatics', 'Knowledge', 'Knowledge Discovery', 'Learning', 'Link', 'Literature', 'Measures', 'Methods', 'Natural Language Processing', 'Online Mendelian Inheritance In Man', 'Ontology', 'Patients', 'Phenotype', 'Probability', 'Research', 'Resources', 'Software Tools', 'Standardization', 'Statistical Models', 'System', 'Terminology', 'Testing', 'Text', 'Translating', 'Universities', 'Variant', 'abstracting', 'base', 'causal variant', 'clinical decision support', 'clinical diagnostics', 'clinical practice', 'clinical sequencing', 'cost effectiveness', 'data modeling', 'data warehouse', 'design', 'disease diagnosis', 'disease phenotype', 'disease-causing mutation', 'disorder prevention', 'ethnic diversity', 'exome', 'exome sequencing', 'experience', 'genetic disorder diagnosis', 'genetic variant', 'health record', 'human disease', 'improved', 'information organization', 'innovation', 'interoperability', 'next generation', 'novel', 'open source', 'phenotypic data', 'pituitary fossa', 'portability', 'precision medicine', 'success']",NLM,COLUMBIA UNIVERSITY HEALTH SCIENCES,R01,2019,399965,0.02586240855056307
"Psoriasis Center of Research Translation The Psoriasis Center of Research Translation at Case Western Reserve University (CORT) will advance translational discovery and application in psoriasis using a cutting-edge systems biology approach that integrates patient-centered data within a rich and synergistic /collaborative institutional environment. We will leverage extensive preclinical, clinical and translational resources with the expertise and experience of our CWRU interdisciplinary research team, which encompasses bioinformatics, micro/myocobiome, psoriasis patient care, cutaneous immunology and transgenic models.  The overall goal of the CORT is to combine new bioinformatic methodologies with advanced murine and human experimental approaches to translate scientific findings into clinical applications that more nimbly advance therapy for psoriasis and related inflammatory comorbidities. Our highly innovative, synergistic and cross-disciplinary CORT model will use a collaborative research project (CRP) as a central hub with bi- directional input from 2 highly interactive research cores, to refine and test hypotheses, identify and test drug leads and advance understanding of psoriasis and related inflammatory comorbidities. To do so, the CRP will integrate input from the: 1) Preclinical Modeling Core (PMC), that will provide and customize our many validated, unique transgenic psoriasiform animal models and translatable human xenograft approaches, essential to translating new mediator/pathway roles and drug leads; 2) Applied Meta-`Omics Core (AMC), that will apply multi-platform (transcriptome, metabolome, micro/mycobiome) bioinformatics to individual patient and murine samples to identify novel pathway-specific targets. Iterative experimental testing of these targets and feedback from the PMC and CRP will identify key novel pathways critical for psoriasis pathogenesis likely to benefit from intervention by new drugs or repurposed existing drugs for psoriasis therapy.  Our patient-centered translational approach will exploit and enhance a novel, comprehensive and highly annotated database of ~850 psoriasis/psoriatic arthritis single-patient case records that combines clinical information derived from CLEARPATH (an Ohio medical provider consortium-based unified EMR repository for research access), with inflammation markers that stratify subsets. Into each patient's EMR, we will directly integrate his/her meta'Omics data created by the AMC working with the CRP, to create an 'Omics-integrated EMR (EMRi) data set. These cohesive multi-platform personal data records will identify psoriasis patient endotypes based upon unique perturbations identified from their “meta'Omics” analyses. Our overarching hypothesis is that by powerfully combining existing and developing psoriasis basic science datasets, patient records, bioinformatics and computational systems biology with bi-directional mouse and human studies, we will identify new therapeutic targets and repurposed drugs that can be expeditiously moved to clinical trials, improving psoriasis treatment and patient care. The Psoriasis CORT at Case Western Reserve University and University Hospitals Cleveland Medical Center uses emerging capabilities of data analyses that can assemble many aspects of a single psoriasis patient in great detail, including their gene expression in skin and blood cells, the skin microbes (both bacterial and fungal) and the clinical features that are recorded in their electronic medical record (EMR). Using advanced computer algorithms to compare in-house patient data against externally available large databases, we can identify drugs already approved by the FDA that may be repurposed to treat psoriasis, and validate/invalidate them in animal models and patient cells.",Psoriasis Center of Research Translation,9792242,P50AR070590,"['Advisory Committees', 'Animal Model', 'Artificial Intelligence', 'Basic Science', 'Bioinformatics', 'Biological', 'Biological Markers', 'Biological Models', 'Blood Cells', 'Cells', 'Clinical', 'Clinical Trials', 'Comorbidity', 'Computational Biology', 'Computational algorithm', 'Computerized Medical Record', 'Coupled', 'Critical Pathways', 'Custom', 'Cutaneous', 'Data', 'Data Analyses', 'Data Set', 'Databases', 'Decision Making', 'Development', 'Drug Targeting', 'Environment', 'FDA approved', 'Feedback', 'Gene Expression', 'Gene Targeting', 'Goals', 'Growth', 'Human', 'Human Resources', 'Immunology', 'Inflammatory', 'Interdisciplinary Study', 'Intervention', 'Laboratories', 'Leadership', 'Link', 'Machine Learning', 'Mediator of activation protein', 'Medical', 'Medical center', 'Methodology', 'Methods', 'Microbe', 'Modeling', 'Molecular', 'Mus', 'Ohio', 'Pathogenesis', 'Pathogenicity', 'Pathway interactions', 'Patient Care', 'Patients', 'Pharmaceutical Preparations', 'Pre-Clinical Model', 'Provider', 'Psoriasis', 'Psoriatic Arthritis', 'Records', 'Records Controls', 'Research', 'Research Project Grants', 'Resource Allocation', 'Resources', 'Role', 'Sampling', 'Skin', 'Systems Biology', 'Techniques', 'Technology', 'Testing', 'Transgenic Model', 'Transgenic Organisms', 'Translating', 'Translational Research', 'Universities', 'University Hospitals', 'Xenograft procedure', 'base', 'clinical application', 'cohesion', 'cohort', 'data mining', 'design', 'differential expression', 'drug development', 'drug discovery', 'drug testing', 'effective intervention', 'experience', 'improved', 'individual patient', 'inflammatory marker', 'innovation', 'meetings', 'metabolome', 'metabolomics', 'microbiome', 'multimodality', 'mycobiome', 'new therapeutic target', 'novel', 'novel strategies', 'novel therapeutics', 'patient oriented', 'pre-clinical', 'pre-clinical research', 'programs', 'repository', 'response', 'synergism', 'therapeutic target', 'transcriptome', 'transcriptomics', 'translational approach']",NIAMS,CASE WESTERN RESERVE UNIVERSITY,P50,2019,1308373,0.07683792002920559
