text,title,id,project_number,terms,administration,organization,mechanism,year,funding,score
"EMR-Linked Biobank for Translational Genomics ﻿    DESCRIPTION (provided by applicant): Medical care informed by genomic information is beginning to move into clinical practice. The Electronic Medical Records and Genomics (eMERGE) network through its initial phases has provided much of the groundwork for this transformation. The Geisinger Health System project, ""EMR-Linked Biobank for Translational Genomics"" intends to build on the knowledge and experience from eMERGE phase II to accelerate discovery and implementation while expanding our understanding of the sociocultural implications of genomics in medicine. We will accomplish this goal through three specific aims: 1) Use existing biospecimens, genotype and sequence data and EMR-generated phenotypes for discovery in the proposed disorders: familial hypercholesterolemia and chronic rhinosinusitis, 2) Develop and test approaches for implementation of genomic information in clinical practice, 3) Explore, develop and implement novel approaches for family-centered communication around clinically relevant genomic results. We currently have over 60,000 patients broadly consented for research with a large and increasing proportion consented for return of results and deposition in the electronic health record. Over 18,000 patients are genotyped on high density platforms. Our two proposed phenotypes, familial hypercholesterolemia (FH) and chronic rhinosinusitis (CRS) were chosen because both conditions have a significant public health impact in the United States, but they are also ideally suited to the specific aims of the project. They provide opportunities for innovation and extension of current eMERGE methods. While many of these innovations will take advantage of the sequencing done as part of the project, there are several other areas emphasized in the funding opportunity that will broaden the scope of eMERGE research. One of the areas of emphasis for eMERGE III is exploring the familial return of actionable results. FH is well suited to this, as the current clinical recommendation is cascade testing of family members for all diagnosed patients. Currently this relies on the patient to contact at risk family members, but this is less than optimal. We will explore this issue using qualitative and quantitative methods and use the results to design and test novel family communication strategies. Gene-environment interactions play an important role in the development and severity of disease. These are very difficult to study. We propose novel approaches that leverage the assets of Geisinger Health System and the eMERGE Network to develop and apply methods to extend existing projects that study the impact of environment on CRS. This would include the first large scale environment-wide association studies (EWAS). Finally, we propose to lead efforts to apply the tools of economic modeling and analysis to eMERGE projects to begin to quantify the value of implementation of genomic medicine in the US healthcare system. These proposed innovations will magnify the already significant impact that the eMERGE program has had in moving genomic medicine from a dream to a reality. PUBLIC HEALTH RELEVANCE: Through this application GHS seeks to continue its participation in the eMERGE Network for Phase III - Study Investigators U01 (RFA-HG-14-025) funding opportunity. We propose 3 specific aims: 1) use existing biospecimens, genotype and sequence data and EMR-generated phenotypes for discovery and validation of gene-phenotype associations; 2) develop and test approaches for implementation of genomic information in clinical practice; develop and implement novel approaches for family-centered communication around clinically relevant genomic results",EMR-Linked Biobank for Translational Genomics,9285815,U01HG008679,"['Adult', 'Algorithms', 'Ambulatory Care', 'Area', 'Attitude', 'Candidate Disease Gene', 'Caring', 'Catchment Area', 'Child', 'Clinical', 'Communication', 'Computerized Medical Record', 'Consent', 'County', 'Cystic Fibrosis Transmembrane Conductance Regulator', 'Data', 'Deposition', 'Development', 'Diagnosis', 'Disease', 'Dreams', 'Economic Models', 'Ecosystem', 'Electronic Health Record', 'Ensure', 'Environment', 'Familial Hypercholesterolemia', 'Familial disease', 'Family', 'Family member', 'Foundations', 'Funding Opportunities', 'Generations', 'Genes', 'Genomic medicine', 'Genomics', 'Genotype', 'Geography', 'Goals', 'Group Practice', 'Health', 'Health Insurance', 'Health system', 'Healthcare', 'Healthcare Systems', 'Individual', 'Information Systems', 'Inpatients', 'Institute of Medicine (U.S.)', 'Integrated Health Care Systems', 'Knowledge', 'Lead', 'Leadership', 'Learning', 'Link', 'Lipids', 'Machine Learning', 'Medical', 'Medicine', 'Methods', 'Outcome Study', 'Participant', 'Patient Care', 'Patients', 'Pennsylvania', 'Phase', 'Phenotype', 'Physicians', 'Play', 'Population', 'Process', 'Prognostic Factor', 'Provider', 'Public Health', 'Recommendation', 'Research', 'Research Infrastructure', 'Research Personnel', 'Resources', 'Risk', 'Role', 'Rural', 'Rural Population', 'Safety', 'Severity of illness', 'Site', 'Strategic Planning', 'System', 'Techniques', 'Testing', 'Treatment outcome', 'United States', 'Validation', 'Variant', 'base', 'biobank', 'case finding', 'chronic rhinosinusitis', 'clinical care', 'clinical practice', 'clinically relevant', 'density', 'design', 'epidemiology study', 'experience', 'gene environment interaction', 'genetic association', 'genetic epidemiology', 'genetic variant', 'genotyped patients', 'implementation research', 'innovation', 'interest', 'meetings', 'novel', 'novel strategies', 'personalized health care', 'phase 3 study', 'phenome', 'population based', 'programs', 'public health relevance', 'screening', 'tool', 'trait', 'translational genomics', 'treatment response']",NHGRI,GEISINGER CLINIC,U01,2017,871212,0.13648656861079886
"EMERGE PHASE III CLINICAL CENTER AT PARTNERS HEALTHCARE ﻿    DESCRIPTION (provided by applicant): The eMERGE III Clinical Center proposal from Partners HealthCare leverages a large biobank, clinical data in the electronic medical records (EMR) for >4 million participants from the largest integrated health care provider in New England, advanced bioinformatics expertise and state-of-the-art genetic analysis. We propose three aims. (1) Aim 1. Discovery. We will test the hypothesis that common and rare variants from a custom chip including 50,000 loss of function (LoF) alleles will be associated with cardiovascular, neuropsychiatric and immune-mediated phenotypes derived from the EMR. We are currently genotyping 25,000 Partners HealthCare Biobank subjects with a custom chip that includes LoF alleles from 63,000 exomes that we have analyzed. (2) Aim 2. Penetrance and Pleiotropy. We will test the hypothesis that sequencing a set of established genes or loci will allow us to discover additional variation, and define penetrance and pleiotropy using EMR phenotypes. Rare variants in genes selected by the eMERGE network will be studied for penetrance and pleiotropic outcomes by PheWAS and chart review. In addition, we are poised to perform recall-by-genotype studies because all Biobank participants have provided consent for such callback. (3) Aim 3. Implementation. We will test the hypothesis that physicians will alter their surveillance and treatment of patients based upon voluntary return of actionable variants to provide safe and cost-effective benefits to patients. We will screen our entire Biobank population of 25,000 individuals for pathogenic variants in the LDLR gene, the leading genetic cause of premature coronary artery disease, and conduct an exploratory trial in disclosing this information. Biobank participants with pathogenic variants in LDLR will be offered enrollment into a randomized trial, in which their finding will be CLIA-confirmed, and in one arm, this result will be communicated to their physicians through the EMR. Over one year, we will collect the following outcomes through participant surveys and EMR queries: physician visits, laboratory testing, changes in medication prescriptions, LDL levels, medical costs and the number of family members screened and treated as a result of the intervention. We will collaborate with the entire eMERGE III Network to incorporate what we learn from this pilot trial into large-scale implementation protocols for the genes selected by the Network for sequencing. Finally, we will participate in all Network activities to enhance the movement of genetics into clinical practice. PUBLIC HEALTH RELEVANCE: The discovery and clinical use of genetic variants associated with both rare Mendelian and more common complex diseases promises to dramatically change the practice of medicine. Our eMERGE III project will leverage a large Biobank and a rich electronic medical record to define the phenotypic impact of mutations emerging from sequencing and then return results on selected variants to Biobank participants using a clinical trial.",EMERGE PHASE III CLINICAL CENTER AT PARTNERS HEALTHCARE,9477855,U01HG008685,"['Algorithms', 'Alleles', 'Area', 'Asthma', 'Attention deficit hyperactivity disorder', 'Bioinformatics', 'Biology', 'Bipolar Disorder', 'CTLA4 gene', 'Callback', 'Cardiovascular Diseases', 'Cardiovascular system', 'Clinical', 'Clinical Data', 'Clinical Trials', 'Complex', 'Computerized Medical Record', 'Congestive Heart Failure', 'Consent', 'Coronary Arteriosclerosis', 'Coronary heart disease', 'Cost Effectiveness Analysis', 'Custom', 'DRD2 gene', 'Data', 'Disease', 'Enrollment', 'Family member', 'Funding', 'Genes', 'Genetic', 'Genomic medicine', 'Genotype', 'Goals', 'HLA-DRB1', 'Health Personnel', 'Healthcare', 'Immune', 'Individual', 'Inflammatory Bowel Diseases', 'Informatics', 'Intervention', 'LDL Cholesterol Lipoproteins', 'LDLR gene', 'Laboratories', 'Learning', 'Low-Density Lipoproteins', 'Machine Learning', 'Mediating', 'Medical', 'Medicine', 'Mental Depression', 'Mining', 'Movement', 'Multiple Sclerosis', 'Mutation', 'New England', 'Newborn Infant', 'Outcome', 'Participant', 'Pathogenicity', 'Patients', 'Penetrance', 'Pharmaceutical Preparations', 'Pharmacogenetics', 'Phase', 'Phenotype', 'Physicians', 'Population', 'Population Attributable Risks', 'Protocols documentation', 'Public Health', 'Research', 'Rheumatoid Arthritis', 'Schizophrenia', 'Source', 'Stream', 'Stroke', 'Surveys', 'TCF7L2 gene', 'TNFRSF1A gene', 'TYK2', 'Testing', 'Variant', 'Visit', 'arm', 'base', 'biobank', 'biomarker panel', 'clinical care', 'clinical practice', 'clinical sequencing', 'clinically actionable', 'cost', 'cost effective', 'design', 'exome', 'experience', 'genetic analysis', 'genetic information', 'genetic variant', 'hypercholesterolemia', 'implementation research', 'loss of function', 'neuropsychiatric disorder', 'neuropsychiatry', 'novel', 'pilot trial', 'pleiotropism', 'premature', 'public health relevance', 'randomized trial', 'rare variant', 'support tools']",NHGRI,BRIGHAM AND WOMEN'S HOSPITAL,U01,2017,100000,0.10146060800620932
"EMERGE PHASE III CLINICAL CENTER AT PARTNERS HEALTHCARE ﻿    DESCRIPTION (provided by applicant): The eMERGE III Clinical Center proposal from Partners HealthCare leverages a large biobank, clinical data in the electronic medical records (EMR) for >4 million participants from the largest integrated health care provider in New England, advanced bioinformatics expertise and state-of-the-art genetic analysis. We propose three aims. (1) Aim 1. Discovery. We will test the hypothesis that common and rare variants from a custom chip including 50,000 loss of function (LoF) alleles will be associated with cardiovascular, neuropsychiatric and immune-mediated phenotypes derived from the EMR. We are currently genotyping 25,000 Partners HealthCare Biobank subjects with a custom chip that includes LoF alleles from 63,000 exomes that we have analyzed. (2) Aim 2. Penetrance and Pleiotropy. We will test the hypothesis that sequencing a set of established genes or loci will allow us to discover additional variation, and define penetrance and pleiotropy using EMR phenotypes. Rare variants in genes selected by the eMERGE network will be studied for penetrance and pleiotropic outcomes by PheWAS and chart review. In addition, we are poised to perform recall-by-genotype studies because all Biobank participants have provided consent for such callback. (3) Aim 3. Implementation. We will test the hypothesis that physicians will alter their surveillance and treatment of patients based upon voluntary return of actionable variants to provide safe and cost-effective benefits to patients. We will screen our entire Biobank population of 25,000 individuals for pathogenic variants in the LDLR gene, the leading genetic cause of premature coronary artery disease, and conduct an exploratory trial in disclosing this information. Biobank participants with pathogenic variants in LDLR will be offered enrollment into a randomized trial, in which their finding will be CLIA-confirmed, and in one arm, this result will be communicated to their physicians through the EMR. Over one year, we will collect the following outcomes through participant surveys and EMR queries: physician visits, laboratory testing, changes in medication prescriptions, LDL levels, medical costs and the number of family members screened and treated as a result of the intervention. We will collaborate with the entire eMERGE III Network to incorporate what we learn from this pilot trial into large-scale implementation protocols for the genes selected by the Network for sequencing. Finally, we will participate in all Network activities to enhance the movement of genetics into clinical practice. PUBLIC HEALTH RELEVANCE: The discovery and clinical use of genetic variants associated with both rare Mendelian and more common complex diseases promises to dramatically change the practice of medicine. Our eMERGE III project will leverage a large Biobank and a rich electronic medical record to define the phenotypic impact of mutations emerging from sequencing and then return results on selected variants to Biobank participants using a clinical trial.",EMERGE PHASE III CLINICAL CENTER AT PARTNERS HEALTHCARE,9284512,U01HG008685,"['Algorithms', 'Alleles', 'Area', 'Asthma', 'Attention deficit hyperactivity disorder', 'Bioinformatics', 'Biology', 'Bipolar Disorder', 'CTLA4 gene', 'Callback', 'Cardiovascular Diseases', 'Cardiovascular system', 'Clinical', 'Clinical Data', 'Clinical Trials', 'Complex', 'Computerized Medical Record', 'Congestive Heart Failure', 'Consent', 'Coronary Arteriosclerosis', 'Coronary heart disease', 'Cost Effectiveness Analysis', 'Custom', 'DRD2 gene', 'Data', 'Disease', 'Enrollment', 'Family member', 'Funding', 'Genes', 'Genetic', 'Genomic medicine', 'Genotype', 'Goals', 'HLA-DRB1', 'Health Personnel', 'Healthcare', 'Immune', 'Individual', 'Inflammatory Bowel Diseases', 'Informatics', 'Intervention', 'LDL Cholesterol Lipoproteins', 'LDLR gene', 'Laboratories', 'Learning', 'Low-Density Lipoproteins', 'Machine Learning', 'Mediating', 'Medical', 'Medicine', 'Mental Depression', 'Mining', 'Movement', 'Multiple Sclerosis', 'Mutation', 'New England', 'Newborn Infant', 'Outcome', 'Participant', 'Pathogenicity', 'Patients', 'Penetrance', 'Pharmaceutical Preparations', 'Pharmacogenetics', 'Phase', 'Phenotype', 'Physicians', 'Population', 'Population Attributable Risks', 'Protocols documentation', 'Public Health', 'Research', 'Rheumatoid Arthritis', 'Schizophrenia', 'Source', 'Stream', 'Stroke', 'Surveys', 'TCF7L2 gene', 'TNFRSF1A gene', 'TYK2', 'Testing', 'Variant', 'Visit', 'arm', 'base', 'biobank', 'biomarker panel', 'clinical care', 'clinical practice', 'clinical sequencing', 'clinically actionable', 'cost', 'cost effective', 'design', 'exome', 'experience', 'genetic analysis', 'genetic information', 'genetic variant', 'hypercholesterolemia', 'implementation research', 'loss of function', 'neuropsychiatric disorder', 'neuropsychiatry', 'novel', 'pilot trial', 'pleiotropism', 'premature', 'public health relevance', 'randomized trial', 'rare variant', 'support tools']",NHGRI,BRIGHAM AND WOMEN'S HOSPITAL,U01,2017,916160,0.10146060800620932
"Informatics Tools for Pharmacogenomic Discovery using Practice-based Data DESCRIPTION (provided by applicant): Rapid growth in the clinical implementation of large electronic medical records (EMRs) has led to an unprecedented expansion in the availability of dense longitudinal datasets for observational research. More recently, huge efforts have linked EMR databases with archived biological material, to accelerate research in personalized medicine. EMR- linked DNA biobanks have identified common and rare genetic variants that contribute to risk of disease. An appealing vision, which has not been extensively explored, is to use EMRs-linked biobanks for pharmacogenomic studies, which identify associations between genetic variation and drug efficacy and toxicity. The longitudinal nature of the data contained within EMRs make them ideal for quantifying drug outcome (both efficacy and toxicity). Efforts are already underway to link these EMRs across institutions, and standardize the definition of phenotypes for large-scale studies of treatment outcome, specifically within the context of routine clinical care. Despite its success, EMR-based pharmacogenomic studies are often hampered by its data-intensive nature -- it is time- consuming and costly to extract and integrate data from multiple heterogeneous EMR databases, for large-scale pharmacogenomic studies. The Informatics for Integrating Biology and the Bedside (i2b2) is a National Center for Biomedical Computing based at Partners Healthcare System. I2b2 has developed a scalable informatics framework to enable clinical researchers to repurpose existing EMR data for clinical and genomic discovery. In this study, we will collaborate with i2b2 to extend its informatics framework to the pharmacogenomics domain, by proposing the following specific aims: 1) Develop new methods to extract and model drug exposure and outcome information from EMR and integrate them with the i2b2 NLP components; 2) Build ontology tools to normalize and integrate pharmacogenomic data across different sites; 3) Conduct known and novel pharmacogenomic studies to evaluate and refine tools developed in Aim 1 and 2; and 4) Disseminate the developed informatics tools among pharmacogenomic researchers. PUBLIC HEALTH RELEVANCE: Longitudinal electronic medical records (EMRs) linked with DNA biobanks have become valuable resources for genomic and pharmacogenomics research, allowing identification of associations between genetic variations and drug efficacy and toxicity. The Informatics for Integrating Biology and the Bedside (i2b2), a National Center for Biomedical Computing based at Partners Healthcare System, has developed a scalable informatics framework to enable clinical researchers to use existing EMR data for genomic knowledge discovery of diseases. In this study, we will collaborate with i2b2 to extend its informatics framework to the pharmacogenomics domain, by developing new natural language processing, ontology components, and user-friendly interfaces, and then apply these tools to real-world pharmacogenomic studies.",Informatics Tools for Pharmacogenomic Discovery using Practice-based Data,9307936,R01GM103859,"['Adverse drug event', 'Adverse event', 'Algorithms', 'Anthracyclines', 'Archives', 'Award', 'Biocompatible Materials', 'Biology', 'Biomedical Computing', 'Biomedical Research', 'Boston', 'Cardiotoxicity', 'Cells', 'Clinic', 'Clinical', 'Clinical Data', 'Clostridium difficile', 'Colitis', 'Communities', 'Computer software', 'Computerized Medical Record', 'Coupled', 'DNA', 'Data', 'Databases', 'Disease', 'Drug Exposure', 'Drug Modelings', 'Drug toxicity', 'Event', 'Foundations', 'Funding', 'Genetic Variation', 'Genomics', 'Genotype', 'Grant', 'Healthcare Systems', 'Heparin', 'Informatics', 'Information Management', 'Institution', 'Knowledge Discovery', 'Link', 'Methods', 'Modeling', 'Morphologic artifacts', 'Natural Language Processing', 'Nature', 'Observational Study', 'Ontology', 'Outcome', 'Patients', 'Pediatric Hospitals', 'Pharmaceutical Preparations', 'Pharmacogenomics', 'Phenotype', 'Population Heterogeneity', 'Research', 'Research Personnel', 'Resources', 'Sampling', 'Science', 'Site', 'Standardization', 'Structure', 'System', 'Terminology', 'Text', 'Thrombocytopenia', 'Time', 'TimeLine', 'Toxic effect', 'Treatment outcome', 'United States National Institutes of Health', 'Vancomycin', 'Vision', 'Warfarin', 'base', 'biobank', 'case control', 'clinical care', 'clopidogrel', 'cost', 'data integration', 'disorder risk', 'drug efficacy', 'exome sequencing', 'genetic variant', 'genomic data', 'improved', 'longitudinal dataset', 'novel', 'open source', 'personalized medicine', 'phenotypic data', 'public health relevance', 'rapid growth', 'rare variant', 'response', 'study population', 'success', 'tool', 'user-friendly', 'virtual']",NIGMS,VANDERBILT UNIVERSITY MEDICAL CENTER,R01,2017,600474,0.1492080299705914
