text,title,id,project_number,terms,administration,organization,mechanism,year,funding,score
"Automating Directly Observed Therapy as a Platform Technology     DESCRIPTION (provided by applicant): Introduction: Ai Cure Technologies LLC was established in 2009 to develop automated medication adherence monitoring solutions using computer vision technology. This SBIR Phase II will allow Ai Cure Technologies to test the accuracy and validity of its flagship product, AiView"". The SBIR Phase I demonstrated that the AiView"" platform was technically feasible and capable of confirming medication administration. Significance: Poor medication adherence is a huge burden on clinical research and clinical practice. The inability to accurately measure or improve adherence significantly compounds the problem. Clinical trials depend on people taking the drug being tested. The problem of medication adherence has been addressed - determinants of adherence are being studied and new monitoring methods developed - but no solution has been able to accurately confirm real-time medication adherence while also being affordable, flexible, and likable. The Product: Ai Cure Technologies will provide an automated DOT (Directly Observed Therapy) software platform, AiView"", for use in clinical trials which uses sophisticated computer vision technology on webcam- enabled smart phones or tablets to visually confirm medication administration. AiView"" will visually track and confirm medication administration without human supervision. Long-Term Goal: The AiView"" system will combine sophisticated computer vision technology with the best attributes of DOT for 1/400th of the cost. Automating and standardizing the way medication adherence is captured will help clinical trials better define their subjects' rates of compliance and allow them to intervene immediately in case of non-compliance. Phase II hypothesis: AiView"" can be used to accurately measure and improve medication adherence across different patient populations, and positively impact self-perception and clinical outcomes. Specific Aim #1: To demonstrate that the AiView"" system can accurately measure and improve medication adherence in a depression and a stroke patient population. Specific Aim #2: To demonstrate that the AiView"" system can improve self-perception and improve clinical outcomes in the AiView"" intervention groups Expected Outcome: The patients in the AiView"" intervention groups (depression and stroke) are expected to have statistically significant higher adherence rates than those in the pill counting groups.         PUBLIC HEALTH RELEVANCE: Poor medication adherence is a huge burden on clinical research and clinical practice with the inability to accurately measure or improve adherence significantly compounding the problem. In accordance with this SBIR Phase II grant, Ai Cure Technologies will continue development and testing of its Automated DOTSM (Directly Observed Therapy) software platform, AiView"", for use in clinical trials which uses sophisticated computer vision technology on webcam-enabled smart phones or tablets to visually confirm medication administration. Automating and standardizing the way medication adherence is captured will help clinical trials better define their subjects' rates of compliance and allow tria administrators to intervene immediately in case of non-compliance, thus improving the accuracy of clinical trials the overall safety of the drug development process.            ",Automating Directly Observed Therapy as a Platform Technology,8524716,R44TR000873,"['Address', 'Adherence', 'Administrator', 'Clinical', 'Clinical Research', 'Clinical Trials', 'Communication', 'Computer Vision Systems', 'Computer software', 'Control Groups', 'Controlled Environment', 'Data', 'Data Quality', 'Development', 'Directly Observed Therapy', 'Disease Management', 'Drug Prescriptions', 'Electronics', 'Ensure', 'Event', 'Goals', 'Grant', 'Health', 'Health Insurance Portability and Accountability Act', 'Human', 'Intervention', 'Libraries', 'Marketing', 'Measures', 'Mental Depression', 'Methods', 'Monitor', 'Oral cavity', 'Outcome', 'Participant', 'Patients', 'Pharmaceutical Preparations', 'Phase', 'Phase III Clinical Trials', 'Phase IV Clinical Trials', 'Population', 'Process', 'Recording of previous events', 'Regimen', 'Research', 'Research Personnel', 'Risk', 'Running', 'Safety', 'Secure', 'Self Perception', 'Small Business Innovation Research Grant', 'Solutions', 'Speed', 'Stroke', 'Supervision', 'System', 'Tablets', 'Technology', 'Telephone', 'Testing', 'Time', 'Travel', 'base', 'clinical application', 'clinical practice', 'commercial application', 'compliance behavior', 'cost', 'design', 'drug development', 'flexibility', 'group intervention', 'improved', 'medication compliance', 'meetings', 'non-compliance', 'patient population', 'pill', 'public health relevance', 'tool', 'usability']",NCATS,"AI CURE TECHNOLOGIES, LLC",R44,2013,895818,0.017288640918610165
"Providing Access to Appliance Displays for Visually Impaired Users  Providing Access to Appliance Displays for Visually Impaired Users Summary The goal of this project is to develop a computer vision system that runs on smartphones and tablets to enable blind and visually impaired persons to read appliance displays. This ability is increasingly necessary to use a variety of household and commercial appliances equipped with displays, such as microwave ovens and thermostats, and is essential for independent living, education and employment. No access to this information is currently afforded by conventional text reading systems such as optical character recognition (OCR), which is intended for reading printed documents. Our proposed system runs as software on a standard, off-the-shelf smartphone or tablet and uses computer vision algorithms to analyze video images taken by the user and to detect and read the text within each image. For blind users, this text is either read aloud using synthesized speech, or for low vision users, presented in magnified, contrast- enhanced form (which is most suited to the use of a tablet).  We propose to build on our past work on a prototype display reader using powerful new techniques that will enable the resulting system to read a greater variety of LED/LCD display text fonts, and to better accommodate the conditions that often make reading displays difficult, including glare, reflections and poor contrast. These techniques include novel character recognition techniques adapted specifically to the domain of digital displays; finger detection to allow the user to point to a specific location of interest in the display; the use of display templates as reference images to match to, and thereby help interpret, noisy images of displays; and the integration of multiple views of the display into a single clear view. Special user interface features such as the use of finger detection to help blind users aim the camera towards the display and contrast-enhancement for low vision users address the particular needs of different users. Blind and visually impaired subjects will test the system periodically to provide feedback and performance data, driving the development and continual improvement of the system, which will be assessed with objective performance measures. The resulting display reader system will be released as an app for smartphones and tablets that can be downloaded and used by anybody for free, and also as an open source project that can be freely built on or modified for use in 3rd-party software. PUBLIC HEALTH RELEVANCE:  For blind and visually impaired persons, one of the most serious barriers to employment, economic self-sufficiency and independence is insufficient access to the ever-increasing variety of devices and appliances in the home, workplace, school or university that incorporate visual LED/LCD displays.  The proposed research would result in a smartphone/tablet-based assistive technology system (available for free) to provide increased access to such display information for the approximately 10 million Americans with significant vision impairments or blindness.                ",Providing Access to Appliance Displays for Visually Impaired Users,8579051,R01EY018890,"['Access to Information', 'Address', 'Adoption', 'Algorithms', 'American', 'Automobile Driving', 'Blindness', 'Computer Vision Systems', 'Computer software', 'Cosmetics', 'Custom', 'Data', 'Detection', 'Development', 'Devices', 'Economics', 'Education', 'Employment', 'Evaluation', 'Feedback', 'Fingers', 'Glare', 'Goals', 'Hand', 'Home environment', 'Household', 'Image', 'Image Analysis', 'Image Enhancement', 'Imaging problem', 'Impairment', 'Independent Living', 'Location', 'Mainstreaming', 'Measures', 'Movement', 'Performance', 'Prevalence', 'Printing', 'Procedures', 'Reader', 'Reading', 'Research', 'Research Infrastructure', 'Running', 'Schools', 'Self-Help Devices', 'Speech', 'System', 'Tablets', 'Techniques', 'Testing', 'Text', 'Training', 'Universities', 'Vision', 'Visual', 'Visual impairment', 'Visually Impaired Persons', 'Work', 'Workplace', 'base', 'blind', 'consumer product', 'design', 'digital', 'improved', 'information display', 'interest', 'microwave electromagnetic radiation', 'novel', 'open source', 'optical character recognition', 'prototype', 'public health relevance']",NEI,SMITH-KETTLEWELL EYE RESEARCH INSTITUTE,R01,2013,376082,0.07020479663253296
"A Cell Phone-Based Street Intersection Analyzer for Visually Impaired Pedestrians    DESCRIPTION (provided by applicant): A Cell Phone-Based Street Intersection Analyzer for Visually Impaired Pedestrians Abstract Project Summary Urban intersections are among the most dangerous parts of a blind person's travel. They are becoming increasingly complex, making safe crossing using conventional blind orientation and mobility techniques ever more difficult. To alleviate this problem, we propose to develop and evaluate a cell phone-based system to analyze images of street intersections, taken by a blind or visually impaired person using a standard cell phone, to provide real-time feedback. Building on our past work on a prototype ""Crosswatch"" system that uses computer vision algorithms to find crosswalks and Walk lights, we will greatly enhance the functionality of the system with information about the intersection layout and the identity of its connecting streets, the presence of stop signs, one-way signs and other controls indicating right-of-way, and timing information integrated from Walk/Don't Walk lights, countdown timers and other traffic lights. The system will convey intersection information, and will actively guide the user to align himself/herself with crosswalks, using a combination of synthesized speech and audio tones. We will conduct human factors studies to optimize the system functionality and the configuration of the user interface, as well as develop interactive training applications to equip users with the skills to better use the system. These training applications, implemented as additional cell phone software to complement the intersection system, will train users to hold the camera horizontal and forward and to minimize veer when traversing a crosswalk. The intersection analysis and training software will be made freely available for download onto popular cell phones (such as iPhone, Android or Symbian models). The cell phone will not need any hardware modifications or add-ons to run this software. Ultimately a user will be able to download an entire suite of such algorithms for free onto the cell phone he or she is already likely to be carrying, without having to carry a separate piece of equipment for each function.       PUBLIC HEALTH RELEVANCE: The ability to walk safely and confidently along sidewalks and traverse crosswalks is taken for granted every day by the sighted, but approximately 10 million Americans with significant vision impairments and a million who are legally blind face severe difficulties in this task. The proposed research would result in a highly accessible system (with zero or minimal cost to users) to augment existing wayfinding techniques, which could dramatically improve independent travel for blind and visually impaired persons.            ",A Cell Phone-Based Street Intersection Analyzer for Visually Impaired Pedestrians,8435501,R01EY018345,"['Address', 'Adoption', 'Algorithms', 'American', 'Cellular Phone', 'Complement', 'Complement component C4', 'Complex', 'Computer Vision Systems', 'Computer software', 'Cosmetics', 'Crowding', 'Custom', 'Data', 'Development', 'Devices', 'Equipment', 'Face', 'Feedback', 'Glosso-Sterandryl', 'Grant', 'Human', 'Image', 'Image Analysis', 'Impairment', 'Length', 'Light', 'Location', 'Mainstreaming', 'Modeling', 'Modification', 'Names', 'Process', 'Reading', 'Relative (related person)', 'Research', 'Research Infrastructure', 'Running', 'Safety', 'Self-Help Devices', 'Signal Transduction', 'Speech', 'Speed', 'System', 'Techniques', 'Technology', 'Telephone', 'Testing', 'Time', 'Training', 'Travel', 'Vision', 'Visual impairment', 'Visually Impaired Persons', 'Walking', 'Work', 'abstracting', 'base', 'blind', 'consumer product', 'cost', 'design', 'improved', 'interest', 'legally blind', 'meter', 'prototype', 'public health relevance', 'sensor', 'skills', 'trafficking', 'volunteer', 'way finding']",NEI,SMITH-KETTLEWELL EYE RESEARCH INSTITUTE,R01,2013,383018,-0.0171485019444694
"Context Understanding Technology to improve internet accessibility for users with     DESCRIPTION (provided by applicant): The purpose of this SBIR project is to develop a new tool to improve the ability of blind and visually impaired people to quickly get to the right web pages, to avoid ending up on the wrong web pages, and to reach the desired part of each web page efficiently. The motivation for this effort is that getting a 'big picture' understanding of a web page is one of the biggest challenges facing this population of computer users. Existing tools for blind and visually impaired people, such as screen readers and screen magnifiers, present the entire web page serially, in full detail, either by textual output of the details, or b providing a magnified view of a small part of the page. However, if the user is not already familiar with the website, the resulting lack of context requires a laborious and time-consuming process to scan through sometimes hundreds of details before knowing whether anything of interest even exists on the page in question. In contrast, the proposed technology analyzes web pages in a similar way that sighted users quickly scan pages before reading in detail, to provide a succinct, informative guidance on the context and layout of the page, so that a user quickly gains a much richer ""big-picture"" understanding. The proposed Phase II project builds on a successful Phase I user evaluation of a proof- of-concept of the software, in which users expressed a strong preference for the contextual cues provided by the approach. Phase II includes creating a fully-functional prototype of the software tool. Throughout the technology development, feedback from users and practitioners will guide the path of the R&D for maximum usability. At the conclusion of Phase II, an end-user, in-home evaluation study will verify the effectiveness of the tool, providing the starting point for full-scale commercialization.         PUBLIC HEALTH RELEVANCE: The R&D in this Phase II SBIR project will result in an improved way to use the Internet for individuals with visual disabilities. The technology will help to overcome the lack of accessibility and high level of frustration currently found among blind and visually impaired users. The results of the project will enable such individuals to explore new opportunities and be more productive, thus providing improved employment potential and an increase in the quality of life.                ",Context Understanding Technology to improve internet accessibility for users with,8459121,R44EY020082,"['Advertisements', 'Area', 'Arizona', 'Artificial Intelligence', 'Boxing', 'Characteristics', 'Color', 'Computer software', 'Computers', 'Cues', 'Effectiveness', 'Employment', 'Evaluation', 'Evaluation Studies', 'Feedback', 'Frustration', 'Generations', 'Government', 'Grouping', 'Home environment', 'Individual', 'Interest Group', 'Internet', 'Literature', 'Marketing', 'Motivation', 'Mus', 'Output', 'Persons', 'Phase', 'Population', 'Process', 'Quality of life', 'Reader', 'Reading', 'Research', 'Scanning', 'Small Business Innovation Research Grant', 'Software Tools', 'Speech', 'System', 'Technology', 'Text', 'Time', 'Training', 'Vision', 'Visual', 'Visual impairment', 'Visually Impaired Persons', 'base', 'blind', 'commercialization', 'disability', 'experience', 'improved', 'interest', 'natural language', 'phrases', 'preference', 'prototype', 'public health relevance', 'research and development', 'technology development', 'tool', 'usability', 'web page', 'web site']",NEI,"VORTANT TECHNOLOGIES, LLC",R44,2013,371933,0.051732546712071434
"Advanced training platform and methodologies for emergency responders and skilled     DESCRIPTION (provided by applicant): There is a need to be able to deliver just-in-time training and reference materials for first responders and skilled support personnel. Mobile computing platforms are becoming ubiquitous and provide an ideal means to reach users at any time in any location. The process of translating existing reference materials into mobile-friendly formats is currently manual and very labor intensive. Nicolalde R&D LLC is well under way to commercialize its mTraining mobile technology and service prototyped during a phase I SBIR from NIEHS. The mTraining technology is an objective and checklist-based method for delivering just-in-time training and reference materials, making it an effective Electronic Performance Support System (EPSS) for providing workers easy access to information after training, and on site prior to or during an assignment. It provides short, incident specific awareness and safety training that can be delivered prior to responding to an emergency situation. The proposed development under this phase II SBIR includes: a) a back-end document processing engine that is able to automatically parse, analyze, mark-up, and organize documents so that their content is easily cross-referenced, linked and re-organized for effective delivery on a mobile training platform or other electronic medium. This will be connected to a server and database architecture to facilitate its operation and support storing and accessing content; b) the front-end interface for the mobile training platform (mTraining) was prototyped in Phase I of this project for delivering training content to emergency responders, skilled support personnel, and volunteers before or during an incident. The improved back-end architecture will support intelligent search capabilities for a large repository of training documents with different structures. This capability relies on the document processing engine's ability to semi-automatically extract relevant data and automatically translate this data into a structured format. This data can then be used for display in the mobile application, stored into databases, and automatically populated into ontologies. Throughout this project the participatory-based design paradigm has been used for facilitating the integration of user requirements and the fast prototyping and testing of design alternatives. This approach will continue to be utilized in Phase 2 of the project.         PUBLIC HEALTH RELEVANCE: The proposed research and development will advance the field of environmental health and safety training by bringing to it new and innovative advanced training technologies that are based on the mobile and just-in-time paradigm. Furthermore, the research and development proposed herein will advance the mobile information technology field by developing robust and scalable tools for processing and linking information residing in different source documents that are semantically related.            ",Advanced training platform and methodologies for emergency responders and skilled,8518023,R44ES020135,"['Access to Information', 'Architecture', 'Awareness', 'Back', 'Case Study', 'Data', 'Databases', 'Development', 'Educational Curriculum', 'Educational Materials', 'Electronics', 'Emergency Situation', 'Environmental Health', 'Focus Groups', 'Human Resources', 'Information Technology', 'Link', 'Location', 'Manuals', 'Medical', 'Medical Students', 'Methodology', 'Methods', 'National Institute of Environmental Health Sciences', 'Natural Language Processing', 'Ontology', 'Performance', 'Phase', 'Process', 'Provider', 'Research Infrastructure', 'Retrieval', 'Safety', 'Semantics', 'Services', 'Simulate', 'Site', 'Small Business Innovation Research Grant', 'Source', 'Specific qualifier value', 'Structure', 'Support System', 'Technology', 'Testing', 'Time', 'Time Management', 'Training', 'Training and Education', 'Translating', 'Update', 'base', 'computer based Semantic Analysis', 'design', 'emergency service responder', 'improved', 'innovation', 'interest', 'operation', 'public health relevance', 'repository', 'research and development', 'response', 'tool', 'usability', 'volunteer']",NIEHS,"NICOLALDE R AND D, LLC",R44,2013,142612,-0.00069039978856782
"Mobile Search for the Visually Impaired    DESCRIPTION (provided by applicant):    The technology developed as part of this NIH SBIR project will transform the cell phone camera of visually impaired individuals into a powerful tool capable of identifying the objects they encounter, track the items they own, or navigate complex new environments. Broad access to low-cost visual intelligence technologies developed in this project will improve the independence and capabilities of the visually impaired. There has been tremendous technological progress in computer vision and in the computational power and network bandwidth of and Smartphone platforms. The synergy of these advances stands to revolutionize the way people find information and interact with the physical world. However, these technologies are not yet fully in the hands of the visually impaired, arguably the population that could benefit the most from these developments. Part of the barrier to progress in this area has been that computer vision can accurately handle only a small fraction of the typical images coming from a cell phone camera. To cope with these limitations and make any-image recognition possible, IQ Engines will develop a hybrid system that uses both computer vision and crowdsourcing: if the computer algorithms are not able to understand an image, then the image is sent to a unique crowdsourcing network of people for image analysis. The proposed research includes specific aims to both develop advanced computer vision algorithms for object recognition and advanced crowdsourced networks optimized to the needs of the visually impaired community. This approach combines the speed and accuracy of computer vision with the robustness and understanding of human vision, ultimately providing the user fast and accurate information about the content of any image.      PUBLIC HEALTH RELEVANCE:    The image recognition technology developed in this application will enable the visually impaired to access visual information using a mobile phone camera, a device most people already have. Transforming the camera into an intelligent visual sensor will lower the cost of assistance and improve the quality of life of the visually impaired community through increased independence and capabilities.                 The image recognition technology developed in this application will enable the visually impaired to access visual information using a mobile phone camera, a device most people already have. Transforming the camera into an intelligent visual sensor will lower the cost of assistance and improve the quality of life of the visually impaired community through increased independence and capabilities.            ",Mobile Search for the Visually Impaired,8198847,R44EY019790,"['Address', 'Algorithms', 'Area', 'Car Phone', 'Cellular Phone', 'Classification', 'Client', 'Clip', 'Communities', 'Complex', 'Computational algorithm', 'Computer Vision Systems', 'Crowding', 'Data', 'Databases', 'Detection', 'Development', 'Devices', 'Ensure', 'Environment', 'Family', 'Feedback', 'Friends', 'Glosso-Sterandryl', 'Human', 'Hybrid Computers', 'Hybrids', 'Image', 'Image Analysis', 'Individual', 'Intelligence', 'Label', 'Learning', 'Location', 'Modeling', 'Monitor', 'Phase', 'Population', 'Preparation', 'Process', 'Quality of life', 'Research', 'Running', 'Scanning', 'Services', 'Small Business Innovation Research Grant', 'Social Network', 'Source', 'Speed', 'System', 'Technology', 'Telephone', 'Time', 'United States National Institutes of Health', 'Vision', 'Visual', 'Visual impairment', 'base', 'blind', 'cell transformation', 'coping', 'cost', 'improved', 'innovation', 'novel', 'object recognition', 'open source', 'sensor', 'tool', 'visual information', 'visual search', 'volunteer']",NEI,"IQ ENGINES, INC.",R44,2012,499358,0.01742781186728963
