text,title,id,project_number,terms,administration,organization,mechanism,year,funding,score
"Natural language processing for clinical and translational research     DESCRIPTION (provided by applicant): Rapid growth in the clinical implementation of large electronic medical records (EMRs) has led to an unprecedented expansion in the availability of dense longitudinal datasets for clinical and translational research. This growth is being fueled by recent federal legislation that provides generous financial incentives to institutions demonstrating aggressive application and ""meaningful use"" of comprehensive EMRs. Efforts are already underway to link these EMRs across institutions, and standardize the definition of phenotypes for large scale studies of disease onset and treatment outcome, specifically within the context of routine clinical care. However, a well-known challenge for secondary use of EMR data for clinical and translational research is that much of detailed patient information is embedded in narrative text. Natural Language Processing (NLP) technologies, which are able to convert unstructured clinical text into coded data, have been introduced into the biomedical domain and have demonstrated promising results. Researchers have used NLP systems to identify clinical syndromes and common biomedical concepts from radiology reports, discharge summaries, problem lists, nursing documentation, and medical education documents. Different NLP systems have been developed at different institutions and utilized to convert clinical narrative text into structured data that may be used for other clinical applications and studies. Successful stories in applying NLP to clinical and translational research have been reported widely. However, institutions often deploy different NLP systems, which produce various types of output formats and make it difficult to exchange information between sites. Therefore, the lack of interoperability among different clinical NLP systems becomes a bottleneck for efficient multi-site studies. In addition, many successful studies often require a strong interdisciplinary team where informaticians and clinicians have to work very closely to iteratively define optimal algorithms for clinical phenotypes. As intensive informatics support may not be available to every clinical researcher, the usability of NLP systems for end users is another important issue. The proposed project builds upon first-hand knowledge and experience across the research team in the use of NLP for clinical and translational research projects. There are several big informatics initiatives for clinical and translational research but those initiatives generally assume one shoe fits all and follow top-down approaches to develop NLP solutions. Complementary to those initiatives, we will use a bottom-up approach to handle interoperability and usability: i) we will obtain a common NLP data model and exchange format through empirical analysis of existing NLP systems and NLP results; ii) we will develop a user-centric NLP front end interface for NLP systems wrapped to be consistent with the proposed NLP data model and exchange format incorporating usability analysis into the agile development process. All deliverables will be distributed through the open health NLP (OHNLP) consortium which we intend to make it more open and inclusive.         PUBLIC HEALTH RELEVANCE: Rapid growth in the clinical implementation of large electronic medical records (EMRs) has led to an unprecedented expansion in the availability of dense longitudinal datasets for clinical and translational research. We propose the development of a novel framework to enable the use of clinical information embedded in clinical narratives for clinical and translational research.                ",Natural language processing for clinical and translational research,8640959,R01GM102282,"['Acceleration', 'Adopted', 'Adoption', 'Adverse drug effect', 'Algorithms', 'Architecture', 'Attention', 'Clinical', 'Clinical Investigator', 'Clinical Research', 'Code', 'Communities', 'Computerized Medical Record', 'DNA Databases', 'Data', 'Data Set', 'Development', 'Dictionary', 'Discipline of Nursing', 'Disease Association', 'Documentation', 'Elements', 'Exclusion Criteria', 'Genes', 'Genomics', 'Goals', 'Growth', 'Health', 'Informatics', 'Institution', 'Knowledge', 'Link', 'Logical Observation Identifiers Names and Codes', 'Manuals', 'Medical Education', 'Modeling', 'Natural Language Processing', 'Onset of illness', 'Output', 'Patients', 'Pharmacogenomics', 'Phenotype', 'Play', 'Process', 'Radiology Specialty', 'Reporting', 'Research', 'Research Personnel', 'Research Project Grants', 'Resources', 'Role', 'SNOMED Clinical Terms', 'Semantics', 'Shoes', 'Site', 'Solutions', 'Statutes and Laws', 'Structure', 'Syndrome', 'System', 'Technology', 'Text', 'Translational Research', 'Treatment outcome', 'Work', 'base', 'clinical application', 'clinical care', 'clinical phenotype', 'computer human interaction', 'data exchange', 'data modeling', 'experience', 'financial incentive', 'flexibility', 'human centered computing', 'interoperability', 'novel', 'open source', 'patient safety', 'public health relevance', 'rapid growth', 'success', 'tool', 'usability', 'user-friendly']",NIGMS,MAYO CLINIC ROCHESTER,R01,2014,580082,0.05665169678508291
"From GWAS to PheWAS: Scanning the EMR Phenome for Gene-disease Associations     DESCRIPTION (provided by applicant): Genomic medicine offers hope for improved diagnostic methods and for more effective, patient-specific therapies. Genome-wide associated studies (GWAS) elucidate genetic markers that improve clinical understanding of risks and mechanisms for many diseases and conditions and that may ultimately guide diagnosis and therapy on a patient-specific basis. This project will expand on existing work to identify gene-phenotype associations across the genome and phenome, deploying new phenome-wide associations study (PheWAS) methods to deeply investigate electronic medical record (EMR)-derived phenotypes across common and rare variants across the genome. The project is enabled by large DNA biobanks coupled to de-identified copies of EMR. This project has three specific aims. First, we will expand the PheWAS phenotype library to include both binary traits and continuous variables incorporating about 7000 phenotypes derived from natural language processing, laboratory data, and report data. The second aim is to perform a PheWAS for common and rare variants using extant genome-wide and exome variant data and the broader set of phenotypes derived in Aim 1. We will analyze associations using single variant and multi-variant aggregation methods. We will validate the efficacy of our methods in Aim 2 by comparing to known associations. The third aim is to develop a standards-based infrastructure to share PheWAS results and develop tools to enable others to perform PheWAS. The tools generated from this project will not only expand the capabilities of the current PheWAS methodology, but will also broadly enable clinical research and subsequent genetic studies.             Project Narrative Genomic medicine offers hope for improved diagnosis and for more effective, patient- specific therapies. This PheWAS proposal will develop new methods to identify detailed phenotypes and diseases from electronic medical records and then find novel genetic associations from existing genomic data.",From GWAS to PheWAS: Scanning the EMR Phenome for Gene-disease Associations,8816305,R01LM010685,"['Address', 'Adopted', 'Architecture', 'Atrial Fibrillation', 'Biology', 'Body mass index', 'Cardiac', 'Cataloging', 'Catalogs', 'Clinic', 'Clinical', 'Clinical Data', 'Clinical Research', 'Code', 'Complex', 'Computer software', 'Computerized Medical Record', 'Coupled', 'DNA', 'DNA Databases', 'Data', 'Data Reporting', 'Development', 'Diagnosis', 'Diagnostic', 'Diagnostic Procedure', 'Disease', 'Disease Association', 'Documentation', 'Drug Exposure', 'Exclusion', 'Funding', 'Genes', 'Genetic', 'Genetic Markers', 'Genetic Variation', 'Genome', 'Genomics', 'Genotype', 'Grant', 'Health system', 'Human', 'Human Genome', 'Individual', 'Informatics', 'Laboratories', 'Lead', 'Libraries', 'Link', 'Mainstreaming', 'Measures', 'Medicine', 'Methodology', 'Methods', 'National Human Genome Research Institute', 'Natural Language Processing', 'Nature', 'Obesity', 'Pathway interactions', 'Patients', 'Peer Review', 'Phase', 'Phenotype', 'Population', 'Process', 'Proxy', 'Rare Diseases', 'Reporting', 'Research', 'Research Infrastructure', 'Research Personnel', 'Risk', 'Scanning', 'Single Nucleotide Polymorphism', 'Site', 'Solutions', 'Surveys', 'Testing', 'Variant', 'Work', 'base', 'biobank', 'cohort', 'disease phenotype', 'disorder subtype', 'endophenotype', 'exome', 'genetic association', 'genetic variant', 'genome wide association study', 'genome-wide', 'improved', 'next generation', 'novel', 'phenome', 'pleiotropism', 'rare variant', 'software development', 'tool', 'trait']",NLM,VANDERBILT UNIVERSITY,R01,2014,481897,0.05364349316816409
"Genetic Discovery and  Application in a Clinical Setting Continuing a Partnership    DESCRIPTION (provided by applicant): The Seattle eMERGE project aims to bring personal genomics to practice settings by taking advantage of the extensive electronic medical record (EMR) and biorepository of Group Health Cooperative (GH), including a 33-year pharmacy database and longitudinal data on an aging population. Algorithms developed in eMERGE I will be used to combine genome-wide association studies with phenotypes mined from EMRs to discover new polymorphism-phenotype relationships. Target phenotypes are infectious disease susceptibility, specifically to Clostridium difficile diarrhea, shingles from varicella zoster virus, and fungal nail infection, responses to antihypertensive drugs, serotonin-specific reuptake inhibitors, and statins, including adverse events. A new algorithm will follow longitudinal glycemia and hematocrit trajectories, and a novel automated method will detect karyotype abnormalities for assessing correlation to myelodysplasia and leukemia. Data will also support phenotypes investigated at other eMERGE sites. To create a model for introducing genomics into clinical practice, successful needs assessment methods from eMERGE I will engage stakeholders in guiding development of prototype EMR user interfaces in a clinical decision support format. The test case will be human leukocyte antigen-typing for an adverse drug reaction and the setting will be the patient-centered medical home care model developed at GH. This proposal provides the eMERGE network and its collaborators with the Seattle team's unique expertise in using natural language processing (NLP) to extract information from EMRs, and assisting in adoption of NLP methods. To disseminate eMERGE results and foster collaborations, it takes advantage of leadership positions of the investigators, including partners within eMERGE, other consortia and the HMO Research network, especially the potential for developments supported by the NIH Director's Common Fund in biobanking and megaepidemiology. Completion of the aims will reveal new, medically useful markers, improve the linking of high-throughput genomic methods to EMR data, and develop policies and practices for bringing individualized evidence-based medicine to communities.       RELEVANCE (See instrucfions): To advance personalized medicine-treatment and preventive care based on individual traits; this project matches small differences in DNA to infectious disease susceptibility and response to statins, serotonin- specific reuptake inhibitors (SSRIs) and blood pressure medications. Methods to use these results in clinical care will be guided by focus groups of patients and caregivers in the patient-centered Group Health system.              n/a",Genetic Discovery and  Application in a Clinical Setting Continuing a Partnership,8721471,U01HG006375,"['Address', 'Adoption', 'Adverse event', 'Algorithms', 'Anemia', 'Antihypertensive Agents', 'Bioethics', 'Blood Pressure', 'Bone Marrow Diseases', 'Caregivers', 'Caring', 'Chromosome abnormality', 'Clinical', 'Clinical Research', 'Clostridium difficile', 'Collaborations', 'Communicable Diseases', 'Communities', 'Computerized Medical Record', 'Consent', 'DNA', 'Data', 'Development', 'Diabetes Mellitus', 'Diarrhea', 'Disease', 'Disease susceptibility', 'Dysmyelopoietic Syndromes', 'Ensure', 'Epidemiology', 'Evidence Based Medicine', 'Excision', 'Focus Groups', 'Fostering', 'Funding', 'Genetic', 'Genetic Polymorphism', 'Genomics', 'Goals', 'HLA Antigens', 'Health', 'Health system', 'Healthcare', 'Hematocrit procedure', 'Herpes zoster disease', 'Herpesvirus Type 3', 'Incidental Findings', 'Individual', 'Infection', 'Karyotype', 'Knowledge', 'Leadership', 'Libraries', 'Link', 'Low-Density Lipoproteins', 'Medical', 'Medical Records', 'Medical center', 'Medicine', 'Mental Depression', 'Methods', 'Mining', 'Modeling', 'Nail plate', 'Natural Language Processing', 'Needs Assessment', 'Other Genetics', 'Outcome', 'Oxidoreductase', 'Patient Care', 'Patients', 'Pharmaceutical Preparations', 'Pharmacy facility', 'Phenotype', 'Policies', 'Population', 'Positioning Attribute', 'Predisposition', 'Preventive', 'Primary Health Care', 'Principal Investigator', 'Qualifying', 'Reaction', 'Research', 'Research Personnel', 'Resources', 'Serotonin', 'Single Nucleotide Polymorphism', 'Site', 'Solutions', 'Systems Biology', 'Technology', 'Testing', 'Therapeutic', 'United States National Institutes of Health', 'Variant', 'aging population', 'base', 'biobank', 'clinical application', 'clinical care', 'clinical practice', 'clinical research site', 'clinically relevant', 'comparative effectiveness', 'design', 'effectiveness research', 'ethical legal social implication', 'evidence base', 'experience', 'genetic technology', 'genome wide association study', 'improved', 'inhibitor/antagonist', 'leukemia', 'leukocyte antigen typing', 'longitudinal database', 'member', 'novel', 'patient home care', 'patient oriented', 'patient population', 'prototype', 'response', 'reuptake', 'skills', 'standard care', 'trait']",NHGRI,KAISER FOUNDATION HEALTH PLAN OF WASHINGTON,U01,2014,191107,0.14352394205147154
"Informatics Tools for Pharmacogenomic Discovery using Practice-based Data     DESCRIPTION (provided by applicant): Rapid growth in the clinical implementation of large electronic medical records (EMRs) has led to an unprecedented expansion in the availability of dense longitudinal datasets for observational research. More recently, huge efforts have linked EMR databases with archived biological material, to accelerate research in personalized medicine. EMR- linked DNA biobanks have identified common and rare genetic variants that contribute to risk of disease. An appealing vision, which has not been extensively explored, is to use EMRs-linked biobanks for pharmacogenomic studies, which identify associations between genetic variation and drug efficacy and toxicity. The longitudinal nature of the data contained within EMRs make them ideal for quantifying drug outcome (both efficacy and toxicity). Efforts are already underway to link these EMRs across institutions, and standardize the definition of phenotypes for large-scale studies of treatment outcome, specifically within the context of routine clinical care. Despite its success, EMR-based pharmacogenomic studies are often hampered by its data-intensive nature -- it is time- consuming and costly to extract and integrate data from multiple heterogeneous EMR databases, for large-scale pharmacogenomic studies. The Informatics for Integrating Biology and the Bedside (i2b2) is a National Center for Biomedical Computing based at Partners Healthcare System. I2b2 has developed a scalable informatics framework to enable clinical researchers to repurpose existing EMR data for clinical and genomic discovery. In this study, we will collaborate with i2b2 to extend its informatics framework to the pharmacogenomics domain, by proposing the following specific aims: 1) Develop new methods to extract and model drug exposure and outcome information from EMR and integrate them with the i2b2 NLP components; 2) Build ontology tools to normalize and integrate pharmacogenomic data across different sites; 3) Conduct known and novel pharmacogenomic studies to evaluate and refine tools developed in Aim 1 and 2; and 4) Disseminate the developed informatics tools among pharmacogenomic researchers.         PUBLIC HEALTH RELEVANCE: Longitudinal electronic medical records (EMRs) linked with DNA biobanks have become valuable resources for genomic and pharmacogenomics research, allowing identification of associations between genetic variations and drug efficacy and toxicity. The Informatics for Integrating Biology and the Bedside (i2b2), a National Center for Biomedical Computing based at Partners Healthcare System, has developed a scalable informatics framework to enable clinical researchers to use existing EMR data for genomic knowledge discovery of diseases. In this study, we will collaborate with i2b2 to extend its informatics framework to the pharmacogenomics domain, by developing new natural language processing, ontology components, and user-friendly interfaces, and then apply these tools to real-world pharmacogenomic studies.            ",Informatics Tools for Pharmacogenomic Discovery using Practice-based Data,8629996,R01GM103859,"['Adverse event', 'Algorithms', 'Anthracyclines', 'Archives', 'Award', 'Biocompatible Materials', 'Biology', 'Biomedical Computing', 'Biomedical Research', 'Boston', 'Cardiotoxicity', 'Cells', 'Clinic', 'Clinical', 'Clinical Data', 'Clostridium difficile', 'Colitis', 'Communities', 'Computer software', 'Computerized Medical Record', 'Coupled', 'DNA', 'Data', 'Data Set', 'Databases', 'Disease', 'Drug Exposure', 'Drug toxicity', 'Electronics', 'Event', 'Foundations', 'Funding', 'Genetic Variation', 'Genomics', 'Genotype', 'Grant', 'Healthcare Systems', 'Heparin', 'Informatics', 'Information Management', 'Institution', 'Knowledge Discovery', 'Link', 'Medicine', 'Methods', 'Modeling', 'Morphologic artifacts', 'Natural Language Processing', 'Nature', 'Observational Study', 'Ontology', 'Outcome', 'Patients', 'Pediatric Hospitals', 'Pharmaceutical Preparations', 'Pharmacogenomics', 'Phenotype', 'Population Heterogeneity', 'Population Study', 'Research', 'Research Personnel', 'Resources', 'Sampling', 'Science', 'Site', 'Standardization', 'Structure', 'System', 'Terminology', 'Text', 'Thrombocytopenia', 'Time', 'TimeLine', 'Toxic effect', 'Treatment outcome', 'United States National Institutes of Health', 'Vancomycin', 'Vision', 'Warfarin', 'base', 'biobank', 'case control', 'clinical care', 'clopidogrel', 'data integration', 'disorder risk', 'drug efficacy', 'exome sequencing', 'genetic variant', 'improved', 'large-scale database', 'novel', 'open source', 'public health relevance', 'rapid growth', 'rare variant', 'response', 'success', 'surveillance study', 'tool', 'user-friendly', 'virtual']",NIGMS,VANDERBILT UNIVERSITY,R01,2014,648591,0.1492080299705914
"EMR Phenotype and Community Engaged Genomic Associations    DESCRIPTION (provided by applicant): The electronic medical record (EMR) can be leveraged for high throughput phenotyping of large numbers of patients for genomics research. As part of eMERGE-l, we used EMR-based algorithms to enable genome- wide association studies (GWAS) of several primary and network-wide phenotypes. The present application will leverage the research infrastructure established in eMERGE-l to identify common genetic variants that influence medically important phenotypes. The Mayo eMERGE-ll cohort (n=6916) includes the 3769 eMERGE-l patients and an additional 3147 individuals, the majority (90%) genotyped on the same lllumina 660W platform. We will work with other eMERGE-ll sites to expand and validate the library of electronic phenotyping algorithms to enable GWAS of multiple phenotypes of interest. A major focus of our application is to translate recent GWAS findings to clinical practice. Our specific aims are: Specific aim 1. Conduct EMR-based GWAS to identify common genetic variants that influence a) inter-individual variation in cardiorespiratory fitness and response to statin medications and b) susceptibility to venous thromboembolism and colon polyps. Specific aim 2. Quantify genetic risk of a common 'complex' disease - coronary heart disease (CHD) - and an adverse drug response - statin myopathy. We will develop risk communication tools that convey the clinical and genetic components of risk to both patients and care providers. Specific aim 3. Develop informatics approaches to incorporate genomic data into the EMR, including links to clinical decision support. Specific aim 4. Conduct a randomized-clinical trial to investigate how patients respond to genetically informed CHD-risk. We will re-consent 150 eMERGE-l patients without CHD, communicate the results via a genetic counselor, and discuss in detail the implications of the testing relevant to disease risk. The effectiveness of the communication and the patients' comprehension of risk, their hopes and concerns, and planned changes in lifestyle will be assessed by surveys and interviews after the patient-counselor encounter. As part of our ongoing efforts in community consultation, we will establish a community advisory group specific to this project.       RELEVANCE (See instructions): The proposed application will leverage the research infrastructure established in eMERGE-l to identify common genetic variants that influence medically important phenotypes. We will develop tools to incorporate genomic information in the EMR. In addition, we will investigate clinical, translational, and ethical aspects of genetic testing for complex diseases and assess the response of patients to genetic testing.              n/a",EMR Phenotype and Community Engaged Genomic Associations,8724540,U01HG006379,"['Address', 'Algorithms', 'Area', 'Atrial Fibrillation', 'Bioethics', 'Cardiology', 'Clinic', 'Clinical', 'Code', 'Collaborations', 'Colonic Polyps', 'Communication', 'Communication Tools', 'Communities', 'Complex', 'Comprehension', 'Computerized Medical Record', 'Consent', 'Coronary heart disease', 'Data', 'Diagnosis', 'Disease', 'Disease susceptibility', 'Dose', 'Drops', 'Drug usage', 'Early Diagnosis', 'Effectiveness', 'Electronic library', 'Empirical Research', 'Epidemiologist', 'Ethical Issues', 'Ethics', 'Future', 'Genetic', 'Genetic Predisposition to Disease', 'Genetic Risk', 'Genetic screening method', 'Genome', 'Genomics', 'Genotype', 'Individual', 'Informatics', 'Instruction', 'Interview', 'Knowledge', 'Laboratories', 'Libraries', 'Life Style', 'Link', 'Medicine', 'Methods', 'Myopathy', 'Natural Language Processing', 'Patient Care', 'Patients', 'Perception', 'Pharmaceutical Preparations', 'Pharmacotherapy', 'Phenotype', 'Predisposition', 'Preventive', 'Principal Investigator', 'Procedures', 'Professional counselor', 'Provider', 'Public Health', 'Publishing', 'Randomized Clinical Trials', 'Research', 'Research Infrastructure', 'Risk', 'Risk Factors', 'Scientist', 'Site', 'Staging', 'Surveys', 'Testing', 'Text', 'Thromboembolism', 'Translating', 'Variant', 'Venous', 'Work', 'adverse outcome', 'base', 'clinical practice', 'clinical risk', 'cohort', 'community consultation', 'cost', 'disorder risk', 'exome sequencing', 'experience', 'fitness', 'genetic risk assessment', 'genetic variant', 'genome wide association study', 'heart disease risk', 'interest', 'open source', 'point of care', 'repository', 'response', 'screening', 'tool']",NHGRI,MAYO CLINIC ROCHESTER,U01,2014,164026,0.05997355014806002
