text,title,id,project_number,terms,administration,organization,mechanism,year,funding,score
"Evidence-based Diagnostic Tools for Translational and Clinical Research (eTfor2)    DESCRIPTION (provided by applicant): The eTfor2 project will develop and evaluate open-source programs and knowledge representations to better characterize patients for translational and clinical research studies. The project addresses National Library of Medicine (NLM) RFA initiatives for: (a) information & knowledge processing, including natural language processing and text summarization, (b) approaches for linking phenomic and genomic information, and (c) integration of information from heterogeneous sources. Translational studies correlate clinical patient descriptors (phenome) with results of genomic investigations, e.g., genome-wide association studies (GWAS). Standard methods for defining phenotypes require costly, labor-intensive cohort enrollments to identify patients with diseases and appropriate controls. Recently, translational and clinical researchers have used electronic medical record (EMR) data as an alternative to identifying patient characteristics. However, EMR case extraction requires substantial manual review and ""tuning"" for case selection, due to the inaccuracies inherent in ICD9 billing codes. While relevant and useful natural language processing (NLP) approaches to facilitate EMR text extraction have proliferated, the target patient descriptors these approaches employ typically remain non-standard and locally defined, and vary from disease to disease, project to project and institution to institution. At best, such NLP applications use standard terminology descriptors such as SNOMED-CT as EMR extraction targets. Yet, there is no generally utilized ""standard"" knowledge base that links such ""extractable"" descriptors to an academic-quality knowledge source detailing what findings have been reliably reported to occur in each disease. To facilitate translational and clinical research, the eTfor2 project will make available an open-source, evidence-based, electronic clinical knowledge base (KB) and related NLP tools enabling researchers at any site to extract a standard ""target"" set of EMR-based phenomic descriptors at both the finding and disease levels. It will further include diagnostic decision support logic to confirm the degree of support for patients' diagnoses in their EMR records. The eTfor2 project will decrease effort required to harvest EMR patient descriptors for clinical and translational studies, and enable new translational work that identifies genomic associations at both finding and disease levels. The eTfor2 resources should improve the quality and cross-institutional validity of EMR-based translational and clinical studies.           Evidence-based Diagnostic Tools for Translational and Clinical Research (eTfor2) Project Narrative When completed successfully, the eTfor2 project will enable researchers at disparate institutions to extract from their respective EMR systems a shared ""target"" set of common phenomic descriptors, in a standard, reproducible manner. Doing so should improve the quality and cross-institutional validity of EMR-based translational and clinical studies.",Evidence-based Diagnostic Tools for Translational and Clinical Research (eTfor2),7950411,R01LM010828,"['18 year old', 'Abdomen', 'Abdominal Pain', 'Address', 'Adult', 'Algorithms', 'Automated Abstracting', 'Biopsy', 'Characteristics', 'Child', 'Clinical', 'Clinical Research', 'Code', 'Cohort Studies', 'Companions', 'Computer-Assisted Diagnosis', 'Computerized Medical Record', 'Core Facility', 'DNA', 'DNA Databases', 'Data', 'Data Analyses', 'Descriptor', 'Diagnosis', 'Diagnostic', 'Diagnostic Procedure', 'Disease', 'Electronics', 'Enrollment', 'Epigastrium', 'Evaluation Studies', 'Exhibits', 'Generic Drugs', 'Genes', 'Genomics', 'Goals', 'Gold', 'Harvest', 'Human', 'Image', 'Individual', 'Institution', 'Intellectual Property', 'Internal Medicine', 'Internist', 'Intra-abdominal', 'Investigation', 'Knowledge', 'Laboratories', 'Licensing', 'Link', 'Literature', 'Logic', 'Manuals', 'Maps', 'Methods', 'Metric', 'Names', 'Natural Language Processing', 'Negative Finding', 'Normal Range', 'Outcome', 'Pain', 'Patient Care', 'Patients', 'Persons', 'Pharmaceutical Preparations', 'Phenotype', 'Physical Examination', 'Process', 'Proliferating', 'Property Rights', 'Proteomics', 'Publishing', 'Recording of previous events', 'Records', 'Reporting', 'Research', 'Research Personnel', 'Resources', 'Review Literature', 'SNOMED Clinical Terms', 'Sampling', 'Side', 'Site', 'Source', 'Specific qualifier value', 'Splenomegaly', 'Supplementation', 'Symptoms', 'System', 'Terminology', 'Testing', 'Text', 'Time', 'Translational Research', 'United States National Library of Medicine', 'Universities', 'Visceromegaly', 'Vocabulary', 'Work', 'base', 'case control', 'clinical phenotype', 'cohort', 'evidence base', 'genome wide association study', 'improved', 'information organization', 'innovation', 'interest', 'knowledge base', 'meetings', 'member', 'open source', 'phenome', 'phenomics', 'programs', 'research study', 'success', 'theories', 'tool', 'translational study']",NLM,VANDERBILT UNIVERSITY,R01,2010,388125,0.15249352561383456
"An in-silico method for epidemiological studies using Electronic Medical Records DESCRIPTION: Observational epidemiological studies are effective methods for identifying factors affecting the health and illness of populations, as well as for determining optimal treatments for diseases, such as cancers. However, conventional epidemiological research usually involves personnel-intensive effort (such as manual chart and public records review) and can be very time consuming before conclusive results are obtained. Recently, a large amount of detailed longitudinal clinical data has been accumulated at hospitals' Electronic Medical Records (EMR) systems and it has become a valuable data source for epidemiological studies. However, there are two obstacles that prevent the wide usage of EMR data in epidemiological studies. First, most of the detailed clinical information in EMRs is embedded in narrative text and it is very costly to extract that information manually. Second, EMRs usually have data quality problems such as selection bias and missing data, which require adaptation of conventional statistical methods developed for randomized controlled trials.   In this study, we propose an in silico informatics-based approach for observational epidemiological studies using EMR data. We hypothesize that existing EMR data can be used for certain types of epidemiological studies in a very efficient manner with the help of informatics methods. The informatics-based approach will contain two major components. One is an NLP (Natural Language Processing) based information extraction system that can automatically extract detailed clinical information from EMR and another is a set of statistical and informatics methods that can be used to analyze EMR-derived data. If the feasibility of this approach is proven, it will change the standard paradigm of observational epidemiological research, because it has the capability to answer an epidemiological question in a very short time at a very low cost. The specific aim of this study is to develop an automated informatics approach to extract both fine-grained cancer findings and general clinical information from EMRs and use them to conduct cancer related epidemiological studies. We will perform both casecontrol and cohort studies related to prevention and treatment of breast and colon cancers using EMR data. The informatics approach will be validated on EMRs from two major hospitals to demonstrate its generalizability. Epidemiological findings from our study will be compared to reported findings for validation. Narrative: According to the American Cancer Society, about 7.6 million people died from various types of cancer in the world during 2007. It is very important to identify risk factors of  cancers and to determine optimal treatments of cancers, and epidemiological study is  one of the methods to achieve it. This proposed study will use natural language  processing technologies to automatically extract fine-grained cancer information from  existing patient electronic medical records and use it to conduct cancer related  epidemiological studies, thus accelerating knowledge accumulation of cancer research.",An in-silico method for epidemiological studies using Electronic Medical Records,7925776,R01CA141307,"['Affect', 'American Cancer Society', 'Breast', 'Cereals', 'Clinical', 'Clinical Data', 'Cohort Studies', 'Colon Carcinoma', 'Computer Simulation', 'Computerized Medical Record', 'Data', 'Data Quality', 'Data Sources', 'Disease', 'Epidemiologic Studies', 'Epidemiology', 'Health', 'Hospitals', 'Human Resources', 'Informatics', 'Knowledge', 'Malignant Neoplasms', 'Manuals', 'Methods', 'Natural Language Processing', 'Patients', 'Population', 'Prevention', 'Randomized Controlled Trials', 'Records', 'Reporting', 'Research', 'Risk Factors', 'Selection Bias', 'Statistical Methods', 'System', 'Technology', 'Text', 'Time', 'Validation', 'anticancer research', 'base', 'cancer therapy', 'cancer type', 'cost', 'prevent']",NCI,VANDERBILT UNIVERSITY,R01,2010,259993,0.11511547485847858
"Vanderbilt Genome-Electronic Records Project    DESCRIPTION (provided by applicant):  VGER: The Vanderbilt Genome-Electronic Record project An important potential enabling resource for Personalized Medicine is the combination of a DNA repository with Electronic Medical Record (EMR) systems sufficiently robust to provide excellence in clinical care and to serve as resources for analysis of disease susceptibility and therapeutic outcomes across patient populations. The Vanderbilt EMR is a state of the art clinical and research tool (that includes >1.4 million records), and is associated with a DNA repository which has been in development for over 3 years; these are the key components of VGER, the Vanderbilt Genome-Electronic Records project proposed here. The VGER model acquires DNA from discarded blood samples collected from routine patient care, and can link these to de-identified data extracted and readily updated from the EMR. The phenotype we will analyze here is the QRS duration on the electrocardiogram, since slow conduction (indicated by longer QRS duration) is a marker of arrhythmia susceptibility. This will not only exploit the power of Genome-Wide Association (GWA) approaches to generate new biologic knowledge that impacts an area of public health concern, but also provides a platform for the development of tools, such as Natural Language Processing approaches, to optimally mine EMRs. This project brings together a team of investigators with nationally recognized records of accomplishment in genome science, medical ethics, bioinformatics, de-identification science, and translational and cardiovascular medicine to address four Specific Aims: (1) perform a GWA comparing samples from subjects with QRS durations at the extremes of the normal range, and validate by genotyping high likelihood associations in prospectively ascertained clinical trial sets for QRS duration and for arrhythmia susceptibility; (2) evaluate the validity and utility of structured and unstructured components of EMR data for genome-phenome correlations; (3) assess the ethical, scientific, and societal advantages and disadvantages of the VGER model, and determine best practices for oversight, community involvement, and communication as the resource grows; and (4) develop and evaluate formal privacy protection models for data derived from databanks and EMRs, establishing data sharing and integration practices. We also include here a proposal to develop the Administrative Coordinating Center whose mission will be to facilitate communication and collaboration among nodes in this network, the NHGRI, and external advisors. We subscribe to a vision of Personalized Medicine in which genomic and other patient-specific information drives personalized, predictive, preemptive, and participatory health care, and VGER represents an important step in that direction.           n/a",Vanderbilt Genome-Electronic Records Project,7893787,U01HG004603,"['Address', 'Area', 'Arrhythmia', 'Arts', 'Bioinformatics', 'Blood specimen', 'Cardiac', 'Cardiovascular system', 'Clinical Research', 'Clinical Trials', 'Collaborations', 'Commit', 'Communication', 'Communities', 'Computerized Medical Record', 'DNA', 'Data', 'Databases', 'Development', 'Disadvantaged', 'Disease', 'Disease susceptibility', 'EKG QRS Complex', 'Electrocardiogram', 'Electronics', 'Ethics', 'Genome', 'Genomics', 'Genotype', 'Healthcare', 'Heart Diseases', 'Institution', 'Knowledge', 'Lead', 'Legal', 'Link', 'Measures', 'Medical Ethics', 'Medicine', 'Methods', 'Mining', 'Mission', 'Modeling', 'National Human Genome Research Institute', 'Natural Language Processing', 'Normal Range', 'Outcome', 'Patient Care', 'Patients', 'Phenotype', 'Predisposition', 'Privacy', 'Public Health', 'Records', 'Research', 'Research Ethics Committees', 'Research Personnel', 'Resources', 'Sampling', 'Science', 'Structure', 'System', 'Testing', 'Therapeutic', 'Translational Research', 'Update', 'Validation', 'Variant', 'Vision', 'clinical care', 'clinical practice', 'data modeling', 'data sharing', 'egg', 'endophenotype', 'genome wide association study', 'heart rhythm', 'indexing', 'patient population', 'phenome', 'repository', 'tool', 'tool development']",NHGRI,VANDERBILT UNIVERSITY,U01,2010,1512082,0.1444220349779425
"Development and Use of Network Infrastructure for High-Throughput GWA Studies    DESCRIPTION (provided by applicant):  Linking biorepositories of patients in healthcare delivery systems with electronic medical records (EMRs) is an efficient strategy for high-throughput genome wide association (GWA) studies, as phenotype, covariable and exposure data of public health importance can be economically abstracted and pooled across delivery systems to facilitate the large numbers of subjects needed for GWA studies of each phenotype. Key obstacles to the success of this strategy remain. In this project, which will use population-based genomic and phenotype data from a well characterized population served by a delivery system which captures virtually all health care encounters in its data bases. Researchers from Group Health Cooperative's Center for Health Studies, the University of Washington, and the Fred Hutchinson Cancer Research Center will address these obstacles by pursuing the following specific aims:       1. Informed by results from targeted focus groups, implement a consensus process with key stakeholders to develop recommendations concerning consent, data sharing, and return of research results to subjects.    2. Work together with other network sites to develop a virtual data warehouse (VDW) analogous to that used in the Cancer Research Network, and extend natural language processing (NLP) to pathology, radiology, and clinical chart notes.   3. Develop and test strategies to determine whether each candidate EMR-based phenotype is sufficiently valid to pursue analyses of GWA data, and develop statistical methods that explicitly account for heterogeneous phenotype validity within and between sites.    4. Perform a series of GWA analyses in the GHC biorepository and linked biorepositories. 4a: Alzheimer's disease (AD). 4b: Carotid artery atherosclerotic disease (CAAD). 4c: Complications of statin use, including elevations of CPK and muscle pain.       Through cooperation with other investigators and the NHGRI, this work will facilitate development of policies and procedures to realize the incredible potential of EMR-linked biorepositories for GWA studies to improve understanding, prevention and treatment of chronic diseases and illnesses. Specific GWA research will allow us to explore both etiologic research (AD and CAAD progression) and pharmacogenetics (statin therapy). The implications of this portfolio of research extend far beyond the specific phenotypes we have chosen to emphasize; we expect this work represents the beginning of a large and productive enterprise.              n/a",Development and Use of Network Infrastructure for High-Throughput GWA Studies,7902293,U01HG004610,"['Abbreviations', 'Accounting', 'Address', 'Adult', 'Adverse event', 'Age', 'Alzheimer&apos', 's Disease', 'Alzheimer&apos', 's Disease patient registry', 'Blood Pressure', 'Cancer Research Network', 'Carotid Arteries', 'Carotid Artery Diseases', 'Cholesterol', 'Chronic Disease', 'Clinic', 'Clinical', 'Clinical Data', 'Cognition', 'Collaborations', 'Communities', 'Complement', 'Computerized Medical Record', 'Consensus', 'Consent', 'Creatinine', 'Data', 'Data Collection', 'Data Set', 'Data Sources', 'Databases', 'Dementia', 'Development', 'Diagnosis', 'Disease', 'Disease Progression', 'Electronics', 'Enrollment', 'Environmental Exposure', 'Exposure to', 'Focus Groups', 'Foundations', 'Fred Hutchinson Cancer Research Center', 'Funding', 'Genomics', 'Genotype', 'Gold', 'Health', 'Healthcare', 'Healthcare Systems', 'High Density Lipoproteins', 'Individual', 'Inpatients', 'Knowledge', 'Laboratories', 'Leadership', 'Life', 'Link', 'Malignant Neoplasms', 'Maps', 'Medical', 'Meta-Analysis', 'Methods', 'Myalgia', 'National Cancer Institute', 'National Human Genome Research Institute', 'National Institute on Aging', 'Natural Language Processing', 'Neurofibrillary Tangles', 'Outcome', 'Outpatients', 'Participant', 'Pathology', 'Patients', 'Performance', 'Persons', 'Pharmaceutical Preparations', 'Pharmacogenetics', 'Pharmacy facility', 'Phenotype', 'Population', 'Prevention', 'Procedures', 'Process', 'Public Domains', 'Public Health', 'Quality of Care', 'Radiology Specialty', 'Recommendation', 'Recruitment Activity', 'Research', 'Research Ethics Committees', 'Research Infrastructure', 'Research Personnel', 'Resources', 'Risk Factors', 'Sampling', 'Senile Plaques', 'Series', 'Single Nucleotide Polymorphism', 'Site', 'Statistical Methods', 'System', 'Testing', 'Text', 'Time', 'Universities', 'Ursidae Family', 'Washington', 'Work', 'abstracting', 'base', 'biobank', 'case control', 'cohort', 'cost', 'data sharing', 'development policy', 'economic cost', 'gene environment interaction', 'genome wide association study', 'genome-wide', 'health care delivery', 'human disease', 'improved', 'interest', 'member', 'population based', 'prospective', 'success', 'trait', 'virtual']",NHGRI,KAISER FOUNDATION HEALTH PLAN OF WASHINGTON,U01,2010,889184,0.08411462100454584
"Investigating the generalizability of natural language processing of EMR data    DESCRIPTION (provided by applicant):       The electronic medical record (EMR) offers impressive opportunities for increasing care quality, but challenges stand in the way of realizing this vision. For example, coded EMR data readily available for analysis typically are incomplete (due to the prevalence of free-text clinical notes in EMR implementations), and data from different EMRs are often incommensurate due to differences in standard vocabularies and system implementations. While informatics research has shown the feasibility of automatically coding specific aspects of clinical text using Natural Language Processing (NLP), challenges remain for translating these informatics developments into large-scale care quality assessments. To date, successful NLP solutions for automated quality assessment have tended to be applications that are specific to (a) the target problem or clinical focus, (b) the EMR data system, and (c) the person or team that implements the NLP solution. In this study, we propose to begin addressing the problem of implementation team specificity by developing, evaluating, and making freely available a generalizable NLP development tool suite. The tools will enable widespread adoption of NLP systems to extract and code data from free text clinical notes. The Knowledge Editing Toolkit will simplify development of problem-specific knowledge by helping the user define the rules, concepts, and terms that constitute a domain-specific knowledge module, thus allowing any informaticist to develop an NLP application. The NLP Application Validation Toolkit will allow rapid testing and evaluation of the application against a gold standard of independently-coded test records from any EMR. To evaluate the effects of the toolkits on NLP generalizability, we will have three clinical informaticists each build two NLP applications (for a total of six distinct applications). One of their applications will identify a constellation of common clinical signs or symptoms (e.g., ""persistent cough"") that are relatively discrete concepts using simple language terms for many different clinical purposes. Their second application will assess behavioral counseling (e.g., ""alcohol counseling""), which uses complex language constructs for dedicated clinical purposes. We will describe and evaluate the accuracy of the solutions against independently coded test sets of medical records. We will quantify and compare the difficulty of creating these solutions as measured by the time, number of iterations required to build the applications, and the number of concepts and rules employed, as well as analyze variability in content and accuracy of the solutions created. In addition, we will use qualitative techniques to assess the ease of using the development tools; the difficulty in learning the tools; and specific types of problems, limitations, and bugs encountered. Such an NLP development tool suite has the potential to allow simple, elegant, and reliably good NLP solutions regardless of the clinical problem domain or the person developing the solution.           n/a",Investigating the generalizability of natural language processing of EMR data,7691692,R21LM009728,"['Address', 'Adopted', 'Adoption', 'Affect', 'Alcohols', 'Architecture', 'Behavioral', 'Caring', 'Classification', 'Clinical', 'Clinical Data', 'Code', 'Complex', 'Computer Systems Development', 'Computerized Medical Record', 'Coughing', 'Counseling', 'Data', 'Databases', 'Development', 'Event', 'Gold', 'Healthcare Systems', 'Human Resources', 'Informatics', 'Information Systems', 'Information Technology', 'Institute of Medicine (U.S.)', 'Knowledge', 'Language', 'Learning', 'Measures', 'Medical Records', 'Modification', 'Natural Language Processing', 'Performance', 'Persons', 'Positioning Attribute', 'Prevalence', 'Process', 'Proliferating', 'Quality of Care', 'Records', 'Research', 'Running', 'Solutions', 'Source', 'Specificity', 'Structure', 'Symptoms', 'System', 'Techniques', 'Testing', 'Text', 'Time', 'Translating', 'United States National Academy of Sciences', 'Ursidae Family', 'Validation', 'Vision', 'Vocabulary', 'care delivery', 'cost', 'design', 'evaluation/testing', 'experience', 'health care quality', 'stem', 'success', 'tool', 'tool development', 'web site']",NLM,KAISER FOUNDATION RESEARCH INSTITUTE,R21,2009,177750,0.08186357265243215
