text,title,id,project_number,terms,administration,organization,mechanism,year,funding,score
"SCH: A Computer Vision and Lens-Free Imaging System for Automatic Monitoring of Infections Automated monitoring and screening of various physiological signals is an indispensable tool in modern medicine. However, despite the  preponderance of long-term monitoring and screening modalities for certain vital signals, there are a significant number of applications for  which no automated monitoring or screening is available. For example, patients in need of urinary catheterization are at significant risk of  urinary tract infections, but long-term monitoring for a developing infection while a urinary catheter is in place typically requires a caregiver to  frequently collect urine samples which then must be transported to a laboratory facility to be tested for a developing infection. Disruptive  technologies at the intersection of lens-free imaging, fluidics, image processing, computer vision and machine learning offer a tremendous  opportunity to develop new devices that can be connected to a urinary catheter to automatically monitor urinary tract infections. However, novel  image reconstruction, object detection and classification, and deep learning algorithms are needed to deal with challenges such as low image  resolution, limited labeled data, and heterogeneity of the abnormalities to be detected in urine samples. This project brings together a multidisciplinary team of computer scientists, engineers and clinicians to design, develop and test a system that integrates lens-free imaging, fluidics, image processing, computer vision and machine learning to automatically monitor urinary tract infections. The system will take a urine sample as an input, image the sample with a lens-free microscope as it flows through a fluidic channel, reconstruct the images using advanced holographic reconstruction algorithms, and detect and classify abnormalities, e.g., white blood cells, using advanced computer vision and machine learning algorithms. Specifically, this project will: (1) design fluidic and optical hardware to appropriately sample urine from patient lines, flow the sample through the lens-free imager, and capture holograms of the sample; (2) develop holographic image reconstruction algorithms based on deep network architectures constrained by the physics of light diffraction to produce high quality images of the specimen from the lens-free holograms; (3) develop deep learning algorithms requiring a minimal level of manual supervision to detect various abnormalities in the fluid sample that might be indicative of a developing infection (e.g., the presence of white bloods cells or bacteria); and (4) integrate the above hardware and software developments into a system to be validated on urine samples obtained from patient discards against standard urine monitoring and screening methods. RELEVANCE (See instructions):  This project could lead to the development of a low-cost device for automated screening and monitoring of urinary tract infections (the most  common hospital and nursing home acquired infection), and such a device could eliminate the need for patients or caregivers to manually collect  urine samples and transport them to a laboratory facility for testing and enable automated long-term monitoring and screening for UTIs. Early  detection of developing UTIs could allow caregivers to preemptively remove the catheter before the UTI progressed to the point of requiring  antibiotic treatment, thus reducing overall antibiotic usage. The technology to be developed in this project could also be used for screening  abnormalities in other fluids, such as central spinal fluid, and the methods to detect and classify large numbers of cells in an image could lead to  advances in large scale multi-object detection and tracking for other computer vision applications. n/a",SCH: A Computer Vision and Lens-Free Imaging System for Automatic Monitoring of Infections,9976740,R01AG067396,"['Algorithms', 'Antibiotic Therapy', 'Antibiotics', 'Bacteria', 'Bacteriuria', 'Caregivers', 'Catheters', 'Cations', 'Cells', 'Cerebrospinal Fluid', 'Classification', 'Clinical', 'Computer Vision Systems', 'Computers', 'Data', 'Detection', 'Development', 'Devices', 'Diagnostic', 'Diffusion', 'Early Diagnosis', 'Engineering', 'Erythrocytes', 'Evaluation', 'Goals', 'Heterogeneity', 'Hospital Nursing', 'Image', 'Infection', 'Instruction', 'Knowledge', 'Label', 'Laboratories', 'Lead', 'Leukocytes', 'Light', 'Lighting', 'Liquid substance', 'Machine Learning', 'Manuals', 'Maps', 'Measurement', 'Methods', 'Microscope', 'Modality', 'Modern Medicine', 'Monitor', 'Nursing Homes', 'Optics', 'Patients', 'Performance', 'Physics', 'Physiological', 'Prevalence', 'Principal Investigator', 'Procedures', 'Process', 'Resistance', 'Resolution', 'Risk', 'Sampling', 'Scientist', 'Signal Transduction', 'Specimen', 'Supervision', 'Surface', 'System', 'Technology', 'Testing', 'Training', 'Urinalysis', 'Urinary Catheterization', 'Urinary tract infection', 'Urine', 'base', 'biological heterogeneity', 'classification algorithm', 'cost', 'deep learning algorithm', 'design', 'diffraction of light', 'image processing', 'image reconstruction', 'imager', 'imaging system', 'laboratory facility', 'lens', 'machine learning algorithm', 'multidisciplinary', 'network architecture', 'novel', 'particle', 'reconstruction', 'screening', 'software development', 'tool', 'urinary']",NIA,JOHNS HOPKINS UNIVERSITY,R01,2019,299197,0.00355297316175113
"User-driven Retrospectively Supervised Classification Updating (RESCU) systemfor robust upper limb prosthesis control ABSTRACT Approximately 41,000 individuals live with upper-limb loss (loss of at least one hand) in the US. Fortunately, prosthetic devices have advanced considerably in the past decades with the development of dexterous, anthropomorphic hands. However, potentially the most promising used control strategy, myoelectric control, lacks a correspondingly high-level of performance and hence the use of dexterous hands remains highly limited. The need for a complete overhaul in upper limb prosthesis control is well highlighted by the abandonment rates of myoelectric devices, which can reach up to 40% in the case of trans-humeral amputees. The area of research that has received the most focus over the past decade has been “pattern recognition,” which is a signal processing based control method that uses multi-channel surface electromyography as the control input. While pattern recognition provides intuitive operation of multiple prosthetic degrees of freedom, it lacks robustness and requires frequent, often daily calibration. Thus, it has not yet achieved the desired clinical acceptance. Our team proposes clinical translation of a novel highly adaptive upper limb prosthesis control system that incorporates two major advances: 1) machine learning (robust classification by implementing a non-boundary based algorithm), and 2) training by retrospectively incorporating user data from activities of daily living (ADL). The proposed system will enable machine intelligence with user input for prosthesis control. Our work is organized as follows: Phase I: (a) First, we will implement a fundamentally new machine intelligence technique, Extreme Learning Machine with Adaptive Sparse Representation Classification (EASRC), that is more resilient to untrained noisy conditions that users may encounter in the real-world and requires less data than traditional myoelectric signal processing. (b) In parallel, we will implement an adaptive learning algorithm, Nessa, which allows users to relabel misclassified data recorded during use and then update the EASRC classifier to adapt to any major extrinsic or intrinsic changes in the signals. Taken together, EASRC and Nessa comprise the Retrospectively Supervised Classification Updating (RESCU) system. Once, the RESCU implementation is complete, we will optimize the system through a joint effort with Johns Hopkins University, and complete an iterative benchtop RESCU evaluation with a focus group of 3 amputee subjects and their prosthetists. Our milestones for Phase I are as follows:  Milestone 1.1: Extreme Learning Machine with Adaptively Sparse Representation (EASRC) algorithm  successfully implemented and verified  Milestone 1.2: Implementation of Nessa adaptive learning algorithm and smartwatch interface  Milestone 1.3: User Needs and Design Inputs locked as a result of Focus Group testing  Milestone 1.4: Hold a pre-submission meeting with FDA for feedback on device classification and  planned product performance testing  Milestone 1.5: Hold a Scientific Steering Group (SSG) meeting  Milestone 1.6: Convene a Study Monitoring Committee (SMC) and hold an initial meeting to review  clinical plans.  Milestone 1.7: Develop Clinical Study Protocol  Milestone 1.8: Register the study on www.clinicaltrials.gov. PROJECT NARRATIVE In this project, we aim to empower the user by bringing them into the control loop of their prosthesis and improve the stability of their control strategy over time. Specifically, we implement to a robust classifier, an adaptive learning algorithm, and a smartwatch interface, which allows the user to teach their device when it misunderstands the commands that the user is sending to control the prosthesis. This will result in improved control without cumbersome or time-consuming effort on the part of the user and, more importantly, we hope that it will give the user a greater sense of empowerment and ownership over their prosthesis.",User-driven Retrospectively Supervised Classification Updating (RESCU) systemfor robust upper limb prosthesis control,9779227,U44NS108894,"['Activities of Daily Living', 'Algorithms', 'Amputees', 'Area', 'Artificial Intelligence', 'Calibration', 'Classification', 'Clinical', 'Clinical Research', 'Consumption', 'Data', 'Development', 'Devices', 'Electromyography', 'Evaluation', 'Feedback', 'Focus Groups', 'Freedom', 'Group Meetings', 'Hand', 'Individual', 'Intuition', 'Joints', 'Machine Learning', 'Methods', 'Monitor', 'Ownership', 'Pattern Recognition', 'Performance', 'Phase', 'Prosthesis', 'Protocols documentation', 'Research', 'Signal Transduction', 'Supervision', 'Surface', 'System', 'Techniques', 'Testing', 'Time', 'Training', 'Universities', 'Update', 'Upper Extremity', 'Work', 'adaptive learning', 'base', 'clinical translation', 'design', 'empowerment', 'improved', 'learning algorithm', 'meetings', 'myoelectric control', 'novel', 'operation', 'performance tests', 'prosthesis control', 'signal processing', 'smart watch']",NINDS,"INFINITE BIOMEDICAL TECHNOLOGIES, LLC",U44,2019,79250,0.009556598535988697
"User-driven Retrospectively Supervised Classification Updating (RESCU) system for robust upper limb prosthesis control ABSTRACT Approximately 41,000 individuals live with upper-limb loss (loss of at least one hand) in the US. Fortunately, prosthetic devices have advanced considerably in the past decades with the development of dexterous, anthropomorphic hands. However, potentially the most promising used control strategy, myoelectric control, lacks a correspondingly high-level of performance and hence the use of dexterous hands remains highly limited. The need for a complete overhaul in upper limb prosthesis control is well highlighted by the abandonment rates of myoelectric devices, which can reach up to 40% in the case of trans-humeral amputees. The area of research that has received the most focus over the past decade has been “pattern recognition,” which is a signal processing based control method that uses multi-channel surface electromyography as the control input. While pattern recognition provides intuitive operation of multiple prosthetic degrees of freedom, it lacks robustness and requires frequent, often daily calibration. Thus, it has not yet achieved the desired clinical acceptance. Our team proposes clinical translation of a novel highly adaptive upper limb prosthesis control system that incorporates two major advances: 1) machine learning (robust classification by implementing a non-boundary based algorithm), and 2) training by retrospectively incorporating user data from activities of daily living (ADL). The proposed system will enable machine intelligence with user input for prosthesis control. Our work is organized as follows: Phase I: (a) First, we will implement a fundamentally new machine intelligence technique, Extreme Learning Machine with Adaptive Sparse Representation Classification (EASRC), that is more resilient to untrained noisy conditions that users may encounter in the real-world and requires less data than traditional myoelectric signal processing. (b) In parallel, we will implement an adaptive learning algorithm, Nessa, which allows users to relabel misclassified data recorded during use and then update the EASRC classifier to adapt to any major extrinsic or intrinsic changes in the signals. Taken together, EASRC and Nessa comprise the Retrospectively Supervised Classification Updating (RESCU) system. Once, the RESCU implementation is complete, we will optimize the system through a joint effort with Johns Hopkins University, and complete an iterative benchtop RESCU evaluation with a focus group of 3 amputee subjects and their prosthetists. Phase II: Verification and validation of RESCU will be completed, culminating in third-party validation testing and certification. Finally, we will complete a clinical assessment including self-reporting subjective measures, and real-world usage metrics in a long-term clinical study. PROJECT NARRATIVE In this project, we aim to empower the user by bringing them into the control loop of their prosthesis and improve the stability of their control strategy over time. Specifically, we implement to a robust classifier, an adaptive learning algorithm, and a smartwatch interface, which allows the user to teach their device when it misunderstands the commands that the user is sending to control the prosthesis. This will result in improved control without cumbersome or time-consuming effort on the part of the user and, more importantly, we hope that it will give the user a greater sense of empowerment and ownership over their prosthesis.",User-driven Retrospectively Supervised Classification Updating (RESCU) system for robust upper limb prosthesis control,10013405,U44NS108894,"['Activities of Daily Living', 'Adoption', 'Algorithms', 'Amputees', 'Area', 'Artificial Intelligence', 'Calibration', 'Certification', 'Classification', 'Clinical', 'Clinical Research', 'Clinical assessments', 'Communication', 'Consumption', 'Data', 'Development', 'Devices', 'Electromyography', 'Evaluation', 'Focus Groups', 'Freedom', 'Goals', 'Hand', 'Individual', 'Intuition', 'Joints', 'Label', 'Limb Prosthesis', 'Machine Learning', 'Measures', 'Methods', 'Outcome', 'Ownership', 'Patient Self-Report', 'Pattern Recognition', 'Performance', 'Phase', 'Prosthesis', 'Research', 'Signal Transduction', 'Small Business Innovation Research Grant', 'Supervision', 'Surface', 'Surveys', 'System', 'Systems Integration', 'Techniques', 'Technology', 'Testing', 'Time', 'Training', 'Universities', 'Update', 'Upper Extremity', 'Validation', 'Work', 'adaptive learning', 'base', 'clinical translation', 'empowerment', 'functional improvement', 'improved', 'innovation', 'learning algorithm', 'myoelectric control', 'novel', 'operation', 'programs', 'prospective', 'prosthesis control', 'satisfaction', 'signal processing', 'smart watch', 'verification and validation']",NINDS,"INFINITE BIOMEDICAL TECHNOLOGIES, LLC",U44,2019,735600,0.009315602146889446
"Leveraging Maps and Computer Vision to Support Indoor Navigation for Blind Travelers Leveraging Maps and Computer Vision to Support Indoor Navigation for Blind Travelers Summary The goal of this project is to develop a smartphone-based wayfinding app designed to help people with visual impairments navigate indoor environments more easily and independently. It harnesses computer vision and smartphone sensors to estimate and track the user's location in real time relative to a map of the indoor environment, providing audio-based turn-by-turn directions to guide the user to a desired destination. An additional option is to provide audio or tactile alerts to the presence of nearby points of interest in the environment, such as exits, elevators, restrooms and meeting rooms. The app estimates the user's location by recognizing standard informational signs present in the environment, tracking the user's trajectory and relating it to a digital map that has been annotated with information about signs and landmarks. Compared with other indoor wayfinding approaches, our computer vision and sensor-based approach has the advantage of requiring neither physical infrastructure to be installed and maintained (such as iBeacons) nor precise prior calibration (such as the spatially referenced radiofrequency signature acquisition process required for Wi-Fi-based systems), which are costly measures that are likely to impede widespread adoption. Our proposed system has the potential to greatly expand opportunities for safe, independent navigation of indoor spaces for people with visual impairments. Towards the end of the grant period, the wayfinding software (including documentation) will be released as free and open source software (FOSS). Health Relevance For people who are blind or visually impaired, a serious barrier to employment, economic self- sufficiency and independence is the ability to navigate independently, efficiently and safely in a variety of environments, including large public spaces such as medical centers, schools and office buildings. The proposed research would result in a new smartphone-based wayfinding app that could greatly increase travel independence for the approximately 10 million Americans with significant vision impairments or blindness.",Leveraging Maps and Computer Vision to Support Indoor Navigation for Blind Travelers,9934891,R01EY029033,"['Adoption', 'American', 'Blindness', 'Calibration', 'Cellular Phone', 'Computer Vision Systems', 'Computer software', 'Cost Measures', 'Destinations', 'Documentation', 'Economics', 'Elevator', 'Employment', 'Environment', 'Goals', 'Grant', 'Health', 'Indoor environment', 'Infrastructure', 'Location', 'Maps', 'Medical center', 'Process', 'Research', 'Schools', 'System', 'Tactile', 'Time', 'Travel', 'Visual impairment', 'base', 'blind', 'design', 'digital', 'interest', 'meetings', 'open source', 'radio frequency', 'sensor', 'way finding', 'wireless fidelity']",NEI,SMITH-KETTLEWELL EYE RESEARCH INSTITUTE,R01,2019,105337,0.040333965632272546
"Leveraging Maps and Computer Vision to Support Indoor Navigation for Blind Travelers Leveraging Maps and Computer Vision to Support Indoor Navigation for Blind Travelers Summary The goal of this project is to develop a smartphone-based wayfinding app designed to help people with visual impairments navigate indoor environments more easily and independently. It harnesses computer vision and smartphone sensors to estimate and track the user’s location in real time relative to a map of the indoor environment, providing audio-based turn-by-turn directions to guide the user to a desired destination. An additional option is to provide audio or tactile alerts to the presence of nearby points of interest in the environment, such as exits, elevators, restrooms and meeting rooms. The app estimates the user’s location by recognizing standard informational signs present in the environment, tracking the user’s trajectory and relating it to a digital map that has been annotated with information about signs and landmarks. Compared with other indoor wayfinding approaches, our computer vision and sensor-based approach has the advantage of requiring neither physical infrastructure to be installed and maintained (such as iBeacons) nor precise prior calibration (such as the spatially referenced radiofrequency signature acquisition process required for Wi-Fi-based systems), which are costly measures that are likely to impede widespread adoption. Our proposed system has the potential to greatly expand opportunities for safe, independent navigation of indoor spaces for people with visual impairments. Towards the end of the grant period, the wayfinding software (including documentation) will be released as free and open source software (FOSS). Health Relevance For people who are blind or visually impaired, a serious barrier to employment, economic self- sufficiency and independence is the ability to navigate independently, efficiently and safely in a variety of environments, including large public spaces such as medical centers, schools and office buildings. The proposed research would result in a new smartphone-based wayfinding app that could greatly increase travel independence for the approximately 10 million Americans with significant vision impairments or blindness.",Leveraging Maps and Computer Vision to Support Indoor Navigation for Blind Travelers,9663319,R01EY029033,"['Adoption', 'Algorithms', 'American', 'Blindness', 'Calibration', 'Cellular Phone', 'Computer Vision Systems', 'Computer software', 'Cost Measures', 'Destinations', 'Development', 'Documentation', 'Economics', 'Elevator', 'Employment', 'Ensure', 'Environment', 'Evaluation', 'Floor', 'Focus Groups', 'Goals', 'Grant', 'Health', 'Indoor environment', 'Infrastructure', 'Location', 'Maps', 'Measures', 'Medical center', 'Needs Assessment', 'Performance', 'Process', 'Research', 'Schools', 'System', 'Systems Integration', 'Tactile', 'Testing', 'Time', 'Travel', 'Visual', 'Visual impairment', 'base', 'blind', 'design', 'digital', 'improved', 'interest', 'lens', 'meetings', 'open source', 'radio frequency', 'sensor', 'way finding', 'wireless fidelity']",NEI,SMITH-KETTLEWELL EYE RESEARCH INSTITUTE,R01,2019,416374,0.040333965632272546
