text,title,id,project_number,terms,administration,organization,mechanism,year,funding,score
"Capti Screen Reading Assistant for Goal Directed Web Browsing ﻿    DESCRIPTION (provided by applicant): Web browsing with assistive technologies such as screen readers and magnifiers can often be a frustrating and challenging experience for people with vision impairments, because it entails a lot of searching for content, forms, and links that are required for doing online tasks such as shopping, bill-payment, reservations, etc. This SBIR Phase II project will build on Phase I results and will continue the development and eventual deployment of Capti Screen Reading Assistant - a next-generation assistive technology, enabling goal- directed web browsing for people with visual impairments. With Capti Assistant, users will be able to stay focused on their high-level browsing goals that are expressed in natural language (spoken or typed). The Assistant will lead the users step-by-step towards the fulfillment of these goals by offering suggestions on what action to take at every step of the way and automatically executing the chosen action on behalf of the user. Suggested actions will include operations such as form filling, activating controls (e.g., clicking buttons and links), et. Capti Assistant will dramatically reduce the time spent by people with visual impairments on performing tasks online. The Assistant will significantly improve the speed and efficiency with which they can interact with the Web, thereby, making people with disabilities more productive in today's web-based economy. Given a user browsing goal, expressed in a natural-language form, Capti Assistant will utilize a predictive model to guide the user toward the goal. The unique aspect of the Assistant is that its suggestions will be automatically learned from the user's own history of browsing actions and commands, as well as from the user's demonstration of how to accomplish browsing tasks that have not been done before. The Assistant will process user commands and present the suggested browsing actions to the user on demand, giving the user a choice between following the suggestions or continue browsing normally without accepting the suggestions. The functionality offered by the Assistant will go far beyond popular personal assistant applications such as Siri, which have not been designed specifically for people with vision impairments, and which cannot be used for ad hocweb browsing. Capti Assistant will go a long way towards bridging the growing web accessibility divide between the ways people with and without vision impairments browse the Web. For them, the Assistant will usher in a new era of independence and employability in our global web-based economy. Thus, from a broader perspective, goal- directed browsing will exemplify the vision of the Universally Accessible Web whose thesis is ""equal access for all"", i.e. anyone should be able to reap the benefits of the Web without being constrained by any disability. PUBLIC HEALTH RELEVANCE: This SBIR Project seeks to do Research and Development on goal-directed web browsing - the next generation accessible technology that will empower people with vision impairments to stay focused on their high-level browsing goals, while the browser will do low-level operations (such as clicking on links and filling forms) necessary to fulfill these goals. Goal-directed browsing will go a long way towards bridging the growing web accessibility divide between the ways people with and without vision impairments browse the web, thus improving independence and employability of the former in our global Web-based economy. From a broader perspective, goal-directed browsing will facilitate rehabilitation of people with disabilities and exemplify the vision of the Universally Accessible Web whose thesis is ""equal access for all"", enabling anyone to reap the benefits of the Web without being constrained by any disability.",Capti Screen Reading Assistant for Goal Directed Web Browsing,9199231,R44EY021962,"['Automation', 'Blindness', 'Budgets', 'Businesses', 'Communication', 'Computer software', 'Computers', 'Data', 'Development', 'Disabled Persons', 'Ensure', 'Environment', 'Evaluation', 'FarGo', 'Focus Groups', 'Generations', 'Goals', 'Human Resources', 'In Situ', 'Information Retrieval', 'Internet', 'Internships', 'Laboratory Study', 'Lead', 'Legal patent', 'Link', 'Longitudinal Studies', 'Machine Learning', 'Mining', 'Modeling', 'Natural Language Processing', 'Online Systems', 'Pattern', 'Phase', 'Probability', 'Process', 'Productivity', 'Publications', 'Publishing', 'Reader', 'Reading', 'Recording of previous events', 'Rehabilitation therapy', 'Research', 'Research Personnel', 'Reservations', 'Resources', 'Schedule', 'Scheme', 'Seasons', 'Self-Help Devices', 'Small Business Innovation Research Grant', 'Speed', 'Suggestion', 'System', 'Technology', 'Time', 'Universities', 'Vision', 'Visual impairment', 'Work', 'base', 'collaborative environment', 'commercial application', 'commercialization', 'computer human interaction', 'design', 'disability', 'educational atmosphere', 'experience', 'improved', 'innovation', 'member', 'natural language', 'next generation', 'novel strategies', 'operation', 'payment', 'predictive modeling', 'public health relevance', 'quality assurance', 'query optimization', 'research and development', 'response', 'success', 'technological innovation', 'tool', 'usability', 'web page', 'web-accessible']",NEI,"CHARMTECH LABS, LLC",R44,2017,500000,0.023832754484296902
"Enabling Technology for Safe Robot-assisted Surgical Micromanipulation Project Summary  The goal of this grant is to develop enabling technology and systems that address fundamental limitations in microsurgery with a specific focus on vitreoretinal surgery. Due to the inherent micro-scale and the fragility of the neurosensory retina, vitreoretinal surgeons can be challenged by physiological hand tremor where the tremor amplitude is larger than retinal structures, delicate movements that are below tactile sensation, and multiple cognitive decisions that are required when executing high-risk movements, such as during retinal vein cannulation (RVC). Nevertheless currently vitreoretinal surgery is at the limits of human physiological performance and lacks the adequate technology that could further improve the technical performance. This situation is less than optimal and can significantly benefit from the recent advances in medical robotics, sensor feedback and human machine interface design. Robotic assistance may be ideally suited to address common problems encountered in the performance of the demanding micromanipulations in retinal microsurgery.  We propose a robotic system with enhanced real-time multisensory feedback that assesses multiple points of instrument contact located both inside and outside of the eye. Our comprehensive system will enable the surgeon to manipulate tools based on quantitative feedback that will prevent mechanical injury by implementing safeguards against the application of excessive and previously unmeasurable forces at the eyewall and the tool tip. Our aims are: (1) Develop and demonstrate in vivo position/force hybrid control algorithms for enabling real- time high-fidelity sensorimotor capabilities at the sclerotomy for safe robot-assisted vitreoretinal microsurgery: real-time sensorimotor capabilities at the sclerotomy will be uniquely used to control the robot through a machine learning method that adaptively learns a nonlinear mapping from user behavior to sclera-force/position and predicts unsafe motions; (2) Develop and demonstrate in vivo force-input control algorithms for enabling real- time high-fidelity sensorimotor capabilities at the tool-tip for safe robot-assisted vein cannulation: real-time tool- tip-to-tissue interaction force sensing and non-linear robot control algorithms based on observing the user behavior will be used to control the tool-tip position and force and to prevent entry into subretinal areas during RVC; (3) Demonstrate safe robot-assisted RVC in rabbit model in vivo: real-time, position/force hybrid control algorithms based on dual-point (tool-shaft and tip) information fusion will provide sensorimotor guidance of surgical maneuvers during RVC. Statistically significant results in vivo, in clinically realistic conditions will demonstrate the feasibility of our approach.  This highly innovative system will enable surgeons to perform maneuvers in a tremor free environment with a higher level of precision than previously possible and with the ability to sense forces on a scale that have been previously imperceptible. We envision this development as a logical next step in the integration of man, machine and computer for the performance of unprecedented microsurgical maneuvers. Project Narrative  This R01 grant addresses fundamental limitations in current microsurgical practice, focusing on vitreoretinal surgery (VRS), which is the most technically demanding ophthalmologic surgery. Our goal is to develop a cooperatively controlled robotic system with enhanced sensorimotor capabilities that in conjunction with multifunction force-sensing microsurgical instruments could enable safe robot-assisted retinal surgery. Although focused on VRS, our results will be applicable to a broader range of microsurgical training and practice.",Enabling Technology for Safe Robot-assisted Surgical Micromanipulation,9291018,R01EB023943,"['Address', 'Algorithms', 'Area', 'Behavior', 'Cannulations', 'Clinic', 'Clinical', 'Cognitive', 'Computers', 'Development', 'Disadvantaged', 'Discipline', 'Environment', 'Eye', 'Eye Movements', 'Feedback', 'Future', 'Goals', 'Grant', 'Hand', 'Healthcare', 'Hemorrhage', 'Histology', 'Human', 'Hybrids', 'Iatrogenesis', 'Injury', 'Intervention', 'Learning', 'Machine Learning', 'Manuals', 'Mechanics', 'Medical', 'Micromanipulation', 'Microsurgery', 'Miniaturization', 'Monitor', 'Motion', 'Movement', 'Operative Surgical Procedures', 'Ophthalmologic Surgical Procedures', 'Ophthalmology', 'Optics', 'Oryctolagus cuniculus', 'Otorhinolaryngologic Surgical Procedures', 'Patients', 'Perception', 'Performance', 'Phase', 'Physiological', 'Positioning Attribute', 'Postoperative Period', 'Procedures', 'Property', 'Reporting', 'Research', 'Research Proposals', 'Retina', 'Retinal', 'Retinal Hemorrhage', 'Retinal Perforations', 'Retinal Vein Occlusion', 'Robot', 'Robotics', 'Safety', 'Sclera', 'Site', 'Sterilization', 'Structure', 'Structure of central vein of the retina', 'Surgeon', 'Surveys', 'System', 'Tactile', 'Techniques', 'Technology', 'Time', 'Tissues', 'Touch sensation', 'Training', 'Tremor', 'User-Computer Interface', 'Veins', 'Vision', 'Work', 'adaptive learning', 'base', 'design', 'dexterity', 'high risk', 'improved', 'in vivo', 'in vivo Model', 'innovation', 'instrument', 'interest', 'learning strategy', 'man', 'medical specialties', 'multisensory', 'neurosensory', 'neurosurgery', 'operation', 'prevent', 'research clinical testing', 'robot assistance', 'robot control', 'sensor', 'technological innovation', 'tool', 'trend', 'virtual']",NIBIB,JOHNS HOPKINS UNIVERSITY,R01,2017,305007,0.013481873214404598
"Novel Use of Emergent Technologies to Improve Efficiency of Animal Model Research ﻿    DESCRIPTION (provided by applicant): This Phase II project aims to continue development of a commercial quality, innovative cloud hosted information management system, called Climb 2.0(tm) that will increase laboratory efficiency and provide improved capabilities for research laboratories. Climb is designed to offer integrated laboratory process management modules that include mobile communications tools data monitoring and alert systems, and integrated access to Microsoft Azure Cloud(tm) Machine Learning and Stream Analytics services. Initially, Climb 2.0 will target animal model research laboratories; however, the core of the platform is designed to be adaptable to nearly any research type or related industry. Current research information management systems are primarily designed as record-keeping tools with little or no direct focus on laboratory efficiency or in enhancing value of the research data. They also do not leverage emergent mobile device technologies, social media frameworks, and data analysis and storage capabilities of cloud computing. Many laboratories still use paper as their primary recording system. Paper data logging is then followed by secondary data entry into a laboratory database. These systems are error prone, time consuming and lead to laboratory databases with significant time lags between data acquisition and data entry. Moreover, they do not recognized cumulative data relationships, which may identify important trends, and researchers often miss windows of opportunity to take action on time-sensitive events. In Phase I, RockStep Solutions demonstrated feasibility of an innovative Cloud Information Management Bundle system, Climb, which will increase efficiency and improve capabilities in animal model data management. During Phase I, a beta version of Climb was successfully developed and tested against strict performance metrics as a proof of concept. We successfully built a prototype with working interfaces that integrates real-time communication technologies with media capabilities of mobile devices. Phase II proposes four specific Aims: 1) Develop the technology infrastructure to support the secure and scalable Software as a Service (SaaS) deployment of Climb for enterprise commercial release; 2) Develop and extend the Phase-I prototype Data Monitoring and Messaging System (DMMS) into a platform ready for production use; 3) Extend Climb's DMMS adding a Stream Analytics engine to support Internet of Things (IoT) devices and streaming media; 4) Deploy a beta release of Climb at partner research labs, test and refine the product for final commercialization. To ensure Climb is developed with functionality and tools relevant to research organizations, RockStep Solutions has established collaborations with key beta sites to test all of the major functionality developed in this proposal. IMPACT: By leveraging emergent technologies and cloud computing, Climb offers several advantages: 1) enables real-time communications using familiar tools among members of research groups; 2) reduces the risk of experimental setbacks, and 3) enables complex experiments to be conducted efficiently. PUBLIC HEALTH RELEVANCE: The NIH Invests approximately $12 billion each year in animal model research that is central to both understanding basic biological processes and for developing applications directly related to improving human health. More cost-effective husbandry and colony management techniques, equipment, and new approaches to improve laboratory animal welfare and assure efficient and appropriate research use (e.g., through cost savings and reduced animal burden) are high priorities for NIH. RockStep Solutions proposes to meet this need by integrating existing and emergent software and communication technologies to create a novel solution, Climb 2.0, for research animal data management. Climb 2.0 extracts immediate value of data in animal research laboratories and extends the database into a multimedia communication network, thus enabling science that would be impractical to conduct with traditional methods.",Novel Use of Emergent Technologies to Improve Efficiency of Animal Model Research,9354497,R44GM112206,"['Address', 'Algorithms', 'Animal Experimentation', 'Animal Model', 'Animal Welfare', 'Animals', 'Biological Process', 'Biomedical Research', 'Clinical Laboratory Information Systems', 'Cloud Computing', 'Collaborations', 'Communication', 'Communication Tools', 'Communications Media', 'Complex', 'Computer software', 'Computers', 'Consumption', 'Cost Savings', 'Custom', 'Data', 'Data Analyses', 'Data Analytics', 'Data Security', 'Data Set', 'Data Storage and Retrieval', 'Databases', 'Development', 'Devices', 'Emerging Technologies', 'Ensure', 'Equipment', 'Equipment and supply inventories', 'Event', 'Feedback', 'Future', 'Goals', 'Health', 'Health system', 'Human', 'Industry', 'Information Management', 'Internet', 'Internet of Things', 'Investments', 'Laboratories', 'Laboratory Animals', 'Laboratory Research', 'Lead', 'Machine Learning', 'Management Information Systems', 'Methods', 'Modernization', 'Monitor', 'Motion', 'Multimedia', 'Notification', 'Paper', 'Performance', 'Phase', 'Procedures', 'Process', 'Production', 'Protocols documentation', 'Publishing', 'Research', 'Research Infrastructure', 'Research Personnel', 'Rest', 'Risk', 'Science', 'Secure', 'Services', 'Site', 'Stream', 'System', 'Techniques', 'Technology', 'Testing', 'The Jackson Laboratory', 'Time', 'Transact', 'United States National Institutes of Health', 'analytical tool', 'base', 'cloud based', 'commercialization', 'computerized data processing', 'cost', 'cost effective', 'data acquisition', 'data management', 'design', 'encryption', 'experimental study', 'good laboratory practice', 'graphical user interface', 'handheld mobile device', 'improved', 'innovation', 'laptop', 'member', 'novel', 'novel strategies', 'predictive modeling', 'programs', 'prototype', 'public health relevance', 'service learning', 'social media', 'software as a service', 'success', 'time interval', 'tool', 'trend', 'usability']",NIGMS,"ROCKSTEP SOLUTIONS, INC.",R44,2017,739402,0.019010034074672093
"Advancing a novel portable detection method for cannabis intoxication Intoxication from marijuana (MJ) impairs psychomotor performance and at least doubles the risk of motor vehicle accidents. The ongoing wave of legalization of MJ has brought increasing prevalence of driving while intoxicated with MJ. However, there is no quantitative biologic test that can accurately determine whether an individual is acutely impaired from MJ intoxication. Assays of the primary intoxicating substance in MJ, THC, in body fluids has a high false negative rate as THC is cleared from blood within 15 minutes, long before impairment is resolved. And assays of THC metabolites yield a high false positive rate because clearance of these metabolites can take weeks. Thus there is now no nor is there likely to ever be a test of blood, breath or body fluids that can accurately detect MJ intoxication. In response to this significant knowledge gap, this project aims to develop an accurate, portable method for detection of impairment due to MJ intoxication using functional near-infrared spectroscopy (fNIRS). fNIRS is a non-invasive, safe brain imaging technique that capitalizes on differences in the light absorption spectra of deoxygenated and oxygenated hemoglobin (Hb), that allows the measurement of relative changes in Hb concentration that reflect brain activity. fNIRS can be performed in natural environments at low cost, and thus can be used in real-world settings. In Phase I, we will develop an algorithm for individual-level detection of impairment from THC using fNIRS measurements. To do so, we will assess the effect of oral THC (or placebo) on fNIRS measurements, self-reported intoxication, and impairment as defined by the gold standard field sobriety test conducted by a Drug Recognition Expert (DRE) in 40 healthy MJ users. fNIRS assessments will examine (1) the effect of THC exposure on resting state and task-based activation in the prefrontal cortex, (2) the extent to which impairment in psychomotor functioning with THC administration correlates with THC-induced change in hemodynamic responses detected with fNIRS, and (3) the sensitivity and specificity and area under the ROC curve of fNIRS measurements and field sobriety test determinants of impairment. Milestone: Should machine learning applications to the data generate an algorithm that predicts impairment with >80% accuracy compared with a gold standard field sobriety test, we will proceed to Phase II. In Phase II, we will conduct fNIRS testing in 150 individuals under THC/placebo as in Phase I and in 50 individuals in a THC plus alcohol/placebo condition in order to further refine the algorithm for MJ impairment detection such that fNIRS detection concurs with field sobriety testing with >90% specificity. It is anticipated that this level of specificity could be used in legal definitions of impairment. This will warrant commercialization, which will be followed by prototype development and field testing. An accurate, quantitative, biological test that is user-friendly and enables law enforcement to detect impairment from MJ has the potential to dramatically change practice of law enforcement across the country and the world and thus has enormous commercial potential, as outlined in the Commercialization Plan and in accompanying letters of support. The goal of this project is to develop, test, and refine a method to accurately and reliably detect marijuana (MJ) impairment using a portable, user-friendly, non-invasive, brain-based modality. MJ doubles the chance of motor vehicle accidents, yet, there now exists no valid, biologically based method to detect whether an individual is acutely impaired from MJ. The development of a reliable, quantitative biological marker that enables law enforcement officers to screen individuals whom they suspect are impaired from MJ will have highly significant public health importance and enormous commercial potential.",Advancing a novel portable detection method for cannabis intoxication,9334516,R42DA043977,"['Acute', 'Adult', 'Age', 'Alcohols', 'Algorithms', 'Area', 'Base of the Brain', 'Biochemical', 'Biological', 'Biological Assay', 'Biological Markers', 'Biological Testing', 'Blood', 'Blood Circulation', 'Blood Tests', 'Body Fluids', 'Brain', 'Brain imaging', 'Breath Tests', 'Cannabis', 'Collaborations', 'Comorbidity', 'Country', 'Cross-Over Trials', 'Data', 'Detection', 'Development', 'Devices', 'Dose', 'Double-Blind Method', 'Driving While Intoxicated', 'Drug Kinetics', 'Ensure', 'Environment', 'Equipment', 'Evaluation', 'Formulation', 'Future', 'Goals', 'Gold', 'Hemoglobin', 'Hour', 'Human Resources', 'Imaging Techniques', 'Impairment', 'Individual', 'Intoxication', 'Knowledge', 'Law Enforcement', 'Law Enforcement Officers', 'Legal', 'Letters', 'Licensing', 'Light', 'Machine Learning', 'Marijuana', 'Measurement', 'Methods', 'Modality', 'Near-Infrared Spectroscopy', 'Oral', 'Patient Self-Report', 'Pattern', 'Pharmaceutical Preparations', 'Phase', 'Placebo Control', 'Placebos', 'Population', 'Prefrontal Cortex', 'Prevalence', 'Property', 'Psychomotor Impairments', 'Psychomotor Performance', 'Public Health', 'ROC Curve', 'Randomized', 'Readiness', 'Rest', 'Risk', 'Sensitivity and Specificity', 'Source', 'Specificity', 'System', 'THC exposure', 'Testing', 'Tetrahydrocannabinol', 'United States', 'Urine', 'Vendor', 'absorption', 'alcohol exposure', 'base', 'behavior test', 'commercialization', 'cost', 'density', 'detector', 'driving under influence', 'drug testing', 'field sobriety tests', 'field study', 'functional disability', 'hemodynamics', 'interest', 'marijuana legalization', 'marijuana use', 'marijuana user', 'novel', 'novel strategies', 'portability', 'prediction algorithm', 'prototype', 'response', 'spectroscopic imaging', 'tool', 'user-friendly', 'vehicular accident']",NIDA,"HIGHLIGHTI, INC",R42,2017,224973,0.011238167820814077
