text,title,id,project_number,terms,administration,organization,mechanism,year,cost,funding,score
"Chronic Inflammation and Type 2 Diabetes: A Multi-omics Approach ABSTRACT The etiology of type 2 diabetes (T2D) likely involves a complex interaction of polygenic, metabolic, and environmental factors including diet. Accumulating experimental, epidemiological, and clinical evidence supports a pathogenic role of chronic inflammation in T2D development. However, the precise mechanisms underlying these findings are largely unknown, and current evidence on the causal relationships between specific inflammatory pathways and T2D risk is inconclusive. Advances in omics technologies have led to the identification of genes and metabolites associated with T2D risk, but data on mechanisms and causality are still very limited. Multi-omics integration in the framework of systems epidemiology may provide new avenues to enhance our understanding of disease mechanisms. To systematically investigate the relation between chronic inflammation and T2D, I propose to examine 3 Specific Aims by leveraging the rich resources in the UK Biobank, Nurses’ Health Studies (NHS), Health Professional Follow-up Study (HPFS), Hispanic Community Health Study/Study of Latinos (SOL), and Genotype-Tissue Expression project (GTEx). In Aim 1 [K99], I will integrate existing genomic data from the UK Biobank, NHS/HPFS, SOL, and transcriptomic data in the GTEx to examine shared genetic architectures between systemic inflammatory markers and T2D and whether polygenic susceptibility to chronic inflammation confers T2D risk. Meanwhile, I will receive extensive training in T2D systems biology and cutting-edge high-dimensional data analytics and bioinformatics. In Aim 2 [R00], I will integrate dietary and metabolomic data to examine metabolomic profiles mediating the association between dietary inflammatory potentials and T2D risk in the prospective NHS/HPFS and the SOL. In Aim 3 [R00], I will conduct plasma proteomic profiling in a nested case-control study within the NHS to identify inflammatory protein networks in relation to T2D risk, and as a Secondary Aim, integrate findings from Aim 1-3 to explore T2D-related pathways co-regulating at multiple biological dimensions. Findings from this project may improve the understanding of inflammatory mechanisms underlying T2D and identify novel targets/pathways suitable for early detection and prevention. I will be mentored/advised by an interdisciplinary team that includes Dr. JoAnn Manson (diabetes epidemiologist), Dr. Liming Liang (expert in statistical omics methodologies), Dr. Frank Hu (nutritional epidemiologist), Dr. Peter Kraft, (statistical geneticist), Dr. Qibin Qi (genetic epidemiologist), Dr. Towia Libermann (expert in proteomics), and Dr. Clary Clish (expert in metabolomics). The outstanding training opportunities with key leaders in these areas will provide me advanced knowledge and skills, positioning me for a successful, independent career as a diabetes epidemiologist with expertise in systems biology and integrated-omics. This project aligns with the NIDDK’s goal of integrating multi-omics technologies into diabetes research. PROJECT NARRATIVE This project seeks to systematically examine the relationship between chronic inflammation and type 2 diabetes (T2D) by incorporating multi-omics data from several large prospective cohort studies. The proposed research will yield novel evidence on the biological mechanisms underlying the relationship between chronic inflammation and T2D risk. Novel pathways, and specific genes, proteins, and metabolites identified in this research will serve as the critical first steps for future development of biomarkers and therapeutic targets for T2D prevention and treatment.",Chronic Inflammation and Type 2 Diabetes: A Multi-omics Approach,10003234,K99DK122128,"['Adult', 'Affect', 'Applications Grants', 'Area', 'Bioinformatics', 'Biological', 'C-reactive protein', 'Cardiovascular Diseases', 'Chronic', 'Clinical', 'Complex', 'Data', 'Data Analytics', 'Development', 'Diabetes Mellitus', 'Diabetes prevention', 'Diet', 'Dietary Assessment', 'Dimensions', 'Disease', 'Early Diagnosis', 'Environmental Risk Factor', 'Epidemiologist', 'Epidemiology', 'Etiology', 'Follow-Up Studies', 'Food', 'Future', 'Gene Proteins', 'Genes', 'Genetic', 'Genetic Predisposition to Disease', 'Genomics', 'Genotype-Tissue Expression Project', 'Goals', 'Health Professional', 'Hispanic Community Health Study/Study of Latinos', 'IL6 gene', 'Inflammation', 'Inflammatory', 'Intake', 'Interleukin-6', 'Kidney Diseases', 'Knowledge', 'Limes', 'Machine Learning', 'Mediating', 'Mentors', 'Metabolic', 'Methodology', 'Methods', 'Modeling', 'Multiomic Data', 'National Institute of Diabetes and Digestive and Kidney Diseases', 'Nested Case-Control Study', 'Non-Insulin-Dependent Diabetes Mellitus', 'Nurses&apos', ' Health Study', 'Nutritional', 'Pathogenicity', 'Pathway interactions', 'Patient Self-Report', 'Pattern', 'Phenotype', 'Physiological', 'Pilot Projects', 'Plasma', 'Positioning Attribute', 'Predisposition', 'Prevention', 'Prospective cohort study', 'Proteins', 'Proteome', 'Proteomics', 'Public Health', 'Qi', 'Regulator Genes', 'Regulatory Element', 'Research', 'Research Design', 'Research Personnel', 'Resources', 'Retinal Diseases', 'Risk', 'Risk Factors', 'Role', 'Study of Latinos', 'System', 'Systems Biology', 'TNFRSF1A gene', 'Technology', 'Training', 'White Blood Cell Count procedure', 'Work', 'adiponectin', 'base', 'biobank', 'biomarker development', 'cardiometabolism', 'career', 'case control', 'cohort', 'cytokine', 'diabetes risk', 'disorder prevention', 'genetic architecture', 'genomic data', 'genomic locus', 'high dimensionality', 'i(19)', 'improved', 'indexing', 'inflammatory marker', 'innovation', 'metabolome', 'metabolomics', 'mortality', 'multidimensional data', 'multiple omics', 'novel', 'novel marker', 'prospective', 'protein metabolite', 'response', 'skills', 'therapeutic target', 'training opportunity', 'transcriptome', 'transcriptomics', 'whole genome']",NIDDK,HARVARD SCHOOL OF PUBLIC HEALTH,K99,2020,89999,146629556,0.12108453640564172
"Greater Los Angeles Clinical Center of the Consortium for the Study of Chronic Pancreatitis, Diabetes and Pancreatic Cancer This is an application for renewal of Clinical Center designation of the Consortium for the Study of Chronic Pancreatitis, Diabetes, and Pancreatic Cancer (CPDPC). The Greater Los Angeles Clinical Center has provided considerable leadership in the organization and progress of the CPDPC. Dr. Pandol serves as co-chair of the Steering Committee and Dr. Goodarzi co-chairs the Type 3c Working Group. We have excelled in recruitment and retention of participants in the cohort studies implemented through the CPDPC designed to elucidate the natural history and develop means of diagnosis, treatment and clinical management of chronic pancreatitis (CP) and its complications in children and adults, and to determine the pathogenic interrelationships of diabetes and pancreatic cancer and develop the means of early diagnosis and management of pancreatic cancer. In addition, we have been performing a number ancillary and associated studies to support the overall goals of CPDPC, including: 1. Epidemiologic studies defining risk factors for pancreatic cancer and the natural history of CP; 2. Determining that genetic susceptibility for type 2 diabetes is a strong risk factor for diabetes associated with CP; 3. Developing liquid biopsy assays for aiding in the diagnosis of pancreatic cancer and CP; 4. Investigating mechanisms of pancreatitis and pancreatic cancer for rational pharmaceutical treatments; and 5. Conducting pilot clinical trials for treatment of recurrent acute and chronic pancreatitis. For the next phase of the CPDPC we are committed to the following Specific Aims: 1. Continue recruitment and retention of subjects in CPDPC cohort studies (PROCEED, INSPPIRE 2, NOD,  DETECT) in existing and additional study sites, as well as increase diversity in the study population. 2. Continue currently supported ancillary studies to further develop risk factor models combined with liquid  biopsy assays for early diagnosis of chronic pancreatitis and pancreatic cancer, and advance mechanism-  based treatments and clinical trials for recurrent acute and chronic pancreatitis and pancreatic cancer. 3. Build models that combine clinical features with genetic susceptibility to allow the prediction of future  development of diabetes in patients with chronic pancreatitis. 4. Determine the role of pancreatic enzyme replacement in regulating glucose homeostasis in patients with  chronic pancreatitis and diabetes, with or without pancreatic exocrine insufficiency. 5. Use existing and annotated pre-diagnostic CT scans to develop artificial intelligence-based techniques for  highly sensitive and specific methods for CT-based early pancreatic cancer detection. Our Center involves Cedars-Sinai Medical Center, UCLA Medical Center, the VA Greater Los Angeles Healthcare System and the University of Southern California/Los Angeles Public Health System with an organizational structure designed to expand recruitment into cohort studies of CPDPC with increased diversity and to facilitate our participation in ancillary studies. This is an application to renew the “Greater Los Angeles Clinical Center of the Consortium for the Study of Chronic Pancreatitis, Diabetes, and Pancreatic Cancer,” which consists of an expert team well-qualified to carry out studies of the Consortium in Los Angeles County, the most populous and ethnically diverse county in the United States. We plan to adjust and expand our recruitment strategies for cohort studies of the Consortium to help meet national goals; we will also continue progress on a series of ancillary studies within the Consortium designed to detect and treat pancreatic diseases. In addition, we propose new studies to develop prediction models for diabetes in chronic pancreatitis, interrogate the role of digestive enzyme insufficiency in this form of diabetes, and develop novel imaging-based methods for early pancreatic cancer detection that will, in turn, decrease the morbidity of pancreatic cancer.","Greater Los Angeles Clinical Center of the Consortium for the Study of Chronic Pancreatitis, Diabetes and Pancreatic Cancer",10263513,U01DK108314,"['Adult', 'Ancillary Study', 'Area', 'Artificial Intelligence', 'Biological Assay', 'California', 'Cancer Detection', 'Child', 'Childhood', 'Chronic Phase', 'Clinical', 'Clinical Management', 'Clinical Research', 'Clinical Treatment', 'Clinical Trials', 'Clinical Trials Data Monitoring Committees', 'Cohort Studies', 'Collaborations', 'Complex', 'County', 'Development', 'Diabetes Mellitus', 'Diagnosis', 'Diagnostic', 'Early Diagnosis', 'Enzymes', 'Exocrine pancreas', 'Exocrine pancreatic insufficiency', 'Functional disorder', 'Future', 'Genetic Predisposition to Disease', 'Goals', 'Health system', 'Healthcare Systems', 'Human', 'Institutes', 'Leadership', 'Los Angeles', 'Malignant neoplasm of pancreas', 'Medical center', 'Methods', 'Modeling', 'Morbidity - disease rate', 'National Cancer Institute', 'National Institute of Diabetes and Digestive and Kidney Diseases', 'Natural History', 'Non-Insulin-Dependent Diabetes Mellitus', 'Pancreatic Diseases', 'Pancreatic Ductal Adenocarcinoma', 'Pancreatic enzyme', 'Pancreatitis', 'Pathogenicity', 'Patients', 'Pharmacologic Substance', 'Principal Investigator', 'Public Health', 'Recurrence', 'Research', 'Research Personnel', 'Resources', 'Risk Factors', 'Role', 'Series', 'Site', 'Techniques', 'United States', 'United States National Institutes of Health', 'Universities', 'X-Ray Computed Tomography', 'acute pancreatitis', 'base', 'blood glucose regulation', 'chronic pancreatitis', 'clinical center', 'design', 'disorder risk', 'epidemiology study', 'ethnic diversity', 'imaging modality', 'liquid biopsy', 'novel', 'novel diagnostics', 'organizational structure', 'participant retention', 'predictive modeling', 'premalignant', 'recruit', 'response', 'study population', 'treatment trial', 'working group']",NIDDK,CEDARS-SINAI MEDICAL CENTER,U01,2020,90342,90419233,0.1310871455183931
"Greater Los Angeles Clinical Center of the Consortium for the Study of Chronic Pancreatitis, Diabetes and Pancreatic Cancer This is an application for renewal of Clinical Center designation of the Consortium for the Study of Chronic Pancreatitis, Diabetes, and Pancreatic Cancer (CPDPC). The Greater Los Angeles Clinical Center has provided considerable leadership in the organization and progress of the CPDPC. Dr. Pandol serves as co-chair of the Steering Committee and Dr. Goodarzi co-chairs the Type 3c Working Group. We have excelled in recruitment and retention of participants in the cohort studies implemented through the CPDPC designed to elucidate the natural history and develop means of diagnosis, treatment and clinical management of chronic pancreatitis (CP) and its complications in children and adults, and to determine the pathogenic interrelationships of diabetes and pancreatic cancer and develop the means of early diagnosis and management of pancreatic cancer. In addition, we have been performing a number ancillary and associated studies to support the overall goals of CPDPC, including: 1. Epidemiologic studies defining risk factors for pancreatic cancer and the natural history of CP; 2. Determining that genetic susceptibility for type 2 diabetes is a strong risk factor for diabetes associated with CP; 3. Developing liquid biopsy assays for aiding in the diagnosis of pancreatic cancer and CP; 4. Investigating mechanisms of pancreatitis and pancreatic cancer for rational pharmaceutical treatments; and 5. Conducting pilot clinical trials for treatment of recurrent acute and chronic pancreatitis. For the next phase of the CPDPC we are committed to the following Specific Aims: 1. Continue recruitment and retention of subjects in CPDPC cohort studies (PROCEED, INSPPIRE 2, NOD,  DETECT) in existing and additional study sites, as well as increase diversity in the study population. 2. Continue currently supported ancillary studies to further develop risk factor models combined with liquid  biopsy assays for early diagnosis of chronic pancreatitis and pancreatic cancer, and advance mechanism-  based treatments and clinical trials for recurrent acute and chronic pancreatitis and pancreatic cancer. 3. Build models that combine clinical features with genetic susceptibility to allow the prediction of future  development of diabetes in patients with chronic pancreatitis. 4. Determine the role of pancreatic enzyme replacement in regulating glucose homeostasis in patients with  chronic pancreatitis and diabetes, with or without pancreatic exocrine insufficiency. 5. Use existing and annotated pre-diagnostic CT scans to develop artificial intelligence-based techniques for  highly sensitive and specific methods for CT-based early pancreatic cancer detection. Our Center involves Cedars-Sinai Medical Center, UCLA Medical Center, the VA Greater Los Angeles Healthcare System and the University of Southern California/Los Angeles Public Health System with an organizational structure designed to expand recruitment into cohort studies of CPDPC with increased diversity and to facilitate our participation in ancillary studies. This is an application to renew the “Greater Los Angeles Clinical Center of the Consortium for the Study of Chronic Pancreatitis, Diabetes, and Pancreatic Cancer,” which consists of an expert team well-qualified to carry out studies of the Consortium in Los Angeles County, the most populous and ethnically diverse county in the United States. We plan to adjust and expand our recruitment strategies for cohort studies of the Consortium to help meet national goals; we will also continue progress on a series of ancillary studies within the Consortium designed to detect and treat pancreatic diseases. In addition, we propose new studies to develop prediction models for diabetes in chronic pancreatitis, interrogate the role of digestive enzyme insufficiency in this form of diabetes, and develop novel imaging-based methods for early pancreatic cancer detection that will, in turn, decrease the morbidity of pancreatic cancer.","Greater Los Angeles Clinical Center of the Consortium for the Study of Chronic Pancreatitis, Diabetes and Pancreatic Cancer",10074162,U01DK108314,"['Adult', 'Ancillary Study', 'Area', 'Artificial Intelligence', 'Biological Assay', 'California', 'Cancer Detection', 'Child', 'Childhood', 'Chronic Phase', 'Clinical', 'Clinical Management', 'Clinical Research', 'Clinical Treatment', 'Clinical Trials', 'Clinical Trials Data Monitoring Committees', 'Cohort Studies', 'Collaborations', 'Complex', 'County', 'Development', 'Diabetes Mellitus', 'Diagnosis', 'Diagnostic', 'Early Diagnosis', 'Enzymes', 'Exocrine pancreas', 'Exocrine pancreatic insufficiency', 'Functional disorder', 'Future', 'Genetic Predisposition to Disease', 'Goals', 'Health system', 'Healthcare Systems', 'Human', 'Institutes', 'Leadership', 'Los Angeles', 'Malignant neoplasm of pancreas', 'Medical center', 'Methods', 'Modeling', 'Morbidity - disease rate', 'National Cancer Institute', 'National Institute of Diabetes and Digestive and Kidney Diseases', 'Natural History', 'Non-Insulin-Dependent Diabetes Mellitus', 'Pancreatic Diseases', 'Pancreatic Ductal Adenocarcinoma', 'Pancreatic enzyme', 'Pancreatitis', 'Pathogenicity', 'Patients', 'Pharmacologic Substance', 'Principal Investigator', 'Public Health', 'Recurrence', 'Research', 'Research Personnel', 'Resources', 'Risk Factors', 'Role', 'Series', 'Site', 'Techniques', 'United States', 'United States National Institutes of Health', 'Universities', 'X-Ray Computed Tomography', 'acute pancreatitis', 'base', 'blood glucose regulation', 'chronic pancreatitis', 'clinical center', 'design', 'disorder risk', 'epidemiology study', 'ethnic diversity', 'imaging modality', 'liquid biopsy', 'novel', 'novel diagnostics', 'organizational structure', 'participant retention', 'predictive modeling', 'premalignant', 'recruit', 'response', 'study population', 'treatment trial', 'working group']",NIDDK,CEDARS-SINAI MEDICAL CENTER,U01,2020,176996,90419233,0.1310871455183931
"Multisite Electronic Health Record-based Surveillance of the Burden of Diabetes by Type in Children and Adolescents Diabetes is a common chronic disease in children and adolescents under age of 18 years. In the recent two decades, both the prevalence and incidence of type 1 diabetes (T1D) and type 2 diabetes (T2D) have been increasing considerably among US children and adolescents. T2D now accounts for ~15% of diabetes cases diagnosed in childhood and adolescence. The SEARCH for Diabetes in Youth study is the only ongoing multisite surveillance study of T1D and T2D in US children and adolescents. The SEARCH study is a population-based registry, which is a more expensive, more labor-intensive, and slower surveillance method compared with a surveillance system using electronic health records (EHRs). EHR algorithms have shown great potential in identifying diabetes cases. This study will analyze both structured EHR data (e.g., diagnosis codes, medications, and laboratory results) and unstructured clinical notes. We will apply expert knowledge, machine learning, and natural language processing to develop the best algorithms for identifying prevalent and incident T1D and T2D cases. The primary objective of this study is to establish an EHR-based surveillance system for monitoring the burden of T1D and T2D in US children and adolescents. We will collaborate with 3 EHR research networks from the National Patient-Centered Clinical Research Network (PCORnet), covering ~3 million racially, ethnically, and socioeconomically diverse children and adolescents from 4 states (IL, LA, NY, and TX) in 3 Census regions. The patient populations in this study are roughly representative of the source populations in the catchment areas. The specific aims of this study are 1) to estimate the prevalence of T1D and T2D in US children and adolescents by age, sex, race/ethnicity, and geographic region in 2019; 2) to estimate the incidence of T1D and T2D in US children and adolescents by age, sex, race/ethnicity, and geographic region in 2019; 3) to estimate 10-year trends in the prevalence and incidence of T1D and T2D in US children and adolescents by age, sex, race/ethnicity, and geographic region, 2014-2023; and 4) to compare the prevalence and incidence of diabetes by type, as well as temporal trends, in US children and adolescents with those in children and adolescents from other countries and regions. This study is innovative because it will leverage EHRs for surveillance (more efficient and cost-effective than registries and surveys), use advanced statistical approaches (e.g., machine learning and natural language processing), estimate a denominator using patient zip codes, build flexibility into the surveillance methods according to local availability of clinical notes, and use a 2-staged sampling approach to improve chart review efficiency. All 4 states in this study do not have an active diabetes surveillance system for children and adolescents and are not covered by the SEARCH study. This study will advance our understanding of the geographic, age, sex, and racial/ethnic differences in the burden of T1D and T2D in US children and adolescents. The obtained surveillance data will help identify and prioritize subpopulations for prevention of diabetes and related comorbidities to reduce health disparities. The burden of type 1 and type 2 diabetes has been increasing considerably among US children and adolescents. A population-based registry, which is expensive and labor-intensive, has provided estimates for the prevalence and incidence of type 1 and type 2 diabetes in children and adolescents from limited geographic regions in the US. This study will build an efficient and cost-effective multisite surveillance system using electronic health records covering several other geographic regions, to estimate the prevalence, incidence, and trends of type 1 and type 2 diabetes in US children and adolescents according to age, sex, race/ethnicity, and geographic region.",Multisite Electronic Health Record-based Surveillance of the Burden of Diabetes by Type in Children and Adolescents,10085447,U18DP006503,[' '],NCCDPHP,CORNELL UNIVERSITY,U18,2020,250000,91477866,0.10588731197033198
