text,title,id,project_number,terms,administration,organization,mechanism,year,cost,funding,score
"Center for Identification and Study of Individuals with Atypical Diabetes Mellitus (U54) Diabetes is traditionally classified in two broad categories: autoimmune Type 1 and obesity-related Type 2. Numerous phenotypically and etiologically distinct forms exist and are emerging, collectively termed “atypical diabetes” (AD), that do not fit into either category. We hypothesize that AD comprises a spectrum that includes numerous forms, both known (e.g, MODY/monogenic, Latent Autoimmune Diabetes of Adults, Ketosis-Prone Diabetes) and unknown. We propose to establish the Center for Atypical Diabetes Research and Evaluation (CADRE). The goals of CADRE are to (1) identify and define comprehensively the forms of AD; and (2) establish an extensive database and repository of biosamples from AD patients. Defining the forms of AD is challenging because the etiology of AD can range from a single gene variant to a highly complex mixture of genetics, epigenetics and environmental factors. To identify patients with AD, and then to define the forms, we will use a two-pronged approach. Approach (a) will use clustering analysis of genotypic and phenotypic data from diverse groups of patients with diabetes. We have recruited 15 domestic and international population cohorts with data on more than 33,000 patients with diabetes. Further, we have recruited six diabetes study clinics (Baylor College of Medicine [BCM], University of Washington [UW], Indiana University [IU], Emory University, University of Colorado, and SUNY Downstate) who will prospectively recruit patients. The Juvenile Diabetes Research Foundation will facilitate recruitment from patient groups. The Administrative Core at BCM will work with cohorts and clinics to obtain data. The University of South Florida (USF) will filter data for AD and separate patients into phenotypically homogenous clusters that can be diagnosed based on genetic and clinical features unique to the cluster. Approach (b) will identify monogenic, oligogenic and mitochondrial forms of AD from patients enrolled in genetics registries (BCM) and a family study with genetic data (Botnia). The BCM registries include patients referred to the Undiagnosed Disease Network. All patients will undergo whole-exome and mitochondrial genome sequencing (Cores at BCM), single-nucleotide polymorphism variant analysis (Oxford), metabolomic analysis (Duke) and phenotypic analysis of C-peptide, adiponectin, proinsulin, islet autoantibodies, and serum insulin DNA levels (Cores at UW and IU). To establish the database and biorepository, we will invite patients with AD to participate in sample donation and longitudinal follow-up via the cohorts and clinics. Data and samples will be transferred to the Database and Biorepository Core at USF, with input and tracking implemented using the successful framework developed by USF for large multicenter trials. Data will be made available through the NIDDK and a CADRE website and samples will be made available through ancillary study application. Ongoing patient recruitment to expand the database and biorepository will occur through the study clinics and clinician referral through the CADRE website. Overall, CADRE will be built on a foundation of existing, successful core facilities and computational systems to create a lasting resource that will substantially advance AD research. PROJECT NARRATIVE For many people with diabetes, their symptoms do not match those usually associated with type 1 or type 2 diabetes. We will use medical and genetic information from a large number of patients with diabetes to find all the forms of “atypical diabetes,” so doctors can better diagnose and treat these patients. We will also make the Center for Atypical Diabetes Research and Evaluation (CADRE) to keep data and samples from patients with atypical diabetes, so scientists can study these forms of diabetes.",Center for Identification and Study of Individuals with Atypical Diabetes Mellitus (U54),9597055,U54DK118638,"['Adult', 'Affect', 'Ancillary Study', 'Autoantibodies', 'Autoimmune Diabetes', 'Autoimmune Process', 'Biological Markers', 'C-Peptide', 'Categories', 'Characteristics', 'Classification', 'Clinic', 'Clinical', 'Clinical Protocols', 'Cluster Analysis', 'Collaborations', 'Collection', 'Colorado', 'Communication', 'Complex', 'Complex Mixtures', 'Complication', 'Core Facility', 'DNA', 'DNA Sequencing Facility', 'Data', 'Data Analyses', 'Data Storage and Retrieval', 'Databases', 'Development', 'Diabetes Mellitus', 'Diagnosis', 'Disease', 'Enrollment', 'Environmental Risk Factor', 'Epigenetic Process', 'Etiology', 'Evaluation', 'Family Study', 'Florida', 'Foundations', 'Functional disorder', 'Future', 'Genetic', 'Genome', 'Genotype', 'Goals', 'Heterogeneity', 'Immunology', 'Indiana', 'Individual', 'Insulin', 'Insulin-Dependent Diabetes Mellitus', 'International', 'Investigation', 'Longitudinal Studies', 'Medical Genetics', 'Medicine', 'Metabolic', 'Mining', 'Mission', 'Mitochondria', 'Molecular', 'Molecular Diagnosis', 'Multicenter Trials', 'National Institute of Diabetes and Digestive and Kidney Diseases', 'Natural History', 'Non-Insulin-Dependent Diabetes Mellitus', 'Obesity', 'Participant', 'Pathogenesis', 'Pathologic', 'Patient Recruitments', 'Patients', 'Phenotype', 'Physiology', 'Population', 'Proinsulin', 'Registries', 'Research', 'Research Personnel', 'Resources', 'Sampling', 'Scientist', 'Secure', 'Serum', 'Single Nucleotide Polymorphism', 'Subgroup', 'Surface', 'Symptoms', 'Syndrome', 'System', 'Therapeutic', 'Universities', 'Variant', 'Washington', 'Work', 'Youth', 'adiponectin', 'base', 'biobank', 'cohort', 'college', 'data sharing', 'database of Genotypes and Phenotypes', 'design', 'diabetes mellitus genetics', 'exome', 'follow-up', 'genetic analysis', 'genetic information', 'genetic registry', 'genetic variant', 'improved', 'insight', 'islet', 'learning strategy', 'metabolomics', 'mitochondrial genome', 'novel', 'novel diagnostics', 'novel therapeutics', 'outreach', 'patient registry', 'phenotypic data', 'polypeptide C', 'prospective', 'recruit', 'repository', 'treatment response', 'unsupervised learning', 'web site']",NIDDK,BAYLOR COLLEGE OF MEDICINE,U54,2018,2500000,323604360,0.19397155462869753
"Identification of patients with diabetes at high risk for treatment failure ﻿    DESCRIPTION (provided by applicant):  The overall goal of this project is to improve quality of care of patients with diabetes by identifying patients who may have particular difficulty reaching treatment targets and who could therefore potentially benefit from additional resources. Investigators propose to achieve this goal by developing a technology to accurately identify patients at high risk for not reaching blood glucose target to enable cost-effective implementation of resource-intensive interventions that improve glycemic control in high-risk individuals.  Improving blood glucose control in patients with diabetes could both improve their quality of life by reducing diabetes complications and decrease costs. Some patients that face particularly high barriers to glucose control may benefit from additional resources that are too expensive to apply to broad patient populations. However, it is not currently possible to identify patients at high risk not being able to reach blood glucose targets with sufficient accuracy to make these interventions cost-effective.  One reason for this is that a large fraction of critical information about the patients' functional status, social circumstances and other important factors that may present barriers to glucose control is only found in narrative documents, from which it is difficult to extract. Furthermore, the amount of information about any single patient i the medical record is enormous, and is impossible to process efficiently using standard analytical algorithms such as regression analysis.  In the proposed project investigators will combine two novel technologies - natural language processing of electronic provider notes and artificial intelligence technology Dynamic Logic - to help circumvent these challenges to build a high-accuracy model of risk of not being able to reach blood glucose targets in patients with diabetes. Natural language processing will identify key concepts documented in the provider notes and will help translate their text into a compendium of facts about the patient. Dynamic Logic makes use of a limited number of iterative approximations to reduce the complexity of a problem with multiple predictor variables from exponential to approximately linear. Utilization of Dynamic Logic will therefore allow to greatly increasing the number of factors / variables that can be considered for the models for prediction of failure to reach glucose control, and ultimately improve their accuracy. Consequently this translational multidisciplinary project will both advance our understanding of the risk factors for not being able to reach glucose control for patients with diabetes and assist in real-life implementation of interventions that can help lower their blood glucose, decrease the rate of diabetes complications, improve the patients' quality of life and help control the rising costs of healthcare.         PUBLIC HEALTH RELEVANCE:  Lowering blood glucose of patients with diabetes could both improve their quality of life and reduce healthcare costs, but may be more difficult for some patients than others. Patients who have particularly high barriers to blood glucose control could benefit from extra resources, but it can be challenging to identify them in advance. In this projec the investigators will combine advanced computational technologies including artificial intelligence and natural language processing to identify patients with diabetes at high risk for difficulty lowering blood glucose to help make commitment of additional resources cost-effective.                ",Identification of patients with diabetes at high risk for treatment failure,8902473,R41DK105612,"['Adult', 'Algorithms', 'Artificial Intelligence', 'Blood Glucose', 'Cardiovascular Diseases', 'Caring', 'Complications of Diabetes Mellitus', 'Computerized Medical Record', 'Counseling', 'Data', 'Data Analyses', 'Diabetes Mellitus', 'Diabetic Retinopathy', 'Diagnosis', 'Disease', 'Electronics', 'Epidemic', 'Face', 'Failure', 'Fee-for-Service Plans', 'Glucose', 'Glycosylated hemoglobin A', 'Goals', 'Growth', 'Guidelines', 'Health', 'Health Care Costs', 'Health Personnel', 'Healthcare', 'Incentives', 'Individual', 'Intervention', 'Kidney Failure', 'Language', 'Life', 'Life Style', 'Logic', 'Logistic Regressions', 'Medical', 'Medical Records', 'Modeling', 'Morbidity - disease rate', 'Natural Language Processing', 'Neuropathy', 'Outcome', 'Patient Care', 'Patients', 'Personal Satisfaction', 'Pharmaceutical Preparations', 'Pharmacotherapy', 'Phase', 'Prevalence', 'Process', 'Provider', 'Quality of Care', 'Quality of life', 'Regression Analysis', 'Research', 'Research Personnel', 'Resources', 'Risk', 'Risk Factors', 'Source', 'Structure', 'Techniques', 'Technology', 'Testing', 'Text', 'Translating', 'Transportation', 'Treatment Failure', 'analytical method', 'base', 'blood glucose regulation', 'combinatorial', 'commercial application', 'cost', 'cost effective', 'functional status', 'glycemic control', 'high risk', 'improved', 'mortality', 'multidisciplinary', 'new technology', 'patient population', 'public health relevance', 'social']",NIDDK,LP INFORMATION TECHNOLOGY,R41,2015,223336,0,0.13857554256776045
"Psychiatric Epidemiology: Racial Disparities among Vulnerable Populations with De DESCRIPTION (Abstract Provided by Applicant): Remarkably little is known about protective factors that reduce African Americans' risk for depression and diabetes comorbidity. In particular, the link between service use and risk reduction in African Americans has never been demonstrated with a nationally representative sample, particularly one that also takes into account ethnic groups' differences. The lack of research on depression and diabetes comorbidity research among African Americans is due primarily to rather small samples of Black Americans in available data sets from which to draw meaningful conclusions. The proposed research plan aims to provide a comprehensive examination of whether socioeconomic status (SES) and known risk and protective factors are correlated with reductions in the risk for comorbid depression and diabetes with special attention to low income populations in a nationally representative sample of 5,191 African Americans and Caribbean Blacks. The public health significance lies in specifying which demographic factors related to lower comorbidity risk, which will inform subsequent health social service prevention interventions and strategies. The present study plan is designed to advance knowledge and make five important contributions to the literature on depression and diabetes comorbidity among African Americans, namely by: (1) capitalizing on the strengths of a large, nationally representative data set, the National Survey of American Life [NSAL]; (2) determining whether SES is associated with reductions in the risk for the studied comorbid condition by Blacks; (3) examining the mediation effects of health insurance status on the relationship between SES and comorbid depression and diabetes conditions; (4) investigating the relative effects of comorbid status on employment outcomes for welfare recipients; and (5) describing the cultural meaning of being diagnosed with and managing health care with a comorbid diagnosis. The data analytic approaches to be used include logistic regression, multi-nominal logistic regression, and qualitative theme analyses techniques.   Comorbid depression and diabetes is recognized as a condition that is costly to the health care system and is a vital topic of public health concern. Remarkably, few investigations focus on the link between service use and risk reduction in African Americans with this comorbid condition. Moreover, no studies have demonstrated variable linkages with a nationally representative African American sample, particularly one that also takes into account ethnic groups' differences until this one. The Surgeon General's report (2001), ""Mental Health: Culture, Race, and Ethnicity - A supplement to mental health,"" highlighted understanding the protective and risk factors for comorbid conditions among Blacks, as an emergent public health research priority",Psychiatric Epidemiology: Racial Disparities among Vulnerable Populations with De,8687991,K22MD003934,"['Accounting', 'Address', 'Adult', 'African American', 'African Caribbean', 'Age', 'American', 'Attention', 'Award', 'Career Transition Award', 'Client', 'Comorbidity', 'Complement', 'Cultural Diversity', 'Data', 'Data Set', 'Demographic Factors', 'Diabetes Mellitus', 'Diagnosis', 'Employment', 'Employment Status', 'Enrollment', 'Epidemiologic Studies', 'Epidemiology', 'Ethnic Origin', 'Ethnic group', 'Exclusion Criteria', 'Gender', 'Goals', 'Health', 'Health Insurance', 'Health Services', 'Health Services Research', 'Health Status', 'Healthcare', 'Healthcare Systems', 'Income', 'Inequality', 'Insurance Coverage', 'Interview', 'Investigation', 'Knowledge', 'Learning', 'Life', 'Link', 'Literature', 'Logistic Regressions', 'Low Income Population', 'Low income', 'Mediation', 'Medicaid', 'Mental Depression', 'Mental Health', 'Methods', 'Minority Groups', 'Outcome', 'Participant', 'Perception', 'Persons', 'Phase', 'Plant Roots', 'Population Heterogeneity', 'Prevention strategy', 'Preventive Intervention', 'Provider', 'Public Assistance', 'Public Health', 'Race', 'Relative (related person)', 'Reporting', 'Research', 'Research Priority', 'Respondent', 'Risk', 'Risk Factors', 'Risk Reduction', 'Role', 'Sampling', 'Services', 'Social Health Services', 'Social Welfare', 'Social Work', 'Socioeconomic Status', 'Specific qualifier value', 'Structure', 'Surgeon', 'Surveys', 'System', 'Techniques', 'Testing', 'Training Activity', 'Treatment outcome', 'Uninsured', 'Vulnerable Populations', 'Work', 'abstracting', 'design', 'ethnic minority population', 'expectation', 'experience', 'health disparity', 'improved', 'inclusion criteria', 'information gathering', 'insight', 'instrument', 'interest', 'programs', 'public health research', 'racial and ethnic', 'racial difference', 'trend']",NIMHD,STATE UNIVERSITY OF NEW YORK AT ALBANY,K22,2014,192912,9804373,0.1717769786654937
"Psychiatric Epidemiology: Racial Disparities among Vulnerable Populations with De DESCRIPTION (Abstract Provided by Applicant): Remarkably little is known about protective factors that reduce African Americans' risk for depression and diabetes comorbidity. In particular, the link between service use and risk reduction in African Americans has never been demonstrated with a nationally representative sample, particularly one that also takes into account ethnic groups' differences. The lack of research on depression and diabetes comorbidity research among African Americans is due primarily to rather small samples of Black Americans in available data sets from which to draw meaningful conclusions. The proposed research plan aims to provide a comprehensive examination of whether socioeconomic status (SES) and known risk and protective factors are correlated with reductions in the risk for comorbid depression and diabetes with special attention to low income populations in a nationally representative sample of 5,191 African Americans and Caribbean Blacks. The public health significance lies in specifying which demographic factors related to lower comorbidity risk, which will inform subsequent health social service prevention interventions and strategies. The present study plan is designed to advance knowledge and make five important contributions to the literature on depression and diabetes comorbidity among African Americans, namely by: (1) capitalizing on the strengths of a large, nationally representative data set, the National Survey of American Life [NSAL]; (2) determining whether SES is associated with reductions in the risk for the studied comorbid condition by Blacks; (3) examining the mediation effects of health insurance status on the relationship between SES and comorbid depression and diabetes conditions; (4) investigating the relative effects of comorbid status on employment outcomes for welfare recipients; and (5) describing the cultural meaning of being diagnosed with and managing health care with a comorbid diagnosis. The data analytic approaches to be used include logistic regression, multi-nominal logistic regression, and qualitative theme analyses techniques.  Project Narrative Comorbid depression and diabetes is recognized as a condition that is costly to the health care system and is a vital topic of public health concern. Remarkably, few investigations focus on the link between service use and risk reduction in African Americans with this comorbid condition. Moreover, no studies have demonstrated variable linkages with a nationally representative African American sample, particularly one that also takes into account ethnic groups' differences until this one. The Surgeon General's report (2001), ""Mental Health: Culture, Race, and Ethnicity - A supplement to mental health,"" highlighted understanding the protective and risk factors for comorbid conditions among Blacks, as an emergent public health research priority",Psychiatric Epidemiology: Racial Disparities among Vulnerable Populations with De,8521365,K22MD003934,"['Accounting', 'Address', 'Adult', 'African American', 'African Caribbean', 'Age', 'American', 'Attention', 'Award', 'Career Transition Award', 'Client', 'Comorbidity', 'Complement', 'Cultural Diversity', 'Data', 'Data Set', 'Demographic Factors', 'Diabetes Mellitus', 'Diagnosis', 'Employment', 'Employment Status', 'Enrollment', 'Epidemiologic Studies', 'Epidemiology', 'Ethnic Origin', 'Ethnic group', 'Exclusion Criteria', 'Gender', 'Goals', 'Health', 'Health Insurance', 'Health Services', 'Health Services Research', 'Health Status', 'Healthcare', 'Healthcare Systems', 'Income', 'Inequality', 'Insurance Coverage', 'Interview', 'Investigation', 'Knowledge', 'Learning', 'Life', 'Link', 'Literature', 'Logistic Regressions', 'Low Income Population', 'Low income', 'Mediation', 'Medicaid', 'Mental Depression', 'Mental Health', 'Methods', 'Minority Groups', 'Outcome', 'Participant', 'Perception', 'Persons', 'Phase', 'Plant Roots', 'Population Heterogeneity', 'Prevention strategy', 'Preventive Intervention', 'Provider', 'Public Assistance', 'Public Health', 'Race', 'Relative (related person)', 'Reporting', 'Research', 'Research Priority', 'Respondent', 'Risk', 'Risk Factors', 'Risk Reduction', 'Role', 'Sampling', 'Services', 'Social Health Services', 'Social Welfare', 'Social Work', 'Socioeconomic Status', 'Specific qualifier value', 'Structure', 'Surgeon', 'Surveys', 'System', 'Techniques', 'Testing', 'Training Activity', 'Treatment outcome', 'Uninsured', 'Vulnerable Populations', 'Work', 'abstracting', 'design', 'ethnic minority population', 'expectation', 'experience', 'health disparity', 'improved', 'inclusion criteria', 'information gathering', 'insight', 'instrument', 'interest', 'programs', 'public health research', 'racial and ethnic', 'racial difference', 'trend']",NIMHD,STATE UNIVERSITY OF NEW YORK AT ALBANY,K22,2013,180373,9804373,0.17329708070686264
