text,title,id,project_number,terms,administration,organization,mechanism,year,cost,funding,score
"Chronic Inflammation and Type 2 Diabetes: A Multi-omics Approach ABSTRACT The etiology of type 2 diabetes (T2D) likely involves a complex interaction of polygenic, metabolic, and environmental factors including diet. Accumulating experimental, epidemiological, and clinical evidence supports a pathogenic role of chronic inflammation in T2D development. However, the precise mechanisms underlying these findings are largely unknown, and current evidence on the causal relationships between specific inflammatory pathways and T2D risk is inconclusive. Advances in omics technologies have led to the identification of genes and metabolites associated with T2D risk, but data on mechanisms and causality are still very limited. Multi-omics integration in the framework of systems epidemiology may provide new avenues to enhance our understanding of disease mechanisms. To systematically investigate the relation between chronic inflammation and T2D, I propose to examine 3 Specific Aims by leveraging the rich resources in the UK Biobank, Nurses’ Health Studies (NHS), Health Professional Follow-up Study (HPFS), Hispanic Community Health Study/Study of Latinos (SOL), and Genotype-Tissue Expression project (GTEx). In Aim 1 [K99], I will integrate existing genomic data from the UK Biobank, NHS/HPFS, SOL, and transcriptomic data in the GTEx to examine shared genetic architectures between systemic inflammatory markers and T2D and whether polygenic susceptibility to chronic inflammation confers T2D risk. Meanwhile, I will receive extensive training in T2D systems biology and cutting-edge high-dimensional data analytics and bioinformatics. In Aim 2 [R00], I will integrate dietary and metabolomic data to examine metabolomic profiles mediating the association between dietary inflammatory potentials and T2D risk in the prospective NHS/HPFS and the SOL. In Aim 3 [R00], I will conduct plasma proteomic profiling in a nested case-control study within the NHS to identify inflammatory protein networks in relation to T2D risk, and as a Secondary Aim, integrate findings from Aim 1-3 to explore T2D-related pathways co-regulating at multiple biological dimensions. Findings from this project may improve the understanding of inflammatory mechanisms underlying T2D and identify novel targets/pathways suitable for early detection and prevention. I will be mentored/advised by an interdisciplinary team that includes Dr. JoAnn Manson (diabetes epidemiologist), Dr. Liming Liang (expert in statistical omics methodologies), Dr. Frank Hu (nutritional epidemiologist), Dr. Peter Kraft, (statistical geneticist), Dr. Qibin Qi (genetic epidemiologist), Dr. Towia Libermann (expert in proteomics), and Dr. Clary Clish (expert in metabolomics). The outstanding training opportunities with key leaders in these areas will provide me advanced knowledge and skills, positioning me for a successful, independent career as a diabetes epidemiologist with expertise in systems biology and integrated-omics. This project aligns with the NIDDK’s goal of integrating multi-omics technologies into diabetes research. PROJECT NARRATIVE This project seeks to systematically examine the relationship between chronic inflammation and type 2 diabetes (T2D) by incorporating multi-omics data from several large prospective cohort studies. The proposed research will yield novel evidence on the biological mechanisms underlying the relationship between chronic inflammation and T2D risk. Novel pathways, and specific genes, proteins, and metabolites identified in this research will serve as the critical first steps for future development of biomarkers and therapeutic targets for T2D prevention and treatment.",Chronic Inflammation and Type 2 Diabetes: A Multi-omics Approach,9805982,K99DK122128,"['Adult', 'Affect', 'Applications Grants', 'Area', 'Bioinformatics', 'Biological', 'C-reactive protein', 'Cardiovascular Diseases', 'Chronic', 'Clinical', 'Complex', 'Data', 'Data Analytics', 'Development', 'Diabetes Mellitus', 'Diabetes prevention', 'Diet', 'Dietary Assessment', 'Dimensions', 'Disease', 'Early Diagnosis', 'Environmental Risk Factor', 'Epidemiologist', 'Epidemiology', 'Etiology', 'Follow-Up Studies', 'Food', 'Future', 'Gene Proteins', 'Genes', 'Genetic', 'Genetic Predisposition to Disease', 'Genomics', 'Genotype-Tissue Expression Project', 'Goals', 'Health Professional', 'Hispanic Community Health Study/Study of Latinos', 'IL6 gene', 'Inflammation', 'Inflammatory', 'Intake', 'Interleukin-6', 'Kidney Diseases', 'Knowledge', 'Limes', 'Machine Learning', 'Mediating', 'Mentors', 'Metabolic', 'Methodology', 'Methods', 'Modeling', 'Multiomic Data', 'National Institute of Diabetes and Digestive and Kidney Diseases', 'Nested Case-Control Study', 'Non-Insulin-Dependent Diabetes Mellitus', 'Nurses&apos', ' Health Study', 'Nutritional', 'Pathogenicity', 'Pathway interactions', 'Patient Self-Report', 'Pattern', 'Phenotype', 'Physiological', 'Pilot Projects', 'Plasma', 'Positioning Attribute', 'Predisposition', 'Prevention', 'Prospective cohort study', 'Proteins', 'Proteome', 'Proteomics', 'Public Health', 'Qi', 'Regulator Genes', 'Regulatory Element', 'Research', 'Research Design', 'Research Personnel', 'Resources', 'Retinal Diseases', 'Risk', 'Risk Factors', 'Role', 'Study of Latinos', 'System', 'Systems Biology', 'TNFRSF1A gene', 'Technology', 'Training', 'White Blood Cell Count procedure', 'Work', 'adiponectin', 'base', 'biobank', 'biomarker development', 'cardiometabolism', 'career', 'case control', 'cohort', 'cytokine', 'diabetes risk', 'disorder prevention', 'genetic architecture', 'genomic data', 'high dimensionality', 'i(19)', 'improved', 'indexing', 'inflammatory marker', 'innovation', 'metabolome', 'metabolomics', 'mortality', 'multidimensional data', 'multiple omics', 'novel', 'novel marker', 'prospective', 'protein metabolite', 'response', 'skills', 'therapeutic target', 'training opportunity', 'transcriptome', 'transcriptomics', 'whole genome']",NIDDK,HARVARD SCHOOL OF PUBLIC HEALTH,K99,2019,91499,146629556,0.12108453640564172
"Resource Curation and Evaluation for EHR Note Comprehension Title: Resource Curation and Evaluation for EHR Note Comprehension The American Diabetes Association estimates that over 25.8 million Americans have diabetes. Proper patient self-management is perhaps the most critical and under-exercised element for patients to achieve appropriate glycemic control and thus mitigate complications and comorbid conditions, and implement appropriate preventive strategies (e.g., vaccines, exercise, healthy diet). In previous work we have shown that educating patients by using content in their medical records improved diabetes outcomes and that NoteAid, a multi- module natural language processing system that links medical jargon in electronic health records to definitions, has improved self-reported comprehension. Here we propose to develop NoteAid with a high-quality resource of expert-curated lay definitions and evaluation methods for diabetes patients’ note comprehension. ! ! Title: Resource Curation and Evaluation for EHR Note Comprehension The American Diabetes Association estimates that over 25.8 million Americans have diabetes. In previous work we have shown that educating patients by using content in their medical records improved diabetes outcomes and that NoteAid, a natural language processing system that links medical jargon in electronic health records to definitions, has improved self-reported comprehension. Here we propose to develop NoteAid with a high-quality resource of expert-curated lay definitions and evaluation methods for diabetes patients’ note comprehension. ! !",Resource Curation and Evaluation for EHR Note Comprehension,9794757,R01LM012817,"['Adult', 'Age', 'American', 'Artificial Intelligence', 'Attitude', 'Back', 'Behavior', 'Caregivers', 'Caring', 'Characteristics', 'Clinical', 'Cognitive', 'Communication', 'Comorbidity', 'Complex', 'Comprehension', 'Country', 'Data Science', 'Diabetes Mellitus', 'Diagnosis', 'Disease', 'Education', 'Electronic Health Record', 'Elements', 'Ethnic Origin', 'Evaluation', 'Exercise', 'Eye diseases', 'General Population', 'Health', 'Healthcare', 'Heart Diseases', 'Hospitals', 'Individual', 'Informatics', 'Internet', 'Intervention', 'Kidney Diseases', 'Knowledge', 'Language', 'Learning', 'Libraries', 'Link', 'Machine Learning', 'Massachusetts', 'Measurement', 'Mechanics', 'Medical', 'Medical Records', 'Medical Students', 'Methods', 'Modeling', 'Natural Language Processing', 'Nursing Students', 'Ontology', 'Outcome', 'Patient Education', 'Patient Self-Report', 'Patients', 'Physicians', 'Prevention strategy', 'Questionnaires', 'Race', 'Randomized', 'Reading', 'Resources', 'Risk', 'Self Management', 'Speed', 'Supervision', 'System', 'Techniques', 'Testing', 'Time', 'Trust', 'United States National Institutes of Health', 'Universities', 'Vaccines', 'Visual Aid', 'Vocabulary', 'Work', 'base', 'care outcomes', 'clinically relevant', 'cost', 'deep learning', 'design', 'diabetic patient', 'glycemic control', 'good diet', 'improved', 'innovation', 'instrument', 'response', 'sex', 'skills', 'usability']",NLM,UNIVERSITY OF MASSACHUSETTS LOWELL,R01,2019,337238,7208224,0.2409076389704429
"Center for Identification and Study of Individuals with Atypical Diabetes Mellitus (U54) Diabetes is traditionally classified in two broad categories: autoimmune Type 1 and obesity-related Type 2. Numerous phenotypically and etiologically distinct forms exist and are emerging, collectively termed “atypical diabetes” (AD), that do not fit into either category. We hypothesize that AD comprises a spectrum that includes numerous forms, both known (e.g, MODY/monogenic, Latent Autoimmune Diabetes of Adults, Ketosis-Prone Diabetes) and unknown. We propose to establish the Center for Atypical Diabetes Research and Evaluation (CADRE). The goals of CADRE are to (1) identify and define comprehensively the forms of AD; and (2) establish an extensive database and repository of biosamples from AD patients. Defining the forms of AD is challenging because the etiology of AD can range from a single gene variant to a highly complex mixture of genetics, epigenetics and environmental factors. To identify patients with AD, and then to define the forms, we will use a two-pronged approach. Approach (a) will use clustering analysis of genotypic and phenotypic data from diverse groups of patients with diabetes. We have recruited 15 domestic and international population cohorts with data on more than 33,000 patients with diabetes. Further, we have recruited six diabetes study clinics (Baylor College of Medicine [BCM], University of Washington [UW], Indiana University [IU], Emory University, University of Colorado, and SUNY Downstate) who will prospectively recruit patients. The Juvenile Diabetes Research Foundation will facilitate recruitment from patient groups. The Administrative Core at BCM will work with cohorts and clinics to obtain data. The University of South Florida (USF) will filter data for AD and separate patients into phenotypically homogenous clusters that can be diagnosed based on genetic and clinical features unique to the cluster. Approach (b) will identify monogenic, oligogenic and mitochondrial forms of AD from patients enrolled in genetics registries (BCM) and a family study with genetic data (Botnia). The BCM registries include patients referred to the Undiagnosed Disease Network. All patients will undergo whole-exome and mitochondrial genome sequencing (Cores at BCM), single-nucleotide polymorphism variant analysis (Oxford), metabolomic analysis (Duke) and phenotypic analysis of C-peptide, adiponectin, proinsulin, islet autoantibodies, and serum insulin DNA levels (Cores at UW and IU). To establish the database and biorepository, we will invite patients with AD to participate in sample donation and longitudinal follow-up via the cohorts and clinics. Data and samples will be transferred to the Database and Biorepository Core at USF, with input and tracking implemented using the successful framework developed by USF for large multicenter trials. Data will be made available through the NIDDK and a CADRE website and samples will be made available through ancillary study application. Ongoing patient recruitment to expand the database and biorepository will occur through the study clinics and clinician referral through the CADRE website. Overall, CADRE will be built on a foundation of existing, successful core facilities and computational systems to create a lasting resource that will substantially advance AD research. PROJECT NARRATIVE For many people with diabetes, their symptoms do not match those usually associated with type 1 or type 2 diabetes. We will use medical and genetic information from a large number of patients with diabetes to find all the forms of “atypical diabetes,” so doctors can better diagnose and treat these patients. We will also make the Center for Atypical Diabetes Research and Evaluation (CADRE) to keep data and samples from patients with atypical diabetes, so scientists can study these forms of diabetes.",Center for Identification and Study of Individuals with Atypical Diabetes Mellitus (U54),9781712,U54DK118638,"['Adult', 'Affect', 'Ancillary Study', 'Autoantibodies', 'Autoimmune Diabetes', 'Autoimmune Process', 'Biological Markers', 'C-Peptide', 'Categories', 'Characteristics', 'Classification', 'Clinic', 'Clinical', 'Clinical Protocols', 'Cluster Analysis', 'Collaborations', 'Collection', 'Colorado', 'Communication', 'Complex', 'Complex Mixtures', 'Complication', 'Core Facility', 'DNA', 'DNA Sequencing Facility', 'Data', 'Data Analyses', 'Data Storage and Retrieval', 'Databases', 'Development', 'Diabetes Mellitus', 'Diagnosis', 'Disease', 'Enrollment', 'Environmental Risk Factor', 'Epigenetic Process', 'Etiology', 'Evaluation', 'Family Study', 'Florida', 'Foundations', 'Functional disorder', 'Future', 'Genetic', 'Genome', 'Genotype', 'Goals', 'Heterogeneity', 'Immunology', 'Indiana', 'Individual', 'Insulin', 'Insulin-Dependent Diabetes Mellitus', 'International', 'Investigation', 'Longitudinal Studies', 'Medical Genetics', 'Medicine', 'Metabolic', 'Mining', 'Mission', 'Mitochondria', 'Molecular', 'Molecular Diagnosis', 'Multicenter Trials', 'National Institute of Diabetes and Digestive and Kidney Diseases', 'Natural History', 'Non-Insulin-Dependent Diabetes Mellitus', 'Obesity', 'Participant', 'Pathogenesis', 'Pathologic', 'Patient Recruitments', 'Patients', 'Phenotype', 'Physiology', 'Population', 'Proinsulin', 'Registries', 'Research', 'Research Personnel', 'Resources', 'Sampling', 'Scientist', 'Secure', 'Serum', 'Single Nucleotide Polymorphism', 'Subgroup', 'Surface', 'Symptoms', 'Syndrome', 'System', 'Therapeutic', 'Universities', 'Variant', 'Washington', 'Work', 'Youth', 'adiponectin', 'base', 'biobank', 'cohort', 'college', 'data sharing', 'database of Genotypes and Phenotypes', 'design', 'diabetes mellitus genetics', 'exome', 'follow-up', 'genetic analysis', 'genetic information', 'genetic registry', 'genetic variant', 'improved', 'insight', 'islet', 'learning strategy', 'metabolomics', 'mitochondrial genome', 'novel', 'novel diagnostics', 'novel therapeutics', 'outreach', 'patient registry', 'phenotypic data', 'polypeptide C', 'prospective', 'recruit', 'repository', 'treatment response', 'unsupervised learning', 'web site']",NIDDK,BAYLOR COLLEGE OF MEDICINE,U54,2019,2500000,323604360,0.19397155462869753
"Reconociendo Las Raices (Recognizing the Roots): Hispanic Ethnic Heterogeneity in Reported and Measured Hypertension and Diabetes Project Summary/Abstract The Hispanic population in the U.S. aged 65 and older has been growing rapidly and is projected to increase 5- fold between 2012 and 2050, when Hispanics are expected to make up more than 18% of the older adult population. Hypertension and diabetes are major diseases that affect a growing number of aging Hispanics and present significant health challenges to this population. Disease diagnosis is often the basis for estimating prevalence of hypertension and diabetes in the population. People of Hispanic origin, however, are at greater risk of under diagnosis because of the unique challenges they face accessing and interacting with the health care system. The main objectives of the proposed project are two-fold: 1) to obtain estimates of hypertension and diabetes prevalence for different Hispanic subpopulations, defined by ethnic origin, nativity, and time in the U.S.; and 2) to determine how sociocultural factors, health care access and utilization, and the sociomedical environment interact to influence risk for hypertension and diabetes. Data for this project come from the nationally representative Health and Retirement Study (HRS), which includes a large diverse sample of Hispanics, information on both disease diagnosis and direct assessments of disease risk, and contextual data on the social, economic, and health care environment. Multilevel modeling and logistic regression models will be used to: 1) examine the association between sociocultural factors and reported and measured disease prevalence; 2) determine if variation in health insurance and health care utilization accounts for Hispanic group differences in hypertension and diabetes; and 3) determine if variation in the sociomedical environment account for Hispanic differences in hypertension and diabetes. Results from the proposed project will offer additional insight in the determinants of health and the factors that contribute to Hispanic health disparities. Project Narrative Hypertension and diabetes are major diseases that affect a growing number of aging Hispanics and present significant health challenges to this population. This study will integrate multilevel information on sociocultural factors, health care access and utilization, and the sociomedical environment to advance understanding of the risks for developing hypertension and diabetes among older Hispanic populations. Results from the study will offer additional insight in the determinants of health and the factors that contribute to Hispanic health disparities, and will inform interventions targeted at addressing disease burden to improve quality of life among Hispanics.",Reconociendo Las Raices (Recognizing the Roots): Hispanic Ethnic Heterogeneity in Reported and Measured Hypertension and Diabetes,9436167,R36AG057949,"['Accounting', 'Address', 'Affect', 'Aging', 'Caring', 'Characteristics', 'Clinical', 'Country', 'Data', 'Diabetes Mellitus', 'Diagnosis', 'Disease', 'Economics', 'Elderly', 'Environment', 'Environmental Risk Factor', 'Ethnic Origin', 'Face', 'Health', 'Health Insurance', 'Health Promotion', 'Health Services Accessibility', 'Health and Retirement Study', 'Healthcare', 'Healthcare Systems', 'Heterogeneity', 'Hispanics', 'Hypertension', 'Immigrant', 'Individual', 'Insurance Coverage', 'Intervention', 'Language', 'Lead', 'Life', 'Linguistics', 'Logistic Regressions', 'Measurement', 'Measures', 'Medical', 'Modeling', 'National Institute on Aging', 'Outcome', 'Physical environment', 'Plant Roots', 'Population', 'Population Heterogeneity', 'Prevalence', 'Puerto Rican', 'Quality of life', 'Reporting', 'Research', 'Risk', 'Sampling', 'Social Environment', 'Source', 'Subgroup', 'Time', 'Variant', 'Vulnerable Populations', 'age related', 'burden of illness', 'disease diagnosis', 'disorder risk', 'health care quality', 'health care service utilization', 'health disparity', 'human old age (65+)', 'improved', 'insight', 'multilevel analysis', 'segregation', 'social', 'social disparities', 'socioeconomic disadvantage']",NIA,UNIVERSITY OF SOUTHERN CALIFORNIA,R36,2018,72343,324592664,0.2023496185018565
"Resource Curation and Evaluation for EHR Note Comprehension Title: Resource Curation and Evaluation for EHR Note Comprehension The American Diabetes Association estimates that over 25.8 million Americans have diabetes. Proper patient self-management is perhaps the most critical and under-exercised element for patients to achieve appropriate glycemic control and thus mitigate complications and comorbid conditions, and implement appropriate preventive strategies (e.g., vaccines, exercise, healthy diet). In previous work we have shown that educating patients by using content in their medical records improved diabetes outcomes and that NoteAid, a multi- module natural language processing system that links medical jargon in electronic health records to definitions, has improved self-reported comprehension. Here we propose to develop NoteAid with a high-quality resource of expert-curated lay definitions and evaluation methods for diabetes patients’ note comprehension. ! ! Title: Resource Curation and Evaluation for EHR Note Comprehension The American Diabetes Association estimates that over 25.8 million Americans have diabetes. In previous work we have shown that educating patients by using content in their medical records improved diabetes outcomes and that NoteAid, a natural language processing system that links medical jargon in electronic health records to definitions, has improved self-reported comprehension. Here we propose to develop NoteAid with a high-quality resource of expert-curated lay definitions and evaluation methods for diabetes patients’ note comprehension. ! !",Resource Curation and Evaluation for EHR Note Comprehension,9670540,R01LM012817,"['AIDS education', 'Adult', 'Age', 'American', 'Artificial Intelligence', 'Attitude', 'Back', 'Behavior', 'Caregivers', 'Caring', 'Characteristics', 'Clinical', 'Cognitive', 'Communication', 'Comorbidity', 'Complex', 'Comprehension', 'Country', 'Data Science', 'Diabetes Mellitus', 'Diagnosis', 'Disease', 'Education', 'Electronic Health Record', 'Elements', 'Ethnic Origin', 'Evaluation', 'Exercise', 'Eye diseases', 'General Population', 'Health', 'Healthcare', 'Heart Diseases', 'Hospitals', 'Individual', 'Informatics', 'Internet', 'Intervention', 'Kidney Diseases', 'Knowledge', 'Language', 'Learning', 'Libraries', 'Link', 'Machine Learning', 'Massachusetts', 'Measurement', 'Mechanics', 'Medical', 'Medical Records', 'Medical Students', 'Methods', 'Modeling', 'Natural Language Processing', 'Nursing Students', 'Ontology', 'Outcome', 'Patient Education', 'Patient Self-Report', 'Patients', 'Physicians', 'Prevention strategy', 'Questionnaires', 'Race', 'Randomized', 'Reading', 'Resources', 'Risk', 'Self Management', 'Speed', 'Supervision', 'System', 'Techniques', 'Testing', 'Time', 'Trust', 'United States National Institutes of Health', 'Universities', 'Vaccines', 'Visual Aid', 'Vocabulary', 'Work', 'base', 'care outcomes', 'clinically relevant', 'cost', 'deep learning', 'design', 'diabetic patient', 'glycemic control', 'good diet', 'improved', 'innovation', 'instrument', 'response', 'sex', 'skills', 'usability']",NLM,UNIVERSITY OF MASSACHUSETTS LOWELL,R01,2018,370291,7208224,0.2409076389704429
