text,title,id,project_number,terms,administration,organization,mechanism,year,cost,funding,score
"Multisite Electronic Health Record-Based Surveillance of the Burden of Diabetes by Type in Young Adults Approximately 3 million young adults aged 18-44 years currently have diabetes in the United States. This number is projected to increase to ~5.8 million by 2060. Differentiating diabetes types is crucial, because the etiology, treatments, and outcomes of diabetes differ substantially by type. Type 1 diabetes (T1D) accounts for ~17% and type 2 diabetes (T2D) ~75% of total diabetes in US young adults. This distribution of diabetes types continuously evolves. We do not have a large-scale surveillance system to monitor the prevalence and incidence of T1D and T2D in US young adults. The widespread use and increasing functionality of electronic health record (EHR) systems substantially increase the quantity, breadth, and timeliness of data available for surveillance and reduce costs compared with population-based registries and surveys. EHR algorithms have shown great potential in identifying diabetes cases. This study will analyze both structured EHR data (e.g., diagnosis codes, medications, and laboratory results) and unstructured clinical notes. We will apply expert knowledge, machine learning, and natural language processing to develop the best algorithms for identifying prevalent and incident T1D and T2D cases. The primary objective of this study is to establish an EHR-based surveillance system for monitoring the burden of T1D and T2D in US young adults. We will collaborate with 3 EHR research networks from the National Patient-Centered Clinical Research Network (PCORnet), covering ~6 million racially, ethnically, and socioeconomically diverse young adults from 4 states (IL, LA, NY, and TX) in 3 Census regions. The patient populations in this study are roughly representative of the source populations in the catchment areas. The specific aims of this study are 1) to estimate the prevalence of T1D and T2D in US young adults by age, sex, race/ethnicity, and geographic region in 2019; 2) to estimate the incidence of T1D and T2D in US young adults by age, sex, race/ethnicity, and geographic region in 2019; 3) to estimate 10-year trends in the prevalence and incidence of T1D and T2D in US young adults by age, sex, race/ethnicity, and geographic region, 2014-2023; and 4) to compare the prevalence and incidence of diabetes by type, as well as temporal trends, in US young adults with those in young adults from other countries and regions. This study is innovative, because it will detect a false negative rate as low as 0.2%, leverage EHRs for surveillance (more efficient and cost-effective than registries and surveys), use advanced statistical approaches (e.g., machine learning and natural language processing), estimate a denominator using patient zip codes, build flexibility into the surveillance methods according to local availability of clinical notes, and use a 2-staged sampling approach to improve chart review efficiency. This study will advance our understanding of the age, sex, racial/ethnic, and geographic differences in the burden of T1D and T2D in US young adults. The obtained surveillance data will inform planning for healthcare needs, prioritize the allocation of healthcare resources, and reduce health disparities via identifying and prioritizing subpopulations for prevention of diabetes and related comorbidities. The burden of diabetes has been increasing considerably in recent decades in US young adults. However, there is no large-scale surveillance system for monitoring the burden of diabetes by type in US young adults. This study will build an efficient and cost-effective multisite surveillance system using electronic health records, to estimate the prevalence, incidence, and temporal trends of type 1 and type 2 diabetes in US young adults according to age, sex, race/ethnicity, and geographic region.",Multisite Electronic Health Record-Based Surveillance of the Burden of Diabetes by Type in Young Adults,10085448,U18DP006502,[' '],NCCDPHP,CORNELL UNIVERSITY,U18,2020,250000,91477866,0.15313827482658296
"Diabetes Treatments and Hypoglycemic-Related Adverse Events in Nursing Home Residents PROJECT SUMMARY/ABSTRACT The National Institute of Health report Diabetes in America (2018) noted that 39.5% of adults with diabetes are aged ≥ 65 years, and the prevalence of diabetes in older adults is dramatically increasing. Management of diabetes in older adults in nursing homes is challenging due to this population having heterogeneous comorbid medical conditions, and associated medications, many of which are contraindicated for common antidiabetic drugs. Intensive diabetes management in older adults is associated with an increased risk of hypoglycemia. Drug induced hypoglycemia is the 3rd most common adverse drug event among hospitalized Medicare beneficiaries. Hypoglycemia is experienced by 18% to 40% of nursing home residents. There is a lack of observational or clinical evidence pertaining to antidiabetic treatments in long-term care nursing home residents, despite this population being at high risk for diabetes, diabetes-related complications, and adverse effects of antidiabetic drugs. The American Diabetes Association’s consensus report on diabetes in older adults noted that “There are essentially no directly applicable clinical trial data on glucose control for large segments of the older diabetic patient population.” Furthermore, there are few real-world studies of antidiabetic treatments in nursing home residents. In recognition of this knowledge gap in this high-risk population, the Diabetes Mellitus Interagency Coordinating Committee, as reported in the NIDDK Recent Advances & Emerging Opportunities (2019), issued a call for studies that increase our understanding of diabetes treatments in long-term care settings, with a particular emphasis on the need to understand the impact of cognitive and functional impairments, multimorbidity, polypharmacy, and risk of hypoglycemia. These priorities are central to our proposed scope of research. Using the Federally-mandated Minimum Data Set 3.0, linked to Medicare Part A and D claims, the aims are to: 1) characterize antidiabetic treatment practices among nursing home residents; 2) identify and describe clinically relevant phenotypes of diabetic nursing home residents based on patterns of cognitive/functional impairments, comorbidities, and treatment procedures/medications, and 3) estimate the occurrence of hospitalizations (overall, hypoglycemia-related, and hypoglycemia-specific) by propensity- matched patterns of antidiabetic treatments, across resident phenotypes. We hypothesize that risks associated with antidiabetic treatments will be heterogeneous across resident phenotypes. We anticipate that the phenotypic approach we propose will serve as a foundation for future work to conduct phenotypic-specific comparative effectiveness research in support of evidence-based personalized antidiabetic treatment recommendations. PROJECT NARRATIVE Nursing home residents have a high prevalence of diabetes and high risks of diabetes complications. There is limited observational or clinical evidence supporting antidiabetic treatment decisions in long-term care nursing home residents. This study will examine the use and safety of antidiabetic treatments across subgroups (phenotypes) of older nursing home residents with diabetes.",Diabetes Treatments and Hypoglycemic-Related Adverse Events in Nursing Home Residents,9957331,R21NR019160,"['Adult', 'Adverse drug event', 'Adverse effects', 'Adverse event', 'Age Distribution', 'Age-Years', 'American', 'Americas', 'Antidiabetic Drugs', 'Area', 'Clinical', 'Clinical Research', 'Clinical Trials', 'Cognitive', 'Coin', 'Comparative Effectiveness Research', 'Complications of Diabetes Mellitus', 'Consensus', 'Data', 'Data Set', 'Data Sources', 'Diabetes Mellitus', 'Disease', 'Elderly', 'Eligibility Determination', 'Evaluation', 'Feedback', 'Fostering', 'Foundations', 'Future', 'Generations', 'Glucose', 'Goals', 'Guidelines', 'Health', 'High Prevalence', 'Home Nursing Care', 'Hospitalization', 'Hypoglycemia', 'Impaired cognition', 'Individual', 'Knowledge', 'Link', 'Long-Term Care', 'Long-Term Care Nursing', 'Longitudinal Studies', 'Machine Learning', 'Medical', 'Medicare', 'Medicare Part A', 'Medicare/Medicaid', 'Medication Management', 'Modification', 'National Institute of Diabetes and Digestive and Kidney Diseases', 'Nurses', 'Nursing Homes', 'Outcome', 'Paper', 'Patients', 'Pattern', 'Persons', 'Pharmaceutical Preparations', 'Phenotype', 'Polypharmacy', 'Population', 'Positioning Attribute', 'Prevalence', 'Price', 'Procedures', 'Public Health', 'Recommendation', 'Reporting', 'Research', 'Risk', 'Safety', 'Subgroup', 'Techniques', 'United States National Institutes of Health', 'Work', 'advanced analytics', 'adverse event risk', 'analytical method', 'base', 'beneficiary', 'blood glucose regulation', 'clinical application', 'clinically relevant', 'comorbidity', 'cost', 'crosslink', 'diabetes management', 'diabetes risk', 'diabetic', 'diabetic patient', 'evidence base', 'experience', 'functional disability', 'high risk', 'high risk population', 'human old age (65+)', 'instrument', 'multiple chronic conditions', 'novel', 'patient population', 'person centered', 'personalized medicine', 'trend', 'virtual']",NINR,UNIV OF MASSACHUSETTS MED SCH WORCESTER,R21,2020,251250,294146927,0.19661478778168653
"Resource Curation and Evaluation for EHR Note Comprehension Title: Resource Curation and Evaluation for EHR Note Comprehension The American Diabetes Association estimates that over 25.8 million Americans have diabetes. Proper patient self-management is perhaps the most critical and under-exercised element for patients to achieve appropriate glycemic control and thus mitigate complications and comorbid conditions, and implement appropriate preventive strategies (e.g., vaccines, exercise, healthy diet). In previous work we have shown that educating patients by using content in their medical records improved diabetes outcomes and that NoteAid, a multi- module natural language processing system that links medical jargon in electronic health records to definitions, has improved self-reported comprehension. Here we propose to develop NoteAid with a high-quality resource of expert-curated lay definitions and evaluation methods for diabetes patients’ note comprehension. ! ! Title: Resource Curation and Evaluation for EHR Note Comprehension The American Diabetes Association estimates that over 25.8 million Americans have diabetes. In previous work we have shown that educating patients by using content in their medical records improved diabetes outcomes and that NoteAid, a natural language processing system that links medical jargon in electronic health records to definitions, has improved self-reported comprehension. Here we propose to develop NoteAid with a high-quality resource of expert-curated lay definitions and evaluation methods for diabetes patients’ note comprehension. ! !",Resource Curation and Evaluation for EHR Note Comprehension,9925807,R01LM012817,"['Adult', 'Age', 'American', 'Artificial Intelligence', 'Attitude', 'Back', 'Behavior', 'Caregivers', 'Caring', 'Characteristics', 'Clinical', 'Cognitive', 'Communication', 'Complex', 'Comprehension', 'Country', 'Data Science', 'Diabetes Mellitus', 'Diagnosis', 'Disease', 'Education', 'Electronic Health Record', 'Elements', 'Ethnic Origin', 'Evaluation', 'Exercise', 'Eye diseases', 'General Population', 'Health', 'Healthcare', 'Heart Diseases', 'Hospitals', 'Individual', 'Informatics', 'Internet', 'Intervention', 'Kidney Diseases', 'Knowledge', 'Language', 'Learning', 'Libraries', 'Link', 'Machine Learning', 'Massachusetts', 'Measurement', 'Mechanics', 'Medical', 'Medical Records', 'Medical Students', 'Methods', 'Modeling', 'Natural Language Processing', 'Nursing Students', 'Ontology', 'Outcome', 'Patient Education', 'Patient Self-Report', 'Patients', 'Physicians', 'Prevention strategy', 'Questionnaires', 'Race', 'Randomized', 'Reading', 'Resources', 'Risk', 'Self Management', 'Speed', 'Supervision', 'System', 'Techniques', 'Testing', 'Time', 'Trust', 'United States National Institutes of Health', 'Universities', 'Vaccines', 'Visual Aid', 'Vocabulary', 'Work', 'base', 'care outcomes', 'clinically relevant', 'comorbidity', 'cost', 'deep learning', 'design', 'diabetic patient', 'glycemic control', 'good diet', 'improved', 'innovation', 'instrument', 'response', 'sex', 'skills', 'usability']",NLM,UNIVERSITY OF MASSACHUSETTS LOWELL,R01,2020,335875,7208224,0.2409076389704429
"Center for Identification and Study of Individuals with Atypical Diabetes Mellitus (U54) Diabetes is traditionally classified in two broad categories: autoimmune Type 1 and obesity-related Type 2. Numerous phenotypically and etiologically distinct forms exist and are emerging, collectively termed “atypical diabetes” (AD), that do not fit into either category. We hypothesize that AD comprises a spectrum that includes numerous forms, both known (e.g, MODY/monogenic, Latent Autoimmune Diabetes of Adults, Ketosis-Prone Diabetes) and unknown. We propose to establish the Center for Atypical Diabetes Research and Evaluation (CADRE). The goals of CADRE are to (1) identify and define comprehensively the forms of AD; and (2) establish an extensive database and repository of biosamples from AD patients. Defining the forms of AD is challenging because the etiology of AD can range from a single gene variant to a highly complex mixture of genetics, epigenetics and environmental factors. To identify patients with AD, and then to define the forms, we will use a two-pronged approach. Approach (a) will use clustering analysis of genotypic and phenotypic data from diverse groups of patients with diabetes. We have recruited 15 domestic and international population cohorts with data on more than 33,000 patients with diabetes. Further, we have recruited six diabetes study clinics (Baylor College of Medicine [BCM], University of Washington [UW], Indiana University [IU], Emory University, University of Colorado, and SUNY Downstate) who will prospectively recruit patients. The Juvenile Diabetes Research Foundation will facilitate recruitment from patient groups. The Administrative Core at BCM will work with cohorts and clinics to obtain data. The University of South Florida (USF) will filter data for AD and separate patients into phenotypically homogenous clusters that can be diagnosed based on genetic and clinical features unique to the cluster. Approach (b) will identify monogenic, oligogenic and mitochondrial forms of AD from patients enrolled in genetics registries (BCM) and a family study with genetic data (Botnia). The BCM registries include patients referred to the Undiagnosed Disease Network. All patients will undergo whole-exome and mitochondrial genome sequencing (Cores at BCM), single-nucleotide polymorphism variant analysis (Oxford), metabolomic analysis (Duke) and phenotypic analysis of C-peptide, adiponectin, proinsulin, islet autoantibodies, and serum insulin DNA levels (Cores at UW and IU). To establish the database and biorepository, we will invite patients with AD to participate in sample donation and longitudinal follow-up via the cohorts and clinics. Data and samples will be transferred to the Database and Biorepository Core at USF, with input and tracking implemented using the successful framework developed by USF for large multicenter trials. Data will be made available through the NIDDK and a CADRE website and samples will be made available through ancillary study application. Ongoing patient recruitment to expand the database and biorepository will occur through the study clinics and clinician referral through the CADRE website. Overall, CADRE will be built on a foundation of existing, successful core facilities and computational systems to create a lasting resource that will substantially advance AD research. PROJECT NARRATIVE For many people with diabetes, their symptoms do not match those usually associated with type 1 or type 2 diabetes. We will use medical and genetic information from a large number of patients with diabetes to find all the forms of “atypical diabetes,” so doctors can better diagnose and treat these patients. We will also make the Center for Atypical Diabetes Research and Evaluation (CADRE) to keep data and samples from patients with atypical diabetes, so scientists can study these forms of diabetes.",Center for Identification and Study of Individuals with Atypical Diabetes Mellitus (U54),9988405,U54DK118638,"['Adult', 'Affect', 'Ancillary Study', 'Autoantibodies', 'Autoimmune Diabetes', 'Autoimmune Process', 'Biological Markers', 'Biological Specimen Banks', 'C-Peptide', 'Categories', 'Characteristics', 'Classification', 'Clinic', 'Clinical', 'Clinical Protocols', 'Cluster Analysis', 'Collaborations', 'Collection', 'Colorado', 'Communication', 'Complex', 'Complex Mixtures', 'Complication', 'Core Facility', 'DNA', 'DNA Sequencing Facility', 'Data', 'Data Analyses', 'Data Storage and Retrieval', 'Databases', 'Development', 'Diabetes Mellitus', 'Diagnosis', 'Disease', 'Enrollment', 'Environmental Risk Factor', 'Epigenetic Process', 'Etiology', 'Evaluation', 'Family Study', 'Florida', 'Foundations', 'Functional disorder', 'Future', 'Genetic', 'Genome', 'Genotype', 'Goals', 'Heterogeneity', 'Immunology', 'Indiana', 'Individual', 'Insulin', 'Insulin-Dependent Diabetes Mellitus', 'International', 'Investigation', 'Longitudinal Studies', 'Medical Genetics', 'Medicine', 'Metabolic', 'Mining', 'Mission', 'Mitochondria', 'Molecular', 'Molecular Diagnosis', 'Multicenter Trials', 'National Institute of Diabetes and Digestive and Kidney Diseases', 'Natural History', 'Non-Insulin-Dependent Diabetes Mellitus', 'Obesity', 'Participant', 'Pathologic', 'Patient Recruitments', 'Patients', 'Phenotype', 'Physiology', 'Population', 'Proinsulin', 'Registries', 'Research', 'Research Personnel', 'Resources', 'Sampling', 'Scientist', 'Secure', 'Serum', 'Single Nucleotide Polymorphism', 'Subgroup', 'Surface', 'Symptoms', 'Syndrome', 'System', 'Therapeutic', 'Universities', 'Variant', 'Washington', 'Work', 'Youth', 'adiponectin', 'base', 'biobank', 'cohort', 'college', 'data sharing', 'database of Genotypes and Phenotypes', 'design', 'diabetes mellitus genetics', 'diabetes pathogenesis', 'diverse data', 'exome', 'follow-up', 'genetic analysis', 'genetic information', 'genetic registry', 'genetic variant', 'improved', 'insight', 'islet', 'learning strategy', 'metabolomics', 'mitochondrial genome', 'novel', 'novel diagnostics', 'novel therapeutics', 'outreach', 'patient registry', 'phenotypic data', 'prospective', 'recruit', 'treatment response', 'unsupervised learning', 'web site']",NIDDK,BAYLOR COLLEGE OF MEDICINE,U54,2020,2500000,323604360,0.19397155462869753
"Reconociendo Las Raices (Recognizing the Roots): Hispanic Ethnic Heterogeneity in Reported and Measured Hypertension and Diabetes Project Summary/Abstract The Hispanic population in the U.S. aged 65 and older has been growing rapidly and is projected to increase 5- fold between 2012 and 2050, when Hispanics are expected to make up more than 18% of the older adult population. Hypertension and diabetes are major diseases that affect a growing number of aging Hispanics and present significant health challenges to this population. Disease diagnosis is often the basis for estimating prevalence of hypertension and diabetes in the population. People of Hispanic origin, however, are at greater risk of under diagnosis because of the unique challenges they face accessing and interacting with the health care system. The main objectives of the proposed project are two-fold: 1) to obtain estimates of hypertension and diabetes prevalence for different Hispanic subpopulations, defined by ethnic origin, nativity, and time in the U.S.; and 2) to determine how sociocultural factors, health care access and utilization, and the sociomedical environment interact to influence risk for hypertension and diabetes. Data for this project come from the nationally representative Health and Retirement Study (HRS), which includes a large diverse sample of Hispanics, information on both disease diagnosis and direct assessments of disease risk, and contextual data on the social, economic, and health care environment. Multilevel modeling and logistic regression models will be used to: 1) examine the association between sociocultural factors and reported and measured disease prevalence; 2) determine if variation in health insurance and health care utilization accounts for Hispanic group differences in hypertension and diabetes; and 3) determine if variation in the sociomedical environment account for Hispanic differences in hypertension and diabetes. Results from the proposed project will offer additional insight in the determinants of health and the factors that contribute to Hispanic health disparities. Project Narrative Hypertension and diabetes are major diseases that affect a growing number of aging Hispanics and present significant health challenges to this population. This study will integrate multilevel information on sociocultural factors, health care access and utilization, and the sociomedical environment to advance understanding of the risks for developing hypertension and diabetes among older Hispanic populations. Results from the study will offer additional insight in the determinants of health and the factors that contribute to Hispanic health disparities, and will inform interventions targeted at addressing disease burden to improve quality of life among Hispanics.",Reconociendo Las Raices (Recognizing the Roots): Hispanic Ethnic Heterogeneity in Reported and Measured Hypertension and Diabetes,9616227,R36AG057949,"['Accounting', 'Address', 'Affect', 'Aging', 'Caring', 'Characteristics', 'Clinical', 'Country', 'Data', 'Diabetes Mellitus', 'Diagnosis', 'Disease', 'Economics', 'Elderly', 'Environment', 'Environmental Risk Factor', 'Ethnic Origin', 'Face', 'Health', 'Health Insurance', 'Health Promotion', 'Health and Retirement Study', 'Healthcare', 'Healthcare Systems', 'Heterogeneity', 'Hispanics', 'Hypertension', 'Immigrant', 'Individual', 'Insurance Coverage', 'Intervention', 'Language', 'Lead', 'Life', 'Linguistics', 'Logistic Regressions', 'Measurement', 'Measures', 'Medical', 'Modeling', 'National Institute on Aging', 'Outcome', 'Physical environment', 'Plant Roots', 'Population', 'Population Heterogeneity', 'Prevalence', 'Puerto Rican', 'Quality of life', 'Reporting', 'Research', 'Risk', 'Sampling', 'Social Environment', 'Source', 'Subgroup', 'Time', 'Variant', 'Vulnerable Populations', 'age related', 'burden of illness', 'disease diagnosis', 'disorder risk', 'health care availability', 'health care quality', 'health care service utilization', 'health disparity', 'human old age (65+)', 'improved', 'insight', 'multilevel analysis', 'segregation', 'social', 'social disparities', 'socioeconomic disadvantage']",NIA,UNIVERSITY OF SOUTHERN CALIFORNIA,R36,2019,73946,324592664,0.2023496185018565
