text,title,id,project_number,terms,administration,organization,mechanism,year,funding,score
"Computational modeling of 60Hz STN DBS for gait disorder in Parkinson's disease Project Summary The therapeutic gain of subthalamic deep brain stimulation (STN-DBS) for Parkinson’s disease (PD) has relied on high frequency stimulation (HFS) (e.g., 130-185Hz) to alleviate cardinal motor symptoms such as rigidity, bradykinesia and tremor, along with levodopa motor complications (e.g., motor fluctuations and dyskinesia). As the disease progresses, gait disorder, including freezing of gait, may emerge, increasing the risk of falls while limiting socialization and quality of life. Oftentimes, such symptoms are recalcitrant to dopaminergic medications and STN-DBS. Studies suggest that low frequency stimulation (60-80Hz) may improve gait in those with chronic DBS. Furthermore, we demonstrated that 60Hz STN-DBS provides gait improvement within the first year of DBS implantation. However, there is limited data on the nature of this response, in terms of what aspects of gait respond and its relation to dopaminergic medications. In addition, based on preliminary results, it is possible to use machine-learning models to identify patients who may overall benefit from 60Hz STN-DBS based solely on preoperative assessments. However, the extent to which patients’ symptoms may improve under 60Hz STN-DBS needs to be further investigated. This project aims to (1) investigate the impact of 60Hz STN-DBS on gait kinematics using wearable sensors; and (2) develop machine learning models to predict response of STN-DBS patient symptomatology at both high frequency and 60Hz based on sensor profiles of PD motor symptoms at baseline. Parkinson’s patients with gait disorder who will either be undergoing STN-DBS implantation or already have chronic bilateral STN-DBS will be recruited. We will conduct the study in two phases: Phase I – obtain baseline kinematic profile for each subject in terms of tremor, bradykinesia, and gait using objective sensor measurements in the unmedicated and levodopa-ON states. We will specifically assess gait parameters within three domains: postural sway, gait speed and rhythm (cadence), and circumduction. Phase II – participants will be evaluated in two conditions: 1) OFF medication/ON stimulation; 2) ON medication/ON stimulation. Sensor-based gait analysis will be done in 60Hz and HFS modes for each DBS electrode contact pair in the different medication states. Following data collection, statistical analysis will be performed and machine learning models will be developed to accomplish aims (1) and (2). Accordingly, this study will help determine the aspects of gait influenced by 60Hz stimulation and how it is affected by levodopa, while potentially identifying certain 60Hz responsive PD phenotypic subtypes. It will also allow for instantaneous recommendations by artificial intelligence on which stimulation frequency is best suitable for a subject based on a priori sensor measurements of motor symptoms. The ranking provided can guide clinical evaluations and programming through a sensor guided paradigm. Project Narrative    Worsening of gait and balance in Parkinson’s disease increases the risk of falls and cause a decline in quality  of life with limited effective treatment options, including deep brain stimulation (DBS). Despite this, 60Hz  Subthalamic-­Deep Brain Stimulation has emerged as a promising therapy for gait disorder. The outcome of  this study will determine and predict the aspects of gait and balance that responds to 60Hz STN-­DBS using  sensor technology and data driven modeling.        ",Computational modeling of 60Hz STN DBS for gait disorder in Parkinson's disease,9727502,R21NS111301,"['Address', 'Affect', 'Artificial Intelligence', 'Attenuated', 'Bilateral', 'Biological Markers', 'Bradykinesia', 'Chronic', 'Clinical', 'Computer Simulation', 'Data', 'Data Collection', 'Deep Brain Stimulation', 'Disease', 'Double-blind trial', 'Dyskinetic syndrome', 'Electrodes', 'Equilibrium', 'Freezing', 'Frequencies', 'Future', 'Gait', 'Gait abnormality', 'Gait speed', 'Genetic', 'Goals', 'Health', 'Institutional Review Boards', 'Investigation', 'Knowledge', 'Lead', 'Length', 'Levodopa', 'Machine Learning', 'Measurement', 'Modeling', 'Motion', 'Motor', 'Movement Disorders', 'Nature', 'Operative Surgical Procedures', 'Outcome Study', 'Parkinson Disease', 'Participant', 'Patients', 'Pharmaceutical Preparations', 'Pharmacology', 'Phase', 'Postoperative Period', 'Posture', 'Quality of life', 'Randomized', 'Recommendation', 'STN stimulation', 'Socialization', 'Statistical Data Interpretation', 'Symptoms', 'Testing', 'Therapeutic', 'Time', 'Tremor', 'base', 'disease phenotype', 'disorder subtype', 'driving force', 'effective therapy', 'fall risk', 'gait examination', 'implantation', 'improved', 'kinematics', 'motor symptom', 'predicting response', 'recruit', 'research clinical testing', 'responders and non-responders', 'response', 'sensor', 'sensor technology', 'symptomatology', 'wearable device']",NINDS,FEINSTEIN INSTITUTE FOR MEDICAL RESEARCH,R21,2019,451709,0.08523464788868414
"CRCNS: Deep Neural Network Approaches for Closed-Loop Deep Brain Stimulation The discovery that aberrant synchronization of rhythmic neuronal activity recorded in PD patients is suppressed by DBS has advanced the concept that measures associated with pathological activity may be used as biomarkers to control the delivery of DBS therapy. Pilot studies of aDBS in PD have reported promising clinical results from triggering DBS stimulation when the signal recorded from the DBS electrode showed a high level of oscillatory power in the beta frequency range (13 – 35 Hz). That approach, however, has important limitations. Most importantly, beta power recorded from the DBS lead is suppressed by movement including PD tremor, its detection is highly dependent on lead location and the recording montage needed to record during stimulation is incompatible with directional current steering, a recent innovation employing segmented stimulation contacts. The inherent complexity of the increased parameter space through DBS innovations also overwhelms standard programming techniques. Finally, use of additional biomarker signals (e.g., recorded from cortex) is likely to improve the ability to adaptively control DBS for disorders marked by complex multidimensional symptomatologies such as PD. The current proposal will establish methods for overcoming these limitations by developing techniques for multi-feature classification from ECoG recordings, using advanced machine learning algorithms. The proposed research builds upon the extensive and unique experiences with multi-day, extra-operative recording from DBS leads in patients at Charité Hospital and intraoperative ECoG and DBS recording from patients at the University of Pittsburgh, in order to develop computational methods to advance closed-loop, adaptive DBS (aDBS) strategies for movement disorders. This research seeks to improve computational methods for interpreting brain signals recorded from patients undergoing deep brain stimulation for Parkinson’s disease. The results may inform the design of novel strategies for biomarker-responsive brain stimulation.",CRCNS: Deep Neural Network Approaches for Closed-Loop Deep Brain Stimulation,10021999,R01NS110424,"['3-Dimensional', 'Affect', 'Age', 'Algorithms', 'Artificial Intelligence', 'Basal Ganglia', 'Behavior', 'Behavioral', 'Berlin', 'Biological Markers', 'Bradykinesia', 'Brain', 'Brain region', 'Cell Nucleus', 'Characteristics', 'Chronic', 'Classification', 'Clinical', 'Complex', 'Computing Methodologies', 'Custom', 'Data', 'Data Collection', 'Deep Brain Stimulation', 'Detection', 'Development', 'Disease', 'Electrocorticogram', 'Electrodes', 'Environment', 'Epilepsy', 'Evolution', 'Frequencies', 'Future', 'Goals', 'Hospitals', 'Human', 'Implant', 'Intelligence', 'Investigation', 'Joints', 'Knowledge', 'Lead', 'Life', 'Location', 'Machine Learning', 'Maps', 'Measures', 'Medicine', 'Methods', 'Modeling', 'Motor', 'Movement', 'Movement Disorders', 'Neurons', 'Neurosciences', 'Noise', 'Operative Surgical Procedures', 'Parkinson Disease', 'Parkinsonian Disorders', 'Pathologic', 'Patients', 'Performance', 'Periodicity', 'Physiological', 'Pilot Projects', 'Population', 'Procedures', 'Recurrence', 'Reporting', 'Research', 'Series', 'Severities', 'Signal Transduction', 'Specificity', 'Symptoms', 'Techniques', 'Testing', 'Therapeutic', 'Time', 'Training', 'Tremor', 'Universities', 'Validation', 'Work', 'artificial neural network', 'base', 'cohort', 'computer framework', 'deep learning', 'deep neural network', 'design', 'experience', 'implantation', 'improved', 'innovation', 'interest', 'learning strategy', 'machine learning algorithm', 'multidisciplinary', 'neuropsychiatric disorder', 'neurosurgery', 'novel', 'novel strategies', 'reconstruction', 'reduce symptoms', 'remote sensor', 'symptomatology', 'translational neuroscience']",NINDS,MASSACHUSETTS GENERAL HOSPITAL,R01,2019,228673,0.1044838449671397
"Machine-learning based control of functional electrical stimulation PROJECT SUMMARY/ABSTRACT Functional electrical stimulation involves artificial activation of paralyzed muscles with implanted electrodes and has been used successfully to improve the ability of tetraplegics to perform movements important for daily activities. The range of motor behaviors that can be generated by functional electrical stimulation, however, is limited to a relatively small set of preprogrammed movements such as hand grasp and release. A broader range of movements has not been implemented because of the substantial challenge associated with identifying the patterns of muscle stimulation needed to elicit specified movements. To address this limitation, we have developed machine-learning based algorithms that can predict patterns of muscle activity associated with a wide range of complex limb movements. In addition, we have devised a method whereby predicted patterns of muscle activity can then be transformed into stimulus pulse patterns needed to evoke movements in paralyzed limbs. Our goal for this project is to determine whether these approaches, when applied to temporarily paralyzed non-human primates, can be used to produce: 1) a wide range of movements of the hand throughout peri-personal reach space, and 2) configuration of the hand and fingers into a variety of shapes needed to interact with diverse objects in the environment. If successful, this approach would greatly expand the repertoire of motor behaviors available to individuals paralyzed because of spinal cord injury or stroke. Furthermore, this system ultimately might serve as the requisite interface between brain-derived trajectory information and functional electrical stimulation systems needed to realize a self-contained and self- controlled upper limb neuroprosthetic. PROJECT NARRATIVE The goal of this project is to develop methods to artificially activate and control paralyzed muscles with electrodes implanted in muscles. This effort will contribute to the restoration of voluntary limb movements in individuals paralyzed because of spinal cord injury or stroke.",Machine-learning based control of functional electrical stimulation,9699018,R01NS102259,"['3-Dimensional', 'Address', 'Algorithms', 'Anatomy', 'Animals', 'Back', 'Behavior', 'Brain', 'Chronic', 'Complement', 'Complex', 'Data', 'Digit structure', 'Elbow', 'Electrodes', 'Elements', 'Environment', 'Error Sources', 'Experimental Models', 'Feedback', 'Fingers', 'Forearm', 'Goals', 'Hand', 'Health Benefit', 'Human', 'Implanted Electrodes', 'Individual', 'Intramuscular', 'Joints', 'Lifting', 'Limb structure', 'Macaca mulatta', 'Machine Learning', 'Measures', 'Methods', 'Monkeys', 'Motor', 'Movement', 'Muscle', 'Muscle Contraction', 'Muscle Fatigue', 'Output', 'Paralysed', 'Patients', 'Pattern', 'Personal Space', 'Physiologic pulse', 'Quadriplegia', 'Shapes', 'Shoulder', 'Signal Transduction', 'Skeletal Muscle', 'Source', 'Specific qualifier value', 'Spinal cord injury', 'Stimulus', 'Stroke', 'System', 'Testing', 'Time', 'Training', 'Upper Extremity', 'Wrist', 'arm', 'artificial neural network', 'awake', 'base', 'brain machine interface', 'design', 'experience', 'finger movement', 'functional electrical stimulation', 'grasp', 'hand grasp', 'human subject', 'improved', 'insight', 'kinematics', 'limb movement', 'machine learning algorithm', 'neuroprosthesis', 'nonhuman primate', 'response', 'restoration', 'robotic device', 'scapula']",NINDS,UNIVERSITY OF ARIZONA,R01,2019,329650,0.050507670469934964
"DaTscan-based Disease Progression Models for Early-stage Parkinson’s Disease Project Summary Parkinson's disease (PD) is heterogeneous: it has many subtypes and the disease progresses at different rates in different subtypes. Disease progression in early-stage PD is observed as signal changes in SPECT imaging with 123I-FP-CIT, which is called DaTscan imaging, or simply DaTscan. The goal of the research proposed here is to create accurate models of heterogeneous PD progression using DaTscan images. Such models will not only provide additional insight into PD, but they are also critically important in assessing the effect of neuro-protective therapy. A new set of models called mixtures of linear dynamical systems (MLDS) are proposed to model early-state PD progression as it manifests in DaTscans. MLDS models combine machine-learning methods with linear dynamical system theory. They capture many features of early-stage PD progression: laterality, non-linear progression, as well as PD heterogeneity. Preliminary results show that, MLDS is accurate, finds progression subtypes, relates well to clinical data (MDS-UPDRS motor scores), and gives genuinely new insights about PD progression. The proposed research aims to develop the MLDS methodology in region-of-interest as well as voxel-based frameworks. A detailed discussion of the MLDS theory, model fitting, and the relation to clinical data is included. Longitudinal DaTscan images as well as MDS-UPDRS motor scores are available for over 440 subjects from the Parkinson's Progression Markers Initiative (PPMI), and this data set will be used along with MLDS to create the PD progression models. Project Narrative How Parkinson's disease (PD) progresses is poorly understood. This research proposes to develop precise disease progression models for PD using machine-learning. These models will give greater insight into PD progression and also help assess PD therapy.",DaTscan-based Disease Progression Models for Early-stage Parkinson’s Disease,9698441,R01NS107328,"['Algorithms', 'Anterior', 'Bilateral', 'Biological Models', 'Clinical', 'Clinical Data', 'Corpus striatum structure', 'Coupled', 'Coupling', 'Data', 'Data Analyses', 'Data Set', 'Disease', 'Disease Progression', 'Enrollment', 'Exhibits', 'Glean', 'Globus Pallidus', 'Goals', 'Handedness', 'Image', 'Joints', 'Left', 'Machine Learning', 'Mathematics', 'Measures', 'Methodology', 'Methods', 'Modeling', 'Motor', 'National Institute of Neurological Disorders and Stroke', 'Parkinson Disease', 'Pattern', 'Recommendation', 'Research', 'Research Design', 'Signal Transduction', 'Systems Theory', 'Work', 'base', 'disease heterogeneity', 'dopamine transporter', 'dynamic system', 'expectation', 'insight', 'interest', 'learning strategy', 'model design', 'neuron loss', 'presynaptic', 'progression marker', 'putamen', 'research clinical testing', 'single photon emission computed tomography', 'uptake']",NINDS,YALE UNIVERSITY,R01,2019,353562,0.14625340101615814
"Mid-frontal delta/theta rhythms and cognitive control in PD Abstract Up to 80% of patients with Parkinson's disease (PD) will suffer from cognitive symptoms, including impaired attention, planning, reasoning and working memory as well as hallucinations, visuospatial dysfunction, and delusions. These impairments lead to mild cognitive impairment (PD-MCI) and dementia (PDD) in PD. Cognitive symptoms of PD are associated with enormous cost to our society. There are no clear biomarkers and few effective treatments for PD-MCI/PDD. Because risk for PD increases dramatically with age, this problem will surge as our population grows older. The mechanisms contributing to PD-MCI/PDD are unknown. Our group has found that low-frequency (1-8 Hz; or delta/theta bands) brain rhythms might be helpful in diagnosing cognitive dysfunction in PD. This delta/theta activity originates from areas of medial frontal cortex such as the anterior cingulate, and is detectable by mid-frontal scalp EEG electrodes. We have found that mid-frontal delta/theta brain rhythms are engaged when healthy individuals detect novelty, errors, and conflict, or make decisions. These rhythms are attenuated in PD patients. Our working model is that PD patients manifest diverse neuronal and network deficits that impair mid-frontal delta/theta activity, leading to failures in engaging cognitive control. These abnormalities contribute to PD-MCI and PDD. In this proposal we combine `big-data' machine learning tools, intraoperative neurophysiology in humans, and new brain-stimulation paradigms to investigate the role of mid-frontal delta/theta rhythms in PD. We will test the overall hypothesis that mid-frontal delta/theta impairments are a mechanism of cognitive dysfunction in PD. In Aim 1 we will determine if mid-frontal delta/theta activity predicts PD-MCI/PDD. In Aim 2 we will use unique intraoperative recordings to determine how delta/theta activity within medial frontal cortex influences neurons in the subthalamic nucleus, a key site of functional convergence that is targeted by current deep-brain stimulation for PD. Notably, the subthalamic nucleus is a compact structure that receives highly overlapping input from cognitive and motor cortical regions, making it likely that our recordings will capture cognitive processing within this nucleus. Finally, in Aim 3 we will determine if subthalamic nucleus deep-brain stimulation at delta/theta frequencies improves cognitive control in PD patients. Because these experiments involve recordings across several PD patient populations (Aim 1), from single subthalamic neurons (Aim 2), and brain stimulation (Aim 3), each of these aims will provide independent mechanistic insight into cognitive dysfunction in PD. PD is a complex disease, but if cortical EEG abnormalities are a consistent theme it might inspire new diagnostic tools or new brain-stimulation therapies for cognitive dysfunction in PD. Results from this proposal could also be important for other neurodegenerative diseases such as dementia with Lewy bodies and Alzheimer's disease.     Public Health Relevance Cognitive symptoms of Parkinson's disease are an enormous public health problem. Here, we will ana- lyze brain rhythms that are involved in cognitive processing and also dysfunctional in Parkinson's dis- ease. We will use these brain rhythms to guide novel brain stimulation that has the potential to treat dementia and cognitive impairments in Parkinson's disease.  ",Mid-frontal delta/theta rhythms and cognitive control in PD,9730653,R01NS100849,"['Acetylcholine', 'Affect', 'Age', 'Alpha Rhythm', 'Alzheimer&apos', 's Disease', 'Anterior', 'Area', 'Attention', 'Attenuated', 'Big Data', 'Biological Markers', 'Brain', 'Cell Nucleus', 'Cognitive', 'Cognitive Therapy', 'Complex', 'Conflict (Psychology)', 'Data', 'Decision Making', 'Deep Brain Stimulation', 'Delusions', 'Dementia', 'Detection', 'Diagnosis', 'Disease', 'Dopamine', 'Electrodes', 'Electroencephalography', 'Etiology', 'Failure', 'Frequencies', 'Functional disorder', 'Genetic', 'Goals', 'Hallucinations', 'Human', 'Impaired cognition', 'Impairment', 'Individual', 'Lead', 'Lewy Body Dementia', 'Machine Learning', 'Medial', 'Memory', 'Modeling', 'Motor', 'Neurobehavioral Manifestations', 'Neurodegenerative Disorders', 'Neurons', 'Parkinson Disease', 'Parkinson&apos', 's Dementia', 'Patients', 'Performance', 'Population', 'Process', 'Public Health', 'Reaction Time', 'Risk', 'Role', 'Scalp structure', 'Short-Term Memory', 'Signal Transduction', 'Site', 'Societies', 'Structure', 'Structure of subthalamic nucleus', 'Techniques', 'Testing', 'Theta Rhythm', 'Time', 'Visuospatial', 'Work', 'alpha synuclein', 'cognitive control', 'cognitive function', 'cognitive task', 'cost', 'disorder risk', 'effective therapy', 'experimental study', 'frontal lobe', 'implantation', 'improved', 'insight', 'mild cognitive impairment', 'motor symptom', 'neuronal patterning', 'neurophysiology', 'new therapeutic target', 'novel', 'novel diagnostics', 'patient population', 'public health relevance', 'tool']",NINDS,UNIVERSITY OF IOWA,R01,2019,75097,0.16752894106296695
