text,title,id,project_number,terms,administration,organization,mechanism,year,funding,score
"Metabolomics and risk of Parkinson's Disease ﻿    DESCRIPTION (provided by applicant): Parkinson disease (PD) is the second most common neurodegenerative disease in the United States and affects over one million Americans; this number is growing due to population aging. Current treatments do not prevent the disease progression that ultimately results in severe disability. There is thus a compelling need to develop neuroprotective treatments. Because at the time of the clinical diagnosis of PD there is already substantial neuronal loss, such treatments should ideally be initiated earlier. Aims of the proposed investigation are to implement and validate a novel metabolomic approach for the identification of early changes in peripheral blood of individuals with preclinical or premotor PD. The metabolomic results will be integrated with detailed and validated information on risk factors for PD, which has been collected prospectively and periodically updated. We expect by this means to identify new clues to the etiology of PD and to identify a metabolomic signature of PD that could contribute to an early diagnosis. To achieve these goals, we will take advantage of data and blood samples collected from over 80,000 participants in three large ongoing cohorts, the Nurses' Health Study (NHS), the Health Professional Follow-up Study (HPFS), and the Cancer Prevention Study-II Nutrition, who have been followed for over 25 years for incident Parkinson disease. We expect to include a total of 805 incident cases of PD that will be matched to 805 controls, using a nested case-control design. PUBLIC HEALTH RELEVANCE: Parkinson disease is a chronic progressive disease for which there is no cure - the loss of brain cells that leads to disability develops insidiously over many years, and by the time the disease is diagnosed it is already extensive and irreversible. To identify Parkinson disease years before it becomes clinically manifest, we are proposing a novel approach that will take advantage of the peripheral blood and detailed lifestyle and medical information collected from over 80,000 individuals who were followed for up to 25 years. By comparing the blood levels of hundreds of compounds between the blood of individuals who developed Parkinson disease and the blood of individuals of the same age and sex who remained healthy, we expect to make novel discoveries on the etiology of Parkinson disease and to be able to develop a method for the early identification of Parkinson disease in other populations.",Metabolomics and risk of Parkinson's Disease,9536156,R01NS089619,"['Affect', 'Age', 'Alanine', 'American', 'Archives', 'Biological Markers', 'Blood', 'Blood specimen', 'Branched-Chain Amino Acids', 'Caffeine', 'Cancer Prevention Study II', 'Choline', 'Chronic', 'Chronic Disease', 'Clinical', 'Coffee', 'Cohort Studies', 'Confounding Factors (Epidemiology)', 'Consumption', 'Creatine', 'Cross-Sectional Studies', 'Data', 'Data Collection', 'Diabetes Mellitus', 'Diagnosis', 'Diagnostic', 'Diet', 'Disease', 'Disease Progression', 'Early Diagnosis', 'Early identification', 'Etiology', 'Event', 'Failure', 'Follow-Up Studies', 'Functional disorder', 'Funding', 'Glutamates', 'Goals', 'Health Professional', 'Incidence', 'Individual', 'Institutes', 'Insulin Resistance', 'Investigation', 'Life Style', 'Machine Learning', 'Measures', 'Mediating', 'Medical', 'Medical History', 'Metabolic', 'Metabolic Pathway', 'Methods', 'Motor', 'National Institute of Neurological Disorders and Stroke', 'Nature', 'Nerve Degeneration', 'Neurodegenerative Disorders', 'Nurses&apos', ' Health Study', 'Parkinson Disease', 'Participant', 'Patients', 'Persons', 'Phase', 'Physical activity', 'Plasma', 'Population', 'Progressive Disease', 'Research', 'Resources', 'Risk', 'Risk Factors', 'Sampling', 'Smoking', 'Specificity', 'Techniques', 'Therapeutic', 'Time', 'United States', 'United States National Institutes of Health', 'Update', 'Urate', 'Validation', 'Women&apos', 's Health Nursing', 'Work', 'acylcarnitine', 'aging population', 'base', 'brain cell', 'cancer prevention', 'case control', 'cigarette smoking', 'clinical Diagnosis', 'cohort', 'design', 'diabetes risk', 'disability', 'disorder risk', 'follow-up', 'gender difference', 'insight', 'interest', 'men', 'metabolic profile', 'metabolome', 'metabolomics', 'mitochondrial dysfunction', 'motor symptom', 'neuron loss', 'novel', 'novel strategies', 'nutrition', 'peripheral blood', 'pre-clinical', 'prospective', 'public health relevance', 'sex', 'specific biomarkers', 'tool']",NINDS,HARVARD SCHOOL OF PUBLIC HEALTH,R01,2018,563079,0.12510557442686196
"The Gut Microbiome in Parkinson Disease Project Summary/Abstract This is a first R01 application from an early stage, new investigator and current NIEHS K01 awardee. Parkinson disease (PD) is a disabling neurodegenerative disease for which there is no cure. Years before the diagnosis of PD and the onset of motor symptoms, PD patients develop non-motor symptoms, including, importantly, constipation and gastrointestinal dysfunction. Constipation affects over 80% of PD patients and is one of the strongest risk factors for PD. Recent research shows that the enteric nervous system in the gut and the dorsal motor nucleus of the vagus nerve which anatomically links the GI system to the brain, are among the first and most severely affected by alpha-synuclein pathology characteristic of PD5 leading to the hypothesis that the gastrointestinal tract might be the site of initiation of PD. We propose to conduct a comprehensive investigation of the relation between human gut microbiome and PD, focusing on the pre- onset microbiome. We will do this by building on an ongoing Department of Defense funded project that has identified participants with pre-parkinson syndrome (PPS - defined as the co- occurrence of constipation, pRBD (probable rapid eye movement sleep behavior disorder) and hyposmia) that in a pilot study has been associated with a ~200 fold increase in PD risk. Studying the microbiome among this group, who are highly likely to develop PD or are already in the premotor state, will give us a unique look at the microbiome in PD patients prior to any potential disease-associated effects of changes in diet and lifestyle that may have confounded prior case-control studies. The proposed study will take advantage of 25 years of prospectively collected data on environmental and dietary exposures and disease outcomes in two prospective cohorts of men and women. Project Narrative Our appreciation of the impact of the gut microbiome on brain health, and especially PD, is in the early stages. This study will be the first to examine the gut microbiome in participants with premotor PD and compare it to healthy controls, controls with constipation and to recently onset PD cases. This project will thus advance our understanding of how the human gut microbiome contributes to the pathophysiology of PD and will contribute to the development of tools needed for a preclinical diagnosis and/or treatment.",The Gut Microbiome in Parkinson Disease,9343057,R01NS097723,"['Affect', 'Anatomy', 'Anti-inflammatory', 'Bacteria', 'Biometry', 'Blood - brain barrier anatomy', 'Brain', 'Butyrates', 'Caffeine', 'Case-Control Studies', 'Characteristics', 'Chronic Disease', 'Confounding Factors (Epidemiology)', 'Constipation', 'Consumption', 'Data', 'Data Collection', 'Department of Defense', 'Diagnosis', 'Diet', 'Disease', 'Disease Outcome', 'Enteric Nervous System', 'Enterobacteriaceae', 'Epidemiology', 'Exhibits', 'Feces', 'Follow-Up Studies', 'Functional disorder', 'Funding', 'Gait', 'Gastrointestinal tract structure', 'Genes', 'Health Professional', 'Human', 'Individual', 'Inflammatory', 'Inflammatory disease of the intestine', 'Intestines', 'Investigation', 'Life Style', 'Link', 'Machine Learning', 'Mediating', 'Metabolic', 'Mucous Membrane', 'National Institute of Environmental Health Sciences', 'Nature', 'Neurodegenerative Disorders', 'Nurses&apos', ' Health Study', 'Onset of illness', 'Oxidative Stress', 'Parkinson Disease', 'Parkinsonian Disorders', 'Participant', 'Pathology', 'Pathway Analysis', 'Pathway interactions', 'Patients', 'Permeability', 'Pilot Projects', 'Production', 'Prospective cohort', 'Prospective cohort study', 'Proteobacteria', 'REM Sleep Behavior Disorder', 'Ralstonia', 'Reporting', 'Research', 'Research Personnel', 'Risk', 'Risk Factors', 'Site', 'Symptoms', 'Syndrome', 'System', 'Techniques', 'Update', 'Vagus nerve structure', 'Volatile Fatty Acids', 'Woman', 'alpha synuclein', 'brain health', 'cigarette smoking', 'cohort', 'disorder risk', 'dorsal motor nucleus', 'dysbiosis', 'follow-up', 'gastrointestinal', 'gut bacteria', 'gut microbiome', 'gut microbiota', 'hyposmia', 'illness length', 'men', 'microbiome', 'microbiome analysis', 'microbiome composition', 'microbiome research', 'microbiota profiles', 'motor symptom', 'non-motor symptom', 'posture instability', 'pre-clinical', 'predictive signature', 'prospective', 'stool sample', 'tool development']",NINDS,UNIVERSITY OF MASSACHUSETTS LOWELL,R01,2018,418825,0.15299258128733054
"Machine Learning-Based Control of Functional Electrical Stimulation Functional electrical stimulation involves artificial activation of paralyzed muscles with implanted electrodes and has been used successfully to improve the ability of quadriplegics to perform movements important for daily activities. The range of motor behaviors that can be generated by functional electrical stimulation, however, is limited to a relatively small set of preprogrammed movements such as hand grasp and release. A broader range of movements has not been implemented because of the substantial challenge associated with identifying the patterns of muscle stimulation needed to elicit specified movements. To address this limitation, we have developed machine-learning based algorithms that can predict patterns of muscle activity associated with a wide range of complex limb movements. In addition, we have devised a method whereby predicted patterns of muscle activity can then be transformed into stimulus pulse patterns needed to evoke movements in paralyzed limbs. Our goal for this project is to determine whether these approaches, when applied to temporarily paralyzed non-human primates, can be used to produce: 1) a wide range of movements of the hand throughout peri-personal reach space, and 2) configuration of the hand and fingers into a variety of shapes needed to interact with diverse objects in the environment. If successful, this approach would greatly expand the repertoire of motor behaviors available to individuals paralyzed because of spinal cord injury or stroke. Furthermore, this system ultimately might serve as the requisite interface between brain-derived trajectory information and functional electrical stimulation systems needed to realize a self-contained and self- controlled upper limb neuroprosthetic. The goal of this project is to develop methods to artificially activate and control paralyzed muscles with electrodes implanted in muscles. This effort will contribute to the restoration of voluntary limb movements in individuals paralyzed because of spinal cord injury or stroke.",Machine Learning-Based Control of Functional Electrical Stimulation,9436952,R56NS096064,"['3-Dimensional', 'Address', 'Algorithms', 'Anatomy', 'Animals', 'Behavior', 'Biological Neural Networks', 'Brain', 'Chronic', 'Complement', 'Complex', 'Data', 'Digit structure', 'Elbow', 'Electric Stimulation', 'Electrodes', 'Elements', 'Environment', 'Error Sources', 'Experimental Models', 'Fingers', 'Forearm', 'Goals', 'Hand', 'Health Benefit', 'Human', 'Implanted Electrodes', 'Individual', 'Intramuscular', 'Joints', 'Lifting', 'Limb structure', 'Macaca mulatta', 'Machine Learning', 'Measures', 'Methods', 'Monkeys', 'Motor', 'Movement', 'Muscle', 'Muscle Contraction', 'Paralysed', 'Patients', 'Pattern', 'Personal Space', 'Physiologic pulse', 'Quadriplegia', 'Self-control as a personality trait', 'Shapes', 'Shoulder', 'Signal Transduction', 'Skeletal Muscle', 'Source', 'Specific qualifier value', 'Spinal cord injury', 'Stimulus', 'Stroke', 'System', 'Testing', 'Time', 'Training', 'Upper Extremity', 'Wrist', 'arm', 'awake', 'base', 'brain machine interface', 'design', 'experience', 'finger movement', 'grasp', 'hand grasp', 'human subject', 'improved', 'insight', 'kinematics', 'limb movement', 'neuroprosthesis', 'nonhuman primate', 'response', 'restoration', 'robotic device', 'scapula']",NINDS,UNIVERSITY OF ARIZONA,R56,2017,371219,0.04986074456672489
"Characterizing Intrinsic Functional Cortical Networks in Parkinson Disease Dementia ﻿    DESCRIPTION (provided by applicant): Parkinson's disease (PD) affects 1% of adults over age 65. While traditionally defined by motor symptoms, up to 75% of PD patients will eventually develop PD-related dementia (PDD) making it the leading cause of nursing home placement in PD. Although there is currently no cure for PD, our ability to treat motor symptoms has advanced tremendously since the 1960's based on advances in our understanding of motor symptom neurophysiology. We propose that the treatment and prevention PDD may also prove possible by advancing our understanding of the neurophysiology underlying cognitive dysfunction. We will use modern network theory as a theoretical and mathematical framework for this endeavor. The long- term goal is to advance our understanding of the neurophysiology underlying cognitive dysfunction in PD to provide empirically testable models, clinically relevant biomarkers, and novel therapeutic targets. The central hypothesis of this proposal is that patterns of functional connectivity critical to normal cognition are disrupted by subcortical pathology in PDD. This hypothesis was formulated on the basis of our own preliminary data and other recent research. We will accomplish the objectives of this proposal through three Specific Aims: 1) Determine whether graph theory measures of network functional connectivity are associated with cognitive phenotypes in PD based on either a) the severity of cognitive dysfunction; or b) specific cognitive domains affected; 2) Develop a novel state-defining biomarker for PDD based on measures of intrinsic network functional activity using a machine learning approach; and 3) Explore the potential role of subcortical sources on cortical network activity and cognition using dynamic causal modeling (DCM). These Aims are achievable within a two-year timeframe as they will involve analyses of a single data set of resting MEG data from 25 control subjects, 25 PDD subjects, 25 PD subjects with normal cognition and 25 PD subjects with mild cognitive impairment. The feasibility of this proposal is aided by leveraging a currently funded NINDS K02 Independent Scientist Award (1 K02 NS080885-01A1). Data and biomarkers generated by this R21 Exploratory/Developmental Research Grant will provide a foundation for future studies to validate state- defining and predictive biomarkers; mechanistic studies on the role of acetylcholine and dopamine in cognition; and therapeutic studies of physiologic or pharmacologic interventions targeting physiological and regional abnormalities. The approach is innovative as the first study to apply graph theory measures to understanding the relationship of cortical physiology and cognitive dysfunction across cognitive domains and severity levels in PD; the first study to apply machine learning approaches to PDD biomarker development; and the first use of DCM to model cortical and subcortical contributions to PDD. The proposed research is significant because it will advance our understanding of the neurophysiology of PD-related cognitive dysfunction and will provide biomarkers, empiric models and therapeutic targets essential to developing more effective interventions. PUBLIC HEALTH RELEVANCE: Dementia is the leading cause of nursing home placement in Parkinson's disease (PD) yet little is known about the cause of dementia in PD and there are no effective treatments. Our preliminary data and other published studies suggest that abnormalities in brain activity involving networks important for normal thinking and memory may contribute to dementia in PD and may represent a target for future treatments. This proposal will identify abnormalities in brain activity related to dementia in PD using magnetoencephalography (MEG) to create a more complete model of the causes of PDD and to identify MEG features which may serve as diagnostic or predictive tests.",Characterizing Intrinsic Functional Cortical Networks in Parkinson Disease Dementia,9242707,R21NS093266,"['Acetylcholine', 'Adult', 'Affect', 'Algorithms', 'Automobile Driving', 'Bioinformatics', 'Biological Markers', 'Brain', 'Caregiver Burden', 'Characteristics', 'Cognition', 'Cognitive', 'Collaborations', 'Data', 'Data Analyses', 'Data Collection', 'Data Set', 'Dementia', 'Development', 'Diagnostic', 'Dopamine', 'Elderly', 'Etiology', 'Executive Dysfunction', 'Exploratory/Developmental Grant', 'Foundations', 'Frequencies', 'Functional disorder', 'Funding', 'Future', 'Goals', 'Grant', 'Impaired cognition', 'Independent Scientist Award', 'Intervention', 'Lead', 'Link', 'Machine Learning', 'Magnetoencephalography', 'Manuscripts', 'Mathematics', 'Measures', 'Memory', 'Methodology', 'Modeling', 'Modernization', 'National Institute of Neurological Disorders and Stroke', 'Nursing Homes', 'Parkinson Disease', 'Parkinson&apos', 's Dementia', 'Pathologic', 'Pathology', 'Patients', 'Pattern', 'Pharmacology', 'Phenotype', 'Physiological', 'Physiology', 'Prevention', 'Publishing', 'Research', 'Research Project Grants', 'Rest', 'Role', 'Severities', 'Source', 'Structure', 'Structure of subthalamic nucleus', 'Testing', 'Thalamic structure', 'Theoretical model', 'Therapeutic Studies', 'Thinking', 'Visuospatial', 'Work', 'base', 'biomarker development', 'causal model', 'clinically relevant', 'cognitive function', 'effective intervention', 'effective therapy', 'graph theory', 'improved', 'innovation', 'mild cognitive impairment', 'motor symptom', 'neurophysiology', 'new therapeutic target', 'novel', 'novel therapeutic intervention', 'predictive marker', 'predictive modeling', 'public health relevance', 'theories', 'therapeutic target', 'treatment response', 'validation studies']",NINDS,UNIVERSITY OF COLORADO DENVER,R21,2017,200741,0.1423336569582418
"Intrinsic Cortical Networks and Cognitive Dysfunction in Parkinson's Disease DESCRIPTION (provided by applicant): Parkinson's disease (PD) affects 1% of adults over age 65. While traditionally defined by motor symptoms, up to 75% of PD patients will eventually develop dementia making it the leading cause of nursing home placement in this population. Although there is currently no cure for PD, our ability to treat motor symptoms has advanced tremendously since the 1960's based on advances in our understanding of motor symptom neurophysiology. I propose that the treatment and prevention of dementia in PD may also prove possible through advances in our understanding of the neurophysiology of cognitive dysfunction. I will use modern network theory as a theoretical and mathematical framework for this endeavor. My long-term goal is to advance our fundamental understanding of the neurophysiology of cognitive dysfunction in PD to provide empirically testable models, clinically relevant biomarkers, and novel therapeutic targets. The central hypothesis of this proposal is that patterns of cortical functional connectivity critical to normal cognitive function are disruptd by subcortical pathology in PD and that interventions which normalize these patterns will improve cognition. This hypothesis has been formulated on the basis of preliminary data presented in this proposal and other previously published work. The research objectives of this proposal are to further our understanding of how cortical connectivity relates to cognitive dysfunction in PD, develop a novel biomarker for cognitive dysfunction in PD based on cortical physiology and to determine whether modulation of cortical connectivity may result in cognitive improvements in PD. We will accomplish the objectives of this proposal through three Specific Aims: 1) Determine whether graph theory measures of functional cortical activity measured with magneto encephalography (MEG) are associated with cognitive dysfunction in PD subjects with and without mild cognitive impairment (MCI); 2) Develop a novel state-defining biomarker for cognitive dysfunction in PD based on MEG features through a machine learning approach; and 3) Determine the effects of repetitive trans cranial magnetic stimulation (rTMS) on MEG measures of cortical connectivity and cognitive outcomes in PD-MCI patients. The approach is innovative because it represents the first study to apply graph theory measures to understanding the relationship of cortical physiology and cognitive dysfunction in PD; the first study to apply machine learning approaches to cognitive PD biomarker development; and the first clinical trial or mechanistic study of rTMS in PD-MCI. The proposed research is significant because it is expected to advance our understanding of the pathophysiology of cognitive dysfunction in PD and will provide biomarkers and pilot data essential to planning future therapeutic interventions. The training objectives and related research activities of this proposal will provide new skills, manuscripts and pilot data related to advanced MEG analysis, graph theory, biomarker development and rTMS trials necessary to establish my independence in these areas and obtain R01 funding to advance this unique research program. PUBLIC HEALTH RELEVANCE: Dementia is the leading cause of nursing home placement in Parkinson's disease (PD) yet little is known about the cause(s) of cognitive dysfunction in PD and there are no effective treatments. Our preliminary data and other published studies suggest that abnormalities in brain activity involving networks important for normal thinking and memory may contribute to cognitive dysfunction in PD and may represent a target for treatment. This proposal will identify abnormalities in cortical activity related to cognitive dysfunction in PD usng magneto encephalography and will perform a randomized control trial of frontal repetitive trans cranial magnetic stimulation to determine the therapeutic potential of modulating this brain activity.",Intrinsic Cortical Networks and Cognitive Dysfunction in Parkinson's Disease,9315945,K02NS080885,"['Adult', 'Affect', 'Alzheimer&apos', 's Disease', 'Area', 'Biological Markers', 'Brain', 'Caregiver Burden', 'Cephalic', 'Clinical Data', 'Clinical Trials', 'Cognition', 'Cognitive', 'Data', 'Dementia', 'Development', 'Double-Blind Method', 'Elderly', 'Foundations', 'Frequencies', 'Functional disorder', 'Funding', 'Future', 'Goals', 'Impaired cognition', 'Intervention', 'K-Series Research Career Programs', 'Lead', 'Link', 'Machine Learning', 'Magnetism', 'Magnetoencephalography', 'Manuscripts', 'Mathematics', 'Measures', 'Medical', 'Memory', 'Mentors', 'Modeling', 'Modernization', 'Motor Cortex', 'Neurodegenerative Disorders', 'Nursing Homes', 'Operative Surgical Procedures', 'Outcome', 'Parkinson Disease', 'Parkinson&apos', 's Dementia', 'Pathology', 'Patients', 'Pattern', 'Physiological', 'Physiology', 'Population', 'Prevention', 'Publications', 'Publishing', 'Randomized Controlled Trials', 'Research', 'Research Activity', 'Rest', 'Test Result', 'Testing', 'Therapeutic', 'Therapeutic Intervention', 'Thinking', 'Training', 'Transcranial magnetic stimulation', 'Work', 'base', 'biomarker development', 'biomarker identification', 'career', 'career development', 'clinically relevant', 'cognitive ability', 'cognitive change', 'cognitive function', 'cognitive testing', 'effective therapy', 'encephalography', 'graph theory', 'high risk', 'improved', 'innovation', 'mild cognitive impairment', 'motor symptom', 'network dysfunction', 'neurobiological mechanism', 'neurophysiology', 'new therapeutic target', 'novel', 'novel marker', 'physiologic model', 'programs', 'public health relevance', 'screening', 'skills', 'theories', 'therapeutic target']",NINDS,UNIVERSITY OF COLORADO DENVER,K02,2017,132354,0.16440591882276398
