text,title,id,project_number,terms,administration,organization,mechanism,year,funding,score
"Intrinsic Cortical Networks and Cognitive Dysfunction in Parkinson???s Disease     DESCRIPTION (provided by applicant): Parkinson's disease (PD) affects 1% of adults over age 65. While traditionally defined by motor symptoms, up to 75% of PD patients will eventually develop dementia making it the leading cause of nursing home placement in this population. Although there is currently no cure for PD, our ability to treat motor symptoms has advanced tremendously since the 1960's based on advances in our understanding of motor symptom neurophysiology. I propose that the treatment and prevention of dementia in PD may also prove possible through advances in our understanding of the neurophysiology of cognitive dysfunction. I will use modern network theory as a theoretical and mathematical framework for this endeavor. My long-term goal is to advance our fundamental understanding of the neurophysiology of cognitive dysfunction in PD to provide empirically testable models, clinically relevant biomarkers, and novel therapeutic targets. The central hypothesis of this proposal is that patterns of cortical functional connectivity critical to normal cognitive function are disruptd by subcortical pathology in PD and that interventions which normalize these patterns will improve cognition. This hypothesis has been formulated on the basis of preliminary data presented in this proposal and other previously published work. The research objectives of this proposal are to further our understanding of how cortical connectivity relates to cognitive dysfunction in PD, develop a novel biomarker for cognitive dysfunction in PD based on cortical physiology and to determine whether modulation of cortical connectivity may result in cognitive improvements in PD. We will accomplish the objectives of this proposal through three Specific Aims: 1) Determine whether graph theory measures of functional cortical activity measured with magneto encephalography (MEG) are associated with cognitive dysfunction in PD subjects with and without mild cognitive impairment (MCI); 2) Develop a novel state-defining biomarker for cognitive dysfunction in PD based on MEG features through a machine learning approach; and 3) Determine the effects of repetitive trans cranial magnetic stimulation (rTMS) on MEG measures of cortical connectivity and cognitive outcomes in PD-MCI patients. The approach is innovative because it represents the first study to apply graph theory measures to understanding the relationship of cortical physiology and cognitive dysfunction in PD; the first study to apply machine learning approaches to cognitive PD biomarker development; and the first clinical trial or mechanistic study of rTMS in PD-MCI. The proposed research is significant because it is expected to advance our understanding of the pathophysiology of cognitive dysfunction in PD and will provide biomarkers and pilot data essential to planning future therapeutic interventions. The training objectives and related research activities of this proposal will provide new skills, manuscripts and pilot data related to advanced MEG analysis, graph theory, biomarker development and rTMS trials necessary to establish my independence in these areas and obtain R01 funding to advance this unique research program.         PUBLIC HEALTH RELEVANCE: Dementia is the leading cause of nursing home placement in Parkinson's disease (PD) yet little is known about the cause(s) of cognitive dysfunction in PD and there are no effective treatments. Our preliminary data and other published studies suggest that abnormalities in brain activity involving networks important for normal thinking and memory may contribute to cognitive dysfunction in PD and may represent a target for treatment. This proposal will identify abnormalities in cortical activity related to cognitive dysfunction in PD usng magneto encephalography and will perform a randomized control trial of frontal repetitive trans cranial magnetic stimulation to determine the therapeutic potential of modulating this brain activity.            ",Intrinsic Cortical Networks and Cognitive Dysfunction in Parkinson???s Disease,8739318,K02NS080885,"['Adult', 'Affect', 'Alzheimer&apos', 's Disease', 'Area', 'Biological Markers', 'Brain', 'Caregivers', 'Cephalic', 'Clinical Data', 'Clinical Trials', 'Cognition', 'Cognitive', 'Data', 'Dementia', 'Development', 'Disease', 'Double-Blind Method', 'Elderly', 'Foundations', 'Frequencies', 'Functional disorder', 'Funding', 'Future', 'Goals', 'Graph', 'Impaired cognition', 'Intervention', 'K-Series Research Career Programs', 'Lead', 'Link', 'Machine Learning', 'Magnetism', 'Magnetoencephalography', 'Manuscripts', 'Measures', 'Medical', 'Memory', 'Mentors', 'Modeling', 'Motor', 'Motor Cortex', 'Neurodegenerative Disorders', 'Nursing Homes', 'Operative Surgical Procedures', 'Outcome', 'Parkinson Disease', 'Pathology', 'Patients', 'Pattern', 'Physiological', 'Physiology', 'Population', 'Prevention', 'Publications', 'Publishing', 'Randomized Controlled Trials', 'Research', 'Research Activity', 'Rest', 'Symptoms', 'Test Result', 'Testing', 'Therapeutic', 'Therapeutic Intervention', 'Thinking', 'Training', 'Transcranial magnetic stimulation', 'Work', 'base', 'career', 'career development', 'clinically relevant', 'cognitive change', 'cognitive function', 'effective therapy', 'encephalography', 'high risk', 'improved', 'innovation', 'mild cognitive impairment', 'neurobiological mechanism', 'neurophysiology', 'new therapeutic target', 'novel', 'physiologic model', 'programs', 'public health relevance', 'screening', 'skills', 'theories', 'therapeutic target']",NINDS,UNIVERSITY OF COLORADO DENVER,K02,2014,186354,0.16421704422909786
"A Theranostic Tool to Assess and Enable Spared Spinal Motor Function After SCI     DESCRIPTION (provided by applicant): A Theranostic Tool to Assess and Enable Spared Spinal Motor Function After SCI NeuroEnabling Technologies, Inc. RESEARCH & RELATED Other Project Information 7. PROJECT SUMMARY Of the approximately 10 million people in the US living with paralysis, 15,000 are the result of spinal cord injury each year. The first year of care can range from $322,000-$986,000, with lifetime costs of $1.4-4M for someone injured at 25 years of age. In addition to potentially devastating sensorimotor disturbances, there is a huge financial cost, estimated to be $13.55B in medical care, therapy, and lost productivity nationwide. Until very recently, the recovery from spinal cord injury (SCI) was bleak, with little hope of restoring motor function. To address this we have demonstrated that the physiological state of the spinal circuitry of rats and cats can be modulated with epidural stimulation to generate voluntary limb motor function over a range of speeds, loads, and directions, a finding we have extended to humans. Three years post-injury, a motor complete spinal cord injured human subject was implanted with an epidural electrode array over the lumbosacral spinal cord. In less than one month after implantation, the subject could stand independently, and after 7 months of daily epidural stimulation and motor training, voluntary control of both legs was evident in the presence of epidural stimulation, whereas complete paralysis remained in absence of epidural stimulation. We will advance these discoveries with the use of non-invasive stimulation of the lumbosacral cord to improve lower limb function following SCI. Central to this proposal is our discovery of a painless electrical multi-channel (stimulation of multiple parts of the spinal cord) theranostic tool that can be applied to the surface of the skin, termed transcutaneous spinal cord electrical stimulation (TESCS), bypassing the need for a surgically-implanted electrode array. In the first phase of this proposal we will demonstrate proof-of-principle that stimulation of the lumbosacral spinal cord can assess spared spinal motor function by: 1) Testing responses to transcutaneous electrical stimulation in subjects with spinal cord injury; and 2) defining the operational parameters of electrical stimulation that that are most effective using a machine-learning protocol, and 3) produce a multi-channel commercial prototype. This commercial product will undergo testing similar to the proof-of- principle device. This device will then be tested in subjects with cervicothoracic spinal cord injury and evaluated with a machine-learning protocol. This Phase I proposal will deliver a device that can painlessly and non-invasively aid in the assessment and recovery of SCI by delivering a specific electrical stimulation paradigm to the lumbosacral cord that improves use of the lower limbs.         PUBLIC HEALTH RELEVANCE: A Theranostic Tool to Assess and Enable Spared Spinal Motor Function After SCI NeuroEnabling Technologies, Inc. PROJECT NARRATIVE It now seems possible to apply three interventions: transcutaneous stimulation, administration of pharmacological agents, and motor training, to assess and enable the excitability of spared neural circuits in humans with a thoracic spinal cord injury (SCI), thus enabling these individuals to regain use of their legs. This enabling effect is similar to that observed with improved postura and locomotor function after a mid-thoracic SCI in which epidural stimulation was used. We will build and demonstrate a multi-channel transcutaneous electrical spinal cord stimulation theranostic tool that we propose will allow assessment and enabling of lower limb function following a cervicothoracic spinal cord injury.                ",A Theranostic Tool to Assess and Enable Spared Spinal Motor Function After SCI,8735147,R43EB018232,"['Address', 'Age-Years', 'Algorithms', 'American', 'Ankle', 'Bypass', 'Caring', 'Cervical', 'Cervical spinal cord injury', 'Chest', 'Chronic', 'Clinic', 'Clinical', 'Clinical Trials', 'Data', 'Devices', 'Diagnosis', 'Diagnostic', 'Electric Stimulation', 'Electrodes', 'Enrollment', 'Evaluation', 'Felis catus', 'Financial cost', 'Goals', 'Hip region structure', 'Human', 'Implant', 'Implanted Electrodes', 'Individual', 'Injury', 'Intervention', 'Joints', 'Knee', 'Leg', 'Life', 'Limb structure', 'Lower Extremity', 'Lumbar spinal cord structure', 'Machine Learning', 'Measurement', 'Medical', 'Modality', 'Motor', 'Movement', 'Nervous System Physiology', 'Neurologic', 'Neurostimulation procedures of spinal cord tissue', 'Outpatients', 'Painless', 'Paralysed', 'Paraplegia', 'Patients', 'Pharmaceutical Preparations', 'Phase', 'Physiological', 'Productivity', 'Protocols documentation', 'Rattus', 'Recovery', 'Residual state', 'Site', 'Skin', 'Speed', 'Spinal', 'Spinal Cord', 'Spinal Cord Part', 'Spinal Injuries', 'Spinal cord injury', 'Spinal cord injury patients', 'Stroke', 'Surface', 'Techniques', 'Technology', 'Testing', 'Therapeutic', 'Thoracic spinal cord structure', 'Time', 'Toes', 'Training', 'Transcutaneous Electric Nerve Stimulation', 'Translating', 'Upper Extremity', 'Weight-Bearing state', 'design', 'human subject', 'human subject protection', 'implantation', 'improved', 'improved functioning', 'injured', 'life time cost', 'meetings', 'motor control', 'motor function improvement', 'neural circuit', 'neuroregulation', 'prototype', 'public health relevance', 'response', 'theranostics', 'tool', 'transcutaneous stimulation']",NIBIB,"NEUROENABLING TECHNOLOGIES, INC.",R43,2014,346207,0.07515943655218243
"Spinal Epidural Electrode Array To Facilitate Standing and Stepping After SCI     DESCRIPTION (provided by applicant):  In the first 5-year period of our BRP we had two major objectives:  1) to determine whether we could improve motor function of the lower limbs by neuromodulating the spinal lumbosacral circuitry with epidural stimulation and 2) to begin to develop and improve the technologies associated with electrode arrays and chronic implantable stimulation devices to maximize the neuromodulatory potential.  These new technologies have the potential to fine tune the epidural stimulation parameters, to help in understanding some of the underlying mechanisms of epidural stimulation., to examine synergistic effects of epidural stimulation, pharmacological modulation, and examine activity-dependent interventions that might affect the level of recovery of motor function after complete paralysis.  We have demonstrated that an adult rat with a complete, mid-thoracic spinal cord transection can regain full weight-bearing stepping over a range of speeds, loads, and even directions when the spinal cord is stimulated tonically to increase the excitability of the lumbosacral locomotor circuitry.  Furthermore, we learned that load-bearing sensory information can serve as the controller of these complex motor tasks and that the performance of these tasks can be improved even further with combinations of epidural stimulation, pharmacological, and motor training interventions.  We have shown that four humans with a motor complete spinal injury have regained independent standing, assisted stepping, and even a significant level of voluntary control of the lower limbs in the presence of epidural stimulation, with one subject now even having some volitional control without stimulation.  Improvement in bladder control, blood pressure, temperature regulation, and even sexual function has been realized.  Thus, our present challenge is to develop the capability to selectively activate combinations of neural networks that can enable standing, and probably stepping, by improving the technologies needed to make this intervention available in the clinic and in the home of individuals with complete motor paralysis using a chronic epidural electrode implant.  Specifically, we will further improve the electrode array stimulation technology needed for fine-tune control in rats and humans and transform the present hardwired technology for rats to a wireless capability to stimulate and record evoked potentials along the brain-spinal cord-muscle axis in the rat.  To advance the clinical potential, we will continue to develop, refine and validate our machine-learning strategies which automatically optimize stimulation parameters for standing, stepping, and voluntary control.  We will develop an improved interface between the devices implanted in our present subjects and the control devices for defining the specific stimulation parameters needed for a given subject to perform a motor task in the clinic or at home.           PUBLIC HEALTH RELEVANCE:  We now have demonstrated that the human lumbosacral spinal cord can be neuromodulated with epidural stimulation to enable recovery of standing and volitional control of the lower limbs and return of some autonomic function after complete motor paralysis.  Therefore, our objectives are now to develop the technologies needed to more fully capitalize on this clinical potential and develop home-use technologies to do so.                  ",Spinal Epidural Electrode Array To Facilitate Standing and Stepping After SCI,8696689,U01EB007615,"['Adult', 'Affect', 'Algorithms', 'Animals', 'Behavior', 'Binding', 'Biological Neural Networks', 'Bladder Control', 'Blood Pressure', 'Brain', 'Chest', 'Chronic', 'Clinic', 'Clinical', 'Complex', 'Contusions', 'Data', 'Devices', 'Dorsal', 'Educational Intervention', 'Electrodes', 'Evaluation', 'Evoked Potentials', 'Experimental Designs', 'Frequencies', 'Home environment', 'Human', 'Implant', 'Implanted Electrodes', 'Individual', 'Injury', 'Internet', 'Intervention', 'Intramuscular', 'Learning', 'Locomotor training', 'Lower Extremity', 'Machine Learning', 'Methods', 'Modeling', 'Monitor', 'Motor', 'Muscle', 'Paralysed', 'Patients', 'Pattern', 'Performance', 'Physiological', 'Procedures', 'Process', 'Rattus', 'Recovery', 'Regulation', 'Research', 'Robotics', 'Sensory', 'Sex Functioning', 'Signal Transduction', 'Speed', 'Spinal', 'Spinal Cord', 'Spinal Cord transection injury', 'Spinal Injuries', 'Spinal cord injury', 'Stimulus', 'System', 'Task Performances', 'Technology', 'Temperature', 'Testing', 'Thoracic spinal cord structure', 'Training', 'Weight-Bearing state', 'Wireless Technology', 'base', 'density', 'design', 'implantable device', 'improved', 'in vivo', 'motor control', 'motor function improvement', 'motor function recovery', 'new technology', 'next generation', 'novel', 'public health relevance', 'somatosensory', 'voltage']",NIBIB,UNIVERSITY OF CALIFORNIA LOS ANGELES,U01,2014,1152001,0.10412154170043406
"Enabling forelimb function with agonist drug and epidural stimulation in SCI     DESCRIPTION (provided by applicant):  We have demonstrated that the physiological state of the lumbosacral spinal circuitry of spinal rats and cats can be modulated with spinal cord epidural stimulation (EDS) and/or administration of pharmacological agents to generate weight-bearing standing and stepping over a range of speeds, loads, and directions.  We have translated some of these results to humans by implanting 3 motor complete spinal cord injured (SCI) subjects about three years post-injury with an epidural electrode array over the lumbosacral spinal cord.  In less than one month post-electrode implant, the subjects could stand independently, and after up to 7 months of daily EDS and motor training, voluntary control of both legs was evident in the presence of EDS, whereas complete paralysis remained in absence of EDS.  We propose to employ a similar stimulation strategy for the recovery of upper limb function.  We will include extensive testing of spinal rats to guide our strategy to test for upper extremity improvement in human SCI subjects.  We will use off-the-shelf FDA approved pharmacological and stimulation modalities to:  1) Determine the optimal stimulation parameters, i.e., electrode placement and stimulation intensity, frequency and duration, for facilitating forelimb fine motor function in rats with a cervical SCI.  Using existing FDA-approved epidural electrodes, we will demonstrate in patients with a cervical SCI that cervical EDS can facilitate arm-hand function.  2) Identify an effective mode of administration, define the dose- response pharmacokinetics, and determine the effectiveness of a monoaminergic agonist to facilitate upper limb function after a cervical SCI.  We will assess the effectiveness of existing FDA-approved pharmacological agents (i.e., buspirone and as an alternative, bromocriptine), and determine their effectiveness in improving forelimb control in subjects with a cervical SCI.  3) Define the dose-response properties of monoaminergic agonists when combined with EDS in facilitating forelimb function in rats after a cervical SCI.  We will demonstrate the efficacy of ES in combination with a pharmacological intervention in facilitating arm and hand function in humans after a cervical SCI.  4) Determine whether motor training of spinal rats will further enhance the recovery of motor function when combined with pharmacological and/or EDS interventions.  5) Develop a protocol for machine learning to enable rapid selection of the optimal pharmacological and EDS parameters for motor recovery in rats and in human subjects.  If successful, this could represent the beginning of a paradigm shift in the use of minimally invasive strategies combined with rehabilitative approaches to realize significant improvement in upper limb function after paralysis.         PUBLIC HEALTH RELEVANCE:  It now seems possible to apply three interventions (epidural stimulation, administration of pharmacological agents, and motor training) to control the excitability of localized neural circuits in humans with a cervical spinal cord injury (SCI), thus enabling these individuals to regain use of their arms and hands.  This enabling effect is similar to that observed with improved postural and locomotor function after a mid-thoracic SCI.  We will reach critical milestones that will provide the basis for a series of clinical trials for furter defining the efficacy of these interventions.                ",Enabling forelimb function with agonist drug and epidural stimulation in SCI,8690845,U01EB015521,"['Agonist', 'Algorithms', 'Ankle', 'Bromocriptine', 'Buspirone', 'Cervical', 'Cervical spinal cord injury', 'Cervical spinal cord structure', 'Chronic', 'Clinical Trials', 'Complement', 'Devices', 'Dose', 'Drug Kinetics', 'Effectiveness', 'Electrodes', 'FDA approved', 'Felis catus', 'Food', 'Forelimb', 'Frequencies', 'Goals', 'Hand', 'Hand functions', 'Hip region structure', 'Human', 'Implant', 'Implanted Electrodes', 'Individual', 'Injury', 'Intervention', 'Knee', 'Leg', 'Lesion', 'Lower Extremity', 'Machine Learning', 'Methodology', 'Modality', 'Motor', 'Motor Skills', 'Oral', 'Paralysed', 'Patients', 'Pharmaceutical Preparations', 'Physiological', 'Preparation', 'Property', 'Protocols documentation', 'Rattus', 'Recovery', 'Rehabilitation therapy', 'Retrieval', 'Series', 'Speed', 'Spinal', 'Spinal Cord', 'Spinal cord injury', 'Testing', 'Thoracic spinal cord structure', 'Time', 'Toes', 'Training', 'Translating', 'Treatment Efficacy', 'Upper Extremity', 'Weight-Bearing state', 'arm', 'base', 'design', 'human subject', 'improved', 'minimally invasive', 'motor function recovery', 'neural circuit', 'neuroregulation', 'public health relevance', 'response']",NIBIB,UNIVERSITY OF CALIFORNIA LOS ANGELES,U01,2014,819964,0.07790027321737543
