text,title,id,project_number,terms,administration,organization,mechanism,year,funding,score
"Utilizing social media as a resource for mental health surveillance DESCRIPTION (provided by applicant):  Major depressive disorder is one of the most common debilitating illnesses in the United States, with a lifetime prevalence of 16.2%. Currently, nationwide mental health surveillance takes the form of large-scale telephone- based surveys. These surveys have high running costs and require teams of human telephone operators. Even the largest system, the Behavioral Risk Factor Surveillance System, reaches only 0.13% of the US population. Twitter (and other microblog services) offers a rich, if terse, multilingual source of real time data for public health surveillance. Natural Language Processing (NLP) provides techniques and resources to ""unlock"" data from text. We propose using Twitter and NLP as a cost-effective and flexible approach to augmenting current telephone- based surveillance methods for population level depression monitoring.         This grant application has two major strands. First, investigating ethical issues and challenges to privacy that emerge with the use of Twitter data for public health surveillance (Aim One). Second, developing techniques and resources for real-time public health surveillance for mental illness from Twitter (Aim Two &Aim Three). Aim One seeks to investigate and codify our responsibilities as researchers towards Twitter users by engaging with those users directly. With Aim Two, we will build and evaluate Natural Language Processing resources - algorithms, lexicons and taxonomies - to support the identification of depression symptoms in Twitter data. For Aim Three, we will build and evaluate Natural Language Processing modules and services that use Twitter as a data source for monitoring depression levels in the community. The significance of the proposed work lies in three areas. First, our investigations - both empirical and theoretical - will explore ethical issues in the use of Twitter for public health surveillance. This work has the potential to guide future research in the area. Second, in developing and evaluating algorithms and resources for identifying depression from tweets, we are contributing foundational work to the field of NLP. Third, developing these algorithms and resources will provide the bedrock for building social media based surveillance systems which will provide a cost effective means of augmenting current mental health surveillance practice. This proposal is innovative in both its application area (microblogs have not been used before for mental health surveillance), its focus on using NLP to identify depressive symptoms for public health, and in the central role that qualitative bioethical research will play in guiding the work. Project Narrative The proposed research focuses on using advanced Natural Language Processing methods to mine microblog data - in this case, Twitter - for mental health surveillance (specifically, depression surveillance), in order to augment current telephone-based mental health surveillance systems. The research has public health at its core.",Utilizing social media as a resource for mental health surveillance,9127812,R00LM011393,"['Algorithms', 'Applications Grants', 'Area', 'Attitude', 'Behavioral Risk Factor Surveillance System', 'Broadcast Media', 'Cities', 'Cognitive', 'Communities', 'County', 'Data', 'Data Sources', 'Dental', 'Development', 'Disasters', 'Earthquakes', 'Electronic Health Record', 'Epidemiology', 'Ethical Issues', 'Ethics', 'Exercise', 'Guidelines', 'Health', 'Human', 'Influenza A Virus, H1N1 Subtype', 'Interview', 'Investigation', 'Linguistics', 'Location', 'Major Depressive Disorder', 'Mental Depression', 'Mental Health', 'Mental disorders', 'Methods', 'Mining', 'Monitor', 'Natural Language Processing', 'Participant', 'Phase', 'Play', 'Population', 'Population Surveillance', 'Prevalence', 'Privacy', 'Process', 'Psyche structure', 'Public Health', 'Recruitment Activity', 'Reporting', 'Research', 'Research Personnel', 'Resources', 'Role', 'Running', 'Scheme', 'Services', 'Smoking Status', 'Source', 'Surveillance Methods', 'Surveys', 'System', 'Taxonomy', 'Techniques', 'Telephone', 'Text', 'Time', 'United States', 'Update', 'Work', 'base', 'center for epidemiological studies depression scale', 'cost', 'cost effective', 'depressive symptoms', 'flexibility', 'innovation', 'lexical', 'social media', 'syndromic surveillance', 'text searching', 'tool', 'ward']",NLM,UNIVERSITY OF UTAH,R00,2016,225884,0.0733284720093153
"Utilizing social media as a resource for mental health surveillance DESCRIPTION (provided by applicant):  Major depressive disorder is one of the most common debilitating illnesses in the United States, with a lifetime prevalence of 16.2%. Currently, nationwide mental health surveillance takes the form of large-scale telephone- based surveys. These surveys have high running costs and require teams of human telephone operators. Even the largest system, the Behavioral Risk Factor Surveillance System, reaches only 0.13% of the US population. Twitter (and other microblog services) offers a rich, if terse, multilingual source of real time data for public health surveillance. Natural Language Processing (NLP) provides techniques and resources to ""unlock"" data from text. We propose using Twitter and NLP as a cost-effective and flexible approach to augmenting current telephone- based surveillance methods for population level depression monitoring.         This grant application has two major strands. First, investigating ethical issues and challenges to privacy that emerge with the use of Twitter data for public health surveillance (Aim One). Second, developing techniques and resources for real-time public health surveillance for mental illness from Twitter (Aim Two &Aim Three). Aim One seeks to investigate and codify our responsibilities as researchers towards Twitter users by engaging with those users directly. With Aim Two, we will build and evaluate Natural Language Processing resources - algorithms, lexicons and taxonomies - to support the identification of depression symptoms in Twitter data. For Aim Three, we will build and evaluate Natural Language Processing modules and services that use Twitter as a data source for monitoring depression levels in the community. The significance of the proposed work lies in three areas. First, our investigations - both empirical and theoretical - will explore ethical issues in the use of Twitter for public health surveillance. This work has the potential to guide future research in the area. Second, in developing and evaluating algorithms and resources for identifying depression from tweets, we are contributing foundational work to the field of NLP. Third, developing these algorithms and resources will provide the bedrock for building social media based surveillance systems which will provide a cost effective means of augmenting current mental health surveillance practice. This proposal is innovative in both its application area (microblogs have not been used before for mental health surveillance), its focus on using NLP to identify depressive symptoms for public health, and in the central role that qualitative bioethical research will play in guiding the work. Project Narrative The proposed research focuses on using advanced Natural Language Processing methods to mine microblog data - in this case, Twitter - for mental health surveillance (specifically, depression surveillance), in order to augment current telephone-based mental health surveillance systems. The research has public health at its core.",Utilizing social media as a resource for mental health surveillance,8911360,R00LM011393,"['Algorithms', 'Applications Grants', 'Area', 'Attitude', 'Behavioral Risk Factor Surveillance System', 'Broadcast Media', 'Cities', 'Cognitive', 'Communities', 'County', 'Data', 'Data Sources', 'Dental', 'Development', 'Disasters', 'Earthquakes', 'Electronic Health Record', 'Epidemiology', 'Ethical Issues', 'Ethics', 'Exercise', 'Guidelines', 'Health', 'Human', 'Influenza A Virus, H1N1 Subtype', 'Interview', 'Investigation', 'Linguistics', 'Location', 'Major Depressive Disorder', 'Mental Depression', 'Mental Health', 'Mental disorders', 'Methods', 'Mining', 'Monitor', 'Natural Language Processing', 'Participant', 'Phase', 'Play', 'Population', 'Population Surveillance', 'Prevalence', 'Privacy', 'Process', 'Psyche structure', 'Public Health', 'Recruitment Activity', 'Reporting', 'Research', 'Research Personnel', 'Resources', 'Role', 'Running', 'Scheme', 'Services', 'Smoking Status', 'Source', 'Surveillance Methods', 'Surveys', 'System', 'Taxonomy', 'Techniques', 'Telephone', 'Text', 'Time', 'United States', 'Update', 'Work', 'base', 'center for epidemiological studies depression scale', 'cost', 'cost effective', 'depressive symptoms', 'flexibility', 'innovation', 'lexical', 'social', 'syndromic surveillance', 'text searching', 'tool', 'ward']",NLM,UNIVERSITY OF UTAH,R00,2015,217377,0.0733284720093153
"Utilizing social media as a resource for mental health surveillance DESCRIPTION (provided by applicant):  Major depressive disorder is one of the most common debilitating illnesses in the United States, with a lifetime prevalence of 16.2%. Currently, nationwide mental health surveillance takes the form of large-scale telephone- based surveys. These surveys have high running costs and require teams of human telephone operators. Even the largest system, the Behavioral Risk Factor Surveillance System, reaches only 0.13% of the US population. Twitter (and other microblog services) offers a rich, if terse, multilingual source of real time data for public health surveillance. Natural Language Processing (NLP) provides techniques and resources to ""unlock"" data from text. We propose using Twitter and NLP as a cost-effective and flexible approach to augmenting current telephone- based surveillance methods for population level depression monitoring.         This grant application has two major strands. First, investigating ethical issues and challenges to privacy that emerge with the use of Twitter data for public health surveillance (Aim One). Second, developing techniques and resources for real-time public health surveillance for mental illness from Twitter (Aim Two &Aim Three). Aim One seeks to investigate and codify our responsibilities as researchers towards Twitter users by engaging with those users directly. With Aim Two, we will build and evaluate Natural Language Processing resources - algorithms, lexicons and taxonomies - to support the identification of depression symptoms in Twitter data. For Aim Three, we will build and evaluate Natural Language Processing modules and services that use Twitter as a data source for monitoring depression levels in the community. The significance of the proposed work lies in three areas. First, our investigations - both empirical and theoretical - will explore ethical issues in the use of Twitter for public health surveillance. This work has the potential to guide future research in the area. Second, in developing and evaluating algorithms and resources for identifying depression from tweets, we are contributing foundational work to the field of NLP. Third, developing these algorithms and resources will provide the bedrock for building social media based surveillance systems which will provide a cost effective means of augmenting current mental health surveillance practice. This proposal is innovative in both its application area (microblogs have not been used before for mental health surveillance), its focus on using NLP to identify depressive symptoms for public health, and in the central role that qualitative bioethical research will play in guiding the work. Project Narrative The proposed research focuses on using advanced Natural Language Processing methods to mine microblog data - in this case, Twitter - for mental health surveillance (specifically, depression surveillance), in order to augment current telephone-based mental health surveillance systems. The research has public health at its core.",Utilizing social media as a resource for mental health surveillance,8894203,R00LM011393,"['Algorithms', 'Applications Grants', 'Area', 'Attitude', 'Behavioral Risk Factor Surveillance System', 'Broadcast Media', 'Cities', 'Cognitive', 'Communities', 'County', 'Data', 'Data Sources', 'Dental', 'Development', 'Disasters', 'Earthquakes', 'Electronic Health Record', 'Epidemiology', 'Ethical Issues', 'Ethics', 'Exercise', 'Guidelines', 'Health', 'Human', 'Influenza A Virus, H1N1 Subtype', 'Interview', 'Investigation', 'Linguistics', 'Location', 'Major Depressive Disorder', 'Mental Depression', 'Mental Health', 'Mental disorders', 'Methods', 'Mining', 'Monitor', 'Natural Language Processing', 'Participant', 'Phase', 'Play', 'Population', 'Population Surveillance', 'Prevalence', 'Privacy', 'Process', 'Psyche structure', 'Public Health', 'Recruitment Activity', 'Reporting', 'Research', 'Research Personnel', 'Resources', 'Role', 'Running', 'Scheme', 'Services', 'Smoking Status', 'Source', 'Surveillance Methods', 'Surveys', 'System', 'Taxonomy', 'Techniques', 'Telephone', 'Text', 'Time', 'United States', 'Update', 'Work', 'base', 'center for epidemiological studies depression scale', 'cost', 'cost effective', 'depressive symptoms', 'flexibility', 'innovation', 'lexical', 'social', 'syndromic surveillance', 'text searching', 'tool', 'ward']",NLM,UNIVERSITY OF UTAH,R00,2014,224100,0.0733284720093153
"Utilizing social media as a resource for mental health surveillance     DESCRIPTION (provided by applicant):  Major depressive disorder is one of the most common debilitating illnesses in the United States, with a lifetime prevalence of 16.2%. Currently, nationwide mental health surveillance takes the form of large-scale telephone- based surveys. These surveys have high running costs and require teams of human telephone operators. Even the largest system, the Behavioral Risk Factor Surveillance System, reaches only 0.13% of the US population. Twitter (and other microblog services) offers a rich, if terse, multilingual source of real time data for public health surveillance. Natural Language Processing (NLP) provides techniques and resources to ""unlock"" data from text. We propose using Twitter and NLP as a cost-effective and flexible approach to augmenting current telephone- based surveillance methods for population level depression monitoring.         This grant application has two major strands. First, investigating ethical issues and challenges to privacy that emerge with the use of Twitter data for public health surveillance (Aim One). Second, developing techniques and resources for real-time public health surveillance for mental illness from Twitter (Aim Two &Aim Three). Aim One seeks to investigate and codify our responsibilities as researchers towards Twitter users by engaging with those users directly. With Aim Two, we will build and evaluate Natural Language Processing resources - algorithms, lexicons and taxonomies - to support the identification of depression symptoms in Twitter data. For Aim Three, we will build and evaluate Natural Language Processing modules and services that use Twitter as a data source for monitoring depression levels in the community. The significance of the proposed work lies in three areas. First, our investigations - both empirical and theoretical - will explore ethical issues in the use of Twitter for public health surveillance. This work has the potential to guide future research in the area. Second, in developing and evaluating algorithms and resources for identifying depression from tweets, we are contributing foundational work to the field of NLP. Third, developing these algorithms and resources will provide the bedrock for building social media based surveillance systems which will provide a cost effective means of augmenting current mental health surveillance practice. This proposal is innovative in both its application area (microblogs have not been used before for mental health surveillance), its focus on using NLP to identify depressive symptoms for public health, and in the central role that qualitative bioethical research will play in guiding the work.              Project Narrative The proposed research focuses on using advanced Natural Language Processing methods to mine microblog data - in this case, Twitter - for mental health surveillance (specifically, depression surveillance), in order to augment current telephone-based mental health surveillance systems. The research has public health at its core.",Utilizing social media as a resource for mental health surveillance,8510292,K99LM011393,"['Algorithms', 'Applications Grants', 'Area', 'Attitude', 'Behavioral Risk Factor Surveillance System', 'Broadcast Media', 'Cities', 'Cognitive', 'Communities', 'County', 'Data', 'Data Sources', 'Dental', 'Development', 'Disasters', 'Earthquakes', 'Electronic Health Record', 'Epidemiology', 'Ethical Issues', 'Ethics', 'Exercise', 'Guidelines', 'Health', 'Human', 'Influenza A Virus, H1N1 Subtype', 'Interview', 'Investigation', 'Linguistics', 'Location', 'Major Depressive Disorder', 'Mental Depression', 'Mental Health', 'Mental disorders', 'Methods', 'Mining', 'Monitor', 'Natural Language Processing', 'Participant', 'Phase', 'Play', 'Population', 'Population Surveillance', 'Prevalence', 'Privacy', 'Process', 'Psyche structure', 'Public Health', 'Recruitment Activity', 'Reporting', 'Research', 'Research Personnel', 'Resources', 'Role', 'Running', 'Scheme', 'Services', 'Smoking Status', 'Source', 'Surveillance Methods', 'Surveys', 'System', 'Taxonomy', 'Techniques', 'Telephone', 'Text', 'Time', 'United States', 'Update', 'Work', 'base', 'center for epidemiological studies depression scale', 'cost', 'cost effective', 'depressive symptoms', 'flexibility', 'innovation', 'lexical', 'social', 'syndromic surveillance', 'text searching', 'tool', 'ward']",NLM,"UNIVERSITY OF CALIFORNIA, SAN DIEGO",K99,2013,82800,0.0733284720093153
"Improved Disease Stratification Using Electronic Health Records ABSTRACT This Career Development Application describes targeted coursework and mentored research for progression to independent research in the use of electronic health record data for disease subtyping. Electronic health records have demonstrated great promise as a scalable source of data for biomedical research to enable “precision medicine.” Use of natural language processing techniques has enabled computational analysis of specific terms found in free text clinical notes. An improved ability to extract symptom information from clinical notes would improve researchers’ ability to use de-identified data from patient records for discovery of disease subtypes. Symptom-related terms are particularly important in the context of mental health, but also harder to detect in notes than other terms like diseases or drug names.  The research aims of this proposal present a novel approach to scalable extension of biomedical terminologies and improved detection of those terms and their modifiers (e.g. severe, familial, absent). The richer dataset that can be extracted using these enhanced approaches is then used to define patient cohorts and to detect disease subtypes and predictors of response to specific pharmaceutical intervention.  Resulting patient stratification will be compared to groupings made without the enriched data and validated on an independent data set. The overarching hypothesis of this work is that enhanced mining of clinical notes will enable statistically significant and clinically relevant symptom-based stratification of psychiatric disorders. In order to test this hypothesis, I will: Aim 1: Develop a semi-automated pipeline for domain-specific terminology extension Aim 2: Define and stratify patient cohorts through use of enhanced term extraction Aim 3: Evaluate the validity and utility of the richer set of data obtained through Aims 1 and 2  One area of greatest need for more evidence-based disease stratification, and also of greatest challenge for a number of reasons, is that of mental health. Mental health disorders account for 30% of non-fatal disease burden world-wide, and pose an economic burden of trillions of dollars and climbing. Moreover, mental health symptoms are generally subjective and self-reported, with few objectively measurable signs. The impact of this proposal is that it will dramatically improve our ability to use EHR data to stratify patients in this drastically underserved area of health and healthcare.  The major innovations of this project are the adaptation and application of a semi-supervised pattern learning pipeline to augment mental health terminologies, and a novel approach to disease stratification using a significantly underutilized source of biomedical data, namely clinical notes.  This work addresses a major challenge for mining clinical notes in rapidly evolving biomedical domains and leverages a valuable source of medical evidence that is largely untapped and underutilized. Together, these methods for enhanced use of clinical notes will enable identification of distinct patient subgroups using data that is sitting idle in EHRs. Project Narrative Electronic health records have demonstrated great promise as a scalable source of data for biomedical research to enable “precision medicine.” Natural language processing has enabled the use of information from clinical notes in addition to structured data like diagnoses and lab values. This work aims to improve our ability to extract useful information from electronic health records to enable disease subtyping, particularly in the area of mental health.",Improved Disease Stratification Using Electronic Health Records,9566983,K01LM012529,"['Address', 'Area', 'Biological', 'Biomedical Research', 'Categories', 'Classification', 'Clinical', 'Clinical Data', 'Complement', 'Computer Analysis', 'Data', 'Data Set', 'Detection', 'Diagnosis', 'Diagnostic', 'Disease', 'Disease stratification', 'Economic Burden', 'Electrocardiogram', 'Electronic Health Record', 'Genotype', 'Grouping', 'Health', 'Healthcare', 'Intervention', 'Learning', 'Measurable', 'Medical', 'Mental Health', 'Mental disorders', 'Mentors', 'Methods', 'Mining', 'Names', 'Natural Language Processing', 'Outcome', 'Patient Self-Report', 'Patients', 'Pattern', 'Pharmaceutical Preparations', 'Pharmacologic Substance', 'Phenotype', 'Records', 'Research', 'Research Personnel', 'Rheumatology', 'Severities', 'Source', 'Statistical Models', 'Stratification', 'Structure', 'Supervision', 'Symptoms', 'Techniques', 'Terminology', 'Testing', 'Text', 'Work', 'base', 'burden of illness', 'career development', 'clinical decision-making', 'clinically actionable', 'clinically relevant', 'cohort', 'disease classification', 'disorder subtype', 'electronic data', 'evidence base', 'improved', 'innovation', 'novel strategies', 'patient stratification', 'patient subsets', 'phenotypic data', 'precision medicine', 'predicting response', 'response', 'treatment response']",NLM,DUKE UNIVERSITY,K01,2018,187483,0.08904768729836579
