text,title,id,project_number,terms,administration,organization,mechanism,year,funding,score
"Robust Predictors of Mania and Psychosis PROJECT SUMMARY/ABSTRACT  The purpose of the new funding opportunity announcement, RFA-OD-17-004 for Intensive Longitudinal Analysis of Health Behaviors: Leveraging New Technologies To Understand Health Behaviors (U01), is to establish a cooperative agreement network to collaboratively study factors that influence key health behaviors in the dynamic environment of individuals, using intensive longitudinal data collection and analytic methods. Importantly, progress has been slow and frustrating in translating knowledge of the brain to new and more effective treatments for human brain diseases such as severe mental disorders. In fact, severe mental disorders, which include psychotic disorders, are brain diseases that are not only devastating because they result in severe disruptions that occur early in life, but, for many, the course of illness is progressive, leading to chronic debilitation and early mortality. Thus the need to accelerate knowledge about the factors that trigger (or increase or decrease the likelihood) of manic and psychotic episodes, and to translate this knowledge to more effective treatment interventions, is critical. The primary goal of the proposed “Robust Predictors of Mania and Psychosis” is to identify biological, environmental, and social factors that trigger dangerous mental states, particularly mania and psychosis, in individuals known to be at risk for these conditions. The eventual goal of this work is to provide quantifiable and predictable information that can be used to scaffold biological observations and tailor intervention strategies to maximize efficacy at the individual level. We first develop models to predict conventional clinical measures specific to psychosis and mania using (1) digital, low- to-minimal burden interactions through smartphones and wearables (Aim 1), and (2) measures extracted from face and voice during in-person clinical interactions (Aim 2), work which leverages existing data we have already collected. We will next collect one hundred person-years of pseudo-continuous multivariate behavioral data from one hundred individuals with a psychotic disorder, to further test and validate our early observations in a wider array of individuals with affective and non-affective psychotic disorders, who are likely to experience illness fluctuations within a one-year timeframe, employing several strategies to optimize participant engagement (Aim 3). We will also perform, as a representative example, a study comparing sleep, energy expenditure, and mania symptoms over time, using data obtained in the first three aims, to quantify how the relationship between energy expenditure and energy perception varies across our study population in ways that could have important consequences for health behaviors (Aim 4). The main goals of this project are thus to acquire high quality, temporally dense behavioral, cognitive, and clinical data on an important cohort of young adult patients, not only to facilitate future investigations linking these behavioral change points to neurobiological processes but also as a precursor to more effective, targeted therapeutics, such as real-time interventions that could be delivered based on dynamic factors in an individual's environment. 8. PROJECT NARRATIVE The main goal of the proposed “Robust predictors of mania and psychosis” is to identify biological, environmental, and social factors that trigger dangerous mental states, particularly mania and psychosis, in individuals known to be at risk for these conditions by acquiring high quality, temporally dense, longitudinal behavioral data, and using machine learning approaches to iteratively identify factors that increase or decrease the likelihood of these conditions. We focus on early psychosis (both affective and non-affective psychosis), which is a critical time period when there are fewer confounds such as prolonged medication exposure and chronicity, and when early intervention strategies will be most effective, prior to the progression that often leads to debilitating and chronic illnesses, to great suffering, and to an enormous public health problem and economic burden. By developing predictors for mania and psychosis from smartphone, wearable, and audio- video data and then testing these predictors over 100 person-years in individuals with active psychotic disorders, the data collected will make it possible to identify specific factors in the physical, social, and/or built environment that facilitate or hinder healthy behaviors in early psychosis and bipolar disorder and lay the groundwork for tailored intervention strategies that fully account for these factors to maximize efficacy at the individual level.",Robust Predictors of Mania and Psychosis,9938687,U01MH116925,"['Acoustics', 'Affect', 'Affective', 'Behavior', 'Behavioral', 'Biological', 'Biological Factors', 'Bipolar Disorder', 'Brain', 'Brain Diseases', 'Categories', 'Cellular Phone', 'Chronic', 'Chronic Disease', 'Clinical', 'Clinical Data', 'Cognitive', 'Computer Vision Systems', 'Dangerousness', 'Data', 'Data Analytics', 'Data Collection', 'Diagnosis', 'Diagnostic', 'Early Intervention', 'Economic Burden', 'Energy Metabolism', 'Environment', 'Environmental Risk Factor', 'Event', 'Face', 'Functional disorder', 'Funding Opportunities', 'Future', 'Gestures', 'Goals', 'Health behavior', 'Hospitalization', 'Human', 'Individual', 'Intervention', 'Investigation', 'Knowledge', 'Lead', 'Life', 'Link', 'Machine Learning', 'Manic', 'Maps', 'Measures', 'Medical Records', 'Methodology', 'Methods', 'Modeling', 'Nature', 'Neurobiology', 'Participant', 'Patient Self-Report', 'Patients', 'Perception', 'Persons', 'Pharmaceutical Preparations', 'Physical environment', 'Process', 'Prospective Studies', 'Protocols documentation', 'Psychotic Disorders', 'Public Health', 'Reporting', 'Reproducibility', 'Risk', 'Signal Transduction', 'Sleep', 'Social Environment', 'Symptoms', 'Technology', 'Testing', 'Time', 'Translating', 'U-Series Cooperative Agreements', 'Visual', 'Voice', 'Work', 'Wrist', 'actigraphy', 'analytical method', 'base', 'built environment', 'case control', 'cohort', 'design', 'digital', 'disability', 'early onset', 'effective therapy', 'energy balance', 'experience', 'gaze', 'individual patient', 'longitudinal analysis', 'longitudinal design', 'mental state', 'mortality', 'new technology', 'phenotypic data', 'predictive modeling', 'predictive test', 'prospective', 'psychotic symptoms', 'scaffold', 'sensor', 'severe mental illness', 'social', 'social factors', 'study population', 'targeted treatment', 'theories', 'time use', 'wearable device', 'young adult']",NIMH,MCLEAN HOSPITAL,U01,2020,710639,0.04701394037116069
"Integrative Learning to Combine Evidence for Personalized Treatment Strategies. Project Summary:  Mental disorders represent immense healthcare burdens. Intense efforts and resources have been devoted to developing pharmacological and behavioral treatments for mental disorders, but no universally effective treatments are available. Considerable heterogeneity exists in treatment response among individuals with mental disorders, in part because an individual patient's psychosocial characteristics and/or biomarkers are not accounted for when selecting among available treatment options. Barriers to implement personalized treatments in clinical psychiatry include a lack of evidence-based, clinically interpretable, individualized treatment rules (ITRs), a lack of power to detect treatment modifiers from a single study, and a lack of reproducibility for treatment rules estimated from single studies. We propose analytic solutions to tackle these barriers. Specifically, we will provide integrative machine learning methods to build powerful, yet interpretable, individualized treatment strategies that can be easily applied in clinical practice. We will integrate evidence of ITRs identified in multiple randomized controlled trials (RCTs) to increase robustness and reproducibility. In Aim 1, we will provide piece-wise linear decision trees that are  transparent, interpretable, and that have guaranteed performance. Our decision trees will simultaneously identify the optimal treatment for a given patient (qualitative interaction) and subgroups of patients with large benefit  (quantitative interaction). In Aim 2, we propose a novel integrative analysis to synthesize evidence across trials and provide an integrative ITR that improves efficiency and reproducibility. Our method does not require all studies to collect common sets of variables and thus allows evidence to be combined from ITRs identified in recent RCTs that collected emerging biomarkers (e.g., neuroimaging measures) with earlier RCTs that focused on clinical and  behavioral markers. In response to the National Institute of Mental Health Strategic Plan on Research Domain Criteria (RDoC) to center mental health research around “dimensional psychological constructs” shared across disorders, the methods will be applied to a wide range of RCTs that recruited patients with major depressive disorder and other co-morbid mental disorders. This strategy allows examination of ITRs for constructs shared across disorders and will increase generalizability. We will apply our methods to various RCTs, including data available from the  National Database for Clinical Trials Related to Mental Illness. This research will bridge approaches for personalized medicine and integrative analysis in an effort to better understand the complex interplay between biomarkers and clinical manifestations in the context of selecting the best treatments for patients with mental disorders. Project Narrative:  Treatment responses for mental disorders are inadequate and considerable heterogeneity is observed, in part because an individual patient's clinical, psychosocial, and/or biological markers are not accounted for when select- ing treatments among available options. This research proposes novel analytic methods to discover new powerful, yet interpretable personalized treatment strategies and integrate evidence of strategies identified in multiple prior studies to increase robustness and reproducibility.",Integrative Learning to Combine Evidence for Personalized Treatment Strategies.,9774303,R21MH117458,"['Age', 'Anxiety Disorders', 'Behavior Therapy', 'Behavioral', 'Biological Markers', 'Bulimia', 'Characteristics', 'Clinical', 'Clinical Trials Database', 'Collaborations', 'Collection', 'Comorbidity', 'Complex', 'Data', 'Decision Trees', 'Detection', 'Diagnosis', 'Dimensions', 'Disease', 'Equilibrium', 'Goals', 'Grief reaction', 'Healthcare', 'Heterogeneity', 'Individual', 'Intervention', 'Learning', 'Machine Learning', 'Major Depressive Disorder', 'Measures', 'Mental disorders', 'Methods', 'Modeling', 'National Institute of Mental Health', 'Outcome', 'Participant', 'Patient Recruitments', 'Patients', 'Performance', 'Pharmacological Treatment', 'Psychiatry', 'Randomized Controlled Trials', 'Reproducibility', 'Research', 'Research Domain Criteria', 'Resources', 'Sampling', 'Strategic Planning', 'Subgroup', 'Surveys', 'Translating', 'Trees', 'analytical method', 'base', 'burden of illness', 'clinical practice', 'demographics', 'effective therapy', 'evidence base', 'improved', 'individual patient', 'individualized medicine', 'learning strategy', 'mental health center', 'neuroimaging', 'neurophysiology', 'neuropsychiatry', 'novel', 'optimal treatments', 'patient subsets', 'personalized approach', 'personalized medicine', 'psychologic', 'psychosocial', 'response', 'sex', 'success', 'symptomatology', 'treatment effect', 'treatment response', 'treatment strategy']",NIMH,COLUMBIA UNIVERSITY HEALTH SCIENCES,R21,2019,243000,0.20613656529879387
"Integrative Learning to Combine Evidence for Personalized Treatment Strategies. Project Summary:  Mental disorders represent immense healthcare burdens. Intense efforts and resources have been devoted to developing pharmacological and behavioral treatments for mental disorders, but no universally effective treatments are available. Considerable heterogeneity exists in treatment response among individuals with mental disorders, in part because an individual patient's psychosocial characteristics and/or biomarkers are not accounted for when selecting among available treatment options. Barriers to implement personalized treatments in clinical psychiatry include a lack of evidence-based, clinically interpretable, individualized treatment rules (ITRs), a lack of power to detect treatment modiﬁers from a single study, and a lack of reproducibility for treatment rules estimated from single studies. We propose analytic solutions to tackle these barriers. Speciﬁcally, we will provide integrative machine learning methods to build powerful, yet interpretable, individualized treatment strategies that can be easily applied in clinical practice. We will integrate evidence of ITRs identiﬁed in multiple randomized controlled trials (RCTs) to increase robustness and reproducibility. In Aim 1, we will provide piece-wise linear decision trees that are trans- parent, interpretable, and that have guaranteed performance. Our decision trees will simultaneously identify the optimal treatment for a given patient (qualitative interaction) and subgroups of patients with large beneﬁt (quan- titative interaction). In Aim 2, we propose a novel integrative analysis to synthesize evidence across trials and provide an integrative ITR that improves efﬁciency and reproducibility. Our method does not require all studies to collect common sets of variables and thus allows evidence to be combined from ITRs identiﬁed in recent RCTs that collected emerging biomarkers (e.g., neuroimaging measures) with earlier RCTs that focused on clinical and be- havioral markers. In response to the National Institute of Mental Health Strategic Plan on Research Domain Criteria (RDoC) to center mental health research around “dimensional psychological constructs” shared across disorders, the methods will be applied to a wide range of RCTs that recruited patients with major depressive disorder and other co-morbid mental disorders. This strategy allows examination of ITRs for constructs shared across disorders and will increase generalizability. We will apply our methods to various RCTs, including data available from the Na- tional Database for Clinical Trials Related to Mental Illness. This research will bridge approaches for personalized medicine and integrative analysis in an effort to better understand the complex interplay between biomarkers and clinical manifestations in the context of selecting the best treatments for patients with mental disorders. Project Narrative:  Treatment responses for mental disorders are inadequate and considerable heterogeneity is observed, in part because an individual patient's clinical, psychosocial, and/or biological markers are not accounted for when select- ing treatments among available options. This research proposes novel analytic methods to discover new powerful, yet interpretable personalized treatment strategies and integrate evidence of strategies identiﬁed in multiple prior studies to increase robustness and reproducibility.",Integrative Learning to Combine Evidence for Personalized Treatment Strategies.,9581848,R21MH117458,"['Age', 'Anxiety Disorders', 'Behavior Therapy', 'Behavioral', 'Biological Markers', 'Bulimia', 'Characteristics', 'Clinical', 'Clinical Trials Database', 'Collaborations', 'Collection', 'Comorbidity', 'Complex', 'Data', 'Decision Trees', 'Detection', 'Diagnosis', 'Dimensions', 'Disease', 'Equilibrium', 'Goals', 'Healthcare', 'Heterogeneity', 'Individual', 'Intervention', 'Learning', 'Machine Learning', 'Major Depressive Disorder', 'Measures', 'Mental disorders', 'Methods', 'Modeling', 'National Institute of Mental Health', 'Outcome', 'Parents', 'Participant', 'Patient Recruitments', 'Patients', 'Performance', 'Pharmacological Treatment', 'Psychiatry', 'Randomized Controlled Trials', 'Reproducibility', 'Research', 'Research Domain Criteria', 'Resources', 'Sampling', 'Strategic Planning', 'Subgroup', 'Surveys', 'Time', 'Translating', 'Trees', 'analytical method', 'base', 'burden of illness', 'clinical practice', 'demographics', 'effective therapy', 'evidence base', 'improved', 'individual patient', 'individualized medicine', 'learning strategy', 'mental health center', 'neuroimaging', 'neurophysiology', 'neuropsychiatry', 'novel', 'optimal treatments', 'patient subsets', 'personalized approach', 'personalized medicine', 'psychologic', 'psychosocial', 'response', 'sex', 'success', 'symptomatology', 'treatment effect', 'treatment response', 'treatment strategy']",NIMH,COLUMBIA UNIVERSITY HEALTH SCIENCES,R21,2018,202500,0.20734290343892114
"Assisted Identification and Navigation of Early Mental Health Symptoms in Youth ABSTRACT Only slightly more than half (55%) of 4-17 year olds with significant mental health difficulties receive treatment. These are often not initiated until issues are significantly impacting the child and family. Nearly half of children with known mental health disorders and up to 80% of children with sub-clinical symptoms receive no treatment. This study aims to (a) develop methods based on electronic medical records data to identify early mental health needs in children 4-17 years of age and (b) conduct a pragmatic randomized trial in two non-academic health care systems to test a mental health family navigator model to promote early access to, engagement in, and coordination of needed mental health services for children and adolescence. Phase 1 of the study would focus on the development and refinement of a natural language processing (NLP) tool to identify symptomatic 4-17 year olds with no diagnosed mental health disorder(s). The tool would identify patients with documentation of mental health symptoms or complaints in the free text of a progress note from a recent primary care or urgent care visit. Phase 2 of the study would focus on conducting a pragmatic randomized trial comparing intervention and usual care arm patients enrolled from Kaiser Permanente (KP) Washington and KP Northern California. The trial will enroll 200 patients per arm (n=400). The navigator model to be implemented and tested will include three groups based on recent visits recorded in the electronic health record. Those with: (1) a new mental health diagnosis; (2) new mental health medication ordered, no mental health diagnosis; (3) no new mental health diagnosis or medication (symptoms identified by NLP tool). The study intervention will offer 6 months of support to the family by a mental health navigator (social worker). The navigator will perform an initial needs and barriers assessment with the family around mental health services, conduct ongoing motivational interviewing around mental health care, provide up to 4 bridging psychotherapy sessions (when appropriate) via clinic-to-home video visits, help the family find and schedule with appropriate mental health providers in the community, reach out ad hoc if mental health appointments or medication refills are missed, stay in contact with the family for 6 months. The primary outcome is percentage of youth with at least 4 psychotherapy visits in the 6 months following the initial visit. The secondary outcome is the percentage of youth with >=80% medication adherence over the 6 month follow up period. We hypothesize that the intervention arm will have higher rates of psychotherapy use and medication adherence compared to the control arm. We will also assess medication adjustments, initiation of psychotherapy or medications, and (intervention arm only) change in self-efficacy in navigating the mental health care system over 6 months. All primary analyses will follow an intent-to-treat approach. A waiver of consent will be obtained to include data for all individuals offered the intervention in the analysis, regardless of the amount of intervention (“dose” of navigation) received. NARRATIVE Mental illnesses often first appear in childhood and adolescence yet go mostly untreated until a serious disorder develops. This study will (a) develop ways to identify early mental health needs in children 4-17 years of age using free text notes entered into medical records, and (b) carry out a two-arm randomized trial to test if offering social worker support and video-based psychotherapy result in more mental health visits over a 6 month period of time.",Assisted Identification and Navigation of Early Mental Health Symptoms in Youth,9752077,R56MH117767,"['17 year old', 'Abnormal coordination', 'Accident and Emergency department', 'Address', 'Adolescence', 'Adolescent', 'Adult', 'Antipsychotic Agents', 'Appointment', 'California', 'Caring', 'Case Manager', 'Child', 'Childhood', 'Chronic Disease', 'Clinic', 'Clinical', 'Communities', 'Computerized Medical Record', 'Consent', 'Data', 'Development', 'Diagnosis', 'Disease', 'Documentation', 'Dose', 'Early identification', 'Electronic Health Record', 'Enrollment', 'Family', 'Family health status', 'Goals', 'Health Personnel', 'Health Services Accessibility', 'Health system', 'Healthcare', 'Healthcare Systems', 'Home environment', 'Individual', 'Integrated Health Care Systems', 'Intervention', 'Intervention Studies', 'Medical Records', 'Mental Depression', 'Mental Health', 'Mental Health Services', 'Mental disorders', 'Methods', 'Modeling', 'Monitor', 'Natural Language Processing', 'Nurses', 'Outcome', 'Patients', 'Pharmaceutical Preparations', 'Primary Health Care', 'Process', 'Provider', 'Psyche structure', 'Psychiatry', 'Psychotherapy', 'Reporting', 'Research', 'Role', 'Schedule', 'Self Efficacy', 'Social Workers', 'Structure', 'Symptoms', 'System', 'Systems Integration', 'Testing', 'Text', 'Therapeutic', 'Time', 'Videoconferencing', 'Visit', 'Wait Time', 'Washington', 'Work', 'Youth', 'arm', 'base', 'behavioral health', 'burden of illness', 'care providers', 'child mental health service', 'electronic registry', 'experience', 'follow-up', 'improved', 'improved outcome', 'indexing', 'medical specialties', 'medication compliance', 'motivational enhancement therapy', 'outreach', 'peer', 'phase 1 study', 'phase 2 study', 'pragmatic trial', 'prevent', 'primary outcome', 'programs', 'randomized trial', 'secondary outcome', 'severe mental illness', 'skills', 'time use', 'tool', 'treatment arm', 'treatment as usual', 'treatment services', 'trial comparing', 'trial design', 'urgent care', 'usual care arm', 'waiver']",NIMH,KAISER FOUNDATION RESEARCH INSTITUTE,R56,2018,741297,0.26199655498987623
