text,title,id,project_number,terms,administration,organization,mechanism,year,funding,score
"MRI Signatures of Neuromelanin and Iron Pathology in Parkinsonism Parkinson’s disease (PD), multiple system atrophy parkinsonian type (MSA-P), and progressive supranuclear palsy (PSP) are costly and devastating neurodegenerative diseases. They have overlapping clinical manifestations and diagnosis remains challenging in many cases. Thus far no effective treatments have been developed to meaningfully slow or stop their progression. This is due in part to a lack of tools to objectively measure degeneration in the neural systems affected by each of these diseases. Availability of such tools would assist clinical diagnosis, facilitate selection of appropriate patient groups for trial recruitment, and enable objective measurement of treatment outcomes. Recent MRI studies suggest that disease-specific brain changes can, indeed, be identified in these parkinsonian diseases. The objective of this research is to identify univariable markers and multivariable MRI signatures that capture distinct patterns of neurodegenerative change across neural systems to accurately distinguish these diseases.  To accomplish this the investigators use 3 Tesla MRI contrasts sensitive to key features of neurodegeneration to 1) identify structures damaged by PD, MSA-P and PSP and 2) to quantify the extent of damage in each neural system in parkinsonian diseases. Specifically, the investigators use neuromelanin- sensitive MRI to measure neuromelanin loss and quantitative susceptibility mapping (QSM) and R2* imaging to measure iron accumulation in patients with PD, MSA-P, and PSP. Using these contrasts and an innovative region of interest (ROI) selection approach, they reproducibly measure patterns of neurodegenerative change across neural systems. In Aim 1 the investigators use neuromelanin-sensitive MRI to study neuromelanin loss in PD, MSA-P and PSP in to identify univariable disease features that are differentially affected by parkinsonian diseases and may assist distinguishing these conditions. In Aim 2 they use QSM and R2* MRI to study ROIs differentially impacted by PD, MSA-P and PSP to identify iron accumulation biomarkers to help distinguish these diseases. In Aim 3 the investigators apply machine learning classification algorithms to identify multivariable MRI signatures of neurodegenerative change across neural systems to differentiate PD, MSA-P and PSP. Study outputs will be candidate MRI biomarkers and disease signatures. The long term goal of this research is to further develop these outputs for use as clinical diagnostic tools and as biomarkers for subject selection and outcome measurement in clinical trials.  Through this career award Dr. Huddleston will gain new skills in MRI methods, data science, and neural systems imaging in parkinsonian diseases. These new skills will enable Dr. Huddleston to design and lead interdisciplinary neuroimaging biomarker studies for Parkinson’s disease and related disorders. His mentor team is comprised of leaders in their fields. This team and the dynamic research environment at Emory University provide the necessary support for Dr. Huddleston to successfully transition to scientific independence. There is an urgent public health need for new treatments to slow or stop the progression of Parkinson’s disease, multiple system atrophy and progressive supranuclear palsy, and objective tools to distinguish these diseases for clinical and research purposes are lacking. The outputs of the proposed research will be candidate MRI biomarkers and multivariable MRI signatures to differentiate these conditions. These candidate biomarkers may be developed for use in clinical trial designs to increase their odds of success, and they may also assist clinical diagnosis.",MRI Signatures of Neuromelanin and Iron Pathology in Parkinsonism,9666652,K23NS105944,"['Affect', 'Algorithms', 'Autopsy', 'Award', 'Biological Markers', 'Brain', 'Classification', 'Clinic', 'Clinical', 'Clinical Research', 'Clinical Trials', 'Clinical Trials Design', 'Clinical assessments', 'Custom', 'Data', 'Data Science', 'Deep Brain Stimulation', 'Dentate nucleus', 'Deposition', 'Development', 'Diagnosis', 'Differential Diagnosis', 'Disease', 'Environment', 'Freezing', 'Future', 'Gait', 'Globus Pallidus', 'Goals', 'Image', 'Image Analysis', 'Individual', 'Iron', 'Lateral', 'Lead', 'Machine Learning', 'Magnetic Resonance Imaging', 'Measurement', 'Measures', 'Medial', 'Mentors', 'Meta-Analysis', 'Methods', 'Modality', 'Monitor', 'Movement Disorders', 'Multiple System Atrophy', 'Nerve Degeneration', 'Neurodegenerative Disorders', 'Neurology', 'Operative Surgical Procedures', 'Outcome', 'Output', 'Parkinson Disease', 'Parkinsonian Disorders', 'Pathology', 'Patients', 'Pattern', 'Predisposition', 'Process', 'Productivity', 'Progressive Supranuclear Palsy', 'Public Health', 'Questionnaires', 'Red nucleus structure', 'Reproducibility', 'Research', 'Research Personnel', 'Societies', 'Structure', 'Structure of subthalamic nucleus', 'Subjects Selections', 'Substantia nigra structure', 'System', 'Therapeutic', 'Training', 'Treatment outcome', 'Universities', 'Visit', 'Work', 'base', 'candidate marker', 'career', 'clinical Diagnosis', 'clinical diagnostics', 'cost', 'design', 'diagnostic accuracy', 'disorder control', 'effective therapy', 'follow-up', 'image processing', 'imaging modality', 'imaging system', 'improved', 'improved outcome', 'in vivo', 'innovation', 'interest', 'locus ceruleus structure', 'magnetic resonance imaging biomarker', 'neuroimaging marker', 'neuromelanin', 'neuron loss', 'nigrostriatal system', 'novel', 'pars compacta', 'patient screening', 'putamen', 'recruit', 'relating to nervous system', 'skills', 'success', 'tool']",NINDS,EMORY UNIVERSITY,K23,2018,192564,0.1338232057744053
"(PQ2) PD-L1/PD-1 signals in aged hosts undergoing cancer immunotherapy This proposal combines a team with expertise in aging, tumor immunology, tumor immunotherapy, specific genetically modified animal models and early phase clinical trials with a computational team having great expertise in analyzing and modeling aging of the immune system. We will study age effects on PD-L1/PD-1 signaling in the host and the tumor focusing on melanoma with some bladder cancer work, two tumors that are highly responsive to αPD-1 and/or αPD-L1 as proofs-of-concept, and residing in distinct anatomic compartments. In Aim 1 we study tumor PD-L1 intrinsic effects on αPD-L1 and αPD-1 treatment in melanoma and bladder cancer using transplantable B16 and inducible Nras/Cdk2n melanoma models, and transplantable MB49 and BBN-induced tumors for bladder cancer studies. We also use novel melanoma and BC models with tumor cell- specific PD-L1KO. We study 3 cohorts of elderly versus younger humans getting αPD-L1 or αPD-1 for melanoma or bladder cancer for human validation. We measure high-dimensional cell phenotypes and signaling responses, proteins and genes to maximize the information collected from human samples and mice using 23-color FACS, CyTOF, Luminex, Nanostring and other approaches. In Aim 2 we use all the above models and analytic strategies in young and aged PD-L1KO mice and WT or bone marrow chimeras to test hematopoietic and non- hematopoietic (host) PD-L1 signals in treatment outcomes in melanoma and bladder cancer. In Aim 3 the Systems Immunology team will use their innovative and successful computational modeling to identify age- related co-predictors of immunotherapy response and to identify candidate mechanisms for responders and non- responders. We will define a trajectory of immune system aging in mice at ultra-high resolution by performing a systems level integrative analysis of aging in Collaborative Cross and BL6 mice tracked in a combined longitudinal and cross-sectional study. This trajectory will be used to understand how tumor response and treatment outcomes vary as a function of age, and to build a simple, low parameter (i.e., easily testable and clinically translated), predictive models of treatment response. We will test insights by analyzing immune data from aged versus young patients undergoing αPD-L1 and αPD-1 cancer immunotherapy in novel machine learning approaches that we pioneered to identify insights from mouse data that are relevant to humans. Coupling this disease information with the healthy human aging trajectory that we recently defined will allow us to adapt our mouse data to predict optimal treatments in humans based on chronological and immune aging. This combined trans-disciplinary approach will identify common age-related disabilities that reduce PD-L1/PD-1 based immunotherapy responses and suggest tailored treatments for optimal efficacy that could later be tested in validation sets. These data can also be applied to other types of immunotherapy as we will also test. Cancer is a disease of the aged, but therapies are generally modeled in the young. We study age effects on cancer immunotherapy in response to PQ2 to develop ways to optimize cancer immunotherapy in aged patients most at risk. We focus on the PD-L1/PD-1 axis that is the cornerstone of the most successful cancer immunotherapies to date.",(PQ2) PD-L1/PD-1 signals in aged hosts undergoing cancer immunotherapy,9592156,R01CA231325,"['Address', 'Affect', 'Age', 'Aging', 'Anatomy', 'Animal Model', 'Antineoplastic Agents', 'Appearance', 'Bladder Neoplasm', 'Blocking Antibodies', 'Bone Marrow', 'Cancer Model', 'Cancer Patient', 'Cells', 'Chimera organism', 'Chronology', 'Clinical', 'Clinical Trials', 'Color', 'Comorbidity', 'Complement', 'Computer Simulation', 'Coupling', 'Cross-Sectional Studies', 'Data', 'Detection', 'Disease', 'Effectiveness', 'Elderly', 'Genes', 'Genetically Modified Animals', 'Hematopoietic', 'Human', 'Immune', 'Immune System Diseases', 'Immune system', 'Immunity', 'Immunology', 'Immunotherapy', 'Individual', 'Longitudinal Studies', 'Machine Learning', 'Malignant Neoplasms', 'Malignant neoplasm of urinary bladder', 'Measures', 'Metabolism', 'Modeling', 'Morphologic artifacts', 'Mus', 'Organ', 'Outcome', 'PDCD1LG1 gene', 'Patients', 'Pharmaceutical Preparations', 'Phase', 'Phenotype', 'Preclinical Testing', 'Prediction of Response to Therapy', 'Proteins', 'Publishing', 'Regulatory T-Lymphocyte', 'Research', 'Risk', 'Risk Factors', 'SLEB2 gene', 'Sampling', 'Signal Transduction', 'System', 'Systems Biology', 'T-Lymphocyte Subsets', 'Testing', 'Translating', 'Transplantation', 'Treatment Efficacy', 'Treatment Protocols', 'Treatment outcome', 'Tumor Immunity', 'Validation', 'Work', 'age effect', 'age related', 'aged', 'base', 'cancer immunotherapy', 'cell dimension', 'cohort', 'dimensional analysis', 'disability', 'high dimensionality', 'human disease', 'immune checkpoint', 'immune function', 'improved', 'individual patient', 'individualized medicine', 'innovation', 'insight', 'mathematical model', 'melanoma', 'metagenome', 'mouse model', 'nano-string', 'neoplasm immunotherapy', 'neoplastic cell', 'novel', 'optimal treatments', 'preclinical study', 'prediction algorithm', 'predictive modeling', 'responders and non-responders', 'response', 'tool', 'treatment optimization', 'treatment response', 'treatment strategy', 'tumor', 'tumor immunology', 'tumor microenvironment', 'ultra high resolution']",NCI,UNIVERSITY OF TEXAS HLTH SCIENCE CENTER,R01,2018,582917,0.19121176099118606
"Reinforcement Learning for Closed-Loop Deep Brain Stimulation ABSTRACT Parkinson's disease (PD) is the second most common neurodegenerative disease, affecting 1 in 100 people over the age of 60, and more than 5 million people worldwide. Deep brain stimulation (DBS) has emerged as an effective treatment for the motor signs of PD. However, DBS is often limited by partial efficacy, side effects, and long and difficult clinical visits to identify and program therapeutic stimulation settings. Additionally, PD symptoms fluctuate from moment-to-moment depending on a multitude of factors, and therefore the demand for stimulation (or medication) changes throughout the day. There is a clear need for automated, individualized DBS programming strategies that can both reduce programming time and adapt to deliver optimal stimuli as each patient's symptoms fluctuate. The ultimate goal of this proposal is to improve the quality of life for PD patients by providing them with an intelligent, adaptive, closed-loop DBS algorithm. In Aim 1, we propose to create a closed-loop DBS algorithm in silico that can learn from and adapt to electro-physiological signatures of parkinsonian states in order to deliver optimal, patient- specific stimulation. The algorithm will be built upon the framework of reinforcement learning, which has several desirable properties that make it ideally suited for use in a closed-loop DBS algorithm. Given a biomarker for parkinsonian severity and a set of possible actions, the algorithm will autonomously learn how to deliver stimulus to reduce the biomarker and therefore PD symptoms. Preliminary results shown in this proposal suggest that the algorithm is able to learn complex actions without a priori knowledge, and can help to control a selected biomarker. In Aim 2, we propose to test out the algorithm in a large animal model of PD with high-density DBS arrays that have been shown to enable more advanced current steering and higher resolution local field potential recordings. We will then apply the algorithm and compare its performance to continuous DBS in terms of effects on individual parkinsonian motor signs as well as the electrophysiological signal targeted by the algorithm. This project will not only provide a means to critically evaluate putative biomarkers of DBS therapy for alleviating parkinsonian motor signs, but also provide a much more versatile and powerful closed-loop algorithm for use in titrating DBS therapy for individuals with Parkinson's disease and other neurological disorders amenable to deep brain stimulation therapy. As a result of this project, we will create a closed-loop DBS algorithm that can help improve the quality of life for Parkinson's disease patients. NARRATIVE Parkinson's disease (PD) is a neurodegenerative disorder that affects 1 in 100 people over the age of 60, and while dopamine replacement medication is well established for alleviating many of the motor symptoms of PD, but deep brain stimulation (DBS) is often indicated, in conjunction with medication as the disease progresses. One of the significant challenges with DBS is patient-specific dosimetry of stimulation settings to efficiently achieve a strong and consistent therapeutic effect. This project will develop an innovative reinforcement learning algorithm that autonomously learns which stimulation settings are most effective at reducing parkinsonian motor signs based on closed-loop feedback of oscillatory activity within the subthalamic nucleus and globus pallidus using high-density electrode arrays.",Reinforcement Learning for Closed-Loop Deep Brain Stimulation,9638443,F31NS103487,"['Address', 'Adverse effects', 'Affect', 'Age', 'Algorithms', 'Animal Model', 'Attention', 'Basal Ganglia', 'Behavioral', 'Biological Markers', 'Blinded', 'Brain', 'Cell Nucleus', 'Clinical', 'Complex', 'Computer Simulation', 'Coupling', 'Decision Making', 'Deep Brain Stimulation', 'Devices', 'Disease', 'Disease Progression', 'Dopamine', 'Electrodes', 'Electrophysiology (science)', 'Environment', 'Feedback', 'Functional disorder', 'Globus Pallidus', 'Goals', 'Implant', 'Individual', 'Investigation', 'Knowledge', 'Lead', 'Learning', 'Macaca mulatta', 'Machine Learning', 'Moods', 'Motor', 'Neurodegenerative Disorders', 'Neurologic', 'Neurons', 'Neurotoxins', 'Parkinson Disease', 'Parkinsonian Disorders', 'Patients', 'Performance', 'Pharmaceutical Preparations', 'Phase', 'Physiologic pulse', 'Population Heterogeneity', 'Process', 'Property', 'Psychological reinforcement', 'Quality of life', 'Refractory', 'Resolution', 'Rewards', 'Role', 'Severities', 'Signal Transduction', 'Sleep', 'Stimulus', 'Structure', 'Structure of subthalamic nucleus', 'Symptoms', 'System', 'Testing', 'Therapeutic', 'Therapeutic Effect', 'Time', 'Titrations', 'Training', 'Travel', 'Visit', 'Work', 'base', 'clinical translation', 'computational network modeling', 'deep brain stimulation array', 'deep reinforcement learning', 'density', 'dosimetry', 'effective therapy', 'falls', 'improved', 'individual patient', 'innovation', 'investigator training', 'motor symptom', 'nervous system disorder', 'neuronal patterning', 'neurophysiology', 'nonhuman primate', 'novel', 'programs', 'relating to nervous system', 'response', 'therapy outcome', 'tool']",NINDS,UNIVERSITY OF MINNESOTA,F31,2018,30197,0.11219444812975234
"Metabolomics and risk of Parkinson's Disease ﻿    DESCRIPTION (provided by applicant): Parkinson disease (PD) is the second most common neurodegenerative disease in the United States and affects over one million Americans; this number is growing due to population aging. Current treatments do not prevent the disease progression that ultimately results in severe disability. There is thus a compelling need to develop neuroprotective treatments. Because at the time of the clinical diagnosis of PD there is already substantial neuronal loss, such treatments should ideally be initiated earlier. Aims of the proposed investigation are to implement and validate a novel metabolomic approach for the identification of early changes in peripheral blood of individuals with preclinical or premotor PD. The metabolomic results will be integrated with detailed and validated information on risk factors for PD, which has been collected prospectively and periodically updated. We expect by this means to identify new clues to the etiology of PD and to identify a metabolomic signature of PD that could contribute to an early diagnosis. To achieve these goals, we will take advantage of data and blood samples collected from over 80,000 participants in three large ongoing cohorts, the Nurses' Health Study (NHS), the Health Professional Follow-up Study (HPFS), and the Cancer Prevention Study-II Nutrition, who have been followed for over 25 years for incident Parkinson disease. We expect to include a total of 805 incident cases of PD that will be matched to 805 controls, using a nested case-control design. PUBLIC HEALTH RELEVANCE: Parkinson disease is a chronic progressive disease for which there is no cure - the loss of brain cells that leads to disability develops insidiously over many years, and by the time the disease is diagnosed it is already extensive and irreversible. To identify Parkinson disease years before it becomes clinically manifest, we are proposing a novel approach that will take advantage of the peripheral blood and detailed lifestyle and medical information collected from over 80,000 individuals who were followed for up to 25 years. By comparing the blood levels of hundreds of compounds between the blood of individuals who developed Parkinson disease and the blood of individuals of the same age and sex who remained healthy, we expect to make novel discoveries on the etiology of Parkinson disease and to be able to develop a method for the early identification of Parkinson disease in other populations.",Metabolomics and risk of Parkinson's Disease,9536156,R01NS089619,"['Affect', 'Age', 'Alanine', 'American', 'Archives', 'Biological Markers', 'Blood', 'Blood specimen', 'Branched-Chain Amino Acids', 'Caffeine', 'Cancer Prevention Study II', 'Choline', 'Chronic', 'Chronic Disease', 'Clinical', 'Coffee', 'Cohort Studies', 'Confounding Factors (Epidemiology)', 'Consumption', 'Creatine', 'Cross-Sectional Studies', 'Data', 'Data Collection', 'Diabetes Mellitus', 'Diagnosis', 'Diagnostic', 'Diet', 'Disease', 'Disease Progression', 'Early Diagnosis', 'Early identification', 'Etiology', 'Event', 'Failure', 'Follow-Up Studies', 'Functional disorder', 'Funding', 'Glutamates', 'Goals', 'Health Professional', 'Incidence', 'Individual', 'Institutes', 'Insulin Resistance', 'Investigation', 'Life Style', 'Machine Learning', 'Measures', 'Mediating', 'Medical', 'Medical History', 'Metabolic', 'Metabolic Pathway', 'Methods', 'Motor', 'National Institute of Neurological Disorders and Stroke', 'Nature', 'Nerve Degeneration', 'Neurodegenerative Disorders', 'Nurses&apos', ' Health Study', 'Parkinson Disease', 'Participant', 'Patients', 'Persons', 'Phase', 'Physical activity', 'Plasma', 'Population', 'Progressive Disease', 'Research', 'Resources', 'Risk', 'Risk Factors', 'Sampling', 'Smoking', 'Specificity', 'Techniques', 'Therapeutic', 'Time', 'United States', 'United States National Institutes of Health', 'Update', 'Urate', 'Validation', 'Women&apos', 's Health Nursing', 'Work', 'acylcarnitine', 'aging population', 'base', 'brain cell', 'cancer prevention', 'case control', 'cigarette smoking', 'clinical Diagnosis', 'cohort', 'design', 'diabetes risk', 'disability', 'disorder risk', 'follow-up', 'gender difference', 'insight', 'interest', 'men', 'metabolic profile', 'metabolome', 'metabolomics', 'mitochondrial dysfunction', 'motor symptom', 'neuron loss', 'novel', 'novel strategies', 'nutrition', 'peripheral blood', 'pre-clinical', 'prospective', 'public health relevance', 'sex', 'specific biomarkers', 'tool']",NINDS,HARVARD SCHOOL OF PUBLIC HEALTH,R01,2018,563079,0.2601752213744809
"The Gut Microbiome in Parkinson Disease Project Summary/Abstract This is a first R01 application from an early stage, new investigator and current NIEHS K01 awardee. Parkinson disease (PD) is a disabling neurodegenerative disease for which there is no cure. Years before the diagnosis of PD and the onset of motor symptoms, PD patients develop non-motor symptoms, including, importantly, constipation and gastrointestinal dysfunction. Constipation affects over 80% of PD patients and is one of the strongest risk factors for PD. Recent research shows that the enteric nervous system in the gut and the dorsal motor nucleus of the vagus nerve which anatomically links the GI system to the brain, are among the first and most severely affected by alpha-synuclein pathology characteristic of PD5 leading to the hypothesis that the gastrointestinal tract might be the site of initiation of PD. We propose to conduct a comprehensive investigation of the relation between human gut microbiome and PD, focusing on the pre- onset microbiome. We will do this by building on an ongoing Department of Defense funded project that has identified participants with pre-parkinson syndrome (PPS - defined as the co- occurrence of constipation, pRBD (probable rapid eye movement sleep behavior disorder) and hyposmia) that in a pilot study has been associated with a ~200 fold increase in PD risk. Studying the microbiome among this group, who are highly likely to develop PD or are already in the premotor state, will give us a unique look at the microbiome in PD patients prior to any potential disease-associated effects of changes in diet and lifestyle that may have confounded prior case-control studies. The proposed study will take advantage of 25 years of prospectively collected data on environmental and dietary exposures and disease outcomes in two prospective cohorts of men and women. Project Narrative Our appreciation of the impact of the gut microbiome on brain health, and especially PD, is in the early stages. This study will be the first to examine the gut microbiome in participants with premotor PD and compare it to healthy controls, controls with constipation and to recently onset PD cases. This project will thus advance our understanding of how the human gut microbiome contributes to the pathophysiology of PD and will contribute to the development of tools needed for a preclinical diagnosis and/or treatment.",The Gut Microbiome in Parkinson Disease,9343057,R01NS097723,"['Affect', 'Anatomy', 'Anti-inflammatory', 'Bacteria', 'Biometry', 'Blood - brain barrier anatomy', 'Brain', 'Butyrates', 'Caffeine', 'Case-Control Studies', 'Characteristics', 'Chronic Disease', 'Confounding Factors (Epidemiology)', 'Constipation', 'Consumption', 'Data', 'Data Collection', 'Department of Defense', 'Diagnosis', 'Diet', 'Disease', 'Disease Outcome', 'Enteric Nervous System', 'Enterobacteriaceae', 'Epidemiology', 'Exhibits', 'Feces', 'Follow-Up Studies', 'Functional disorder', 'Funding', 'Gait', 'Gastrointestinal tract structure', 'Genes', 'Health Professional', 'Human', 'Individual', 'Inflammatory', 'Inflammatory disease of the intestine', 'Intestines', 'Investigation', 'Life Style', 'Link', 'Machine Learning', 'Mediating', 'Metabolic', 'Mucous Membrane', 'National Institute of Environmental Health Sciences', 'Nature', 'Neurodegenerative Disorders', 'Nurses&apos', ' Health Study', 'Onset of illness', 'Oxidative Stress', 'Parkinson Disease', 'Parkinsonian Disorders', 'Participant', 'Pathology', 'Pathway Analysis', 'Pathway interactions', 'Patients', 'Permeability', 'Pilot Projects', 'Production', 'Prospective cohort', 'Prospective cohort study', 'Proteobacteria', 'REM Sleep Behavior Disorder', 'Ralstonia', 'Reporting', 'Research', 'Research Personnel', 'Risk', 'Risk Factors', 'Site', 'Symptoms', 'Syndrome', 'System', 'Techniques', 'Update', 'Vagus nerve structure', 'Volatile Fatty Acids', 'Woman', 'alpha synuclein', 'brain health', 'cigarette smoking', 'cohort', 'disorder risk', 'dorsal motor nucleus', 'dysbiosis', 'follow-up', 'gastrointestinal', 'gut bacteria', 'gut microbiome', 'gut microbiota', 'hyposmia', 'illness length', 'men', 'microbiome', 'microbiome analysis', 'microbiome composition', 'microbiome research', 'microbiota profiles', 'motor symptom', 'non-motor symptom', 'posture instability', 'pre-clinical', 'predictive signature', 'prospective', 'stool sample', 'tool development']",NINDS,UNIVERSITY OF MASSACHUSETTS LOWELL,R01,2018,418825,0.30384371424562184
