text,title,id,project_number,terms,administration,organization,mechanism,year,funding,score
"CRCNS: Deep Neural Network Approaches for Closed-Loop Deep Brain Stimulation The discovery that aberrant synchronization of rhythmic neuronal activity recorded in PD patients is suppressed by DBS has advanced the concept that measures associated with pathological activity may be used as biomarkers to control the delivery of DBS therapy. Pilot studies of aDBS in PD have reported promising clinical results from triggering DBS stimulation when the signal recorded from the DBS electrode showed a high level of oscillatory power in the beta frequency range (13 – 35 Hz). That approach, however, has important limitations. Most importantly, beta power recorded from the DBS lead is suppressed by movement including PD tremor, its detection is highly dependent on lead location and the recording montage needed to record during stimulation is incompatible with directional current steering, a recent innovation employing segmented stimulation contacts. The inherent complexity of the increased parameter space through DBS innovations also overwhelms standard programming techniques. Finally, use of additional biomarker signals (e.g., recorded from cortex) is likely to improve the ability to adaptively control DBS for disorders marked by complex multidimensional symptomatologies such as PD. The current proposal will establish methods for overcoming these limitations by developing techniques for multi-feature classification from ECoG recordings, using advanced machine learning algorithms. The proposed research builds upon the extensive and unique experiences with multi-day, extra-operative recording from DBS leads in patients at Charité Hospital and intraoperative ECoG and DBS recording from patients at the University of Pittsburgh, in order to develop computational methods to advance closed-loop, adaptive DBS (aDBS) strategies for movement disorders. This research seeks to improve computational methods for interpreting brain signals recorded from patients undergoing deep brain stimulation for Parkinson’s disease. The results may inform the design of novel strategies for biomarker-responsive brain stimulation.",CRCNS: Deep Neural Network Approaches for Closed-Loop Deep Brain Stimulation,10021999,R01NS110424,"['3-Dimensional', 'Affect', 'Age', 'Algorithms', 'Artificial Intelligence', 'Basal Ganglia', 'Behavior', 'Behavioral', 'Berlin', 'Biological Markers', 'Bradykinesia', 'Brain', 'Brain region', 'Cell Nucleus', 'Characteristics', 'Chronic', 'Classification', 'Clinical', 'Complex', 'Computing Methodologies', 'Custom', 'Data', 'Data Collection', 'Deep Brain Stimulation', 'Detection', 'Development', 'Disease', 'Electrocorticogram', 'Electrodes', 'Environment', 'Epilepsy', 'Evolution', 'Frequencies', 'Future', 'Goals', 'Hospitals', 'Human', 'Implant', 'Intelligence', 'Investigation', 'Joints', 'Knowledge', 'Lead', 'Life', 'Location', 'Machine Learning', 'Maps', 'Measures', 'Medicine', 'Methods', 'Modeling', 'Motor', 'Movement', 'Movement Disorders', 'Neurons', 'Neurosciences', 'Noise', 'Operative Surgical Procedures', 'Parkinson Disease', 'Parkinsonian Disorders', 'Pathologic', 'Patients', 'Performance', 'Periodicity', 'Physiological', 'Pilot Projects', 'Population', 'Procedures', 'Recurrence', 'Reporting', 'Research', 'Series', 'Severities', 'Signal Transduction', 'Specificity', 'Symptoms', 'Techniques', 'Testing', 'Therapeutic', 'Time', 'Training', 'Tremor', 'Universities', 'Validation', 'Work', 'artificial neural network', 'base', 'cohort', 'computer framework', 'deep learning', 'deep neural network', 'design', 'experience', 'implantation', 'improved', 'innovation', 'interest', 'learning strategy', 'machine learning algorithm', 'multidisciplinary', 'neuropsychiatric disorder', 'neurosurgery', 'novel', 'novel strategies', 'reconstruction', 'reduce symptoms', 'remote sensor', 'symptomatology', 'translational neuroscience']",NINDS,MASSACHUSETTS GENERAL HOSPITAL,R01,2019,228673,0.07302303249174412
"DaTscan-based Disease Progression Models for Early-stage Parkinson’s Disease Project Summary Parkinson's disease (PD) is heterogeneous: it has many subtypes and the disease progresses at different rates in different subtypes. Disease progression in early-stage PD is observed as signal changes in SPECT imaging with 123I-FP-CIT, which is called DaTscan imaging, or simply DaTscan. The goal of the research proposed here is to create accurate models of heterogeneous PD progression using DaTscan images. Such models will not only provide additional insight into PD, but they are also critically important in assessing the effect of neuro-protective therapy. A new set of models called mixtures of linear dynamical systems (MLDS) are proposed to model early-state PD progression as it manifests in DaTscans. MLDS models combine machine-learning methods with linear dynamical system theory. They capture many features of early-stage PD progression: laterality, non-linear progression, as well as PD heterogeneity. Preliminary results show that, MLDS is accurate, finds progression subtypes, relates well to clinical data (MDS-UPDRS motor scores), and gives genuinely new insights about PD progression. The proposed research aims to develop the MLDS methodology in region-of-interest as well as voxel-based frameworks. A detailed discussion of the MLDS theory, model fitting, and the relation to clinical data is included. Longitudinal DaTscan images as well as MDS-UPDRS motor scores are available for over 440 subjects from the Parkinson's Progression Markers Initiative (PPMI), and this data set will be used along with MLDS to create the PD progression models. Project Narrative How Parkinson's disease (PD) progresses is poorly understood. This research proposes to develop precise disease progression models for PD using machine-learning. These models will give greater insight into PD progression and also help assess PD therapy.",DaTscan-based Disease Progression Models for Early-stage Parkinson’s Disease,9698441,R01NS107328,"['Algorithms', 'Anterior', 'Bilateral', 'Biological Models', 'Clinical', 'Clinical Data', 'Corpus striatum structure', 'Coupled', 'Coupling', 'Data', 'Data Analyses', 'Data Set', 'Disease', 'Disease Progression', 'Enrollment', 'Exhibits', 'Glean', 'Globus Pallidus', 'Goals', 'Handedness', 'Image', 'Joints', 'Left', 'Machine Learning', 'Mathematics', 'Measures', 'Methodology', 'Methods', 'Modeling', 'Motor', 'National Institute of Neurological Disorders and Stroke', 'Parkinson Disease', 'Pattern', 'Recommendation', 'Research', 'Research Design', 'Signal Transduction', 'Systems Theory', 'Work', 'base', 'disease heterogeneity', 'dopamine transporter', 'dynamic system', 'expectation', 'insight', 'interest', 'learning strategy', 'model design', 'neuron loss', 'presynaptic', 'progression marker', 'putamen', 'research clinical testing', 'single photon emission computed tomography', 'uptake']",NINDS,YALE UNIVERSITY,R01,2019,353562,0.2832214024651006
"Mid-frontal delta/theta rhythms and cognitive control in PD Abstract Up to 80% of patients with Parkinson's disease (PD) will suffer from cognitive symptoms, including impaired attention, planning, reasoning and working memory as well as hallucinations, visuospatial dysfunction, and delusions. These impairments lead to mild cognitive impairment (PD-MCI) and dementia (PDD) in PD. Cognitive symptoms of PD are associated with enormous cost to our society. There are no clear biomarkers and few effective treatments for PD-MCI/PDD. Because risk for PD increases dramatically with age, this problem will surge as our population grows older. The mechanisms contributing to PD-MCI/PDD are unknown. Our group has found that low-frequency (1-8 Hz; or delta/theta bands) brain rhythms might be helpful in diagnosing cognitive dysfunction in PD. This delta/theta activity originates from areas of medial frontal cortex such as the anterior cingulate, and is detectable by mid-frontal scalp EEG electrodes. We have found that mid-frontal delta/theta brain rhythms are engaged when healthy individuals detect novelty, errors, and conflict, or make decisions. These rhythms are attenuated in PD patients. Our working model is that PD patients manifest diverse neuronal and network deficits that impair mid-frontal delta/theta activity, leading to failures in engaging cognitive control. These abnormalities contribute to PD-MCI and PDD. In this proposal we combine `big-data' machine learning tools, intraoperative neurophysiology in humans, and new brain-stimulation paradigms to investigate the role of mid-frontal delta/theta rhythms in PD. We will test the overall hypothesis that mid-frontal delta/theta impairments are a mechanism of cognitive dysfunction in PD. In Aim 1 we will determine if mid-frontal delta/theta activity predicts PD-MCI/PDD. In Aim 2 we will use unique intraoperative recordings to determine how delta/theta activity within medial frontal cortex influences neurons in the subthalamic nucleus, a key site of functional convergence that is targeted by current deep-brain stimulation for PD. Notably, the subthalamic nucleus is a compact structure that receives highly overlapping input from cognitive and motor cortical regions, making it likely that our recordings will capture cognitive processing within this nucleus. Finally, in Aim 3 we will determine if subthalamic nucleus deep-brain stimulation at delta/theta frequencies improves cognitive control in PD patients. Because these experiments involve recordings across several PD patient populations (Aim 1), from single subthalamic neurons (Aim 2), and brain stimulation (Aim 3), each of these aims will provide independent mechanistic insight into cognitive dysfunction in PD. PD is a complex disease, but if cortical EEG abnormalities are a consistent theme it might inspire new diagnostic tools or new brain-stimulation therapies for cognitive dysfunction in PD. Results from this proposal could also be important for other neurodegenerative diseases such as dementia with Lewy bodies and Alzheimer's disease.     Public Health Relevance Cognitive symptoms of Parkinson's disease are an enormous public health problem. Here, we will ana- lyze brain rhythms that are involved in cognitive processing and also dysfunctional in Parkinson's dis- ease. We will use these brain rhythms to guide novel brain stimulation that has the potential to treat dementia and cognitive impairments in Parkinson's disease.  ",Mid-frontal delta/theta rhythms and cognitive control in PD,9730653,R01NS100849,"['Acetylcholine', 'Affect', 'Age', 'Alpha Rhythm', 'Alzheimer&apos', 's Disease', 'Anterior', 'Area', 'Attention', 'Attenuated', 'Big Data', 'Biological Markers', 'Brain', 'Cell Nucleus', 'Cognitive', 'Cognitive Therapy', 'Complex', 'Conflict (Psychology)', 'Data', 'Decision Making', 'Deep Brain Stimulation', 'Delusions', 'Dementia', 'Detection', 'Diagnosis', 'Disease', 'Dopamine', 'Electrodes', 'Electroencephalography', 'Etiology', 'Failure', 'Frequencies', 'Functional disorder', 'Genetic', 'Goals', 'Hallucinations', 'Human', 'Impaired cognition', 'Impairment', 'Individual', 'Lead', 'Lewy Body Dementia', 'Machine Learning', 'Medial', 'Memory', 'Modeling', 'Motor', 'Neurobehavioral Manifestations', 'Neurodegenerative Disorders', 'Neurons', 'Parkinson Disease', 'Parkinson&apos', 's Dementia', 'Patients', 'Performance', 'Population', 'Process', 'Public Health', 'Reaction Time', 'Risk', 'Role', 'Scalp structure', 'Short-Term Memory', 'Signal Transduction', 'Site', 'Societies', 'Structure', 'Structure of subthalamic nucleus', 'Techniques', 'Testing', 'Theta Rhythm', 'Time', 'Visuospatial', 'Work', 'alpha synuclein', 'cognitive control', 'cognitive function', 'cognitive task', 'cost', 'disorder risk', 'effective therapy', 'experimental study', 'frontal lobe', 'implantation', 'improved', 'insight', 'mild cognitive impairment', 'motor symptom', 'neuronal patterning', 'neurophysiology', 'new therapeutic target', 'novel', 'novel diagnostics', 'patient population', 'public health relevance', 'tool']",NINDS,UNIVERSITY OF IOWA,R01,2019,75097,0.3254254783141677
"MRI Signatures of Neuromelanin and Iron Pathology in Parkinsonism Parkinson’s disease (PD), multiple system atrophy parkinsonian type (MSA-P), and progressive supranuclear palsy (PSP) are costly and devastating neurodegenerative diseases. They have overlapping clinical manifestations and diagnosis remains challenging in many cases. Thus far no effective treatments have been developed to meaningfully slow or stop their progression. This is due in part to a lack of tools to objectively measure degeneration in the neural systems affected by each of these diseases. Availability of such tools would assist clinical diagnosis, facilitate selection of appropriate patient groups for trial recruitment, and enable objective measurement of treatment outcomes. Recent MRI studies suggest that disease-specific brain changes can, indeed, be identified in these parkinsonian diseases. The objective of this research is to identify univariable markers and multivariable MRI signatures that capture distinct patterns of neurodegenerative change across neural systems to accurately distinguish these diseases.  To accomplish this the investigators use 3 Tesla MRI contrasts sensitive to key features of neurodegeneration to 1) identify structures damaged by PD, MSA-P and PSP and 2) to quantify the extent of damage in each neural system in parkinsonian diseases. Specifically, the investigators use neuromelanin- sensitive MRI to measure neuromelanin loss and quantitative susceptibility mapping (QSM) and R2* imaging to measure iron accumulation in patients with PD, MSA-P, and PSP. Using these contrasts and an innovative region of interest (ROI) selection approach, they reproducibly measure patterns of neurodegenerative change across neural systems. In Aim 1 the investigators use neuromelanin-sensitive MRI to study neuromelanin loss in PD, MSA-P and PSP in to identify univariable disease features that are differentially affected by parkinsonian diseases and may assist distinguishing these conditions. In Aim 2 they use QSM and R2* MRI to study ROIs differentially impacted by PD, MSA-P and PSP to identify iron accumulation biomarkers to help distinguish these diseases. In Aim 3 the investigators apply machine learning classification algorithms to identify multivariable MRI signatures of neurodegenerative change across neural systems to differentiate PD, MSA-P and PSP. Study outputs will be candidate MRI biomarkers and disease signatures. The long term goal of this research is to further develop these outputs for use as clinical diagnostic tools and as biomarkers for subject selection and outcome measurement in clinical trials.  Through this career award Dr. Huddleston will gain new skills in MRI methods, data science, and neural systems imaging in parkinsonian diseases. These new skills will enable Dr. Huddleston to design and lead interdisciplinary neuroimaging biomarker studies for Parkinson’s disease and related disorders. His mentor team is comprised of leaders in their fields. This team and the dynamic research environment at Emory University provide the necessary support for Dr. Huddleston to successfully transition to scientific independence. There is an urgent public health need for new treatments to slow or stop the progression of Parkinson’s disease, multiple system atrophy and progressive supranuclear palsy, and objective tools to distinguish these diseases for clinical and research purposes are lacking. The outputs of the proposed research will be candidate MRI biomarkers and multivariable MRI signatures to differentiate these conditions. These candidate biomarkers may be developed for use in clinical trial designs to increase their odds of success, and they may also assist clinical diagnosis.",MRI Signatures of Neuromelanin and Iron Pathology in Parkinsonism,9786824,K23NS105944,"['Affect', 'Autopsy', 'Award', 'Biological Markers', 'Brain', 'Clinic', 'Clinical', 'Clinical Research', 'Clinical Trials', 'Clinical Trials Design', 'Clinical assessments', 'Custom', 'Data', 'Data Science', 'Deep Brain Stimulation', 'Dentate nucleus', 'Deposition', 'Development', 'Diagnosis', 'Differential Diagnosis', 'Disease', 'Environment', 'Freezing', 'Future', 'Gait', 'Globus Pallidus', 'Goals', 'Image', 'Image Analysis', 'Individual', 'Iron', 'Lateral', 'Lead', 'Machine Learning', 'Magnetic Resonance Imaging', 'Measurement', 'Measures', 'Medial', 'Mentors', 'Meta-Analysis', 'Methods', 'Modality', 'Monitor', 'Movement Disorders', 'Multiple System Atrophy', 'Nerve Degeneration', 'Neurodegenerative Disorders', 'Neurology', 'Operative Surgical Procedures', 'Outcome', 'Output', 'Parkinson Disease', 'Parkinsonian Disorders', 'Pathology', 'Patients', 'Pattern', 'Predisposition', 'Process', 'Productivity', 'Progressive Supranuclear Palsy', 'Public Health', 'Questionnaires', 'Red nucleus structure', 'Reproducibility', 'Research', 'Research Personnel', 'Societies', 'Structure', 'Structure of subthalamic nucleus', 'Subjects Selections', 'Substantia nigra structure', 'System', 'Therapeutic', 'Training', 'Treatment outcome', 'Universities', 'Visit', 'Work', 'analysis pipeline', 'automated analysis', 'base', 'candidate marker', 'career', 'classification algorithm', 'clinical Diagnosis', 'clinical diagnostics', 'cost', 'design', 'diagnostic accuracy', 'disorder control', 'effective therapy', 'follow-up', 'image processing', 'imaging modality', 'imaging system', 'improved', 'improved outcome', 'in vivo', 'innovation', 'interest', 'locus ceruleus structure', 'magnetic resonance imaging biomarker', 'neuroimaging marker', 'neuromelanin', 'neuron loss', 'nigrostriatal system', 'novel', 'pars compacta', 'patient screening', 'putamen', 'recruit', 'relating to nervous system', 'skills', 'success', 'tool']",NINDS,EMORY UNIVERSITY,K23,2019,192564,0.1338232057744053
"(PQ2) PD-L1/PD-1 signals in aged hosts undergoing cancer immunotherapy This proposal combines a team with expertise in aging, tumor immunology, tumor immunotherapy, specific genetically modified animal models and early phase clinical trials with a computational team having great expertise in analyzing and modeling aging of the immune system. We will study age effects on PD-L1/PD-1 signaling in the host and the tumor focusing on melanoma with some bladder cancer work, two tumors that are highly responsive to αPD-1 and/or αPD-L1 as proofs-of-concept, and residing in distinct anatomic compartments. In Aim 1 we study tumor PD-L1 intrinsic effects on αPD-L1 and αPD-1 treatment in melanoma and bladder cancer using transplantable B16 and inducible Nras/Cdk2n melanoma models, and transplantable MB49 and BBN-induced tumors for bladder cancer studies. We also use novel melanoma and BC models with tumor cell- specific PD-L1KO. We study 3 cohorts of elderly versus younger humans getting αPD-L1 or αPD-1 for melanoma or bladder cancer for human validation. We measure high-dimensional cell phenotypes and signaling responses, proteins and genes to maximize the information collected from human samples and mice using 23-color FACS, CyTOF, Luminex, Nanostring and other approaches. In Aim 2 we use all the above models and analytic strategies in young and aged PD-L1KO mice and WT or bone marrow chimeras to test hematopoietic and non- hematopoietic (host) PD-L1 signals in treatment outcomes in melanoma and bladder cancer. In Aim 3 the Systems Immunology team will use their innovative and successful computational modeling to identify age- related co-predictors of immunotherapy response and to identify candidate mechanisms for responders and non- responders. We will define a trajectory of immune system aging in mice at ultra-high resolution by performing a systems level integrative analysis of aging in Collaborative Cross and BL6 mice tracked in a combined longitudinal and cross-sectional study. This trajectory will be used to understand how tumor response and treatment outcomes vary as a function of age, and to build a simple, low parameter (i.e., easily testable and clinically translated), predictive models of treatment response. We will test insights by analyzing immune data from aged versus young patients undergoing αPD-L1 and αPD-1 cancer immunotherapy in novel machine learning approaches that we pioneered to identify insights from mouse data that are relevant to humans. Coupling this disease information with the healthy human aging trajectory that we recently defined will allow us to adapt our mouse data to predict optimal treatments in humans based on chronological and immune aging. This combined trans-disciplinary approach will identify common age-related disabilities that reduce PD-L1/PD-1 based immunotherapy responses and suggest tailored treatments for optimal efficacy that could later be tested in validation sets. These data can also be applied to other types of immunotherapy as we will also test. Cancer is a disease of the aged, but therapies are generally modeled in the young. We study age effects on cancer immunotherapy in response to PQ2 to develop ways to optimize cancer immunotherapy in aged patients most at risk. We focus on the PD-L1/PD-1 axis that is the cornerstone of the most successful cancer immunotherapies to date.",(PQ2) PD-L1/PD-1 signals in aged hosts undergoing cancer immunotherapy,9788318,R01CA231325,"['Address', 'Affect', 'Age', 'Aging', 'Anatomy', 'Animal Model', 'Antineoplastic Agents', 'Appearance', 'Bladder Neoplasm', 'Blocking Antibodies', 'Bone Marrow', 'Cancer Model', 'Cancer Patient', 'Cells', 'Chimera organism', 'Chronology', 'Clinical', 'Clinical Trials', 'Color', 'Comorbidity', 'Complement', 'Computer Simulation', 'Coupling', 'Cross-Sectional Studies', 'Data', 'Detection', 'Disease', 'Effectiveness', 'Elderly', 'Genes', 'Genetically Modified Animals', 'Hematopoietic', 'Human', 'Immune', 'Immune System Diseases', 'Immune system', 'Immunity', 'Immunology', 'Immunotherapy', 'Individual', 'Longitudinal Studies', 'Machine Learning', 'Malignant Neoplasms', 'Malignant neoplasm of urinary bladder', 'Measures', 'Metabolism', 'Modeling', 'Morphologic artifacts', 'Mus', 'Organ', 'Outcome', 'PD-1/PD-L1', 'PDCD1LG1 gene', 'Patients', 'Pharmaceutical Preparations', 'Phase', 'Phenotype', 'Preclinical Testing', 'Prediction of Response to Therapy', 'Proteins', 'Publishing', 'Regulatory T-Lymphocyte', 'Research', 'Risk', 'Risk Factors', 'SLEB2 gene', 'Sampling', 'Signal Transduction', 'System', 'Systems Biology', 'T-Lymphocyte Subsets', 'Testing', 'Translating', 'Transplantation', 'Treatment Efficacy', 'Treatment Protocols', 'Treatment outcome', 'Tumor Immunity', 'Validation', 'Work', 'age effect', 'age related', 'aged', 'base', 'cancer immunotherapy', 'cell dimension', 'cohort', 'dimensional analysis', 'disability', 'high dimensionality', 'human disease', 'immune checkpoint', 'immune function', 'improved', 'individual patient', 'individualized medicine', 'innovation', 'insight', 'mathematical model', 'melanoma', 'metagenome', 'mouse model', 'nano-string', 'neoplasm immunotherapy', 'neoplastic cell', 'novel', 'optimal treatments', 'preclinical study', 'prediction algorithm', 'predictive modeling', 'responders and non-responders', 'response', 'tool', 'treatment optimization', 'treatment response', 'treatment strategy', 'tumor', 'tumor immunology', 'tumor microenvironment', 'ultra high resolution']",NCI,UNIVERSITY OF TEXAS HLTH SCIENCE CENTER,R01,2019,530090,0.19121176099118606
