text,title,id,project_number,terms,administration,organization,mechanism,year,funding,score
"Spinal Epidural Electrode Array To Facilitate Standing and Stepping After SCI     DESCRIPTION (provided by applicant):  In the first 5-year period of our BRP we had two major objectives:  1) to determine whether we could improve motor function of the lower limbs by neuromodulating the spinal lumbosacral circuitry with epidural stimulation and 2) to begin to develop and improve the technologies associated with electrode arrays and chronic implantable stimulation devices to maximize the neuromodulatory potential.  These new technologies have the potential to fine tune the epidural stimulation parameters, to help in understanding some of the underlying mechanisms of epidural stimulation., to examine synergistic effects of epidural stimulation, pharmacological modulation, and examine activity-dependent interventions that might affect the level of recovery of motor function after complete paralysis.  We have demonstrated that an adult rat with a complete, mid-thoracic spinal cord transection can regain full weight-bearing stepping over a range of speeds, loads, and even directions when the spinal cord is stimulated tonically to increase the excitability of the lumbosacral locomotor circuitry.  Furthermore, we learned that load-bearing sensory information can serve as the controller of these complex motor tasks and that the performance of these tasks can be improved even further with combinations of epidural stimulation, pharmacological, and motor training interventions.  We have shown that four humans with a motor complete spinal injury have regained independent standing, assisted stepping, and even a significant level of voluntary control of the lower limbs in the presence of epidural stimulation, with one subject now even having some volitional control without stimulation.  Improvement in bladder control, blood pressure, temperature regulation, and even sexual function has been realized.  Thus, our present challenge is to develop the capability to selectively activate combinations of neural networks that can enable standing, and probably stepping, by improving the technologies needed to make this intervention available in the clinic and in the home of individuals with complete motor paralysis using a chronic epidural electrode implant.  Specifically, we will further improve the electrode array stimulation technology needed for fine-tune control in rats and humans and transform the present hardwired technology for rats to a wireless capability to stimulate and record evoked potentials along the brain-spinal cord-muscle axis in the rat.  To advance the clinical potential, we will continue to develop, refine and validate our machine-learning strategies which automatically optimize stimulation parameters for standing, stepping, and voluntary control.  We will develop an improved interface between the devices implanted in our present subjects and the control devices for defining the specific stimulation parameters needed for a given subject to perform a motor task in the clinic or at home.           PUBLIC HEALTH RELEVANCE:  We now have demonstrated that the human lumbosacral spinal cord can be neuromodulated with epidural stimulation to enable recovery of standing and volitional control of the lower limbs and return of some autonomic function after complete motor paralysis.  Therefore, our objectives are now to develop the technologies needed to more fully capitalize on this clinical potential and develop home-use technologies to do so.                  ",Spinal Epidural Electrode Array To Facilitate Standing and Stepping After SCI,8696689,U01EB007615,"['Adult', 'Affect', 'Algorithms', 'Animals', 'Behavior', 'Binding', 'Biological Neural Networks', 'Bladder Control', 'Blood Pressure', 'Brain', 'Chest', 'Chronic', 'Clinic', 'Clinical', 'Complex', 'Contusions', 'Data', 'Devices', 'Dorsal', 'Educational Intervention', 'Electrodes', 'Evaluation', 'Evoked Potentials', 'Experimental Designs', 'Frequencies', 'Home environment', 'Human', 'Implant', 'Implanted Electrodes', 'Individual', 'Injury', 'Internet', 'Intervention', 'Intramuscular', 'Learning', 'Locomotor training', 'Lower Extremity', 'Machine Learning', 'Methods', 'Modeling', 'Monitor', 'Motor', 'Muscle', 'Paralysed', 'Patients', 'Pattern', 'Performance', 'Physiological', 'Procedures', 'Process', 'Rattus', 'Recovery', 'Regulation', 'Research', 'Robotics', 'Sensory', 'Sex Functioning', 'Signal Transduction', 'Speed', 'Spinal', 'Spinal Cord', 'Spinal Cord transection injury', 'Spinal Injuries', 'Spinal cord injury', 'Stimulus', 'System', 'Task Performances', 'Technology', 'Temperature', 'Testing', 'Thoracic spinal cord structure', 'Training', 'Weight-Bearing state', 'Wireless Technology', 'base', 'density', 'design', 'implantable device', 'improved', 'in vivo', 'motor control', 'motor function improvement', 'motor function recovery', 'new technology', 'next generation', 'novel', 'public health relevance', 'somatosensory', 'voltage']",NIBIB,UNIVERSITY OF CALIFORNIA LOS ANGELES,U01,2014,1152001,0.1493894438330521
"Enabling forelimb function with agonist drug and epidural stimulation in SCI     DESCRIPTION (provided by applicant):  We have demonstrated that the physiological state of the lumbosacral spinal circuitry of spinal rats and cats can be modulated with spinal cord epidural stimulation (EDS) and/or administration of pharmacological agents to generate weight-bearing standing and stepping over a range of speeds, loads, and directions.  We have translated some of these results to humans by implanting 3 motor complete spinal cord injured (SCI) subjects about three years post-injury with an epidural electrode array over the lumbosacral spinal cord.  In less than one month post-electrode implant, the subjects could stand independently, and after up to 7 months of daily EDS and motor training, voluntary control of both legs was evident in the presence of EDS, whereas complete paralysis remained in absence of EDS.  We propose to employ a similar stimulation strategy for the recovery of upper limb function.  We will include extensive testing of spinal rats to guide our strategy to test for upper extremity improvement in human SCI subjects.  We will use off-the-shelf FDA approved pharmacological and stimulation modalities to:  1) Determine the optimal stimulation parameters, i.e., electrode placement and stimulation intensity, frequency and duration, for facilitating forelimb fine motor function in rats with a cervical SCI.  Using existing FDA-approved epidural electrodes, we will demonstrate in patients with a cervical SCI that cervical EDS can facilitate arm-hand function.  2) Identify an effective mode of administration, define the dose- response pharmacokinetics, and determine the effectiveness of a monoaminergic agonist to facilitate upper limb function after a cervical SCI.  We will assess the effectiveness of existing FDA-approved pharmacological agents (i.e., buspirone and as an alternative, bromocriptine), and determine their effectiveness in improving forelimb control in subjects with a cervical SCI.  3) Define the dose-response properties of monoaminergic agonists when combined with EDS in facilitating forelimb function in rats after a cervical SCI.  We will demonstrate the efficacy of ES in combination with a pharmacological intervention in facilitating arm and hand function in humans after a cervical SCI.  4) Determine whether motor training of spinal rats will further enhance the recovery of motor function when combined with pharmacological and/or EDS interventions.  5) Develop a protocol for machine learning to enable rapid selection of the optimal pharmacological and EDS parameters for motor recovery in rats and in human subjects.  If successful, this could represent the beginning of a paradigm shift in the use of minimally invasive strategies combined with rehabilitative approaches to realize significant improvement in upper limb function after paralysis.         PUBLIC HEALTH RELEVANCE:  It now seems possible to apply three interventions (epidural stimulation, administration of pharmacological agents, and motor training) to control the excitability of localized neural circuits in humans with a cervical spinal cord injury (SCI), thus enabling these individuals to regain use of their arms and hands.  This enabling effect is similar to that observed with improved postural and locomotor function after a mid-thoracic SCI.  We will reach critical milestones that will provide the basis for a series of clinical trials for furter defining the efficacy of these interventions.                ",Enabling forelimb function with agonist drug and epidural stimulation in SCI,8690845,U01EB015521,"['Agonist', 'Algorithms', 'Ankle', 'Bromocriptine', 'Buspirone', 'Cervical', 'Cervical spinal cord injury', 'Cervical spinal cord structure', 'Chronic', 'Clinical Trials', 'Complement', 'Devices', 'Dose', 'Drug Kinetics', 'Effectiveness', 'Electrodes', 'FDA approved', 'Felis catus', 'Food', 'Forelimb', 'Frequencies', 'Goals', 'Hand', 'Hand functions', 'Hip region structure', 'Human', 'Implant', 'Implanted Electrodes', 'Individual', 'Injury', 'Intervention', 'Knee', 'Leg', 'Lesion', 'Lower Extremity', 'Machine Learning', 'Methodology', 'Modality', 'Motor', 'Motor Skills', 'Oral', 'Paralysed', 'Patients', 'Pharmaceutical Preparations', 'Physiological', 'Preparation', 'Property', 'Protocols documentation', 'Rattus', 'Recovery', 'Rehabilitation therapy', 'Retrieval', 'Series', 'Speed', 'Spinal', 'Spinal Cord', 'Spinal cord injury', 'Testing', 'Thoracic spinal cord structure', 'Time', 'Toes', 'Training', 'Translating', 'Treatment Efficacy', 'Upper Extremity', 'Weight-Bearing state', 'arm', 'base', 'design', 'human subject', 'improved', 'minimally invasive', 'motor function recovery', 'neural circuit', 'neuroregulation', 'public health relevance', 'response']",NIBIB,UNIVERSITY OF CALIFORNIA LOS ANGELES,U01,2014,819964,0.12676612487114006
"CRCNS:  Effects of Weak Applied Currents on Memory Consolidation During Sleep    DESCRIPTION (provided by applicant):  Intellectual Merit: There is compelling evidence that the distinct stages of sleep play an essential role in the long-term consolidation of memories (Marshall & Born 2007). Specifically, slow-wave sleep (SWS), which is hallmarked by slow oscillatory activity (< 1 Hz) in the human electro-encephalogram (EEG), has been implicated in memory consolidation. We demonstrated that weak electric currents (<1mA, <1Hz and DC) applied to the scalp during SWS modulate these endogenous EEG rhythms and can improve human memory performance (Marshall 2006a). Moreover, application of the same weak currents during learning modulates ongoing EEG rhythms that are typical for the awake state in humans and boosts immediate performance in some learning tasks (Kirov 2009). Yet, despite these remarkable phenomenological findings, the question of how weak currents can modulate brain oscillations and induce plastic changes in brain function remains fundamentally unaddressed. Here we propose to quantitatively address this question through the development of computational models that are tightly constrained by specialized brain-slice experiments and validated through targeted human subject experiments. A central question is: how can weak electric currents, that appear insufficient to modulate excitability or plasticity in quiescent neurons, exert such a powerful effect on oscillations and learning? Our central hypothesis is that weak currents couple into ongoing slow oscillatory activity that then boost their modulatory effect on synaptic plasticity. Preliminary data from our group and others already provides strong evidence for modulation of endogenous rhythmic network activity by applied currents - at intensities considered too weak to affect single neuron function. Concurrently, we and other groups have investigated links between slow wave activity and memory consolidation, including by application of weak currents in human. But a specific connection between the effects of applied weak currents on slow-wave rhythms and plasticity has so far not been explored. Guided by computational models, the crucial empirical link between the two will be sought by probing lasting changes resulting from weak-current stimulation of an in vitro cortical preparation that exhibits SWA. Targeted human experiments will directly test if applied currents also enhance the consolidation of other SWS-mediated learning as the hypothesis would suggest, or rather, if the effect is limited to hippocampus-related learning, thus providing significant constraints to the computational models.    Broader Impacts: Weak applied currents are being explored in a number of empirical studies for their potential benefits to treat depression and neuropathic pain, to assist motor learning after stroke, or more generally, to enhance cognitive performance and to improve learning. The promise of this technique is that weak currents can be applied non-invasively with a potentially broad range of applications and minimal side effects. The enigma in this potentially transformative clinical tool, however, is that the electric field strengths generated by these currents in most studies are two orders of magnitude below what is required to activate an otherwise silent neuron. Currently, research in this area is almost entirely phenomenological and the few mechanistic explanations for the promising phenomenological observations are superficial (e.g. describing all brain function as a ""sliding scale of excitability"") and do not address plasticity - as such, there is no rational basis for improving and targeting stimulation protocols. This work is the first attempt at establishing the mechanistic link between applied currents on endogenous rhythms and the associated SWS-related learning enhancements. Evidently, such an analysis will address basic science questions about the link between endogenous SWS and learning, add to the set of experimental tools which can be used to study cognition, and, shed light on the functional and causal role of the ubiquitous endogenous rhythms generated by the brain.    Consistent with present call for US/German Collaborative Research in Computational Neuroscience this project will combined the expertise of international researchers in the areas of: (1) effects of noninvasive electrical stimulation on nervous tissue (Bikson, US), EEG signal analysis and computational network models (Parra, US), human sleep and learning with applied currents (Marshall, Germany), and dynamical systems and machine learning (Claussen/Martinetz, Germany; Parra, US).           n/a",CRCNS:  Effects of Weak Applied Currents on Memory Consolidation During Sleep,8662794,R01MH092926,"['Acute', 'Address', 'Adverse effects', 'Affect', 'Area', 'Basic Science', 'Brain', 'Chemosensitization', 'Clinical', 'Code', 'Cognition', 'Cognitive', 'Communication', 'Computer Simulation', 'Data', 'Dependence', 'Development', 'Electric Stimulation', 'Electrodes', 'Equilibrium', 'Exhibits', 'Experimental Models', 'Frequencies', 'German population', 'Germany', 'Hippocampus (Brain)', 'Human', 'In Vitro', 'Injection of therapeutic agent', 'International', 'Ion Channel', 'Kale - dietary', 'Learning', 'Light', 'Link', 'Literature', 'Long-Term Effects', 'Machine Learning', 'Marshal', 'Measures', 'Mediating', 'Membrane', 'Memory', 'Mental Depression', 'Modeling', 'Neocortex', 'Nerve Tissue', 'Neurons', 'Pattern', 'Perceptual learning', 'Performance', 'Phase', 'Plastics', 'Play', 'Positioning Attribute', 'Predictive Value', 'Preparation', 'Principal Investigator', 'Process', 'Property', 'Protocols documentation', 'Pyramidal Cells', 'Rattus', 'Research', 'Research Personnel', 'Role', 'Scalp structure', 'Signal Transduction', 'Site', 'Sleep', 'Sleep Stages', 'Slice', 'Slide', 'Slow-Wave Sleep', 'Stimulus', 'Stroke', 'Surface', 'Synapses', 'Synaptic Potentials', 'Synaptic plasticity', 'System', 'Techniques', 'Testing', 'Thalamic structure', 'Theoretical model', 'Time', 'Training', 'Visual', 'Wakefulness', 'Work', 'awake', 'base', 'computational network modeling', 'computational neuroscience', 'data modeling', 'density', 'electric field', 'human subject', 'imprint', 'improved', 'memory trace reactivation', 'motor learning', 'neocortical', 'painful neuropathy', 'receptive field', 'research study', 'response', 'tool', 'voltage']",NIMH,CITY COLLEGE OF NEW YORK,R01,2014,124361,0.07440298224802545
"Mechanisms of neural circuit dynamics in working memory ﻿    DESCRIPTION (provided by applicant): Working memory, the ability to temporarily hold multiple pieces of information for mental manipulation, is central to virtually all cognitive abiliies. Working memory has been closely associated with multiple kinds of neural activity dynamics, such as persistent neural activity, activity ramps, and activity sequences. The neural circuit mechanisms of these dynamics remain unclear. This proposal will apply advanced technologies such as virtual reality, automated monitoring of behavior, in vivo microscopy, ontogenetic, and neural circuit reconstruction to solve fundamental problems in the understanding of working memory. The accumulation of evidence over time scales of seconds, a type of working memory critical for decision-making, will be used as a test bed for studying working memory. The proposal will build upon a rodent evidence-accumulation paradigm that allows quantitative, temporally precise parameterization of working memory and decision-making. The paradigm will be implemented with head-fixed rodents behaving in a virtual reality system (Aim 1), providing mechanical stability that enables the use of two-photon calcium imaging to observe neural activity related to working memory in the neocortex, basal ganglia, and cerebellum (Aim 3). Brain activity will also be perturbed using ontogenetic to probe the roles of brain regions and specific cell types in the formation and stabilization of memory (Aim 2). Finally, we will develop methods for probing the roles of cell types and connectivity in working memory through correlative serial electron microscopy and light microscopy as well as imaging of population responses to ontogenetic stimulation of single cells or groups of cells (Aim 4). This three-year project will produce a catalog of the types of neural circuit dynamics that are related to working memory across many brain regions. In subsequent years, this catalog will be mechanistically investigated by the anatomical and physiological methods developed in Aim 4. The long-term goal of this project is to arrive at a complete, brain-wide understanding of the cellular and circut mechanisms of activity dynamics related to working memory. The understanding is expected to take the form of a new generation of models containing cognitive variables distributed across brain regions, as well as models that explicitly represent neural circuit dynamics. This achievement will be a crucial step towards a mechanistic understanding of the neural basis of cognition.         PUBLIC HEALTH RELEVANCE: Working memory, the ability to temporarily hold multiple pieces of information for mental manipulation, is central to virtually all cognitive abilities and s disrupted in diseases such as schizophrenia. The long-term goals of this project are to characterize neural activity dynamics related to working memory in diverse brain regions, and to account for those dynamics in an integrated, brain-wide fashion in terms of cellular and circuit mechanisms. These goals will be achieved by observing, mapping, and perturbing brain circuits using advanced technologies which will be disseminated to the entire neuroscience community to accelerate progress towards understanding brain function and dysfunction.                ",Mechanisms of neural circuit dynamics in working memory,8827069,U01NS090541,"['Accounting', 'Achievement', 'Algorithms', 'Anatomy', 'Animal Model', 'Animals', 'Basal Ganglia', 'Beds', 'Behavior', 'Behavior monitoring', 'Behavioral', 'Behavioral Model', 'Brain', 'Brain region', 'Breathing', 'Calcium', 'Cataloging', 'Catalogs', 'Cells', 'Cerebellum', 'Cognition', 'Cognitive', 'Communities', 'Complex', 'Data', 'Decision Making', 'Disease', 'Dopamine', 'Electron Microscopy', 'Foundations', 'Functional disorder', 'Future', 'Generations', 'Goals', 'Head', 'Image', 'Lead', 'Machine Learning', 'Maintenance', 'Maps', 'Mechanics', 'Memory', 'Methods', 'Microscopy', 'Modeling', 'Molecular Probes', 'Monitor', 'Neocortex', 'Neurons', 'Neurosciences', 'Optics', 'Physics', 'Physiological', 'Play', 'Population', 'Property', 'Psyche structure', 'Ramp', 'Reporting', 'Resolution', 'Rodent', 'Role', 'Schizophrenia', 'Sensory Process', 'Short-Term Memory', 'System', 'Technology', 'Testing', 'Time', 'Training', 'Whole-Cell Recordings', 'awake', 'base', 'cell type', 'improved', 'in vivo', 'light microscopy', 'neural circuit', 'nonhuman primate', 'novel', 'optical imaging', 'optogenetics', 'public health relevance', 'reconstruction', 'relating to nervous system', 'response', 'social', 'theories', 'tool', 'two-photon', 'virtual reality']",NINDS,PRINCETON UNIVERSITY,U01,2014,250000,0.04103175641867003
"Vestibular Control of the Vasovagal Response     DESCRIPTION (provided by applicant): Neurogenic (vasovagal) syncope (VVS) is a significant medical problem. The faint is preceded by a Vasovagal Response (VVR), characterized by a sudden drop in arterial blood pressure (BP) and heart rate (HR). VVS and VVRs are diagnosed using a tilt test, a vestibular stimulus. Despite being relatively common, the neural basis of the VVR and the role of the vestibular system in inducing VVRs are not known. Moreover, there is no small animal model of VVRs. We recently showed that low frequency sinusoidal galvanic vestibular stimulation (sGVS) induces VVRs in anesthetized rats. As in humans, VVRs are also induced in rats by tilt. In the proposed research we will characterize the physiological properties of VVRs in rats, thereby establishing a useful small animal model of human VVRs. We propose that VVRs are induced by strong, repeated stimulation of the vestibulo-sympathetic reflex (VSR), which maintains blood flow to the brain during changes in head position relative to gravity. Aim 1 will characterize the transitions from normal VSR to VVRs using pulses and sinusoids of galvanic stimulation to show that VVRs occur when the VSR is appropriately stimulated. Nose up tilt and Translation-While-Rotating (TWR) will be used to determine the axes of stimulation that are most likely to produce VVRs. Additionally, the low frequency oscillations in HR and BP that are produced by sGVS and tilt reflect activation of Mayer waves, thought to be of fundamental importance in maintaining BP stability. In Aim 2 these oscillations will be modeled using a novel concept in which Mayer wave function is represented by a non-linear relaxation oscillator. In Aim 3, single unit neurophysiological studies in otolith-recipient portions of the caudal vestibular nuclei will identify the functional characteristics and physiological signature of VVR- related neurons. Together, the proposed research will establish a model of VVS, document how the vestibular system controls BP, and demonstrate that VVRs are adaptive compensatory responses that serve to re- equilibrate BP after major perturbations.         PUBLIC HEALTH RELEVANCE: Vasovagal syncope (VVS; unexpected fainting) and vasovagal responses (VVR) are a significant medical problem when they recur frequently; the underlying causes and neural mechanisms that produce such fainting are unknown. We have recently shown that activation of the vestibular system causes arterial blood pressure and heart rate changes in anesthetized rats that are similar to the changes in humans during these faints. In this project, we will characterize the changes in blood pressure and heart rate that are produced by activation of the vestibular system with tilts and galvanic stimulation, model the process that is causing the faints with a novel relaxation oscillator, and investigate the underlying neuronal basis for these responses.            ",Vestibular Control of the Vasovagal Response,8624688,R01DC012573,"['Acceleration', 'Algorithms', 'Animal Model', 'Animal Testing', 'Animals', 'Baroreflex', 'Behavior', 'Biological Neural Networks', 'Blood Pressure', 'Blood flow', 'Brain', 'Cardiovascular system', 'Cell Nucleus', 'Characteristics', 'Code', 'Coupling', 'Data', 'Diagnosis', 'Discontinuous Capillary', 'Drops', 'Feedback', 'Force of Gravity', 'Frequencies', 'Generations', 'Head', 'Heart Rate', 'Human', 'Lead', 'Machine Learning', 'Medical', 'Metabolic', 'Modeling', 'Modification', 'Neurons', 'Nose', 'Outcome', 'Output', 'Pathway interactions', 'Physiologic pulse', 'Physiological', 'Positioning Attribute', 'Process', 'Production', 'Property', 'Rattus', 'Reaction', 'Reflex action', 'Refractory', 'Relative (related person)', 'Relaxation', 'Research', 'Role', 'Signal Transduction', 'Simulate', 'Stimulus', 'Syncope', 'System', 'Testing', 'Time', 'Translations', 'Vasovagal', 'Vasovagal Syncope', 'Vestibular nucleus structure', 'Width', 'base', 'blood pressure regulation', 'data modeling', 'falls', 'neuromechanism', 'neurophysiology', 'novel', 'operation', 'otoconia', 'public health relevance', 'relating to nervous system', 'research study', 'response', 'vector']",NIDCD,ICAHN SCHOOL OF MEDICINE AT MOUNT SINAI,R01,2014,344886,0.07961559549614129
