text,title,id,project_number,terms,administration,organization,mechanism,year,funding,score
"Transcranial Magnetic Stimulation for Aphasia: Efficacy and Neural Basis PROJECT SUMMARY Transcranial Magnetic Stimulation (TMS) has been demonstrated to improve language function in subjects with chronic aphasia in a number of small studies, many of which did not include a control group. Although the treatment appears promising, data to date do not permit an adequate assessment of the utility of the technique. We propose to study the effects of TMS combined with Constraint Induced Language Therapy (CILT) in 75 subjects with chronic aphasia. Subjects will be randomized in a 2:1 ratio to TMS with CILT or sham TMS with CILT. One Hz TMS at 90% motor threshold will be delivered to the right inferior frontal gyrus for 20 minutes in 10 sessions over 2 weeks; language therapy will be provided for one hour immediately after the conclusion of each session of TMS. Change from baseline in the Western Aphasia Battery Aphasia Quotient at 6 months after the end of TMS treatment will serve as the primary outcome measure. A secondary aim is to identify anatomic and behavioral predictors of response to treatment. Finally, a third aim is to identify the mechanism underlying the beneficial effect of the treatment using a variety of imaging techniques. Subjects who have no contraindication to the MRI will undergo fMRI imaging prior to and at 6 months after therapy. Using modern network analyses and robust machine learning techniques we will identify changes in the strengths of connections between nodes in the language network to address specific hypotheses regarding the effects of TMS and CILT on brain organization that are associated with beneficial response to treatment. PROJECT NARRATIVE Although Transcranial Magnetic Stimulation (TMS) has been demonstrated to improve language function in subjects with aphasia in many small studies, its general clinical utility has not been established. We propose to study the effects of TMS combined with Constraint Induced Language Therapy in a double-blinded study of 75 subjects with chronic aphasia. Additional aims are to identify anatomic and behavioral predictors of response to treatment and identify the mechanisms underlying the beneficial effect of using modern neuroimaging techniques.",Transcranial Magnetic Stimulation for Aphasia: Efficacy and Neural Basis,9596726,R01DC016800,"['Acquired Language Disorders', 'Address', 'Affect', 'Aftercare', 'Anatomy', 'Aphasia', 'Behavioral', 'Brain', 'Brain imaging', 'Chronic', 'Clinical', 'Control Groups', 'Data', 'Disease', 'Double-Blind Method', 'Functional Magnetic Resonance Imaging', 'Hour', 'Image', 'Imaging Techniques', 'Impairment', 'Individual', 'Inferior frontal gyrus', 'Investigation', 'Language', 'Language Therapy', 'Lesion', 'Location', 'Machine Learning', 'Magnetic Resonance Imaging', 'Measures', 'Modernization', 'Motor', 'Neurosciences', 'Outcome Measure', 'Participant', 'Pathway Analysis', 'Performance', 'Persons', 'Prevalence', 'Procedures', 'Psycholinguistics', 'Randomized', 'Rehabilitation therapy', 'Research Design', 'Research Personnel', 'Series', 'Severities', 'Signal Transduction', 'Speech', 'Stroke', 'Techniques', 'Testing', 'Therapeutic Effect', 'Transcranial magnetic stimulation', 'Work', 'aphasia recovery', 'behavioral neurology', 'clinical investigation', 'effective therapy', 'improved', 'insight', 'interest', 'neuroimaging', 'neuroregulation', 'predicting response', 'primary outcome', 'relating to nervous system', 'response', 'treatment effect', 'treatment response', 'white matter']",NIDCD,UNIVERSITY OF PENNSYLVANIA,R01,2018,609151,0.010061311839079353
"Spinal Epidural Electrode Array To Facilitate Standing and Stepping After SCI DESCRIPTION (provided by applicant):  In the first 5-year period of our BRP we had two major objectives:  1) to determine whether we could improve motor function of the lower limbs by neuromodulating the spinal lumbosacral circuitry with epidural stimulation and 2) to begin to develop and improve the technologies associated with electrode arrays and chronic implantable stimulation devices to maximize the neuromodulatory potential.  These new technologies have the potential to fine tune the epidural stimulation parameters, to help in understanding some of the underlying mechanisms of epidural stimulation., to examine synergistic effects of epidural stimulation, pharmacological modulation, and examine activity-dependent interventions that might affect the level of recovery of motor function after complete paralysis.  We have demonstrated that an adult rat with a complete, mid-thoracic spinal cord transection can regain full weight-bearing stepping over a range of speeds, loads, and even directions when the spinal cord is stimulated tonically to increase the excitability of the lumbosacral locomotor circuitry.  Furthermore, we learned that load-bearing sensory information can serve as the controller of these complex motor tasks and that the performance of these tasks can be improved even further with combinations of epidural stimulation, pharmacological, and motor training interventions.  We have shown that four humans with a motor complete spinal injury have regained independent standing, assisted stepping, and even a significant level of voluntary control of the lower limbs in the presence of epidural stimulation, with one subject now even having some volitional control without stimulation.  Improvement in bladder control, blood pressure, temperature regulation, and even sexual function has been realized.  Thus, our present challenge is to develop the capability to selectively activate combinations of neural networks that can enable standing, and probably stepping, by improving the technologies needed to make this intervention available in the clinic and in the home of individuals with complete motor paralysis using a chronic epidural electrode implant.  Specifically, we will further improve the electrode array stimulation technology needed for fine-tune control in rats and humans and transform the present hardwired technology for rats to a wireless capability to stimulate and record evoked potentials along the brain-spinal cord-muscle axis in the rat.  To advance the clinical potential, we will continue to develop, refine and validate our machine-learning strategies which automatically optimize stimulation parameters for standing, stepping, and voluntary control.  We will develop an improved interface between the devices implanted in our present subjects and the control devices for defining the specific stimulation parameters needed for a given subject to perform a motor task in the clinic or at home. PUBLIC HEALTH RELEVANCE:  We now have demonstrated that the human lumbosacral spinal cord can be neuromodulated with epidural stimulation to enable recovery of standing and volitional control of the lower limbs and return of some autonomic function after complete motor paralysis.  Therefore, our objectives are now to develop the technologies needed to more fully capitalize on this clinical potential and develop home-use technologies to do so.",Spinal Epidural Electrode Array To Facilitate Standing and Stepping After SCI,9572928,U01EB007615,"['Adult', 'Affect', 'Algorithms', 'Animals', 'Behavior', 'Bilateral', 'Biological Neural Networks', 'Bladder Control', 'Blood Pressure', 'Brain', 'Chest', 'Chronic', 'Clinic', 'Clinical', 'Complex', 'Data', 'Devices', 'Dorsal', 'Educational Intervention', 'Electrodes', 'Evaluation', 'Evoked Potentials', 'Experimental Designs', 'Frequencies', 'Gaussian model', 'Home environment', 'Human', 'Implant', 'Implanted Electrodes', 'Individual', 'Injury', 'Internet', 'Intervention', 'Intramuscular', 'Learning', 'Locomotor training', 'Lower Extremity', 'Machine Learning', 'Methods', 'Modeling', 'Monitor', 'Motor', 'Muscle', 'Paralysed', 'Patients', 'Pattern', 'Performance', 'Pharmacology', 'Physiological', 'Posture', 'Procedures', 'Process', 'Rattus', 'Recovery', 'Regulation', 'Research', 'Robotics', 'Sensory', 'Sex Functioning', 'Signal Transduction', 'Speed', 'Spinal', 'Spinal Cord', 'Spinal Cord Contusions', 'Spinal Cord transection injury', 'Spinal Injuries', 'Spinal cord injury', 'Stimulus', 'System', 'Task Performances', 'Technology', 'Temperature', 'Testing', 'Thoracic spinal cord structure', 'Training', 'Volition', 'Weight-Bearing state', 'Wireless Technology', 'base', 'density', 'design', 'implantable device', 'improved', 'in vivo', 'learning strategy', 'motor control', 'motor function improvement', 'motor function recovery', 'neuroregulation', 'new technology', 'next generation', 'novel', 'public health relevance', 'somatosensory', 'treadmill', 'voltage']",NIBIB,UNIVERSITY OF CALIFORNIA LOS ANGELES,U01,2018,1060180,0.1493894438330521
"Inside the social perception network: dynamics, connectivity, and stimulation ﻿    DESCRIPTION (provided by applicant): Aberrant processing of social and affective information is a severe and disabling symptom across many neuropsychiatric disorders, including post-traumatic stress disorder (PTSD) and other anxiety disorders, depression, autism, and schizophrenia. Recent reports demonstrate that direct electrical brain stimulation (EBS) can alter perception, such as changing the identity of a person being viewed or causing memory-related hallucinations. If EBS can distort normal perception, then EBS using different parameters may be able to normalize SAP, for example by modulating affective salience to visual stimuli in PTSD. One key impediment towards developing EBS as a therapy for SAP pathology is that we lack an understanding of how electrical stimulation modulates neurodynamics and cognition. A critical step towards designing rational EBS-based stimulation parameters for SAP pathology is building a causal model of the millisecond-scale temporal dynamics, interregional interactions, and EBS modulation of these dynamics and interactions during SAP. Visual SAP relies on a neural circuit in the temporal lobe that includes the amygdala, fusiform gyrus (FG), and posterior superior temporal sulcus (pSTS). Non-invasive brain imaging techniques either lack the temporal resolution to examine millisecond dynamics (fMRI/PET), or are relatively insensitive to activity in deep brain structures such as the amygdala (MEG/EEG/TMS). Direct neural recordings using intracranial electroencephalography (iEEG) in individuals undergoing neurosurgical evaluation for epilepsy will allow us to overcome these barriers to study the dynamics and interactions in the SAP circuit. Furthermore, delivery of EBS via these implanted electrodes will allow us to examine how electrical modulation of this circuit alters SAP. Using iEEG and advanced analysis methods from machine learning, we recently delineated the set of information processing stages that FG goes through for face perception. In this project, we will test a three- stage dynamic model of the sequence of events and interregional interactions that enable SAP based on these previous results, the work of others, and our preliminary data. We will record iEEG in our regions of interest to test neural dynamics during three critical aspects of social affective processing: perception of facial expression (Aim 1), the inference of actions from motion (Aim 2), and guiding conscious perception to affectively and socially salient stimuli (Aim 3). Then we will employ EBS to modulate perception during these processes. In addition, we will supplement iEEG with magnetoencephalography (MEG), which, while less sensitive to amygdala activity, provides whole-brain cortical coverage and facilitates the comparison of iEEG results to a normative population. The outcome of the proposed research will be a spatially and temporally specific model of the causal dynamics and interactions during SAP. This model will provide testable hypotheses regarding targeted EBS therapies that may normalize pathological SAP. PUBLIC HEALTH RELEVANCE: Narrative Abnormalities in social affective perception are a critical part of the etiology of numerous neuropsychiatric diseases, such as autism, schizophrenia, and post-traumatic stress disorder. The proposed research will map the detailed neurodynamics of critical aspects of social affective perception and examine how these neurodynamics, and the associated cognitions, can be modulated by brain stimulation. The results of this research will lead to a deeper understanding of the neurobiology of social affective perception, a circuit relevant to a number of mental disorders, and take a critical step towards determining how brain stimulation may be used to remediate pathological social affective perception.","Inside the social perception network: dynamics, connectivity, and stimulation",9488537,R01MH107797,"['Affective', 'Amygdaloid structure', 'Anatomy', 'Anger', 'Anxiety Disorders', 'Area', 'Autistic Disorder', 'Biological', 'Body Image', 'Brain', 'Brain imaging', 'Caring', 'Categories', 'Cognition', 'Conscious', 'Data', 'Detection', 'Disease', 'Electric Stimulation', 'Electrical Stimulation of the Brain', 'Electrodes', 'Electroencephalography', 'Electrophysiology (science)', 'Emotional', 'Emotions', 'Epilepsy', 'Etiology', 'Evaluation', 'Event', 'Evolution', 'Face', 'Face Processing', 'Facial Expression', 'Facial Expression Perception', 'Feedback', 'Form Perception', 'Frequencies', 'Functional Magnetic Resonance Imaging', 'Functional disorder', 'Fusiform gyrus', 'Goals', 'Hallucinations', 'Human', 'Image', 'Imaging Techniques', 'Implanted Electrodes', 'Individual', 'Knowledge', 'Lead', 'Link', 'Location', 'Machine Learning', 'Magnetoencephalography', 'Maps', 'Memory', 'Mental Depression', 'Mental disorders', 'Methods', 'Modeling', 'Motion', 'Nature', 'Network-based', 'Neurobiology', 'Operative Surgical Procedures', 'Outcome', 'Pathologic', 'Pathology', 'Patients', 'Perception', 'Persons', 'Physiology', 'Population', 'Positron-Emission Tomography', 'Post-Traumatic Stress Disorders', 'Posture', 'Probability', 'Process', 'Recurrence', 'Reporting', 'Research', 'Research Domain Criteria', 'Schizophrenia', 'Site', 'Social Perception', 'Stimulus', 'Structure', 'Structure of superior temporal sulcus', 'Techniques', 'Temporal Lobe', 'Testing', 'Unconscious State', 'Visual', 'Work', 'base', 'causal model', 'clinically relevant', 'design', 'disabling symptom', 'encephalography', 'evidence base', 'face perception', 'healthy volunteer', 'information processing', 'interest', 'kinematics', 'learning strategy', 'millisecond', 'neural circuit', 'neuroimaging', 'neuropsychiatric disorder', 'public health relevance', 'relating to nervous system', 'response', 'social', 'spatiotemporal', 'targeted treatment', 'temporal measurement', 'visual stimulus']",NIMH,UNIVERSITY OF PITTSBURGH AT PITTSBURGH,R01,2018,446302,0.0911874088610724
"Hippocampal and prefrontal contributions to memory integration PROJECT SUMMARY/ABSTRACT Hippocampus (HPC) and prefrontal cortex (PFC) structure and connectivity continue to develop through childhood and adolescence, developmental periods that are associated with substantial gains in memory and cognitive ability. While such structural changes are well documented, we know little about the functions that HPC and PFC development confer, fundamentally limiting our understanding of the mechanisms of cognitive development. The overarching goal of this proposal is to test the hypothesis that the representational capacity of the HPC—PFC memory circuit transforms across development from a system that stores individual memories in childhood to a mature system in adulthood wherein cognitive maps represent the relationships among multiple episodes. Cognitive maps allow memory to extend beyond direct experience by coding unobserved relationships among multiple events. In the absence of a mature HPC—PFC system, such knowledge extension through cognitive map formation may be limited in children and adolescents, and therefore result in development differences in learning, decision making, and reasoning behaviors that require consideration of the relationships among multiple events. Moreover, the differential time course of HPC and PFC development, in which mature HPC function may emerge earlier than that of PFC, suggests there may be distinct patterns of memory representation and behavior in adolescence that differ from both childhood and adulthood. To answer these open questions, the proposed studies use a combination of high-resolution functional magnetic resonance imaging (fMRI) and sophisticated multivariate pattern analyses in children (7-9 years), younger adolescents (10-12 years), older adolescents (13-15 years), and adults (25-30 years). Using these methods, we will quantify: (1) age-related differences in HPC—PFC memory integration and separation strategies that support cognitive map formation and (2) how developmental differences in neural representation impact temporal (Aim 1), spatial (Aim 2), and event memory (Aim 3). Collectively, the results from this project will provide a key test of fundamental theories of cognitive development and substantially advance our knowledge of the representational capacities of the HPC—PFC memory system at different ages. In doing so, the findings have the potential to inform interventions designed to enhance memory and reasoning abilities that rely on cognitive maps, including in individuals diagnosed with mental health or neurodevelopmental disorders associated with memory deficits (e.g., autism, depression, Fragile X, or schizophrenia). . PUBLIC HEALTH RELEVANCE The proposed research investigates how development of hippocampus and prefrontal cortex the human brain supports memory and reasoning during childhood, adolescence, and adulthood. A growing body of empirical work has shown that difficulties with memory and reasoning in development are associated with poor academic outcomes, as well as with several mental health disorders with developmental onsets, including autism, depression, Fragile X, and schizophrenia. Isolating the neural mechanisms that underlie changes in memory and reasoning ability from childhood to adulthood may thus help identify markers of atypical development and contribute to interventions that may improve both cognitive and academic outcomes.",Hippocampal and prefrontal contributions to memory integration,9616654,R01MH100121,"['Adolescence', 'Adolescent', 'Adult', 'Age', 'Anterior', 'Autistic Disorder', 'Award', 'Behavior', 'Brain', 'Child', 'Childhood', 'Code', 'Cognitive', 'Data', 'Decision Making', 'Development', 'Diagnosis', 'Environment', 'Event', 'Fragile X Syndrome', 'Functional Magnetic Resonance Imaging', 'Goals', 'Hippocampus (Brain)', 'Human', 'Individual', 'Influentials', 'Intervention', 'Knowledge', 'Learning', 'Location', 'Machine Learning', 'Maps', 'Measures', 'Medial', 'Mediating', 'Memory', 'Memory impairment', 'Mental Depression', 'Mental Health', 'Mental disorders', 'Methods', 'Neurodevelopmental Disorder', 'Outcome', 'Participant', 'Pattern', 'Prefrontal Cortex', 'Process', 'Research', 'Resolution', 'Retrieval', 'Schizophrenia', 'Structure', 'System', 'Testing', 'Time', 'Work', 'age related', 'cognitive ability', 'cognitive development', 'experience', 'flexibility', 'improved', 'neuromechanism', 'public health relevance', 'relating to nervous system', 'spatial integration', 'spatial memory', 'theories', 'therapy design', 'virtual reality']",NIMH,"UNIVERSITY OF TEXAS, AUSTIN",R01,2018,701530,0.025638789746651635
"Exploring thalamocortical neural state space for adaptive closed-loop deep brain stimulation of epileptic networks. Despite the high prevalence of epilepsy, which affects nearly 4% of the population over their lifetime, roughly one third of afflicted patients are incompletely responsive to anticonvulsant drugs, requiring in severe cases neurosurgical resections or novel approaches such as deep-brain stimulation (DBS). Recently, I helped develop an electrophysiology-based online DBS protocol for seizure detection and interruption in rodent models of absence epilepsy, a form of epilepsy involving aberrant thalamocortical activity. However, like other online DBS procedures which detect seizures as they occur, there was little ability to predict incipient seizures due in large part to limited spatiotemporal resolution of the signal we used, the electrocorticogram (ECoG). ECoG and related electroencephalogram (EEG), being large scale local field potential approaches, do not provide single-cell resolution of neural dynamics that are likely required to obtain predictive information. Over the last decade, the field of brain-machine interface (BMI) has made breakthroughs in neuroscience and engineering by developing methods for multi-electrode array recording of large scale neural spiking activity and efficient reduction of the resultant high-dimensional neural activity to a smaller number of dimensions to effectively control neural prostheses. We predict that this approach will be invaluable for understanding neural dynamics during seizures and stimulation, and for developing predictive algorithms and adaptive DBS protocols.  Therefore, the goal of this project is to precisely characterize thalamocortical neural activity during spontaneous absence seizures and following thalamic stimulation by combining large-scale thalamic and cortical neural recordings, optogenetics, and BMI mathematical techniques. Additionally, the experiments presented in this proposal will use the recorded neural activity to develop adaptive algorithms that both predict oncoming seizure activity and modify stimulation parameters based on the neural state and response to stimulation in real-time. This proposal is aimed towards increasing our understanding of the neural dynamics of epileptic networks and improving the efficacy and safety of online DBS. Roughly one third of epileptic patients are resistant to pharmacological treatment, which has promoted the development of deep brain stimulation (DBS) as a means to detect and prevent seizures. However, the neural activity underlying epileptic discharges and the effects of DBS on this activity are poorly understood, partially due to the limited information carried by the EEG signals used for monitoring seizures. A more precise characterization of epileptic neural circuits is crucial to improve current DBS design and enhance the sensitivity and efficacy of seizure detection and disruption, which demands the tools and resources of basic research.",Exploring thalamocortical neural state space for adaptive closed-loop deep brain stimulation of epileptic networks.,9408441,F31NS100265,"['Absence Epilepsy', 'Address', 'Affect', 'Algorithms', 'Anticonvulsants', 'Appearance', 'Awareness', 'Basic Science', 'Brain', 'Cells', 'Deep Brain Stimulation', 'Detection', 'Development', 'Dimensions', 'Electrocorticogram', 'Electrodes', 'Electroencephalogram', 'Electrophysiology (science)', 'Engineering', 'Epilepsy', 'Excision', 'Exhibits', 'Generalized seizures', 'Goals', 'High Prevalence', 'Implant', 'Individual', 'Interruption', 'Intervention', 'Machine Learning', 'Mathematics', 'Measures', 'Methods', 'Monitor', 'Motor Cortex', 'Movement', 'Neurons', 'Neurosciences', 'Output', 'Patients', 'Pattern', 'Pharmacological Treatment', 'Population', 'Preparation', 'Primates', 'Principal Component Analysis', 'Procedures', 'Protocols documentation', 'Rattus', 'Refractory', 'Research', 'Research Personnel', 'Resistance', 'Resolution', 'Resources', 'Rodent', 'Rodent Model', 'Safety', 'Seizures', 'Signal Transduction', 'Sorting - Cell Movement', 'Surveys', 'Techniques', 'Testing', 'Thalamic structure', 'Time', 'base', 'brain machine interface', 'design', 'experimental study', 'high dimensionality', 'improved', 'insight', 'markov model', 'multi-electrode arrays', 'neural circuit', 'neural prosthesis', 'neuroregulation', 'novel strategies', 'optogenetics', 'prediction algorithm', 'prevent', 'relating to nervous system', 'response', 'spatiotemporal', 'tool']",NINDS,STANFORD UNIVERSITY,F31,2018,38516,0.051841504340434205
