text,title,id,project_number,terms,administration,organization,mechanism,year,funding,score
"Analytic Methods for Determining Multimodal Biomarkers for Parkinson's Disease     DESCRIPTION (provided by applicant): There has been considerable progress in understanding the biology of Parkinson's disease (PD). Reliable biomarkers are still lacking, however, for early stage detection of PD and for characterizing disease progression. Advances in biotechnology have led to the advent of mental health studies that collect large-scale, multi-dimensional data sets, including brain imaging data, genomic data, and biologic and clinical measures. Such studies provide an unprecedented opportunity for cross-cutting investigations that stand to gain a deeper understanding of PD. A major limiting factor to multidimensional biomarker development, however, is the lack of statistical tools available to accommodate diverse, large-scale data. Leveraging data from neuromelanin magnetic resonance imaging (NM-MRI) of the locus coeruleus and the substantia nigra, chemical shift imaging (CSI), diffusion tensor imaging (DTI), resting-state functional MRI, cerebrospinal fluid (CSF) analytes, genotype information, and numerous clinical variables, we plan to develop novel statistical techniques to identify multimodal PD biomarkers. Our data provide an unprecedented opportunity for cross-cutting methodological advances in multimodal PD biomarker discovery. Separately, we will consider a massive patient database with nearly 250,000 subscribers in Georgia. Building on our collective expertise in developing statistical and machine-learning methods for large-scale imaging data and in the pathophysiology of PD, we plan to advance methods for PD biomarker analyses and discovery through the following specific aims. First, we plan to develop new statistical techniques to reveal multimodal biomarkers for PD including imaging, clinical, and biologic variables. Secondly, we plan to utilize the massive clinical database to identify clinical risk factors for early stage PD. Thirdly, we will develop software equipped with a friendly graphical user interface (GUI) to implement the multimodal biomarker detection methods.        PUBLIC HEALTH RELEVANCE: There is a critical unmet need for the discovery of early-stage Parkinson's disease (PD) biomarkers to assist and accelerate the process for conducting clinical trials targeting neuroprotective treatments. Large studies with clinical, molecular, genetic, and neuroimaging measures produce complex multidimensional datasets, which may be useful to help establish such biomarkers. We plan to develop new statistical methods that integrate multiple high-dimensional data sets to identify accurate and robust multimodal biomarkers of PD.                  There is a critical unmet need for the discovery of early-stage Parkinson's disease (PD) biomarkers to assist and accelerate the process for conducting clinical trials targeting neuroprotective treatments. Large studies with clinical, molecular, genetic, and neuroimaging measures produce complex multidimensional datasets, which may be useful to help establish such biomarkers. We plan to develop new statistical methods that integrate multiple high-dimensional data sets to identify accurate and robust multimodal biomarkers of PD.                ",Analytic Methods for Determining Multimodal Biomarkers for Parkinson's Disease,8473443,U18NS082143,"['Alzheimer&apos', 's Disease', 'Anosmia', 'Antidepressive Agents', 'Behavior Disorders', 'Biological Markers', 'Biology', 'Biotechnology', 'Brain imaging', 'Brain region', 'Catecholamines', 'Cell Nucleus', 'Cerebrospinal Fluid', 'Chemical Shift Imaging', 'Clinical', 'Clinical Data', 'Clinical Research', 'Clinical Trials', 'Complex', 'Computer software', 'Conduct Clinical Trials', 'Constipation', 'Data', 'Data Set', 'Databases', 'Detection', 'Development', 'Diagnostic', 'Diffusion Magnetic Resonance Imaging', 'Disease', 'Disease Progression', 'Eligibility Determination', 'Functional Magnetic Resonance Imaging', 'Functional disorder', 'Genetic', 'Genetic screening method', 'Genomics', 'Genotype', 'Image', 'Image Analysis', 'Individual', 'Internet', 'Investigation', 'Link', 'Literature', 'Machine Learning', 'Magnetic Resonance Imaging', 'Measures', 'Medicine', 'Mental Depression', 'Mental Health', 'Methods', 'Mining', 'Modality', 'Modeling', 'Molecular Genetics', 'Motor', 'Parkinson Disease', 'Patients', 'Pharmaceutical Preparations', 'Probability', 'Procedures', 'Process', 'Prospective Studies', 'REM Sleep Behavior Disorder', 'Reading', 'Recording of previous events', 'Reporting', 'Research Design', 'Research Personnel', 'Resolution', 'Resources', 'Rest', 'Risk', 'Risk Factors', 'Staging', 'Statistical Methods', 'Subjects Selections', 'Substantia nigra structure', 'Symptoms', 'Techniques', 'Technology', 'Writing', 'cognitive function', 'cohort', 'cost effective', 'disease diagnosis', 'graphical user interface', 'improved', 'interest', 'locus ceruleus structure', 'neuroimaging', 'neuromelanin', 'novel', 'rapid eye movement', 'software development', 'tool']",NINDS,EMORY UNIVERSITY,U18,2012,300420,0.2529931642419158
"Pattern Analysis of Large-Scale Functional Connectivity in SAD The current proposal is aimed at developing a novel neurobiological marker based on patterns of whole-brain functional connectivity during implicit and subliminal threat-related facial emotion perception to aid the diagnosis and assessment of treatment response in social anxiety (SAD) and panic disorder (PD). The following Specific Aims are proposed: Specific Aim 1). Develop, apply and validate an approach to estimate the large-scale functional networks of implicit and subliminal threat-related and ambiguous facial emotion processing in a healthy control subject pool. We will perform this by first testing whether large-scale partial correlations measured during a particular condition (i.e. presentation of visible or invisible fearful and neutral faces) can be used as features to predict the stimulus type presented during the condition (Sub-aim 1a). We will then test whether the most informative features for predicting fearful vs. neutral face conditions are connections among primarily limbic and paralimbic nodes, and that the most informative features in predicting neutral vs. resting states conditions are connections among primarily attention, motor and sensory related regions (Sub-aim 1b). Specific Aim 2). Determine whether the approach developed in SA1 may have potential clinical application towards the diagnosis and treatment of SAD and PD. We will perform this by testing whether the above functional networks are informative brain signatures that can be used to discriminate between healthy controls, SAD and PD subjects (Sub-aim 2a). We will also test whether the approach can be used to determine the particular sub-networks that are aberrant in SAD and PD (Sub-aim 2b). PROJECT NARRATIVE  The proposed approach may contribute toward the development of effective biomarkers in the diagnosis of SAD and PD. It may also identify the functional connections whose patterns differ between control and SAD, control and PD, and SAD and PD. This would contribute to our understanding of and aid in the development of therapies for these distinct anxiety disorders.",Pattern Analysis of Large-Scale Functional Connectivity in SAD,8262402,F31MH088104,"['Accounting', 'Affect', 'Amygdaloid structure', 'Anxiety', 'Anxiety Disorders', 'Atlases', 'Attention', 'Biological Markers', 'Brain', 'Brain Stem', 'Brain region', 'Classification', 'Cognitive', 'Complex', 'Decision Making', 'Development', 'Diagnosis', 'Diagnostic', 'Discrimination', 'Disease', 'Emotional', 'Emotions', 'Face', 'Functional Magnetic Resonance Imaging', 'Hippocampus (Brain)', 'Learning', 'Machine Learning', 'Manuals', 'Maps', 'Measures', 'Motor', 'Neurobiology', 'Neurocognitive', 'Panic Disorder', 'Pattern', 'Pattern Recognition', 'Perception', 'Population Control', 'Process', 'Rest', 'Sensory', 'Social Controls', 'Stimulus', 'Testing', 'Training', 'Validation', 'Weight', 'base', 'clinical application', 'disorder control', 'improved', 'novel', 'showing emotion', 'social', 'therapy development', 'treatment response']",NIMH,COLUMBIA UNIVERSITY HEALTH SCIENCES,F31,2012,38180,0.2199266642991554
"Pattern analysis of large-scale functional connectivity to predict implicit emoti The current proposal is aimed at developing a novel neurobiological marker based on patterns of whole-brain functional connectivity during implicit and subliminal threat-related facial emotion perception to aid the diagnosis and assessment of treatment response in social anxiety (SAD) and panic disorder (PD). The following Specific Aims are proposed:    Specific Aim 1). Develop, apply and validate an approach to estimate the large-scale functional networks of implicit and subliminal threat-related and ambiguous facial emotion processing in a healthy control subject pool.    We will perform this by first testing whether large-scale partial correlations measured during a particular condition (i.e. presentation of visible or invisible fearful and neutral faces) can be used as features to predict the stimulus type presented during the condition (Sub-aim 1a). We will then test whether the most informative features for predicting fearful vs. neutral face conditions are connections among primarily limbic and paralimbic nodes, and that the most informative features in predicting neutral vs. resting states conditions are connections among primarily attention, motor and sensory related regions (Sub-aim 1b).    Specific Aim 2). Determine whether the approach developed in SA1 may have potential clinical application towards the diagnosis and treatment of SAD and PD.    We will perform this by testing whether the above functional networks are informative brain signatures that can be used to discriminate between healthy controls, SAD and PD subjects (Sub-aim 2a). We will also test whether the approach can be used to determine the particular sub-networks that are aberrant in SAD and PD (Sub-aim 2b). PROJECT NARRATIVE  The proposed approach may contribute toward the development of effective biomarkers in the diagnosis of SAD and PD. It may also identify the functional connections whose patterns differ between control and SAD, control and PD, and SAD and PD. This would contribute to our understanding of and aid in the development of therapies for these distinct anxiety disorders.",Pattern analysis of large-scale functional connectivity to predict implicit emoti,8089245,F31MH088104,"['Accounting', 'Affect', 'Amygdaloid structure', 'Anxiety', 'Anxiety Disorders', 'Atlases', 'Attention', 'Biological Markers', 'Brain', 'Brain Stem', 'Brain region', 'Classification', 'Cognitive', 'Complex', 'Decision Making', 'Development', 'Diagnosis', 'Diagnostic', 'Discrimination', 'Disease', 'Emotional', 'Emotions', 'Face', 'Functional Magnetic Resonance Imaging', 'Hippocampus (Brain)', 'Learning', 'Machine Learning', 'Manuals', 'Maps', 'Measures', 'Motor', 'Neurobiology', 'Neurocognitive', 'Panic Disorder', 'Pattern', 'Pattern Recognition', 'Perception', 'Population Control', 'Process', 'Rest', 'Sensory', 'Social Controls', 'Stimulus', 'Testing', 'Training', 'Weight', 'base', 'clinical application', 'disorder control', 'improved', 'novel', 'showing emotion', 'social', 'therapy development', 'treatment response']",NIMH,COLUMBIA UNIVERSITY HEALTH SCIENCES,F31,2011,37400,0.2189832551290647
"Data Mining to Identify Motor Fluctuations in PD DESCRIPTION (provided by applicant): The purpose of this project is to develop data mining and artificial intelligence systems to recognize the presence and severity of motor fluctuations in patients with Parkinson's disease (PD). Such a system would be valuable both for the clinical management of patients as well as for the conduct of trials of new treatments for PD. We hypothesize that movement disorders that accompany late-stage PD will present with identifiable and predictable features that can be derived from surface electromyographic (EMG) and accelerometer (ACC) signals recorded during the execution of a standardized set of motor assessment tasks.      In the first phase of the project (R21) we will explore motor patterns associated with motor states (OFF, ON, DYSKINETIC). We will design methods that rely on data mining visualization techniques and vector quantization-projection algorithms for the identification of data clusters. Successful accomplishment of this exploratory phase will be followed by an R33 Phase in which we will develop a neuro-fuzzy system to provide clinical scores from automated analysis of the EMG and ACC features. Furthermore, we will perform a thorough analysis of motor pattems expressing the full complement of movement disorders associated with PD using fuzzy ARTMAP techniques. The approach will enable us to integrate clinical information into the quantitative EMG/ACC data analysis for the purpose of increasing our ability to identify the motor patterns associated with these disorders. Finally, Parkinsonian patients with motor fluctuations will be monitored before and after adjustment of their medications to assess the sensitivity of the technique to changes in the motor fluctuation patterns.       Although this project focuses on a specific clinical application requiring advanced analysis techniques, the approach can be generalized to numerous applications in which data mining and other methods developed in this project can be used to analyze large data sets recorded using wearable sensors. n/a",Data Mining to Identify Motor Fluctuations in PD,7109222,R21NS045410,"['Parkinson&apos', 's disease', 'abnormal involuntary movement', 'clinical research', 'computer data analysis', 'electromyography', 'human subject', 'method development', 'neuromuscular disorder', 'psychomotor function', 'tremor']",NINDS,SPAULDING REHABILITATION HOSPITAL,R21,2006,483334,0.18109184166629683
"Data Mining to Identify Motor Fluctuations in PD DESCRIPTION (provided by applicant): The purpose of this project is to develop data mining and artificial intelligence systems to recognize the presence and severity of motor fluctuations in patients with Parkinson's disease (PD). Such a system would be valuable both for the clinical management of patients as well as for the conduct of trials of new treatments for PD. We hypothesize that movement disorders that accompany late-stage PD will present with identifiable and predictable features that can be derived from surface electromyographic (EMG) and accelerometer (ACC) signals recorded during the execution of a standardized set of motor assessment tasks.      In the first phase of the project (R21) we will explore motor patterns associated with motor states (OFF, ON, DYSKINETIC). We will design methods that rely on data mining visualization techniques and vector quantization-projection algorithms for the identification of data clusters. Successful accomplishment of this exploratory phase will be followed by an R33 Phase in which we will develop a neuro-fuzzy system to provide clinical scores from automated analysis of the EMG and ACC features. Furthermore, we will perform a thorough analysis of motor pattems expressing the full complement of movement disorders associated with PD using fuzzy ARTMAP techniques. The approach will enable us to integrate clinical information into the quantitative EMG/ACC data analysis for the purpose of increasing our ability to identify the motor patterns associated with these disorders. Finally, Parkinsonian patients with motor fluctuations will be monitored before and after adjustment of their medications to assess the sensitivity of the technique to changes in the motor fluctuation patterns.       Although this project focuses on a specific clinical application requiring advanced analysis techniques, the approach can be generalized to numerous applications in which data mining and other methods developed in this project can be used to analyze large data sets recorded using wearable sensors. n/a",Data Mining to Identify Motor Fluctuations in PD,6942725,R21NS045410,"['Parkinson&apos', 's disease', 'abnormal involuntary movement', 'clinical research', 'computer data analysis', 'electromyography', 'human subject', 'method development', 'neuromuscular disorder', 'psychomotor function', 'tremor']",NINDS,SPAULDING REHABILITATION HOSPITAL,R21,2005,483683,0.18109184166629683
"Data Mining to Identify Motor Fluctuations in PD DESCRIPTION (provided by applicant): The purpose of this project is to develop data mining and artificial intelligence systems to recognize the presence and severity of motor fluctuations in patients with Parkinson's disease (PD). Such a system would be valuable both for the clinical management of patients as well as for the conduct of trials of new treatments for PD. We hypothesize that movement disorders that accompany late-stage PD will present with identifiable and predictable features that can be derived from surface electromyographic (EMG) and accelerometer (ACC) signals recorded during the execution of a standardized set of motor assessment tasks.      In the first phase of the project (R21) we will explore motor patterns associated with motor states (OFF, ON, DYSKINETIC). We will design methods that rely on data mining visualization techniques and vector quantization-projection algorithms for the identification of data clusters. Successful accomplishment of this exploratory phase will be followed by an R33 Phase in which we will develop a neuro-fuzzy system to provide clinical scores from automated analysis of the EMG and ACC features. Furthermore, we will perform a thorough analysis of motor pattems expressing the full complement of movement disorders associated with PD using fuzzy ARTMAP techniques. The approach will enable us to integrate clinical information into the quantitative EMG/ACC data analysis for the purpose of increasing our ability to identify the motor patterns associated with these disorders. Finally, Parkinsonian patients with motor fluctuations will be monitored before and after adjustment of their medications to assess the sensitivity of the technique to changes in the motor fluctuation patterns.       Although this project focuses on a specific clinical application requiring advanced analysis techniques, the approach can be generalized to numerous applications in which data mining and other methods developed in this project can be used to analyze large data sets recorded using wearable sensors. n/a",Data Mining to Identify Motor Fluctuations in PD,6792043,R21NS045410,"['Parkinson&apos', 's disease', 'abnormal involuntary movement', 'clinical research', 'computer data analysis', 'electromyography', 'human subject', 'method development', 'neuromuscular disorder', 'psychomotor function', 'tremor']",NINDS,SPAULDING REHABILITATION HOSPITAL,R21,2004,153537,0.18109184166629683
"Data Mining to Identify Motor Fluctuations in PD DESCRIPTION (provided by applicant): The purpose of this project is to develop data mining and artificial intelligence systems to recognize the presence and severity of motor fluctuations in patients with Parkinson's disease (PD). Such a system would be valuable both for the clinical management of patients as well as for the conduct of trials of new treatments for PD. We hypothesize that movement disorders that accompany late-stage PD will present with identifiable and predictable features that can be derived from surface electromyographic (EMG) and accelerometer (ACC) signals recorded during the execution of a standardized set of motor assessment tasks.      In the first phase of the project (R21) we will explore motor patterns associated with motor states (OFF, ON, DYSKINETIC). We will design methods that rely on data mining visualization techniques and vector quantization-projection algorithms for the identification of data clusters. Successful accomplishment of this exploratory phase will be followed by an R33 Phase in which we will develop a neuro-fuzzy system to provide clinical scores from automated analysis of the EMG and ACC features. Furthermore, we will perform a thorough analysis of motor pattems expressing the full complement of movement disorders associated with PD using fuzzy ARTMAP techniques. The approach will enable us to integrate clinical information into the quantitative EMG/ACC data analysis for the purpose of increasing our ability to identify the motor patterns associated with these disorders. Finally, Parkinsonian patients with motor fluctuations will be monitored before and after adjustment of their medications to assess the sensitivity of the technique to changes in the motor fluctuation patterns.       Although this project focuses on a specific clinical application requiring advanced analysis techniques, the approach can be generalized to numerous applications in which data mining and other methods developed in this project can be used to analyze large data sets recorded using wearable sensors. n/a",Data Mining to Identify Motor Fluctuations in PD,6688775,R21NS045410,"[""Parkinson's disease"", ' abnormal involuntary movement', ' clinical research', ' computer data analysis', ' electromyography', ' human subject', ' method development', ' neuromuscular disorder', ' psychomotor function', ' tremor']",NINDS,SPAULDING REHABILITATION HOSPITAL,R21,2003,178485,0.18109184166629683
"AI2AMP-PD: Accelerating Parkinsons Diagnosis using Multi-omics and Artificial Intelligence AI2AMP-PD: Accelerating Parkinson’s Diagnosis using Multi-omics and Artificial Intelligence PROJECT SUMMARY AND ABSTRACT Parkinson’s disease (PD) affects more than 7 million people worldwide, and biomarkers to bolster the therapeutic pipeline are urgently needed. Developing biomarkers for clinical use is a difficult process that requires evaluation of multiple, large cohorts, each adding confidence to the marker. The Accelerating Medicine Partnership in Parkinson’s disease (AMP PD) consortium provides an unparalleled opportunity to rapidly achieve this previously elusive goal.  We hypothesize that a powerful, multi-omics classifier powered by standard and advanced machine learning algorithms will accurately identify PD-associated biomarkers at genome scale. Transcripts and genomic classifiers associated with PD will be identified in early-stage, untreated, patients with Dopamine Transporter- neuroimaging-supported diagnosis represented in the PPMI cohort. Transcripts and genomic classifiers will be rigorously replicated in the independent PDBP and BioFIND cohorts. Multi-omics classifiers using both PD- associated transcriptome changes and PD-associated genomic variants will be built with state-of-the-art deep learning techniques (e.g. variational autoencoder).  This analysis will powerfully delineate --- for the first time --- the full spectrum of known and novel, coding and noncoding RNAs linked to PD and detectable in circulating blood cells in a harmonized, large-scale data set. It will develop and test highly innovative multi-omics classifiers and provide a generally useful computational framework for large-scale, unbiased PD biomarker discovery. Project Narrative These large-scale studies are relevant to public health for two reasons. First, they will reveal the biomarker genes whose dysregulation of expression level is associated with (and possibly causal of) early development of Parkinson’s disease. Secondly, the multi-omics, DNA-RNA predictive model built here based on large dataset and advanced deep learning methods will provide a computational framework for further biomarker development and early disease prediction.",AI2AMP-PD: Accelerating Parkinsons Diagnosis using Multi-omics and Artificial Intelligence,10157680,U01NS120637,"['Affect', 'Artificial Intelligence', 'Biological Markers', 'Blood Cells', 'Blood specimen', 'Brain', 'Brain Diseases', 'Clinical', 'Clinical Trials', 'Code', 'Cognitive', 'Cross-Sectional Studies', 'DNA', 'Data Analytics', 'Data Set', 'Development', 'Diagnosis', 'Disease', 'Enhancers', 'Evaluation', 'Future', 'Gene Expression', 'Genes', 'Genetic Risk', 'Genetic Transcription', 'Goals', 'Link', 'Logistic Regressions', 'Machine Learning', 'Medicine', 'Modeling', 'Motor', 'Nature', 'Neurosciences', 'Parkinson Disease', 'Patients', 'Population', 'Process', 'Public Health', 'RNA', 'Sampling', 'Severities', 'Techniques', 'Testing', 'Therapeutic', 'Time', 'Transcript', 'Untranslated RNA', 'Variant', 'analytical method', 'autoencoder', 'base', 'biomarker development', 'biomarker discovery', 'cohort', 'computer framework', 'deep learning', 'differential expression', 'disease diagnosis', 'dopamine transporter', 'feature selection', 'genetic variant', 'genome-wide', 'genomic signature', 'innovation', 'large datasets', 'large scale data', 'learning strategy', 'machine learning algorithm', 'machine learning method', 'multiple omics', 'neuroimaging', 'novel', 'predictive modeling', 'risk variant', 'screening', 'transcriptome']",NINDS,BRIGHAM AND WOMEN'S HOSPITAL,U01,2020,537000,0.2650888909645124
