text,title,id,project_number,terms,administration,organization,mechanism,year,funding,score
"Computational modeling of 60Hz STN DBS for gait disorder in Parkinson's disease Project Summary The therapeutic gain of subthalamic deep brain stimulation (STN-DBS) for Parkinson’s disease (PD) has relied on high frequency stimulation (HFS) (e.g., 130-185Hz) to alleviate cardinal motor symptoms such as rigidity, bradykinesia and tremor, along with levodopa motor complications (e.g., motor fluctuations and dyskinesia). As the disease progresses, gait disorder, including freezing of gait, may emerge, increasing the risk of falls while limiting socialization and quality of life. Oftentimes, such symptoms are recalcitrant to dopaminergic medications and STN-DBS. Studies suggest that low frequency stimulation (60-80Hz) may improve gait in those with chronic DBS. Furthermore, we demonstrated that 60Hz STN-DBS provides gait improvement within the first year of DBS implantation. However, there is limited data on the nature of this response, in terms of what aspects of gait respond and its relation to dopaminergic medications. In addition, based on preliminary results, it is possible to use machine-learning models to identify patients who may overall benefit from 60Hz STN-DBS based solely on preoperative assessments. However, the extent to which patients’ symptoms may improve under 60Hz STN-DBS needs to be further investigated. This project aims to (1) investigate the impact of 60Hz STN-DBS on gait kinematics using wearable sensors; and (2) develop machine learning models to predict response of STN-DBS patient symptomatology at both high frequency and 60Hz based on sensor profiles of PD motor symptoms at baseline. Parkinson’s patients with gait disorder who will either be undergoing STN-DBS implantation or already have chronic bilateral STN-DBS will be recruited. We will conduct the study in two phases: Phase I – obtain baseline kinematic profile for each subject in terms of tremor, bradykinesia, and gait using objective sensor measurements in the unmedicated and levodopa-ON states. We will specifically assess gait parameters within three domains: postural sway, gait speed and rhythm (cadence), and circumduction. Phase II – participants will be evaluated in two conditions: 1) OFF medication/ON stimulation; 2) ON medication/ON stimulation. Sensor-based gait analysis will be done in 60Hz and HFS modes for each DBS electrode contact pair in the different medication states. Following data collection, statistical analysis will be performed and machine learning models will be developed to accomplish aims (1) and (2). Accordingly, this study will help determine the aspects of gait influenced by 60Hz stimulation and how it is affected by levodopa, while potentially identifying certain 60Hz responsive PD phenotypic subtypes. It will also allow for instantaneous recommendations by artificial intelligence on which stimulation frequency is best suitable for a subject based on a priori sensor measurements of motor symptoms. The ranking provided can guide clinical evaluations and programming through a sensor guided paradigm. Project Narrative    Worsening of gait and balance in Parkinson’s disease increases the risk of falls and cause a decline in quality  of life with limited effective treatment options, including deep brain stimulation (DBS). Despite this, 60Hz  Subthalamic-­Deep Brain Stimulation has emerged as a promising therapy for gait disorder. The outcome of  this study will determine and predict the aspects of gait and balance that responds to 60Hz STN-­DBS using  sensor technology and data driven modeling.        ",Computational modeling of 60Hz STN DBS for gait disorder in Parkinson's disease,9727502,R21NS111301,"['Address', 'Affect', 'Artificial Intelligence', 'Attenuated', 'Bilateral', 'Biological Markers', 'Bradykinesia', 'Chronic', 'Clinical', 'Computer Simulation', 'Data', 'Data Collection', 'Deep Brain Stimulation', 'Disease', 'Double-blind trial', 'Dyskinetic syndrome', 'Electrodes', 'Equilibrium', 'Freezing', 'Frequencies', 'Future', 'Gait', 'Gait abnormality', 'Gait speed', 'Genetic', 'Goals', 'Health', 'Institutional Review Boards', 'Investigation', 'Knowledge', 'Lead', 'Length', 'Levodopa', 'Machine Learning', 'Measurement', 'Modeling', 'Motion', 'Motor', 'Movement Disorders', 'Nature', 'Operative Surgical Procedures', 'Outcome Study', 'Parkinson Disease', 'Participant', 'Patients', 'Pharmaceutical Preparations', 'Pharmacology', 'Phase', 'Postoperative Period', 'Posture', 'Quality of life', 'Randomized', 'Recommendation', 'STN stimulation', 'Socialization', 'Statistical Data Interpretation', 'Symptoms', 'Testing', 'Therapeutic', 'Time', 'Tremor', 'base', 'disease phenotype', 'disorder subtype', 'driving force', 'effective therapy', 'fall risk', 'gait examination', 'implantation', 'improved', 'kinematics', 'motor symptom', 'predicting response', 'recruit', 'research clinical testing', 'responders and non-responders', 'response', 'sensor', 'sensor technology', 'symptomatology', 'wearable device']",NINDS,FEINSTEIN INSTITUTE FOR MEDICAL RESEARCH,R21,2019,451709,0.01182247820535079
"Machine-learning based control of functional electrical stimulation PROJECT SUMMARY/ABSTRACT Functional electrical stimulation involves artificial activation of paralyzed muscles with implanted electrodes and has been used successfully to improve the ability of tetraplegics to perform movements important for daily activities. The range of motor behaviors that can be generated by functional electrical stimulation, however, is limited to a relatively small set of preprogrammed movements such as hand grasp and release. A broader range of movements has not been implemented because of the substantial challenge associated with identifying the patterns of muscle stimulation needed to elicit specified movements. To address this limitation, we have developed machine-learning based algorithms that can predict patterns of muscle activity associated with a wide range of complex limb movements. In addition, we have devised a method whereby predicted patterns of muscle activity can then be transformed into stimulus pulse patterns needed to evoke movements in paralyzed limbs. Our goal for this project is to determine whether these approaches, when applied to temporarily paralyzed non-human primates, can be used to produce: 1) a wide range of movements of the hand throughout peri-personal reach space, and 2) configuration of the hand and fingers into a variety of shapes needed to interact with diverse objects in the environment. If successful, this approach would greatly expand the repertoire of motor behaviors available to individuals paralyzed because of spinal cord injury or stroke. Furthermore, this system ultimately might serve as the requisite interface between brain-derived trajectory information and functional electrical stimulation systems needed to realize a self-contained and self- controlled upper limb neuroprosthetic. PROJECT NARRATIVE The goal of this project is to develop methods to artificially activate and control paralyzed muscles with electrodes implanted in muscles. This effort will contribute to the restoration of voluntary limb movements in individuals paralyzed because of spinal cord injury or stroke.",Machine-learning based control of functional electrical stimulation,9699018,R01NS102259,"['3-Dimensional', 'Address', 'Algorithms', 'Anatomy', 'Animals', 'Back', 'Behavior', 'Brain', 'Chronic', 'Complement', 'Complex', 'Data', 'Digit structure', 'Elbow', 'Electrodes', 'Elements', 'Environment', 'Error Sources', 'Experimental Models', 'Feedback', 'Fingers', 'Forearm', 'Goals', 'Hand', 'Health Benefit', 'Human', 'Implanted Electrodes', 'Individual', 'Intramuscular', 'Joints', 'Lifting', 'Limb structure', 'Macaca mulatta', 'Machine Learning', 'Measures', 'Methods', 'Monkeys', 'Motor', 'Movement', 'Muscle', 'Muscle Contraction', 'Muscle Fatigue', 'Output', 'Paralysed', 'Patients', 'Pattern', 'Personal Space', 'Physiologic pulse', 'Quadriplegia', 'Shapes', 'Shoulder', 'Signal Transduction', 'Skeletal Muscle', 'Source', 'Specific qualifier value', 'Spinal cord injury', 'Stimulus', 'Stroke', 'System', 'Testing', 'Time', 'Training', 'Upper Extremity', 'Wrist', 'arm', 'artificial neural network', 'awake', 'base', 'brain machine interface', 'design', 'experience', 'finger movement', 'functional electrical stimulation', 'grasp', 'hand grasp', 'human subject', 'improved', 'insight', 'kinematics', 'limb movement', 'machine learning algorithm', 'neuroprosthesis', 'nonhuman primate', 'response', 'restoration', 'robotic device', 'scapula']",NINDS,UNIVERSITY OF ARIZONA,R01,2019,329650,0.07268661766692337
"Virtual prototyping for retinal prosthesis patients Project Summary/Abstract Retinal dystrophies such as retinitis pigmentosa and macular degeneration induce progressive loss of photoreceptors, resulting in profound visual impairment in more than ten million people worldwide. Visual neuroprostheses (‘bionic eyes’) aim to restore functional vision by electrically stimulating remaining cells in the retina, analogous to cochlear implants. A wide variety of neuroprostheses are either in development (e.g. optogenetics, cortical) or are being implanted in patients (e.g. subretinal or epiretinal electrical). A limiting factor that affects all device types are perceptual distortions and subsequent loss of information, caused by interactions between the implant technology and the underlying neurophysiology. Understanding the causes of these distortions and finding ways to alleviate them is critically important to the success of current and future sight restoration technologies. In this proposal, human visual psychophysics, computational modeling, data-driven approaches, and virtual reality (VR) will be combined to develop and experimentally validate optimized stimulation protocols for epiretinal prostheses. This approach is analogous to virtual prototyping for airplanes and other complex systems: to use a high-quality model of both the implant electronics and the visual system in order to generate a ‘virtual patient’. Retinal electrophysiological and visual behavioral data will be used to develop and validate a computational model of the expected visual experience of patients when electrically stimulated. One way of using this model will be to generate simulations of the expected perceptual outcome of electrical stimulation across a wide variety of electrical stimulation patterns. These will be used as a training set for machine learning algorithms that will invert the input-output function of the model to find the electrical stimulation protocol that best replicates any desired perceptual experience. The model can also be used to simulate the expected perceptual experience of real patients by using sighted subjects in a VR environment – ‘VR virtual patients’. These virtual patients will be used to discover preprocessing methods (e.g., edge enhancement, retargeting, decluttering) that improve behavioral performance in VR. Although current retinal prostheses have been implanted in over 250 patients worldwide, experimentation with improved stimulation protocols remains challenging and expensive. Implementing ‘virtual patients’ in VR offers an affordable and practical alternative for high-throughput experiments to test new stimulation protocols. Stimulation protocols that result in good VR performance will be experimentally validated in real prosthesis patients in collaboration with Second Sight Medical Products Inc. and Pixium Vision, two leading device manufacturers in the field. This work has the potential to significantly improve the effectiveness of visual neuroprostheses as a treatment option for individuals suffering from blinding retinal diseases. Project Narrative Inadequate stimulation paradigms are currently one of the main factors limiting the effectiveness of visual prostheses as a treatment option for individuals suffering from blinding retinal diseases. My goal is to develop and validate novel stimulation protocols for visual prosthesis patients that minimize perceptual distortions and thereby improve behavioral performance. Developing methods for generating better stimulation protocols through a combination of behavioral testing, virtual reality, computational modeling, and machine learning, has the potential to provide a transformative improvement of this device technology.",Virtual prototyping for retinal prosthesis patients,9756406,K99EY029329,"['Affect', 'Behavioral', 'Bionics', 'Cells', 'Clinical Trials', 'Cochlear Implants', 'Collaborations', 'Complex', 'Computer Simulation', 'Computer Vision Systems', 'Data', 'Development', 'Devices', 'Effectiveness', 'Electric Stimulation', 'Electrodes', 'Electronics', 'Electrophysiology (science)', 'Eye', 'Eye Movements', 'Family', 'Financial compensation', 'Future', 'Goals', 'Head', 'Human', 'Imagery', 'Implant', 'In Vitro', 'Individual', 'Knowledge', 'Learning', 'Letters', 'Machine Learning', 'Macular degeneration', 'Manufacturer Name', 'Medical', 'Medicare', 'Methods', 'Modeling', 'Motion', 'Neurons', 'Ocular Prosthesis', 'Online Systems', 'Outcome', 'Output', 'Patients', 'Pattern', 'Perceptual distortions', 'Performance', 'Photoreceptors', 'Prosthesis', 'Prosthesis Design', 'Protocols documentation', 'Psychophysics', 'Rehabilitation therapy', 'Reporting', 'Retina', 'Retinal', 'Retinal Diseases', 'Retinal Dystrophy', 'Retinitis Pigmentosa', 'Schedule', 'Severities', 'Shapes', 'Specialist', 'Stimulus', 'System', 'Techniques', 'Technology', 'Testing', 'Training', 'Vision', 'Visual', 'Visual Psychophysics', 'Visual impairment', 'Visual system structure', 'Work', 'base', 'behavior measurement', 'behavior test', 'deep neural network', 'design', 'experience', 'experimental study', 'gaze', 'implantation', 'improved', 'machine learning algorithm', 'neurophysiology', 'neuroprosthesis', 'novel', 'object recognition', 'optogenetics', 'predictive modeling', 'prototype', 'regression algorithm', 'restoration', 'retinal prosthesis', 'simulation', 'spatiotemporal', 'success', 'virtual', 'virtual reality']",NEI,UNIVERSITY OF WASHINGTON,K99,2019,122039,0.026736083316986257
"A framework for developing translatable intelligent neural interface systems for precision neuromodulation therapies Despite advances in neuromodulation technology, therapeutic devices are often ineffective or have adverse side effects. Next-generation closed-loop neuromodulation systems will provide great potentials for improving the therapeutic outcome by sensing the neural states and adapting the neuromodulatory actions. These systems will provide powerful tools for understanding the mechanisms of treatment by elucidating the causal link between regulating the physiological states and the therapeutic or the behavioral outcomes. However, a lack of systematic approach to optimally control neurostimulation is a major barrier to fully utilize their potentials. Furthermore, the real-time implementation of advanced optimization and control algorithms requires powerful computing hardware that pose a major challenge for translating the effective neural interface systems into implantable or wearable devices with limited power supply. The proposed project is addressing these two problems by developing an open-source end-to-end platform, called NeuroWeaver, to design, test and deploy intelligent Closed-Loop Neuromodulation (iCLON) systems that automatically can learn the optimal neuromodulation control policies by interacting with the nervous system. We cast the problem of optimizing neuromodulation into reward-based learning where achieving the desired neural state or the therapeutic outcome represents a measure of reward for the iCLON system. We will use techniques from reinforcement learning and model predictive control to develop algorithms that enable iCLON systems learn the optimal actions to maximize their reward. Memory dysfunction is one of the most devastating symptoms of Alzheimer’s disease and age-related dementia. We will develop the NeuroWeaver platform in the context of designing iCLON systems to induce good memory states in the hippocampus by closed-loop amygdala stimulation. Optimizing the memory- enhancing effects of amygdala stimulation will have immediate benefits to research on treatments for memory disorders. More broadly, the NeuroWeaver platform can be combined with a wide range of biological sensors and actuators to design intelligent closed-loop control systems for regulating physiological processes far beyond the proposed application in this proposal. Our proposed platform will have the potential to create an open-source ecosystem for collaboration between machine learning, neuroscience, and computer architecture communities as well as provide tools for further enrichment of the algorithms and broader utilization in the biomedical domain. The goal of this project is developing a platform for designing therapeutic devices with artificial intelligence to enable automatic optimization of neuromodulation for precision therapies. We will develop this platform in the context of closed-loop optimization of amygdala stimulation for memory enhancement, one of the most devastating symptoms of the Alzheimer’s disease and age-related dementia.",A framework for developing translatable intelligent neural interface systems for precision neuromodulation therapies,9802681,R01EB028350,"['Acceleration', 'Address', 'Algorithms', 'Alzheimer&apos', 's Disease', 'Amygdaloid structure', 'Architecture', 'Artificial Intelligence', 'Behavior', 'Behavioral', 'Biological Markers', 'Biosensor', 'Clinical', 'Collaborations', 'Communities', 'Computational algorithm', 'Computer Architectures', 'Computer software', 'Custom', 'Data', 'Dementia', 'Dependence', 'Devices', 'Disease', 'Ecosystem', 'Environment', 'Generations', 'Goals', 'Hippocampus (Brain)', 'Human', 'Infrastructure', 'Intelligence', 'Intelligence Tests', 'Learning', 'Libraries', 'Life', 'Link', 'Machine Learning', 'Measurement', 'Measures', 'Memory', 'Memory Disorders', 'Memory impairment', 'Modeling', 'Nervous system structure', 'Neurosciences', 'Patients', 'Performance', 'Physiological', 'Physiological Processes', 'Policies', 'Power Sources', 'Precision therapeutics', 'Psychological reinforcement', 'Rattus', 'Research', 'Rewards', 'Symptoms', 'System', 'Techniques', 'Technology', 'Testing', 'Therapeutic', 'Time', 'Translating', 'Translations', 'Work', 'age related', 'base', 'behavioral outcome', 'biological systems', 'design', 'implantable device', 'improved', 'in vivo', 'in vivo evaluation', 'neurophysiology', 'neuropsychiatric disorder', 'neuroregulation', 'next generation', 'novel strategies', 'open source', 'predictive modeling', 'programs', 'prototype', 'relating to nervous system', 'side effect', 'therapy outcome', 'tool', 'wearable device']",NIBIB,EMORY UNIVERSITY,R01,2019,436002,0.060099474573698325
"Therapeutic potential of vagal neurostimulation to reduce food intake Obesity affects almost 40% percent of US adults and is associated with high levels of comorbidities, including cancer, cardiovascular disease, and diabetes. Although effective treatments with minimal side effects are lacking, vagus nerve stimulation (VNS) can reduce body weight and suppress feeding behavior. There is little insight, however, into its mechanism and it is unclear whether VNS effects on feeding and body weight result from non-specific side effects, such as nausea. The current application directly addresses these issues by assessing gastrointestinal (GI) myoelectric changes as a potential mechanism for effects of VNS on feeding behavior, while comparing these responses to emetic activation. We plan to accomplish this by using a ferret model, which is a gold-standard for studying emesis, vagus nerve, and GI physiology. We will test the hypothesis that electrical stimulation of the vagus nerve can reduce food intake without triggering indicators of nausea, such as disrupted GI myoelectric responses, retching, and vomiting. We will complete three Aims. Aim 1: Define the individualized GI myoelectric patterns during feeding behavior using machine learning classification. Animals will be implanted with planar electrodes attached to the GI serosal surface from proximal gastric fundus to distal duodenum. We will use machine learning to classify GI myoelectric patterns of meal consumption compared to emetic-related states, including those elicited by intragastric emetine and high amplitude and frequency VNS known to trigger emesis. Aim 2: Test the efficacy of abdominal VNS on reducing meal size without triggering disruptions of GI myoelectric responses, retching, and emesis. Animals will be assessed for effects of abdominal VNS using a variety of stimulus parameters on feeding behavior and multi-site GI myoelectric recordings. Aim 3: Determine the efficacy of cervical VNS in controlling meal size without producing off-target effects (disruptions of GI myoelectric responses, retching, emesis, changes in heart rate, or blood pressure). We will test the impact of cervical VNS parameters on feeding behavior, GI myoelectric responses, retching, emesis, hear rate variability, and blood pressure. Our approach is innovative because we will use machine learning classification to detect individualized GI myoelectric response patterns in an awake free-moving animal for comparing therapeutic and off-target effects of VNS on feeding, GI activity, emesis, and cardiovascular function. This planned research is significant because VNS therapy can potentially provide a frontline treatment option for patients with high levels of obesity refractory to behavioral or pharmacological therapy, which unlike other surgical interventions for weight loss, such as gastric bypass, is potentially tunable and reversible by changing stimulation parameters, switching the device off, or complete removal. Obesity affects almost 40% percent of US adults, is associated with type 2 diabetes, cardiovascular disease, and cancer, and has a health-care cost that could total nearly one trillion US dollars by 2030. The current project is designed to test vagus nerve stimulation to reduce food intake, while limiting adverse effects, such as nausea, vomiting, and disrupted gastrointestinal function. Our proposed research is relevant to the NIH’s plan to support the design and testing of new interventions for achieving and maintaining a healthy weight (Strategic Plan for NIH Obesity Research).",Therapeutic potential of vagal neurostimulation to reduce food intake,9796542,R01DK121703,"['Abdomen', 'Address', 'Adult', 'Adverse effects', 'Affect', 'Anatomy', 'Animals', 'Behavioral', 'Blood Pressure', 'Body Weight', 'Body Weight decreased', 'Cardiovascular Diseases', 'Cardiovascular Physiology', 'Cardiovascular system', 'Cervical', 'Chemicals', 'Chronic', 'Classification', 'Comorbidity', 'Consumption', 'Data', 'Devices', 'Diabetes Mellitus', 'Distal', 'Duodenum', 'Eating', 'Effectiveness', 'Electric Stimulation', 'Electrodes', 'Emetics', 'Emetine', 'Event', 'Excision', 'FDA approved', 'Feeding behaviors', 'Ferrets', 'Fiber', 'Frequencies', 'Gastric Bypass', 'Gastrointestinal Motility', 'Gastrointestinal Physiology', 'Gastrointestinal tract structure', 'Goals', 'Gold', 'Health Care Costs', 'Hearing', 'Heart Rate', 'Implant', 'Individual', 'Intervention', 'Laboratory Rat', 'Laboratory mice', 'Liquid substance', 'Machine Learning', 'Malignant Neoplasms', 'Measures', 'Modeling', 'Nausea', 'Nausea and Vomiting', 'Non-Insulin-Dependent Diabetes Mellitus', 'Obesity', 'Operative Surgical Procedures', 'Patients', 'Pattern', 'Pharmacology', 'Phenotype', 'Physiological', 'Rattus', 'Refractory', 'Reporting', 'Research', 'Rodent Model', 'Satiation', 'Sensory', 'Signal Transduction', 'Site', 'Sleep', 'Stimulus', 'Stomach', 'Strategic Planning', 'Surface', 'Testing', 'Therapeutic', 'Training', 'United States National Institutes of Health', 'Upper digestive tract structure', 'Vagus nerve structure', 'Vomiting', 'awake', 'behavioral pharmacology', 'design', 'effective therapy', 'efficacy testing', 'experimental study', 'feeding', 'gastric fundus', 'gastrointestinal', 'gastrointestinal function', 'healthy weight', 'heart rate variability', 'indexing', 'innovation', 'insight', 'machine learning algorithm', 'obesity treatment', 'personalized medicine', 'pre-clinical', 'predicting response', 'recruit', 'reduced food intake', 'response', 'side effect', 'therapeutic target', 'vagus nerve stimulation', 'weight loss intervention']",NIDDK,UNIVERSITY OF PITTSBURGH AT PITTSBURGH,R01,2019,488645,0.05026191858206125
