text,title,id,project_number,terms,administration,organization,mechanism,year,funding,score
"Neural and Kinematic Features of Freezing of Gait for Adaptive Neurostimulation PROJECT SUMMARY Freezing of gait (FOG) in Parkinson’s disease (PD) results in unpredictable episodes of gait cessation, which may lead to falls, injury, a loss of independent living, and even death19. The treatment of FOG is inconsistent with either dopaminergic medication or with current open loop, continuous high frequency deep brain stimulation (cDBS)15, 25. Emerging technology using non-continuous, closed loop or adaptive DBS (aDBS), has the potential to improve treatment for FOG. Adaptive DBS can sense patient specific neural and/or kinematic signals and respond by adjusting DBS parameters to provide more efficacious therapy while reducing adverse side effects known to occur with cDBS. The critical barriers of using aDBS for FOG are the lack of knowledge of: the neural features of FOG that could be ‘sensed’ by aDBS to trigger stimulation, the optimal, patient specific DBS parameters for the treatment of FOG, and whether aDBS for FOG is safe and tolerable in human PD patients. In the Bronte-Stewart Lab, we have the technology, the regulatory approvals and the research experience collecting synchronized neural and quantitative kinematic signals, applying different DBS parameters for FOG, performing the first aDBS experiments in freely moving PD subjects. The Bronte-Stewart Lab was the first group and Stanford was the first site in the United States to implant a sensing neurostimulator for PD, the Activa® PC+S (Medtronic Inc., FDA IDE/Stanford IRB approval, October 2013). This comprised the FDA approved neurostimulator (Activa PC®, Medtronic Inc.) with additional software that enabled recording of brain signals via telemetry from the neurostimulator itself. We have implanted twenty PD patients (largest cohort in the world), from whom we have been collecting synchronized neural and computerized kinematic signals for over thirty months without adverse events. We will use this new technology in conjunction with our expertise in quantitative kinematics and validated measure of FOG to begin understanding the neural features associated with FOG. In addition, we will use quantitative measures of FOG to accurately determine the efficacy of patient specific stimulation parameters for effective and consistent treatment of FOG. No center has had the technological capability to test the safety and feasibility of aDBS for FOG in freely moving PD patients. Whether patients can tolerate aDBS, which continually adjusts output to control a time-varying patient-specific neural signal as they are walking and moving freely is completely unknown and will be assessed in a pilot study in this proposal. This project is expected to signal the beginning of a new era of precise medicine: the possibility to treat FOG in PD in a customized, adaptive manner, while minimizing adverse effects and complementing the treatment of other disabling motor features of PD such as tremor. PROJECT NARRATIVE Freezing of gait (FOG), a severe complication of Parkinson’s disease that could result in falls and even death, is not consistently well treated with current one-size fits all continuous deep brain stimulation therapy. Newly available adaptive DBS (aDBS) provides an opportunity to improve treatment of FOG by delivering precise medicine; real-time patient specific stimulation that is driven by patient specific neural signals. The goals of this project are to perform an in-depth analysis of the synchronized neural and kinematic data of freely moving patients, while stimulating with various settings to (1) better define these poorly understood patient specific signals and effective stimulation settings, and (2) to perform a pilot study to determine the safety and feasibility of whether patients can tolerate aDBS which continually adjusts the stimulation output.",Neural and Kinematic Features of Freezing of Gait for Adaptive Neurostimulation,9244090,R21NS096398,"['Address', 'Adverse effects', 'Adverse event', 'Algorithms', 'Bradykinesia', 'Brain', 'Brain region', 'Cell Nucleus', 'Cessation of life', 'Clinical', 'Collection', 'Complement', 'Complication', 'Computer software', 'Coupling', 'Data', 'Deep Brain Stimulation', 'Dorsal', 'Electrodes', 'Emerging Technologies', 'FDA approved', 'Fall injury', 'Feasibility Studies', 'Freezing', 'Frequencies', 'Gait', 'Gap Junctions', 'Goals', 'Human', 'Implant', 'Independent Living', 'Institutional Review Boards', 'Knowledge', 'Lead', 'Location', 'Machine Learning', 'Measurement', 'Measures', 'Medicine', 'Motor', 'Outcome', 'Output', 'Parkinson Disease', 'Patients', 'Pharmaceutical Preparations', 'Phase', 'Pilot Projects', 'Research', 'Rest', 'Safety', 'Side', 'Signal Transduction', 'Site', 'Structure of subthalamic nucleus', 'Technology', 'Telemetry', 'Testing', 'Time', 'Tremor', 'United States', 'Variant', 'Walking', 'Wireless Technology', 'cohort', 'comparative efficacy', 'computerized', 'effective therapy', 'experience', 'falls', 'human subject', 'improved', 'kinematics', 'neuroregulation', 'neurotransmission', 'new technology', 'patient safety', 'place fields', 'relating to nervous system', 'research study', 'safety testing', 'sensor', 'spatiotemporal', 'standard care']",NINDS,STANFORD UNIVERSITY,R21,2016,235500,0.11883627034392956
"Metabolomics and risk of Parkinson's Disease ﻿    DESCRIPTION (provided by applicant): Parkinson disease (PD) is the second most common neurodegenerative disease in the United States and affects over one million Americans; this number is growing due to population aging. Current treatments do not prevent the disease progression that ultimately results in severe disability. There is thus a compelling need to develop neuroprotective treatments. Because at the time of the clinical diagnosis of PD there is already substantial neuronal loss, such treatments should ideally be initiated earlier. Aims of the proposed investigation are to implement and validate a novel metabolomic approach for the identification of early changes in peripheral blood of individuals with preclinical or premotor PD. The metabolomic results will be integrated with detailed and validated information on risk factors for PD, which has been collected prospectively and periodically updated. We expect by this means to identify new clues to the etiology of PD and to identify a metabolomic signature of PD that could contribute to an early diagnosis. To achieve these goals, we will take advantage of data and blood samples collected from over 80,000 participants in three large ongoing cohorts, the Nurses' Health Study (NHS), the Health Professional Follow-up Study (HPFS), and the Cancer Prevention Study-II Nutrition, who have been followed for over 25 years for incident Parkinson disease. We expect to include a total of 805 incident cases of PD that will be matched to 805 controls, using a nested case-control design. PUBLIC HEALTH RELEVANCE: Parkinson disease is a chronic progressive disease for which there is no cure - the loss of brain cells that leads to disability develops insidiously over many years, and by the time the disease is diagnosed it is already extensive and irreversible. To identify Parkinson disease years before it becomes clinically manifest, we are proposing a novel approach that will take advantage of the peripheral blood and detailed lifestyle and medical information collected from over 80,000 individuals who were followed for up to 25 years. By comparing the blood levels of hundreds of compounds between the blood of individuals who developed Parkinson disease and the blood of individuals of the same age and sex who remained healthy, we expect to make novel discoveries on the etiology of Parkinson disease and to be able to develop a method for the early identification of Parkinson disease in other populations.",Metabolomics and risk of Parkinson's Disease,9134892,R01NS089619,"['Affect', 'Age', 'Alanine', 'American', 'Archives', 'Biological Markers', 'Blood', 'Blood specimen', 'Branched-Chain Amino Acids', 'Caffeine', 'Cancer Prevention Study II', 'Choline', 'Chronic', 'Chronic Disease', 'Coffee', 'Cohort Studies', 'Confounding Factors (Epidemiology)', 'Consumption', 'Controlled Study', 'Creatine', 'Cross-Sectional Studies', 'Data', 'Data Collection', 'Diabetes Mellitus', 'Diagnosis', 'Diagnostic', 'Diet', 'Disease', 'Disease Progression', 'Early Diagnosis', 'Early identification', 'Etiology', 'Event', 'Failure', 'Functional disorder', 'Funding', 'Glutamates', 'Goals', 'Health', 'Health Professional', 'Incidence', 'Individual', 'Institutes', 'Insulin Resistance', 'Investigation', 'Life Style', 'Machine Learning', 'Measures', 'Mediating', 'Medical', 'Medical History', 'Metabolic', 'Metabolic Pathway', 'Methods', 'Motor', 'National Institute of Neurological Disorders and Stroke', 'Nature', 'Nerve Degeneration', 'Neurodegenerative Disorders', 'Nurses&apos', ' Health Study', 'Parkinson Disease', 'Participant', 'Patients', 'Persons', 'Phase', 'Physical activity', 'Plasma', 'Population', 'Progressive Disease', 'Research', 'Resources', 'Risk', 'Risk Factors', 'Sampling', 'Smoking', 'Specificity', 'Techniques', 'Therapeutic', 'Time', 'United States', 'United States National Institutes of Health', 'Update', 'Urate', 'Validation', 'Woman', 'Work', 'acylcarnitine', 'aging population', 'base', 'brain cell', 'cancer prevention', 'case control', 'cigarette smoking', 'clinical Diagnosis', 'cohort', 'design', 'diabetes risk', 'disability', 'disorder risk', 'follow-up', 'gender difference', 'insight', 'interest', 'men', 'metabolic profile', 'metabolome', 'metabolomics', 'mitochondrial dysfunction', 'motor symptom', 'neuron loss', 'novel', 'novel strategies', 'nutrition', 'peripheral blood', 'pre-clinical', 'prevent', 'prospective', 'sex', 'specific biomarkers', 'tool']",NINDS,HARVARD SCHOOL OF PUBLIC HEALTH,R01,2016,563079,0.2601752213744809
"Intrinsic Cortical Networks and Cognitive Dysfunction in Parkinson's Disease DESCRIPTION (provided by applicant): Parkinson's disease (PD) affects 1% of adults over age 65. While traditionally defined by motor symptoms, up to 75% of PD patients will eventually develop dementia making it the leading cause of nursing home placement in this population. Although there is currently no cure for PD, our ability to treat motor symptoms has advanced tremendously since the 1960's based on advances in our understanding of motor symptom neurophysiology. I propose that the treatment and prevention of dementia in PD may also prove possible through advances in our understanding of the neurophysiology of cognitive dysfunction. I will use modern network theory as a theoretical and mathematical framework for this endeavor. My long-term goal is to advance our fundamental understanding of the neurophysiology of cognitive dysfunction in PD to provide empirically testable models, clinically relevant biomarkers, and novel therapeutic targets. The central hypothesis of this proposal is that patterns of cortical functional connectivity critical to normal cognitive function are disruptd by subcortical pathology in PD and that interventions which normalize these patterns will improve cognition. This hypothesis has been formulated on the basis of preliminary data presented in this proposal and other previously published work. The research objectives of this proposal are to further our understanding of how cortical connectivity relates to cognitive dysfunction in PD, develop a novel biomarker for cognitive dysfunction in PD based on cortical physiology and to determine whether modulation of cortical connectivity may result in cognitive improvements in PD. We will accomplish the objectives of this proposal through three Specific Aims: 1) Determine whether graph theory measures of functional cortical activity measured with magneto encephalography (MEG) are associated with cognitive dysfunction in PD subjects with and without mild cognitive impairment (MCI); 2) Develop a novel state-defining biomarker for cognitive dysfunction in PD based on MEG features through a machine learning approach; and 3) Determine the effects of repetitive trans cranial magnetic stimulation (rTMS) on MEG measures of cortical connectivity and cognitive outcomes in PD-MCI patients. The approach is innovative because it represents the first study to apply graph theory measures to understanding the relationship of cortical physiology and cognitive dysfunction in PD; the first study to apply machine learning approaches to cognitive PD biomarker development; and the first clinical trial or mechanistic study of rTMS in PD-MCI. The proposed research is significant because it is expected to advance our understanding of the pathophysiology of cognitive dysfunction in PD and will provide biomarkers and pilot data essential to planning future therapeutic interventions. The training objectives and related research activities of this proposal will provide new skills, manuscripts and pilot data related to advanced MEG analysis, graph theory, biomarker development and rTMS trials necessary to establish my independence in these areas and obtain R01 funding to advance this unique research program. PUBLIC HEALTH RELEVANCE: Dementia is the leading cause of nursing home placement in Parkinson's disease (PD) yet little is known about the cause(s) of cognitive dysfunction in PD and there are no effective treatments. Our preliminary data and other published studies suggest that abnormalities in brain activity involving networks important for normal thinking and memory may contribute to cognitive dysfunction in PD and may represent a target for treatment. This proposal will identify abnormalities in cortical activity related to cognitive dysfunction in PD usng magneto encephalography and will perform a randomized control trial of frontal repetitive trans cranial magnetic stimulation to determine the therapeutic potential of modulating this brain activity.",Intrinsic Cortical Networks and Cognitive Dysfunction in Parkinson's Disease,8853346,K02NS080885,"['Adult', 'Affect', 'Alzheimer&apos', 's Disease', 'Area', 'Biological Markers', 'Brain', 'Caregivers', 'Cephalic', 'Clinical Data', 'Clinical Trials', 'Cognition', 'Cognitive', 'Data', 'Dementia', 'Development', 'Double-Blind Method', 'Elderly', 'Foundations', 'Frequencies', 'Functional disorder', 'Funding', 'Future', 'Goals', 'Graph', 'Health', 'Impaired cognition', 'Intervention', 'K-Series Research Career Programs', 'Lead', 'Link', 'Machine Learning', 'Magnetism', 'Magnetoencephalography', 'Manuscripts', 'Measures', 'Medical', 'Memory', 'Mentors', 'Modeling', 'Motor', 'Motor Cortex', 'Neurodegenerative Disorders', 'Nursing Homes', 'Operative Surgical Procedures', 'Outcome', 'Parkinson Disease', 'Pathology', 'Patients', 'Pattern', 'Physiological', 'Physiology', 'Population', 'Prevention', 'Publications', 'Publishing', 'Randomized Controlled Trials', 'Research', 'Research Activity', 'Rest', 'Symptoms', 'Test Result', 'Testing', 'Therapeutic', 'Therapeutic Intervention', 'Thinking', 'Training', 'Transcranial magnetic stimulation', 'Work', 'base', 'career', 'career development', 'clinically relevant', 'cognitive ability', 'cognitive change', 'cognitive function', 'cognitive testing', 'effective therapy', 'encephalography', 'high risk', 'improved', 'innovation', 'mild cognitive impairment', 'neurobiological mechanism', 'neurophysiology', 'new therapeutic target', 'novel', 'physiologic model', 'programs', 'screening', 'skills', 'theories', 'therapeutic target']",NINDS,UNIVERSITY OF COLORADO DENVER,K02,2015,186354,0.31961103825885384
"FUNCTIONAL BRAIN NETWORK DEVELOPMENT IN EARLY CHILDHOOD DEPRESSION DESCRIPTION (provided by applicant): Neuroimaging studies of depression have suggested aberrant brain network relationships in this disorder. Despite these compelling findings there have been very few investigations examining the developmental timing of these alterations in children experiencing the earliest known form of depression, Preschool Depression (PD). The purpose of this mentored Patient-Oriented Career Development Award (K23) is to provide the applicant with the skills and experience necessary to begin filling this knowledge gap. The unique mentorship and training opportunities available to the applicant complement his strong background in clinical psychology and research with clinical populations. The applicant's long-term goal is to develop an independent programmatic line of research investigating the developmental neurobiology of depression. To facilitate this goal, instruction and mentoring are proposed in 1) applying a systematic approach to the study of functional brain network development in PD using functional magnetic resonance imaging (fMRI) 2) methods for studying the relationships between brain networks and behavior in PD and 3) methods for studying the convergence between network organization and task based fMRI activity in PD. An expert interdisciplinary team of mentors and consultants will support the proposed research and training plan. The feasibility of the proposed award is enhanced by the availability of a large set of fMRI data from an ongoing longitudinal neuroimaging study of school age children with a history of PD and their same age healthy peers (NIMH MH090786) as well as a high level of success in obtaining pilot fMRI data from healthy and depressed preschoolers (4-6 years old). Using these samples, a systematic approach investigating functional brain networks at the level of individual brain regions or region pairs, targeted subnetworks, and whole brain networks (using graph theory methods) is planned for aim 1. As a second aim, the behavioral correlates associated with group differences identified in aim 1 will be examined. Patterns of overlap between group differences in brain network organization and fMRI task-based activity during an emotion face-viewing paradigm (collected in the same individuals) will be the focus of a planned exploratory aim. It is hypothesized that 1) PD will be associated with disrupted Default Mode Network connectivity 2) atypical network organization will be related to depression severity and emotion regulation difficulties in PD and 3) a high level of overlap between network and task based group differences will be present. The study of brain networks in PD may reveal unique and early occurring neurobiological markers of risk for continued mood difficulties and/or later depression; information potentially critical for developing novel preventative treatments aimed at minimizing depression's public health burden. The complimentary training and research plans proposed in this application will facilitate the applicant's transition into an independent researc career addressing NIMH research priorities that emphasize discoveries in the brain and behavioral sciences (Strategic Plan) and the study of brain networks in psychopathology (RDoC). The training and research goals outlined in the current application will enable the candidate to become an independent researcher in the field of translational developmental neuroscience, with unique expertise that could significantly increase our developmental understanding of brain networks in depression and how they go awry in this impairing disorder. Despite growing recognition of depression as a 'network illness', there have been very few studies examining functional brain network organization in children with very early occurring depression. Such studies could lead to the earlier identification of children who will later develop MDD and inform new preventive treatment efforts aimed at minimizing the significant burden of this important public health issue. Thus, the proposed award addresses important federal research priorities aimed at reducing the impact of depression on public health.",FUNCTIONAL BRAIN NETWORK DEVELOPMENT IN EARLY CHILDHOOD DEPRESSION,8880280,K23MH098176,"['6 year old', 'Address', 'Adult', 'Age', 'Amygdaloid structure', 'Area', 'Award', 'Behavior', 'Behavioral', 'Behavioral Sciences', 'Brain', 'Brain region', 'Child', 'Clinical', 'Clinical Psychology', 'Clinical Research', 'Collection', 'Complement', 'Complex', 'Crying', 'Data', 'Data Analyses', 'Data Set', 'Depressed mood', 'Development', 'Disease', 'Doctor of Medicine', 'Doctor of Philosophy', 'Dorsal', 'Early identification', 'Educational Curriculum', 'Emotional', 'Emotions', 'Ethical Issues', 'Exposure to', 'Face', 'Fellowship', 'Functional Magnetic Resonance Imaging', 'Funding', 'Goals', 'Graph', 'Hydrocortisone', 'Impairment', 'Individual', 'Instruction', 'Investigation', 'K-Series Research Career Programs', 'Knowledge', 'Lead', 'Learning', 'Life', 'Machine Learning', 'Major Depressive Disorder', 'Measures', 'Mental Depression', 'Mentors', 'Mentorship', 'Methods', 'Moods', 'Movement', 'National Institute of Mental Health', 'Neural Network Simulation', 'Neurobiology', 'Neurosciences', 'Nursery Schools', 'Pathway Analysis', 'Pattern', 'Physiology', 'Population', 'Postdoctoral Fellow', 'Prefrontal Cortex', 'Preventive', 'Process', 'Psychopathology', 'Public Health', 'Recording of previous events', 'Research', 'Research Activity', 'Research Domain Criteria', 'Research Personnel', 'Research Priority', 'Research Training', 'Rest', 'Risk', 'Risk Marker', 'Sampling', 'Scanning', 'School-Age Population', 'Seeds', 'Severities', 'Specificity', 'Strategic Planning', 'Symptoms', 'Techniques', 'Time', 'Training', 'Training Activity', 'Training Programs', 'Universities', 'Variant', 'Washington', 'Work', 'base', 'brain behavior', 'career', 'case control', 'child depression', 'clinically significant', 'cognitive control', 'depressive symptoms', 'developmental neurobiology', 'early childhood', 'early experience', 'emotion regulation', 'emotional behavior', 'experience', 'innovation', 'interest', 'neuroimaging', 'novel', 'patient oriented', 'peer', 'programs', 'skills', 'success', 'theories', 'tool', 'treatment response']",NIMH,WASHINGTON UNIVERSITY,K23,2015,131037,0.1016350273651499
