text,title,id,project_number,terms,administration,organization,mechanism,year,funding,score
"Reliable Seizure Prediction Using Physiological Signals and Machine Learning ﻿    DESCRIPTION (provided by applicant): For most individuals living with epilepsy, seizures are relatively infrequent events occupying a small fraction of their life. Despite spending as little a 0.01% of their lives having seizures (typically only minutes per month), people with epilepsy take anti-epileptic drugs (AED) daily, suffer AED related side effects, and spend their lives dreading when the next seizure will strike. The apparent randomness of seizures is associated with significant psychological consequences. In addition, despite daily AED approximately 1/3 of patients continue to have seizures. We hypothesize that epilepsy can be more effectively treated, both the seizures and their psychological impact, by providing patients with real-time seizure forecasting. Periods of low seizure probability would not require AEDs, or at least lower doses of AEDs, thus reducing AED exposure and their side effects. Periods of high seizure probability may respond to acute AED and patients could alter their activities to avoid injury. Patients would be empowered to manage their medications and life activities using reliable seizure forecasts. In this grant we investigate the hypothesis that seizures are predictable events, and pursue accurate, clinically relevant seizure forecasting using recent advances in support vector machines (SVM), data-analytic models, and Universum-SVM applied to continuous intracranial EEG (iEEG) in focal canine epilepsy. This is an initial step in establishin a new treatment paradigm for focal epilepsy, whereby the probability of seizure occurrence is continuously tracked for patient warning and intelligent responsive therapies. Naturally occurring focal canine epilepsy is an excellent model for investigation of seizure forecasting because of the clinical and electrophsyiological similarity to focal human epilepsy. This study provides a unique opportunity to study seizure forecasting in naturally occurring canine epilepsy under uniform conditions (the same environment). Importantly, dogs are large enough to accommodate devices designed for human use. The hypotheses driving this proposal are that focal seizures are not random events and there are brain states associated with low or high probability of seizure occurrence, and that these states can be reliably classified using machine learning approaches (SVM & Universum-SVM) that combine features from iEEG, behavioral state tracking, and electrocardiogram (ECG) heart rate variability. The goal of this proposal is to develop reliable seizure forecasting (when possible) and improved understanding (data characterization) when good forecasting is not possible. PUBLIC HEALTH RELEVANCE: This grant proposes to develop the capability for accurate, reliable seizure forecasting using recent advances in support vector machines, data-analytic models, and Universum-SVM applied to continuous intracranial EEG canines with naturally occurring epilepsy. Naturally occurring focal canine epilepsy is an excellent model for investigation of seizure forecasting because of the clinical and electrophsyiological similarity to focal human epilepsy. This is an initial step in establishing a new treatment paradigm for focal epilepsy, whereby the probability of seizure occurrence is continuously tracked for patient warning and intelligent responsive neurostimulative or pharmacological therapies.",Reliable Seizure Prediction Using Physiological Signals and Machine Learning,9664683,R01NS092882,"['Acute', 'Algorithms', 'Anatomy', 'Animals', 'Antiepileptic Agents', 'Automobile Driving', 'Behavioral', 'Brain', 'Canis familiaris', 'Classification', 'Clinical', 'Data', 'Data Analytics', 'Device Designs', 'Dose', 'Drowsiness', 'Drug Exposure', 'Electrocardiogram', 'Electroencephalography', 'Environment', 'Epilepsy', 'Event', 'Focal Seizure', 'Goals', 'Grant', 'Heart Rate', 'High Frequency Oscillation', 'Hippocampus (Brain)', 'Human', 'Individual', 'Injury', 'Intelligence', 'Investigation', 'Lead', 'Learning', 'Life', 'Machine Learning', 'Methodology', 'Modeling', 'Neocortex', 'Partial Epilepsies', 'Pathologic', 'Patients', 'Pattern', 'Pharmaceutical Preparations', 'Pharmacology', 'Physiological', 'Population', 'Probability', 'Psychological Impact', 'Scalp structure', 'Seizures', 'Signal Transduction', 'Sleep', 'Staging', 'Techniques', 'Thalamic structure', 'Time', 'Training', 'Validation', 'circadian', 'clinically relevant', 'empowered', 'heart rate variability', 'improved', 'novel', 'psychologic', 'public health relevance', 'side effect']",NINDS,MAYO CLINIC ROCHESTER,R01,2019,607609,0.11620927805212786
"Big Data and Deep Learning for the Interictal-Ictal-Injury Continuum Project Summary/Abstract: Big Data and Deep Learning for the Interictal-Ictal-Injury Continuum Brain monitoring in critical care has grown dramatically over the past 20 years with the discovery that a large proportion of ICU patients suffer from subclinical seizures and seizure-like electrical events, collectively called “ictal-interictal-injury continuum abnormalities” (IIICAs), detectable only by electroencephalography (EEG). This growth has created a crisis in critical care: It is clear that IIICAs damage the brain and cause permanent neurologic disability. Yet detection of IIICAs by expert visual review is often delayed suggesting we need better tools for real-time monitoring, to cope with the deluge of ICU EEG data. In other cases, IIICAs appear to be harmless epiphenomena, and many worry that increased awareness of IIICAs has created an epidemic of overly-aggressive prescribing of anticonvulsant drugs leading to preventable adverse events and costs. This crisis highlights critical unmet needs for automated EEG monitoring for IIICAs, and a better understanding of which types of IIICAs cause neural injury and warrant intervention. Causes of IIICAs range widely, from primary brain injuries like hemorrhagic stroke and intracranial hemorrhage, to systemic medical illnesses like sepsis and uremia. Until recently, this massive clinical heterogeneity has been an insurmountable barrier to understanding the impact of IIICAs on neurologic outcome. However, recent advances in deep learning, coupled with the unprecedented availability of a massive dataset developed by our team over the last three years, makes it feasible for the first time to systematically study the relationship between IIICAs and neurologic outcomes. To meet the need for better monitoring tools and better models for understanding IIICAs, we will take a deep learning approach to leverage the as-yet untapped information in a massive ICU EEG dataset. We will pursue three Specific Aims: SA1: Comprehensively label all occurrences of IIICAs in a massive set of cEEG recordings, thus preparing the EEG data for training computers to detect IIICA patterns; SA2: Develop supervised DL algorithms to detect IIICAs as accurately as human experts, thus providing powerful tools for both research on IIICAs and for clinical brain monitoring; SA3: Estimate the effect of IIICAs on neurologic outcome: we will develop models to quantify effects of IIICAs on risk for disability after controlling for inciting illness and other clinical factors, and to predict effects of interventions to suppress IIICAs. This work will provide four crucial benefits to advance the field of precision critical care neurology, and by extension, our ability to provide optimal neurologic care for patients during critical illness. 1) Improved understanding of the clinical significance of seizure like IIICA states; 2) development of robust tools and algorithms for critical care brain telemetry; 3) a unique, massive, publicly available, thoroughly annotated dataset that will enable other researchers to further advance the field; and 4) a testable model that predicts which types of cEEG abnormalities warrant aggressive treatment, setting the stage for interventional trials. Project Narrative: Big Data and Deep Learning for the Interictal-Ictal-Injury Continuum RELEVANCE: Seizures and seizure-like brain activity, collectively called “ictal-interictal-injury continuum abnormalities” (IIICAs), occur commonly in electroencephalogram recordings of brain activity in ICU patients, and simultaneously represent a preventable cause of brain injury and a common cause of over-treatment and iatrogenic harm to patients. Big Data and deep learning approaches have recently enabled advances in several fields of medicine, but have so far had little impact in ICU neuromedicine. This project will use Big Data and Deep Learning to advance the goal of protecting brain health in ICU patients, by 1) providing improved understanding of the clinical significance of IIICA states; 2) developing robust tools and algorithms for ICU brain telemetry; 3) creating a unique, massive, publicly available, annotated dataset to enable other researchers to further advance the field; and 4) developing a testable model that predicts which types of cEEG abnormalities warrant aggressive treatment, setting the stage for interventional trials.",Big Data and Deep Learning for the Interictal-Ictal-Injury Continuum,9769180,R01NS107291,"['Adverse event', 'Algorithms', 'Anesthetics', 'Anticonvulsants', 'Awareness', 'Big Data', 'Brain', 'Brain Injuries', 'Brain hemorrhage', 'Characteristics', 'Clinical', 'Collaborations', 'Communities', 'Computers', 'Coupled', 'Critical Care', 'Critical Illness', 'Data', 'Data Set', 'Detection', 'Development', 'Early Intervention', 'Electroencephalogram', 'Electroencephalography', 'Epidemic', 'Event', 'Frequencies', 'Goals', 'Growth', 'Hour', 'Human', 'Iatrogenesis', 'Injury', 'Intervention', 'Intervention Trial', 'Intracranial Hemorrhages', 'Label', 'Medical', 'Medicine', 'Modeling', 'Monitor', 'Neurologic', 'Neurological outcome', 'Neurology', 'Nomenclature', 'Patient Care', 'Patients', 'Pattern', 'Periodicity', 'Phenotype', 'Physicians', 'Positioning Attribute', 'Research', 'Research Personnel', 'Risk', 'Seizures', 'Sepsis', 'Standardization', 'Subclinical Seizures', 'Supervision', 'Telemetry', 'Testing', 'Time', 'Training', 'Uremia', 'Visual', 'Work', 'brain health', 'causal model', 'clinical care', 'clinical heterogeneity', 'clinically actionable', 'clinically significant', 'computer science', 'cost', 'deep learning', 'deep learning algorithm', 'disability', 'improved', 'improved outcome', 'intervention effect', 'learning strategy', 'nerve injury', 'neurophysiology', 'overtreatment', 'predictive modeling', 'preventable death', 'real time monitoring', 'tool']",NINDS,MASSACHUSETTS GENERAL HOSPITAL,R01,2019,559137,0.07448308184691602
"Development of a novel pharmaco-EEG based, high-throughput screening platform to facilitate drug discovery for psychiatric disorders PROJECT SUMMARY The high rate of failure in CNS drug discovery, in particular of the first-in-class therapeutics with new modes of action, highlights a clear unmet need to improve the success rate in drug discovery for psychiatric disorders. One well-known issue is the poor ability of current bioassays and animal models to predict the efficacy and side-effects of compounds. In response, there is a steady growth in the use of electroencephalogram (EEG) in clinical trials in recent years. Pharmaceutical companies are incorporating EEG more often in their preclinical drug discovery efforts because the high degree of translatability of EEG from rodents to humans makes it ideal to use in de-risking programs in drug discovery. Moreover, quantitative EEG (qEEG) is an objective measurement of brain activity with a high test-retest reliability and considerable predictive, face, and construct validity. Additionally, well-documented literature shows that certain classes of drugs elicit different EEG fingerprints, suggesting that EEG yields pharmaco-dynamic signatures specific to pharmacological action and can be used to enable classification of drugs based on the effects of the EEG. Further, EEG can be used to rapidly screen compounds for potential activity at specific pharmacological targets and provide valuable information for guiding the early stages of drug development. However, to date, no EEG-based tool is broadly available to be used to predict the therapeutic utility of unknown compounds for drug discovery in psychiatric disorders. In order to develop such a tool, PsychoGenics, Inc., is leveraging our existing expertise in performing high-throughput pharmaco-sleep-EEG studies and our established proprietary machine learning approach to develop a novel EEG-based drug discovery platform that can predict therapeutic indications or underlying mechanism of action (MOA; i.e. the neurotransmitter system/receptor targets) of unknown compounds for psychiatric disorders. Our aims are 1) to generate a quantitative electroencephalogram (QEEG) database of compounds with a known mechanism and therapeutic value in mice, and 2) to develop a classifier using supervised machine learning. The success of this Phase I SBIR project will result in a novel EEG-based drug discovery platform that can predict therapeutic indications and MOA of new compounds based on their EEG profiles. In a future Phase II project, we will 1) add in auditory evoked potentials (AEPs) database, 2) test our EEGCube by conducting a phenotypic drug discovery project with our established collaborator (see letters of support), 3) investigate whether integrating the EEGcube database with our SmartCube® database of same compounds helps better understand the circuitry responsible for behavioral responses and/or achieves even greater prediction power in identifying therapeutic indication of novel compounds and 4) explore EEG signatures of transgenic mouse models of disease and investigate use of their signatures to identify potential therapies for the respective diseases based on EEG. PROJECT NARRATIVE There is an unmet need to improve success rate in drug discovery for psychiatric disorders due to the high rate of failure. Given the high degree of translatability of electroencephalogram (EEG) from rodents to humans, PsychoGenics, Inc., proposes to develop a novel EEG-based drug discovery platform that can predict therapeutic indications, underlying mechanism of action, and/or compound liabilities to guide the early stages of drug development.","Development of a novel pharmaco-EEG based, high-throughput screening platform to facilitate drug discovery for psychiatric disorders",9846025,R43MH121136,"['Animal Model', 'Antipsychotic Agents', 'Auditory Evoked Potentials', 'Behavior', 'Behavioral', 'Biological Assay', 'Biological Markers', 'Brain', 'Brain region', 'Central Nervous System Diseases', 'Clinical', 'Clinical Trials', 'Data', 'Databases', 'Development', 'Disease', 'Disease model', 'Dose', 'Electroencephalogram', 'Electroencephalography', 'Ensure', 'Eye', 'Face', 'Failure', 'Fingerprint', 'Frequencies', 'Future', 'Growth', 'Human', 'Letters', 'Libraries', 'Literature', 'Machine Learning', 'Measurement', 'Measures', 'Mental disorders', 'Methods', 'Mus', 'Neurotransmitters', 'Output', 'Pattern', 'Performance', 'Pharmaceutical Preparations', 'Pharmacodynamics', 'Pharmacologic Actions', 'Pharmacologic Substance', 'Pharmacology', 'Phase', 'Phenotype', 'Process', 'Rattus', 'Research Personnel', 'Rest', 'Rights', 'Risk', 'Rodent', 'Signal Transduction', 'Sleep', 'Sleep Stages', 'Small Business Innovation Research Grant', 'Standardization', 'Symptoms', 'System', 'Testing', 'Therapeutic', 'Transgenic Mice', 'Validation', 'base', 'behavioral response', 'clinically relevant', 'drug classification', 'drug development', 'drug discovery', 'high throughput screening', 'improved', 'insight', 'novel', 'pharmacokinetics and pharmacodynamics', 'pre-clinical', 'programs', 'receptor', 'response', 'side effect', 'success', 'supervised learning', 'tool']",NIMH,"PSYCHOGENICS, INC.",R43,2019,449973,0.1296798727181494
"Development of brain-computer interface methods to influence brain dynamics in stuttering Project summary Brain dynamics that drive variability within and between patients are an important, but poorly understood, element of many cognitive disorders. The long-term goal of this research project is to develop technology that will identify brain activity patterns associated with successful performance on a given task, and use this pattern as a target for brain-computer interface (BCI) training. The overarching hypothesis is that using BCI training to more often have a brain state that is spontaneously correlated to good performance will, in turn, improve overall performance. This approach could be developed into a powerful tool for rehabilitation and therapy for many neurological and psychiatric disorders. Here we will investigate persistent developmental stuttering (PDS) as a model to study brain dynamics associated with successful vs. unsuccessful performance. PDS is a speech disorder where fluent speech is punctuated to various degrees by stuttering. Individuals with PDS are otherwise neurologically in the normal range, which avoids complicating factors in most patient populations. Stuttering is intermittent; thus on some occasions the brain is in a state conducive to fluent speech and at other times it is not. We propose to use EEG activity shortly before speaking to predict whether somebody with PDS will stutter or speak fluently. Preliminary data are given to show proof of concept with traditional EEG analysis methods. This approach will be expanded by first using advanced methods such as common spatial pattern analysis and machine learning over multiple subject sessions to identify EEG signals that distinguish fluent vs. dysfluent trials (Aim 1). PDS subjects will then be trained to produce and maintain their EEG pattern that is most strongly associated with fluent speech by using BCI methods. We hypothesize that individuals will learn to modulate EEG features to be more consistent with fluent trials, which in turn will significantly reduce stuttering rate. After successful completion of this project we envision a new BCI-based intervention that can be used to encourage neural states conducive to fluent speech in those who stutter. The BCI intervention would complement traditional speech therapy using behavioral methods. The “two-step approach” of first identifying brain states associated with a patient’s best performance followed by BCI training to enter that state more often can be applied to rehabilitation in many other neurological and psychiatric disorders, such as Alzheimer’s disease, traumatic brain injury, and mood disorders, to name a few. Project narrative The goal of this project is to develop brain-computer interface technology to optimize brain function on an individual basis. This could have therapeutic applications to many neurological and psychiatric disorders, including stroke, Alzheimer’s disease, and traumatic brain injury.",Development of brain-computer interface methods to influence brain dynamics in stuttering,9659309,R21DC016353,"['Alzheimer&apos', 's Disease', 'Behavioral', 'Brain', 'Brain region', 'Cognition Disorders', 'Complement', 'Control Groups', 'Cues', 'Data', 'Development', 'Developmental Stuttering', 'Electroencephalography', 'Elements', 'Failure', 'Feedback', 'Frequencies', 'Goals', 'Individual', 'Intervention', 'Learning', 'Machine Learning', 'Memory', 'Mental disorders', 'Metaphor', 'Methods', 'Modeling', 'Mood Disorders', 'Names', 'Neurologic', 'Normal Range', 'Patients', 'Pattern', 'Performance', 'Physiology', 'Rehabilitation therapy', 'Research Project Grants', 'Sensitivity and Specificity', 'Severities', 'Signal Transduction', 'Speech', 'Speech Disorders', 'Speech Therapy', 'Stroke', 'Stuttering', 'Technology', 'Testing', 'Therapeutic', 'Time', 'Training', 'Traumatic Brain Injury', 'Work', 'base', 'brain computer interface', 'improved', 'indexing', 'motor control', 'nervous system disorder', 'patient population', 'relating to nervous system', 'response', 'tool', 'visual feedback']",NIDCD,UNIVERSITY OF TEXAS SAN ANTONIO,R21,2019,170514,0.0048974937886789235
"Decoding the neural time-course of spoken word recognition Project Summary  Word recognition is crucial not only for comprehending spoken language but for mapping spoken words onto text in reading. Individuals with language and reading deficits (e.g., Specific Language Impairment, Dyslexia, Autism, which together affect up to 16% of children) have been shown to have deficits in word recognition, making it crucial to understand this process. A hallmark of word recognition is that listeners activate neural representations of multiple candidate words that are consistent with the early acoustic input, and these candidates compete for recognition as they unfold in real-time.  The overall goal of this proposal is to capitalize on recent developments in multivariate and machine- learning techniques for analyzing signals obtained from the human brain to measure the real-time unfolding of spoken word recognition. Although these techniques have been most widely used with fMRI data, we propose to extend them to EEG data because EEG is easily used with children and clinical populations, and provides access to the time-course of word recognition, thereby revealing underlying cognitive mechanisms of word recognition, such as lexical competition. Our preliminary findings using this EEG-based paradigm have demonstrated that we can decode the recognition of a specific word (among a set of 8-12 alternatives) at each msec time-step after stimulus onset. The method is sensitive to partial activation of competing words that share some phonological features with the target word, thereby revealing the dynamics of lexical competition as the word-recognition system settles on the final target.  Our objectives are to conduct a series of small-scale experiments that achieve three aims. First, we develop and optimize the method with adults (e.g., the experimental procedure and computational implementation). Second, we validate the method with adults by measuring its test/re-test reliability, comparing its estimates of word recognition with traditional behavioral paradigms, and examining how lexical status, and semantic and orthographic expectations shape lexical competition revealed by the EEG measure. This will yield a new, non-invasive, and highly reliable method suitable for assessing spoken word recognition in adults, children, and special populations. Third, we will preliminarily extend the method to children to pave the way for future developmental studies. Taken together, accomplishing these three aims would provide an innovative and powerful tool for assessing a crucial component of language processing in a wide variety of typical and atypical populations. Project Narrative The proposed research will impact public health by establishing a new EEG-based paradigm for understanding how listeners recognize spoken words. Word recognition is crucial not only for comprehending spoken language but for mapping spoken words onto text in reading. Individuals with language and reading deficits (e.g., Specific Language Impairment, Dyslexia, Autism, which together affect up to 16% of children) have been shown to have deficits in word recognition, making it crucial to understand this process. A hallmark of word recognition is that listeners activate neural representations of multiple candidate words that are consistent with the early acoustic input, and these candidates compete for recognition as they unfold in real-time. Our project will develop and optimize a new method in which machine learning tools are used to decode EEG-based neural signals to characterize the time-course of competition. Such a method offers the prospect of a diagnostic tool to identify young children who are at risk for communication disorders.",Decoding the neural time-course of spoken word recognition,9650473,R21DC017596,"['Acoustics', 'Address', 'Adolescence', 'Adult', 'Affect', 'Behavioral', 'Behavioral Paradigm', 'Brain', 'Candy', 'Child', 'Childhood', 'Clinical', 'Cochlear Implants', 'Cognitive', 'Communication impairment', 'Complement', 'Data', 'Development', 'Diagnostic', 'Dyslexia', 'Electrocorticogram', 'Electroencephalography', 'Epilepsy', 'Eye Movements', 'Functional Magnetic Resonance Imaging', 'Future', 'Goals', 'Hearing', 'Human', 'Impairment', 'Implanted Electrodes', 'Individual', 'Instruction', 'Language', 'Language Development Disorders', 'Language Disorders', 'Link', 'Literature', 'Machine Learning', 'Measures', 'Methods', 'Orthography', 'Participant', 'Patients', 'Pilot Projects', 'Population', 'Procedures', 'Process', 'Public Health', 'Reading', 'Research', 'Risk', 'Semantics', 'Series', 'Shapes', 'Signal Transduction', 'Standardization', 'Stimulus', 'Surface', 'System', 'Techniques', 'Testing', 'Text', 'Time', 'Visual', 'Visual attention', 'attentional control', 'autism spectrum disorder', 'base', 'behavior measurement', 'behavioral response', 'expectation', 'experimental study', 'indexing', 'innovation', 'insight', 'language processing', 'lexical', 'lexical processing', 'millisecond', 'named group', 'neurotransmission', 'oculomotor', 'phonology', 'reading difficulties', 'relating to nervous system', 'response', 'specific language impairment', 'temporal measurement', 'tool']",NIDCD,"HASKINS LABORATORIES, INC.",R21,2019,277714,0.020075821727305272
