text,title,id,project_number,terms,administration,organization,mechanism,year,funding,score
"Fusion of Electromagnetic Brain Imaging and fMRI    DESCRIPTION (provided by applicant): Multimodal non-invasive functional brain imaging has made a tremendous impact in improving our understanding of the neural correlates of human behavior, and is now an indispensable tool for systems and cognitive neuroscientists. We propose to develop state-of-the-art multimodal functional imaging fusion algorithms for accurate visualization of the brain's dynamic activity and high spatial and temporal resolution. We propose to develop algorithms that combine complementary high spatial resolution of functional MRI (fMRI) and high-temporal resolution of magnetoencephalography (MEG) and electroencephalography (EEG) data for high-fidelity reconstruction of brain activity. In recent years, our research group has developed a suite of novel and powerful algorithms for MEG/EEG imaging superior to existing benchmark algorithms, and we have compared these results with electrocorticography (ECOG). Specifically, our algorithms can solve for many brain sources, including sources located far from the sensors, in the presence of large interference from unrelated brain sources using fast and robust probabilistic inference techniques. Here, we propose to extend this success in M/EEG inverse algorithms into the domain of multimodal imaging data fusion. Our overall goal here is to ultimately produce robust, high fidelity videos of event-related brain activation at a sub-millimeter and sub-millisecond resolution from noisy MEG/EEG and fMRI data using state-of-the-art machine learning algorithms. Specifically, we propose to extend a powerful new algorithm that we have recently developed, called Champagne, into two new fusion algorithms that combine fMRI, MEG and EEG data in different ways. Performance of both algorithms will first be rigorously evaluated in simulations, including performance comparisons with existing benchmark fusion algorithms. Algorithms will then tested for consistency on four fMRI-MEG+EEG datasets from healthy controls obtained for identical paradigms (auditory, motor, picture naming and verb-generation) and two fMRI-EEG datasets (face and motion perception). Additional validation studies will also be performed on fMRI-MEG/EEG datasets obtained from epilepsy patients and compared to electrocorticography (ECoG). Following successful testing and evaluation, all algorithms developed in this grant proposal, as well as example validation datasets, will be distributed using NUTMEG (nutmeg.berkeley.edu), an open-source software toolbox that we have developed.        Multimodal non-invasive functional brain imaging has made a tremendous impact in improving our understanding of the neural correlates of human behavior, and is now an indispensable tool for systems and cognitive neuroscientists. With the development of appropriate analytical tools, multimodal functional brain imaging is in the process of revolutionizing the diagnosis and treatment of a variety of neurological and psychiatric disorders such as autism, schizophrenia, dementia, and epilepsy that affect tens of millions of Americans.         ",Fusion of Electromagnetic Brain Imaging and fMRI,8320120,R21NS076171,"['Affect', 'Algorithms', 'American', 'Applications Grants', 'Auditory', 'Autistic Disorder', 'Behavior', 'Benchmarking', 'Brain', 'Brain imaging', 'Cognitive', 'Computer software', 'Data', 'Data Set', 'Dementia', 'Development', 'Diagnosis', 'Electrocorticogram', 'Electroencephalography', 'Electromagnetics', 'Epilepsy', 'Event', 'Functional Imaging', 'Functional Magnetic Resonance Imaging', 'Generations', 'Goals', 'Human', 'Image', 'Machine Learning', 'Magnetic Resonance Imaging', 'Magnetoencephalography', 'Measurement', 'Measures', 'Mental disorders', 'Methods', 'Modality', 'Modeling', 'Motion Perception', 'Motor', 'Multimodal Imaging', 'Names', 'Nutmeg - dietary', 'Patients', 'Pattern', 'Performance', 'Process', 'Research', 'Resolution', 'Scalp structure', 'Schizophrenia', 'Signal Transduction', 'Source', 'Specific qualifier value', 'Surface', 'Techniques', 'Testing', 'Time', 'Validation', 'Variant', 'analytical tool', 'base', 'blood oxygen level dependent', 'cognitive system', 'evaluation/testing', 'face perception', 'foot', 'hemodynamics', 'imaging modality', 'improved', 'magnetic field', 'millimeter', 'millisecond', 'nervous system disorder', 'novel', 'open source', 'reconstruction', 'relating to nervous system', 'sensor', 'simulation', 'spatiotemporal', 'success', 'tool', 'validation studies']",NINDS,"UNIVERSITY OF CALIFORNIA, SAN FRANCISCO",R21,2012,193125,0.12201747890615677
"Real-Time Automated Detection of Craving States with fMRI and EEG  Project Summary/Abstract Neurofeedback by real time functional MRI (rt-fMRI) has potential for addiction research and treatment that will be realized only if the feedback given the subject is related meaningfully to the cognitive states that must be controlled. The mental operations of the brain are too distributed to be represented by the raw rt-fMRI signal in any one brain region or small group of regions. Our aims are to: 1) Use computational machine learning to rapidly detect patterned activation in the rt-fMRI signal that better expresses cognitive state; 2) augment these data with concurrently-collected electroencephalographic (EEG) data; 3) develop an atlas of brain data that identifies brain patterns with cognitive states relevant to addiction and drug abuse research and 4) to explore rt-fMRI neurofeedback using this rt-fMRI/EEG machine learning method. Our approach will be to first create rapid algorithms for pattern matching that are fast compared with the imaging, thereby allowing ""real-time"" application. To do so we will select features from the images that express the differences among state concisely (more technically, we will use a method known as independent components analysis to reduce the data dimensionality.) We will similarly condense the EEG features by studying them by the location of their sources within the brain, and by examining the frequencies that they contain. We will run experiments on volunteers designed to help us see their tendency to make impulsive choices - which is known to relate to their likelihood to become drug users, as well as experiments that track changes in their brain as they control their craving urges. For these studies we will look at heavy cigarette users. Cigarette use on its own is a serious health burden to the nation, and it is also an excellent model for addiction more generally, as it is known to have many neural features in common with use of other drugs of abuse, such as cocaine and methamphetamine. This is a phased innovation proposal. The first phase will be focused on the developments of the rt-fMRI analysis and instrumentation technology. On its successful completion, based on specific milestones, we will move to the more applied work with human subjects.  Project Narrative Our research aims to develop and characterize a means of rapidly detecting brain states relevant to addiction research through the use of magnetic resonance imaging and electroencephalography. We are interested specifically in states and markers of impulsivity and cigarette craving. Our goal ultimately is to have a tool that can be used in the context of neurofeedback, allowing human subject or patient to receive an indication of activity in their brains associated with these states and to enable them to learn to control these cognitive/affective states by controlling the brain activity.",Real-Time Automated Detection of Craving States with fMRI and EEG,8288263,R33DA026109,"['Abstinence', 'Address', 'Affective', 'Algorithms', 'Anterior', 'Atlases', 'Base of the Brain', 'Behavior', 'Brain', 'Brain region', 'Cigarette', 'Classification', 'Clinical', 'Cocaine', 'Cognitive', 'Complex', 'Computer-Assisted Image Analysis', 'Computing Methodologies', 'Data', 'Data Analyses', 'Data Collection', 'Data Set', 'Databases', 'Detection', 'Development', 'Devices', 'Dimensions', 'Discrimination', 'Drug abuse', 'Drug user', 'Electroencephalogram', 'Electroencephalography', 'Electrophysiology (science)', 'Epilepsy', 'Feedback', 'Four-dimensional', 'Frequencies', 'Functional Magnetic Resonance Imaging', 'Galvanic Skin Response', 'Generations', 'Goals', 'Health', 'Healthcare', 'Image', 'Imaging technology', 'Impulsivity', 'Intervention', 'Learning', 'Location', 'Machine Learning', 'Magnetic Resonance Imaging', 'Maps', 'Measures', 'Medical', 'Methamphetamine', 'Methods', 'Modeling', 'Patients', 'Pattern', 'Pharmaceutical Preparations', 'Phase', 'Physiological', 'Proxy', 'Psyche structure', 'Reporter', 'Reporting', 'Research', 'Rest', 'Running', 'Scalp structure', 'Schizophrenia', 'Short-Term Memory', 'Signal Transduction', 'Source', 'Stimulus', 'Study Subject', 'Technology', 'Testing', 'Time', 'Traumatic Brain Injury', 'United States National Institutes of Health', 'Work', 'abstracting', 'addiction', 'base', 'blind', 'chronic pain', 'cingulate cortex', 'cognitive control', 'craving', 'data space', 'design', 'discounting', 'drug of abuse', 'effective intervention', 'human subject', 'improved', 'independent component analysis', 'innovation', 'instrument', 'instrumentation', 'interest', 'machine abstracting', 'method development', 'mind control', 'neurofeedback', 'neuroimaging', 'novel', 'operation', 'programs', 'relating to nervous system', 'research study', 'response', 'symposium', 'tool', 'trend', 'virtual', 'volunteer']",NIDA,UNIVERSITY OF CALIFORNIA LOS ANGELES,R33,2012,566794,0.11182858989675129
"CRCNS:  Effects of Weak Applied Currents on Memory Consolidation During Sleep    DESCRIPTION (provided by applicant):  Intellectual Merit: There is compelling evidence that the distinct stages of sleep play an essential role in the long-term consolidation of memories (Marshall & Born 2007). Specifically, slow-wave sleep (SWS), which is hallmarked by slow oscillatory activity (< 1 Hz) in the human electro-encephalogram (EEG), has been implicated in memory consolidation. We demonstrated that weak electric currents (<1mA, <1Hz and DC) applied to the scalp during SWS modulate these endogenous EEG rhythms and can improve human memory performance (Marshall 2006a). Moreover, application of the same weak currents during learning modulates ongoing EEG rhythms that are typical for the awake state in humans and boosts immediate performance in some learning tasks (Kirov 2009). Yet, despite these remarkable phenomenological findings, the question of how weak currents can modulate brain oscillations and induce plastic changes in brain function remains fundamentally unaddressed. Here we propose to quantitatively address this question through the development of computational models that are tightly constrained by specialized brain-slice experiments and validated through targeted human subject experiments. A central question is: how can weak electric currents, that appear insufficient to modulate excitability or plasticity in quiescent neurons, exert such a powerful effect on oscillations and learning? Our central hypothesis is that weak currents couple into ongoing slow oscillatory activity that then boost their modulatory effect on synaptic plasticity. Preliminary data from our group and others already provides strong evidence for modulation of endogenous rhythmic network activity by applied currents - at intensities considered too weak to affect single neuron function. Concurrently, we and other groups have investigated links between slow wave activity and memory consolidation, including by application of weak currents in human. But a specific connection between the effects of applied weak currents on slow-wave rhythms and plasticity has so far not been explored. Guided by computational models, the crucial empirical link between the two will be sought by probing lasting changes resulting from weak-current stimulation of an in vitro cortical preparation that exhibits SWA. Targeted human experiments will directly test if applied currents also enhance the consolidation of other SWS-mediated learning as the hypothesis would suggest, or rather, if the effect is limited to hippocampus-related learning, thus providing significant constraints to the computational models.    Broader Impacts: Weak applied currents are being explored in a number of empirical studies for their potential benefits to treat depression and neuropathic pain, to assist motor learning after stroke, or more generally, to enhance cognitive performance and to improve learning. The promise of this technique is that weak currents can be applied non-invasively with a potentially broad range of applications and minimal side effects. The enigma in this potentially transformative clinical tool, however, is that the electric field strengths generated by these currents in most studies are two orders of magnitude below what is required to activate an otherwise silent neuron. Currently, research in this area is almost entirely phenomenological and the few mechanistic explanations for the promising phenomenological observations are superficial (e.g. describing all brain function as a ""sliding scale of excitability"") and do not address plasticity - as such, there is no rational basis for improving and targeting stimulation protocols. This work is the first attempt at establishing the mechanistic link between applied currents on endogenous rhythms and the associated SWS-related learning enhancements. Evidently, such an analysis will address basic science questions about the link between endogenous SWS and learning, add to the set of experimental tools which can be used to study cognition, and, shed light on the functional and causal role of the ubiquitous endogenous rhythms generated by the brain.    Consistent with present call for US/German Collaborative Research in Computational Neuroscience this project will combined the expertise of international researchers in the areas of: (1) effects of noninvasive electrical stimulation on nervous tissue (Bikson, US), EEG signal analysis and computational network models (Parra, US), human sleep and learning with applied currents (Marshall, Germany), and dynamical systems and machine learning (Claussen/Martinetz, Germany; Parra, US).           n/a",CRCNS:  Effects of Weak Applied Currents on Memory Consolidation During Sleep,8286826,R01MH092926,"['Acute', 'Address', 'Adverse effects', 'Affect', 'Area', 'Basic Science', 'Brain', 'Chemosensitization', 'Clinical', 'Code', 'Cognition', 'Cognitive', 'Communication', 'Computer Simulation', 'Data', 'Dependence', 'Development', 'Electric Stimulation', 'Electrodes', 'Equilibrium', 'Exhibits', 'Experimental Models', 'Frequencies', 'German population', 'Germany', 'Hippocampus (Brain)', 'Human', 'In Vitro', 'Injection of therapeutic agent', 'International', 'Ion Channel', 'Kale - dietary', 'Learning', 'Light', 'Link', 'Literature', 'Long-Term Effects', 'Machine Learning', 'Marshal', 'Measures', 'Mediating', 'Membrane', 'Memory', 'Mental Depression', 'Modeling', 'Neocortex', 'Nerve Tissue', 'Neurons', 'Pattern', 'Perceptual learning', 'Performance', 'Phase', 'Plastics', 'Play', 'Positioning Attribute', 'Predictive Value', 'Preparation', 'Principal Investigator', 'Process', 'Property', 'Protocols documentation', 'Pyramidal Cells', 'Rattus', 'Research', 'Research Personnel', 'Role', 'Scalp structure', 'Signal Transduction', 'Site', 'Sleep', 'Sleep Stages', 'Slice', 'Slide', 'Slow-Wave Sleep', 'Stimulus', 'Stroke', 'Surface', 'Synapses', 'Synaptic Potentials', 'Synaptic plasticity', 'System', 'Techniques', 'Testing', 'Thalamic structure', 'Theoretical model', 'Time', 'Training', 'Visual', 'Wakefulness', 'Work', 'awake', 'base', 'computational network modeling', 'computational neuroscience', 'data modeling', 'density', 'electric field', 'human subject', 'imprint', 'improved', 'memory trace reactivation', 'motor learning', 'neocortical', 'painful neuropathy', 'receptive field', 'research study', 'response', 'tool', 'voltage']",NIMH,CITY COLLEGE OF NEW YORK,R01,2012,124361,0.08186987530125614
"Learned regulation of the limbic network via combined EEG and fMRI     DESCRIPTION (provided by applicant): This project aims to develop a novel potential treatment for common neuropsychiatric disorders, specifically chronic pain syndrome and affective disorders including depression, anxiety, and post-traumatic stress disorder (PTSD). We have previously shown that real-time functional magnetic resonance imaging (rt-fMRI) can provide a feedback signal (neurofeedback) that allows people to gain learned voluntary control of activation in the rostral anterior cingulate (rACC), which in turn alters pain perception. Here, we aim to develop a brain-validated electroencephalography (EEG) neurofeedback method that involves simultaneous EEG and fMRI recordings. This system will then be used to determine EEG signatures reflective of regulation of rACC and of the amygdala. Multiple psychiatric states (e.g., depressive, anxious) are associated with an inability to regulate emotion and appear to be characterized by dysfunction of the limbic circuit including the ACC and amygdala. However, current psychiatric treatment approaches typically lack specificity regarding brain networks and mechanisms. Based on research studies indicating that individuals can be trained to regulate their own mental and physiological responses through online feedback, the proposed study aims to develop a novel tool for enhancing physiological resilience through psychological training using brain signals as the basis for such feedback. Thus, neurofeedback can provide a potential, complementary/alternate approach for treatment of neuropsychiatric disturbances. The combination of simultaneously acquired high spatial-resolution fMRI data and high temporal-resolution EEG data together with advanced statistical learning approaches provide a plausible way to infer and generate a robust and effective EEG neurofeedback signals that can target even deep brain structures such as the rACC or amygdala as the source of feedback. Given the high prevalence of psychopathology and the non-specific targeting of current treatments, the development of a robust method for learned regulation of specific limbic regions is important. Specifically, the new EEG-neurofeedback tool could be a novel, rational, neuroscience-based therapeutic intervention that could become a portable, easy-to-use, and low-cost clinical tool for improving self-control over brain working. In the long-term such a technique could be useful in alleviating chronic pain and regulating emotional instability and agony in cases of depression and anxiety syndromes.        PUBLIC HEALTH RELEVANCE: The inability to self-regulate our affective/mental states is an underlying cause of multiple disorders, including chronic pain syndrome, depression, and anxiety that have serious social and psychological consequences. This project aims to develop a novel system that enables people to learn to regulate pain and emotion, which could lead to improved outcomes for major neuropsychiatric diseases that are often unresponsive to current treatments.              The inability to self-regulate our affective/mental states is an underlying cause of multiple disorders, including chronic pain syndrome, depression, and anxiety that have serious social and psychological consequences. This project aims to develop a novel system that enables people to learn to regulate pain and emotion, which could lead to improved outcomes for major neuropsychiatric diseases that are often unresponsive to current treatments.            ",Learned regulation of the limbic network via combined EEG and fMRI,8302045,R21MH092564,"['Address', 'Adverse effects', 'Affective', 'Amygdaloid structure', 'Anterior', 'Anxiety', 'Brain', 'Brain region', 'Clinical', 'Cognitive', 'Data', 'Disease', 'Effectiveness', 'Electroencephalography', 'Emotional', 'Emotions', 'Face', 'Feedback', 'Frequencies', 'Functional Magnetic Resonance Imaging', 'Functional disorder', 'Goals', 'High Prevalence', 'Individual', 'Lead', 'Learning', 'Logic', 'Machine Learning', 'Magnetic Resonance Imaging', 'Mental Depression', 'Mental disorders', 'Methods', 'Mood Disorders', 'Neurosciences', 'Outcome', 'Pain', 'Pattern', 'Perception', 'Performance', 'Physiological', 'Placebos', 'Population', 'Post-Traumatic Stress Disorders', 'Procedures', 'Process', 'Psyche structure', 'Psychiatric therapeutic procedure', 'Psychopathology', 'Regulation', 'Research', 'Resolution', 'Self-control as a personality trait', 'Signal Transduction', 'Source', 'Specificity', 'Stimulus', 'Structure', 'Syndrome', 'System', 'Techniques', 'Testing', 'Therapeutic Intervention', 'Time', 'Training', 'Validation', 'Work', 'base', 'chronic pain', 'clinically relevant', 'clinically significant', 'common treatment', 'cost', 'depressive symptoms', 'drug development', 'emotion regulation', 'improved', 'innovation', 'mental state', 'neurofeedback', 'neuropsychiatry', 'novel', 'psychologic', 'research study', 'resilience', 'response', 'social', 'success', 'therapy development', 'tool', 'young adult']",NIMH,MASSACHUSETTS INSTITUTE OF TECHNOLOGY,R21,2012,200625,-0.025252565899432054
