text,title,id,project_number,terms,administration,organization,mechanism,year,funding,score
"Reliable Seizure Prediction Using Physiological Signals and Machine Learning ﻿    DESCRIPTION (provided by applicant): For most individuals living with epilepsy, seizures are relatively infrequent events occupying a small fraction of their life. Despite spending as little a 0.01% of their lives having seizures (typically only minutes per month), people with epilepsy take anti-epileptic drugs (AED) daily, suffer AED related side effects, and spend their lives dreading when the next seizure will strike. The apparent randomness of seizures is associated with significant psychological consequences. In addition, despite daily AED approximately 1/3 of patients continue to have seizures. We hypothesize that epilepsy can be more effectively treated, both the seizures and their psychological impact, by providing patients with real-time seizure forecasting. Periods of low seizure probability would not require AEDs, or at least lower doses of AEDs, thus reducing AED exposure and their side effects. Periods of high seizure probability may respond to acute AED and patients could alter their activities to avoid injury. Patients would be empowered to manage their medications and life activities using reliable seizure forecasts. In this grant we investigate the hypothesis that seizures are predictable events, and pursue accurate, clinically relevant seizure forecasting using recent advances in support vector machines (SVM), data-analytic models, and Universum-SVM applied to continuous intracranial EEG (iEEG) in focal canine epilepsy. This is an initial step in establishin a new treatment paradigm for focal epilepsy, whereby the probability of seizure occurrence is continuously tracked for patient warning and intelligent responsive therapies. Naturally occurring focal canine epilepsy is an excellent model for investigation of seizure forecasting because of the clinical and electrophsyiological similarity to focal human epilepsy. This study provides a unique opportunity to study seizure forecasting in naturally occurring canine epilepsy under uniform conditions (the same environment). Importantly, dogs are large enough to accommodate devices designed for human use. The hypotheses driving this proposal are that focal seizures are not random events and there are brain states associated with low or high probability of seizure occurrence, and that these states can be reliably classified using machine learning approaches (SVM & Universum-SVM) that combine features from iEEG, behavioral state tracking, and electrocardiogram (ECG) heart rate variability. The goal of this proposal is to develop reliable seizure forecasting (when possible) and improved understanding (data characterization) when good forecasting is not possible. PUBLIC HEALTH RELEVANCE: This grant proposes to develop the capability for accurate, reliable seizure forecasting using recent advances in support vector machines, data-analytic models, and Universum-SVM applied to continuous intracranial EEG canines with naturally occurring epilepsy. Naturally occurring focal canine epilepsy is an excellent model for investigation of seizure forecasting because of the clinical and electrophsyiological similarity to focal human epilepsy. This is an initial step in establishing a new treatment paradigm for focal epilepsy, whereby the probability of seizure occurrence is continuously tracked for patient warning and intelligent responsive neurostimulative or pharmacological therapies.",Reliable Seizure Prediction Using Physiological Signals and Machine Learning,9238808,R01NS092882,"['Acute', 'Adverse effects', 'Algorithms', 'Anatomy', 'Animals', 'Antiepileptic Agents', 'Automobile Driving', 'Behavioral', 'Brain', 'Canis familiaris', 'Circadian Rhythms', 'Classification', 'Clinical', 'Data', 'Data Analytics', 'Device Designs', 'Dose', 'Drowsiness', 'Drug Exposure', 'Electrocardiogram', 'Electroencephalography', 'Employee Strikes', 'Environment', 'Epilepsy', 'Event', 'Focal Seizure', 'Goals', 'Grant', 'Heart Rate', 'High Frequency Oscillation', 'Hippocampus (Brain)', 'Human', 'Individual', 'Injury', 'Investigation', 'Lead', 'Learning', 'Life', 'Machine Learning', 'Methodology', 'Modeling', 'Neocortex', 'Partial Epilepsies', 'Pathologic', 'Patients', 'Pattern', 'Pharmaceutical Preparations', 'Pharmacology', 'Physiological', 'Population', 'Probability', 'Psychological Impact', 'Scalp structure', 'Seizures', 'Signal Transduction', 'Sleep', 'Staging', 'Techniques', 'Thalamic structure', 'Time', 'Training', 'Validation', 'clinically relevant', 'empowered', 'heart rate variability', 'improved', 'novel', 'psychologic', 'public health relevance']",NINDS,MAYO CLINIC ROCHESTER,R01,2017,614764,0.11620927805212786
"EEGLAB: Software for Analysis of Human Brain Dynamics DESCRIPTION (provided by applicant): A major shift in scientific perspective on the nature and use of electrophysiological brain data is now ongoing a shift from measurement and visualization of individual channel signals (in the 'recording channel space') to visualizing and interpreting the data directly within a suitable inverse model representing activity reaching the electrodes by volume conduction from a set of effective data sources in native 'brain source space'. An equivalent shift, via the development and exploitation of an appropriate inverse imaging model, made possible the phenomenon of structural and functional magnetic resonance imaging (fMRI). While the electrophysiological inverse problem is still difficult, dramatic progress has been and is being made through combined use of multimodal imaging and modern statistical signal processing methods. Recovering the considerable degree of spatial source resolution available in high-density scalp electroencephalographic (EEG) and other electrophysiological data, while retaining its natural advantage over other functional imaging methods in temporal resolution, has begun to yield a steady stream of new information about patterns of distributed brain processing supporting human behavior and experience. Relative to other brain imaging modalities, EEG has substantial and increasing cost and mobility advantages, making promotion of new EEG methods for source space analysis of increasing interest and importance for brain and health research. However, applying new source signal and signal processing models to electrophysiological data is complex and increasingly involves application of modern mathematical methods whose details are not within the training of most health research professionals. The EEGLAB signal processing environment, an open source software project of the Swartz Center for Computational Neuroscience (SCCN) at the University of California San Diego, began as a set of EEG data analysis running on MATLAB (The Mathworks, Inc.) released on the World Wide Web in 1997. EEGLAB was first released from SCCN in 2001. Now, more than ten years later, the EEGLAB reference paper (Delorme & Makeig, 2004) has over 2,350 Google scholar citations (increasing at above 1 per day), the opt-in EEGLAB discussion email list links over 5,000 researchers, the news list over 9,000, and a recent survey of 687 researcher respondents reports EEGLAB to be the software environment most widely used for electrophysiological data analysis worldwide. EEGLAB is thus now a de facto standard supporting a wide range of EEG and other electrophysiological research studies and teaching labs. At least 35 EEGLAB plug-in toolsets have now been released by researchers from many laboratories. Under NIH PAR 11-028 we propose renewal funding to further develop and maintain the EEGLAB software framework. We propose new and better tools for brain source and source network modeling and localization, an expanded online EEGLAB course and workshop, better statistical inference modeling of group data, and new support for automated source decomposition, measure computation, data duration, and data sharing. PUBLIC HEALTH RELEVANCE: A major shift in scientific perspective on the nature and use of human electrophysiological data is now accelerating from measuring and visualizing individual scalp channel signals to directly visualizing and interpreting their brain sources. The EEGLAB signal processing environment, an open source software project of the Swartz Center for Computational Neuroscience (SCCN) at the University Of California San Diego (UCSD), supports a large number of EEG and related electrophysiological research studies and teaching labs. We propose continued funding to further develop and maintain the EEGLAB environment.",EEGLAB: Software for Analysis of Human Brain Dynamics,9310366,R01NS047293,"['Bayesian Modeling', 'Behavior', 'Brain', 'Brain imaging', 'California', 'Clinical', 'Cloud Computing', 'Code', 'Community Outreach', 'Complex', 'Computer software', 'Data', 'Data Analyses', 'Data Set', 'Data Sources', 'Databases', 'Development', 'Disease', 'Documentation', 'Ecosystem', 'Educational process of instructing', 'Educational workshop', 'Electrodes', 'Electromagnetics', 'Electronic Mail', 'Electrophysiology (science)', 'Electroplating', 'Environment', 'Event', 'Event-Related Potentials', 'Eye', 'Functional Imaging', 'Functional Magnetic Resonance Imaging', 'Funding', 'Future', 'Health', 'Human', 'Image', 'Imagery', 'Individual', 'Internet', 'Joints', 'Laboratories', 'Links List', 'Machine Learning', 'Measurement', 'Measures', 'Memory', 'Metadata', 'Methods', 'Modeling', 'Modernization', 'Morphologic artifacts', 'Multimodal Imaging', 'Nature', 'Neurosciences', 'Output', 'Paper', 'Pattern', 'Performance', 'Physiology', 'Plug-in', 'Privatization', 'Procedures', 'Psyche structure', 'Reporting', 'Research', 'Research Activity', 'Research Methodology', 'Research Personnel', 'Resolution', 'Respondent', 'Running', 'Scalp structure', 'Signal Transduction', 'Software Framework', 'Source', 'Speed', 'Stream', 'Surveys', 'Testing', 'Time', 'Training', 'United States National Institutes of Health', 'Universities', 'Update', 'base', 'brain health', 'computational neuroscience', 'computing resources', 'cost', 'cranium', 'data sharing', 'density', 'design', 'experience', 'experimental study', 'flexibility', 'imaging modality', 'improved', 'innovation', 'interest', 'learning strategy', 'mathematical methods', 'network models', 'news', 'online course', 'open source', 'public health relevance', 'research study', 'signal processing', 'source localization', 'symposium', 'temporal measurement', 'tool', 'web site', 'wiki']",NINDS,"UNIVERSITY OF CALIFORNIA, SAN DIEGO",R01,2017,475233,0.16080996938420689
"Reliable Seizure Prediction Using Physiological Signals and Machine Learning ﻿    DESCRIPTION (provided by applicant): For most individuals living with epilepsy, seizures are relatively infrequent events occupying a small fraction of their life. Despite spending as little a 0.01% of their lives having seizures (typically only minutes per month), people with epilepsy take anti-epileptic drugs (AED) daily, suffer AED related side effects, and spend their lives dreading when the next seizure will strike. The apparent randomness of seizures is associated with significant psychological consequences. In addition, despite daily AED approximately 1/3 of patients continue to have seizures. We hypothesize that epilepsy can be more effectively treated, both the seizures and their psychological impact, by providing patients with real-time seizure forecasting. Periods of low seizure probability would not require AEDs, or at least lower doses of AEDs, thus reducing AED exposure and their side effects. Periods of high seizure probability may respond to acute AED and patients could alter their activities to avoid injury. Patients would be empowered to manage their medications and life activities using reliable seizure forecasts. In this grant we investigate the hypothesis that seizures are predictable events, and pursue accurate, clinically relevant seizure forecasting using recent advances in support vector machines (SVM), data-analytic models, and Universum-SVM applied to continuous intracranial EEG (iEEG) in focal canine epilepsy. This is an initial step in establishin a new treatment paradigm for focal epilepsy, whereby the probability of seizure occurrence is continuously tracked for patient warning and intelligent responsive therapies. Naturally occurring focal canine epilepsy is an excellent model for investigation of seizure forecasting because of the clinical and electrophsyiological similarity to focal human epilepsy. This study provides a unique opportunity to study seizure forecasting in naturally occurring canine epilepsy under uniform conditions (the same environment). Importantly, dogs are large enough to accommodate devices designed for human use. The hypotheses driving this proposal are that focal seizures are not random events and there are brain states associated with low or high probability of seizure occurrence, and that these states can be reliably classified using machine learning approaches (SVM & Universum-SVM) that combine features from iEEG, behavioral state tracking, and electrocardiogram (ECG) heart rate variability. The goal of this proposal is to develop reliable seizure forecasting (when possible) and improved understanding (data characterization) when good forecasting is not possible. PUBLIC HEALTH RELEVANCE: This grant proposes to develop the capability for accurate, reliable seizure forecasting using recent advances in support vector machines, data-analytic models, and Universum-SVM applied to continuous intracranial EEG canines with naturally occurring epilepsy. Naturally occurring focal canine epilepsy is an excellent model for investigation of seizure forecasting because of the clinical and electrophsyiological similarity to focal human epilepsy. This is an initial step in establishing a new treatment paradigm for focal epilepsy, whereby the probability of seizure occurrence is continuously tracked for patient warning and intelligent responsive neurostimulative or pharmacological therapies.",Reliable Seizure Prediction Using Physiological Signals and Machine Learning,9212935,R01NS092882,"['Acute', 'Adverse effects', 'Algorithms', 'Animals', 'Antiepileptic Agents', 'Automobile Driving', 'Behavioral', 'Brain', 'Canis familiaris', 'Circadian Rhythms', 'Clinical', 'Data', 'Data Analytics', 'Device Designs', 'Dose', 'Drug Exposure', 'Electrocardiogram', 'Electroencephalography', 'Employee Strikes', 'Environment', 'Epilepsy', 'Event', 'Focal Seizure', 'Goals', 'Grant', 'Health', 'Heart Rate', 'High Frequency Oscillation', 'Hippocampus (Brain)', 'Human', 'Individual', 'Injury', 'Investigation', 'Lead', 'Life', 'Machine Learning', 'Methodology', 'Modeling', 'Neocortex', 'Partial Epilepsies', 'Patients', 'Pattern', 'Pharmaceutical Preparations', 'Physiological', 'Population', 'Probability', 'Psychological Impact', 'Scalp structure', 'Seizures', 'Signal Transduction', 'Sleep', 'Sleep Stages', 'Structure', 'Techniques', 'Thalamic structure', 'Time', 'Training', 'Validation', 'clinically relevant', 'empowered', 'hands-on learning', 'heart rate variability', 'improved', 'innovation', 'novel', 'psychologic', 'training aid']",NINDS,MAYO CLINIC ROCHESTER,R01,2016,10000,0.11620927805212786
"Reliable Seizure Prediction Using Physiological Signals and Machine Learning ﻿    DESCRIPTION (provided by applicant): For most individuals living with epilepsy, seizures are relatively infrequent events occupying a small fraction of their life. Despite spending as little a 0.01% of their lives having seizures (typically only minutes per month), people with epilepsy take anti-epileptic drugs (AED) daily, suffer AED related side effects, and spend their lives dreading when the next seizure will strike. The apparent randomness of seizures is associated with significant psychological consequences. In addition, despite daily AED approximately 1/3 of patients continue to have seizures. We hypothesize that epilepsy can be more effectively treated, both the seizures and their psychological impact, by providing patients with real-time seizure forecasting. Periods of low seizure probability would not require AEDs, or at least lower doses of AEDs, thus reducing AED exposure and their side effects. Periods of high seizure probability may respond to acute AED and patients could alter their activities to avoid injury. Patients would be empowered to manage their medications and life activities using reliable seizure forecasts. In this grant we investigate the hypothesis that seizures are predictable events, and pursue accurate, clinically relevant seizure forecasting using recent advances in support vector machines (SVM), data-analytic models, and Universum-SVM applied to continuous intracranial EEG (iEEG) in focal canine epilepsy. This is an initial step in establishin a new treatment paradigm for focal epilepsy, whereby the probability of seizure occurrence is continuously tracked for patient warning and intelligent responsive therapies. Naturally occurring focal canine epilepsy is an excellent model for investigation of seizure forecasting because of the clinical and electrophsyiological similarity to focal human epilepsy. This study provides a unique opportunity to study seizure forecasting in naturally occurring canine epilepsy under uniform conditions (the same environment). Importantly, dogs are large enough to accommodate devices designed for human use. The hypotheses driving this proposal are that focal seizures are not random events and there are brain states associated with low or high probability of seizure occurrence, and that these states can be reliably classified using machine learning approaches (SVM & Universum-SVM) that combine features from iEEG, behavioral state tracking, and electrocardiogram (ECG) heart rate variability. The goal of this proposal is to develop reliable seizure forecasting (when possible) and improved understanding (data characterization) when good forecasting is not possible. PUBLIC HEALTH RELEVANCE: This grant proposes to develop the capability for accurate, reliable seizure forecasting using recent advances in support vector machines, data-analytic models, and Universum-SVM applied to continuous intracranial EEG canines with naturally occurring epilepsy. Naturally occurring focal canine epilepsy is an excellent model for investigation of seizure forecasting because of the clinical and electrophsyiological similarity to focal human epilepsy. This is an initial step in establishing a new treatment paradigm for focal epilepsy, whereby the probability of seizure occurrence is continuously tracked for patient warning and intelligent responsive neurostimulative or pharmacological therapies.",Reliable Seizure Prediction Using Physiological Signals and Machine Learning,9065664,R01NS092882,"['Acute', 'Adverse effects', 'Algorithms', 'Animals', 'Antiepileptic Agents', 'Automobile Driving', 'Behavioral', 'Brain', 'Canis familiaris', 'Circadian Rhythms', 'Clinical', 'Data', 'Data Analytics', 'Device Designs', 'Dose', 'Drug Exposure', 'Electrocardiogram', 'Electroencephalography', 'Employee Strikes', 'Environment', 'Epilepsy', 'Event', 'Focal Seizure', 'Goals', 'Grant', 'Health', 'Heart Rate', 'High Frequency Oscillation', 'Hippocampus (Brain)', 'Human', 'Individual', 'Injury', 'Investigation', 'Lead', 'Life', 'Machine Learning', 'Methodology', 'Modeling', 'Neocortex', 'Partial Epilepsies', 'Patients', 'Pattern', 'Pharmaceutical Preparations', 'Physiological', 'Population', 'Probability', 'Psychological Impact', 'Scalp structure', 'Seizures', 'Signal Transduction', 'Sleep', 'Sleep Stages', 'Structure', 'Techniques', 'Thalamic structure', 'Time', 'Training', 'Validation', 'clinically relevant', 'empowered', 'hands-on learning', 'heart rate variability', 'improved', 'innovation', 'novel', 'psychologic', 'training aid']",NINDS,MAYO CLINIC ROCHESTER,R01,2016,595775,0.11620927805212786
"EEGLAB: Software for Analysis of Human Brain Dynamics DESCRIPTION (provided by applicant): A major shift in scientific perspective on the nature and use of electrophysiological brain data is now ongoing a shift from measurement and visualization of individual channel signals (in the 'recording channel space') to visualizing and interpreting the data directly within a suitable inverse model representing activity reaching the electrodes by volume conduction from a set of effective data sources in native 'brain source space'. An equivalent shift, via the development and exploitation of an appropriate inverse imaging model, made possible the phenomenon of structural and functional magnetic resonance imaging (fMRI). While the electrophysiological inverse problem is still difficult, dramatic progress has been and is being made through combined use of multimodal imaging and modern statistical signal processing methods. Recovering the considerable degree of spatial source resolution available in high-density scalp electroencephalographic (EEG) and other electrophysiological data, while retaining its natural advantage over other functional imaging methods in temporal resolution, has begun to yield a steady stream of new information about patterns of distributed brain processing supporting human behavior and experience. Relative to other brain imaging modalities, EEG has substantial and increasing cost and mobility advantages, making promotion of new EEG methods for source space analysis of increasing interest and importance for brain and health research. However, applying new source signal and signal processing models to electrophysiological data is complex and increasingly involves application of modern mathematical methods whose details are not within the training of most health research professionals. The EEGLAB signal processing environment, an open source software project of the Swartz Center for Computational Neuroscience (SCCN) at the University of California San Diego, began as a set of EEG data analysis running on MATLAB (The Mathworks, Inc.) released on the World Wide Web in 1997. EEGLAB was first released from SCCN in 2001. Now, more than ten years later, the EEGLAB reference paper (Delorme & Makeig, 2004) has over 2,350 Google scholar citations (increasing at above 1 per day), the opt-in EEGLAB discussion email list links over 5,000 researchers, the news list over 9,000, and a recent survey of 687 researcher respondents reports EEGLAB to be the software environment most widely used for electrophysiological data analysis worldwide. EEGLAB is thus now a de facto standard supporting a wide range of EEG and other electrophysiological research studies and teaching labs. At least 35 EEGLAB plug-in toolsets have now been released by researchers from many laboratories. Under NIH PAR 11-028 we propose renewal funding to further develop and maintain the EEGLAB software framework. We propose new and better tools for brain source and source network modeling and localization, an expanded online EEGLAB course and workshop, better statistical inference modeling of group data, and new support for automated source decomposition, measure computation, data duration, and data sharing. PUBLIC HEALTH RELEVANCE: A major shift in scientific perspective on the nature and use of human electrophysiological data is now accelerating from measuring and visualizing individual scalp channel signals to directly visualizing and interpreting their brain sources. The EEGLAB signal processing environment, an open source software project of the Swartz Center for Computational Neuroscience (SCCN) at the University Of California San Diego (UCSD), supports a large number of EEG and related electrophysiological research studies and teaching labs. We propose continued funding to further develop and maintain the EEGLAB environment.",EEGLAB: Software for Analysis of Human Brain Dynamics,9099954,R01NS047293,"['Bayesian Modeling', 'Behavior', 'Brain', 'Brain imaging', 'California', 'Clinical', 'Cloud Computing', 'Code', 'Community Outreach', 'Complex', 'Computer software', 'Data', 'Data Analyses', 'Data Set', 'Data Sources', 'Databases', 'Development', 'Disease', 'Documentation', 'Ecosystem', 'Educational process of instructing', 'Educational workshop', 'Electrodes', 'Electromagnetics', 'Electronic Mail', 'Electrophysiology (science)', 'Environment', 'Event', 'Event-Related Potentials', 'Eye', 'Functional Imaging', 'Functional Magnetic Resonance Imaging', 'Funding', 'Future', 'Health', 'Human', 'Image', 'Imagery', 'Individual', 'Internet', 'Joints', 'Laboratories', 'Links List', 'Machine Learning', 'Measurement', 'Measures', 'Memory', 'Metadata', 'Methods', 'Modeling', 'Morphologic artifacts', 'Multimodal Imaging', 'Nature', 'Neurosciences', 'Output', 'Paper', 'Pattern', 'Performance', 'Physiology', 'Plug-in', 'Positioning Attribute', 'Procedures', 'Process', 'Reporting', 'Research', 'Research Activity', 'Research Personnel', 'Resolution', 'Respondent', 'Running', 'Scalp structure', 'Signal Transduction', 'Software Framework', 'Source', 'Speed', 'Stream', 'Surveys', 'Testing', 'Time', 'Training', 'United States National Institutes of Health', 'Universities', 'Update', 'base', 'brain health', 'computational neuroscience', 'computing resources', 'cost', 'cranium', 'data sharing', 'density', 'design', 'experience', 'flexibility', 'imaging modality', 'improved', 'innovation', 'interest', 'learning strategy', 'mathematical methods', 'network models', 'news', 'online course', 'open source', 'research study', 'signal processing', 'symposium', 'temporal measurement', 'tool', 'web site', 'wiki']",NINDS,"UNIVERSITY OF CALIFORNIA, SAN DIEGO",R01,2016,480520,0.16080996938420689
