text,title,id,project_number,terms,administration,organization,mechanism,year,funding,score
"Programmable RNA-targeting CRISPR-Cas tools to study RNA biology Summary Technological advances such as next-generation sequencing and single-cell analysis have opened the flood gates for RNA analysis, revealing that the transcriptome is significantly more complex than previously thought, both with respect to the diversity of RNA transcripts, their temporal expression dynamics, and their cellular location. Moreover, thousands of dysregulated RNAs have been observed in diseases including cancer and neurodegenerative disorders. These observations underscore the dire need for new molecular tools to precisely dissect RNA function in health and disease. The goal of my research program is to harness the unprecedented power of CRISPR-Cas systems to create a versatile range of methods to precisely manipulate virtually any RNA, and to use these tools to explore fundamental knowledge gaps in RNA biology. This proposal specifically focuses on addressing the following knowledge gaps: 1) Despite the technological advances in harnessing RNA-targeting CRISPR-Cas enzymes Cas9 and Cas13 for research and clinical applications, we still do not understand the principles of gRNA selection for efficient and tunable RNA-targeting. This problem precludes the facile development of a number of RNA-targeting applications and underscores the need for a thorough interrogation of gRNA selection. Our goal here is to develop a model to predict highly-active gRNAs for Cas9/Cas13 RNA- targeting in human cells. We will use a combination of high-throughput RNA:protein interactome methods, flow- cytometry based gRNA screens and machine learning to precisely define features of highly active RNA-targeting gRNAs for RNA-binding and knockdown for Cas9 and Cas13. 2) The vast majority of human RNAs are alternatively spliced, and RNA splicing defects are common in cancers and neurological diseases. However, our understanding of the downstream functional effects of splicing in a majority of cases is rudimentary. To address this issue, we will develop a toolbox of robust, multiplexable Cas-based splicing factors to offer an unprecedented opportunity to study the functional consequences of alternative splicing. that can determine in a single step both the identity of proteins bound to a And 3) There is a paucity of methods specific RNA and their location on that RNA. The development of such an approach will enable us to determine the spatial arrangement of proteins on specific RNAs to dissect their dynamic deposition in range of RNA processes such as transcription, 3ʹ-end and micro-RNA processing, and lncRNA function. To address this issue, we propose to develop a genetically encodable Cas-based RNA proximity-labeling strategy to precisely identify proteins that bind in close proximity to a specific RNA sequence. We will then use this approach to identify protein factors involved in regulating microprocessor (Drosha/DGCR8) activity at specific primary micro-RNA loci. These research goals fully align with the NIGMS 5 Year Strategic Plan, through the development of essential research tools to study and RNA function for biomedical research. Project Narrative RNA-targeting CRISPR-Cas proteins offer an unprecedented opportunity to precisely manipulate RNA biology in ways not currently possible. We propose several innovative approaches to address critical knowledge gaps in CRISPR-Cas tool development and chart a path to use these tools to interrogate several fundamental questions in RNA biology. Our approaches will help us define the gRNA design rules for RNA-targeting Cas proteins, and develop robust new RNA-targeting Cas tools to manipulate RNA splicing and dissect protein- RNA interaction networks, and ultimately, the tools developed here will transform the way we study RNA and will broadly impact the fields of molecular and cell biology.",Programmable RNA-targeting CRISPR-Cas tools to study RNA biology,9796943,R35GM133462,"['Address', 'Alternative Splicing', 'BCAR1 gene', 'Binding Proteins', 'Biology', 'Biomedical Research', 'Cells', 'Cellular biology', 'Clustered Regularly Interspaced Short Palindromic Repeats', 'Complex', 'Defect', 'Deposition', 'Development', 'Disease', 'Enzymes', 'Floods', 'Flow Cytometry', 'Genetic Transcription', 'Goals', 'Guide RNA', 'Health', 'Human', 'Knowledge', 'Label', 'Location', 'Machine Learning', 'Malignant Neoplasms', 'Methods', 'MicroRNAs', 'Microprocessor', 'Modeling', 'Molecular', 'Molecular Biology', 'National Institute of General Medical Sciences', 'Neurodegenerative Disorders', 'Process', 'Proteins', 'RNA', 'RNA Binding', 'RNA Processing', 'RNA Sequences', 'RNA Splicing', 'RNA analysis', 'RNA-Protein Interaction', 'Research', 'Strategic Planning', 'System', 'Transcript', 'base', 'clinical application', 'design', 'innovation', 'knock-down', 'nervous system disorder', 'next generation sequencing', 'programs', 'single cell analysis', 'tool', 'tool development', 'transcriptome', 'virtual']",NIGMS,UNIVERSITY OF ROCHESTER,R35,2019,385000,0.3027091976878245
"Revealing Principles of Subcellular RNA Localization by Proximity Labeling PROJECT SUMMARY The human body comprises of trillion of cells, which are the building blocks of life. Each cell is highly organized, with various constituents within localizing to specific regions. Location within a cell is a cardinal organizing principle of gene control and function, especially for RNAs that code for proteins or serve regulatory roles as non-coding RNAs. Each cell type has its distinct RNA-species profile, and where these RNAs are located within the cell can dictate their folding, editing, splicing, translation, degradation, binding partners, catalytic activity, and even the fate of the proteins that they encode. Unsurprisingly, perturbations in RNA localization result in disease conditions including cancers and neuropathologies. In spite of the vital importance of subcellular RNA localization in gene expression, investigating such phenomena simultaneously for many RNA species has been challenging. To address these long-standing issues, Dr. Furqan Fazal and others have recently developed a technique called APEX-seq that can track the location of thousands of RNAs in living human cells with high-temporal and nanometer-spatial resolution. APEX-seq has the transformative potential to provide high-resolution snapshots of tens of thousands of endogenous cellular RNA species, free from artifacts of overexpression, cell fixation or recombinant tagging. This proposal outlines a five-year career program for Dr. Fazal as he investigates principles of RNA subcellular localization, and reaches milestone goals that will transition him into an independent investigator. By improving the APEX-seq technique and amalgamating it with a number of cutting-edge tools including massively-parallel reporter assays and deep-learning-based approaches, Dr. Fazal will dissect how sequences within RNAs direct them to different locations, and how cells actively control RNA subcellular localization to regulate gene function. This work will be carried out at Stanford University, where Dr. Fazal will be mentored by Dr. Howard Chang, a pioneer in developing new genomics tools, and Dr. Joanna Wysocka, a leading authority in vertebrate development and non-coding genomic regulatory elements. Both mentors have highly-successful track records of placing postdoctoral fellows into independent academic positions at leading institutions around the nation and world. Additional support will be available through collaboration with Drs. Shen, Boettiger and Kundaje who will provide training and expertise in genetics, imaging, statistics and computation. An advisory committee comprising of world-leading investigators Drs. Ting, Kool, Li, Bryant and Bassik will also monitor progress and provide expertise. Further acquisition of scientific and professional skills will be achieved by utilizing the educational resources available through the Stanford University School of Medicine and Office of Postdoctoral Affairs. Stanford provides an outstanding intellectually-stimulating environment with all facilities and resources necessary for success, and all proposed training will complement Dr. Fazal’s previous knowledge in genomics and biophysics and facilitate his transition into a multidisciplinary RNA biologist in the field of spatial transcriptomics. PROJECT NARRATIVE Many RNA species within a cell are spatially localized and locally translated into proteins, and previous studies in embryos, neurons and highly-dynamic tissues have demonstrated the vital importance of RNA subcellular location in development and cellular function. However, it has been challenging to study localization transcriptome-wide, which has hampered understanding of the extent and role of such processes in normal and diseased tissues. The proposed work will improve a newly-developed tool for the RNA community to investigate spatial transcriptomics, and use it to provide new insights into RNA biology by determining the regulatory sequences (i.e. the grammar) controlling localization, as well as identifying the associated cellular mechanisms.",Revealing Principles of Subcellular RNA Localization by Proximity Labeling,9870316,K99HG010910,"['3-Dimensional', 'Active Biological Transport', 'Address', 'Advisory Committees', 'Animal Model', 'Binding', 'Biochemical Genetics', 'Biological Assay', 'Biology', 'Biophysics', 'Caenorhabditis elegans', 'Cell physiology', 'Cells', 'Chromatin', 'Cis-Acting Sequence', 'Code', 'Collaborations', 'Communities', 'Complement', 'DNA', 'DNA Library', 'Data', 'Data Set', 'Development', 'Developmental Biology', 'Disease', 'Dynein ATPase', 'Elements', 'Embryo', 'Environment', 'Enzymes', 'Fractionation', 'Gene Expression', 'Gene Expression Regulation', 'Genes', 'Genetic', 'Genomics', 'Goals', 'Grant', 'Heterochromatin', 'Human', 'Human body', 'Image', 'Institution', 'Kinesin', 'Knowledge', 'Label', 'Life', 'Location', 'Machine Learning', 'Malignant Neoplasms', 'Maps', 'Mentors', 'Messenger RNA', 'Mitochondria', 'Modeling', 'Modification', 'Molecular Motors', 'Monitor', 'Morphologic artifacts', 'Myosin ATPase', 'Neurons', 'Nuclear', 'Nuclear Envelope', 'Nuclear Lamina', 'Nuclear Pore', 'Organelles', 'Outer Mitochondrial Membrane', 'Pattern', 'Peroxidases', 'Pharmaceutical Preparations', 'Phase', 'Positioning Attribute', 'Postdoctoral Fellow', 'Process', 'Proteins', 'Protocols documentation', 'RNA', 'RNA Splicing', 'RNA Transport', 'RNA-Binding Proteins', 'Recombinants', 'Records', 'Regulation', 'Regulatory Element', 'Repetitive Sequence', 'Reporter', 'Research Personnel', 'Resolution', 'Resources', 'Retrotransposon', 'Role', 'Single Nucleotide Polymorphism', 'Small Nuclear RNA', 'Structure', 'System', 'Techniques', 'Technology', 'Testing', 'Tissues', 'Training', 'Transcript', 'Translating', 'Translations', 'Universities', 'Untranslated RNA', 'Variant', 'Work', 'Writing', 'active control', 'authority', 'base', 'career', 'cell fixation', 'cell type', 'clinically significant', 'deep learning', 'design', 'education resources', 'experience', 'gene function', 'genomic tools', 'improved', 'in vitro Assay', 'insertion/deletion mutation', 'insight', 'medical schools', 'multidisciplinary', 'nanometer', 'neuropathology', 'overexpression', 'programs', 'ribosome profiling', 'skills', 'statistics', 'success', 'tool', 'transcriptome', 'transcriptome sequencing', 'transcriptomics']",NHGRI,STANFORD UNIVERSITY,K99,2019,137214,0.1903450678591107
"The next generation of RNA-Seq simulators for benchmarking analyses Abstract: RNA-Sequencing (RNA-Seq) has established itself as the primary method for studying transcription in basic research, with an emerging role in the clinic – currently upwards of 5,000 publications using the technology are indexed in PubMed. However, the interpretation of RNA-Seq requires several complex operations including alignment, quantification, normalization and statistical analyses of various types. Since its inception a large number of algorithms have appeared for each step, creating a very confusing landscape for investigators. In order to determine the best analysis practices, numerous benchmarking studies have emerged which leverage real RNA-Seq data made from well-studied RNA samples, such as the Genetic European Variation in Health and Disease (GEUVADIS) consortium data. These valuable RNA-Seq datasets contain the biases and errors introduced by sequencing biochemistry—factors that any analysis method must account for and overcome. However, the utility of such datasets for benchmarking analysis methods is limited by the fact that we do not know the underlying truth (e.g. the true number of RNA molecules from each transcript in the original sample). Therefore researchers tend to rely heavily on simulated data, since we know everything about the true composition of these samples. There are dozens of DNA simulators aimed at benchmarking applications such as variant calling. And while the need for simulators is just as strong in RNA analysis, there are only a scant few RNA-Seq simulators available. Furthermore, the available RNA- Seq simulators are based on simplifying assumptions that greatly restrict their utility for benchmarking anything but the most upstream steps in the analysis pipeline (e.g. alignment). The further downstream the analysis method is, the more accurately the true nature of real data and its technical biases need to be modeled in order to draw meaningful conclusions. For example, no simulator generates data from a diploid genome, which would be necessary to evaluate allele specific quantification. Given our extensive experience with RNA-Seq analysis and transcriptomics in general, and our success at building the BEERS simulator, and our track record of authorship on all comprehensive RNA-Seq aligner benchmarking studies published to date, we are ideally situated to develop the next generation of open-source RNA-Seq simulator which aims to model all sources of technical variability. Furthermore, the simulator will model biological variability with an empirical approach based on using real data to configure the simulator’s parameters, which is a natural problem for machine learning. There are eleven steps in RNA-Seq library preparation which introduce bias, all of which will be modeled by the software in an object-oriented modular framework. Project Narrative: There have been many algorithms developed for every step of the RNA-Seq analysis pipeline with no easy way to compare between them. Simulated data are useful for this purpose, but to date there are very few RNA-Seq simulators available and all make too many simplifying assumptions to be used for anything but the most upstream steps in the pipeline, e.g. alignment. We propose to develop the next generation of open-source RNA-Seq simulator, which will capture all of the biochemical processes in a modular fashion and model all of the sources of technical variation.",The next generation of RNA-Seq simulators for benchmarking analyses,9730605,R21LM012763,"['Affect', 'Algorithms', 'Alleles', 'Alternative Splicing', 'Authorship', 'Basic Science', 'Benchmarking', 'Biochemical', 'Biochemical Process', 'Biochemical Reaction', 'Biological', 'Biological Models', 'Clinic', 'Clinical', 'Communities', 'Complement', 'Complex', 'Computer Simulation', 'Computer software', 'DNA', 'DNA-Directed DNA Polymerase', 'Data', 'Data Set', 'Development', 'Diploidy', 'Disease', 'Enzymes', 'European', 'Genetic', 'Genetic Transcription', 'Genome', 'Goals', 'Guanine + Cytosine Composition', 'Health', 'In Vitro', 'Libraries', 'Machine Learning', 'Methods', 'Modeling', 'Morphologic artifacts', 'Nature', 'Output', 'Preparation', 'Process', 'Protein Isoforms', 'Protocols documentation', 'PubMed', 'Public Domains', 'Publications', 'Publishing', 'RNA', 'RNA Splicing', 'RNA analysis', 'Research Personnel', 'Resources', 'Role', 'Sampling', 'Sequencing Biochemistry', 'Signal Transduction', 'Source', 'Statistical Data Interpretation', 'Technology', 'Testing', 'Transcript', 'Variant', 'Work', 'analog', 'analysis pipeline', 'base', 'biochemical model', 'design', 'digital', 'experience', 'experimental study', 'flexibility', 'indexing', 'next generation', 'open source', 'operation', 'power analysis', 'success', 'tool', 'transcriptome sequencing', 'transcriptomics']",NLM,UNIVERSITY OF PENNSYLVANIA,R21,2019,181125,0.23505701098012544
"SpliceCore: A Cloud-Based Software Platform to Translate Alternative Splicing Events into Therapeutic Targets Using RNA-seq Data Abstract Over 30 million people in the US suffer from genetic diseases or cancers caused by mutations of which ~15% disrupt the regulation of splicing. Alternative splicing (AS) errors have been reported in literature to drive 370 genetic diseases out of ~800 described to date. In addition, due to the recent success of FDA-approved splicing modulators like Nusinersen, along with fascinating pre- clinical results underlining the importance of AS as therapeutic targets; splicing research has become of major interest to pharmaceutical companies. Envisagenics is developing SpliceCoreTM, an innovative cloud-based software platform using biomedical big data for AS analysis to discover new therapies and biomarkers for complex diseases. Our breakthrough platform combines algorithms and databases developed and experimentally validated at Cold Spring Harbor Laboratory (CSHL): SpliceTrapTM, for the detection of splicing activity using RNA-seq data; SpliceDuoTM, for the identification of significant splicing variation across biological samples; SpliceImpact2TM, for the prioritization of biologically relevant AS variants with therapeutic potential; and TXdbTM, a splicing isoform database that connects client’s proprietary data to public repositories such as the Cancer Genome Atlas (TCGA). Thanks to the Phase I award SpliceCore was adapted as a cloud-based software, accelerating scalability and adaptation to the fast- evolving market of biomedical Big Data. We now have deployed SpliceCore’s back-end on three cloud-service providers, increased its overall run-time by a factor of 12, developed tools to discover disease-specific AS isoforms, finalized and tested a machine-learning algorithm to predict the biological impact of AS, and experimentally validated some of our new predictions with a success rate of 82.5%. The goal for Phase II is to accelerate client acquisition through the development of user-interactive applications informed from client’s feedback by substantially expanding the platform’s knowledgebase and predictive functions with novel AS isoforms extracted from ~37,000 public datasets. Thus, a new version of SpliceCore will be developed to predict regulatory interactions between RNA-binding proteins and their RNA targets to assist in the interpretation of aberrant splicing factors through a collaboration with world renowned HHMI Professor Dr. Tom Tuschl from Rockefeller University and developer of Nusinersen, Professor Dr. Adrian Krainer from CSHL. Envisagenics is targeting the global bioinformatics market valued at $4 billion in 2014 with a CAGR of over 21%. SpliceCore could capture ~10% of the market, identify novel drug targets, and design RNA therapeutics from aberrant splicing events prevalent in cancer and a multitude of genetic diseases while increasing the efficiency of R&D in biopharma. Project Narrative In this SBIR Phase II, Envisagenics will advance the development of SpliceCoreTM, a cloud-based software platform for the discovery of drug-targets and biomarkers using biomedical big data. Therapeutic screens are increasingly focusing on Alternative Splicing (AS), a biological process that regulates gene-product structure and function. Strikingly, 50% of genetic diseases described in literature can be triggered by AS errors. The recent FDA approval of RNA-therapeutic compounds to correct AS errors, combined with increasingly available big datasets and groundbreaking cloud-computing provide a unique opportunity for computerized discovery of AS therapeutics. Envisagenics’ technology will help biomedical researchers to translate basic science into new therapeutic products for cancer and genetic diseases. By the completion of this project, we will deploy a user-friendly, secured and scalable SpliceCore software, with new functionalities ready for integration into biopharmaceutical Research & Development workflows.",SpliceCore: A Cloud-Based Software Platform to Translate Alternative Splicing Events into Therapeutic Targets Using RNA-seq Data,9677178,R44GM116478,"['Achievement', 'Advanced Development', 'Affect', 'Algorithms', 'Alternative Splicing', 'Amyotrophic Lateral Sclerosis', 'Award', 'Back', 'Basic Science', 'Big Data', 'Bioinformatics', 'Biological', 'Biological Markers', 'Biological Process', 'Biological Products', 'Cancer Etiology', 'Client', 'Cloud Computing', 'Cloud Service', 'Collaborations', 'Complex', 'Computer Simulation', 'Computer software', 'Data', 'Data Set', 'Databases', 'Defect', 'Detection', 'Development', 'Disease', 'Drops', 'Drug Targeting', 'Dysmyelopoietic Syndromes', 'Ensure', 'Event', 'FDA approved', 'Face', 'Failure', 'Feedback', 'Food and Drug Administration Drug Approval', 'Frequencies', 'Genetic Diseases', 'Genotype-Tissue Expression Project', 'Goals', 'Growth', 'Imagery', 'Immunoprecipitation', 'Infrastructure', 'Laboratories', 'Literature', 'Machine Learning', 'Malignant Neoplasms', 'Manuals', 'Maps', 'Memorial Sloan-Kettering Cancer Center', 'Meta-Analysis', 'Methods', 'Mutation', 'Nucleotides', 'Pathway interactions', 'Patients', 'Performance', 'Pharmacologic Substance', 'Phase', 'Predictive Analytics', 'Prevalence', 'Price', 'Privatization', 'Probability', 'Protein Binding Domain', 'Protein Isoforms', 'Protein Splicing', 'RNA', 'RNA Splicing', 'RNA-Binding Protein FUS', 'RNA-Binding Proteins', 'Regulation', 'Reporting', 'Research', 'Research Personnel', 'Ribonucleosides', 'Risk', 'Running', 'SRSF2 gene', 'Sampling', 'Secure', 'Services', 'Small Business Innovation Research Grant', 'Specificity', 'Spinal Muscular Atrophy', 'Structure', 'System', 'Technology', 'Testing', 'The Cancer Genome Atlas', 'Therapeutic', 'Time', 'Tissues', 'Translating', 'Universities', 'Validation', 'Variant', 'Work', 'big biomedical data', 'cancer genetics', 'case control', 'cloud based', 'commercial application', 'computerized', 'cost', 'crosslink', 'data mining', 'data warehouse', 'design', 'drug discovery', 'experimental study', 'fascinate', 'flexibility', 'gene product', 'human disease', 'improved', 'innovation', 'interest', 'knowledge base', 'learning strategy', 'machine learning algorithm', 'new therapeutic target', 'novel', 'novel therapeutics', 'petabyte', 'pre-clinical', 'preclinical study', 'predictive modeling', 'professor', 'repository', 'research and development', 'service providers', 'success', 'system architecture', 'targeted biomarker', 'therapeutic RNA', 'therapeutic target', 'tool', 'transcriptome sequencing', 'user-friendly']",NIGMS,"ENVISAGENICS, INC.",R44,2019,517226,0.060154227793852474
