text,title,id,project_number,terms,administration,organization,mechanism,year,funding,score
"An integrative genomic strategy to infer global RNA regulatory networks  Project summary It is increasingly recognized that mammalian biologic complexity is amplified enormously by the regulation of RNA complexity. This regulation is mediated by hundreds of RNA-binding proteins (RBPs) and microRNAs (miRNAs) through sequence-specific interactions with their targets. Misregulation of RNAs can cause a number of genetic diseases. Despite their critical roles, efforts to study RNA complexity are largely impeded by the difficulty to accurately infer global RNA-regulatory networks, due to deficiencies of high-throughput experimental technologies and effective computational methods. This application describes a combination of experimental and computational approaches to advance the understanding of in vivo RNA regulation in mammalian brains at the systems level. On the experimental side, I will take advantage of the mouse genetic systems and high-throughput technologies established in the Robert Darnell laboratory at Rockefeller University, where the mentored phase of research will be performed. HITS-CLIP will be used to generate genome-wide maps of biochemical footprints of several important neuronal RBPs; exon-junction microarrays and RNA-Seq will be used to generate nucleotide-resolution transcriptome profiles for comparative analysis of wild type brains and brains lacking individual RBPs, and of developing mouse brains. On the computational side, integrative modeling techniques, such as hidden Markov models (HMMs) and Bayesian networks, will be employed to probabilistically model biochemical, structural, genomic, and evolutionary information from multiple data sources, so that highly predictive models of RBP/miRNA target sites and RNA-regulatory networks can be developed. Substantial preliminary data have been obtained from the analysis of RNA splicing regulation by Nova, which demonstrates the effectiveness of such an integrative genomic strategy to define accurate and comprehensive RNA-regulatory networks and obtain novel biological insights. Here I propose to further improve these methods, and extend the strategy to other RBPs, individually or in combination, and other steps of RNA regulation. The regulatory mechanisms discovered in genetically engineered systems will be further extended to study the combinatorial and dynamic RNA regulation in developing brains and in different brain regions. While I have received extensive training in machine learning and computational studies of RNA regulation, this career development award will allow me to expand my existing skills and continue to develop my experimental skills. The excellent environment in the Darnell lab and Rockefeller University will greatly facilitate not only the mentored research, but also my transition to an independent academic position. Together, the proposed study will pave the road to launch my future investigations that aim to decode rules governing RNA regulation in normal biological processes and human diseases.  Public Health Relevance Statement RNA regulation is critical for the diversification of mammalian gene expression, organism complexity, and human diseases. The proposed study is to investigate the fundamentals of neuronal RNA complexity at the systems level, using a combination of high-throughput experimental technologies and novel integrative computational methods.",An integrative genomic strategy to infer global RNA regulatory networks,8582163,R00GM095713,"['Age', 'Alternative Splicing', 'Binding', 'Binding Sites', 'Biochemical', 'Biological', 'Biological Models', 'Biological Process', 'Brain', 'Brain region', 'Code', 'Collaborations', 'Computing Methodologies', 'Data', 'Data Set', 'Data Sources', 'Development', 'Effectiveness', 'Environment', 'Evaluation', 'Exons', 'Foxes', 'Future', 'Gene Expression', 'Gene Expression Profile', 'Genetic', 'Genetic Engineering', 'Genetic Transcription', 'Genomics', 'Goals', 'Hereditary Disease', 'Individual', 'Investigation', 'K-Series Research Career Programs', 'Knock-out', 'Knockout Mice', 'Knowledge', 'Laboratories', 'Machine Learning', 'Maps', 'Mediating', 'Mentors', 'Messenger RNA', 'Methods', 'MicroRNAs', 'Modeling', 'Monitor', 'Mus', 'Muscle', 'Neurons', 'Nucleotides', 'Organism', 'Phase', 'Polyadenylation', 'Positioning Attribute', 'Proteins', 'RNA', 'RNA Splicing', 'RNA-Binding Proteins', 'RNA-Protein Interaction', 'Regulation', 'Research', 'Resolution', 'Role', 'Side', 'Site', 'Small RNA', 'Specificity', 'Statistical Models', 'System', 'Techniques', 'Technology', 'Training', 'Transcript', 'Translations', 'Universities', 'Validation', 'base', 'biochemical model', 'combinatorial', 'comparative', 'computer based statistical methods', 'computer studies', 'design', 'functional outcomes', 'genome-wide', 'high throughput technology', 'human disease', 'improved', 'in vivo', 'insight', 'mRNA Export', 'mRNA Stability', 'markov model', 'new technology', 'novel', 'predictive modeling', 'public health relevance', 'research study', 'skills', 'structural genomics', 'transcriptome sequencing']",NIGMS,COLUMBIA UNIVERSITY HEALTH SCIENCES,R00,2013,249000,0.19874366428074308
"Functional RNA elements in the human genome DESCRIPTION (provided by applicant): Pre-mRNA splicing is essential for proper gene expression in higher eukaryotic genomes, as the vast majority of genes contain introns that have to be accurately recognized and removed. Recent studies have revealed that >90% of the genes undergo alternative splicing, which is believed to contribute to the complexity of the proteome in different cell types and tissues in vertebrates and abundant evidence suggests that altered splicing causes a variety of human diseases. Despite extensive knowledge on the splicing mechanism based on biochemical dissection of model minigenes, we know little about how many genes are involved in the regulation of alternative splicing and where the functional RNA elements are embedded in the human genome. Built on our productive research in the current award period, we now propose a bold plan to systematically attack the critical gap of our knowledge about the regulation of alternative splicing. We will pursue three major lines of research by utilizing the latest and innovative genomics technologies. (1) We will use a new, automated platform recently developed in our lab to profile hundreds of conserved alternative splicing events against every annotated genes in the human genome. This unbiased approach will generate unprecedented information to uncover novel splicing regulators and deduce pathways in regulated splicing. (2) We will focus on RNA binding proteins involved in individual regulatory pathways to elucidate the molecular basis for regulated splicing by mapping their physical interactions with expressed RNA. For this purpose, we will construct a large panel of cell lines based on FLP-In 293 cells to express individual RNA binding proteins as a V5-tagged protein at the C- terminus, which will permit large-scale mapping of RNA-protein interactions by CLIP-seq (CrossLinking ImmunoPrecipitation followed by high throughput sequencing) under a similar and optimized set of conditions. (3) Our third goal is to use the information generated from the proposed mapping and functional studies to develop an integrated framework for de novo prediction of splicing regulation by using machine-learning and graphical models. This research has the potential to fundamentally change our view on splicing control and its contribution to human disease. This RNA genomics project aims to deduce the splicing code in the human genome by systematic determination of genes involved in regulated splicing, elucidation of regulatory pathways, and RNA-protein interactions. The proposed research will use the latest genomics technologies to reveal functional RNA elements in the human genome, which will provide the molecular basis for many RNA-related human diseases.",Functional RNA elements in the human genome,8471148,R01HG004659,"['Address', 'Affect', 'Alternative Splicing', 'Award', 'Beryllium', 'Binding', 'Biochemical', 'Biological Process', 'Biology', 'Cell Line', 'Cell physiology', 'Cells', 'Cistrons', 'Code', 'Complex', 'Computational Biology', 'DNA-Binding Proteins', 'Development', 'Dissection', 'Epigenetic Process', 'Eukaryota', 'Event', 'Excision', 'Exons', 'Functional RNA', 'Gene Expression', 'Gene Expression Regulation', 'Genes', 'Genetic', 'Genome', 'Genomics', 'Goals', 'Grant', 'Hereditary Disease', 'Heterogeneous-Nuclear Ribonucleoproteins', 'Human', 'Human Cell Line', 'Human Genetics', 'Human Genome', 'Immunoprecipitation', 'Indium', 'Individual', 'Introns', 'Knowledge', 'Leadership', 'Machine Learning', 'Malignant Neoplasms', 'Maps', 'Measurement', 'Mediating', 'MicroRNAs', 'Modeling', 'Molecular', 'National Human Genome Research Institute', 'Output', 'Pathway interactions', 'Play', 'Process', 'Protein Isoforms', 'Proteins', 'Proteome', 'Publications', 'Publishing', 'RNA', 'RNA Interference', 'RNA Splicing', 'RNA-Binding Proteins', 'RNA-Protein Interaction', 'Regulation', 'Regulatory Pathway', 'Relative (related person)', 'Reporter', 'Research', 'Role', 'Sampling', 'Series', 'Signal Transduction', 'Site', 'System', 'Technology', 'Tissues', 'Vertebrates', 'base', 'cell type', 'cost effective', 'crosslink', 'empowered', 'functional group', 'functional outcomes', 'genome wide association study', 'genome-wide', 'homologous recombination', 'human disease', 'innovation', 'interest', 'mRNA Precursor', 'mammalian genome', 'new technology', 'novel', 'predictive modeling', 'programs', 'response']",NHGRI,"UNIVERSITY OF CALIFORNIA, SAN DIEGO",R01,2013,649400,0.17134022340554317
"Blood Studies of Endothelial Function and Systemic Inflammation Recent publications are summarized below, adapted from the article's abstracts:  1. A systematic comparison and evaluation of high density exon arrays and RNA-seq technology used to unravel the peripheral blood transcriptome of sickle cell disease.  BACKGROUND: Transcriptomic studies in clinical research are essential tools for deciphering the functional elements of the genome and unraveling underlying disease mechanisms. Various technologies have been developed to deduce and quantify the transcriptome including hybridization and sequencing-based approaches. Recently, high density exon microarrays have been successfully employed for detecting differentially expressed genes and alternative splicing events for biomarker discovery and disease diagnostics. The field of transcriptomics is currently being revolutionized by high throughput DNA sequencing methodologies to map, characterize, and quantify the transcriptome.  METHODS: In an effort to understand the merits and limitations of each of these tools, we undertook a study of the transcriptome in sickle cell disease, a monogenic disease comparing the Affymetrix Human Exon 1.0 ST microarray (Exon array) and Illumina's deep sequencing technology (RNA-seq) on whole blood clinical specimens.  RESULTS: Analysis indicated a strong concordance (R&#8201;=&#8201;0.64) between Exon array and RNA-seq data at both gene level and exon level transcript expression. The magnitude of differential expression was found to be generally higher in RNA-seq than in the Exon microarrays. We also demonstrate for the first time the ability of RNA-seq technology to discover novel transcript variants and differential expression in previously unannotated genomic regions in sickle cell disease. In addition to detecting expression level changes, RNA-seq technology was also able to identify sequence variation in the expressed transcripts.  CONCLUSIONS: Our findings suggest that microarrays remain useful and accurate for transcriptomic analysis of clinical samples with low input requirements, while RNA-seq technology complements and extends microarray measurements for novel discoveries.  2. A novel molecular signature for elevated tricuspid regurgitation velocity in sickle cell disease.  Rationale: An increased tricuspid regurgitation jet velocity (TRV > 2.5 m/s) and pulmonary hypertension defined by right heart catheterization both independently confer increased mortality in sickle cell disease (SCD).   Objectives: We explored the usefulness of peripheral blood mononuclear cell-derived gene signatures as biomarkers for an elevated TRV in SCD.   Methods: Twenty-seven patients with SCD underwent echocardiography and peripheral blood mononuclear cell isolation for expression profiling and 112 patients with SCD were genotyped for single-nucleotide polymorphisms.   Measurements and Main Results: Genome-wide gene and miRNA expression profiles were correlated against TRV, yielding 631 transcripts and 12 miRNAs. Support vector machine analysis identified a 10-gene signature including GALNT13 (encoding polypeptide N-acetylgalactosaminyltransferase 13) that discriminates patients with and without increased TRV with 100% accuracy. This finding was then validated in a cohort of patients with SCD without (n = 10) and with pulmonary hypertension (n = 10, 90% accuracy). Increased TRV-related miRNAs revealed strong in silico binding predictions of miR-301a to GALNT13 corroborated by microarray analyses demonstrating an inverse correlation between their expression. A genetic association study comparing patients with an elevated (n = 49) versus normal (n = 63) TRV revealed five significant single-nucleotide polymorphisms within GALNT13 (P < 0.005), four trans-acting (P < 2.1  10(-7)) and one cis-acting (P = 0.6  10(-4)) expression quantitative trait locus upstream of the adenosine-A2B receptor gene (ADORA2B).   Conclusions: These studies validate the clinical usefulness of genomic signatures as potential biomarkers and highlight ADORA2B and GALNT13 as potential candidate genes in SCD-associated elevated TRV. n/a",Blood Studies of Endothelial Function and Systemic Inflammation,8746610,ZIAHL006013,"['Adenosine A2B Receptor', 'Alternative Splicing', 'Area', 'Arteriosclerosis', 'Base Sequence', 'Binding', 'Biochemistry', 'Biological Assay', 'Biological Markers', 'Biology', 'Blood', 'Blood Vessels', 'Blood specimen', 'Candidate Disease Gene', 'Cardiac Catheterization Procedures', 'Cell Adhesion Molecules', 'Cell Separation', 'Child', 'Clinical', 'Clinical Research', 'Collection', 'Complement', 'Computer Simulation', 'Consumption', 'Coronary Arteriosclerosis', 'Critical Care', 'DNA Sequence', 'Data', 'Development', 'Diagnostic', 'Disease', 'Echocardiography', 'Elements', 'Evaluation', 'Event', 'Exons', 'Fetal Hemoglobin', 'Gene Expression', 'Gene Expression Profile', 'Genes', 'Genome', 'Genomics', 'Genotype', 'Hematology', 'Hospitals', 'Human', 'In Vitro', 'Inflammation', 'Inflammation Mediators', 'Inflammatory', 'Laboratories', 'Laboratory Chemicals', 'Laboratory Research', 'Lung', 'Lung diseases', 'Machine Learning', 'Maps', 'Measurement', 'Medical center', 'Medicine', 'Metabolic', 'Metabolism', 'Methodology', 'Methods', 'MicroRNAs', 'Molecular Profiling', 'National Heart, Lung, and Blood Institute', 'National Institute of Diabetes and Digestive and Kidney Diseases', 'Nitric Oxide', 'Patients', 'Peripheral Blood Mononuclear Cell', 'Plasma', 'Plasma Cells', 'Plasma Proteins', 'Polypeptide N-acetylgalactosaminyltransferase', 'Protocols documentation', 'Publications', 'Pulmonary Hypertension', 'Quantitative Trait Loci', 'Receptor Gene', 'Research', 'Role', 'Sampling', 'Sepsis', 'Sickle Cell Anemia', 'Single Nucleotide Polymorphism', 'Specimen', 'Technology', 'Time', 'Transcript', 'Tricuspid Valve Insufficiency', 'Variant', 'Whole Blood', 'abstracting', 'cohort', 'deep sequencing', 'density', 'fetal globin', 'genetic association', 'genome-wide', 'healthy volunteer', 'improved', 'in vivo', 'member', 'monocyte', 'mortality', 'novel', 'peripheral blood', 'sickling', 'tool', 'transcriptome sequencing', 'transcriptomics', 'volunteer']",NHLBI,"NATIONAL HEART, LUNG, AND BLOOD INSTITUTE",ZIA,2013,116613,0.10497252139418839
"Unlocking transcript diversity via differential analyses of splice graphs Abstract A most basic difference between cells of the same genotype and different phenotype lies in their transcriptome. Understanding the difference between two transcriptomes in terms of the RNA molecules present in each, or changes in abundance of specific molecules, can offer valuable insight into the molecular mechanisms of disease, development, and specialization. High throughput sequencing provides a unique view of the transcriptome in the form of millions or even billions of short reads of nucleotide sequences sampled from the RNA molecules. To date, nearly 1000 such RNA-seq datasets have already been deposited in the NCBI Gene Expression Omnibus. Beyond measuring differences in overall expression of genes between samples, there is a critical need to measure differences in expression at the transcript level. Computational tools that can extract significant changes in transcript diversity across populations with RNA-seq are in immediate demand. However, reconstructing the full extent of transcript isoforms from this wealth of data is not a solved problem because of fundamental ambiguities between isoforms at the scale of the short read samples.  We propose a novel approach to the differential analysis of transcriptomes that does not depend on the reconstruction of the full-length transcripts, and yet can accurately pinpoint the variation of transcriptomes. Our techniques are data-driven and applicable to any transcriptome, requiring only a reference genome, and do not depend on a priori gene structure annotations. Our research program builds on our highly sensitive and accurate MapSplice alignment algorithm to construct expression weighted splice graphs (ESG) from RNA-seq datasets. ESGs can be three orders of magnitude smaller in size than current RNA-seq datasets, yet fully represent the substantive biological content of such datasets. The ESG representation supports highly efficient analysis techniques that can directly identify and visualize statistically significant differential transcription between samples. Generalizations of the algorithms are proposed to identify co-regulated splicing patterns that are keys for biological pathway analyses and systems biology analyses.  We have established an ongoing interactive and collaborative research environment among the co-PIs and Co-Is which include the biologists, computer scientists and statistician. The proposed computational methods will be tested and refined using RNA-seq data generated from breast cancer cell lines before being further applied to three well curated RNA-seq datasets on lung cancer pathogenesis, stem cells in leukemia, and equine articular cartilage development and repair (a non-model mammalian organism). Experimental validation of differentially expressed transcript isoforms will both improve the accuracy of our methods, as well as propose novel candidates for alternative isoforms associated with lung cancer,and leukemia diseases, and chondrocyte differentiation.  The software will be open-source and will be developed as a set of components that can be used on their own or integrated into RNA-seq processing workflows. In particular we will integrate the components into the Galaxy cloud computing framework hosted on a local server. As such the methods will be available to researchers worldwide. As components mature they may be installed in other servers worldwide to provide a convenient and secure way to analyze transcriptomes.  Unveiling the dynamics of the transcriptome at modest cost will revolutionize cellular diagnostics and biomedical research. Genome-wide measurement of transcription variants offers the potential for detailed molecular information about cellular identity and function that will greatly expand traditional histological assessment. Cloud-based access to the methods can turn individual laboratories into small genome centers and will enable individual scientists to assess differences among RNA transcriptomes in a matter of days. Our suite of algorithms will enable biomedical researchers to prioritize candidate genes or different gene ontology categories to investigate further for differential transcription and mechanistic importance between experimental conditions. Project Narrative  This project will develop new techniques to compare the transcriptome of different cells, sampled using high-throughput sequencing technology. As the transcriptome consists of the RNA ""instructions"" controlling the cell's functions, differential analysis can provide detailed insight into the difference between healthy and diseased cells, or can be used to more clearly discover the functional differences between, say, liver cells and brain cells.",Unlocking transcript diversity via differential analyses of splice graphs,8473250,R01HG006272,"['Affect', 'Algorithms', 'Alternative Splicing', 'Base Sequence', 'Bioinformatics', 'Biological', 'Biological Models', 'Biomedical Research', 'Breast Cancer Cell', 'Cancer cell line', 'Candidate Disease Gene', 'Categories', 'Cell physiology', 'Cells', 'Chondrocytes', 'Computer software', 'Computers', 'Computing Methodologies', 'Data', 'Data Set', 'Databases', 'Deposition', 'Development', 'Diagnostic', 'Disease', 'Environment', 'Equus caballus', 'Evaluation', 'Event', 'Galaxy', 'Gene Expression', 'Gene Expression Profile', 'Gene Fusion', 'Gene Structure', 'Generations', 'Genes', 'Genetic Transcription', 'Genome', 'Genotype', 'Graph', 'Hepatocyte', 'High Performance Computing', 'Individual', 'Institution', 'Instruction', 'Kentucky', 'Laboratories', 'Length', 'Machine Learning', 'Malignant neoplasm of lung', 'Measurement', 'Measures', 'Methods', 'Metric', 'Molecular', 'Molecular and Cellular Biology', 'Mutation', 'Ontology', 'Organism', 'Pathogenesis', 'Pathway interactions', 'Pattern', 'Phenotype', 'Population', 'Problem Solving', 'Process', 'Protein Isoforms', 'Publishing', 'RNA', 'RNA Splicing', 'Reading', 'Records', 'Research', 'Research Personnel', 'Sampling', 'Scientist', 'Secure', 'Stem cells', 'Structure', 'System', 'Systems Biology', 'Techniques', 'Technology', 'Testing', 'Training', 'Transcript', 'Universities', 'Validation', 'Variant', 'Weight', 'Work', 'abstracting', 'anticancer research', 'articular cartilage', 'base', 'brain cell', 'cartilage development', 'cartilage repair', 'comparative', 'computer science', 'computerized tools', 'cost', 'data mining', 'experience', 'flexibility', 'functional genomics', 'genome annotation', 'genome wide association study', 'genome-wide', 'improved', 'insertion/deletion mutation', 'insight', 'leukemia', 'meetings', 'method development', 'novel', 'novel strategies', 'open source', 'programs', 'reconstruction', 'research study', 'statistics', 'transcriptome sequencing']",NHGRI,UNIV OF NORTH CAROLINA CHAPEL HILL,R01,2013,395553,0.1819830154722332
