text,title,id,project_number,terms,administration,organization,mechanism,year,funding,score
"Structure, function, and dynamics of viral RNAs and RNA-containing complexes ﻿    DESCRIPTION (provided by applicant): RNA is a central molecule in biology, performing a large number of diverse and essential tasks. The diversity of RNA function is conferred, in part, by its ability to adopt many different architectures. This includes the ability to form compactly folded structures that interact with other macromolecules to achieve a biological outcome. The discovery of RNAs with novel functions is accelerating, but our understanding of the diversity of RNA structure and how these structures drive function is not keeping pace. Given the importance of RNA in biology, this is an important knowledge gap. The research program described here focuses on understanding important, diverse, biologically active RNAs produced by viruses. This program is motivated by the fact that many viruses use RNA-based mechanisms to manipulate host cell components, altering cellular conditions to favor infection. Thus, viral RNAs are powerful models to discover new RNA structures, to understand how these structures fold, to examine how they interact with and manipulate other macromolecules, and ultimately to describe how the structure drives a specific function. In addition, by studying how viral RNAs manipulate cellular machines, we learn about the machinery itself and we may find new important fundamental RNA-based cellular processes. Finally, viral disease remains a substantial threat to human health, but for most viral infections there is no effective therapy. Learning how viral RNAs work reveals the molecular basis of virus-induced disease, a necessary understanding for developing needed therapies. The number of unexplored viral RNAs is vast, therefore our strategy is to study a set of model viral RNAs with diverse functions. This includes viral RNAs that manipulate the protein synthesis machinery, RNAs that interfere with or co-opt the function of cellular enzymes, and viral RNAs that mimic cellular RNAs and may be molecular ""hijackers"". For each, we aim to understand the details of their structure-based mechanisms by linking atomic-resolution structural data with the function of these structures within cells. In addition, we are particularly interested in understanding how these RNAs may use programmed conformational dynamics to regulate their function. To achieve this understanding we are using quantitative biochemistry, biophysics, structural biology, and virology in an integrated approach. Our overarching goal is to discover important fundamental rules of RNA-based mechanisms of high impact and with broad applicability to many biological systems, simultaneously characterizing new therapeutic targets to inform the development of treatments for human disease. PUBLIC HEALTH RELEVANCE    Relevance to NIH Viruses of all sorts are worldwide health threats and the danger of new pandemics continues to rise with increasing human travel and trade. For the vast majority of viruses there are no effective treatments; developing new therapies to target viral disease requires a much greater understanding of the molecular basis of infection and disease. The research program proposed here aims to understand in great detail how structured viral RNAs manipulate host cell machines during infection, and in so doing help create new therapies.","Structure, function, and dynamics of viral RNAs and RNA-containing complexes",9320692,R35GM118070,"['Adopted', 'Architecture', 'Biochemistry', 'Biological', 'Biology', 'Biophysics', 'Cell physiology', 'Cells', 'Cellular Structures', 'Complex', 'Data', 'Disease', 'Enzymes', 'Goals', 'Health', 'Human', 'Human Development', 'Infection', 'Knowledge', 'Learning', 'Link', 'Machine Learning', 'Modeling', 'Molecular', 'Molecular Conformation', 'Outcome', 'Protein Biosynthesis', 'RNA', 'Research', 'Resolution', 'Structure', 'Travel', 'United States National Institutes of Health', 'Virus', 'Virus Diseases', 'Work', 'base', 'biological systems', 'effective therapy', 'interest', 'macromolecule', 'new therapeutic target', 'novel', 'novel therapeutics', 'pandemic disease', 'programs', 'public health relevance', 'structural biology', 'therapy development', 'viral RNA', 'virology']",NIGMS,UNIVERSITY OF COLORADO DENVER,R35,2017,552994,0.1814351681130187
"Identification of Long Non-coding RNAs as Novel Biomarkers for Heterogeneous Glioblastomas PROJECT SUMMARY  Glioblastoma multiforme (GBM) is the most malignant form of brain tumors with more than 18,000 newly diagnosed patients and 13,000 deaths annually in the United States. The prognosis for GBM remains dismal with a median survival time of GBM patients of 14 to 16 months after diagnosis. A hallmark of malignant GBM is their high heterogeneity within the tumors. This unique characteristic manifests to molecular subtypes of GBM that display unique patterns of pathogenesis, biology, and prognosis. While specific molecular markers are of value in clinical care (e.g., IDH1/2 mutations, 1p/19q co-deletion), significant improvement in prognostic stratification and targeted therapeutics are urgently needed. With the ultimate goal of realizing the full potential of personalized and precision medicine, we propose to interrogate long non-coding RNAs (lncRNAs) in a cohort of clinical GBM specimens. LncRNAs are a class of non-coding RNAs that have emerged as critical modulators in various cellular processes through gene regulation. Previous studies including The Cancer Genome Atlas (TCGA), though limited by their profiling technique not designed for non-coding RNAs, have suggested that lncRNAs are abundant in human cancers and are highly cancer-type-specific. In particular, lncRNAs have been implicated in brain function and glioma development. Specifically, in this exploratory project, we will apply the Ribo-Zero-based transcriptomic sequencing (RNA-seq) to comprehensively characterize lncRNAs in 100 clinical GBM samples that have been collected at the Northwestern University Brain Tumor Tissue Bank (Aim 1a). In contrast to the oligo(dT)-based RNA-seq that was used by previous studies, including TCGA, the Ribo-Zero-based technique is optimized for non-coding RNA transcripts, thus offering a great advantage for profiling all potentially functional lncRNAs in GBM. Notably, a novel detection algorithm based on machine learning will be developed to provide a more flexible and universal framework of lncRNA detection using RNA-seq. Though restricted to those lncRNAs shared between our GBM data and the oligo(dT)-based TCGA, we will evaluate the tissue-specificity of lncRNAs detected in GBM using TCGA data on several solid tumors (Aim 1b). After characterizing the landscape of lncRNAs in GBM, we will evaluate whether lncRNAs are associated with the clinical outcomes of GBM patients, and evaluate the feasibility of integrating lncRNAs and gene-level transcripts into a prognostic tool (Aim 2a). This proposal will enable us to employ these novel biomarkers for the prognosis of GBM as well as future functional studies. In addition, we will utilize co-expression network analysis to assign functions to the detected lncRNAs in GBM. An integrated, internet-based catalog will be constructed to provide a resource of lncRNAs in GBM that will benefit the general research community in this new area (Aim 2b). Finally, the PIs have assembled an outstanding research team with significant achievements in relevant research areas and complimentary expertise, therefore ensuring the success of this multidisciplinary and highly innovative project. PUBLIC HEALTH RELEVANCE This work seeks to understand whether long non-coding RNAs implicate in the prognosis of glioblastoma multiforme (GBM), a form of malignant brain tumors. By characterizing these novel gene regulatory molecules in GBM, we expect to identify novel biomarkers that can be used as a prognostic tool for patients with GBM. This approach could also be applied to other human cancers.",Identification of Long Non-coding RNAs as Novel Biomarkers for Heterogeneous Glioblastomas,9321295,R21CA209345,"['19q', 'Achievement', 'Affect', 'Algorithms', 'Area', 'Biological Markers', 'Biology', 'Brain', 'Brain Neoplasms', 'Cancer Patient', 'Catalogs', 'Cell Proliferation', 'Cell physiology', 'Central Nervous System Neoplasms', 'Cessation of life', 'Characteristics', 'Clinical', 'Code', 'Colorectal Neoplasms', 'Combined Modality Therapy', 'Communities', 'Complex', 'Data', 'Detection', 'Development', 'Diagnosis', 'Ensure', 'Epidermal Growth Factor Receptor', 'Exons', 'Female', 'Future', 'Gene Expression', 'Gene Expression Profile', 'Gene Expression Regulation', 'Genes', 'Genetic Transcription', 'Glioblastoma', 'Glioma', 'Goals', 'Heterogeneity', 'Human', 'Internet', 'Length', 'Machine Learning', 'Malignant - descriptor', 'Malignant Neoplasms', 'Malignant neoplasm of brain', 'Measures', 'Messenger RNA', 'Morphologic artifacts', 'Mutation', 'Neoplasm Metastasis', 'Newly Diagnosed', 'Nucleotides', 'Operative Surgical Procedures', 'Outcome', 'Pathogenesis', 'Pathway Analysis', 'Patient-Focused Outcomes', 'Patients', 'Pattern', 'Primary Neoplasm', 'RNA', 'RNA Splicing', 'Regulation', 'Regulator Genes', 'Research', 'Resources', 'Role', 'Sampling', 'Scanning', 'Solid Neoplasm', 'Specificity', 'Specimen', 'Stratification', 'Techniques', 'The Cancer Genome Atlas', 'Time', 'Tissue Banks', 'Tissues', 'Transcript', 'United States', 'Universities', 'Untranslated RNA', 'Validation', 'Work', 'X Inactivation', 'base', 'cancer biomarkers', 'cancer type', 'clinical Diagnosis', 'clinical care', 'cohort', 'differential expression', 'flexibility', 'gene function', 'histone modification', 'indexing', 'innovation', 'molecular marker', 'molecular subtypes', 'multidisciplinary', 'novel', 'novel marker', 'novel therapeutics', 'oligo (dT)', 'outcome forecast', 'peripheral blood', 'personalized medicine', 'precision medicine', 'prognostic', 'prognostic tool', 'public health relevance', 'success', 'targeted treatment', 'transcriptome', 'transcriptome sequencing', 'transcriptomics', 'tumor', 'tumorigenesis']",NCI,NORTHWESTERN UNIVERSITY AT CHICAGO,R21,2017,165732,0.07419560368271608
"Extrinsic Perturbations of Cell Physiology and Associated Regulatory Networks     DESCRIPTION (provided by applicant):         The overall goal of the Data Generation Aim is to produce high quality data measuring phenotypes, protein and phosphoproteomics, and RNA expression in 30 cell lines grown on diverse microenvironments (ME). This approach will significantly enhance the LINCS data matrix by providing phenotypic, proteomic, and transcriptomic data for cell lines under unique ME conditions. Furthermore, the data will be utilized for subsequent generation of cellular network signatures in the Data Analysis Aim. Sub aim 1.1 will be generate 10 different phenotypic endpoints for 30 cell lines grown on 3,060 MEs. We will utilize Microenvironment    Microarrays (MEMA) to assess the effects of the ME on proliferation, apoptosis, differentiation state, cell binding, and motility in each cell line. Statistical analysis will identify 50 significnt MEs for validation each year in years 2-6 in sub aim 1.2.A (total of 250 conditions). Each of the 50 ME conditions will be re-tested with the same endpoints at a second site using MEMA technology to provide independent validation of the primary results. At the same time, the cells will be tested using the 50 ME conditions on a second set of arrays designed to model the elastic modulus of human tissues to determine the effects on phenotypes of the matrix stiffness. From the 50 conditions tested in the validation aims, 30 of the most concordant between the primary and validation sites will be selected annually for analysis by Reverse Phase Protein Array (RPPA) aim 1.2.B and RNA expression analysis (aim I.2.C.). The RPPA aim will produce data using 500 validated antibodies against proteins and phosphoproteins in key signaling pathways under each of the ME perturbations. The RNA expression analysis will examine 1000 key genes using Luminex bead technology developed by the LINCS group at the Broad Institute, who will perform the same analysis for us using RNA prepared from each of the cell lines grown under the ME conditions. In total, the RPPA and RNA expression analysis will generate data for 150 different ME conditions under 2 different elastic moduli. All data will be carefully curated, with extensive metadata collected, and provided to the LINCS community for populating the data matrix.         Public Health Relevance: The main goals of the data generation aim will be to populate the LINCS data matrix with unique information that is currently not present in the matrix, and to provide data for generation of cellular network signatures. Our proposal to use MEMA technology will identify unique combinatorial MEs that perturb various phenotypic endpoints, providing novel data to fill in the LINCS data matrix.            ",Extrinsic Perturbations of Cell Physiology and Associated Regulatory Networks,9320999,U54HG008100,"['Adhesions', 'Antibodies', 'Apoptosis', 'Archives', 'Behavior', 'Binding', 'Biological', 'Cell Line', 'Cell physiology', 'Cells', 'Communities', 'DNA Damage', 'Data', 'Data Analyses', 'Data Quality', 'Databases', 'Disease', 'Extracellular Matrix', 'Generations', 'Genes', 'Genetic Transcription', 'Glycoproteins', 'Goals', 'Growth', 'Image', 'Institutes', 'Machine Learning', 'Measurement', 'Measures', 'Metadata', 'Methods', 'Microarray Analysis', 'Modeling', 'Modulus', 'Molecular', 'Molecular Profiling', 'Non-Malignant', 'Pathway interactions', 'Peptides', 'Phase', 'Phenotype', 'Phosphoproteins', 'Physiological', 'Protein Array', 'Proteins', 'Proteomics', 'RNA', 'Sampling', 'Signal Pathway', 'Signal Transduction', 'Site', 'Standardization', 'Statistical Data Interpretation', 'Synapses', 'System', 'Technology', 'Tern', 'Testing', 'Therapeutic Agents', 'Time', 'Tissues', 'Transcript', 'Validation', 'base', 'cell behavior', 'cell motility', 'combinatorial', 'design', 'fluorescence imaging', 'genetic regulatory protein', 'high resolution imaging', 'human tissue', 'image processing', 'novel', 'phosphoproteomics', 'public health relevance', 'response', 'senescence', 'transcriptomics', 'web portal']",NHGRI,OREGON HEALTH & SCIENCE UNIVERSITY,U54,2017,1714600,0.1063708187703881
"Mapping RNA protein interaction networks in the human genome Detecting protein-RNA interactions is challenging–both experimentally and computationally– because RNA transcripts are large in number, diverse in cellular location and function. As a result, many RNA-binding proteins (RBPs) and their cognate motifs are likely unknown or uncharacterized in humans as well as other model organisms. With increasing number of RBPs implicated in human diseases, there is an urgent need for identifying and mapping functional and phenotypic information for RBPs as well as to complete a map of the protein-RNA interaction network. The objective here is to establish a robust computational technique that integrates expression associations with sequence as well as several RBP centric features for genome-scale prediction of binding motifs for hundreds of human RBPs to facilitate the elucidation of their tissue-specific post-transcriptional networks. At the completion of this project, we expect to have developed the most advanced tool for predicting human RBP motifs and methods as well as resources which can facilitate the construction of tissue-specific RBP-RNA networks. Our central hypothesis, supported by our initial genome-scale computational study and assessment by comparative analysis of known RBP binding motifs is that, since many RBPs are involved in different stages of RNA metabolism, exon expression level associations with an RBP and other exon related features can be very powerful in identifying the binding motifs of an RBP in a tissue-specific manner. The proposed integrated approach to experimentally validate several binding motifs using CLIP-seq and to deconvolute global posttranscriptional networks in specific cell/tissue types, using genome-wide data from protein protection assays (POP-seq) will significantly enhance our capability of uncovering network dynamics of RBPs in cell types and tissues. Such high-quality predictions based on experimental validations, resulting from all the Aims which will be made public, can become a venue for future experimental follow up to dissect the role of these important regulatory molecules in different tissues and disease states. The proposed studies will make an impact in the field as the first large-scale computational mapping of protein-RNA interaction networks in the human tissues by taking our ability to predict RBP targets to the next level. The complementary experience and expertise of investigators will make this project successful. RNA-binding proteins (RBPs) play important roles in every biological pathway and cellular process. Elucidation of the RNA recognition motifs of hundreds of RNA-binding proteins discovered in recent years and analysis of dynamic post-transcriptional networks of RBPs across various tissues and disease states will increase our fundamental knowledge about how gene expression is modulated by these important regulatory molecules in living organisms. This knowledge is a critical step towards understanding, diagnosis, and treatment of several human diseases caused by mutation or mis-expression of these proteins.",Mapping RNA protein interaction networks in the human genome,9398667,R01GM123314,"['AIDS/HIV problem', 'Address', 'Algorithms', 'Alpha Cell', 'Amino Acid Motifs', 'Animal Model', 'Benchmarking', 'Binding', 'Binding Sites', 'Bioinformatics', 'Biological', 'Biological Assay', 'Cell Line', 'Cell physiology', 'Cells', 'Complex', 'Computational Technique', 'Computer software', 'Data', 'Data Set', 'Development', 'Diagnosis', 'Disease', 'Embryo', 'Exons', 'Future', 'Gene Expression', 'Genes', 'Genetic Transcription', 'HepG2', 'Human', 'Human Genome', 'K-562', 'K562 Cells', 'Knowledge', 'Liver', 'Location', 'MALAT1 gene', 'Machine Learning', 'Malignant Neoplasms', 'Maps', 'Metabolism', 'Methods', 'Mining', 'Mus', 'Nature', 'Nerve Degeneration', 'Organism', 'Pathway interactions', 'Pattern', 'Phenotype', 'Physiology', 'Play', 'Protein Binding Domain', 'Proteins', 'Publications', 'RNA', 'RNA Binding', 'RNA Recognition Motif', 'RNA-Binding Proteins', 'RNA-Protein Interaction', 'Research Personnel', 'Resources', 'Ribonucleoproteins', 'Role', 'Running', 'Structure', 'Time', 'Tissues', 'Transcript', 'Validation', 'base', 'cell type', 'comparative', 'computer framework', 'computer studies', 'computing resources', 'crosslinking and immunoprecipitation sequencing', 'deep sequencing', 'differential expression', 'disease-causing mutation', 'experience', 'follow-up', 'genome-wide', 'human disease', 'human tissue', 'improved', 'insight', 'novel', 'online resource', 'predictive tools', 'protein expression', 'protein profiling', 'success', 'tool', 'transcriptome sequencing', 'user-friendly']",NIGMS,INDIANA UNIV-PURDUE UNIV AT INDIANAPOLIS,R01,2017,326862,0.18053001859798795
"Rational design of small interfering RNA for genome-wide target knockdown ﻿    DESCRIPTION (provided by applicant):  RNA interference (RNAi) is a small RNA-guided gene silencing process within living cells. The RNAi technique is widely used in both biological research and clinical applications because it has the ability to knockdown essentially any gene of interest. However, one major unresolved issue in RNAi studies is non-specific gene silencing. It is well known that, in addition to the single intended gene target, many unintended targets are also simultaneously silenced. Thus, there is an urgent need to develop new methods for improving RNAi specificity. RNAi specificity and potency are determined by the small interfering RNA (siRNA) in the silencing complex. We propose the hypothesis that gene silencing specificity can be significantly improved with rational siRNA design. We have previously developed a machine learning algorithm for the design of widely-distributed commercial siRNAs. Based on this commercial success, we propose to further develop a new method for genome-wide design of next-generation siRNAs with significantly reduced off-target effects. The new design method will lay a solid foundation for further commercial development of siRNA products that can be used in a variety of RNAi-based applications. PUBLIC HEALTH RELEVANCE:  RNA interference (RNAi) is a small RNA-guided gene silencing process within living cells. RNAi has many diverse applications as it can suppress almost any human genes by recognizing the gene sequence. We propose to remove a major hurdle in RNAi studies by genome-wide design of siRNAs with significantly improved gene silencing specificity.",Rational design of small interfering RNA for genome-wide target knockdown,9146385,R41HG008567,"['Algorithm Design', 'Algorithms', 'Applications Grants', 'Bioinformatics', 'Cataloging', 'Catalogs', 'Cells', 'Communities', 'Complex', 'Computer Simulation', 'Data', 'Databases', 'Development', 'Experimental Models', 'Foundations', 'Gene Silencing', 'Gene Targeting', 'Genes', 'Genetic Transcription', 'Goals', 'High-Throughput RNA Sequencing', 'Human', 'Individual', 'Libraries', 'Life', 'Machine Learning', 'Methods', 'Modeling', 'Mus', 'Process', 'RNA', 'RNA Interference', 'RNA Sequence Analysis', 'RNA interference screen', 'Research', 'Resources', 'Services', 'Small Interfering RNA', 'Small RNA', 'Solid', 'Specificity', 'Techniques', 'Technology', 'Therapeutic', 'Time', 'Validation', 'base', 'biological research', 'clinical application', 'design', 'gene function', 'genome-wide', 'genome-wide analysis', 'improved', 'interest', 'knock-down', 'learning strategy', 'next generation', 'public health relevance', 'success', 'tool', 'transcriptome sequencing']",NHGRI,"NAWGEN, LLC",R41,2016,349932,0.106671680316751
"Computational genome-wide RNA profiling using next-generation sequencing DESCRIPTION (provided by applicant): Recent evidence has shown that non-coding RNAs are ubiquitous in the cell and that their functions and structure vary to a greater extent than previously imagined. Multiple new RNA classes have been implicated in many diseases, and understanding how these RNAs work is a critical need. While exciting discoveries are accumulating, our functional knowledge of these new RNAs remains limited. Here we propose to couple a new high-throughput RNA duplex sequencing technology with new, computational methods to economically study novel functional non-coding RNA at a genomic scale. We propose to develop two computational methodologies to characterize putative newly found non-coding RNAs on the genomic scale. First, we will develop a maximum likelihood approach that estimates RNA secondary structure using RNA-seq assays that preferentially sequence single- or double-stranded nucleotides. Second, we will develop a machine-learning framework that predicts the functional category of novel non-coding RNAs using length and structure features of known RNAs. These structural and functional predictions will be validated by comparative genomics and experimentation. We will develop databases and analysis software, and investigate the human genome and five other model organisms. In total, our findings will yield tremendous insights into non-coding RNA biology and will substantially impact continued study of these important molecules. We propose to develop computational methods to study novel non-coding RNA transcripts by leveraging a new duplex RNA sequencing technique. Our first objective is to develop a maximum likelihood algorithm that estimates secondary structure using double-stranded or single-stranded RNA sequencing. We will also develop a machine-learning framework that predicts the functional category of novel non-coding RNAs using length and structure features from RNA-seq experiments. These methods will be used to annotate all RNA transcripts using experimental data from human and five model organisms.",Computational genome-wide RNA profiling using next-generation sequencing,9062460,R01GM099962,"['Algorithms', 'Animal Model', 'Base Pairing', 'Binding', 'Biological Assay', 'Biology', 'Categories', 'Cells', 'ChIP-seq', 'Classification', 'Communities', 'Complex', 'Computer Simulation', 'Computer software', 'Computing Methodologies', 'Couples', 'Data', 'Databases', 'Diabetes Mellitus', 'Disease', 'Disease Pathway', 'Double-Stranded RNA', 'Exons', 'Family', 'Genetic Transcription', 'Genome', 'Genomic Segment', 'Genomics', 'High-Throughput RNA Sequencing', 'Human Genome', 'Introns', 'Knowledge', 'Length', 'Literature', 'Machine Learning', 'Malignant Neoplasms', 'Mental disorders', 'Messenger RNA', 'Metabolism', 'Methods', 'MicroRNAs', 'Modeling', 'Molecular', 'Nerve Degeneration', 'Nucleotides', 'Online Systems', 'Organism', 'RNA', 'RNA Sequence Analysis', 'Reading', 'Regulation', 'Reporting', 'Research', 'Research Personnel', 'Ribosomal RNA', 'Sampling', 'Scheme', 'Secondary to', 'Small Nucleolar RNA', 'Small RNA', 'Statistical Models', 'Structure', 'Techniques', 'Technology', 'Tissues', 'Training', 'Transcript', 'Transfer RNA', 'Untranslated RNA', 'Validation', 'Vascular Diseases', 'Work', 'base', 'comparative genomics', 'genome browser', 'genome-wide', 'genome-wide analysis', 'human data', 'insight', 'next generation sequencing', 'novel', 'novel strategies', 'open source', 'prediction algorithm', 'programs', 'research study', 'transcription factor', 'transcriptome', 'transcriptome sequencing']",NIGMS,UNIVERSITY OF PENNSYLVANIA,R01,2016,312000,0.2522295201266959
