text,title,id,project_number,terms,administration,organization,mechanism,year,funding,score
"Multi-modal and Extreme PET/MRI Reconstruction Methods Project Summary / Abstract  Hybrid PET/MRI systems are very advantageous for a variety of clinical applications by combining the soft tissue contrast of MRI with the functional and metabolic information of PET. These systems have found success for oncology studies, particularly in head and abdomen/pelvis, as well as for epilepsy, neurological diseases, heart disease, and pediatrics for dose reduction. However, the PET resolution and SNR is typically worse than MRI, and suffers from the loss of feature and data due to motion as well. PET/MRI systems offer the potential to create more accurate, higher resolution PET reconstructions, including correction of artifacts, motion, and im- proved localization, by performing synergistic reconstructions that leverage the simultaneous data acquisition. In particular, this fellowship proposes to develop novel physics-constrained machine learning models for informa- tion sharing between PET and MRI for enhanced spatial localization, estimation of attenuation and activity, and motion. We propose to develop a deep maximum-likelihood estimation of attenuation and activity (MLAA) that can compensate for artifacts and improve PET reconstruction accuracy. We also propose a motion-enhanced joint PET/MRI reconstruction to capture arbitrary motions and reduce dose requirements for chest and abdomen studies. Together, these models aim to improve the PET spatio-temporal resolution, SNR, and quantiﬁcation for a broad range of clinical applications, and will be evaluated for cancer assessment in the pelvis, liver, and lung.  This fellowship will be performed in the Department of Radiology and Biomedical Imaging at UCSF under the guidance of Prof. Peder Larson, who leads a research program on advanced imaging methods development, and Dr. Thomas Hope, a radiologist and nuclear medicine physician who leads multiple PET/MRI projects. The Department is one of the leading centers in biomedical imaging research, and has been at the forefront on translating PET/MRI systems into clinical practice. The UCSF PET/MRI scanner has dedicated research time, which is also available on other MRI and PET/CT research systems, and extensive computational resources to support the proposed project. The applicant, Dr. Abhejit Rajagopal, has a background in computational imaging and machine learning, will be jointly mentored by this engineer/physician team. He will be trained to become a biomedical imaging scientist by participating in formal coursework on medical imaging systems, training on the PET/MRI system, grant writing, and performing clinical research, supporting his development into a creative, independent biomedical researcher. Project Narrative  Hybrid positron emission tomography (PET) and magnetic resonance imagery (MRI) imaging systems cur- rently aid in diagnosis and prognosis of numerous types of cancer and disease, but are not always precise enough to accurately measure and track a patient’s response to therapy, particularly in organs and tissue that are sub- ject to motion. There is an unrealized potential here to synergistically combine complimentary PET-MRI data to dramatically improve the spatial resolution and SNR of PET, as well as to create motion-resolved 4D (x,y,z,t) imagery by combining information across modalities and time-frames to combat severe undersampling. These methods will be evaluated in human studies of cancer to capture ﬁne structure and micro-features on moving organs (e.g. lung nodules, liver metastases), ultimately aiding in quantitative characterization of disease.",Multi-modal and Extreme PET/MRI Reconstruction Methods,10069132,F32EB030411,"['3-Dimensional', 'Abdomen', 'Address', 'Affect', 'Algorithms', 'Attention', 'Chest', 'Childhood', 'Clinical', 'Clinical Research', 'Data', 'Data Set', 'Development', 'Diagnosis', 'Discipline of Nuclear Medicine', 'Disease', 'Dose', 'Engineering', 'Epilepsy', 'FOLH1 gene', 'Fellowship', 'Financial compensation', 'Goals', 'Grant', 'Head', 'Head and Neck Cancer', 'Heart Diseases', 'Human', 'Hybrids', 'Image', 'Imagery', 'Implant', 'Joint repair', 'Joints', 'Learning', 'Liver', 'Lung', 'Lung nodule', 'Machine Learning', 'Magnetic Resonance', 'Magnetic Resonance Imaging', 'Malignant Female Reproductive System Neoplasm', 'Malignant Neoplasms', 'Malignant neoplasm of prostate', 'Measures', 'Medical Imaging', 'Mentors', 'Metabolic', 'Metals', 'Metastatic Neoplasm to the Liver', 'Methods', 'Modality', 'Modeling', 'Morphologic artifacts', 'Motion', 'Neurodegenerative Disorders', 'Oncology', 'Organ', 'Output', 'Patients', 'Pediatrics', 'Pelvis', 'Performance', 'Physicians', 'Physics', 'Positron-Emission Tomography', 'Research', 'Research Personnel', 'Research Support', 'Resolution', 'Scanning', 'Signal Transduction', 'Standardization', 'Structure', 'System', 'Time', 'Tissues', 'Tracer', 'Training', 'Translating', 'Writing', 'attenuation', 'bioimaging', 'bone', 'cancer type', 'clinical application', 'clinical practice', 'combat', 'computing resources', 'data acquisition', 'deep learning', 'heart imaging', 'high resolution imaging', 'imaging modality', 'imaging scientist', 'imaging system', 'improved', 'information model', 'lung imaging', 'method development', 'multimodality', 'nervous system disorder', 'neuro-oncology', 'novel', 'outcome forecast', 'patient response', 'programs', 'radiological imaging', 'radiologist', 'reconstruction', 'respiratory', 'soft tissue', 'spatiotemporal', 'success', 'systems research', 'uptake']",NIBIB,"UNIVERSITY OF CALIFORNIA, SAN FRANCISCO",F32,2020,69426,0.18965232699950382
"High performance PET Detector Module for Human Brain Imaging Project Summary / Abstract This proposal is in response to PA 18-484. In the BRAIN 2025 Report, PET (positron emission tomography) is identified as “the best means to translate studies of neurotransmitters, receptors, and neuromodulators to humans.” However dynamic assessment of receptor occupancy and metabolism is hindered by the spatial resolution and sensitivity of even the most modern of clinically available PET scanners. To address this challenge, we propose a next generation PET detector with a highly innovative design: a detector module with a layered scintillator structure and a side readout configuration. The crystal slabs in the module are stacked along the depth direction and are optically separated by reflective films. The scintillation light created in each layer is measured by photodetectors located on the four sides of the crystal. Compared with traditional PET detectors, which contain pixelated crystal arrays, the new design has the following advantages: (1) The layered structure provides depth of interaction (DOI) information such that a smaller diameter detector ring can be used without increasing parallax error, increasing sensitivity while lowering costs. (2) The four-sided readout method improves the energy resolution of the system with increased scintillation light collection efficiency by reducing light loss due to total internal reflection. (3) Sub millimeter spatial resolution is achievable without using very small pitch crystal arrays, since the interaction location in each crystal layer is determined via machine learning- based decoding of the light distribution collected on the four crystal sides. Therefore the production cost of the crystals is reduced. (4) Since the interaction location and energy resolution for each layer are determined independently, the system sensitivity can be increased by stacking more layers in the module without affecting the spatial and energy resolution of the system. (5) For side readout setup, a larger ratio of cross-sectional area to length requires fewer photodetectors to cover all four sides of the module; this reduces photodetector cost. The first four points above have been demonstrated in preliminary studies using a small, prototype module. We propose to build a large scale detector module with this new design to verify the fifth advantage, and to study the effect of detector size on the first four. The outcome of this proposal will be two DOI enabled detector modules with excellent spatial resolution (~1 mm) and energy resolution (~10%), as well as good timing resolution (~400 ps), and DOI resolution (~ 3 mm) and high system sensitivity. A full characterization study for the two modules and imaging studies for both the Derenzo and Hoffman brain phantoms will address the current limitations of human brain PET scanners, and will serve as the foundation for a new dynamic PET scanner for neuroimaging. Project Narrative The goal of this project is to develop a novel design for detector modules used in brain-dedicated PET system with good spatial resolution, energy resolution, timing resolution, and DOI resolution, as well as high sensitivity. If successful, the study will pave the way for building a novel PET system for greatly improved dynamic PET imaging of the human brain.",High performance PET Detector Module for Human Brain Imaging,10017238,R01EB028337,"['Address', 'Affect', 'Alzheimer&apos', 's Disease', 'Area', 'Brain', 'Brain Neoplasms', 'Brain imaging', 'Caliber', 'Calibration', 'Clinical', 'Collection', 'Crystallization', 'Development', 'Diagnosis', 'Evaluation', 'Event', 'Film', 'Foundations', 'Gamma Rays', 'Geometry', 'Goals', 'Human', 'Image', 'Imaging Phantoms', 'Individual', 'Length', 'Light', 'Location', 'Machine Learning', 'Measures', 'Metabolism', 'Methods', 'Modernization', 'Neuromodulator', 'Neurotransmitter Receptor', 'Optics', 'Outcome', 'Parkinson Disease', 'Pattern', 'Performance', 'Portugal', 'Positioning Attribute', 'Positron-Emission Tomography', 'Process', 'Production', 'Reporting', 'Resolution', 'Rod', 'Side', 'Signal Transduction', 'Silicon', 'Source', 'Staging', 'Structure', 'Surface', 'System', 'Thinness', 'Translating', 'Variant', 'base', 'brain size', 'cost', 'design', 'detector', 'human imaging', 'imaging study', 'improved', 'innovation', 'machine learning method', 'meetings', 'millimeter', 'nervous system disorder', 'neuroimaging', 'next generation', 'novel', 'photomultiplier', 'prototype', 'receptor', 'response']",NIBIB,"CANON MEDICAL RESEARCH USA, INC.",R01,2020,243919,0.20446864031863135
"Generation of parametric images for FDG PET using dual-time-point scans Project Summary/Abstract Positron emission tomography combined with computed tomography (PET/CT) using the radiolabeled tracer 2- deoxy-2-(18F)fluoro-D-glucose (FDG) has become a standard imaging tool for cancer patient management. The semi-quantitative parameter standardized uptake value (SUV) is routinely used in clinical for tumor uptake quantification, which is computed on the static PET image acquired at a certain time (typically 60 min) post tracer injection for a short interval (typically 5-15 min). However, the quantification accuracy of SUV from a single PET scan suffers from the variabilities of tracer plasma clearance and acquisition start time. The dual- time-point FDG PET imaging has been intensively investigated and used in both clinical and research studies, typically one scan at 60 min and the other at 120 min, showing the potential to enhance the diagnostic accuracy of FDG PET by differentiating malignancy from inflammation and normal tissue. However, the current clinical dual-time-point FDG PET studies use the relative SUV change between two scans as the quantification index, which cannot eliminate the variations in tracer plasma clearance. Meanwhile, the dual-time-point protocol has not been optimized and standardized currently, leading to conflicting results. The fully-quantitative parameter, tracer net uptake rate constant Ki, is the most accurate parameter to quantify FDG PET, which is calculated using dynamic imaging with compartmental modeling. Ki is independent on the plasma clearance or acquisition start time. However, the long and complex acquisition protocol (typically at least 60 min), which requires dynamic scanning and sequential arterial blood sampling (or image-derived blood activity) used as input function from the time of injection, limits its application in clinical practice. Meanwhile, generation of the parametric Ki image, which can provide additional heterogeneity information for FDG PET, is challenging clinically using voxel-by-voxel compartmental modeling due to the computational cost and being sensitive to noise using non-linear least squares. The graphical Patlak plot, can be used for simplified Ki calculation and Ki image generation by voxel-by-voxel fitting. However, it still needs dynamic scanning starting from 15-30 min after injection and input function from the time of injection. The aims of this proposal are 1) to optimize the dual-time-point protocol for accurate Ki quantification using Patlak plot without the need for individual patient's input function, and 2) to generate high-quality low-noise dual-time-point Ki images using novel techniques based on deep learning. Upon the success of this project, our proposed approach can obtain reliable tumor Ki quantification and parametric Ki image ""for free"" without adding any additional complexity on the existing dual- time-point protocol currently used in clinical practice, with great potential of improving diagnosis and therapy assessment in oncology. We expect the translation of this approach to clinical investigation to be fast, as this is a post-processing approach and is based on data already acquired using clinically used protocol without imposing additional burden to technologists. Project Narrative For FDG PET imaging, we propose to develop a novel and simple approach of quantifying tumor Ki and generating parametric Ki image ""for free"" without adding any additional complexity on the existing dual-time- point protocol currently used in clinical practice, with great potential of improving diagnosis and therapy assessment in oncology.",Generation of parametric images for FDG PET using dual-time-point scans,9896329,R03EB027864,"['Blood', 'Blood specimen', 'Cancer Patient', 'Clinic', 'Clinical', 'Clinical Research', 'Complex', 'Conflict (Psychology)', 'Data', 'Diagnosis', 'Generations', 'Glucose', 'Heterogeneity', 'Image', 'Imaging Device', 'Inflammation', 'Injections', 'Label', 'Least-Squares Analysis', 'Malignant Neoplasms', 'Methods', 'Modeling', 'Noise', 'Normal tissue morphology', 'Oncology', 'Patients', 'Plasma', 'Positron-Emission Tomography', 'Protocols documentation', 'Radiation exposure', 'Radiolabeled', 'Scanning', 'Standardization', 'Techniques', 'Time', 'Tracer', 'Training', 'Translations', 'Variant', 'X-Ray Computed Tomography', 'attenuation', 'base', 'clinical investigation', 'clinical practice', 'cohort', 'convolutional neural network', 'cost', 'deep learning', 'diagnostic accuracy', 'image reconstruction', 'improved', 'indexing', 'individual patient', 'innovation', 'novel', 'parametric imaging', 'population based', 'research study', 'simulation', 'success', 'tumor', 'uptake']",NIBIB,YALE UNIVERSITY,R03,2020,80375,0.20953802823215814
"NeuroExplorer: Ultra-high Performance Human Brain PET Imager for Highly-resolved In Vivo Imaging of Neurochemistry Research applications of brain Positron Emission Tomography (PET) have been in place for over 40 years. The combination of quantitative PET systems with novel radiotracers has led to a numerous imaging para- digms to understand normal brain physiology including neurotransmitter dynamics and receptor pharmacology at rest and during activation. Brain-dedicated PET systems offer important advantages over currently available PET systems in terms of sensitivity and resolution. However, the state-of-the-art for brain PET has not progressed beyond the 20-year-old HRRT. Therefore, there is a compelling need to build the next generation of brain PET systems for human studies. This proposal brings together a highly experienced collaborative team from Yale, UC Davis, and United Imaging Healthcare America (UIHA). to develop the next generation NeuroEXPLORER (NX) PET system with the following Aims. Specific Aim 1: Design and Build the NeuroEXPLORER: In 2 years, we will complete the design and build the NX system. The design includes high performance LYSO-SiPM blocks with small detectors, 4-mm depth-of-interaction, 250 ps time-of-flight resolution, and axial length of ~50 cm, paired with CT for attenuation correction. This design will produce a factor of 10 greater effective sensitivity than the HRRT and practical resolution of 1.5-2 mm in the human brain. The system will include built-in real-time state-of-art motion tracking cameras and will be tested using novel phantom experiments to assess the full-range of operation to validate the dramatic improvement in small- region precision and accuracy. Specific Aim 2: Algorithm Development for Fully-Quantitative Brain PET. We will develop the novel algorithms for this system. Using EXPLORER experience. we will implement reconstruction algorithms to produce dynamic images with uniform ultra-high resolution in space and time, Extending Yale’s HRRT motion correction experience, we will develop camera-based motion detection and correction algorithms to deliver ultra-high resolution human brain images. Using the carotid artery shape and geometry, we will develop methods to accurately measure blood activity to be compared to human arterial data with the goal to permit kinetic modeling without arterial sampling. We will develop noise reduction methods with machine learning to reduce dose for studying health brains and to eliminate the need for the CT scan for attenuation correction. Specific Aim 3: Human Paradigm Demonstration. With human subjects, we will evaluate specific imaging paradigms to demonstrate the effectiveness of the NX system: 1) demonstration of the dramatic sensitivity increase (with a direct comparison to the HRRT) and its impact on detection of pharmacologic effects, 2) leveraging high sensitivity to reliably measure uptake in small nuclei; and 3) opening new frontiers of imaging neurotransmitter dynamics, including dopamine and opioid release. The ultimate goal is a fully functioning and characterized system that dramatically expands the scope of brain PET protocols and applications. Human research applications of brain Positron Emission Tomography (PET) imaging have been in place for over 40 years and have led to a detailed understand of normal brain physiology including neurotransmitter dynamics and receptor pharmacology at rest and during activation. Brain-dedicated PET systems offer important advantages over currently available PET systems, but the state-of-the-art for brain PET imaging systems has not progressed beyond the 20-year-old HRRT. The proposed next generation NeuroEXPLORER (NX) PET system will have a factor of 10 greater sensitivity and will dramatically expand the scope of human brain PET protocols and applications.",NeuroExplorer: Ultra-high Performance Human Brain PET Imager for Highly-resolved In Vivo Imaging of Neurochemistry,10005604,U01EB029811,"['20 year old', 'Adolescent', 'Algorithms', 'Americas', 'Area', 'Blood', 'Brain', 'Brain imaging', 'Brain scan', 'Carotid Arteries', 'Cell Nucleus', 'Child', 'Clinical', 'Collaborations', 'Data', 'Detection', 'Development', 'Disease', 'Dopamine', 'Dose', 'Effectiveness', 'Enzymes', 'Evaluation', 'Functional disorder', 'Future', 'Geometry', 'Goals', 'Healthcare', 'Hippocampus (Brain)', 'Human', 'Image', 'Inferior', 'Length', 'Machine Learning', 'Manufacturer Name', 'Measures', 'Metabolism', 'Methods', 'Midbrain structure', 'Modeling', 'Motion', 'Nerve Degeneration', 'Neurotransmitters', 'Noise', 'Opioid', 'Performance', 'Pharmacology', 'Physics', 'Physiology', 'Positron-Emission Tomography', 'Proteins', 'Protocols documentation', 'Radioactive', 'Research', 'Resolution', 'Rest', 'Sampling', 'Sensory Receptors', 'Shapes', 'Structure', 'Substantia nigra structure', 'Synapses', 'System', 'Technology', 'Testing', 'Thalamic structure', 'Time', 'Tracer', 'X-Ray Computed Tomography', 'algorithm development', 'attenuation', 'base', 'body system', 'brain health', 'data quality', 'density', 'design', 'detector', 'experience', 'experimental study', 'frontier', 'human subject', 'imager', 'imaging system', 'improved', 'in vivo imaging', 'kinetic model', 'locus ceruleus structure', 'neurochemistry', 'neurotransmitter release', 'next generation', 'novel', 'operation', 'pre-clinical', 'radiotracer', 'raphe nuclei', 'receptor', 'reconstruction', 'solid state', 'statistics', 'ultra high resolution', 'uptake']",NIBIB,YALE UNIVERSITY,U01,2020,1700000,0.33158374533851975
