text,title,id,project_number,terms,administration,organization,mechanism,year,funding,score
"Deep learning techniques for time-of-flight PET detectors Project Summary/Abstract One of the key advances in modern positron emission tomography (PET) systems for clinical imaging is the use of time-of-flight (TOF) information. In cancer imaging TOF provides superior lesion detection and more accurate quantification that is crucial in measuring response to therapy, as well as in neurological and cardiovascular imaging applications. An additional benefit of TOF is the ability to lower the radiation dose or scan time without sacrificing image quality, important for patient safety and comfort. The magnitude of these clinical benefits is determined by the TOF resolution of the PET detectors, therefore the prospect of achieving unprecedented image quality and clinical imaging capabilities with superior TOF resolution has fueled significant research in developing detector technology for TOF-PET systems. However, these developments have been largely unaccompanied by advances in signal processing methods needed to extract TOF information from the detector’s electrical signals, with most detectors making use of crude analog algorithms that discard most of the useful timing information contained in the signals. Now, with the availability of low-cost fast waveform digitizers, there is an exciting opportunity to implement sophisticated digital signal processing algorithms to achieve superior TOF resolution. The main advantage of developing advanced signal processing algorithms is that it presents a cost-effective route to improved TOF resolution that is complementary to instrumentation innovations. In essence, the TOF gain comes for free; the detector signals already contain the information needed for better TOF resolution, it just needs to be used effectively. Here we propose to tailor deep learning techniques to estimate TOF from the detector signals. Deep learning with convolutional neural networks (CNNs) is a powerful approach to learn complex representations of input data that can be used for tasks such as classification and regression. CNNs are therefore very suitable for directly estimating TOF from the detector waveforms, since these waveforms are influenced by several complex and intertwined processes which are hard to accurately model. Furthermore, large amounts of ground truth training data are readily generated. We recently demonstrated the feasibility of CNN-based TOF estimation, and found up to 23% improvement in TOF resolution compared to standard signal processing methods. This proposal aims to optimize these methods to push the limits of achievable TOF resolution and develop methods for their practical implementation. First, we will develop CNN architectures and methods suitable for silicon photomultipliers (SiPMs) that are now used in modern TOF-PET systems. We will also optimize the digitizing parameters to make optimal use of CNNs for TOF estimation. Second, we will implement CNN-TOF methods in a modern commercial PET detector, including using a global CNN to simultaneously estimate TOF and the crystal-of-interaction from the detector waveforms, demonstrating the practical feasibility of using this promising deep learning method in next generation PET systems. Narrative The use of time-of-flight information in positron emission tomography (PET) is a powerful way to increase clinical imaging capabilities of PET, and is now used in most modern systems. Improving time-of-flight performance promises to provide substantial benefits for lesion detection in cancer imaging, kinetic modeling with dynamic imaging, and the use of lower radiation dose for patient safety. Here we introduce deep learning signal processing methods to significantly improve the performance of time-of-flight PET detectors without requiring new materials, which thereby represents a cost effective route towards maximizing the use of the rich imaging signal provided by time-of-flight.",Deep learning techniques for time-of-flight PET detectors,9784818,R03EB027268,"['Address', 'Adoption', 'Algorithms', 'Characteristics', 'Classification', 'Clinical', 'Complex', 'Coupled', 'Crystallization', 'Data', 'Data Quality', 'Detection', 'Development', 'Devices', 'Digital Signal Processing', 'Electronics', 'Foundations', 'Future', 'Goals', 'Healthcare', 'Human Engineering', 'Image', 'Industry', 'Industry Collaboration', 'Investigation', 'Kinetics', 'Knowledge', 'Learning', 'Lesion', 'Low Dose Radiation', 'Machine Learning', 'Manufacturer Name', 'Measures', 'Methods', 'Modeling', 'Modernization', 'Network-based', 'Neurologic', 'Noise', 'Outcome', 'Patient Care', 'Performance', 'Photons', 'Positron-Emission Tomography', 'Procedures', 'Process', 'Property', 'Radiation Dose Unit', 'Research', 'Research Personnel', 'Resolution', 'Route', 'Sampling', 'Scanning', 'Signal Transduction', 'Silicon', 'Solid', 'Speed', 'Sum', 'System', 'Techniques', 'Technology', 'Temperature', 'Time', 'Training', 'Tube', 'analog', 'base', 'cancer imaging', 'cardiovascular imaging', 'clinical imaging', 'convolutional neural network', 'cost', 'cost effective', 'deep learning', 'detector', 'digital', 'imaging capabilities', 'improved', 'innovation', 'instrumentation', 'learning strategy', 'neural network architecture', 'next generation', 'patient safety', 'photomultiplier', 'physical process', 'response', 'scale up', 'signal processing', 'time use', 'voltage']",NIBIB,UNIVERSITY OF CALIFORNIA AT DAVIS,R03,2019,78500,0.21764920331141574
"Synergistic integration of deep learning and regularized image reconstruction for positron emission tomography Project Summary/Abstract Positron emission tomography (PET) is a high-sensitivity molecular imaging modality widely used in oncology, neurology, and cardiology, with the ability to observe molecular-level activities inside a living body through the injection of specific radioactive tracers. In addition to the commonly used F-18-FDG, new tracers are being constantly developed and investigated to pinpoint specific pathways in various diseases. New PET scanners are also being proposed by exploiting time of flight (TOF) information, enabling depth of interaction capability, and extending the solid angle coverage. To realize the full potential of the new PET tracers and scanners, there is an increasing need for the development of advanced image reconstruction methods. This grant application proposes a new framework for regularized image reconstruction that synergistically integrates deep learning and regularized image reconstruction. The new framework is enabled by the recent advances in machine learning, which provide a tool to digest vast amount information embedded in existing medical images. The proposed method embeds a pre-trained deep neural network in an iterative image reconstruction framework and uses the deep neural network to regularize PET image directly. By training the deep neural network with a large amount of high-quality low-noise PET images, the proposed method can capture complex prior information from existing inter-subject and intra-subject data and thus is expected to substantially outperform the current state-of-the-art regularized image reconstruction method. The two specific aims of this exploratory proposal are (1) to develop the theoretical framework to synergistically integrate deep learning in regularized image reconstruction for PET and (2) to implement the proposed method and validate its effectiveness using existing animal data. Once the proposed method is validated using existing animal data, we will seek funding to acquire necessary human data for the implementation of the proposed method on clinical PET scanners. Project Narrative Positron emission tomography (PET) is a medical imaging technique widely used in clinic for detecting cancer, cardiovascular diseases, and neurological disorders. This project will develop an innovative image reconstruction method that has potential to improve PET image quality and reduce radiation dose. Its success will improve the accuracy of PET for cancer detection and other diseases.",Synergistic integration of deep learning and regularized image reconstruction for positron emission tomography,9752639,R21EB026668,"['Advanced Development', 'Anatomy', 'Applications Grants', 'Cancer Detection', 'Cardiology', 'Cardiovascular Diseases', 'Clinic', 'Clinical', 'Complex', 'Core Facility', 'Data', 'Data Set', 'Detection', 'Disease', 'Funding', 'Genomics', 'Grant', 'Image', 'Imaging Techniques', 'Injections', 'Learning', 'Lesion', 'Machine Learning', 'Magnetic Resonance Imaging', 'Malignant Neoplasms', 'Medical Imaging', 'Methods', 'Molecular', 'Morphologic artifacts', 'Mus', 'Network-based', 'Neurology', 'Noise', 'Output', 'Pathway interactions', 'Patients', 'Play', 'Positron-Emission Tomography', 'Radiation Dose Unit', 'Radioactive Tracers', 'Rattus', 'Role', 'Solid', 'Time', 'Tracer', 'Training', 'Use Effectiveness', 'Validation', 'Work', 'X-Ray Computed Tomography', 'anatomic imaging', 'animal data', 'base', 'cost', 'deep learning', 'deep neural network', 'fluorodeoxyglucose', 'human data', 'image reconstruction', 'imaging modality', 'improved', 'innovation', 'learning strategy', 'molecular imaging', 'nervous system disorder', 'neural network', 'nonhuman primate', 'novel strategies', 'oncology', 'success', 'tool']",NIBIB,UNIVERSITY OF CALIFORNIA AT DAVIS,R21,2019,196250,0.28664826161197
"Multimodal MR-PET Machine Learning Approaches for Primary Prostate Cancer Characterization Project Summary Prostate cancer (PCa) is the most diagnosed form of non-cutaneous cancer in US men. The selection of patients who require immediate treatment from those suitable for active surveillance currently relies on non- specific and inaccurate measurements. A method that allows clinicians to more confidently discriminate clinically relevant from non-life-threatening tumors is needed to improve patient management. Multiparametric magnetic resonance imaging (mpMRI) is the preferred non-invasive imaging modality for characterizing primary PCa. However, its accuracy for detecting clinically significant PCa is variable. We propose to address this limitation by combining mpMRI with positron emission tomography (PET) with a PCa-specific radiotracer and using advanced multimodal machine learning models (i.e. radiomics and deep learning) to characterize tumor aggressiveness based on the imaging data. Recently, scanners capable of simultaneous PET and MR data acquisition in human subjects have become commercially available. An integrated MR-PET scanner is the ideal tool for comparing MR and PET derived image features to identify those that provide complementary information and build a hybrid PET-mpMRI model that most accurately identifies clinically significant tumors. While this novel technology allows the acquisition of perfectly coregistered complementary anatomical, functional and metabolic data in a single imaging session, a new challenge needs to first be addressed to obtain quantitatively accurate PET data. In an integrated MR-PET scanner, the information needed for PET attenuation correction (AC) has to be derived from the MR data and the methods currently available for this task are inadequate for advanced quantitative studies. We have formed an academic-industrial partnership to accelerate the translation of multimodal MR-PET machine learning approaches into PCa research and clinical applications by addressing the AC challenge and validating machine learning models for detecting clinically significant disease against gold standard histopathology in patients undergoing radical prostatectomy. Specifically, we will: (1) Develop and validate an MR-based approach for obtaining quantitatively accurate PET data. We hypothesize that attenuation maps as accurate as those obtained using a 511 keV transmission source – the true gold standard for PET AC – will be obtained; (2) Identify the multimodal radiomics model that most accurately predicts PCa aggressiveness. We hypothesize that the diagnostic accuracy of this approach will be superior to that offered by the stand-alone modalities; (3) Evaluate radiomics and deep learning approaches for predicting pPCa aggressiveness. We hypothesize that machine learning approaches will achieve a higher predictive accuracy when applied to data acquired simultaneously than sequentially. Project narrative A better method to non-invasively characterize primary prostate cancer is needed to improve patient management. Extracting additional information from multimodality quantitative MR-PET data using machine learning approaches is expected to result in better diagnostic performance. In this work, we propose to accelerate the translation of quantitative MR-PET to prostate cancer research and clinical applications. In particular, we will develop and validate an MR-based attenuation correction approach to guarantee that quantitatively accurate PET data are obtained in an integrated MR-PET scanner and then use machine learning approaches to characterize the aggressiveness of the tumors in patients undergoing radical prostatectomy.",Multimodal MR-PET Machine Learning Approaches for Primary Prostate Cancer Characterization,9653979,R01CA218187,"['3-Dimensional', 'Address', 'Affect', 'Algorithms', 'Anatomy', 'Biological', 'Biopsy', 'Cancer Death Rates', 'Cancer Patient', 'Classification', 'Computer software', 'Data', 'Data Set', 'Devices', 'Diagnosis', 'Diagnostic', 'Discrimination', 'Disease', 'Early Diagnosis', 'Early treatment', 'FOLH1 gene', 'Gold', 'Guidelines', 'Hand', 'Histopathology', 'Hybrids', 'Image', 'Individual', 'Interobserver Variability', 'Kinetics', 'Lesion', 'Life Expectancy', 'Ligands', 'Machine Learning', 'Magnetic Resonance Imaging', 'Malignant Neoplasms', 'Malignant neoplasm of prostate', 'Maps', 'Measurement', 'Meta-Analysis', 'Metabolic', 'Methodology', 'Methods', 'Modality', 'Modeling', 'Morphology', 'Patient Selection', 'Patients', 'Pelvis', 'Performance', 'Phenotype', 'Physiological', 'Positron-Emission Tomography', 'Prostate', 'Prostate-Specific Antigen', 'Quality of life', 'Radical Prostatectomy', 'Reproducibility', 'Risk', 'Scanning', 'Source', 'Testing', 'Time', 'Translations', 'Work', 'anticancer research', 'attenuation', 'base', 'bone imaging', 'cancer classification', 'cancer imaging', 'clinical application', 'clinically relevant', 'clinically significant', 'data acquisition', 'deep learning', 'diagnostic accuracy', 'human subject', 'imaging modality', 'improved', 'industry partner', 'men', 'multimodality', 'new technology', 'non-invasive imaging', 'radiologist', 'radiomics', 'radiotracer', 'tool', 'transmission process', 'tumor']",NCI,MASSACHUSETTS GENERAL HOSPITAL,R01,2019,663746,0.11056444498074029
"A TOF, DOI, MRI compatible PET detector to support sub-millimeter neuroPET imaging Abstract The overall goal of this research is to develop next generation positron emission tomography (PET) detector technology to support non-invasive, quantitative brain imaging at spatial and temporal resolutions currently not achievable with human neuro-PET systems. The developed PET detector technology will also be compatible with operation in an MRI system. The proposed research is targeted to the NIH Brain Research through Advancing Innovative Neurotechnologies (BRAIN) initiative. Human brain imaging with PET/MRI will be an essential tool in neuroscience studies to ""Develop innovative technologies to understand the human brain and treat its disorders; create and support integrated brain research networks."" The key advancement that we introduce is a PET detector with <100 psec time-of-flight (TOF) PET coincidence resolution, <2 mm continuous depth of interaction (DOI) positioning and intrinsic detector spatial resolution to support <1 mm PET image resolution throughout the system imaging field of view (FOV). Detector modules have been designed that individually achieve these performance metrics; however, no detector module has been designed that supports all of them. To make disruptive advancements in neuro-imaging using PET, one must push the image spatial resolution (i.e., currently 2-3 mm image resolution) as well as coincidence timing resolution and also be MRI compatible. The impact of this project is that we will advance the state of the art in all of these critical performance areas. We will achieve these goals by first understanding the role that different PET detector performance parameters have on task-based figures of merit for neuroPET imaging. We will investigate how both TOF and image resolution impact figure of merit performance for estimation, detection and characterization imaging tasks. Monte Carlo simulation will be used along with both object-based (i.e., mathematical) and anthropomorphic digital phantoms. Next we will optimize SiPM device selection, electronics and detector geometry for <100 psec TOF coincidence timing, 1 mm intrinsic spatial resolution and <2 mm DOI positioning resolution. We will build and characterize a prototype PET detector module utilizing a novel dual- sided slat crystal detector design. To advance coincidence timing performance we will investigate the use of machine learning to estimate the arrival time of detected events. Finally, we will optimize the detector design for MRI compatibility. We will fully test and characterize performance of our prototype detector on the benchtop and in a MRI scanner while running clinical MRI pulse sequences. At the end of this developmental project we will be in position to build a state of the art, MRI compatible, TOF, DOI PET imaging system. Narrative The overall goal of this work is to develop detector imaging technology that will enable new research into the development, function and aging of the human brain. This technology will allow functional imaging of the brain at higher spatial resolution and higher coincidence timing resolution than previously achieved and also facilitate simultaneous multi-modality imaging (i.e., PET/MRI) at these new levels of performance.","A TOF, DOI, MRI compatible PET detector to support sub-millimeter neuroPET imaging",9791188,R01EB026964,"['Aging', 'Algorithms', 'Area', 'Benchmarking', 'Brain', 'Brain imaging', 'Clinical', 'Crystallization', 'Data', 'Detection', 'Development', 'Devices', 'Dimensions', 'Disease', 'Electronics', 'Elements', 'Evaluation', 'Event', 'Functional Imaging', 'Geometry', 'Goals', 'Guidelines', 'Human', 'Image', 'Imaging technology', 'Individual', 'Investigation', 'Laboratory Research', 'Lead', 'Length', 'Machine Learning', 'Magnetic Resonance Imaging', 'Mathematics', 'Measurement', 'Measures', 'Methods', 'Modeling', 'Monte Carlo Method', 'Multimodal Imaging', 'Neurosciences', 'Optics', 'Outcome', 'Performance', 'Physiologic pulse', 'Positioning Attribute', 'Positron-Emission Tomography', 'Property', 'Research', 'Research Personnel', 'Resolution', 'Role', 'Running', 'Side', 'Silicon', 'Surface', 'System', 'Technology', 'Testing', 'Time', 'United States National Institutes of Health', 'Universities', 'Vendor', 'Washington', 'Work', 'base', 'brain research', 'design', 'detector', 'digital', 'imaging detector', 'imaging system', 'improved', 'innovative neurotechnologies', 'innovative technologies', 'learning strategy', 'neuroimaging', 'next generation', 'novel', 'operation', 'prototype', 'temporal measurement', 'tool']",NIBIB,UNIVERSITY OF WASHINGTON,R01,2019,22992,0.20303937578683168
"High performance PET Detector Module for Human Brain Imaging Project Summary / Abstract This proposal is in response to PA 18-484. In the BRAIN 2025 Report, PET (positron emission tomography) is identified as “the best means to translate studies of neurotransmitters, receptors, and neuromodulators to humans.” However dynamic assessment of receptor occupancy and metabolism is hindered by the spatial resolution and sensitivity of even the most modern of clinically available PET scanners. To address this challenge, we propose a next generation PET detector with a highly innovative design: a detector module with a layered scintillator structure and a side readout configuration. The crystal slabs in the module are stacked along the depth direction and are optically separated by reflective films. The scintillation light created in each layer is measured by photodetectors located on the four sides of the crystal. Compared with traditional PET detectors, which contain pixelated crystal arrays, the new design has the following advantages: (1) The layered structure provides depth of interaction (DOI) information such that a smaller diameter detector ring can be used without increasing parallax error, increasing sensitivity while lowering costs. (2) The four-sided readout method improves the energy resolution of the system with increased scintillation light collection efficiency by reducing light loss due to total internal reflection. (3) Sub millimeter spatial resolution is achievable without using very small pitch crystal arrays, since the interaction location in each crystal layer is determined via machine learning- based decoding of the light distribution collected on the four crystal sides. Therefore the production cost of the crystals is reduced. (4) Since the interaction location and energy resolution for each layer are determined independently, the system sensitivity can be increased by stacking more layers in the module without affecting the spatial and energy resolution of the system. (5) For side readout setup, a larger ratio of cross-sectional area to length requires fewer photodetectors to cover all four sides of the module; this reduces photodetector cost. The first four points above have been demonstrated in preliminary studies using a small, prototype module. We propose to build a large scale detector module with this new design to verify the fifth advantage, and to study the effect of detector size on the first four. The outcome of this proposal will be two DOI enabled detector modules with excellent spatial resolution (~1 mm) and energy resolution (~10%), as well as good timing resolution (~400 ps), and DOI resolution (~ 3 mm) and high system sensitivity. A full characterization study for the two modules and imaging studies for both the Derenzo and Hoffman brain phantoms will address the current limitations of human brain PET scanners, and will serve as the foundation for a new dynamic PET scanner for neuroimaging. Project Narrative The goal of this project is to develop a novel design for detector modules used in brain-dedicated PET system with good spatial resolution, energy resolution, timing resolution, and DOI resolution, as well as high sensitivity. If successful, the study will pave the way for building a novel PET system for greatly improved dynamic PET imaging of the human brain.",High performance PET Detector Module for Human Brain Imaging,9802309,R01EB028337,"['Address', 'Affect', 'Alzheimer&apos', 's Disease', 'Area', 'Brain', 'Brain Neoplasms', 'Brain imaging', 'Caliber', 'Calibration', 'Clinical', 'Collection', 'Crystallization', 'Development', 'Diagnosis', 'Evaluation', 'Event', 'Film', 'Foundations', 'Gamma Rays', 'Geometry', 'Goals', 'Human', 'Image', 'Imaging Phantoms', 'Individual', 'Length', 'Light', 'Location', 'Machine Learning', 'Measures', 'Metabolism', 'Methods', 'Modernization', 'Neuromodulator', 'Neurotransmitter Receptor', 'Optics', 'Outcome', 'Parkinson Disease', 'Pattern', 'Performance', 'Portugal', 'Positioning Attribute', 'Positron-Emission Tomography', 'Process', 'Production', 'Reporting', 'Resolution', 'Side', 'Signal Transduction', 'Silicon', 'Source', 'Staging', 'Structure', 'Surface', 'System', 'Thinness', 'Translating', 'Variant', 'base', 'brain size', 'cost', 'design', 'detector', 'human imaging', 'imaging study', 'improved', 'innovation', 'learning strategy', 'meetings', 'millimeter', 'nervous system disorder', 'neuroimaging', 'next generation', 'novel', 'photomultiplier', 'prototype', 'receptor', 'response', 'retinal rods']",NIBIB,"CANON MEDICAL RESEARCH USA, INC.",R01,2019,293568,0.20446864031863135
