text,title,id,project_number,terms,administration,organization,mechanism,year,funding,score
"Motion Compensated Brain PET Imaging for Neuroscience Research ﻿    DESCRIPTION (provided by applicant):   Advanced imaging technologies such as Positron Emission Tomography (PET) and Magnetic Resonance Imaging (MR) have led to remarkable improvement in our knowledge of brain metabolism, function, and biochemistry. And yet, our understanding of most neurological disorders is at best rudimentary. Etiology of such common diseases as drug and alcohol addiction, schizophrenia, Alzheimer's dementia and Parkinson's remains elusive. Malignant brain tumors such as glioblastoma continue being fatal. Changes happening in the brain in such common syndromes as hospital-acquired delirium, and post-operative cognitive decline, are not understood. Most studies involving advanced brain imaging remain small due to logistical challenges, cost constraints, and difficulty of scanning neurological patients in standard radiology equipment. Acceleration of brain research is required to elucidate the pathophysiology of neurological and psychiatric conditions. Brain Biosciences was established to make neurological imaging comfortable, inexpensive, and widely available both in the clinic and in the research laboratory. One of the common problems encountered in imaging research is unintentional patient motion. Head movement during Positron Emission Tomography (PET) degrades PET image quality, leads to image artifacts, and introduces quantitative errors. Motion is particularly common in confused patients with neurological diseases, drug addiction, and movement disorders. This problem becomes especially relevant as research involving lengthy dynamic scans, and high-resolution brain imaging becomes common. While sedation is often used to minimize the patient motion, sedative drugs change brain biochemistry, interfere with radiopharmaceutical uptake, and may cause side effects. Physical restraints are often distressing, and may increase patient agitation. In this direct Phase II SBIR proposal we seek to develop, clinically validate, and receive FDA clearance for FREEMotion(tm), a video-based head tracking system, enabling motion- compensated brain Positron Emission Tomography (PET) imaging of neurological patients without sedation or physical head restraint. PUBLIC HEALTH RELEVANCE: This application proposes to develop and validate a novel head tracking system capable of compensating for patient motion during high-resolution brain Positron Emission Tomography (PET) imaging. This device will lower improve the quality, comfort, and quantification of brain PET in patients with neurological and psychiatric diseases, as well as drug abuse. The proposed device will have applications both in the clinic and neuroscience research.",Motion Compensated Brain PET Imaging for Neuroscience Research,9142315,R44DA040382,"['Acceleration', 'Accounting', 'Adoption', 'Adverse effects', 'Agitation', 'Alcohol dependence', 'Algorithms', 'Alzheimer&apos', 's Disease', 'Biochemistry', 'Biological Sciences', 'Brain', 'Brain imaging', 'Calibration', 'Certification', 'Clinic', 'Clinical', 'Clinical Data', 'Clinical Research', 'Computer Vision Systems', 'Devices', 'Disease', 'Distress', 'Drug Addiction', 'Drug abuse', 'Electromagnetics', 'Equipment', 'Etiology', 'Evaluable Disease', 'Face', 'Failure', 'Financial compensation', 'Freedom', 'Functional disorder', 'Funding', 'Glioblastoma', 'Guidelines', 'Head', 'Head Movements', 'Health', 'Hospitals', 'Image', 'Imaging technology', 'Immune', 'Impaired cognition', 'Institutional Review Boards', 'Knowledge', 'Laboratory Research', 'Lighting', 'Magnetic Resonance Imaging', 'Malignant neoplasm of brain', 'Maryland', 'Mental disorders', 'Modeling', 'Morphologic artifacts', 'Motion', 'Motor Neuron Disease', 'Movement Disorders', 'Neurologic', 'Neurosciences Research', 'Parkinson Disease', 'Participant', 'Patients', 'Pharmaceutical Preparations', 'Phase', 'Physical Restraint', 'Positioning Attribute', 'Positron-Emission Tomography', 'Procedures', 'Qualifying', 'Quality Control', 'Radiology Specialty', 'Radiopharmaceuticals', 'Reader', 'Research', 'Resolution', 'Safety', 'Sales', 'Scanning', 'Schizophrenia', 'Sedation procedure', 'Small Business Innovation Research Grant', 'Software Design', 'Supervision', 'Syndrome', 'System', 'Testing', 'Universities', 'Vendor', 'base', 'brain metabolism', 'brain research', 'commercialization', 'cost', 'design', 'experience', 'improved', 'industry partner', 'medical schools', 'nervous system disorder', 'novel', 'postoperative delirium', 'programs', 'prototype', 'reconstruction', 'restraint', 'sedative', 'uptake']",NIDA,BRAIN BIO,R44,2016,588013,0.20834148886265266
"Motion Compensated Brain PET Imaging for Neuroscience Research ﻿    DESCRIPTION (provided by applicant):   Advanced imaging technologies such as Positron Emission Tomography (PET) and Magnetic Resonance Imaging (MR) have led to remarkable improvement in our knowledge of brain metabolism, function, and biochemistry. And yet, our understanding of most neurological disorders is at best rudimentary. Etiology of such common diseases as drug and alcohol addiction, schizophrenia, Alzheimer's dementia and Parkinson's remains elusive. Malignant brain tumors such as glioblastoma continue being fatal. Changes happening in the brain in such common syndromes as hospital-acquired delirium, and post-operative cognitive decline, are not understood. Most studies involving advanced brain imaging remain small due to logistical challenges, cost constraints, and difficulty of scanning neurological patients in standard radiology equipment. Acceleration of brain research is required to elucidate the pathophysiology of neurological and psychiatric conditions. Brain Biosciences was established to make neurological imaging comfortable, inexpensive, and widely available both in the clinic and in the research laboratory. One of the common problems encountered in imaging research is unintentional patient motion. Head movement during Positron Emission Tomography (PET) degrades PET image quality, leads to image artifacts, and introduces quantitative errors. Motion is particularly common in confused patients with neurological diseases, drug addiction, and movement disorders. This problem becomes especially relevant as research involving lengthy dynamic scans, and high-resolution brain imaging becomes common. While sedation is often used to minimize the patient motion, sedative drugs change brain biochemistry, interfere with radiopharmaceutical uptake, and may cause side effects. Physical restraints are often distressing, and may increase patient agitation. In this direct Phase II SBIR proposal we seek to develop, clinically validate, and receive FDA clearance for FREEMotion(tm), a video-based head tracking system, enabling motion- compensated brain Positron Emission Tomography (PET) imaging of neurological patients without sedation or physical head restraint.         PUBLIC HEALTH RELEVANCE: This application proposes to develop and validate a novel head tracking system capable of compensating for patient motion during high-resolution brain Positron Emission Tomography (PET) imaging. This device will lower improve the quality, comfort, and quantification of brain PET in patients with neurological and psychiatric diseases, as well as drug abuse. The proposed device will have applications both in the clinic and neuroscience research.            ",Motion Compensated Brain PET Imaging for Neuroscience Research,9049061,R44DA040382,"['Acceleration', 'Accounting', 'Adoption', 'Adverse effects', 'Agitation', 'Alcohol dependence', 'Algorithms', 'Alzheimer&apos', 's Disease', 'Biochemistry', 'Brain', 'Brain imaging', 'Calibration', 'Certification', 'Clinic', 'Clinical', 'Clinical Data', 'Clinical Research', 'Computer Vision Systems', 'Delirium', 'Devices', 'Disease', 'Distress', 'Drug Addiction', 'Drug abuse', 'Electromagnetics', 'Equipment', 'Etiology', 'Evaluable Disease', 'Face', 'Failure', 'Financial compensation', 'Freedom', 'Functional disorder', 'Funding', 'Glioblastoma', 'Guidelines', 'Head', 'Head Movements', 'Hospitals', 'Image', 'Imaging technology', 'Immune', 'Impaired cognition', 'Institutional Review Boards', 'Knowledge', 'Laboratory Research', 'Lighting', 'Magnetic Resonance Imaging', 'Malignant neoplasm of brain', 'Maryland', 'Mental disorders', 'Modeling', 'Morphologic artifacts', 'Motion', 'Motor Neuron Disease', 'Movement Disorders', 'Neurologic', 'Neurosciences Research', 'Parkinson Disease', 'Participant', 'Patients', 'Pharmaceutical Preparations', 'Phase', 'Physical Restraint', 'Positioning Attribute', 'Positron-Emission Tomography', 'Postoperative Period', 'Procedures', 'Qualifying', 'Quality Control', 'Radiology Specialty', 'Radiopharmaceuticals', 'Reader', 'Research', 'Resolution', 'Safety', 'Sales', 'Scanning', 'Schizophrenia', 'Sedation procedure', 'Small Business Innovation Research Grant', 'Software Design', 'Supervision', 'Syndrome', 'System', 'Testing', 'Universities', 'Vendor', 'base', 'brain metabolism', 'brain research', 'commercialization', 'cost', 'design', 'experience', 'improved', 'medical schools', 'nervous system disorder', 'novel', 'programs', 'prototype', 'public health relevance', 'reconstruction', 'restraint', 'sedative', 'uptake']",NIDA,BRAIN BIO,R44,2015,911987,0.20834148886265266
"Reliable Human-Model Observers for Emission Tomography    DESCRIPTION (provided by applicant): Our overall objective is to develop numerical observers for dependable technology evaluations in emission tomography. Positron emission tomography (PET) and single-photon emission tomography (SPECT) are the primary clinical modalities for imaging many types of cancer. However, early de- tection often presents the best chances of surviving cancer whereas these imaging modalities have limited diagnostic utility for small tumors. Systematic task-based developmental assessments could facilitate early identification of promising new technology for improving the diagnostic capabilities of these modalities. Yet, assessments with human observers are generally impractical for developmental use. Moreover, available mathematical models (or numerical observers) intended to predict human performance-what we refer to as human-model observers-present significant limits, including con- straints on the types of diagnostic tasks that can be considered. Partly because of these constraints, existing human-model observers frequently require revalidation given any change to the imaging pro- cess. Our approach to observer development is founded on the concept of task equivalence, whereby the task for the numerical observer mirrors the desired clinical task as closely as possible. In this grant, we propose a novel observer framework that is influenced by descriptions of radiologists' visual-search (VS) processes, in which an initial global scan of an image identifies candidate locations deserving closer inspection. We shall use the VS paradigm to investigate the hypotheses that task equivalence i) can lead to a human-observer model that reliably generalizes to a wide range of diagnostic tasks, and ii) is necessary to ensure truly relevant task-based evaluations. We shall test these hypotheses through observer studies with fluorine-18 deoxyglucose (FDG) whole-body PET and SPECT In-111 imaging of neuroendocrine tumors (NETs). A state-of-the-art model observer for developmental stud- ies should be capable of detection-localization tasks, and our observer studies will be analyzed with jackknife FROC (JAFROC) methodology. The specific aims of this work are to: 1) determine what features of FDG-PET image slices attract initial human-observer attention; 2) develop a VS numerical observer for tumor detection-localization tasks in FDG-PET; 3) test the VS observer against humans in a JAFROC detection-localization study featuring hybrid PET images; 4) investigate generalizations of the VS observer to SPECT and 3D detection-localization tasks; and 5) compare system optimiza- tions for oncologic SPECT obtained from the VS and existing numerical observers. The application is optimization of a parallel-hole collimator design for In-111 NET imaging.      PUBLIC HEALTH RELEVANCE: Functional imaging with positron emission tomography (PET) and single-photon emission tomog- raphy (SPECT) has a significant role in cancer diagnosis and management. Still, early detection offers the best chances for surviving many cancers and refining the diagnostic capabilities of these modali- ties for small tumors continues to be a major research focus. This work is focused on the development of assessment methods for assisting in the early identification of technological advances that could improve the diagnostic utility of PET and SPECT.           Project Narrative  Functional imaging with positron emission tomography (PET) and single-photon emission tomog- raphy (SPECT) has a significant role in cancer diagnosis and management. Still, early detection offers the best chances for surviving many cancers and refining the diagnostic capabilities of these modali- ties for small tumors continues to be a major research focus. This work is focused on the development of assessment methods for assisting in the early identification of technological advances that could improve the diagnostic utility of PET and SPECT.",Reliable Human-Model Observers for Emission Tomography,8541012,R01EB012070,"['Agreement', 'Algorithms', 'Attention', 'Characteristics', 'Clinical', 'Collimator', 'Computer Assisted', 'Data', 'Deoxyglucose', 'Dependence', 'Detection', 'Development', 'Diagnostic', 'Disease Management', 'Early Diagnosis', 'Early identification', 'Emission-Computed Tomography', 'Ensure', 'Evaluation', 'Eye', 'Fluorine', 'Functional Imaging', 'Goals', 'Grant', 'Human', 'Hybrids', 'Image', 'Indium-111', 'Investigation', 'Laboratories', 'Lead', 'Location', 'Machine Learning', 'Malignant Neoplasms', 'Measures', 'Methodology', 'Methods', 'Metric', 'Modality', 'Modeling', 'Morphology', 'Neuroendocrine Tumors', 'Pattern', 'Performance', 'Photons', 'Positron-Emission Tomography', 'Process', 'Research', 'Role', 'Scanning', 'Slice', 'Stress', 'System', 'Systems Development', 'Technology', 'Testing', 'Time', 'Training', 'Work', 'base', 'cancer diagnosis', 'cancer type', 'design', 'digital', 'image processing', 'imaging modality', 'improved', 'interest', 'mathematical model', 'new technology', 'novel', 'public health relevance', 'radiologist', 'simulation', 'single photon emission computed tomography', 'tomography', 'tool', 'tumor', 'visual search']",NIBIB,UNIVERSITY OF HOUSTON,R01,2013,361799,0.15901897398334305
"Reliable Human-Model Observers for Emission Tomography    DESCRIPTION (provided by applicant): Our overall objective is to develop numerical observers for dependable technology evaluations in emission tomography. Positron emission tomography (PET) and single-photon emission tomography (SPECT) are the primary clinical modalities for imaging many types of cancer. However, early de- tection often presents the best chances of surviving cancer whereas these imaging modalities have limited diagnostic utility for small tumors. Systematic task-based developmental assessments could facilitate early identification of promising new technology for improving the diagnostic capabilities of these modalities. Yet, assessments with human observers are generally impractical for developmental use. Moreover, available mathematical models (or numerical observers) intended to predict human performance-what we refer to as human-model observers-present significant limits, including con- straints on the types of diagnostic tasks that can be considered. Partly because of these constraints, existing human-model observers frequently require revalidation given any change to the imaging pro- cess. Our approach to observer development is founded on the concept of task equivalence, whereby the task for the numerical observer mirrors the desired clinical task as closely as possible. In this grant, we propose a novel observer framework that is influenced by descriptions of radiologists' visual-search (VS) processes, in which an initial global scan of an image identifies candidate locations deserving closer inspection. We shall use the VS paradigm to investigate the hypotheses that task equivalence i) can lead to a human-observer model that reliably generalizes to a wide range of diagnostic tasks, and ii) is necessary to ensure truly relevant task-based evaluations. We shall test these hypotheses through observer studies with fluorine-18 deoxyglucose (FDG) whole-body PET and SPECT In-111 imaging of neuroendocrine tumors (NETs). A state-of-the-art model observer for developmental stud- ies should be capable of detection-localization tasks, and our observer studies will be analyzed with jackknife FROC (JAFROC) methodology. The specific aims of this work are to: 1) determine what features of FDG-PET image slices attract initial human-observer attention; 2) develop a VS numerical observer for tumor detection-localization tasks in FDG-PET; 3) test the VS observer against humans in a JAFROC detection-localization study featuring hybrid PET images; 4) investigate generalizations of the VS observer to SPECT and 3D detection-localization tasks; and 5) compare system optimiza- tions for oncologic SPECT obtained from the VS and existing numerical observers. The application is optimization of a parallel-hole collimator design for In-111 NET imaging.      PUBLIC HEALTH RELEVANCE: Functional imaging with positron emission tomography (PET) and single-photon emission tomog- raphy (SPECT) has a significant role in cancer diagnosis and management. Still, early detection offers the best chances for surviving many cancers and refining the diagnostic capabilities of these modali- ties for small tumors continues to be a major research focus. This work is focused on the development of assessment methods for assisting in the early identification of technological advances that could improve the diagnostic utility of PET and SPECT.           Project Narrative  Functional imaging with positron emission tomography (PET) and single-photon emission tomog- raphy (SPECT) has a significant role in cancer diagnosis and management. Still, early detection offers the best chances for surviving many cancers and refining the diagnostic capabilities of these modali- ties for small tumors continues to be a major research focus. This work is focused on the development of assessment methods for assisting in the early identification of technological advances that could improve the diagnostic utility of PET and SPECT.",Reliable Human-Model Observers for Emission Tomography,8323998,R01EB012070,"['Agreement', 'Algorithms', 'Attention', 'Characteristics', 'Clinical', 'Collimator', 'Computer Assisted', 'Data', 'Deoxyglucose', 'Dependence', 'Detection', 'Development', 'Diagnostic', 'Disease Management', 'Early Diagnosis', 'Early identification', 'Emission-Computed Tomography', 'Ensure', 'Evaluation', 'Eye', 'Fluorine', 'Functional Imaging', 'Goals', 'Grant', 'Human', 'Hybrids', 'Image', 'Indium-111', 'Investigation', 'Laboratories', 'Lead', 'Location', 'Machine Learning', 'Malignant Neoplasms', 'Measures', 'Methodology', 'Methods', 'Metric', 'Modality', 'Modeling', 'Morphology', 'Neuroendocrine Tumors', 'Pattern', 'Performance', 'Photons', 'Positron-Emission Tomography', 'Process', 'Research', 'Role', 'Scanning', 'Slice', 'Stress', 'System', 'Systems Development', 'Technology', 'Testing', 'Time', 'Training', 'Work', 'base', 'cancer diagnosis', 'cancer type', 'design', 'digital', 'image processing', 'imaging modality', 'improved', 'interest', 'mathematical model', 'new technology', 'novel', 'public health relevance', 'radiologist', 'simulation', 'single photon emission computed tomography', 'tomography', 'tool', 'tumor', 'visual search']",NIBIB,UNIVERSITY OF HOUSTON,R01,2012,406394,0.15901897398334305
"Optimization of PET Imaging    DESCRIPTION (provided by applicant): Positron emission tomography (PET) is a functional imaging modality that is capable of imaging biochemical processes in humans or animals through the use of radioactive tracers. PET/CT with [18F]fluorodeoxyglucose (FDG) is increasingly being used for staging, restaging and treatment monitoring for cancer patients with different types of tumors. However, current FDG-PET provides a low sensitivity to detect micrometastases and small tumor infiltrated lymph nodes. The goal of this project is to improve the efficacy of PET imaging through the development of novel image reconstruction methods and data analysis tools. During the current funding period, we have developed a method for tuning reconstruction algorithm based on the noise characteristics in measured patient data. This patient-adaptive reconstruction algorithm has been validated using computer simulations and phantom experiments. In the next phase of the project, we will implement the patient-adaptive algorithm on clinical PET scanners and validate the method using patient data. We will further expand the capability of PET imaging by developing novel methods to utilize the anatomical information provided by PET/CT scanners and by exploring the potential of dynamic PET for cancer detection and staging. The four specific aims of the project are (1) To implement the patient-adaptive MAP reconstruction on clinical scanners and to validate the algorithm using breast cancer patients; (2) To develop a novel approach to PET image reconstruction using anatomical information; (3) To develop statistically efficient image reconstruction methods for dynamic PET; (4) To identify spatial-temporal features in dynamic PET image for detection and characterization of breast cancer and to evaluate the performance using breast cancer patient data. The first aim is an important step towards translating image reconstruction technology development into patient health care. Once validated using breast cancer patients, the method is readily applicable to imaging other types of tumors. The second to the fourth aims will greatly enhance the capability of PET by taking advantage of the recent advances in instrumentation (wide availability of PET/CT) and the dynamic nature of PET imaging. We expect the new methods to be developed will be able to extract clinically relevant features from dynamic PET for detecting small tumors and characterizing the malignancy of primary tumors. All the results will be validated using breast cancer patient data with histologically verified ground truth. The success of this research will have a significant and positive impact on the management of patients with breast cancer.      PUBLIC HEALTH RELEVANCE: Positron emission tomography (PET) is a medical imaging technique that can detect cancer and monitor treatment response. This research aims to improve the efficacy of PET by developing novel image reconstruction and data processing tools that will enable early detection and characterization of breast cancer. The success of this research is of substantial benefit to the general population of breast cancer suffers.           Project Narrative Positron emission tomography (PET) is a medical imaging technique that can detect cancer and monitor treatment response. This research aims to improve the efficacy of PET by developing novel image reconstruction and data processing tools that will enable early detection and characterization of breast cancer. The success of this research is of substantial benefit to the general population of breast cancer suffers.",Optimization of PET Imaging,8313653,R01EB000194,"['Address', 'Algorithms', 'Animals', 'Biochemical Process', 'Blood', 'Blood specimen', 'Breast', 'Cancer Detection', 'Cancer Patient', 'Characteristics', 'Clinical', 'Computer Simulation', 'Data', 'Data Analyses', 'Detection', 'Development', 'Development Plans', 'Diagnostic Neoplasm Staging', 'Early Diagnosis', 'Functional Imaging', 'Funding', 'General Population', 'Goals', 'Healthcare', 'Histologic', 'Histology', 'Human', 'Image', 'Imaging Techniques', 'Machine Learning', 'Malignant Neoplasms', 'Mammary Gland Parenchyma', 'Maps', 'Mastectomy', 'Measures', 'Medical Imaging', 'Methods', 'Micrometastasis', 'Modeling', 'Monitor', 'Motion', 'Nature', 'Neoplasm Metastasis', 'Noise', 'Operative Surgical Procedures', 'Outcome', 'Patients', 'Pattern', 'Performance', 'Phase', 'Physiological', 'Positron-Emission Tomography', 'Primary Neoplasm', 'Property', 'Protocols documentation', 'Radioactive Tracers', 'Recruitment Activity', 'Research', 'Resolution', 'Scanning', 'Staging', 'Structure', 'System', 'Techniques', 'Time', 'Translating', 'Validation', 'base', 'cancer imaging', 'clinical practice', 'clinically relevant', 'computerized data processing', 'fluorodeoxyglucose', 'fluorodeoxyglucose positron emission tomography', 'image reconstruction', 'imaging modality', 'improved', 'instrumentation', 'lymph nodes', 'malignant breast neoplasm', 'novel', 'novel strategies', 'patient population', 'public health relevance', 'reconstruction', 'research study', 'success', 'technology development', 'tool', 'treatment response', 'tumor', 'uptake']",NIBIB,UNIVERSITY OF CALIFORNIA AT DAVIS,R01,2012,311153,0.18756180429198746
