text,title,id,project_number,terms,administration,organization,mechanism,year,funding,score
"Quantitative Low-Dose PET Imaging Project summary Quantitative PET has become increasingly important in clinical management and research, in particular for predicting and assessing response to therapy for cancer patients. Current PET protocols involve injection of PET tracers that typically result in ~6-7 mSv radiation dose to patients. For patients who require multiple repeated PET scans to monitor the response to therapy, and for patients who need PET scans with two or more tracers (e.g., FDG + FLT) to optimally predict response to therapy, it is critical to reduce the radiation dose from the PET tracer injection, while still maintaining the quantitative accuracy and image quality for cancer management. When reducing injection dose, the PET images will have higher noise due to fewer detected counts, which will subsequently introduce errors in quantitative measurements. For moving organs and tumors such as those in the lung and abdomen, respiratory motion can substantially degrade quantitative accuracy, so motion correction is required. Conventional motion correction uses a gating strategy that rebins the PET data, resulting in substantially higher noise in each gate. More advanced methods incorporate motion vector estimation in the image domain for post-registration or motion compensated image reconstruction using all detected events without increasing noise. The motion vectors need to be derived from gated PET, which are even noisier when using a reduced tracer injection in low-dose studies, imposing substantial challenges for accurate and reliable voxel-by-voxel motion vector estimation. In dynamic PET studies with clinical cardiac tracers and other novel oncology and neurology tracers, quantification is even more challenging for low-dose PET as each dynamic frame only contains a small fraction of detected events so the high image noise will affect the determination of image-derived input functions and can lead to bias and high noise in parametric images. In this project, to reduce image noise and maintain quantitative accuracy in PET, we propose to develop, optimize, and evaluate multiple innovative imaging methods for low-dose PET data to achieve comparable quantitative accuracy as full-dose PET. While the imaging developments are generally applicable to all PET tracers in oncology, neurology, and cardiology, since cancer is the primary clinical application of PET, we will focus our investigation and optimization in this project on three lung cancer imaging tracers at different clinical adoption stages as examples: 1) 18F-FDG as a routine clinical tracer, 2) 18F-FMISO for hypoxia studies as a tracer for human research, and 3) 18F-PD-L1 that specifically binds to human PD-L1 in tumors and other organs as a recent first-in-human tracer. For each tracer, we will investigate 1) static PET, 2) gated and respiratory motion corrected PET, and 3) dynamic PET. Project narrative Patient radiation dose is a major concern in PET imaging. This project will be an important step to develop and standardize low-dose PET imaging methods and provide guidance for clinical practice, research studies, and both single and multiple site clinical trials for PET dose reduction. This project will lead to the development of imaging approaches to achieve the lowest level of PET radiation dose for applications not only in evaluation and prediction of response to cancer therapy, but for other applications in oncology, neurology, and cardiology.",Quantitative Low-Dose PET Imaging,9879968,R01EB025468,"['3-Dimensional', 'Abdomen', 'Adoption', 'Affect', 'Anatomy', 'Binding', 'Breathing', 'Cancer Patient', 'Cardiac', 'Cardiology', 'Clinical', 'Clinical Management', 'Clinical Research', 'Clinical Trials', 'Collaborations', 'Data', 'Data Set', 'Development', 'Dose', 'Evaluation', 'Event', 'Goals', 'Gold', 'Human', 'Hypoxia', 'Image', 'Injections', 'Investigation', 'Kinetics', 'Lead', 'Lung', 'Malignant Neoplasms', 'Malignant neoplasm of lung', 'Measurement', 'Methods', 'Modeling', 'Monitor', 'Motion', 'Neurology', 'Noise', 'Organ', 'PDCD1LG1 gene', 'Patients', 'Positron-Emission Tomography', 'Protocols documentation', 'Radiation Dose Unit', 'Research', 'Resolution', 'Sampling', 'Scanning', 'Standardization', 'Texture', 'Tracer', 'Training', 'Translating', 'Translations', 'Vendor', 'attenuation', 'base', 'cancer imaging', 'cancer therapy', 'clinical application', 'clinical practice', 'clinical research site', 'deep learning', 'first-in-human', 'fluorodeoxyglucose', 'image reconstruction', 'imaging approach', 'imaging modality', 'innovation', 'novel', 'oncology', 'parametric imaging', 'predicting response', 'reconstruction', 'research study', 'respiratory', 'response', 'tumor', 'vector']",NIBIB,YALE UNIVERSITY,R01,2019,167376,0.3662940323210492
"Deep learning techniques for time-of-flight PET detectors Project Summary/Abstract One of the key advances in modern positron emission tomography (PET) systems for clinical imaging is the use of time-of-flight (TOF) information. In cancer imaging TOF provides superior lesion detection and more accurate quantification that is crucial in measuring response to therapy, as well as in neurological and cardiovascular imaging applications. An additional benefit of TOF is the ability to lower the radiation dose or scan time without sacrificing image quality, important for patient safety and comfort. The magnitude of these clinical benefits is determined by the TOF resolution of the PET detectors, therefore the prospect of achieving unprecedented image quality and clinical imaging capabilities with superior TOF resolution has fueled significant research in developing detector technology for TOF-PET systems. However, these developments have been largely unaccompanied by advances in signal processing methods needed to extract TOF information from the detector’s electrical signals, with most detectors making use of crude analog algorithms that discard most of the useful timing information contained in the signals. Now, with the availability of low-cost fast waveform digitizers, there is an exciting opportunity to implement sophisticated digital signal processing algorithms to achieve superior TOF resolution. The main advantage of developing advanced signal processing algorithms is that it presents a cost-effective route to improved TOF resolution that is complementary to instrumentation innovations. In essence, the TOF gain comes for free; the detector signals already contain the information needed for better TOF resolution, it just needs to be used effectively. Here we propose to tailor deep learning techniques to estimate TOF from the detector signals. Deep learning with convolutional neural networks (CNNs) is a powerful approach to learn complex representations of input data that can be used for tasks such as classification and regression. CNNs are therefore very suitable for directly estimating TOF from the detector waveforms, since these waveforms are influenced by several complex and intertwined processes which are hard to accurately model. Furthermore, large amounts of ground truth training data are readily generated. We recently demonstrated the feasibility of CNN-based TOF estimation, and found up to 23% improvement in TOF resolution compared to standard signal processing methods. This proposal aims to optimize these methods to push the limits of achievable TOF resolution and develop methods for their practical implementation. First, we will develop CNN architectures and methods suitable for silicon photomultipliers (SiPMs) that are now used in modern TOF-PET systems. We will also optimize the digitizing parameters to make optimal use of CNNs for TOF estimation. Second, we will implement CNN-TOF methods in a modern commercial PET detector, including using a global CNN to simultaneously estimate TOF and the crystal-of-interaction from the detector waveforms, demonstrating the practical feasibility of using this promising deep learning method in next generation PET systems. Narrative The use of time-of-flight information in positron emission tomography (PET) is a powerful way to increase clinical imaging capabilities of PET, and is now used in most modern systems. Improving time-of-flight performance promises to provide substantial benefits for lesion detection in cancer imaging, kinetic modeling with dynamic imaging, and the use of lower radiation dose for patient safety. Here we introduce deep learning signal processing methods to significantly improve the performance of time-of-flight PET detectors without requiring new materials, which thereby represents a cost effective route towards maximizing the use of the rich imaging signal provided by time-of-flight.",Deep learning techniques for time-of-flight PET detectors,9651713,R03EB027268,"['Address', 'Adoption', 'Algorithms', 'Biological Neural Networks', 'Characteristics', 'Classification', 'Clinical', 'Complex', 'Coupled', 'Crystallization', 'Data', 'Data Quality', 'Detection', 'Development', 'Devices', 'Digital Signal Processing', 'Dose', 'Electronics', 'Foundations', 'Future', 'Goals', 'Healthcare', 'Human Engineering', 'Image', 'Industry', 'Industry Collaboration', 'Investigation', 'Kinetics', 'Knowledge', 'Learning', 'Lesion', 'Low Dose Radiation', 'Machine Learning', 'Manufacturer Name', 'Measures', 'Methods', 'Modeling', 'Modernization', 'Network-based', 'Neurologic', 'Noise', 'Outcome', 'Patient Care', 'Performance', 'Photons', 'Positron-Emission Tomography', 'Procedures', 'Process', 'Property', 'Radiation', 'Research', 'Research Personnel', 'Resolution', 'Route', 'Sampling', 'Scanning', 'Signal Transduction', 'Silicon', 'Solid', 'Speed', 'Sum', 'System', 'Techniques', 'Technology', 'Temperature', 'Time', 'Training', 'Tube', 'analog', 'base', 'cancer imaging', 'cardiovascular imaging', 'clinical imaging', 'cost', 'cost effective', 'deep learning', 'detector', 'digital', 'imaging capabilities', 'improved', 'innovation', 'instrumentation', 'learning strategy', 'network architecture', 'next generation', 'patient safety', 'photomultiplier', 'physical process', 'response', 'scale up', 'signal processing', 'time use', 'voltage']",NIBIB,UNIVERSITY OF CALIFORNIA AT DAVIS,R03,2018,78500,0.21764920331141574
"Multimodal MR-PET Machine Learning Approaches for Primary Prostate Cancer Characterization Project Summary Prostate cancer (PCa) is the most diagnosed form of non-cutaneous cancer in US men. The selection of patients who require immediate treatment from those suitable for active surveillance currently relies on non- specific and inaccurate measurements. A method that allows clinicians to more confidently discriminate clinically relevant from non-life-threatening tumors is needed to improve patient management. Multiparametric magnetic resonance imaging (mpMRI) is the preferred non-invasive imaging modality for characterizing primary PCa. However, its accuracy for detecting clinically significant PCa is variable. We propose to address this limitation by combining mpMRI with positron emission tomography (PET) with a PCa-specific radiotracer and using advanced multimodal machine learning models (i.e. radiomics and deep learning) to characterize tumor aggressiveness based on the imaging data. Recently, scanners capable of simultaneous PET and MR data acquisition in human subjects have become commercially available. An integrated MR-PET scanner is the ideal tool for comparing MR and PET derived image features to identify those that provide complementary information and build a hybrid PET-mpMRI model that most accurately identifies clinically significant tumors. While this novel technology allows the acquisition of perfectly coregistered complementary anatomical, functional and metabolic data in a single imaging session, a new challenge needs to first be addressed to obtain quantitatively accurate PET data. In an integrated MR-PET scanner, the information needed for PET attenuation correction (AC) has to be derived from the MR data and the methods currently available for this task are inadequate for advanced quantitative studies. We have formed an academic-industrial partnership to accelerate the translation of multimodal MR-PET machine learning approaches into PCa research and clinical applications by addressing the AC challenge and validating machine learning models for detecting clinically significant disease against gold standard histopathology in patients undergoing radical prostatectomy. Specifically, we will: (1) Develop and validate an MR-based approach for obtaining quantitatively accurate PET data. We hypothesize that attenuation maps as accurate as those obtained using a 511 keV transmission source – the true gold standard for PET AC – will be obtained; (2) Identify the multimodal radiomics model that most accurately predicts PCa aggressiveness. We hypothesize that the diagnostic accuracy of this approach will be superior to that offered by the stand-alone modalities; (3) Evaluate radiomics and deep learning approaches for predicting pPCa aggressiveness. We hypothesize that machine learning approaches will achieve a higher predictive accuracy when applied to data acquired simultaneously than sequentially. Project narrative A better method to non-invasively characterize primary prostate cancer is needed to improve patient management. Extracting additional information from multimodality quantitative MR-PET data using machine learning approaches is expected to result in better diagnostic performance. In this work, we propose to accelerate the translation of quantitative MR-PET to prostate cancer research and clinical applications. In particular, we will develop and validate an MR-based attenuation correction approach to guarantee that quantitatively accurate PET data are obtained in an integrated MR-PET scanner and then use machine learning approaches to characterize the aggressiveness of the tumors in patients undergoing radical prostatectomy.",Multimodal MR-PET Machine Learning Approaches for Primary Prostate Cancer Characterization,9524253,R01CA218187,"['Address', 'Affect', 'Algorithms', 'Anatomy', 'Biological', 'Biopsy', 'Cancer Death Rates', 'Cancer Patient', 'Classification', 'Computer software', 'Data', 'Data Set', 'Devices', 'Diagnosis', 'Diagnostic', 'Discrimination', 'Disease', 'Early Diagnosis', 'Early treatment', 'FOLH1 gene', 'Gold', 'Guidelines', 'Hand', 'Histopathology', 'Hybrids', 'Image', 'Individual', 'Interobserver Variability', 'Kinetics', 'Lesion', 'Life Expectancy', 'Ligands', 'Machine Learning', 'Magnetic Resonance Imaging', 'Malignant Neoplasms', 'Malignant neoplasm of prostate', 'Maps', 'Measurement', 'Meta-Analysis', 'Metabolic', 'Methodology', 'Methods', 'Modality', 'Modeling', 'Morphology', 'Patient Selection', 'Patient risk', 'Patients', 'Pelvis', 'Performance', 'Phenotype', 'Physiological', 'Positron-Emission Tomography', 'Prostate', 'Prostate-Specific Antigen', 'Quality of life', 'Radical Prostatectomy', 'Reproducibility', 'Scanning', 'Source', 'Testing', 'Time', 'Translations', 'Work', 'anticancer research', 'attenuation', 'base', 'bone imaging', 'cancer classification', 'cancer imaging', 'clinical application', 'clinically relevant', 'clinically significant', 'data acquisition', 'deep learning', 'diagnostic accuracy', 'human subject', 'imaging modality', 'improved', 'industry partner', 'men', 'multimodality', 'new technology', 'non-invasive imaging', 'radiologist', 'radiomics', 'radiotracer', 'tool', 'transmission process', 'tumor']",NCI,MASSACHUSETTS GENERAL HOSPITAL,R01,2018,684119,0.11056444498074029
"Synergistic integration of deep learning and regularized image reconstruction for positron emission tomography Project Summary/Abstract Positron emission tomography (PET) is a high-sensitivity molecular imaging modality widely used in oncology, neurology, and cardiology, with the ability to observe molecular-level activities inside a living body through the injection of specific radioactive tracers. In addition to the commonly used F-18-FDG, new tracers are being constantly developed and investigated to pinpoint specific pathways in various diseases. New PET scanners are also being proposed by exploiting time of flight (TOF) information, enabling depth of interaction capability, and extending the solid angle coverage. To realize the full potential of the new PET tracers and scanners, there is an increasing need for the development of advanced image reconstruction methods. This grant application proposes a new framework for regularized image reconstruction that synergistically integrates deep learning and regularized image reconstruction. The new framework is enabled by the recent advances in machine learning, which provide a tool to digest vast amount information embedded in existing medical images. The proposed method embeds a pre-trained deep neural network in an iterative image reconstruction framework and uses the deep neural network to regularize PET image directly. By training the deep neural network with a large amount of high-quality low-noise PET images, the proposed method can capture complex prior information from existing inter-subject and intra-subject data and thus is expected to substantially outperform the current state-of-the-art regularized image reconstruction method. The two specific aims of this exploratory proposal are (1) to develop the theoretical framework to synergistically integrate deep learning in regularized image reconstruction for PET and (2) to implement the proposed method and validate its effectiveness using existing animal data. Once the proposed method is validated using existing animal data, we will seek funding to acquire necessary human data for the implementation of the proposed method on clinical PET scanners. Project Narrative Positron emission tomography (PET) is a medical imaging technique widely used in clinic for detecting cancer, cardiovascular diseases, and neurological disorders. This project will develop an innovative image reconstruction method that has potential to improve PET image quality and reduce radiation dose. Its success will improve the accuracy of PET for cancer detection and other diseases.",Synergistic integration of deep learning and regularized image reconstruction for positron emission tomography,9586688,R21EB026668,"['Advanced Development', 'Anatomy', 'Applications Grants', 'Biological Neural Networks', 'Cancer Detection', 'Cardiology', 'Cardiovascular Diseases', 'Clinic', 'Clinical', 'Complex', 'Core Facility', 'Data', 'Data Set', 'Detection', 'Disease', 'Dose', 'Funding', 'Genomics', 'Grant', 'Image', 'Imaging Techniques', 'Injections', 'Learning', 'Lesion', 'Machine Learning', 'Magnetic Resonance Imaging', 'Malignant Neoplasms', 'Medical Imaging', 'Methods', 'Molecular', 'Morphologic artifacts', 'Mus', 'Network-based', 'Neurology', 'Noise', 'Output', 'Pathway interactions', 'Patients', 'Play', 'Positron-Emission Tomography', 'Radiation', 'Radioactive Tracers', 'Rattus', 'Role', 'Solid', 'Time', 'Tracer', 'Training', 'Use Effectiveness', 'Validation', 'Work', 'X-Ray Computed Tomography', 'anatomic imaging', 'animal data', 'base', 'cost', 'deep learning', 'deep neural network', 'fluorodeoxyglucose', 'human data', 'image reconstruction', 'imaging modality', 'improved', 'innovation', 'learning strategy', 'molecular imaging', 'nervous system disorder', 'nonhuman primate', 'novel strategies', 'oncology', 'success', 'tool']",NIBIB,UNIVERSITY OF CALIFORNIA AT DAVIS,R21,2018,221250,0.28664826161197
"A TOF, DOI, MRI compatible PET detector to support sub-millimeter neuroPET imaging Abstract The overall goal of this research is to develop next generation positron emission tomography (PET) detector technology to support non-invasive, quantitative brain imaging at spatial and temporal resolutions currently not achievable with human neuro-PET systems. The developed PET detector technology will also be compatible with operation in an MRI system. The proposed research is targeted to the NIH Brain Research through Advancing Innovative Neurotechnologies (BRAIN) initiative. Human brain imaging with PET/MRI will be an essential tool in neuroscience studies to ""Develop innovative technologies to understand the human brain and treat its disorders; create and support integrated brain research networks."" The key advancement that we introduce is a PET detector with <100 psec time-of-flight (TOF) PET coincidence resolution, <2 mm continuous depth of interaction (DOI) positioning and intrinsic detector spatial resolution to support <1 mm PET image resolution throughout the system imaging field of view (FOV). Detector modules have been designed that individually achieve these performance metrics; however, no detector module has been designed that supports all of them. To make disruptive advancements in neuro-imaging using PET, one must push the image spatial resolution (i.e., currently 2-3 mm image resolution) as well as coincidence timing resolution and also be MRI compatible. The impact of this project is that we will advance the state of the art in all of these critical performance areas. We will achieve these goals by first understanding the role that different PET detector performance parameters have on task-based figures of merit for neuroPET imaging. We will investigate how both TOF and image resolution impact figure of merit performance for estimation, detection and characterization imaging tasks. Monte Carlo simulation will be used along with both object-based (i.e., mathematical) and anthropomorphic digital phantoms. Next we will optimize SiPM device selection, electronics and detector geometry for <100 psec TOF coincidence timing, 1 mm intrinsic spatial resolution and <2 mm DOI positioning resolution. We will build and characterize a prototype PET detector module utilizing a novel dual- sided slat crystal detector design. To advance coincidence timing performance we will investigate the use of machine learning to estimate the arrival time of detected events. Finally, we will optimize the detector design for MRI compatibility. We will fully test and characterize performance of our prototype detector on the benchtop and in a MRI scanner while running clinical MRI pulse sequences. At the end of this developmental project we will be in position to build a state of the art, MRI compatible, TOF, DOI PET imaging system. Narrative The overall goal of this work is to develop detector imaging technology that will enable new research into the development, function and aging of the human brain. This technology will allow functional imaging of the brain at higher spatial resolution and higher coincidence timing resolution than previously achieved and also facilitate simultaneous multi-modality imaging (i.e., PET/MRI) at these new levels of performance.","A TOF, DOI, MRI compatible PET detector to support sub-millimeter neuroPET imaging",9616697,R01EB026964,"['Aging', 'Algorithms', 'Area', 'Benchmarking', 'Brain', 'Brain imaging', 'Clinical', 'Crystallization', 'Data', 'Detection', 'Development', 'Devices', 'Dimensions', 'Disease', 'Electronics', 'Elements', 'Evaluation', 'Event', 'Functional Imaging', 'Geometry', 'Goals', 'Guidelines', 'Human', 'Image', 'Imaging technology', 'Individual', 'Investigation', 'Laboratory Research', 'Lead', 'Length', 'Machine Learning', 'Magnetic Resonance Imaging', 'Mathematics', 'Measurement', 'Measures', 'Methods', 'Modeling', 'Monte Carlo Method', 'Multimodal Imaging', 'Neurosciences', 'Optics', 'Outcome', 'Performance', 'Physiologic pulse', 'Positioning Attribute', 'Positron-Emission Tomography', 'Property', 'Research', 'Research Personnel', 'Resolution', 'Role', 'Running', 'Side', 'Silicon', 'Surface', 'System', 'Technology', 'Testing', 'Time', 'United States National Institutes of Health', 'Universities', 'Vendor', 'Washington', 'Work', 'base', 'brain research', 'design', 'detector', 'digital', 'imaging detector', 'imaging system', 'improved', 'innovative neurotechnologies', 'innovative technologies', 'learning strategy', 'neuroimaging', 'next generation', 'novel', 'operation', 'prototype', 'temporal measurement', 'tool']",NIBIB,UNIVERSITY OF WASHINGTON,R01,2018,29442,0.20303937578683168
