text,title,id,project_number,terms,administration,organization,mechanism,year,funding,score
"HashtagHealth: A Social Media Big Data Resource for Neighborhood Effects Research DESCRIPTION:   My goal in seeking a Mentored Research Career Development Award is to acquire the necessary training, practical experience, and knowledge to become a leading independent investigator who harnesses biomedical Big Data Science for the investigation of multilevel influences on health. To continue my progress towards this goal, I am proposing to build the infrastructure to establish a neighborhood data repository, HashtagHealth, for public health researchers and policy makers. I am a highly trained researcher in social epidemiology and quantitative analyses, particularly large health surveys. Before coming to Utah, I worked as a full-time statistical programmer/data analyst on a NIH-funded project to evaluate the health effects of a large neighborhood relocation policy experiment on low-income families in five cities. Our study results suggested that moving from high- to lower poverty neighborhood is related to reductions in obesity and diabetes and improved mental health. Other extant research has provided evidence on associations between the neighborhood environment and mortality and morbidity-even after adjusting for individual characteristics. Poor access to healthy food, fast food chains, the lack of recreational facilities, and higher crime rates all correlate with hiher obesity rates. Nonetheless, the dearth of neighborhood data, especially measures of neighborhood quality that are consistent across geographic areas, limits neighborhood effects research. Moreover, neighborhoods are not only defined by their resources, but also by the social interactions and activities of people who live there. The widespread usage of the internet and open recording of many transactions has led to the availability of massive amounts of data that permits capture of previously hidden micro-level interactions. We will build the data algorithms and infrastructure to harness relatively untapped, cost efficient, and pervasive social media data to develop neighborhood indicators such as food themes, healthiness of food mentions, frequency of exercise/recreation mentions, metabolic intensity of physical activities, and happiness levels. The creation of HashtagHealth requires the use and refinement of Big Data methods to perform data mining, processing and storing of heterogeneous, unstructured data. We will build a testable version of HashtagHealth for the state of Utah and then apply the data resource to the examination of neighborhood effects on young adult obesity. My rigorous training and previous research experiences in social determinants of health, causal inference, and data analyses uniquely prepare me to make significant contributions to the field of Big Data, particularly at the intersection of public health and social sciences.  My Specific Aims are: 1) to develop a neighborhood data resource, HashtagHealth, for public health researchers, 2) to develop Big Data techniques to produce novel neighborhood quality indicators (e.g., healthiness of food mentions, frequency and type of exercise/recreation and happiness levels), and 3) to utilize HashtagHealth and individual-level data from the Utah Population Database to investigate neighborhood influences on obesity among young adults. My mentorship team includes experts in biomedical research (Drs. Ken Smith, Jim VanDerslice), computer science (Dr. Feifei Li), and statistics (Dr. Ming Wen). My team has the breadth of expertise to help me obtain critical multidisciplinary skills and successfully implement my research aims. In addition to my research aims, my Specific Career Development Aims include the following: 1) to develop expertise in data mining and database systems, 2) to acquire training in natural language processing and machine learning, 3) to further gain knowledge of geographic information systems (GIS), 4) to develop expertise in study design and analysis of neighborhood effects, and 5) and to develop grant writing and research management skills to lead future projects. The knowledge and experience gained from this proposal will allow me to successfully compete for R01 funding to create a national neighborhood data repository and to investigate national patterns of neighborhood effects on obesity. This proposal makes significant, relevant contributions to the field because 1) neighborhood environments are increasingly linked to important health outcomes, and 2) this project addresses the limits to research resulting from the lack of neighborhood data by providing new, cost-efficient data resources and methods for characterizing neighborhoods. PUBLIC HEALTH RELEVANCE: The epidemic rise in obesity and related chronic diseases in recent decades signal the importance of structural forces and social processes, but the dearth of data on contextual factors limits the investigation of multilevel effects on health. My overarching career goal is to contribute to the improvement of population health by conducting research in social determinants of health and developing new methodologies to address multidimensional research questions. The development of the Hashtag Health data repository will be a significant benefit to neighborhood effects researchers, harnessing the largely untapped potential of social media data to capture social and cultural processes with potential impact on health.",HashtagHealth: A Social Media Big Data Resource for Neighborhood Effects Research,9096792,K01ES025433,"['Address', 'Adolescence', 'Advocacy', 'Affect', 'Age', 'Alcohol consumption', 'Algorithms', 'Area', 'Behavior', 'Big Data', 'Biomedical Research', 'Birth', 'Birth Weight', 'Characteristics', 'Chronic Disease', 'Cities', 'Communications Media', 'Crime', 'Data', 'Data Analyses', 'Data Science', 'Data Sources', 'Databases', 'Development', 'Diabetes Mellitus', 'Environment', 'Epidemic', 'Epidemiology', 'Exercise', 'Family', 'Food', 'Food Access', 'Food Chain', 'Frequencies', 'Funding', 'Future', 'Geographic Information Systems', 'Geographic Locations', 'Geography', 'Goals', 'Grant', 'Happiness', 'Health', 'Health Food', 'Health Promotion', 'Health Sciences', 'Health Services Accessibility', 'Health Surveys', 'Health behavior', 'Health care facility', 'Healthcare', 'Hypertension', 'Individual', 'Informal Social Control', 'Internet', 'Investigation', 'K-Series Research Career Programs', 'Knowledge', 'Lead', 'Life', 'Link', 'Longevity', 'Low income', 'Machine Learning', 'Maintenance', 'Maps', 'Marital Status', 'Measures', 'Medical Records', 'Mental Health', 'Mentors', 'Mentorship', 'Metabolic', 'Methodology', 'Methods', 'Modeling', 'Morbidity - disease rate', 'Natural Language Processing', 'Neighborhoods', 'Obesity', 'Outcome', 'Pattern', 'Physical activity', 'Policies', 'Policy Maker', 'Population Database', 'Poverty', 'Principal Investigator', 'Process', 'Public Health', 'Quality Indicator', 'Recreation', 'Research', 'Research Design', 'Research Infrastructure', 'Research Personnel', 'Resources', 'Semantics', 'Siblings', 'Signal Transduction', 'Smoking', 'Social Environment', 'Social Interaction', 'Social Network', 'Social Sciences', 'System', 'Techniques', 'Time', 'Training', 'United States National Institutes of Health', 'Update', 'Utah', 'Work', 'Writing', 'built environment', 'career', 'career development', 'computer science', 'contextual factors', 'cost efficient', 'data integration', 'data management', 'data mining', 'design', 'experience', 'fast food', 'food consumption', 'health data', 'improved', 'mortality', 'multidisciplinary', 'news', 'novel', 'obesity risk', 'physical conditioning', 'population health', 'research study', 'screening', 'sex', 'skills', 'social', 'social health determinants', 'social media', 'statistics', 'tool', 'user-friendly', 'walkability', 'young adult']",NIEHS,UNIVERSITY OF UTAH,K01,2016,155914,0.41074243063266364
"Mechanisms Underlying Differential Effects of Neighborhood Poverty on Problematic Adolescent Drug Use PROJECT SUMMARY/ABSTRACT  Where a child grows up can inﬂuence his or her risk of problematic drug use. Surprisingly, policies and programs designed to improve neighborhood conditions have yielded conﬂicting results in which some children beneﬁt but others are harmed. Understanding the mechanisms by which neighborhoods act to affect problem- atic drug use and how these mechanisms differ across subgroups and cities—that is, understanding where and for whom mechanisms apply—is essential to optimize the effectiveness of future neighborhood interventions. Mechanisms involving mediation by aspects of the school environment have been unexamined, but could prove promising for understanding differential effects of neighborhood on problematic drug use. The objective of this K99/R00 is to identify school-based mechanisms that mediate the relationship between neighborhood poverty and problematic drug use and to develop statistical methods to understand how mediation effects differ across subgroup and place. This objective contributes to the long-term goal of improving the effectiveness of interven- tions to prevent drug abuse and dependence by tailoring interventions to address the most relevant mechanisms of action for each target population based on place and individual-level characteristics. The K99 phase ﬁlls the following training gaps that are critical to achieving the research objective and long-term goal: 1) methodologic training in causal mediation analysis; 2) subject-matter training in drug abuse and dependence prevention in ur- ban populations; and 3) involvement in real-world school-based interventions to develop methods with practical utility. Aim 1 of the proposed research identiﬁes the school environment mechanisms that mediate the relationship between neighborhood poverty and adolescent problematic drug use and modiﬁers of those mechanisms. Aim 2 extends a statistical method recently developed by the proposed research team for generalizing intervention ef- fects from one city to another to generalizing mediation effects. Finally, Aim 3 uses the method developed in Aim 2 to identify how the school environment mechanisms mediating neighborhood poverty and problematic drug use differ across major U.S. cities. The proposed research is expected to identify school-based mechanisms underly- ing differential effects of neighborhood poverty on adolescent problematic drug use by subgroup and place using the only study of randomized neighborhood residence. In addition, it is expected to contribute a novel statistical method that incorporates cutting-edge machine learning techniques to identify which mediation mechanisms can generalize across place, advancing translational research. Successful interventions are assumed to work in differ- ent settings, but that is not the case in practice. The proposed research will allow us to predict intervention effects while accounting for differences in population composition and modiﬁers of the mediation mechanism. This will make a signiﬁcant contribution to improving health by informing the design and targeting of future neighborhood interventions to adolescents and places that may be most impacted in terms of problematic drug use prevention. PROJECT NARRATIVE  The proposed research is to expected to advance understanding of how two important contexts—neighborhood and school—act together to inﬂuence problematic drug use among adolescents, including how these mechanisms differ across adolescent subgroups and places. In addition, the proposed research will result in the development of a ﬂexible statistical method to predict intervention mechanism effects in new target populations, taking into account population composition. Together, these contributions are anticipated to optimize targeting of future interventions to prevent drug abuse and addiction.",Mechanisms Underlying Differential Effects of Neighborhood Poverty on Problematic Adolescent Drug Use,9163466,K99DA042127,"['Accounting', 'Address', 'Adolescent', 'Affect', 'Age', 'Characteristics', 'Child', 'Cities', 'Development', 'Drug Addiction', 'Drug Use Disorder', 'Drug abuse', 'Drug usage', 'Effectiveness', 'Effectiveness of Interventions', 'Environment', 'Epidemiologist', 'Future', 'Gender', 'Goals', 'Health', 'Home visitation', 'Hour', 'House Call', 'Individual', 'Intervention', 'Machine Learning', 'Mediating', 'Mediation', 'Mediator of activation protein', 'Mental Health', 'Methods', 'Modeling', 'Neighborhoods', 'Outcome', 'Partner in relationship', 'Pharmaceutical Preparations', 'Phase', 'Policies', 'Population', 'Poverty', 'Prevention', 'Property', 'Randomized', 'Research', 'Research Training', 'Risk', 'Role', 'Safety', 'Schools', 'Statistical Methods', 'Students', 'Subgroup', 'Target Populations', 'Techniques', 'Testing', 'Training', 'Translational Research', 'Tweens', 'Work', 'adolescent drug use', 'base', 'boys', 'bullying', 'career', 'cost', 'design', 'drug abuse prevention', 'girls', 'improved', 'intervention effect', 'method development', 'novel', 'population based', 'prevent', 'programs', 'residence', 'successful intervention']",NIDA,UNIVERSITY OF CALIFORNIA BERKELEY,K99,2016,155590,0.272773595503467
"(PQA4) GPS exposure to environments & relations with biomarkers of cancer risk DESCRIPTION (provided by applicant): Physical inactivity, an unhealthy diet, and obesity are related to breast and colon cancer directly and through insulin and inflammation pathways. Greater access to healthy environments in residential neighborhoods is associated with higher physical activity (PA), a healthier diet, lower BMI, and in one study lower insulin resistance. Despite some significant findings, the effect sizes in built environment research have been small likely because of a mismatch between the environment assessed (home neighborhoods only) and location where the behaviors occur. Temporal variation in behaviors and locations within and across days has also been ignored. We propose to advance methods of cancer risk exposure assessment by measuring both neighborhood access and total environment exposure to healthy environments by dynamically integrating Global Positioning System (GPS) data with Geographical Information System (GIS) data. We hypothesize that dynamic GPS based measures of environmental exposure will be more strongly related to behavior and insulin and inflammation biomarkers than static addressed based GIS measures of access. We will study a large sample of adults (N=700), 40-75 years old, who have lived at their residence at least one year. We will recruit participants from census blocks specially selected to vary by income, walkability, and food environments to ensure environmental variability not achieved in a random sample. We will ensure balanced recruitment by census block type (walkability & food environments) across ethnicity, gender, age, and season. Half the sample will be Hispanic to explore potential interaction effects by ethnicity. Participants will complete surveys about their PA, sedentary behavior, environmental perceptions, self-selection, cancer risk, and demographics. PA and sedentary behavior will also be assessed by accelerometry and Machine Learning techniques will be employed to objectively identify specific behaviors likely related to the built environment e.g. walking, biking, riding in a car, screen time etc. Participants will complete the ASA 24 to assess diet, total calories and fat calories. A subsample (N=50) will wear a SenseCam to assess social context, validate GIS built environment measures, and validate the Machine Learned categories. Dynamic GIS measures of exposure will be created from 7 day person worn GPS data matched to GIS indicators of supportive PA and food environments (e.g. parks, walkable streets, fresh produce markets etc.) weighted by time, speed, transportation mode and features of the environment e.g. parcel size. Static residential GIS buffers of access to neighborhood resources will be created within a 1km street network buffer around a participant's home. Using multilevel statistical models adjusting for clustering, we will investigate whether GPS based Dynamic GIS measures of exposure to healthy food and PA supportive environments are more strongly associated with breast and colon cancer risk factors - including behaviors (PA, sedentary behavior, & diet), BMI, and biomarkers of insulin resistance and inflammation (e.g. CRP, IL-6, HOMA-IR) than Static GIS measures of access to neighborhood resources. PUBLIC HEALTH RELEVANCE:  Where people spend their time during the day may be related to their risk of getting cancer. Previous studies have only looked at places near to home. This project will assess behaviors in different locations across the day and relate exposure to different environments to biological outcomes such as insulin resistance.",(PQA4) GPS exposure to environments & relations with biomarkers of cancer risk,9132699,R01CA179977,"['Accelerometer', 'Address', 'Adult', 'Age', 'Behavior', 'Biological', 'Biological Markers', 'Buffers', 'Calories', 'Categories', 'Censuses', 'Child', 'Code', 'Colon Carcinoma', 'Data', 'Devices', 'Diet', 'Eating', 'Ensure', 'Environment', 'Environmental Exposure', 'Equilibrium', 'Ethnic Origin', 'Exposure to', 'Fatty acid glycerol esters', 'Food', 'Gender', 'Health', 'Health Food', 'High Fat Diet', 'Hispanics', 'Home environment', 'Image', 'Income', 'Inflammation', 'Information Systems', 'Insulin', 'Insulin Resistance', 'Interleukin-6', 'Life', 'Location', 'Machine Learning', 'Malignant Neoplasms', 'Marketing', 'Measures', 'Methods', 'Neighborhoods', 'Obesity', 'Outcome', 'Participant', 'Pathway interactions', 'Patient Self-Report', 'Persons', 'Pharmaceutical Preparations', 'Physical Function', 'Physical activity', 'Positioning Attribute', 'Recreation', 'Recruitment Activity', 'Research', 'Resources', 'Restaurants', 'Risk', 'Risk Factors', 'Sampling', 'Seasons', 'Self Perception', 'Social Behavior', 'Social Environment', 'Social Interaction', 'Speed', 'Statistical Models', 'Surveys', 'System', 'Techniques', 'Text', 'Time', 'Transportation', 'Variant', 'Walking', 'Weight', 'base', 'built environment', 'cancer risk', 'collaborative environment', 'demographics', 'density', 'fast food', 'food environment', 'good diet', 'inflammatory marker', 'land use', 'learned behavior', 'malignant breast neoplasm', 'novel', 'obesogenic', 'physical inactivity', 'residence', 'sedentary lifestyle', 'sugar', 'tv watching', 'walkability']",NCI,"UNIVERSITY OF CALIFORNIA, SAN DIEGO",R01,2016,816993,0.16758200526810496
"Mediators and Moderators of a Neighborhood Experiment on Alcohol Use ﻿    DESCRIPTION (provided by applicant): Excessive drinking in adolescence disrupts healthy development and leads to adverse social, economic and health consequences later in life. Although existing research focuses primarily on individual-level causes, neighborhood context is increasingly recognized as an upstream determinant of alcohol use. Yet since most prior neighborhood research on health has not been experimental, it is potentially biased, and weakens the foundation for policy translation. Our study proposes a secondary analysis of newly-available data from a social experiment of voluntary neighborhood relocation using housing vouchers in 5 cities (the Moving to Opportunity, MTO, Study), to test whether, how, and why random assignment of an offer to move to a low- poverty neighborhood over a 15 year period influenced the alcohol use, excessive drinking, and alcohol dependence of adolescents and their mothers. We will complement existing data with additional neighborhood- level data to enrich the dataset and test multilevel hypotheses. MTO is the only available large-scale study that has randomly assigned families to receive different neighborhood housing contexts, to support strong causal inferences of how early-life neighborhood context shapes alcohol use. When launched, MTO was one of the most promising policies to reverse the damaging effects of neighborhood poverty for minority families. But health researchers have had limited access to MTO data, compromising the scientific payoff of the $70+ million investment. Since residential mobility experiments like MTO are rare, expensive, and since MTO profoundly affected substance use, it is crucial to probe its effects. We propose new secondary data analyses with newly available 15 year follow-up data from this RCT, using novel methods to test mediation and moderation, applied to alcohol outcome measures that have not been examined prior. We apply innovative methods for assessing mediation (i.e., weight-based causal methods) and effect modification (i.e., machine learning techniques). Aside from the RCT design for strong causal inference of how early-life neighborhood changes influence excessive drinking, we also leverage one of the few longitudinal intervention designs sampling both mothers and their children, to illuminate familial transmission of drinking as it emerges in adolescence. Our R21 project builds on a productive, interdisciplinary team, experienced with the MTO study, and proposes 3 aims: to test how moving to a low-poverty neighborhood in the MTO experiment influenced excessive drinking and alcohol dependence; to examine if the MTO experimental effect on excessive drinking and alcohol dependence was less beneficial for more vulnerable families; to test whether effects of moving to a low-poverty neighborhood in MTO for excessive drinking and alcohol dependence were mediated by individual-level stress; family-level context; or neighborhood-level stress, alcohol availability, or alcohol norms. The results will enrich our understanding of neighborhood and family context as a cause of excessive drinking and alcohol use in adolescents and adults, and inform the next generation of alcohol prevention policy.         PUBLIC HEALTH RELEVANCE    This project will test mediation and moderation of a social experiment of housing and neighborhood relocation on alcohol use, excessive drinking, and alcohol dependence, among adolescents and their mothers, to probe whether, why, and among whom neighborhood context earlier in life is a cause of alcohol use across 15 years. This knowledge will inform the next generation of alcohol prevention policies. Because of its experimental design, results will inform causal pathways and potential intervention points, including during childhood, by which to reduce the population burden of alcohol use.                ",Mediators and Moderators of a Neighborhood Experiment on Alcohol Use,9015709,R21AA024530,"['Adolescence', 'Adolescent', 'Adult', 'Adverse effects', 'Affect', 'Alcohol consumption', 'Alcohol dependence', 'Alcohol or Other Drugs use', 'Alcohols', 'Child', 'Childhood', 'Cities', 'Complement', 'Crime', 'Data', 'Data Analyses', 'Data Compromising', 'Data Set', 'Dependence', 'Development', 'Disease', 'Elements', 'Exhibits', 'Experimental Designs', 'Exposure to', 'Family', 'Female', 'Female Adolescents', 'Foundations', 'Fright', 'Health', 'Heavy Drinking', 'Household Heads', 'Housing', 'Individual', 'Intervention', 'Investments', 'Knowledge', 'Lead', 'Life', 'Low income', 'Machine Learning', 'Male Adolescents', 'Mediating', 'Mediation', 'Mediator of activation protein', 'Mental Health', 'Methods', 'Minority', 'Modeling', 'Modification', 'Mothers', 'Neighborhoods', 'Outcome', 'Outcome Measure', 'Pathway interactions', 'Pharmaceutical Preparations', 'Policies', 'Population', 'Poverty', 'Randomized', 'Research', 'Research Personnel', 'Residential Mobility', 'Risk', 'Safety', 'Sampling', 'Shapes', 'Son', 'Stress', 'Subgroup', 'Techniques', 'Testing', 'Translations', 'Victimization', 'Weight', 'Work', 'Youth', 'alcohol availability', 'alcohol prevention', 'base', 'boys', 'contextual factors', 'density of AOD outlets', 'design', 'drinking', 'excessive drinking in adolescence', 'experience', 'follow-up', 'girls', 'health economics', 'innovation', 'learning strategy', 'low socioeconomic status', 'next generation', 'novel', 'public health relevance', 'research study', 'social', 'therapy design', 'transmission process', 'underage drinking', 'volunteer', 'voucher']",NIAAA,UNIVERSITY OF MINNESOTA,R21,2016,233407,0.09827255485093772
