text,title,id,project_number,terms,administration,organization,mechanism,year,funding,score
"(PQA4) GPS exposure to environments & relations with biomarkers of cancer risk     DESCRIPTION (provided by applicant): Physical inactivity, an unhealthy diet, and obesity are related to breast and colon cancer directly and through insulin and inflammation pathways. Greater access to healthy environments in residential neighborhoods is associated with higher physical activity (PA), a healthier diet, lower BMI, and in one study lower insulin resistance. Despite some significant findings, the effect sizes in built environment research have been small likely because of a mismatch between the environment assessed (home neighborhoods only) and location where the behaviors occur. Temporal variation in behaviors and locations within and across days has also been ignored. We propose to advance methods of cancer risk exposure assessment by measuring both neighborhood access and total environment exposure to healthy environments by dynamically integrating Global Positioning System (GPS) data with Geographical Information System (GIS) data. We hypothesize that dynamic GPS based measures of environmental exposure will be more strongly related to behavior and insulin and inflammation biomarkers than static addressed based GIS measures of access. We will study a large sample of adults (N=700), 40-75 years old, who have lived at their residence at least one year. We will recruit participants from census blocks specially selected to vary by income, walkability, and food environments to ensure environmental variability not achieved in a random sample. We will ensure balanced recruitment by census block type (walkability & food environments) across ethnicity, gender, age, and season. Half the sample will be Hispanic to explore potential interaction effects by ethnicity. Participants will complete surveys about their PA, sedentary behavior, environmental perceptions, self-selection, cancer risk, and demographics. PA and sedentary behavior will also be assessed by accelerometry and Machine Learning techniques will be employed to objectively identify specific behaviors likely related to the built environment e.g. walking, biking, riding in a car, screen time etc. Participants will complete the ASA 24 to assess diet, total calories and fat calories. A subsample (N=50) will wear a SenseCam to assess social context, validate GIS built environment measures, and validate the Machine Learned categories. Dynamic GIS measures of exposure will be created from 7 day person worn GPS data matched to GIS indicators of supportive PA and food environments (e.g. parks, walkable streets, fresh produce markets etc.) weighted by time, speed, transportation mode and features of the environment e.g. parcel size. Static residential GIS buffers of access to neighborhood resources will be created within a 1km street network buffer around a participant's home. Using multilevel statistical models adjusting for clustering, we will investigate whether GPS based Dynamic GIS measures of exposure to healthy food and PA supportive environments are more strongly associated with breast and colon cancer risk factors - including behaviors (PA, sedentary behavior, & diet), BMI, and biomarkers of insulin resistance and inflammation (e.g. CRP, IL-6, HOMA-IR) than Static GIS measures of access to neighborhood resources.         PUBLIC HEALTH RELEVANCE:  Where people spend their time during the day may be related to their risk of getting cancer. Previous studies have only looked at places near to home. This project will assess behaviors in different locations across the day and relate exposure to different environments to biological outcomes such as insulin resistance.",(PQA4) GPS exposure to environments & relations with biomarkers of cancer risk,8722512,R01CA179977,"['Address', 'Adult', 'Age', 'Behavior', 'Biological', 'Biological Markers', 'Buffers', 'Calories', 'Categories', 'Censuses', 'Child', 'Code', 'Colon Carcinoma', 'Data', 'Devices', 'Diet', 'Eating', 'Ensure', 'Environment', 'Environmental Exposure', 'Equilibrium', 'Ethnic Origin', 'Exposure to', 'Fatty acid glycerol esters', 'Food', 'Gender', 'Health', 'Health Food', 'Hispanics', 'Home environment', 'Image', 'Income', 'Inflammation', 'Information Systems', 'Insulin', 'Insulin Resistance', 'Interleukin-6', 'Life', 'Location', 'Machine Learning', 'Malignant Neoplasms', 'Marketing', 'Measures', 'Methods', 'Neighborhoods', 'Obesity', 'Outcome', 'Participant', 'Pathway interactions', 'Patient Self-Report', 'Persons', 'Pharmaceutical Preparations', 'Physical Function', 'Physical activity', 'Positioning Attribute', 'Recreation', 'Recruitment Activity', 'Research', 'Resources', 'Restaurants', 'Risk', 'Risk Factors', 'Sampling', 'Seasons', 'Self Perception', 'Social Behavior', 'Social Environment', 'Social Interaction', 'Speed', 'Statistical Models', 'Surveys', 'System', 'Techniques', 'Text', 'Time', 'Transportation', 'Variant', 'Walking', 'Weight', 'base', 'cancer risk', 'demographics', 'density', 'fast food', 'food environment', 'good diet', 'inflammatory marker', 'land use', 'learned behavior', 'malignant breast neoplasm', 'novel', 'public health relevance', 'residence', 'sedentary', 'sugar', 'tv watching']",NCI,"UNIVERSITY OF CALIFORNIA, SAN DIEGO",R01,2014,715557,0.16758200526810496
"(PQA4) GPS exposure to environments & relations with biomarkers of cancer risk     DESCRIPTION (provided by applicant): Physical inactivity, an unhealthy diet, and obesity are related to breast and colon cancer directly and through insulin and inflammation pathways. Greater access to healthy environments in residential neighborhoods is associated with higher physical activity (PA), a healthier diet, lower BMI, and in one study lower insulin resistance. Despite some significant findings, the effect sizes in built environment research have been small likely because of a mismatch between the environment assessed (home neighborhoods only) and location where the behaviors occur. Temporal variation in behaviors and locations within and across days has also been ignored. We propose to advance methods of cancer risk exposure assessment by measuring both neighborhood access and total environment exposure to healthy environments by dynamically integrating Global Positioning System (GPS) data with Geographical Information System (GIS) data. We hypothesize that dynamic GPS based measures of environmental exposure will be more strongly related to behavior and insulin and inflammation biomarkers than static addressed based GIS measures of access. We will study a large sample of adults (N=700), 40-75 years old, who have lived at their residence at least one year. We will recruit participants from census blocks specially selected to vary by income, walkability, and food environments to ensure environmental variability not achieved in a random sample. We will ensure balanced recruitment by census block type (walkability & food environments) across ethnicity, gender, age, and season. Half the sample will be Hispanic to explore potential interaction effects by ethnicity. Participants will complete surveys about their PA, sedentary behavior, environmental perceptions, self-selection, cancer risk, and demographics. PA and sedentary behavior will also be assessed by accelerometry and Machine Learning techniques will be employed to objectively identify specific behaviors likely related to the built environment e.g. walking, biking, riding in a car, screen time etc. Participants will complete the ASA 24 to assess diet, total calories and fat calories. A subsample (N=50) will wear a SenseCam to assess social context, validate GIS built environment measures, and validate the Machine Learned categories. Dynamic GIS measures of exposure will be created from 7 day person worn GPS data matched to GIS indicators of supportive PA and food environments (e.g. parks, walkable streets, fresh produce markets etc.) weighted by time, speed, transportation mode and features of the environment e.g. parcel size. Static residential GIS buffers of access to neighborhood resources will be created within a 1km street network buffer around a participant's home. Using multilevel statistical models adjusting for clustering, we will investigate whether GPS based Dynamic GIS measures of exposure to healthy food and PA supportive environments are more strongly associated with breast and colon cancer risk factors - including behaviors (PA, sedentary behavior, & diet), BMI, and biomarkers of insulin resistance and inflammation (e.g. CRP, IL-6, HOMA-IR) than Static GIS measures of access to neighborhood resources.         PUBLIC HEALTH RELEVANCE:  Where people spend their time during the day may be related to their risk of getting cancer. Previous studies have only looked at places near to home. This project will assess behaviors in different locations across the day and relate exposure to different environments to biological outcomes such as insulin resistance.                ",(PQA4) GPS exposure to environments & relations with biomarkers of cancer risk,8590146,R01CA179977,"['Address', 'Adult', 'Age', 'Behavior', 'Biological', 'Biological Markers', 'Buffers', 'Calories', 'Categories', 'Censuses', 'Child', 'Code', 'Colon Carcinoma', 'Data', 'Devices', 'Diet', 'Eating', 'Ensure', 'Environment', 'Environmental Exposure', 'Equilibrium', 'Ethnic Origin', 'Exposure to', 'Fatty acid glycerol esters', 'Food', 'Gender', 'Health', 'Health Food', 'Hispanics', 'Home environment', 'Image', 'Income', 'Inflammation', 'Information Systems', 'Insulin', 'Insulin Resistance', 'Interleukin-6', 'Life', 'Location', 'Machine Learning', 'Malignant Neoplasms', 'Marketing', 'Measures', 'Methods', 'Neighborhoods', 'Obesity', 'Outcome', 'Participant', 'Pathway interactions', 'Patient Self-Report', 'Persons', 'Pharmaceutical Preparations', 'Physical Function', 'Physical activity', 'Positioning Attribute', 'Recreation', 'Recruitment Activity', 'Research', 'Resources', 'Restaurants', 'Risk', 'Risk Factors', 'Sampling', 'Seasons', 'Self Perception', 'Social Behavior', 'Social Environment', 'Social Interaction', 'Speed', 'Statistical Models', 'Surveys', 'System', 'Techniques', 'Text', 'Time', 'Transportation', 'Variant', 'Walking', 'Weight', 'base', 'cancer risk', 'demographics', 'density', 'fast food', 'food environment', 'good diet', 'inflammatory marker', 'land use', 'learned behavior', 'malignant breast neoplasm', 'novel', 'public health relevance', 'residence', 'sedentary', 'sugar', 'tv watching']",NCI,"UNIVERSITY OF CALIFORNIA, SAN DIEGO",R01,2013,733604,0.16758200526810496
"Built Environment, Pedestrian Injuries and Deep Learning (BEPIDL) Study PROJECT SUMMARY Road traffic injuries are a major contributor to the burden of disease globally with nearly 1.3 million deaths globally and as many as 50 million injured annually with pedestrians and cyclists in low and middle-income countries (LMICs) among the most affected. Road infrastructure of the built environment (e.g., sidewalks), neighborhood design (e.g., street connectivity) and urban development (e.g., urban sprawl) are key determinants of the risk of pedestrian injuries. In LMICs, poor road infrastructure and neighborhood design are acknowledged as being important contributors to rising numbers of road traffic injuries and deaths, but there are few studies systematically identifying and quantifying what specific features of the built environment are contributing to motor vehicle collisions in these settings. Within LMIC cities, there are often large disparities where infrastructure is improved that reflect socioeconomic characteristics, leading to health inequities in road traffic injury. The paucity of georeferenced data on the built environment in LMICs has made research on road traffic injuries more difficult, though recent advances in computer vision and image analysis combined with Big Data of publicly available, georeferenced, images of roads worldwide (e.g., Google Street View, GSV) can help overcome the paucity of data and the cost and time limitations of collecting and analyzing data on the built environment in LMICs. Automated image analysis has largely been made possible via deep learning, a subfield of artificial intelligence and machine learning and relies on training neural networks to detect and label specific objects within images. These methods can drastically reduce the barriers to citywide built environment and traffic safety research in LMIC cities, thus substantially increasing research capacity and generalizability. My career goal is to become an independent investigator in global urban health with a focus on road safety and the built environment in LMICs. I propose undertaking research and training in deep learning methods applied to public health in the setting of Bogota, Colombia: 1) Develop neural networks to create a database of BE features of the road infrastructure from image data and to create neighborhood typologies from those features; 2) Assess the association between neighborhood-level BE features and typologies and pedestrian collisions and fatalities and road safety perceptions; 3) Assess the association of neighborhood social environment characteristics with pedestrian collision and fatalities, perceptions, and BE features and typologies. I am seeking additional training in 1) developing competency in deep learning methods applied to public health; 2) creating neighborhood indictors and typologies of health and the built environment; 3) applying Bayesian spatiotemporal models to understand how neighborhood characteristics and typologies influence health; 4) develop skills in multi-country collaboration, grant writing and overseeing research projects in LMICs. PROJECT NARRATIVE Roads and neighborhoods with a built environment that support safe and active transportation are a major priority in low- and middle-income countries (LMICs) due to 90% of road traffic deaths occurring in these locations, especially to pedestrians and other vulnerable road users, yet data on key built environment features at a large scale are not always readily available in these settings. My career goal is to improve population health by examining the effects of the built environment and transportation on health through the adoption and use of methods that can leverage Big Data sources and answer complex, multilevel research questions by overcoming the lack of built environment data in LMICs. The proposed research uses deep learning and advanced statistical methods to create a citywide dataset of built and social environment features in Bogota, Colombia that will provide crucial data to answer questions of their impact on pedestrian injuries and deaths, as well as assessing the presence of health inequities in their distribution and that will lay the groundwork to expand these efforts to more cities in Latin America and other LMICs.","Built Environment, Pedestrian Injuries and Deep Learning (BEPIDL) Study",10123391,K01TW011782,"['Adopted', 'Adoption', 'Affect', 'Artificial Intelligence', 'Big Data', 'Cessation of life', 'Characteristics', 'Cities', 'Classification', 'Collaborations', 'Colombia', 'Competence', 'Complex', 'Computer Vision Systems', 'Country', 'Data', 'Data Analyses', 'Data Collection', 'Data Set', 'Data Sources', 'Databases', 'Discipline', 'Education', 'Future', 'Goals', 'Grant', 'Health', 'Human', 'Image', 'Image Analysis', 'Infrastructure', 'Injury', 'Label', 'Latin America', 'Lead', 'Location', 'Machine Learning', 'Mathematics', 'Mentors', 'Methods', 'Modeling', 'Neighborhoods', 'Perception', 'Persons', 'Public Health', 'Research', 'Research Methodology', 'Research Personnel', 'Research Project Grants', 'Research Training', 'Risk', 'Safety', 'Social Environment', 'Statistical Methods', 'Time', 'Training', 'Transportation', 'Typology', 'Urban Developments', 'Urban Health', 'Vehicle crash', 'Writing', 'automated image analysis', 'built environment', 'burden of illness', 'career', 'career development', 'computer science', 'cost', 'data infrastructure', 'deep learning', 'design', 'digital imaging', 'experience', 'high risk', 'improved', 'injured', 'learning strategy', 'low and middle-income countries', 'neighborhood association', 'neural network', 'pedestrian injury', 'population health', 'skills', 'social', 'socioeconomics', 'spatiotemporal', 'virtual']",FIC,DREXEL UNIVERSITY,K01,2020,138024,0.16171131954648013
"Neighborhood Looking Glass: 360 Degree Automated Characterization of the Built Environment for Neighborhood Effects Research PROJECT SUMMARY/ABSTRACT This proposal represents a vertical advancement in neighborhood effects research, producing for the first time, national neighborhood indicators of the built environment. Thus far, only local studies have been conducted due to the resource-intensive nature of site visits to conduct assessments of community features and also manual annotations of street images. With the recent advancement of computer vision and the emergence of massive sources of image data, we will leverage our team’s abilities to develop a data collection strategy utilizing geographic information systems to assemble a national collection of Google Street View images of all road intersections and street segments in the United States. We will utilize this data bank, and develop informatics algorithms to produce neighborhood summaries of built environment that have been theoretically and empirically identified to be important for health outcomes. After the creation of Neighborhood Looking Glass, we will conduct investigations into the impact of neighborhood environments on health utilizing medical records from hundreds of thousands of patients and accounting for predisposing characteristics in analyses. Our investigative team—comprised of experts in the field of epidemiology, computer vision, bioinformatics, and computer science—is uniquely suited to implement the study aims. Our Specific Aims are: 1) Develop informatics techniques to produce neighborhood quality indicators; 2) Measure the accuracy of data algorithms and construct an interactive geoportal for neighborhood data visualization and data sharing, 3) Utilize Neighborhood Looking Glass and a large collection of medical records from Intermountain Healthcare to investigate neighborhood influences on the risk of obesity and substance abuse. The epidemic rise in chronic health conditions is recent and as such suggests its cause is social, cultural, and constructed rather than purely biological. Thus, we have the possibility of intervening on the environment to better support health. Recent studies suggest that the current cohort of young adults may face historically high cardiovascular disease risk and chronic disease burden. Our substantive investigation of the impact of neighborhood factors on chronic conditions will contribute further to the understanding of contextual influences on the health of this cohort at the forefront of a chronic disease epidemic. Moreover, the dramatic rise in overdoses, accidental poisonings, and mental health issues contributing to premature mortality warrants further investigation into risk-inducing environmental factors for substance abuse. Neighborhood Looking Glass will be a significant benefit to neighborhood effects researchers, harnessing the largely untapped potential of street image data to capture built environment characteristics. Results can be utilized to inform population-based strategies to reduce health disparities and improve health. Project Narrative/Relevance to Public Health The epidemic rise in obesity, related chronic diseases, and substance abuse in recent decades signal the importance of structural forces and social processes, but the dearth of data on contextual factors limits the investigation of multilevel effects on health. The development of the Neighborhood Looking Glass will be a significant benefit to neighborhood effects researchers, harnessing the largely untapped potential of street image data to capture built environment characteristics with potential impact on health. Results from our project can be utilized to inform system-wide and local strategies to improve community health.",Neighborhood Looking Glass: 360 Degree Automated Characterization of the Built Environment for Neighborhood Effects Research,9979947,R01LM012849,"['Accounting', 'Alcohol or Other Drugs use', 'Algorithms', 'Bioinformatics', 'Biological', 'Characteristics', 'Chronic', 'Chronic Disease', 'Cities', 'Collection', 'Communities', 'Community Health', 'Computer Vision Systems', 'Consumption', 'Data', 'Data Collection', 'Data Sources', 'Development', 'Disease', 'Environment', 'Environmental Risk Factor', 'Epidemic', 'Epidemiology', 'Face', 'Family', 'Food', 'Food Access', 'Geographic Information Systems', 'Geography', 'Glass', 'Grant', 'Happiness', 'Health', 'Health Food', 'Health Personnel', 'Health behavior', 'Health care facility', 'Healthcare', 'Image', 'Individual', 'Informatics', 'Investigation', 'Label', 'Literature', 'Manuals', 'Measures', 'Medical Records', 'Mental Health', 'Methods', 'Nature', 'Neighborhoods', 'Obesity', 'Outcome', 'Overdose', 'Patients', 'Physical activity', 'Physical environment', 'Premature Mortality', 'Process', 'Public Health', 'Quality Indicator', 'Research', 'Research Personnel', 'Resources', 'Risk', 'Sampling', 'Signal Transduction', 'Site Visit', 'Social Environment', 'Social Processes', 'Source', 'Structure', 'Substance abuse problem', 'System', 'Techniques', 'Testing', 'Time', 'United States', 'Visit', 'built environment', 'burden of illness', 'cardiovascular disorder risk', 'cohort', 'computer science', 'contextual factors', 'convolutional neural network', 'cost', 'crowdsourcing', 'data management', 'data mining', 'data resource', 'data sharing', 'data visualization', 'data warehouse', 'density', 'health care availability', 'health disparity', 'improved', 'land use', 'obesity risk', 'object recognition', 'physical conditioning', 'population based', 'social', 'social media', 'walkability', 'young adult']",NLM,"UNIV OF MARYLAND, COLLEGE PARK",R01,2020,329703,0.35966169408907606
