text,title,id,project_number,terms,administration,organization,mechanism,year,funding,score
"Placental RNA Expression as a Function of Gestational Age and Environmental Exposures Project Summary/Abstract  The placenta is an essential organ in human development, and disruption of its function can result in problems in pregnancy including miscarriage, preterm labor, preeclampsia and intrauterine growth restriction. Additionally, disrupted placenta function during pregnancy has been associated with a great number of disorders and diseases that do not present until much later in the offspring's life such as metabolic syndrome, cardiovascular diseases, developmental delay and other neurodevelopmental and psychiatric disorders. How the exposures encountered in the environment drive alterations in placenta structure and function is poorly understood, and placenta function is difficult to assess in vivo using noninvasive methods. We propose to understand how gene expression is altered in the placenta during gestation by noninvasively characterizing the placenta transcriptome in association with exposure to chemicals known to alter endocrine signaling. These chemicals, called phthalates, are commonly found in a variety of commercial products such as plastics and personal care products, and phthalate exposure has also been shown to effect neurodevelopment. The link between phthalate exposure and placenta gene expression in vivo is not yet clear; therefore we have assembled a team comprised of neuroscientists, placenta biologists, environmental epidemiologists, and genomics experts do address how phthalate exposure and gestational age effects gene that are expressed in the placenta but not in other tissues. One of the advantages of the proposed research is that we will assess placenta gene expression noninvasively through RNA molecules contained in extracellular vesicles that are secreted into the urine of pregnant women. Collecting gene expression data and chemical exposure data from urine is highly clinically relevant, and we expect our approach will have clear translational applications just as home pregnancy tests that rely on the detection of placenta produced hormones in urine have become common. Our proposed study will provide the basic science background for the development of rapid, noninvasive tests for assessing placenta function, chemical exposures, and ultimately problems in neurodevelopment and other danger signals during pregnancy. Project Narrative  The proposed research will collect genome wide placenta gene expression data from 50 pregnant women at three time points during gestation. In addition to assessing gene expression differences the proposed research will develop methods to noninvasively determine placenta-originating transcripts among all transcripts existing in the urine of pregnant women. The proposed research will also compare gene expression to endocrine disrupting chemicals known to cause health problems.",Placental RNA Expression as a Function of Gestational Age and Environmental Exposures,9197555,R21ES027878,"['Accounting', 'Address', 'Archives', 'Basic Science', 'Biological', 'Biological Assay', 'Biology', 'Blood Circulation', 'Candidate Disease Gene', 'Cardiovascular Diseases', 'Cells', 'Chemical Exposure', 'Chemicals', 'Chorionic Gonadotropin', 'Collection', 'Conceptus', 'Corticotropin-Releasing Hormone', 'Data', 'Detection', 'Development', 'Developmental Delay Disorders', 'Diethylhexyl Phthalate', 'Disease', 'Endocrine', 'Endocrine Disruptors', 'Endothelial Cells', 'Environment', 'Environmental Epidemiology', 'Environmental Exposure', 'Epidemiologist', 'Exposure to', 'Fetal Growth Retardation', 'Functional disorder', 'Future', 'Gene Expression', 'Genes', 'Genetic Transcription', 'Genomics', 'Gestational Age', 'Goals', 'Health', 'Home environment', 'Hormones', 'Human', 'Human Development', 'Illinois', 'Libraries', 'Life', 'Link', 'Liquid substance', 'Machine Learning', 'Measures', 'Mediating', 'Mental disorders', 'Messenger RNA', 'Metabolic syndrome', 'Methods', 'MicroRNAs', 'Monitor', 'Morbidity - disease rate', 'Mothers', 'Nature', 'Neurodevelopmental Disorder', 'Organ', 'Outcome', 'Outcome Measure', 'Participant', 'Pattern', 'Peptides', 'Placenta', 'Placentation', 'Population', 'Pre-Eclampsia', 'Pregnancy', 'Pregnancy Tests', 'Pregnant Women', 'Premature Birth', 'Premature Labor', 'Procedures', 'RNA', 'Reporting', 'Research', 'Role', 'Sampling', 'Signal Transduction', 'Small RNA', 'Source', 'Spontaneous abortion', 'Stromal Cells', 'Structure', 'Surrogate Markers', 'Syncytiotrophoblast', 'Syndrome', 'Techniques', 'Testing', 'Time', 'Tissues', 'Transcript', 'Urine', 'Uterine cavity', 'Villous', 'abstracting', 'age effect', 'base', 'cell type', 'clinically relevant', 'cohort', 'cytotrophoblast', 'design', 'developmental toxicology', 'extracellular vesicles', 'genome-wide', 'in vivo', 'interest', 'mortality', 'multidisciplinary', 'neonatal morbidity', 'neurodevelopment', 'novel', 'offspring', 'perinatal morbidity', 'personal care products', 'phthalates', 'postnatal', 'prenatal', 'response', 'study population', 'transcriptome', 'transcriptome sequencing', 'urinary']",NIEHS,UNIVERSITY OF ILLINOIS AT URBANA-CHAMPAIGN,R21,2016,245727,0.02965616836097915
"Elucidating the Role of the Genetic and Environmental Determinants of Preterm Birth Using Integrative Computational Approaches ABSTRACT Given the wealth and availability of genomic and environmental exposure data, computational methods provide a powerful opportunity to identify population-specific determinants of disease. Proper treatment of data types emerging from a diverse set of molecular and environmental profiling technologies cannot be analyzed using traditional statistical routines and new computational approaches are needed. In line with the President's Precision Medicine Initiative, the goal of this proposal is to develop computational methods and integrate large- scale genetic and environmental exposure datasets to elucidate factors that affect preterm birth (PTB) in diverse populations. Preterm birth, or the delivery of an infant prior to 37 weeks of gestation, is a major health concern. Infants born prematurely, comprising of about 12% of the US newborns, have elevated risks of neonatal mortality and a wide array of health problems. Preterm birth rates vary among different ethnic groups, with frequencies significantly elevated in African Americans and moderately elevated in Hispanics in comparison to Europeans. Environmental and socioeconomic factors alone may not explain these disparities and despite the evidence for a genetic basis to preterm birth, to date no causal genetic variants have been identified. In this proposal I aim to leverage the rich genetic and environmental variation data and develop computational approaches to advance our understanding of biology of preterm birth as it relates to all populations. To that extent, I propose three aims. In aim 1, I will develop computational methods to identify and validate novel genetic factors for preterm birth by genome-wide association (GWA) study in diverse ethnic populations. I obtained a comprehensive set of publicly available PTB case and control datasets consisting of ethnically diverse mothers and babies including 3,500 cases and nearly 16,000 controls from dbGAP and will carry out an ancestry-based case-control GWA study to identify genetic factors influencing PTB. In aim 2, I will develop analytical methodology to identify environmental and socioeconomic factors that impact preterm birth in diverse ethnic populations. I propose to integrate linked California State databases covering over 3 million births across diverse populations with geographical location data and pollution levels and UV exposure data from the Environmental Protection Agency in order to identify whether these exposures play a role in contributing to population-specific PTB risk. In aim 3, I will carry out integrative data analysis and build computational models in order to identify population specific interactions between the genetic and environmental factors affecting PTB risk. I hypothesize that gene-environment interactions contribute to population differences in preterm birth risk following environmental exposures. The proposed work will allow us to learn more about the etiology PTB, but could also be extended to other phenotypes of interest. This project is the logical next step for the study of the interaction of genetics and environment in the context of disease, which can be used to inform precise population-specific diagnostic and therapeutic strategies. PROJECT NARRATIVE Given the wealth and availability of genomic and environmental exposure data, computational methods provide a powerful opportunity to identify population-specific determinants of disease. The goal of this proposal is to develop computational approaches to integrate diverse genetic and environmental exposure datasets to elucidate factors that affect disease in diverse populations and apply them to the study of preterm birth. The methodology developed as part of this proposal can be extended and applied to other phenotypes of interest and inform precise population-specific diagnostic and therapeutic strategies.",Elucidating the Role of the Genetic and Environmental Determinants of Preterm Birth Using Integrative Computational Approaches,9163426,K01LM012381,"['37 weeks gestation', 'Advisory Committees', 'Affect', 'African American', 'Air Pollution', 'Animals', 'Behavior', 'Bioinformatics', 'Biological', 'Biology', 'Birth', 'Birth Rate', 'California', 'Candidate Disease Gene', 'Child', 'Computer Simulation', 'Computing Methodologies', 'Data', 'Data Analyses', 'Data Set', 'Databases', 'Diagnostic', 'Disease', 'Drug usage', 'Ecology', 'Environment', 'Environmental Exposure', 'Environmental Risk Factor', 'Ethnic group', 'Etiology', 'European', 'Family', 'Food', 'Frequencies', 'Genetic', 'Genetic Determinism', 'Genetic study', 'Genome', 'Genomics', 'Genotype', 'Geographic Locations', 'Goals', 'Health', 'Heritability', 'High Prevalence', 'Hispanics', 'Immunity', 'Individual', 'Infant', 'Investigation', 'Knowledge', 'Latino', 'Learning', 'Life Style', 'Link', 'Low Prevalence', 'Machine Learning', 'Mass Spectrum Analysis', 'Mentors', 'Methodology', 'Methods', 'Molecular', 'Mothers', 'Neonatal Mortality', 'Neonatology', 'Newborn Infant', 'Nutrient', 'Particulate', 'Pathway interactions', 'Phenotype', 'Play', 'Pollution', 'Population', 'Population Heterogeneity', 'Precision Medicine Initiative', 'Pregnancy', 'Premature Birth', 'Premature Infant', 'Prevalence', 'Research Personnel', 'Risk', 'Role', 'Signal Transduction', 'Smoking', 'Societies', 'Socioeconomic Factors', 'Stress', 'Subgroup', 'Technology', 'Therapeutic', 'Training Activity', 'Twin Studies', 'UV Radiation Exposure', 'United States Environmental Protection Agency', 'Variant', 'Work', 'admixture mapping', 'base', 'case control', 'cohort', 'economic cost', 'ethnic diversity', 'gene environment interaction', 'genetic variant', 'genome wide association study', 'improved', 'interest', 'non-genetic', 'novel', 'precision medicine', 'racial and ethnic', 'statistics']",NLM,"UNIVERSITY OF CALIFORNIA, SAN FRANCISCO",K01,2016,176920,0.06089885897213127
"A Direct Reading Video Assessment Instrument for Repetitive Motion Stress Project Summary/ Abstract This research studies if computer vision can more effectively evaluate worker exposure and assess the associated risk for work related injuries than conventional methods. Current methods involve either observations or measurements using instruments attached to a worker's hands or arms. Observation is often considered too subjective or inaccurate, and instruments too invasive or time consuming for routine applications in industry. Automated job analysis potentially offers a more objective, accurate, repeatable, and efficient exposure assessment tool than observational analysis. Computer vision uses less resources than instruments attached to workers and does not interfere with production; can quantify more exposure variables and interactions; is suitable for long-term, direct reading exposure assessment; and offers animated data visualizations synchronized with video for identifying aspects of jobs needing interventions. This research leverages the research from coordinated multi-institutional prospective studies of upper limb work related MSD conducted between 2001 and 2010 that studied production and service workers from a variety of US industries, and used rigorous case-criteria and individual-level exposure assessments prospectively, including recording detailed videos of the work. Our study partners from the National Institute for Occupational Safety and Health, the Washington State Labor & Industries Safety & Health Assessment & Research for Prevention program and the University of California-San Francisco will provide task-level videos, associated exposure variable data, and prospective health outcomes for 1,649 workers. Exposure properties directly measured from videos of jobs and corresponding health outcomes from the prospective study database will establish dose-response relationships to translate into a prototype automated job analysis instrument. We build on our previous success in developing video marker-less hand motion algorithms for estimating the ACGIH hand activity level, and reliable video processing methods for hand tracking under challenging viewing conditions. This proposal will refine and develop additional video algorithms, and analyze the videos to extract exposure measures for repetition, posture, exertions, and their interactions. The video extracted exposure measures will be compared against conventional observational exposure measures made by our collaborators. Video and corresponding observational data will be merged with the prospective health outcomes data to evaluate dose-response and to develop and validate parsimonious exposure risk models for an automated direct reading repetitive motion instrument. We will test if automation has better predictive capability than observation and also consider the accuracy and utility of computer vision analysis against conventional job analysis for selected industrial jobs. This proposal addresses the NIOSH cross-sector programs in Musculoskeletal Disorders as well as in Exposure Assessment. This translational research is in concurrence with the Research to Practice (r2P) initiative by developing technology to disseminate knowledge from recent NIOSH sponsored prospective studies on MSDs. Project Narrative  Upper extremity musculoskeletal injuries are common in hand intensive work involving highly repetitive motions  and exertions and impose a significant socioeconomic burden and substantial personal toll on health,  prosperity and wellbeing.  This proposal investigates a practical approach for exposure assessment of jobs that  can be implemented non-­invasively in the workplace and provide direct reading quantitative measures for  evaluation, prevention and control.   ",A Direct Reading Video Assessment Instrument for Repetitive Motion Stress,9174992,R01OH011024,[' '],NIOSH,UNIVERSITY OF WISCONSIN-MADISON,R01,2016,475542,0.0851838487016715
"White Matter Damage in Subconcussive Blast Exposure DESCRIPTION (provided by applicant): Exposure to explosive forces (primary blast) emanating from bombs and other devices is common in recent military personnel from the conflicts in Iraq and Afghanistan. Clinicians and experts have established minimum symptom criteria for diagnosis of mild TBI including altered sensorium (e.g. feeling dazed and confused), loss of consciousness (LOC), and amnesia following exposure to blast or impact. Diffusion Tensor Imaging (DTI) has demonstrated that these symptoms are associated with white matter damage. However, little attention has been given to investigating white matter following asymptomatic exposure to repetitive blast. Relatedly, several recent studies report white matter damage in elite athletes following repetitive impacts despite the absence of concussive symptoms.  Our goal is to assess damage to white matter and impairments in cognitive performance in recent military personnel with primary blast exposure without clinical symptoms of TBI (subconcussive blast exposure).  Animal models of blast support systemic mechanisms of white matter damage such as neuroinflammatory and neurotoxic processes that are likely to result in diffuse and widespread tissue injury that is spatially heterogeneous among affected individuals. We will use methods for quantifying spatially heterogeneous damage to white matter damage that are more sensitive than conventional voxelwise or region-of-interest approaches. We anticipate comparable white matter damage in a subconcussive blast exposed group and a mild TBI group that will be significantly greater than in blast- unexposed subjects. We will use a machine learning approach to generalize knowledge about the magnitude of white matter in clinically established cases of mild TBI. We will then test this knowledge (validation) to make diagnostic predictions for new cases, particularly blast-exposed individuals, who lack a clinical diagnosis of TBI.  We will assess the association between spatially distributed injury to white matter and other measures including, gray matter volume, resting-state functional connectivity, cognitive performance, and symptoms of PTSD and depression. If we confirm our key predictions that tissue damage, cognitive impairment, and functional quality of life changes result from subconcussive blast exposure, it would argue for an augmentation of the established approach for making clinical symptom-based diagnoses of mild TBI with neuroimaging-based diagnostic criteria. The results would further imply that many blast-exposed individuals with chronic symptoms (e.g. mood symptoms, fatigue, inattention) are being incorrectly diagnosed with other conditions (e.g. depression, PTSD) in the absence of acute clinical diagnosis of TBI. Validation of our approach on a large scale including translation to civilian subconcussive exposure (e.g. sports), would argue for implementing advanced diffusion imaging and analytic techniques in the clinical setting. PUBLIC HEALTH RELEVANCE: The majority of mild traumatic brain injury (TBI) cases from recent military conflicts involve exposure to explosive forces (primary blast) emanating from bombs and other devices. Whereas, Diffusion Tensor Imaging (DTI) has demonstrated disruption of brain tissue in cases that meet the minimum symptom criteria for clinical diagnosis of mild TBI, the consequences of blast exposure that is insufficient to meet these criteria is unknown.  We will investigate damage resulting to brain tissue from exposure to ""subconcussive"" blast.",White Matter Damage in Subconcussive Blast Exposure,8917308,R01NS086885,"['Acute', 'Affect', 'Afghanistan', 'Amnesia', 'Animal Model', 'Attention', 'Blast Cell', 'Brain', 'Chronic', 'Climacteric', 'Clinical', 'Conflict (Psychology)', 'Conscious', 'Data', 'Devices', 'Diagnosis', 'Diagnostic', 'Diffuse', 'Diffusion', 'Diffusion Magnetic Resonance Imaging', 'Dose', 'Exposure to', 'Fatigue', 'Feeling', 'Frequencies', 'Goals', 'Health', 'Heterogeneity', 'Human', 'Image', 'Impaired cognition', 'Impairment', 'Individual', 'Injury', 'Iraq', 'Kinetics', 'Knowledge', 'Location', 'Machine Learning', 'Measures', 'Mechanics', 'Mental Depression', 'Methods', 'Military Personnel', 'Moods', 'Pattern', 'Performance', 'Post-Traumatic Stress Disorders', 'Process', 'Quality of life', 'Reporting', 'Rest', 'Sports', 'Structure', 'Symptoms', 'System', 'Techniques', 'Testing', 'Tissues', 'Translations', 'Traumatic Brain Injury', 'Unconscious State', 'Validation', 'base', 'brain tissue', 'clinical Diagnosis', 'cognitive performance', 'cognitive task', 'executive function', 'gray matter', 'inattention', 'interest', 'meetings', 'mild traumatic brain injury', 'neuroimaging', 'neurotoxic', 'novel', 'response', 'white matter', 'white matter damage']",NINDS,DUKE UNIVERSITY,R01,2015,347813,0.08300560522046489
"National Exposure Assessment Laboratory at Emory ﻿    DESCRIPTION (provided by applicant): The vision for the U2C National Exposure Assessment Laboratory at Emory (NEALE) is to provide the children's health research community with access to state-of-the-art analysis of environmental factors related to health and disease. In addition to providing data, the NEALE will provide context for the results including detailed methodology, sample processing, data analysis flow, rigorous quality control/assurance and assistance with interpretation. Building upon infrastructure established as part of the exposome-based NIEHS P30, the Emory team is ideally suited to pursue the type of research described in the U2C RFA. The overarching goal of the NEAL at Emory is to provide comprehensive and reproducible data on environmental exposures and the corresponding biological responses for the children's health research community. The NEAL at Emory will achieve its goal by pursuing the following objectives: Objective 1. Help articulate and promote the vision of the early-life exposome to the children's health research community. Objective 2. Conduct targeted analysis on samples provided from children's health studies. Emory has extensive experience with performing targeted analysis of chemicals in large human studies (GC/MS, GC-MS/MS, HPLC/MS, HPLC/MS/MS, ICP-MS, and FT- HRMS). Objective 3. Conduct untargeted analysis on samples provided from children's health studies using a high-resolution metabolomics platform. Emory has been at the forefront of method development with Fourier transform-high resolution mass spectrometry-based metabolomics. Objective 4. Analyze samples from children's health studies using a suite of up- to-date assays designed to measure the biological responses to external influences that impact children's health. Objective 5. Develop and integrate novel approaches into the NEAL at Emory. The Developmental Research Resource will promote the development of novel approaches for the measurement of environmental mediators of children's health. This will include, but not be limited to, development of new methodologies for sample collection, development of targeted methods for newly emerging environmental chemicals, adoption of existing techniques to measurement of biological response, and integration and consolidation of existing platforms to reduce costs and increase throughput. Objective 6. Serve as a conduit for the receipt of samples from the CHEAR Coordinating Center and the transfer of data to the CHEAR Data Core.         PUBLIC HEALTH RELEVANCE: The National Exposure Assessment Laboratory at Emory is designed to support children's health research as it relates to environmental exposures. Expert services in mass spectrometry for targeted and untargeted analysis, as well as measures of biological responses will be provided to investigators under the direction of the CHEAR Coordinating Center.            ",National Exposure Assessment Laboratory at Emory,9062178,U2CES026560,"['Adoption', 'Award', 'Behavior', 'Bioinformatics', 'Biological', 'Biological Assay', 'Biometry', 'Books', 'Chemicals', 'Child health care', 'Childhood', 'Communities', 'Core Facility', 'Data', 'Data Analyses', 'Databases', 'Development', 'Disease', 'Engineering', 'Environment', 'Environmental Exposure', 'Environmental Risk Factor', 'Epigenetic Process', 'Fourier Transform', 'Goals', 'Health', 'High Pressure Liquid Chromatography', 'Homeostasis', 'Human', 'Inductively Coupled Plasma Mass Spectrometry', 'International', 'Laboratories', 'Life', 'Machine Learning', 'Mass Spectrum Analysis', 'Measurement', 'Measures', 'Mediator of activation protein', 'Melissa', 'Methodology', 'Methods', 'Mutation', 'National Institute of Environmental Health Sciences', 'Outcome', 'Oxidation-Reduction', 'Process', 'Quality Control', 'Research', 'Research Infrastructure', 'Research Personnel', 'Resolution', 'Resources', 'Sampling', 'Services', 'Systems Biology', 'Targeted Research', 'Techniques', 'Vision', 'Work', 'base', 'biomedical informatics', 'cost', 'design', 'environmental chemical', 'experience', 'metabolomics', 'method development', 'non-genetic', 'novel strategies', 'public health relevance', 'ranpirnase', 'response', 'sample collection', 'tool', 'ultra high resolution']",NIEHS,EMORY UNIVERSITY,U2C,2015,8300000,0.037568894382733316
