text,title,id,project_number,terms,administration,organization,mechanism,year,funding,score
"Health, Neighborhood Context, and Mobility Neighborhood context may be an upstream cause of economic mobility, yet few neighborhood studies are experimental, weakening causal inference and limiting policy translation. Our study proposes to analyze newly- available data from a large, federal government initiated social experiment of voluntary neighborhood relocation using housing vouchers in 5 US cities (the Moving to Opportunity, MTO, Study). Our project will test whether, how, and among whom random assignment of an offer to move to a lower-poverty neighborhood influenced the economic mobility of 4600 low-income families over a 15 year period. The goal of MTO was to interrupt the cascading effects of neighborhood poverty for minority low-income families, by increasing area- based access to opportunities, and thereby promote economic mobility. Although the MTO voucher intervention did not consistently affect economic outcomes, it did profoundly affect health. Unfortunately, health researchers have had limited access to MTO data, compromising the scientific payoff of the $70+ million investment. So as of yet, we have no clear understanding of why results might differ across outcomes, groups, or what mechanisms are at play, since few studies have tested mediation or moderation. Since health is one of the most important barriers to economic self-sufficiency among low-income parents, it is conceivable that economic and employment gains were concentrated among families who first experienced health improvements. However testing whether factors that occurred after random assignment are precursors for other outcomes is methodologically challenging. Fortunately, recent methodological developments in the epidemiology discipline offer cogent solutions to model this complexity and bound any bias. We propose secondary data analyses with newly available 15 year follow-up data from this experiment, to test whether health influenced the economic effects of the randomized MTO housing voucher treatment. Paired with this experimental design, we propose to apply innovative causal methods and machine learning techniques for assessing mediation and effect modification, to overcome limitations and potential bias of traditional approaches, and strengthen causal inference. Our R01 project builds on a productive, interdisciplinary team, experienced with the MTO data, and draws on a barriers-to-employment framework. We propose 4 aims to determine: whether the effect of MTO on economic outcomes was modified by baseline health vulnerability; whether MTO improved parental economic outcomes, if they or their children experienced health gains; whether MTO improved children’s employment and education, if they experienced health gains; whether MTO improved economic outcomes, if families moved to neighborhoods with fewer spatial barriers to employment. Our findings have direct policy relevance since they address a key policy question in housing voucher implementation: incorporating elements from non-housing sectors (e.g., health, employment, education) to promote moves to higher opportunity neighborhoods, to ultimately improve outcomes for low income families. This project will test whether health-related barriers to employment mediate and moderate the effects of a social experiment of housing and neighborhood relocation on economic mobility, among adolescents, young adults, and their mothers. This knowledge will inform the next generation of social policy, e.g., to provide guidance on augmenting housing counseling assistance services to include health-related additional program supports and cross-sectoral services (e.g. health management or substance use treatment services) for vulnerable families.","Health, Neighborhood Context, and Mobility",9712679,R01HD090014,"['Address', 'Adolescent', 'Adult', 'Affect', 'Alcohol or Other Drugs use', 'Area', 'Budgets', 'Child', 'Child Development', 'Cities', 'Counseling', 'Data', 'Data Analyses', 'Data Compromising', 'Development', 'Discipline', 'Economics', 'Education', 'Elements', 'Employment', 'Epidemiology', 'Etiology', 'Experimental Designs', 'Family', 'Family health status', 'Federal Government', 'Funding', 'Goals', 'Grant', 'Health', 'Heterogeneity', 'Housing', 'Income', 'Interruption', 'Intervention', 'Investments', 'Knowledge', 'Low income', 'Machine Learning', 'Measures', 'Mediating', 'Mediation', 'Mediator of activation protein', 'Mental Health', 'Methodology', 'Methods', 'Minority', 'Modeling', 'Modification', 'Mothers', 'Neighborhoods', 'Outcome', 'Parents', 'Participant', 'Pattern', 'Play', 'Policies', 'Poverty', 'Privatization', 'Public Housing', 'Randomized', 'Research', 'Research Personnel', 'Role', 'Services', 'Social Policies', 'Structure', 'Techniques', 'Testing', 'Translations', 'United States National Institutes of Health', 'Wages', 'Weight', 'Youth', 'base', 'cohort', 'design', 'economic outcome', 'experience', 'experimental study', 'follow-up', 'health management', 'improved', 'improved outcome', 'indexing', 'innovation', 'interdisciplinary collaboration', 'lower income families', 'next generation', 'physical conditioning', 'programs', 'social', 'treatment effect', 'treatment group', 'treatment services', 'volunteer', 'voucher', 'welfare', 'young adult']",NICHD,UNIVERSITY OF MINNESOTA,R01,2019,483010,0.28527055052445005
"Big Data and Network Analysis of Children's Health Project Summary  Decades of research suggest that neighborhood socioeconomic disadvantage increases children's health risk. This proposed project seeks to address two major weaknesses in conventional neighborhood effects research and interventions: a) the assumption that residential neighborhoods function independently of each other - ignoring that risk factors in areas where people work, learn, and play away from home may interact with residential factors; and b) as importantly, insufficient understanding of neighborhood effects mechanisms and heterogeneity in effects. To systematically address these critical barriers in the field, I propose a research and training program that will enable me to learn, use, and adapt recent advancements in Big Data analytics. I plan to model hidden interdependencies among individuals and neighborhoods and operationalize mechanisms of neighborhood effects by drawing on multiple large datasets (demographic, geospatial, networks, population flows), with several hundred million observations across multiple states, cities, and years, and match them to locally and nationally representative restricted survey data. The massive volume, great variety, and unique complexity of such data, such as relational data on inter-neighborhood dependencies and interactions, pose a challenge to the standard capabilities of hardware, algorithms, and analytical methods and models of social and population science. The proposed training program in Big Data analytics and machine learning will enable me to overcome computational and conceptual challenges and uniquely position me to: a) examine the ecological inter-neighborhood networks (econetworks) to which population groups are differentially exposed to across space and time; and b) test new contextual mechanisms underlying children's exposures to health risks. Specifically, I propose to: a) develop computational models of dynamic large scale econetworks to assess population differences in exposures to health risk factors, as they commute daily between home and workplaces; b) examine heterogeneity in econetwork effects on child health using a hybrid design that links Big Data to local and national surveys; and c) model child health risk mechanisms and causal effects using natural experiments on Big Data. The proposed training program will enable me to learn and adapt Big Data analytics, draw on its strengths, but also address some of its key limitations. With the support of a unique team of distinguished mentors and advisors, established experts in Big Data analytics, spatial demography, network analysis, child development and health risk, neighborhood change, and population heterogeneity, I will embark on a training program that will uniquely enable me to address these research goals and position me to become an independent scholar and a leader in the field. Project Narrative This project contributes to advancing public health scholarship by leveraging and adapting Big Data analytical tools to overcome critical barriers in the field related to conventional assumptions about effects of neighborhood risk exposures on child health. It addresses the need to understand and model inter- neighborhood interdependencies and underlying multidimensional social capital mechanisms in order to better understand population heterogeneity in neighborhood effects on child health across space and time. The project also advances public health through an integration of rigorous social and data science methodology to create new measures and test causal hypotheses that advance our understanding of social capital forces that foster resilience to adversity and improve child health behavior and outcomes.",Big Data and Network Analysis of Children's Health,9767837,K01HD093863,"['Address', 'Alcohol consumption', 'Area', 'Big Data', 'Big Data Methods', 'Businesses', 'Censuses', 'Child', 'Child Behavior', 'Child Development', 'Child Health', 'Child Rearing', 'Cities', 'Collaborations', 'Commuting', 'Computational Technique', 'Computer Simulation', 'Data', 'Data Analyses', 'Data Science', 'Data Set', 'Demography', 'Dependence', 'Dimensions', 'Distress', 'Drug usage', 'Exposure to', 'Fostering', 'Goals', 'Graph', 'Health', 'Health Resources', 'Health behavior outcomes', 'Heterogeneity', 'Home environment', 'Hybrids', 'Individual', 'Infrastructure', 'Intervention', 'Learning', 'Link', 'Location', 'Longitudinal Surveys', 'Machine Learning', 'Measures', 'Mentors', 'Methodology', 'Modeling', 'Natural experiment', 'Neighborhoods', 'Outcome', 'Parents', 'Participant', 'Pathway Analysis', 'Pharmaceutical Preparations', 'Play', 'Population', 'Population Group', 'Population Heterogeneity', 'Population Sciences', 'Positioning Attribute', 'Poverty', 'Pregnancy in Adolescence', 'Public Health', 'Records', 'Research', 'Research Training', 'Risk', 'Risk Behaviors', 'Risk Factors', 'Sampling', 'Scholarship', 'Schools', 'Smoking', 'Social Sciences', 'Social Work', 'Social support', 'Socioeconomic Status', 'Stress and Coping', 'Surveys', 'Testing', 'Time', 'Training Programs', 'Victimization', 'Work', 'Workplace', 'algorithmic methodologies', 'analytical method', 'analytical tool', 'base', 'boys', 'design', 'experimental study', 'improved', 'innovation', 'insight', 'low socioeconomic status', 'neighborhood disadvantage', 'population health', 'programs', 'resilience', 'social capital', 'socioeconomic disadvantage', 'theories', 'violence exposure']",NICHD,PENNSYLVANIA STATE UNIVERSITY-UNIV PARK,K01,2019,138258,0.28339497370689043
"Using a Natural Experiment to Evaluate the Long-Term Effects of Neighborhood Deprivation on Alzheimer's Disease and Vascular Risk Factors ABSTRACT  The NIA has called for social science and community-based studies to clarify risk and protective factors for Alzheimer's disease and related dementias (ADRD), particularly among racial minorities who are disproportionately affected. Place, including both neighborhood of residence and region/state of birth, has consistently been correlated with ADRD, stroke, and impaired cognitive function. Yet it is unclear whether modifiable mechanisms explain this association, or whether the association is merely due to the selection of unhealthy individuals into poor regions. The goal of this study is to produce the first quasi-experimental evidence to understand the influence of neighborhood socioeconomic deprivation on ADRD and its vascular risk factors. We take advantage of a unique natural experiment, overcoming methodological challenges in the previous literature on neighborhood effects on ADRD. From 1986 to 1998, the Danish government actively dispersed roughly 76,000 incoming refugees across the country in a nearly randomized (“quasi-random”) fashion to avoid over-crowding in major cities. This cohort includes nearly 12,000 individuals who lived until at least age 60 in Denmark during the 30-year follow-up. Over 90% of families agreed to participate in the program, creating a natural experiment in which these individuals were quasi-randomly assigned to neighborhoods with different levels of deprivation. We will employ unique data spanning over 30 years from Denmark's population and clinical registers, which provide data on sociodemographics, clinical encounters, and prescriptions for all Danish residents. We identify cases of ADRD and its vascular risk factors among this racially diverse cohort via validated techniques using ICD codes and prescription data in clinical registers. We have successfully linked these registers to detailed geocoded data sources on eight measures of neighborhood socioeconomic deprivation. In Aim 1, our goal is to test the hypothesis that neighborhood deprivation increases the incidence of ADRD later in life. In Aim 2, we will examine the effects of neighborhood deprivation on vascular risk factors for ADRD, including highly prevalent conditions that occur across the life course. In Aim 3, we will identify vulnerable subgroups whose development of ADRD and vascular risk factors differs in response to neighborhood deprivation, taking advantage of the large sample size and complete register data available on all subjects. We will employ both hypothesis-driven and hypothesis-generating statistical techniques, including innovative machine learning methods that allow for more complex and robust subgroup identification. This will enable future interventions to be tailored to the most vulnerable individuals. Overall, the expected outcome of this research is to produce rigorous evidence on the effects of neighborhood characteristics on ADRD and vascular risk factors, overcoming the methodological challenges in previous work. This will directly inform the development of clinical, community, and policy strategies to address the neighborhood determinants of ADRD among vulnerable populations who are most at-risk. PROJECT NARRATIVE  The goal of this research is to examine the effects of neighborhood deprivation on Alzheimer's dementia and its vascular risk factors. We will examine the association of specific neighborhood characteristics with Alzheimer's and its risk factors, and we will assess whether specific subgroups may be more vulnerable to neighborhood deprivation. This will inform the development of interventions to address the neighborhood factors that affect Alzheimer's disease.",Using a Natural Experiment to Evaluate the Long-Term Effects of Neighborhood Deprivation on Alzheimer's Disease and Vascular Risk Factors,9745267,R01AG063385,"['Address', 'Affect', 'Age', 'Alzheimer&apos', 's Disease', 'Alzheimer&apos', 's disease related dementia', 'Alzheimer&apos', 's disease risk', 'Attention', 'Biological Factors', 'Birth', 'Blood Vessels', 'Characteristics', 'Cities', 'Clinical', 'Communities', 'Community Developments', 'Complex', 'Country', 'Crowding', 'Data', 'Data Sources', 'Denmark', 'Development', 'Diabetes Mellitus', 'Diagnosis', 'Disadvantaged', 'Discrimination', 'Environmental Risk Factor', 'Exposure to', 'Family', 'Future', 'Gender', 'Goals', 'Government', 'Health', 'Hyperlipidemia', 'Hypertension', 'Immigrant', 'Impaired cognition', 'Incidence', 'Individual', 'International Classification of Disease Codes', 'Intervention', 'Life', 'Life Cycle Stages', 'Life Experience', 'Link', 'Literature', 'Logistics', 'Long-Term Effects', 'Machine Learning', 'Measures', 'Methodology', 'Minority Groups', 'Natural experiment', 'Neighborhoods', 'Observational Study', 'Outcome', 'Outcomes Research', 'Pathway interactions', 'Pattern', 'Policies', 'Population', 'Poverty', 'Race', 'Randomized', 'Refugees', 'Research', 'Risk', 'Risk Factors', 'Sample Size', 'Sampling', 'Schools', 'Social Sciences', 'Socialization', 'Stroke', 'Subgroup', 'Techniques', 'Testing', 'Time', 'Violence', 'Vulnerable Populations', 'Work', 'base', 'clinical development', 'cognitive function', 'cohort', 'dementia risk', 'deprivation', 'diabetes risk', 'environmental enrichment for laboratory animals', 'ethnic minority population', 'evidence base', 'experimental study', 'follow-up', 'forest', 'high risk', 'indexing', 'innovation', 'learning strategy', 'member', 'prevent', 'programs', 'protective factors', 'racial and ethnic', 'racial diversity', 'racial minority', 'residence', 'response', 'social', 'sociodemographics', 'socioeconomic disadvantage', 'socioeconomics', 'stressor', 'theories', 'therapy development', 'treatment effect', 'vascular risk factor', 'young adult']",NIA,"UNIVERSITY OF CALIFORNIA, SAN FRANCISCO",R01,2019,567836,0.312873677463704
"Neighborhood Looking Glass: 360 Degree Automated Characterization of the Built Environment for Neighborhood Effects Research PROJECT SUMMARY/ABSTRACT This proposal represents a vertical advancement in neighborhood effects research, producing for the first time, national neighborhood indicators of the built environment. Thus far, only local studies have been conducted due to the resource-intensive nature of site visits to conduct assessments of community features and also manual annotations of street images. With the recent advancement of computer vision and the emergence of massive sources of image data, we will leverage our team’s abilities to develop a data collection strategy utilizing geographic information systems to assemble a national collection of Google Street View images of all road intersections and street segments in the United States. We will utilize this data bank, and develop informatics algorithms to produce neighborhood summaries of built environment that have been theoretically and empirically identified to be important for health outcomes. After the creation of Neighborhood Looking Glass, we will conduct investigations into the impact of neighborhood environments on health utilizing medical records from hundreds of thousands of patients and accounting for predisposing characteristics in analyses. Our investigative team—comprised of experts in the field of epidemiology, computer vision, bioinformatics, and computer science—is uniquely suited to implement the study aims. Our Specific Aims are: 1) Develop informatics techniques to produce neighborhood quality indicators; 2) Measure the accuracy of data algorithms and construct an interactive geoportal for neighborhood data visualization and data sharing, 3) Utilize Neighborhood Looking Glass and a large collection of medical records from Intermountain Healthcare to investigate neighborhood influences on the risk of obesity and substance abuse. The epidemic rise in chronic health conditions is recent and as such suggests its cause is social, cultural, and constructed rather than purely biological. Thus, we have the possibility of intervening on the environment to better support health. Recent studies suggest that the current cohort of young adults may face historically high cardiovascular disease risk and chronic disease burden. Our substantive investigation of the impact of neighborhood factors on chronic conditions will contribute further to the understanding of contextual influences on the health of this cohort at the forefront of a chronic disease epidemic. Moreover, the dramatic rise in overdoses, accidental poisonings, and mental health issues contributing to premature mortality warrants further investigation into risk-inducing environmental factors for substance abuse. Neighborhood Looking Glass will be a significant benefit to neighborhood effects researchers, harnessing the largely untapped potential of street image data to capture built environment characteristics. Results can be utilized to inform population-based strategies to reduce health disparities and improve health. Project Narrative/Relevance to Public Health The epidemic rise in obesity, related chronic diseases, and substance abuse in recent decades signal the importance of structural forces and social processes, but the dearth of data on contextual factors limits the investigation of multilevel effects on health. The development of the Neighborhood Looking Glass will be a significant benefit to neighborhood effects researchers, harnessing the largely untapped potential of street image data to capture built environment characteristics with potential impact on health. Results from our project can be utilized to inform system-wide and local strategies to improve community health.",Neighborhood Looking Glass: 360 Degree Automated Characterization of the Built Environment for Neighborhood Effects Research,9756470,R01LM012849,"['Accounting', 'Alcohol or Other Drugs use', 'Algorithms', 'Bioinformatics', 'Biological', 'Characteristics', 'Chronic', 'Chronic Disease', 'Cities', 'Collection', 'Communities', 'Community Health', 'Computer Vision Systems', 'Consumption', 'Data', 'Data Collection', 'Data Sources', 'Development', 'Disease', 'Environment', 'Environmental Risk Factor', 'Epidemic', 'Epidemiology', 'Face', 'Family', 'Food', 'Food Access', 'Geographic Information Systems', 'Geography', 'Glass', 'Grant', 'Happiness', 'Health', 'Health Food', 'Health Personnel', 'Health behavior', 'Health care facility', 'Healthcare', 'Image', 'Individual', 'Informatics', 'Investigation', 'Label', 'Literature', 'Manuals', 'Measures', 'Medical Records', 'Mental Health', 'Methods', 'Nature', 'Neighborhoods', 'Obesity', 'Outcome', 'Overdose', 'Patients', 'Physical activity', 'Physical environment', 'Premature Mortality', 'Process', 'Public Health', 'Quality Indicator', 'Research', 'Research Personnel', 'Resources', 'Risk', 'Sampling', 'Signal Transduction', 'Site Visit', 'Social Environment', 'Social Processes', 'Source', 'Structure', 'Substance abuse problem', 'System', 'Techniques', 'Testing', 'Time', 'United States', 'Visit', 'built environment', 'burden of illness', 'cardiovascular disorder risk', 'cohort', 'computer science', 'contextual factors', 'convolutional neural network', 'cost', 'crowdsourcing', 'data management', 'data mining', 'data resource', 'data sharing', 'data visualization', 'data warehouse', 'density', 'health care availability', 'health disparity', 'improved', 'land use', 'obesity risk', 'object recognition', 'physical conditioning', 'population based', 'social', 'social media', 'walkability', 'young adult']",NLM,"UNIV OF MARYLAND, COLLEGE PARK",R01,2019,329730,0.35966169408907606
