text,title,id,project_number,terms,administration,organization,mechanism,year,funding,score
"A DATA SCIENCE APPROACH TO AIR TOXICS AND CHILDREN'S ENVIRONMENTAL HEALTH PROJECT SUMMARY: This proposal aims to characterize the associations between prenatal exposure to interpretable combinations of air toxics and children’s cognitive health through the efficient use of big public health data. With guidance from multidisciplinary advisors, the candidate will develop skills in data science, machine learning and advanced biostatistics to supplement her training in epidemiologic methods. This will allow her to progress in her career and advance research on combined environmental exposures and children’s health. Previous research has found associations between prenatal exposure to single air pollutants and children’s cognitive health but has lacked the ability to investigate combined impacts of multiple pollutants, including the synergistic/antagonistic interactions between pollutants that have been observed in experimental studies. Understanding the effects of combined exposures is a strategic goal of the National Institute of Environmental Health Sciences, and the field of environmental health is transitioning from single-pollutant approaches to more holistic paradigms, such as the exposome. Identifying associations and interactions within the context of high-dimensional exposure data presents a computational challenge. Methods from domains such as data science, including machine learning methods, can be incorporated into the epidemiologic toolbox for addressing environmental mixtures and multiple exposures. The goal of this Career Development Award is to advance the candidate into an independent research career at the intersection of big data science and children’s environmental health. Through formal coursework, directed learning and field rotations, the candidate will gain skills in data science, machine learning and advanced biostatistics. Mentors, advisors and consultants have been selected for their complementary expertise, relevant research experience and mentoring abilities. The proposed research will leverage the skills gained from the training plan and apply them to characterize associations between prenatal exposure to interpretable combinations of air toxics and 3rd grade standardized test scores, a school-based measure of cognitive outcomes. Residence at birth will be used to link data on air toxics, a subset of air pollutants, to an administrative data linkage of public health registries and education data for approximately 220,000 children born in New York City from 1994-1998. The candidate will develop and validate a two-stage approach of hypotheses generation followed by targeted analyses in order to identify combinations of air toxics associated with children’s test scores within the context of high-dimensional exposure data (Aim 1). Targeted analyses using well-established epidemiologic methods for effect estimation and assessment of interaction between air toxics will be performed. (Aim2) Potential mediators of the relationship between air toxics and test scores can then be identified using statistical mediation and data science approaches. (Aim 3) Completion of these aims will uniquely position the candidate to conduct future research on combined environmental exposures and children’s health. PROJECT NARRATIVE Epidemiologic studies have shown that prenatal and/or early-life exposures to ambient air pollutants are associated with multiple measures of neurodevelopment and cognition in childhood. However, most of the previous studies characterized exposure using a single pollutant, even though ambient air is a complex mixture. This study will identify the combined effects of prenatal exposure to multiple air pollutants on children's standardized test scores within a large, representative population of urban children.",A DATA SCIENCE APPROACH TO AIR TOXICS AND CHILDREN'S ENVIRONMENTAL HEALTH,9791316,R00ES027022,"['Address', 'Affect', 'Air', 'Air Pollutants', 'Algorithms', 'Big Data', 'Bioinformatics', 'Biological Monitoring', 'Biometry', 'Birth', 'Child', 'Child Health', 'Childhood', 'Cognition', 'Cognitive', 'Complex Mixtures', 'Coupled', 'Data', 'Data Linkages', 'Data Science', 'Data Set', 'Databases', 'Development Plans', 'Distal', 'Education', 'Environmental Exposure', 'Environmental Health', 'Environmental Monitoring', 'Epidemiologic Methods', 'Epidemiology', 'Exposure to', 'Future', 'Generations', 'Genetic', 'Goals', 'Health', 'Information Systems', 'Investigation', 'K-Series Research Career Programs', 'Knowledge', 'Learning', 'Link', 'Literature', 'Machine Learning', 'Measures', 'Mediating', 'Mediation', 'Mediator of activation protein', 'Mentors', 'Methodology', 'Methods', 'Modeling', 'National Institute of Environmental Health Sciences', 'New York City', 'Ontology', 'Outcome', 'Pathway interactions', 'Population', 'Positioning Attribute', 'Public Health', 'Records', 'Registries', 'Research', 'Research Personnel', 'Resources', 'Retrospective cohort', 'Rotation', 'Schools', 'Selection Bias', 'Standardization', 'Statistical Methods', 'Technical Expertise', 'Testing', 'Time', 'Training', 'Trees', 'Urban Population', 'base', 'career', 'career development', 'clinical Diagnosis', 'early life exposure', 'epidemiological model', 'epidemiology study', 'experience', 'experimental study', 'genome wide association study', 'health data', 'high dimensionality', 'learning strategy', 'multidisciplinary', 'neurodevelopment', 'pollutant', 'prenatal', 'prenatal exposure', 'random forest', 'research and development', 'residence', 'skills', 'third grade', 'urban children']",NIEHS,COLUMBIA UNIVERSITY HEALTH SCIENCES,R00,2019,246653,0.1430859754217632
"Bringing Modern Data Science Tools to Bear on Environmental Mixtures: Administrative Supplement for U3 Populations Project Summary/Abstract of the PRIME parent award: Bringing Modern Data Science Tools to Bear on Environmental Mixtures Environmental exposures often cumulate in particular geographies, and the nature of the complex mixtures that characterize these exposures remains understudied. In addition, adverse environmental exposures often occur in communities facing multiple social stressors such as deteriorating housing, inadequate access to health care, poor schools, high unemployment, crime, and poverty – all of which may compound the effects of environmental exposures. Our central objective is to develop new data architecture, statistical, and machine learning methods to assess how exposure to environmental mixtures shapes educational outcomes in the presence or absence of social stress. We focus on air pollution mixtures, childhood lead exposure, and social stressors. We will implement our proposed work in North Carolina (NC), a state characterized by diverse environmental features, industrial activities, and airsheds typified by varying pollution emission sources and resulting pollutant mixtures. To accomplish this central objective, we will first develop, document, and disseminate methods for building space-time environmental and social data architectures. We will implement this for all of NC, incorporating data on air pollution, lead exposure risk, and social exposures from 1990-2015+ (dataset 1). Second, we will refine methods for linking unrelated datasets to build a space-time child movement and outcome data architecture (dataset 2). Third, we will connect exposures (dataset 1) and outcomes (dataset 2) data via shared geography and temporality into a single, comprehensive geodatabase. Fourth, we will implement increasingly complex methods to assess the effect of environmental mixtures in the presence or absence of social stressors on early childhood educational outcomes. We will document and disseminate all of the underlying methodological work via public website. The proposed work leverages a rich array of data resources already available to the investigators (with some significantly post-processed) and allows tracking of children across space and time. Our team brings tools from modern data science (hierarchical Bayesian methods with variable selection, spatial point process models, machine learning) to bear on the critical question of how environmental mixtures shape child outcomes directly and differentially in the presence of social stress. Project Narrative Hypertensive disorders of pregnancy (HDP) are major causes of perinatal mortality and morbidity and have profound consequences for maternal and child health, but it is unclear if and how rates of HDP are changing over time, or whether neighborhood conditions (e.g., racial residential segregation) and air pollution exposure are associated with risk of developing HDP. We use detailed birth records and Bayesian spatial analysis methods to better understand how HDP rates have changed over a 20 year period (1995-2014), whether racial/ethnic disparities in HDP rates have narrowed or widened in this time frame, and if neighborhood racial segregation and air pollution exposure are associated with an individual’s HDP risk.",Bringing Modern Data Science Tools to Bear on Environmental Mixtures: Administrative Supplement for U3 Populations,9911827,R01ES028819,"['Administrative Supplement', 'Air Pollution', 'Architecture', 'Award', 'Bayesian Analysis', 'Bayesian Method', 'Birth Records', 'Child', 'Childhood', 'Communities', 'Complex', 'Complex Mixtures', 'Crime', 'Data', 'Data Science', 'Data Set', 'Environmental Exposure', 'Exposure to', 'Geography', 'Housing', 'Individual', 'Industrialization', 'Link', 'Machine Learning', 'Maternal and Child Health', 'Methodology', 'Methods', 'Modeling', 'Modernization', 'Movement', 'Nature', 'Neighborhoods', 'North Carolina', 'Outcome', 'Parents', 'Perinatal mortality demographics', 'Pollution', 'Population', 'Poverty', 'Pregnancy Rate', 'Process', 'Research Personnel', 'Risk', 'Schools', 'Shapes', 'Source', 'Time', 'Unemployment', 'Ursidae Family', 'Work', 'data resource', 'early childhood', 'health care availability', 'lead exposure', 'learning strategy', 'perinatal morbidity', 'pollutant', 'pregnancy disorder', 'racial and ethnic disparities', 'segregation', 'social', 'social stress', 'stressor', 'tool', 'web site']",NIEHS,RICE UNIVERSITY,R01,2019,117375,0.11807640689234607
"Bringing Modern Data Science Tools to Bear on Environmental Mixtures Project Summary: Bringing Modern Data Science Tools to Bear on Environmental Mixtures Environmental exposures often cumulate in particular geographies, and the nature of the complex mixtures that characterize these exposures remains understudied. In addition, adverse environmental exposures often occur in communities facing multiple social stressors such as deteriorating housing, inadequate access to health care, poor schools, high unemployment, crime, and poverty – all of which may compound the effects of environmental exposures. Our central objective is to develop new data architecture, statistical, and machine learning methods to assess how exposure to environmental mixtures shapes educational outcomes in the presence or absence of social stress. We focus on air pollution mixtures, childhood lead exposure, and social stressors. We will implement our proposed work in North Carolina (NC), a state characterized by diverse environmental features, industrial activities, and airsheds typified by varying pollution emission sources and resulting pollutant mixtures. To accomplish this central objective, we will first develop, document, and disseminate methods for building space-time environmental and social data architectures. We will implement this for all of NC, incorporating data on air pollution, lead exposure risk, and social exposures from 1990-2015+ (dataset 1). Second, we will refine methods for linking unrelated datasets to build a space-time child movement and outcome data architecture (dataset 2). Third, we will connect exposures (dataset 1) and outcomes (dataset 2) data via shared geography and temporality into a single, comprehensive geodatabase. Fourth, we will implement increasingly complex methods to assess the effect of environmental mixtures in the presence or absence of social stressors on early childhood educational outcomes. We will document and disseminate all of the underlying methodological work via public website. The proposed work leverages a rich array of data resources already available to the investigators (with some significantly post-processed) and allows tracking of children across space and time. Our team brings tools from modern data science (hierarchical Bayesian methods with variable selection, spatial point process models, machine learning) to bear on the critical question of how environmental mixtures shape child outcomes directly and differentially in the presence of social stress. Project Narrative Environmental exposure mixtures, especially when coupled with social stressors, have the potential to compromise developmental outcomes in children, but have been understudied. We will use a unique longitudinal dataset that tracks children from birth through early elementary school, in combination with new tools from modern data science, to disentangle the complex effects of these mixtures on educational outcomes.",Bringing Modern Data Science Tools to Bear on Environmental Mixtures,9626424,R01ES028819,"['Address', 'Air', 'Air Pollutants', 'Air Pollution', 'Architecture', 'Bayesian Method', 'Biological Availability', 'Biological Factors', 'Birth', 'Birth Records', 'Carbon Monoxide', 'Censuses', 'Chemicals', 'Child', 'Child Health', 'Childhood', 'Communities', 'Complex', 'Complex Mixtures', 'Computer software', 'Coupled', 'Cox Models', 'Crime', 'Data', 'Data Science', 'Data Set', 'Data Sources', 'Development', 'Environmental Exposure', 'Exposure to', 'Gaussian model', 'Genetic', 'Geography', 'Housing', 'Individual', 'Industrialization', 'Lead', 'Link', 'Machine Learning', 'Methodology', 'Methods', 'Modeling', 'Modernization', 'Mothers', 'Movement', 'Nature', 'Neighborhoods', 'Nitrogen Dioxide', 'North Carolina', 'Nursery Schools', 'Outcome', 'Outcome Measure', 'Output', 'Ozone', 'Particle Size', 'Particulate Matter', 'Personal Satisfaction', 'Pollution', 'Poverty', 'Process', 'Relative Risks', 'Research', 'Research Personnel', 'Risk', 'Schools', 'Shapes', 'Siblings', 'Social Environment', 'Source', 'Sulfur Dioxide', 'System', 'Taxes', 'Time', 'Unemployment', 'Ursidae Family', 'Validation', 'Work', 'cohort', 'data resource', 'deprivation', 'early childhood', 'elementary school', 'experience', 'flexibility', 'health care availability', 'indexing', 'lead exposure', 'learning strategy', 'longitudinal dataset', 'pollutant', 'programs', 'rural environment', 'simulation', 'social', 'social stress', 'stressor', 'tool', 'web site']",NIEHS,RICE UNIVERSITY,R01,2019,499515,0.15266789607488945
"Estimating Cholera Burden with Cross-sectional Immunologic Data Project Summary/Abstract Cholera is an acute dehydrating diarrheal disease caused by infection with Vibrio cholerae. It is endemic in over 50 countries, affecting up to 3 million people and causing more than 100,000 deaths annually. A renewed global effort to fight cholera is underway, catalyzed by the large on-going epidemic in Haiti and now aided by new generation oral cholera vaccines. Identifying key populations at high risk of cholera is essential to guide these activities. Current methods to estimate cholera burden are largely based on clinical reporting with infrequent microbiological confirmation. These methods are limited by the sporadic nature of outbreaks, poor surveillance infrastructure, and fundamental uncertainties in the number of asymptomatic or mildly symptomatic cases. Improved methods of detecting cholera exposure and risk are urgently needed. Detection of immune responses in serum (serosurveillance) can provide a new avenue for rapid and accurate estimates of cholera exposure and risk. We currently do not understand what immunological and clinical parameters are most predictive of recent exposure, nor whether immune responses in areas with different levels of endemicity are similar. In preliminary studies, we have used machine learning methods on antibody response data from cholera patients in Bangladesh to classify whether individuals had been exposed in the previous 30-, 90-, or 360-days with high sensitivity and specificity. In this application, we propose to use longitudinal antibody response kinetics, from populations with diverse genetic and epidemiologic profiles, paired with novel statistical and machine learning approaches to provide generalizable tools to estimate the incidence of exposure to Vibrio cholerae from cross sectional serosurveys. In Aim 1, we will develop models to estimate the time since exposure to Vibrio cholerae and exposure incidence from cross-sectional antibody profiles and demographic data using previously collected data from a cohort in Bangladesh. These results will allow us to identify the antibodies and demographic factors that are most useful for prediction of time-since-exposure. In Aim 2, we will collect longitudinal antibody data from a cohort of cholera cases and household contacts in Haiti to develop models for estimating exposure incidence from cross-sectional serosurveillance. This cohort will also enable us to compare the models developed for moderate/severe cases and mild/asymptomatic cases. In Aim 3, we will optimize and validate field-adapted methods to measure cholera-specific antibodies, including the use of dried blood spot and lateral flow assays. We will conduct a proof-of-concept cross-sectional serosurvey using these methods in rural Haiti. Upon the completion of these aims, we will have provided a number of new tools for measure of susceptibility to cholera in a population. These tools will have the potential to transform cholera control efforts from the current reactive strategies to proactive ones, with the potential to contribute to disease elimination. Project Narrative Cholera is a diarrheal disease affecting millions of people worldwide each year, with the majority of deaths due to cholera occurring in places with poor disease surveillance infrastructure. To optimize cholera control efforts, accurate estimates of cholera exposure and risk are needed. We propose studies using computational methods to determine how antibody decay data may help us estimate cholera exposure incidence.",Estimating Cholera Burden with Cross-sectional Immunologic Data,9703882,R01AI135115,"['Acute', 'Address', 'Affect', 'Africa', 'Antibodies', 'Antibody Response', 'Area', 'Bangladesh', 'Bangladeshi', 'Biological Assay', 'Blood', 'Caring', 'Cessation of life', 'Cholera', 'Cholera Vaccine', 'Clinical', 'Collaborations', 'Computer Simulation', 'Computing Methodologies', 'Country', 'Data', 'Decision Making', 'Demographic Factors', 'Detection', 'Development', 'Devices', 'Diarrhea', 'Disease', 'Disease Outbreaks', 'Disease Surveillance', 'Enrollment', 'Epidemic', 'Epidemiology', 'Exposure to', 'Funding', 'Future', 'Generations', 'Genetic', 'Haiti', 'Haitian', 'Health care facility', 'Health system', 'Household', 'Immune response', 'Immunologics', 'Immunology', 'Incidence', 'Individual', 'Infection', 'Infrastructure', 'Intervention', 'Joints', 'Kinetics', 'Laboratories', 'Lateral', 'Link', 'Logistics', 'Machine Learning', 'Measurement', 'Measures', 'Methods', 'Microbiology', 'Modeling', 'Nature', 'Oral', 'Patients', 'Population', 'Populations at Risk', 'Predisposition', 'Reporting', 'Research Infrastructure', 'Research Personnel', 'Resources', 'Risk', 'Rural', 'Sanitation', 'Sensitivity and Specificity', 'Serological', 'Serum', 'Specificity', 'Spottings', 'Standardization', 'Surveillance Methods', 'System', 'Time', 'Translations', 'Uncertainty', 'United States National Institutes of Health', 'Vibrio cholerae', 'Vibrio cholerae O1', 'Vibrio cholerae infection', 'Water', 'age related', 'base', 'cohort', 'diarrheal disease', 'disorder risk', 'fighting', 'high risk', 'improved', 'insight', 'learning strategy', 'novel', 'pathogen', 'predictive modeling', 'statistics', 'tool']",NIAID,UNIVERSITY OF UTAH,R01,2019,687902,0.07727479614763148
"Novel Biomarker to Identify Critical Windows of Susceptibility to Metal Mixture ﻿    DESCRIPTION (provided by applicant): Neurodevelopment and cognitive function are among the most important outcomes in public health, particularly with the rise of knowledge-based economies. While it is widely believed that the simultaneous presence of several toxic exposures can alter developmental trajectories of the central nervous system, studies designed to address mixed chemical exposures are rare, and represent a critical need in the field of public health. Multiple barriers are inherent to conducting mixtures research and must be overcome if this field is to progress. Obvious barriers include the need for large sample sizes and prospective data to assess exposure timing (i.e. critical developmental windows). Two additional barriers include exposure misclassification and lack of statistical approaches available for higher dimensional interactions. Our proposal addresses all of these barriers directly and will establish a framework for the study of chemical mixtures that can be applied broadly in environmental health. We have developed a novel biomarker that can objectively reconstruct the dose and timing of past chemical exposure using deciduous teeth. This biomarker differs from standard tooth biomarkers as it combines sophisticated histological and chemical analyses to precisely sample dentine layers corresponding to specific life stages, generating integrated, longitudinal weekly exposure estimates in the second and third trimesters and during early childhood. Our proposal will address mixed metal exposure, as a first step. We note, however, that our approach can and will be applied to organic chemicals in the future, and we are in parallel developing methods for their analysis in teeth. On another front, we will also apply cutting-edge statistical machine learning methods. In this study, we will focus on five metals/metalloids that are of public health significance, manganese (Mn), lead (Pb), arsenic (As), zinc (Zn) and cadmium (Cd). We will conduct this study in the Early Life Exposures in MExico and NeuroToxicology (ELEMENT), a prospective birth cohort using advanced methods in social science, genetics and toxicology to assess transdisciplinary risk factors impacting neurodevelopment. PUBLIC HEALTH RELEVANCE: Neurodevelopment and cognitive function are among the most important outcomes in public health. While it is widely believed that the simultaneous presence of several toxic exposures can alter developmental trajectories of the central nervous system, studies designed to address mixed chemical exposures are rare, and represent a critical need in the field of public health. The proposed program will apply a novel dental biomarker of exposure to multiple chemicals and cutting-edge statistical methods to identify specific life stages including perinatal periods that correspond to increased susceptibility to neurodevelopmental effects of metal toxicant mixtures.",Novel Biomarker to Identify Critical Windows of Susceptibility to Metal Mixture,9767585,R01ES026033,"['8 year old', 'Address', 'Affect', 'Arsenic', 'Biological Markers', 'Birth', 'Cadmium', 'Chemical Exposure', 'Chemicals', 'Child', 'Childhood', 'Cohort Studies', 'Complex', 'Data', 'Data Analyses', 'Data Set', 'Dental', 'Development', 'Dimensions', 'Dose', 'Educational workshop', 'Environment', 'Environmental Health', 'Exposure to', 'Funding', 'Future', 'Goals', 'Health', 'Histologic', 'Institutes', 'Lead', 'Life', 'Machine Learning', 'Manganese', 'Metal exposure', 'Metals', 'Methodology', 'Methods', 'Mexico', 'Modeling', 'National Institute of Environmental Health Sciences', 'Neuraxis', 'Neurodevelopmental Deficit', 'Nutrient', 'Organic Chemicals', 'Outcome', 'Phenotype', 'Predisposition', 'Process', 'Public Health', 'Publishing', 'Recording of previous events', 'Research', 'Research Design', 'Risk Factors', 'Sample Size', 'Sampling', 'Second Pregnancy Trimester', 'Social Sciences', 'Statistical Methods', 'Sum', 'Techniques', 'Testing', 'Third Pregnancy Trimester', 'Time', 'Tooth structure', 'Toxicant exposure', 'Toxicogenetics', 'Work', 'Zinc', 'cognitive function', 'cohort', 'cost', 'deciduous tooth', 'developmental neurotoxicity', 'early childhood', 'early life exposure', 'experience', 'high dimensionality', 'knowledge base', 'learning strategy', 'neurodevelopment', 'neurotoxic', 'neurotoxicology', 'novel', 'novel marker', 'perinatal period', 'programs', 'prospective', 'public health relevance', 'response', 'synergism', 'tool', 'toxicant']",NIEHS,ICAHN SCHOOL OF MEDICINE AT MOUNT SINAI,R01,2019,608605,0.16331684332654503
