text,title,id,project_number,terms,administration,organization,mechanism,year,funding,score
"Social Determinants of Health and Novel Prediction of Cardiovascular Health from Young Adulthood to Middle Age in the CARDIA Study Project Summary In the U.S., approximately 840,000 Americans die from cardiovascular disease (CVD) each year. The prevalence of CVD is on the rise and widespread disparities in CVD exist across economic, racial, and ethnic groups. In order to address the rising prevalence of CVD and persistent disparities, there has been a shift in focus to public health strategies addressing cardiovascular health (CVH). CVH is a broader and more positive construct beyond the absence of CVD. Despite this recent focus on improving CVH, widespread disparities still exist. Social determinants of health (SDOH) may be important contributors to these continued disparities. The World Health Organization (WHO) defines SDOH as the “structural determinants and conditions in which people are born, grow, live, work, and age.” There has been limited work in studying how a diverse set of SDOH change over time and perform in the prediction of CVH. To address this need, we will identify patterns of SDOH exposure over time and determine if the addition of SDOH variables allows for better prediction of an individual's CVH status. The primary hypothesis is that a diverse set of SDOH will be associated with and improve the prediction of CVH, independent of baseline CVH and other covariates. To examine this hypothesis, we will pursue the following Specific Aims: 1) identify patterns of SDOH exposure up to age 50 and define exposure subgroups and 2) determine whether overall and domain-specific patterns of SDOH exposures from young adulthood to middle age, identified in Aim 1, are associated with and improve the prediction of CVH and its component metrics. We will utilize the Coronary Artery Risk Development in Young Adults (CARDIA) study, a prospective cohort study with detailed information on cardiovascular risk factors and disease in a geographically and racially diverse sample of young adults. In Aim 1, we will use a novel sequential pattern mining method to identify the associations among SDOH and determine the SDOH exposure patterns from baseline to age 50. The Aim 1 SDOH exposure definitions will be included as predictors of CVH at age 50 and beyond using supervised machine learning techniques. By including SDOH in predictive models, health services professionals and clinicians may have an improved understanding of patients at high-risk for low CVH and may better tailor social and clinical interventions to each patient's needs. If awarded, this fellowship will allow me to contribute novel research to the SDOH and cardiovascular health fields, gain competency in new research skills, and improve my writing and presentation skills. The completion of this project and training will prepare me for my long-term career goal of becoming an independent research scientist in an academic setting, studying SDOH and using data science and informatics tools to improve public health. Project Narrative The incorporation of social determinants of health (SDOH) in predictive models for cardiovascular health (CVH) may help health services professionals and clinicians in identifying patients at high-risk for low CVH. This has important public health implications because social and clinical interventions may be tailored to each patient's needs. This research may also help to identify which SDOH are predictive of CVH from young adulthood to middle age, allowing public health professionals to target specific SDOH through directed social, behavioral, and policy-related interventions.",Social Determinants of Health and Novel Prediction of Cardiovascular Health from Young Adulthood to Middle Age in the CARDIA Study,9911103,F31HL151178,"['Accounting', 'Address', 'Age', 'American', 'American Heart Association', 'Award', 'Behavior', 'Behavioral', 'Blood Pressure', 'Body mass index', 'Cardiovascular Diseases', 'Cause of Death', 'Cessation of life', 'Cholesterol', 'Clinical', 'Communities', 'Competence', 'Coronary Artery Risk Development in Young Adults Study', 'Data', 'Data Science', 'Disease', 'Economics', 'Education', 'Environment', 'Epidemiology', 'Ethnic group', 'Event', 'Fellowship', 'Geography', 'Goals', 'Health', 'Health Professional', 'Health Services', 'Health Status', 'Health behavior', 'Healthcare', 'Individual', 'Intervention', 'Life', 'Life Cycle Stages', 'Link', 'Machine Learning', 'Maintenance', 'Measures', 'Mediating', 'Methods', 'Mining', 'Modeling', 'Morbidity - disease rate', 'Neighborhoods', 'Patients', 'Pattern', 'Performance', 'Phenotype', 'Physical activity', 'Policies', 'Population', 'Predictive Analytics', 'Prevalence', 'Prospective cohort study', 'Public Health', 'Race', 'Research', 'Research Training', 'Risk Behaviors', 'Risk Factors', 'Sampling', 'Scientist', 'Site', 'Smoking Status', 'Social Identification', 'Socioeconomic Factors', 'Stroke', 'Structure', 'Subgroup', 'Techniques', 'Time', 'Training', 'Work', 'World Health Organization', 'Writing', 'age group', 'base', 'biracial', 'built environment', 'burden of illness', 'cardiovascular health', 'cardiovascular risk factor', 'career', 'cohort', 'fasting plasma glucose', 'good diet', 'health disparity', 'health economics', 'high risk', 'improved', 'informatics tool', 'machine learning algorithm', 'machine learning method', 'middle age', 'mortality', 'novel', 'patient population', 'predictive modeling', 'programs', 'racial difference', 'racial diversity', 'secondary analysis', 'sex', 'skills', 'social', 'social factors', 'social health determinants', 'supervised learning', 'theories', 'training opportunity', 'young adult']",NHLBI,NORTHWESTERN UNIVERSITY AT CHICAGO,F31,2020,40733,0.03366255845297819
"The Impact of Temperature and Pollution on Mortality, Morbidity, and Health Care Cost Among the Elderly OTHER PROJECT INFORMATION – Project Summary/Abstract Determinants of Vulnerability to Environmental Stress Among the Elderly ADRD Population As individuals live longer, healthier lives, the number of people living with, and dying from, Alzheimer’s Disease (AD) has risen. AD prevalence and mortality are expected to continue to rise in the future. However, while AD is fatal and individuals living with AD have high mortality rates, their immediate cause of death is usually respiratory disease or ischemic heart disease rather than dementia. Consequently, improving the health and quality of life of people living with ADRD depends on understanding their vulnerability to these diseases, and how these conditions interact with their dementia. Our proposed study focuses on the determinants of health and mortality among those in the Medicare population who have been identified as living with ADRD. Because cardiovascular and respiratory diseases have been identified as frequent causes of death among the ADRD population, we focus on an environmental stressor that increases the likelihood of death due to cardiovascular and respiratory causes: acute exposure to air pollution. Using a large dataset of Medicare beneficiaries and machine-learning techniques applied to quasi-random variation in pollution exposure generated by changes in local wind direction, we find that acute exposure to air pollution increases mortality risk for only about one quarter of the elderly. While individuals living with ADRD are much more likely to be in this vulnerable group than the typical Medicare beneficiary, we find that acute air pollution exposure does not increase mortality risk for a large fraction (44%) of Medicare beneficiaries living with ADRD. In this study, we will apply machine learning and “big data” techniques to Medicare administrative data, local characteristics, and atmospheric variables in order to understand why some individuals living with ADRD suffer harm from the increased cardiovascular and respiratory stress induced by air pollution exposure while others do not. These factors, once identified and verified in continuing research, will provide guidance that can improve the health and quality of life of individuals living with ADRD by better directing resources to those most in need and guiding interventions aimed at reducing vulnerability to these and other hazards. As part of the project, we will develop a publicly available database that provides the following data at the ZIP code level: ADRD prevalence, vulnerability to air pollution exposure among the ADRD population, and ZIP code level characteristics that have been shown to affect vulnerability. Other researchers can then use this data for any other study seeking to understand the effects of geographically defined factors or policies on the ADRD population. OTHER PROJECT INFORMATION – Project Narrative While Alzheimer’s disease is a fatal form of dementia, the top two immediate causes of death for people with Alzheimer’s disease are respiratory illness (55.5%) and ischemic heart disease (23.1%), which are both exacerbated by exposure to environmental hazards such as air pollution. In this study, we will apply machine learning and “big data” techniques to Medicare administrative data in order to identify risk factors that predict vulnerability to the harmful effects of pollution exposure for individuals living with ADRD, allowing for better targeting of resources to those most in need and contributing to the improvement of interventions aimed at reducing vulnerability to these and other hazards.","The Impact of Temperature and Pollution on Mortality, Morbidity, and Health Care Cost Among the Elderly",10123225,R01AG053350,"['Acute', 'Affect', 'Air Pollution', 'Alzheimer&apos', 's Disease', 'Alzheimer&apos', 's disease related dementia', 'Big Data', 'Cardiovascular Diseases', 'Cardiovascular system', 'Cause of Death', 'Cessation of life', 'Characteristics', 'Code', 'Data', 'Databases', 'Dementia', 'Disease', 'Elderly', 'Environmental Hazards', 'Environmental Wind', 'Exposure to', 'Future', 'Geography', 'Health', 'Health Care Costs', 'Individual', 'Intervention', 'Lung diseases', 'Machine Learning', 'Medicare', 'Morbidity - disease rate', 'Myocardial Ischemia', 'Policies', 'Pollution', 'Population', 'Predictive Factor', 'Prevalence', 'Quality of life', 'Research', 'Research Personnel', 'Resources', 'Risk Factors', 'Stress', 'Techniques', 'Temperature', 'Variant', 'Vulnerable Populations', 'beneficiary', 'environmental stressor', 'hazard', 'improved', 'large datasets', 'mortality', 'mortality risk', 'respiratory']",NIA,NATIONAL BUREAU OF ECONOMIC RESEARCH,R01,2020,376508,-0.012584645605323115
"Novel Biomarker to Identify Critical Windows of Susceptibility to Metal Mixture ﻿    DESCRIPTION (provided by applicant): Neurodevelopment and cognitive function are among the most important outcomes in public health, particularly with the rise of knowledge-based economies. While it is widely believed that the simultaneous presence of several toxic exposures can alter developmental trajectories of the central nervous system, studies designed to address mixed chemical exposures are rare, and represent a critical need in the field of public health. Multiple barriers are inherent to conducting mixtures research and must be overcome if this field is to progress. Obvious barriers include the need for large sample sizes and prospective data to assess exposure timing (i.e. critical developmental windows). Two additional barriers include exposure misclassification and lack of statistical approaches available for higher dimensional interactions. Our proposal addresses all of these barriers directly and will establish a framework for the study of chemical mixtures that can be applied broadly in environmental health. We have developed a novel biomarker that can objectively reconstruct the dose and timing of past chemical exposure using deciduous teeth. This biomarker differs from standard tooth biomarkers as it combines sophisticated histological and chemical analyses to precisely sample dentine layers corresponding to specific life stages, generating integrated, longitudinal weekly exposure estimates in the second and third trimesters and during early childhood. Our proposal will address mixed metal exposure, as a first step. We note, however, that our approach can and will be applied to organic chemicals in the future, and we are in parallel developing methods for their analysis in teeth. On another front, we will also apply cutting-edge statistical machine learning methods. In this study, we will focus on five metals/metalloids that are of public health significance, manganese (Mn), lead (Pb), arsenic (As), zinc (Zn) and cadmium (Cd). We will conduct this study in the Early Life Exposures in MExico and NeuroToxicology (ELEMENT), a prospective birth cohort using advanced methods in social science, genetics and toxicology to assess transdisciplinary risk factors impacting neurodevelopment. PUBLIC HEALTH RELEVANCE: Neurodevelopment and cognitive function are among the most important outcomes in public health. While it is widely believed that the simultaneous presence of several toxic exposures can alter developmental trajectories of the central nervous system, studies designed to address mixed chemical exposures are rare, and represent a critical need in the field of public health. The proposed program will apply a novel dental biomarker of exposure to multiple chemicals and cutting-edge statistical methods to identify specific life stages including perinatal periods that correspond to increased susceptibility to neurodevelopmental effects of metal toxicant mixtures.",Novel Biomarker to Identify Critical Windows of Susceptibility to Metal Mixture,10005934,R01ES026033,"['8 year old', 'Address', 'Affect', 'Arsenic', 'Biological Markers', 'Birth', 'Cadmium', 'Chemical Exposure', 'Chemicals', 'Child', 'Childhood', 'Cohort Studies', 'Complex', 'Data', 'Data Analyses', 'Data Set', 'Dental', 'Development', 'Dimensions', 'Dose', 'Educational workshop', 'Environment', 'Environmental Health', 'Exposure to', 'Funding', 'Future', 'Goals', 'Health', 'Histologic', 'Institutes', 'Lead', 'Life', 'Manganese', 'Metal exposure', 'Metals', 'Methodology', 'Methods', 'Mexico', 'Modeling', 'National Institute of Environmental Health Sciences', 'Neuraxis', 'Neurodevelopmental Deficit', 'Nutrient', 'Organic Chemicals', 'Outcome', 'Phenotype', 'Predisposition', 'Process', 'Public Health', 'Publishing', 'Recording of previous events', 'Research', 'Research Design', 'Risk Factors', 'Sample Size', 'Sampling', 'Second Pregnancy Trimester', 'Social Sciences', 'Statistical Methods', 'Sum', 'Techniques', 'Testing', 'Third Pregnancy Trimester', 'Time', 'Tooth structure', 'Toxicant exposure', 'Toxicogenetics', 'Work', 'Zinc', 'cognitive function', 'cohort', 'cost', 'deciduous tooth', 'developmental neurotoxicity', 'early childhood', 'early life exposure', 'experience', 'high dimensionality', 'knowledge base', 'machine learning method', 'neurodevelopment', 'neurodevelopmental effect', 'neurotoxic', 'neurotoxicology', 'novel', 'novel marker', 'perinatal period', 'programs', 'prospective', 'public health relevance', 'response', 'statistical and machine learning', 'synergism', 'tool', 'toxicant']",NIEHS,ICAHN SCHOOL OF MEDICINE AT MOUNT SINAI,R01,2020,604973,0.16331684332654503
"Role of the gut microbiome in pesticide-induced effects on child neurodevelopment SUMMARY Pesticides are pervasive in our environment, and have accumulated in drinking water reserves serving millions of people worldwide, causing growing concern since the potential adverse health effects are not fully understood. In 2017 alone, the world used about 6.8 million tons of pesticides, of which the world's largest usage is in China and the United States. More recently it has been discovered that pesticides have strong effects on microbial communities, extinguishing entire clades while promoting growth in others. Shifts in microbial composition have been associated with brain development, mood and behavior suggesting a strong link between the gut and the brain. We hypothesize that there may exist an unappreciated microbiome component to the adverse health effects of pesticide exposure. In this proposal, we will use a comprehensive approach to identify the microbial components of pesticide susceptibility to neurodevelopmental delay. Specifically, in Aim 1 we will investigate the impact of prenatal exposure to 11 targeted pesticides on child neurodevelopment in a large well-defined human Mother and Child Microbiome Cohort (MCMC) consisting of 3000 mother and child pairs. Study participants are currently followed up regularly until the children reach 4 years of age. Comprehensive artificial intelligence analysis of pesticide exposure and children's early neurodevelopment data will identify key pesticides that negatively impact child development. In Aim 2, we hypothesize that prenatal exposure to pesticides can shift the composition of the GM and subsequently lead to abnormal neurodevelopment. We will integrate the child gut microbiome data with maternal pesticide exposure during pregnancy and child neurodevelopment data to investigate the impact of prenatal exposure to targeted pesticides on child gut microbiome and development. This Aim will identify specific gut bacteria or clades associated with child neurodevelopment. In Aim 3, we will use conventional and germ-free mouse models to elucidate mechanisms by which pesticide exposure can affect the gut microbiome and behavior. Conventionally housed pregnant mice will be exposed to pesticides and the gut microbiome and behavior (anxiety, memory, motor performance, social interaction) will be analyzed in their offspring. Also, germ-free mice will be colonized with specific bacteria or bacterial clades to study the causality of the impact of the GM on behavior. The long-term implications for human health are significant – it may be possible to increase tolerance/robustness to pesticide exposure by providing sensitive individuals with probiotics that have select degradation pathways. Moreover, this understanding is important in order to formulate novel preventive strategies including educating health practitioners, families, and public health providers and organizations regarding the potential risks of environmental exposures. PROJECT NARRATIVE Chemical and toxic substances, such as herbicides and pesticides pose some of the most common threats to environmental and human health. Our studies are designed to identify effects of prenatal pesticide exposure on child neurodevelopment and the role of the gut microbiome in mediating pesticide-induced adverse health effects. Findings of our study will ultimately result in precision risk assessment and precision prevention strategies to improve human health worldwide.",Role of the gut microbiome in pesticide-induced effects on child neurodevelopment,9879567,R01ES031322,"['16S ribosomal RNA sequencing', '4 year old', 'Affect', 'Anxiety', 'Artificial Intelligence', 'Atrazine', 'Bacteria', 'Behavior', 'Behavioral', 'Bioinformatics', 'Biological', 'Birth', 'Brain', 'C57BL/6 Mouse', 'Chemical Exposure', 'Chemicals', 'Child', 'Child Development', 'Child Health', 'China', 'Chinese People', 'Chlorpyrifos', 'Data', 'Data Collection', 'Degradation Pathway', 'Development', 'Developmental Delay Disorders', 'Diet', 'Dose', 'Environment', 'Environmental Exposure', 'Environmental Risk Factor', 'Etiology', 'Exposure to', 'Failure', 'Family health status', 'Food Supply', 'Germ-Free', 'Gnotobiotic', 'Growth', 'Health', 'Health Personnel', 'Herbicides', 'Human', 'Immunologic Deficiency Syndromes', 'Individual', 'Industrialization', 'Insecticides', 'Intervention', 'Lead', 'Life', 'Link', 'Manuscripts', 'Measures', 'Mediating', 'Medical', 'Memory', 'Moods', 'Mothers', 'Motor', 'Mus', 'Organ', 'Outcome', 'Paraquat', 'Participant', 'Pathway interactions', 'Pentachlorophenol', 'Performance', 'Pesticides', 'Phenotype', 'Phorate', 'Physiology', 'Play', 'Poison', 'Predisposition', 'Pregnancy', 'Pregnant Women', 'Prevention strategy', 'Probiotics', 'Public Health', 'Risk', 'Risk Assessment', 'Role', 'Sampling', 'Second Pregnancy Trimester', 'Serum', 'Social Interaction', 'Structure', 'Taxonomy', 'Testing', 'Toxic effect', 'United States', 'Universities', 'Validation', 'Water Supply', 'acaricide', 'biological systems', 'body system', 'brain tissue', 'carcinogenesis', 'cognitive performance', 'cohort', 'design', 'drinking water', 'experimental study', 'follow-up', 'glyphosate', 'gut bacteria', 'gut microbiome', 'gut microbiota', 'health organization', 'high risk', 'improved', 'individual variation', 'individualized prevention', 'microbial', 'microbial community', 'microbiome', 'microbiome analysis', 'microbiome components', 'microbiome composition', 'microbiome sequencing', 'motor behavior', 'mouse model', 'neurodevelopment', 'novel', 'offspring', 'pesticide exposure', 'predictive modeling', 'pregnant', 'prenatal', 'prenatal environmental exposure', 'prenatal exposure', 'recruit', 'response', 'risk prediction model', 'sample collection', 'transcriptome sequencing']",NIEHS,UNIVERSITY OF CALIF-LAWRENC BERKELEY LAB,R01,2020,282150,0.05439106029113751
