text,title,id,project_number,terms,administration,organization,mechanism,year,funding,score
"Big Data and Network Analysis of Children's Health Project Summary  Decades of research suggest that neighborhood socioeconomic disadvantage increases children's health risk. This proposed project seeks to address two major weaknesses in conventional neighborhood effects research and interventions: a) the assumption that residential neighborhoods function independently of each other - ignoring that risk factors in areas where people work, learn, and play away from home may interact with residential factors; and b) as importantly, insufficient understanding of neighborhood effects mechanisms and heterogeneity in effects. To systematically address these critical barriers in the field, I propose a research and training program that will enable me to learn, use, and adapt recent advancements in Big Data analytics. I plan to model hidden interdependencies among individuals and neighborhoods and operationalize mechanisms of neighborhood effects by drawing on multiple large datasets (demographic, geospatial, networks, population flows), with several hundred million observations across multiple states, cities, and years, and match them to locally and nationally representative restricted survey data. The massive volume, great variety, and unique complexity of such data, such as relational data on inter-neighborhood dependencies and interactions, pose a challenge to the standard capabilities of hardware, algorithms, and analytical methods and models of social and population science. The proposed training program in Big Data analytics and machine learning will enable me to overcome computational and conceptual challenges and uniquely position me to: a) examine the ecological inter-neighborhood networks (econetworks) to which population groups are differentially exposed to across space and time; and b) test new contextual mechanisms underlying children's exposures to health risks. Specifically, I propose to: a) develop computational models of dynamic large scale econetworks to assess population differences in exposures to health risk factors, as they commute daily between home and workplaces; b) examine heterogeneity in econetwork effects on child health using a hybrid design that links Big Data to local and national surveys; and c) model child health risk mechanisms and causal effects using natural experiments on Big Data. The proposed training program will enable me to learn and adapt Big Data analytics, draw on its strengths, but also address some of its key limitations. With the support of a unique team of distinguished mentors and advisors, established experts in Big Data analytics, spatial demography, network analysis, child development and health risk, neighborhood change, and population heterogeneity, I will embark on a training program that will uniquely enable me to address these research goals and position me to become an independent scholar and a leader in the field. Project Narrative This project contributes to advancing public health scholarship by leveraging and adapting Big Data analytical tools to overcome critical barriers in the field related to conventional assumptions about effects of neighborhood risk exposures on child health. It addresses the need to understand and model inter- neighborhood interdependencies and underlying multidimensional social capital mechanisms in order to better understand population heterogeneity in neighborhood effects on child health across space and time. The project also advances public health through an integration of rigorous social and data science methodology to create new measures and test causal hypotheses that advance our understanding of social capital forces that foster resilience to adversity and improve child health behavior and outcomes.",Big Data and Network Analysis of Children's Health,9569278,K01HD093863,"['Address', 'Alcohol consumption', 'Area', 'Big Data', 'Businesses', 'Censuses', 'Child', 'Child Behavior', 'Child Development', 'Child Health', 'Child Rearing', 'Cities', 'Collaborations', 'Commuting', 'Computational Technique', 'Computer Simulation', 'Data', 'Data Analyses', 'Data Analytics', 'Data Science', 'Data Set', 'Demography', 'Dependence', 'Dimensions', 'Distress', 'Drug usage', 'Exposure to', 'Fostering', 'Goals', 'Graph', 'Health', 'Health Resources', 'Health behavior outcomes', 'Heterogeneity', 'Home environment', 'Hybrids', 'Individual', 'Intervention', 'Learning', 'Link', 'Location', 'Longitudinal Surveys', 'Machine Learning', 'Measures', 'Mentors', 'Methodology', 'Modeling', 'Natural experiment', 'Neighborhoods', 'Outcome', 'Parents', 'Participant', 'Pathway Analysis', 'Pharmaceutical Preparations', 'Play', 'Population', 'Population Group', 'Population Heterogeneity', 'Population Sciences', 'Positioning Attribute', 'Poverty', 'Pregnancy in Adolescence', 'Public Health', 'Records', 'Research', 'Research Infrastructure', 'Research Training', 'Risk', 'Risk Behaviors', 'Risk Factors', 'Sampling', 'Scholarship', 'Schools', 'Smoking', 'Social Sciences', 'Social Work', 'Social support', 'Socioeconomic Status', 'Stress and Coping', 'Surveys', 'Testing', 'Time', 'Training Programs', 'Victimization', 'Work', 'Workplace', 'algorithmic methodologies', 'analytical method', 'analytical tool', 'base', 'boys', 'design', 'experimental study', 'improved', 'innovation', 'insight', 'low socioeconomic status', 'neighborhood disadvantage', 'population health', 'programs', 'resilience', 'social capital', 'socioeconomic disadvantage', 'theories', 'violence exposure']",NICHD,PENNSYLVANIA STATE UNIVERSITY-UNIV PARK,K01,2018,139005,0.28339497370689043
"Neighborhood Looking Glass: 360 Degree Automated Characterization of the Built Environment for Neighborhood Effects Research PROJECT SUMMARY/ABSTRACT This proposal represents a vertical advancement in neighborhood effects research, producing for the first time, national neighborhood indicators of the built environment. Thus far, only local studies have been conducted due to the resource-intensive nature of site visits to conduct assessments of community features and also manual annotations of street images. With the recent advancement of computer vision and the emergence of massive sources of image data, we will leverage our team’s abilities to develop a data collection strategy utilizing geographic information systems to assemble a national collection of Google Street View images of all road intersections and street segments in the United States. We will utilize this data bank, and develop informatics algorithms to produce neighborhood summaries of built environment that have been theoretically and empirically identified to be important for health outcomes. After the creation of Neighborhood Looking Glass, we will conduct investigations into the impact of neighborhood environments on health utilizing medical records from hundreds of thousands of patients and accounting for predisposing characteristics in analyses. Our investigative team—comprised of experts in the field of epidemiology, computer vision, bioinformatics, and computer science—is uniquely suited to implement the study aims. Our Specific Aims are: 1) Develop informatics techniques to produce neighborhood quality indicators; 2) Measure the accuracy of data algorithms and construct an interactive geoportal for neighborhood data visualization and data sharing, 3) Utilize Neighborhood Looking Glass and a large collection of medical records from Intermountain Healthcare to investigate neighborhood influences on the risk of obesity and substance abuse. The epidemic rise in chronic health conditions is recent and as such suggests its cause is social, cultural, and constructed rather than purely biological. Thus, we have the possibility of intervening on the environment to better support health. Recent studies suggest that the current cohort of young adults may face historically high cardiovascular disease risk and chronic disease burden. Our substantive investigation of the impact of neighborhood factors on chronic conditions will contribute further to the understanding of contextual influences on the health of this cohort at the forefront of a chronic disease epidemic. Moreover, the dramatic rise in overdoses, accidental poisonings, and mental health issues contributing to premature mortality warrants further investigation into risk-inducing environmental factors for substance abuse. Neighborhood Looking Glass will be a significant benefit to neighborhood effects researchers, harnessing the largely untapped potential of street image data to capture built environment characteristics. Results can be utilized to inform population-based strategies to reduce health disparities and improve health. Project Narrative/Relevance to Public Health The epidemic rise in obesity, related chronic diseases, and substance abuse in recent decades signal the importance of structural forces and social processes, but the dearth of data on contextual factors limits the investigation of multilevel effects on health. The development of the Neighborhood Looking Glass will be a significant benefit to neighborhood effects researchers, harnessing the largely untapped potential of street image data to capture built environment characteristics with potential impact on health. Results from our project can be utilized to inform system-wide and local strategies to improve community health.",Neighborhood Looking Glass: 360 Degree Automated Characterization of the Built Environment for Neighborhood Effects Research,9499844,R01LM012849,"['Accounting', 'Alcohol or Other Drugs use', 'Algorithms', 'Bioinformatics', 'Biological', 'Biological Neural Networks', 'Characteristics', 'Chronic', 'Chronic Disease', 'Cities', 'Collection', 'Communities', 'Community Health', 'Computer Vision Systems', 'Data', 'Data Collection', 'Data Sources', 'Development', 'Disease', 'Environment', 'Environmental Risk Factor', 'Epidemic', 'Epidemiology', 'Face', 'Family', 'Food', 'Food Access', 'Geographic Information Systems', 'Geography', 'Glass', 'Grant', 'Happiness', 'Health', 'Health Food', 'Health Personnel', 'Health Services Accessibility', 'Health behavior', 'Health care facility', 'Healthcare', 'Image', 'Individual', 'Informatics', 'Investigation', 'Label', 'Literature', 'Manuals', 'Measures', 'Medical Records', 'Mental Health', 'Methods', 'Nature', 'Neighborhoods', 'Obesity', 'Outcome', 'Overdose', 'Patients', 'Physical activity', 'Physical environment', 'Premature Mortality', 'Process', 'Public Health', 'Quality Indicator', 'Research', 'Research Personnel', 'Resources', 'Risk', 'Sampling', 'Signal Transduction', 'Site Visit', 'Social Environment', 'Source', 'Substance abuse problem', 'System', 'Techniques', 'Testing', 'Time', 'United States', 'Visit', 'built environment', 'burden of illness', 'cardiovascular disorder risk', 'cohort', 'computer science', 'contextual factors', 'cost', 'crowdsourcing', 'data management', 'data mining', 'data resource', 'data sharing', 'data visualization', 'data warehouse', 'density', 'health disparity', 'improved', 'land use', 'obesity risk', 'object recognition', 'physical conditioning', 'population based', 'social', 'social media', 'walkability', 'young adult']",NLM,"UNIV OF MARYLAND, COLLEGE PARK",R01,2018,355252,0.35966169408907606
"HashtagHealth: A Social Media Big Data Resource for Neighborhood Effects Research DESCRIPTION:   My goal in seeking a Mentored Research Career Development Award is to acquire the necessary training, practical experience, and knowledge to become a leading independent investigator who harnesses biomedical Big Data Science for the investigation of multilevel influences on health. To continue my progress towards this goal, I am proposing to build the infrastructure to establish a neighborhood data repository, HashtagHealth, for public health researchers and policy makers. I am a highly trained researcher in social epidemiology and quantitative analyses, particularly large health surveys. Before coming to Utah, I worked as a full-time statistical programmer/data analyst on a NIH-funded project to evaluate the health effects of a large neighborhood relocation policy experiment on low-income families in five cities. Our study results suggested that moving from high- to lower poverty neighborhood is related to reductions in obesity and diabetes and improved mental health. Other extant research has provided evidence on associations between the neighborhood environment and mortality and morbidity-even after adjusting for individual characteristics. Poor access to healthy food, fast food chains, the lack of recreational facilities, and higher crime rates all correlate with hiher obesity rates. Nonetheless, the dearth of neighborhood data, especially measures of neighborhood quality that are consistent across geographic areas, limits neighborhood effects research. Moreover, neighborhoods are not only defined by their resources, but also by the social interactions and activities of people who live there. The widespread usage of the internet and open recording of many transactions has led to the availability of massive amounts of data that permits capture of previously hidden micro-level interactions. We will build the data algorithms and infrastructure to harness relatively untapped, cost efficient, and pervasive social media data to develop neighborhood indicators such as food themes, healthiness of food mentions, frequency of exercise/recreation mentions, metabolic intensity of physical activities, and happiness levels. The creation of HashtagHealth requires the use and refinement of Big Data methods to perform data mining, processing and storing of heterogeneous, unstructured data. We will build a testable version of HashtagHealth for the state of Utah and then apply the data resource to the examination of neighborhood effects on young adult obesity. My rigorous training and previous research experiences in social determinants of health, causal inference, and data analyses uniquely prepare me to make significant contributions to the field of Big Data, particularly at the intersection of public health and social sciences.  My Specific Aims are: 1) to develop a neighborhood data resource, HashtagHealth, for public health researchers, 2) to develop Big Data techniques to produce novel neighborhood quality indicators (e.g., healthiness of food mentions, frequency and type of exercise/recreation and happiness levels), and 3) to utilize HashtagHealth and individual-level data from the Utah Population Database to investigate neighborhood influences on obesity among young adults. My mentorship team includes experts in biomedical research (Drs. Ken Smith, Jim VanDerslice), computer science (Dr. Feifei Li), and statistics (Dr. Ming Wen). My team has the breadth of expertise to help me obtain critical multidisciplinary skills and successfully implement my research aims. In addition to my research aims, my Specific Career Development Aims include the following: 1) to develop expertise in data mining and database systems, 2) to acquire training in natural language processing and machine learning, 3) to further gain knowledge of geographic information systems (GIS), 4) to develop expertise in study design and analysis of neighborhood effects, and 5) and to develop grant writing and research management skills to lead future projects. The knowledge and experience gained from this proposal will allow me to successfully compete for R01 funding to create a national neighborhood data repository and to investigate national patterns of neighborhood effects on obesity. This proposal makes significant, relevant contributions to the field because 1) neighborhood environments are increasingly linked to important health outcomes, and 2) this project addresses the limits to research resulting from the lack of neighborhood data by providing new, cost-efficient data resources and methods for characterizing neighborhoods. PUBLIC HEALTH RELEVANCE: The epidemic rise in obesity and related chronic diseases in recent decades signal the importance of structural forces and social processes, but the dearth of data on contextual factors limits the investigation of multilevel effects on health. My overarching career goal is to contribute to the improvement of population health by conducting research in social determinants of health and developing new methodologies to address multidimensional research questions. The development of the Hashtag Health data repository will be a significant benefit to neighborhood effects researchers, harnessing the largely untapped potential of social media data to capture social and cultural processes with potential impact on health.",HashtagHealth: A Social Media Big Data Resource for Neighborhood Effects Research,9528113,K01ES025433,"['Address', 'Adolescence', 'Advocacy', 'Affect', 'Age', 'Alcohol consumption', 'Algorithms', 'Area', 'Behavior', 'Big Data', 'Biomedical Research', 'Birth', 'Birth Weight', 'Characteristics', 'Chronic Disease', 'Cities', 'Communications Media', 'Crime', 'Data', 'Data Analyses', 'Data Science', 'Data Sources', 'Databases', 'Development', 'Diabetes Mellitus', 'Environment', 'Epidemic', 'Epidemiology', 'Exercise', 'Family', 'Food', 'Food Access', 'Food Chain', 'Frequencies', 'Funding', 'Future', 'Geographic Information Systems', 'Geographic Locations', 'Geography', 'Goals', 'Grant', 'Happiness', 'Health', 'Health Food', 'Health Promotion', 'Health Sciences', 'Health Services Accessibility', 'Health Surveys', 'Health behavior', 'Health care facility', 'Healthcare', 'Hypertension', 'Individual', 'Informal Social Control', 'Internet', 'Investigation', 'K-Series Research Career Programs', 'Knowledge', 'Lead', 'Link', 'Longevity', 'Machine Learning', 'Maintenance', 'Marital Status', 'Measures', 'Medical Records', 'Mental Health', 'Mentors', 'Mentorship', 'Metabolic', 'Methodology', 'Methods', 'Modeling', 'Morbidity - disease rate', 'Natural Language Processing', 'Neighborhoods', 'Obesity', 'Outcome', 'Pattern', 'Physical activity', 'Policies', 'Policy Maker', 'Politics', 'Population Database', 'Poverty', 'Principal Investigator', 'Process', 'Public Health', 'Quality Indicator', 'Recreation', 'Research', 'Research Design', 'Research Infrastructure', 'Research Personnel', 'Resources', 'Semantics', 'Siblings', 'Signal Transduction', 'Smoking', 'Social Environment', 'Social Interaction', 'Social Network', 'Social Sciences', 'System', 'Techniques', 'Time', 'Training', 'Transact', 'United States National Institutes of Health', 'Update', 'Utah', 'Work', 'Writing', 'big biomedical data', 'built environment', 'career', 'career development', 'computer science', 'contextual factors', 'cost efficient', 'data integration', 'data management', 'data mining', 'data resource', 'design', 'experience', 'experimental study', 'fast food', 'food consumption', 'health data', 'improved', 'lower income families', 'mortality', 'multidisciplinary', 'news', 'novel', 'obesity risk', 'physical conditioning', 'population health', 'public health relevance', 'screening', 'sex', 'skills', 'social', 'social health determinants', 'social media', 'statistics', 'tool', 'user-friendly', 'walkability', 'young adult']",NIEHS,"UNIV OF MARYLAND, COLLEGE PARK",K01,2017,155914,0.41074243063266364
"Mechanisms Underlying Differential Effects of Neighborhood Poverty on Problematic Adolescent Drug Use PROJECT SUMMARY/ABSTRACT  Where a child grows up can inﬂuence his or her risk of problematic drug use. Surprisingly, policies and programs designed to improve neighborhood conditions have yielded conﬂicting results in which some children beneﬁt but others are harmed. Understanding the mechanisms by which neighborhoods act to affect problem- atic drug use and how these mechanisms differ across subgroups and cities—that is, understanding where and for whom mechanisms apply—is essential to optimize the effectiveness of future neighborhood interventions. Mechanisms involving mediation by aspects of the school environment have been unexamined, but could prove promising for understanding differential effects of neighborhood on problematic drug use. The objective of this K99/R00 is to identify school-based mechanisms that mediate the relationship between neighborhood poverty and problematic drug use and to develop statistical methods to understand how mediation effects differ across subgroup and place. This objective contributes to the long-term goal of improving the effectiveness of interven- tions to prevent drug abuse and dependence by tailoring interventions to address the most relevant mechanisms of action for each target population based on place and individual-level characteristics. The K99 phase ﬁlls the following training gaps that are critical to achieving the research objective and long-term goal: 1) methodologic training in causal mediation analysis; 2) subject-matter training in drug abuse and dependence prevention in ur- ban populations; and 3) involvement in real-world school-based interventions to develop methods with practical utility. Aim 1 of the proposed research identiﬁes the school environment mechanisms that mediate the relationship between neighborhood poverty and adolescent problematic drug use and modiﬁers of those mechanisms. Aim 2 extends a statistical method recently developed by the proposed research team for generalizing intervention ef- fects from one city to another to generalizing mediation effects. Finally, Aim 3 uses the method developed in Aim 2 to identify how the school environment mechanisms mediating neighborhood poverty and problematic drug use differ across major U.S. cities. The proposed research is expected to identify school-based mechanisms underly- ing differential effects of neighborhood poverty on adolescent problematic drug use by subgroup and place using the only study of randomized neighborhood residence. In addition, it is expected to contribute a novel statistical method that incorporates cutting-edge machine learning techniques to identify which mediation mechanisms can generalize across place, advancing translational research. Successful interventions are assumed to work in differ- ent settings, but that is not the case in practice. The proposed research will allow us to predict intervention effects while accounting for differences in population composition and modiﬁers of the mediation mechanism. This will make a signiﬁcant contribution to improving health by informing the design and targeting of future neighborhood interventions to adolescents and places that may be most impacted in terms of problematic drug use prevention. PROJECT NARRATIVE  The proposed research is to expected to advance understanding of how two important contexts—neighborhood and school—act together to inﬂuence problematic drug use among adolescents, including how these mechanisms differ across adolescent subgroups and places. In addition, the proposed research will result in the development of a ﬂexible statistical method to predict intervention mechanism effects in new target populations, taking into account population composition. Together, these contributions are anticipated to optimize targeting of future interventions to prevent drug abuse and addiction.",Mechanisms Underlying Differential Effects of Neighborhood Poverty on Problematic Adolescent Drug Use,9312260,K99DA042127,"['Accounting', 'Address', 'Adolescent', 'Affect', 'Age', 'Alcohol or Other Drugs use', 'Characteristics', 'Child', 'Cities', 'Conflict (Psychology)', 'Development', 'Drug Addiction', 'Drug Use Disorder', 'Drug abuse', 'Drug usage', 'Effectiveness', 'Effectiveness of Interventions', 'Environment', 'Epidemiologist', 'Future', 'Gender', 'Goals', 'Health', 'Home visitation', 'Hour', 'Individual', 'Intervention', 'Machine Learning', 'Mediating', 'Mediation', 'Mediator of activation protein', 'Mental Health', 'Methodology', 'Methods', 'Modeling', 'Neighborhoods', 'Outcome', 'Partner in relationship', 'Pharmaceutical Preparations', 'Phase', 'Policies', 'Population', 'Poverty', 'Prevention', 'Property', 'Randomized', 'Research', 'Risk', 'Role', 'Safety', 'Schools', 'Statistical Methods', 'Students', 'Subgroup', 'Target Populations', 'Techniques', 'Testing', 'Training', 'Translational Research', 'Tweens', 'Work', 'adolescent drug use', 'base', 'boys', 'bullying', 'career', 'cost', 'design', 'drug abuse prevention', 'flexibility', 'girls', 'improved', 'intervention effect', 'method development', 'novel', 'population based', 'prevent', 'programs', 'residence', 'successful intervention']",NIDA,UNIVERSITY OF CALIFORNIA BERKELEY,K99,2017,153238,0.272773595503467
