text,title,id,project_number,terms,administration,organization,mechanism,year,funding,score
"Improving Diagnosis of Multiple Sclerosis Through the Integration of Novel Imaging and Laboratory Biomarkers Project Summary/Abstract:  The diagnosis of multiple sclerosis (MS) remains challenging due to its clinical heterogeneity and lengthy differential diagnosis. The incorrect assignment of a diagnosis of MS occurs in approximately 9% of newly evaluated patients and is associated with considerable clinically important, and avoidable, medical risk, morbidity, and healthcare costs. At the same time studies have demonstrated that many patients encounter a significant diagnostic delay prior to confirmation of a correct diagnosis of MS. In such patients early and accurate diagnosis of MS can result in prompt initiation of disease modifying therapy and consequent preventable disability. MS remains a clinical diagnosis and diagnostic criteria for MS are revised periodically, including most recently in 2017. Since implementation of the 2017 criteria, like all prior revisions, will continue to rely on subjective clinical and radiological assessments for its fulfillment, misdiagnosis will remain a risk.  New objective, automated, and clinically applicable approaches to MS diagnosis are needed. Recent preliminary data from cross-sectional pilot studies in patients with established diagnoses have shown promise for three new radiographic and three new laboratory methods to differentiate MS from other disorders. The present study will evaluate these six methods for the first time in a prospective cohort of 125 patients undergoing an initial evaluation for MS at an academic MS subspecialty center. The specificity and sensitivity of each method will be compared to fulfillment of 2017 MS diagnostic criteria at the time of initial clinical evaluation. Using diagnostic thresholds developed from this analysis, a two year post-enrollment analysis will also be performed in participants who did not meet 2017 criteria initially but did so during the subsequent two year interval to determine if the study methods could have predicted a diagnosis of MS earlier in such patients. The use of a multimodal and machine-learning approach to evaluate the integration of each of these six new methods which represent different aspects of MS neuroinflammatory and neurodegenerative processes will also be performed during each analysis, and such a combination of radiographic and laboratory methodology may provide superior diagnostic accuracy compared to any given method alone.  Planned collaborative career development, mentoring, and advising activities will facilitate acquisition of specific advanced quantitative and qualitative research skills necessary to develop and coordinate collection of data for this large prospective cohort study to rigorously evaluate new diagnostic methods for MS and incorporate machine learning analyses. Successful completion of this study will provide experience and skills necessary to move the field of MS diagnosis forward through a planned prospective multicenter NIH R01 funded study. Project Narrative: A highly specific, sensitive, objective and automated novel diagnostic approach to multiple sclerosis (MS) is needed maximize early benefits of disease modifying therapy in patients with MS and to prevent the frequent problem of MS misdiagnosis. This project assesses three novel MRI techniques and three novel blood tests for the diagnosis of MS in a large prospective cohort undergoing a new clinical evaluation for suspect MS. While each method may show promise alone, utilization of machine learning methodology combining these approaches that represent different aspects of MS pathophysiology may demonstrate a highly accurate and clinically applicable methodology for MS diagnosis.",Improving Diagnosis of Multiple Sclerosis Through the Integration of Novel Imaging and Laboratory Biomarkers,9646600,K02NS109340,"['Algorithms', 'Appearance', 'Atrophic', 'Binding', 'Biological Assay', 'Biological Markers', 'Blood Tests', 'C-Peptide', 'Central Vein', 'Clinical', 'Clinical/Radiologic', 'Computer Simulation', 'Data', 'Data Collection', 'Development', 'Diagnosis', 'Diagnostic', 'Diagnostic Procedure', 'Diagnostic radiologic examination', 'Differential Diagnosis', 'Disease', 'Early Diagnosis', 'Enrollment', 'Erythrocytes', 'Evaluation', 'Evolution', 'Functional disorder', 'Funding', 'Gene Expression', 'Goals', 'Gold', 'Health Care Costs', 'Image', 'Inflammatory', 'Laboratories', 'Lesion', 'Light', 'Liquid substance', 'Machine Learning', 'Magnetic Resonance Imaging', 'Medical', 'Mentors', 'Methodology', 'Methods', 'Morbidity - disease rate', 'Multiple Sclerosis', 'Myelin', 'Nerve Degeneration', 'Neurodegenerative Disorders', 'Neuronal Injury', 'Participant', 'Pathogenesis', 'Patients', 'Peptides', 'Pilot Projects', 'Process', 'Prospective cohort', 'Prospective cohort study', 'Qualitative Research', 'RNA', 'Rare Diseases', 'Risk', 'Sensitivity and Specificity', 'Serum', 'Specificity', 'Symptoms', 'Syndrome', 'Techniques', 'Testing', 'Thalamic structure', 'Time', 'Training', 'United States National Institutes of Health', 'Untranslated RNA', 'Whole Blood', 'accurate diagnosis', 'career development', 'clinical Diagnosis', 'clinical application', 'clinical diagnostics', 'clinical heterogeneity', 'clinical phenotype', 'clinical practice', 'cohort', 'diagnostic accuracy', 'disability', 'disease heterogeneity', 'experience', 'gray matter', 'improved', 'learning strategy', 'multimodality', 'multiple sclerosis patient', 'neurofilament', 'neuroinflammation', 'novel', 'novel diagnostics', 'novel imaging technique', 'polypeptide C', 'prevent', 'prospective', 'recruit', 'research clinical testing', 'skills', 'specific biomarkers', 'white matter']",NINDS,UNIVERSITY OF VERMONT & ST AGRIC COLLEGE,K02,2019,193783,0.2894699447004233
"Predicting Patient Outcome in Multiple Sclerosis using a Quantitative Radiomic Approach Project Summary: Multiple sclerosis (MS), a leading cause of disability in young and middle-aged adults, is a highly heterogeneous disease, with wide variations in clinical presentation, disease course and response to treatment. In order to personalize care in MS, it is important to harness its clinical heterogeneity and the diversity of its underlying pathology, and to develop models able to predict individual behavior of patients. Brain magnetic resonance images (MRI), acquired routinely in MS patients, contain information that reflects underlying pathophysiology, which may be brought into light through quantitative analyses. Radiomics, a technique well developed in oncology, converts routine medical images into mineable high-dimensional data that can be modeled to support clinical decision-making. The central hypothesis of the proposed project is that radiomic analysis, combined with careful feature selection and accurate modeling, can predict patient outcome and response to therapy using standard-of-care MRI in MS. Our hypothesis will be tested by leveraging existing 3-year imaging and clinical data from the CombiRx trial, a multi-center, phase-III investigation of combination therapy in 1008 relapsing-remitting MS (RRMS) patients. We will first determine the potential for non-invasive radiomic biomarkers of disease severity in RRMS. Towards this goal, we will extract radiomic features of MS lesions from FLAIR, pre and postcontrast T1-weighted MR images using an open-source radiomic pipeline. Through appropriate feature selection, we will identify an independent radiomic feature set able to characterize individual phenotype on MRI in a selection cohort. We will then evaluate the selected features cross-sectionally to determine their efficacy in characterizing disease severity, leveraging training and validation subsets. The performance of our radiomic approach will be compared to traditional models using clinical and standard imaging markers such as lesion volume. In the second stage of this proposal, we will explore the performance of radiomic-based models to predict long-term outcome and treatment response in MS. We will build models to predict disease activity free status (DAFS) at 3 years using selected baseline radiomic features, and identify treatment response phenotypes. We will investigate and compare the performance of various machine-learning models in an unbiased manner. Finally, we will assess the effect of each therapeutic regimen on radiomic features by comparing on-treatment changes across treatment arms. This may provide evidence for treatment-specific monitoring parameters.   Project Narrative:    Multiple sclerosis (MS) is a chronic and disabling disorder of the central nervous system affecting over 1  million  individuals  in  the  United  States.  Unambiguous  and  robust  clinical  prediction  of  individual  outcome  and  treatment  response  is  deeply  needed  to  provide  personalized  medicine  to  MS  patients,  reduce disability, and minimize the burden of MS on individuals and society. Radiomics has the potential  to contribute to decision-­‐support systems in MS, by transforming routinely acquired magnetic resonance  images into mineable high-­‐dimensional data.   ",Predicting Patient Outcome in Multiple Sclerosis using a Quantitative Radiomic Approach,9824996,R03NS109715,"['Adult', 'Affect', 'Behavior', 'Biological Markers', 'Blinded', 'Brain', 'Brain Pathology', 'Central Nervous System Diseases', 'Chronic', 'Clinical', 'Clinical Data', 'Combined Modality Therapy', 'Data', 'Data Set', 'Decision Support Systems', 'Dimensions', 'Disease', 'Enrollment', 'Functional disorder', 'Goals', 'Image', 'Individual', 'Inflammatory', 'Investigation', 'Lesion', 'Light', 'Machine Learning', 'Magnetic Resonance Imaging', 'Measures', 'Medical Imaging', 'Modeling', 'Monitor', 'Multiple Sclerosis', 'Multiple Sclerosis Lesions', 'Multivariate Analysis', 'Outcome', 'Pathology', 'Patient-Focused Outcomes', 'Patients', 'Performance', 'Phase', 'Phenotype', 'Regimen', 'Relapse', 'Relapsing-Remitting Multiple Sclerosis', 'Risk', 'Severity of illness', 'Societies', 'Techniques', 'Testing', 'Therapeutic', 'Tissues', 'Training', 'United States', 'Validation', 'Variant', 'base', 'clinical application', 'clinical decision support', 'clinical decision-making', 'clinical heterogeneity', 'clinical phenotype', 'clinically relevant', 'cohort', 'digital', 'disability', 'disease phenotype', 'imaging biomarker', 'insight', 'learning strategy', 'middle age', 'multidimensional data', 'multiple sclerosis patient', 'novel', 'oncology', 'open source', 'patient response', 'personalized care', 'personalized medicine', 'predictive modeling', 'quantitative imaging', 'radiomics', 'response', 'routine practice', 'standard of care', 'treatment arm', 'treatment response']",NINDS,"UNIVERSITY OF TEXAS, AUSTIN",R03,2019,88953,0.2463893143164157
"Integrating EHR and Genomics to Predict Multiple Sclerosis Drug Response PROJECT SUMMARY The growing expansion of the approved multiple sclerosis (MS) disease-modifying treatments (DMTs) and the variable responses to MS treatment have created an unmet medical need to provide individually tailored therapy. Efforts to bring precision medicine to provide individualized MS treatment selection have been impeded by our limited understanding of the factors that determine treatment response. While genomics hold the promise for closing this knowledge gap, the insufficient number of patients with detailed treatment response data and the modest effect size of genetic variants that influence treatment responses are the main limiting factors in pharmacogenomics studies. As electronic health records (EHR) become widely adopted and increasingly standardized and as we implement sophisticated computational and statistical methods to harness the EHR data, EHR systems can become cost-effective platforms to perform large-scale treatment response studies in real-life settings. Our team with a history of productive collaborations and diverse expertise (led by PI Dr. Xia) previously developed robust algorithms to identify 5,495 MS patients from the Partners HealthCare EHR systems and then model MS disease activity in these patients using EHR data. The Partners EHR system contains longitudinal clinical information on thousands of MS patients from two large academic medical centers and is linked to a well-characterized MS patient research registry and biobanks with existing genomics data. For the proposed study, we will test the hypothesis that meaningful phenotypes of MS disease activity can be extracted from EHR data to inform treatment response, and that additional common genetic variants exist in the population and can predict therapeutic response in MS when combined with clinical features derived from EHR data. The proposed study has three aims with the overall goal to produce a computational and analytic approach capable of identifying MS disease activity in relation to treatment history using EHR data and integrate with genomics profile to develop a predictive model of therapeutic response to commonly prescribed DMTs in this cohort of 5,495 MS patients, including injectable (interferon-β, glatiramer acetate) and oral (fingolimod, dimethyl fumarate) options. Specifically, we will (1) leverage narrative electronic health records data (e.g., clinical notes, radiology reports) and natural language processing (NLP) to ascertain individualized response to DMTs (n=600 for each DMT); (2) Identify clinical features from electronic health record data (e.g., diagnoses, exposures) that predict response to DMTs using a systematic phenome-wide approach; (3) Develop and test a comprehensive predictive model of individualized response to DMTs that incorporates clinical and genetic predictors. This research has the potential impact to be transformative by contributing to a major knowledge gap regarding the factors that influence treatment response and bringing precision medicine closer to individualized MS treatment selection. PROJECT NARRATIVE AND PUBLIC HEALTH RELEVANCE Multiple sclerosis (MS) is a chronic neurological condition that affects over 400,000 individuals in the United States and creates a high socioeconomic burden as a leading cause of neurological disability in young adults. Because not all patients respond the same way to a specific medication, physicians and MS patients often lose precious time searching for effective treatment with serially testing of costly medications. An individually tailored treatment can ensure early start of effective medication that can prevent relapse and progression of disability. Ultimately, this project will help gain insights into the factors that determine treatment response and enable physicians to match an individual MS patient's clinical and genomic profile with uniquely tailored therapy to maximize effectiveness, delay disease progression and reduce overall cost.",Integrating EHR and Genomics to Predict Multiple Sclerosis Drug Response,9747390,R01NS098023,"['Academic Medical Centers', 'Adopted', 'Affect', 'Algorithms', 'Biology', 'Chronic', 'Clinical', 'Clinical Data', 'Code', 'Collaborations', 'Computing Methodologies', 'DNA', 'Data', 'Diagnosis', 'Diagnostic', 'Diagnostic radiologic examination', 'Disease', 'Disease Progression', 'Effectiveness', 'Electronic Health Record', 'Ensure', 'Fumarates', 'Genomics', 'Genotype', 'Goals', 'Gold', 'Healthcare', 'Healthcare Systems', 'Individual', 'Informatics', 'Injectable', 'Interferon-beta', 'Knowledge', 'Life', 'Link', 'Longitudinal prospective study', 'Manuals', 'Medical', 'Mission', 'Modeling', 'Multiple Sclerosis', 'National Institute of Neurological Disorders and Stroke', 'Natural Language Processing', 'Neurologic', 'Neurologist', 'Oral', 'Outcome', 'Patients', 'Pharmaceutical Preparations', 'Pharmacogenomics', 'Phenotype', 'Physicians', 'Population', 'Positioning Attribute', 'Prediction of Response to Therapy', 'Radiology Specialty', 'Recording of previous events', 'Registries', 'Relapse', 'Reporting', 'Research', 'Research Design', 'Retrospective Studies', 'Selection for Treatments', 'Standardization', 'Statistical Methods', 'System', 'Testing', 'Time', 'TimeLine', 'Treatment Cost', 'Treatment outcome', 'United States', 'Variant', 'biobank', 'clinical predictors', 'cohort', 'copolymer 1', 'cost', 'cost effective', 'disability', 'effective therapy', 'experience', 'genetic predictors', 'genetic variant', 'genome-wide', 'genomic data', 'genomic profiles', 'individual response', 'individualized medicine', 'insight', 'multiple sclerosis patient', 'multiple sclerosis treatment', 'nervous system disorder', 'neuroimaging', 'patient response', 'phenome', 'portability', 'precision medicine', 'predicting response', 'predictive modeling', 'prevent', 'public health relevance', 'response', 'socioeconomics', 'treatment group', 'treatment response', 'young adult']",NINDS,UNIVERSITY OF PITTSBURGH AT PITTSBURGH,R01,2019,298872,0.2864876921024999
"ICLIC-MS for Enhancing Outcomes Research and Clinical Care in Multiple Sclerosis PROJECT SUMMARY Cognitive impairment, physical disability and progressive disease are common but understudied clinical outcomes that substantially impact employment and overall quality of life for individuals with multiple sclerosis (MS). We have recently developed and validated an assisted, web-based tool (ICLIC-MS) for systematic and longitudinal clinical outcomes data collection of MS-validated cognitive function measures, physical disability and progressive disease measures that are not reliably captured in the electronic health record (EHR). In response to FOA# PA-17-010, Use of Technology to Enhance Patient Outcomes and Prevent Illness, our team proposes the study of MS outcomes in a large, multi-ethnic population representative sample of more than 3,000 female and male MS cases from the Kaiser Permanente Northern California Health Plan Membership. We will integrate other EHR data such as important comorbid conditions, use of disease modifying therapy, MRI reports, as well as quality of life measures and employment histories. Our goals include: 1) comprehensively characterizing clinical outcomes in a large MS patient cohort; 2) developing and utilizing an integrated MS health report to enhance patient care; and 3) establishing a resource for clinical outcomes research in MS that also includes whole genomic and environmental exposure data. Findings from our proposed study represent an extraordinary opportunity to facilitate effective long-term management of MS, accelerate progress in the understanding of disease pathogenesis, predict patient trajectories and inform prevention strategies. We have assembled a team with strong expertise in clinical neurology/MS neurology, advanced epidemiologic methods, EHR structure and clinical care within a health maintenance organization, human genomics, biostatistics, and big data approaches. PROJECT NARRATIVE Our team has developed and validated an assisted web-based interface for longitudinal clinical data collection of cognitive function measures, physical disability and depression measures that are not reliably captured in the electronic health record (EHR) of multiple sclerosis (MS) patients. We will integrate several sources of patient data including genomic, clinical and EHR for 3,000 individuals to facilitate research and improve clinical care.",ICLIC-MS for Enhancing Outcomes Research and Clinical Care in Multiple Sclerosis,9763663,R01NR017431,"['Address', 'Area', 'Big Data', 'Biological', 'Biology', 'Biometry', 'California', 'Clinic', 'Clinic Visits', 'Clinical', 'Clinical Data', 'Clinical Investigator', 'Clinical Research', 'Clinical assessments', 'Cognition', 'Cognitive', 'Collection', 'Comorbidity', 'Consumption', 'Data', 'Data Collection', 'Development', 'Disease', 'Disease Progression', 'Electronic Health Record', 'Employment', 'Employment Status', 'Environmental Exposure', 'Epidemiologic Methods', 'Ethnic Origin', 'Family', 'Female', 'Funding Opportunities', 'Genetic', 'Genomics', 'Goals', 'Health', 'Health Maintenance Organizations', 'Impaired cognition', 'Individual', 'Internet', 'Intervention', 'Lead', 'Light', 'Machine Learning', 'Magnetic Resonance Imaging', 'Measures', 'Mental Depression', 'Methods', 'Multiple Sclerosis', 'Neurologist', 'Neurology', 'Outcome', 'Outcome Measure', 'Outcome Study', 'Outcomes Research', 'Pathogenesis', 'Patient Care', 'Patient-Focused Outcomes', 'Patients', 'Performance', 'Physically Handicapped', 'Physicians', 'Pilot Projects', 'Population', 'Predictive Factor', 'Preparation', 'Prevention strategy', 'Primary Health Care', 'Progressive Disease', 'Quality of life', 'Race', 'Recording of previous events', 'Reporting', 'Research', 'Resources', 'Risk Factors', 'Sampling', 'Source', 'Structure', 'Technology', 'Testing', 'Time', 'Unemployment', 'Validity and Reliability', 'Visit', 'Work', 'base', 'clinical care', 'cognitive function', 'cohort', 'disability', 'electronic data', 'health plan', 'human genomics', 'improved', 'male', 'member', 'multidisciplinary', 'multiple sclerosis patient', 'new technology', 'prevent', 'programs', 'response', 'sex', 'web based interface', 'web-based tool']",NINR,UNIVERSITY OF CALIFORNIA BERKELEY,R01,2019,606029,0.23190689886084762
"Statistical Methods for Multilevel Multivariate Functional Studies Abstract  While imaging studies are widely used in clinical practice and research, the number of neuroimaging- based biomarkers is small. For example, in clinical trials of immunomodulatory therapies for MS, the only commonly used imaging biomarkers are the total lesion volume and the number of new and en- hancing lesions. These biomarkers are essential, but do not capture the recovery process of lesions, which is thought to decline in more severe, progressive disease. The partial or complete recovery of lesions may depend both on the ability of the brain to heal and on external factors, such as treat- ment or environmental and behavioral exposures. In this proposal we take the natural next step of proposing imaging biomarkers for MS based on the formation and change of lesions as observed on multi-sequence structural MRIs. To solve this problem we propose to address several general method- ological problems: 1) develop models and methods for the longitudinal analysis of several images of the same brain; 2) identify and estimate the length of history that is necessary to estimate recovery; 3) study the association with known biomarkers of the disease (in this case total volume and number of new and enhancing lesions); 4) develop methods that are robust to changes in imaging protocols that inevitably arise in longitudinal neuroimaging studies; and 5) develop the computational tools that allow for sophisticated methods to be implemented seamlessly in practice. While our scientiﬁc problem is focused, the proposed statistical methods are general and can be applied to a wide variety of longitu- dinal neuroimaging studies. For example, there are many ongoing longitudinal neuroimaging studies, including the ADNI, AIBL, HBC, and MISTIE, where our methods could be used to study subtle or large changes in lesions or in white and gray matter intensities. Project narrative. The project provides statistical analysis methods for quantiﬁcation of the evolution in the intensity of brain lesions on multi-sequence Magnetic Resonance Imaging (MRI). Methods are motivated by the need to develop new neuroimaging-based biomarkers for multiple sclerosis (MS), but can be applied to other types of brain diseases including stroke, Alzheimer disease, and cancer.",Statistical Methods for Multilevel Multivariate Functional Studies,9635802,R01NS060910,"['Accounting', 'Address', 'Alzheimer&apos', 's Disease', 'Behavioral', 'Biological Markers', 'Brain', 'Brain Diseases', 'Brain imaging', 'Clinical Research', 'Clinical Trials', 'Computer software', 'Data', 'Databases', 'Disease', 'Enhancing Lesion', 'Event', 'Evolution', 'Funding', 'Grant', 'Graph', 'Image', 'Incidence', 'Length', 'Lesion', 'Machine Learning', 'Magnetic Resonance Imaging', 'Malignant Neoplasms', 'Mediation', 'Mediator of activation protein', 'Methodology', 'Methods', 'Modeling', 'Multiple Sclerosis', 'Multiple Sclerosis Lesions', 'Names', 'Natural History', 'Nature', 'Online Systems', 'Pattern', 'Population Heterogeneity', 'Problem Solving', 'Process', 'Progressive Disease', 'Protocols documentation', 'Randomized', 'Recording of previous events', 'Recovery', 'Research', 'Sampling', 'Statistical Data Interpretation', 'Statistical Methods', 'Stroke', 'Structure', 'Supervision', 'Techniques', 'Time', 'United States National Institutes of Health', 'base', 'biomarker validation', 'clinical practice', 'computerized tools', 'design', 'gray matter', 'healing', 'high dimensionality', 'imaging biomarker', 'imaging study', 'immunomodulatory therapies', 'improved', 'insight', 'longitudinal analysis', 'longitudinal database', 'multidimensional data', 'neuroimaging', 'non-Gaussian model', 'personalized approach', 'repaired', 'serial imaging', 'software development', 'treatment response', 'white matter']",NINDS,JOHNS HOPKINS UNIVERSITY,R01,2019,633289,0.1189814087701883
