text,title,id,project_number,terms,administration,organization,mechanism,year,funding,score
"Statistical Methods for Multilevel Multivariate Functional Studies Abstract  While imaging studies are widely used in clinical practice and research, the number of neuroimaging- based biomarkers is small. For example, in clinical trials of immunomodulatory therapies for MS, the only commonly used imaging biomarkers are the total lesion volume and the number of new and en- hancing lesions. These biomarkers are essential, but do not capture the recovery process of lesions, which is thought to decline in more severe, progressive disease. The partial or complete recovery of lesions may depend both on the ability of the brain to heal and on external factors, such as treat- ment or environmental and behavioral exposures. In this proposal we take the natural next step of proposing imaging biomarkers for MS based on the formation and change of lesions as observed on multi-sequence structural MRIs. To solve this problem we propose to address several general method- ological problems: 1) develop models and methods for the longitudinal analysis of several images of the same brain; 2) identify and estimate the length of history that is necessary to estimate recovery; 3) study the association with known biomarkers of the disease (in this case total volume and number of new and enhancing lesions); 4) develop methods that are robust to changes in imaging protocols that inevitably arise in longitudinal neuroimaging studies; and 5) develop the computational tools that allow for sophisticated methods to be implemented seamlessly in practice. While our scientiﬁc problem is focused, the proposed statistical methods are general and can be applied to a wide variety of longitu- dinal neuroimaging studies. For example, there are many ongoing longitudinal neuroimaging studies, including the ADNI, AIBL, HBC, and MISTIE, where our methods could be used to study subtle or large changes in lesions or in white and gray matter intensities. Project narrative. The project provides statistical analysis methods for quantiﬁcation of the evolution in the intensity of brain lesions on multi-sequence Magnetic Resonance Imaging (MRI). Methods are motivated by the need to develop new neuroimaging-based biomarkers for multiple sclerosis (MS), but can be applied to other types of brain diseases including stroke, Alzheimer disease, and cancer.",Statistical Methods for Multilevel Multivariate Functional Studies,9492705,R01NS060910,"['Accounting', 'Address', 'Alzheimer&apos', 's Disease', 'Behavioral', 'Biological Markers', 'Brain', 'Brain Diseases', 'Brain imaging', 'Clinical Research', 'Clinical Trials', 'Computer software', 'Data', 'Databases', 'Disease', 'Enhancing Lesion', 'Event', 'Evolution', 'Funding', 'Grant', 'Graph', 'Image', 'Incidence', 'Length', 'Lesion', 'Machine Learning', 'Magnetic Resonance Imaging', 'Malignant Neoplasms', 'Mediation', 'Mediator of activation protein', 'Methodology', 'Methods', 'Modeling', 'Multiple Sclerosis', 'Multiple Sclerosis Lesions', 'Names', 'Natural History', 'Nature', 'Online Systems', 'Pattern', 'Population Heterogeneity', 'Problem Solving', 'Process', 'Progressive Disease', 'Protocols documentation', 'Randomized', 'Recording of previous events', 'Recovery', 'Research', 'Sampling', 'Statistical Data Interpretation', 'Statistical Methods', 'Stroke', 'Supervision', 'Techniques', 'Time', 'United States National Institutes of Health', 'base', 'biomarker validation', 'clinical practice', 'computerized tools', 'design', 'gray matter', 'healing', 'high dimensionality', 'imaging biomarker', 'imaging study', 'immunomodulatory therapies', 'improved', 'insight', 'longitudinal analysis', 'longitudinal database', 'neuroimaging', 'non-Gaussian model', 'personalized approach', 'repaired', 'software development', 'treatment response', 'white matter']",NINDS,JOHNS HOPKINS UNIVERSITY,R01,2018,637414,0.1189814087701883
"Long non-coding RNA signatures to classify multiple sclerosis Diagnosis of relapsing remitting multiple sclerosis (MS) rests on clinical symptoms and examinations as  outlined in the revised McDonald’s criteria supported by appropriate magnetic resonance imaging findings and  other laboratory tests. The need for early diagnosis is clearly emphasized in a position paper produced in 2015  by MS Brain Health organization called “Brain health, Time matters in multiple sclerosis’ which is endorsed by  the major organizations and foundations that advocate for MS research, providers and patients including  Accelerated Cure Project (ACP), Americans Committed for Treatment and Research in Multiple Sclerosis  (ACTRIMS), The Consortium of Multiple Sclerosis Centers (CMSC), European Brain Council (EBC), European  Committee for Treatment and Research in Multiple Sclerosis (ECTRIMS), European Multiple Sclerosis Platform  (EMSP), International Society of Neuroimmunology (ISNI), International Organization of Multiple Sclerosis  Nurses (IOMSN), National Multiple Sclerosis Society (NMSS), and Multiple Sclerosis Trust (MS). To cite from  their executive summary page: (1) “A therapeutic strategy that offers the best chance of preserving brain  and spinal cord tissue early in the disease course needs to be widely accepted – and urgently adopted.”  (2) “Significant delays often occur before a person with symptoms suggestive of MS sees a neurologist  for diagnosis and treatment.” (3) “Early intervention is vital.” (bold type face is theirs, not ours).   The question of whether or not disease classifiers capable of providing clinically useful information could be  built based upon disease-specific expression levels of mRNAs in whole blood has been a subject of research for  several years. Long non-coding RNAs (lncRNA) are recently discovered regulatory RNA molecules that do not  code for proteins but influence a vast array of biological processes. It is also thought that lncRNAs drive biologic  complexity observed in vertebrates that may also be reflected by the greater array of complex idiopathic diseases  that humans develop. As such, our data obtained in the phase 1 portion of this work, support the notion that  disease-associated lncRNAs exhibit far greater differences in expression than disease-associated mRNAs. In  this application, we propose to explore the hypothesis that lncRNAs are better biomarkers of human disease  than mRNAs. Here, we will focus on MS as a disease category and have identified and validated MS associated  differentially expressed lncRNAs. Study of lncRNAs in human autoimmune disease is in its infancy and  exploration of lncRNAs as biomarkers of autoimmune disease has not been previously addressed. We propose  to determine expression levels of target lncRNAs in blood obtained from larger cohorts of subjects that include  1) subjects with RRMS, 2) healthy controls, 3) neurologic disease controls including both inflammatory and non- inflammatory disorders, and 4) peripheral autoimmune disease controls obtained from various sites in the U.S.  and Europe to establish a wide geographic distribution and to identify optimum machine learning classifiers to  distinguish the MS cohorts from healthy and disease control cohorts with greatest overall accuracy. Diagnosis of relapsing remitting multiple sclerosis (MS) is a subjective diagnosis based largely on clinical  symptoms and MRI findings disseminated in time and space. Biomarkers to aid and accelerate this diagnosis  is an area of active investigation. Long non-coding RNAs (lncRNAs) are newly discovered classes of RNAs  with an array of regulatory functions. Our hypothesis to test, and supported by our phase 1 studies, is that  classifiers can be built based upon differential expression of lncRNAs in blood. These classifiers will possess  greater accuracy to identify presence of MS in a subject earlier than is currently available leading to  preservation of ‘brain health’.",Long non-coding RNA signatures to classify multiple sclerosis,9405679,R44AI124766,"['Address', 'Adopted', 'Advocate', 'American', 'Area', 'Asians', 'Autoimmune Diseases', 'Biological Markers', 'Biological Preservation', 'Biological Process', 'Blood', 'Brain', 'Categories', 'Clinical', 'Code', 'Complex', 'Data', 'Demyelinations', 'Diagnosis', 'Diagnostic tests', 'Disease', 'Early Diagnosis', 'Early Intervention', 'Europe', 'European', 'Event', 'Exhibits', 'Face', 'Fibromyalgia', 'Foundations', 'Gene Expression Profile', 'Genes', 'Geographic Distribution', 'Healthcare', 'Healthcare Systems', 'Hour', 'Human', 'Inflammation', 'Inflammatory', 'International', 'Invertebrates', 'Investigation', 'Irritable Bowel Syndrome', 'Laboratories', 'Latin American', 'Machine Learning', 'Magnetic Resonance Imaging', 'Messenger RNA', 'Middle East', 'Multiple Sclerosis', 'Neurologic', 'Neurologist', 'Northern Africa', 'Nurses', 'Organism', 'Paper', 'Patients', 'Pattern', 'Peripheral', 'Persons', 'Phase', 'Positioning Attribute', 'Proteins', 'Provider', 'RNA', 'Relapsing-Remitting Multiple Sclerosis', 'Research', 'Research Subjects', 'Rest', 'Site', 'Societies', 'Spinal Cord', 'Suggestion', 'Symptoms', 'Syndrome', 'Systemic Scleroderma', 'Testing', 'Therapeutic', 'Time', 'Tissues', 'Trust', 'United States', 'Untranslated RNA', 'Vertebrates', 'Whole Blood', 'Work', 'base', 'brain health', 'cell type', 'cohort', 'cost', 'differential expression', 'disorder control', 'experience', 'health organization', 'human disease', 'infancy', 'nervous system disorder', 'neuroimmunology', 'phase 1 study']",NIAID,"IQUITY LABS, INC",R44,2017,504933,0.1818458474694082
"Integrating EHR and Genomics to Predict Multiple Sclerosis Drug Response PROJECT SUMMARY The growing expansion of the approved multiple sclerosis (MS) disease-modifying treatments (DMTs) and the variable responses to MS treatment have created an unmet medical need to provide individually tailored therapy. Efforts to bring precision medicine to provide individualized MS treatment selection have been impeded by our limited understanding of the factors that determine treatment response. While genomics hold the promise for closing this knowledge gap, the insufficient number of patients with detailed treatment response data and the modest effect size of genetic variants that influence treatment responses are the main limiting factors in pharmacogenomics studies. As electronic health records (EHR) become widely adopted and increasingly standardized and as we implement sophisticated computational and statistical methods to harness the EHR data, EHR systems can become cost-effective platforms to perform large-scale treatment response studies in real-life settings. Our team with a history of productive collaborations and diverse expertise (led by PI Dr. Xia) previously developed robust algorithms to identify 5,495 MS patients from the Partners HealthCare EHR systems and then model MS disease activity in these patients using EHR data. The Partners EHR system contains longitudinal clinical information on thousands of MS patients from two large academic medical centers and is linked to a well-characterized MS patient research registry and biobanks with existing genomics data. For the proposed study, we will test the hypothesis that meaningful phenotypes of MS disease activity can be extracted from EHR data to inform treatment response, and that additional common genetic variants exist in the population and can predict therapeutic response in MS when combined with clinical features derived from EHR data. The proposed study has three aims with the overall goal to produce a computational and analytic approach capable of identifying MS disease activity in relation to treatment history using EHR data and integrate with genomics profile to develop a predictive model of therapeutic response to commonly prescribed DMTs in this cohort of 5,495 MS patients, including injectable (interferon-β, glatiramer acetate) and oral (fingolimod, dimethyl fumarate) options. Specifically, we will (1) leverage narrative electronic health records data (e.g., clinical notes, radiology reports) and natural language processing (NLP) to ascertain individualized response to DMTs (n=600 for each DMT); (2) Identify clinical features from electronic health record data (e.g., diagnoses, exposures) that predict response to DMTs using a systematic phenome-wide approach; (3) Develop and test a comprehensive predictive model of individualized response to DMTs that incorporates clinical and genetic predictors. This research has the potential impact to be transformative by contributing to a major knowledge gap regarding the factors that influence treatment response and bringing precision medicine closer to individualized MS treatment selection. PROJECT NARRATIVE AND PUBLIC HEALTH RELEVANCE Multiple sclerosis (MS) is a chronic neurological condition that affects over 400,000 individuals in the United States and creates a high socioeconomic burden as a leading cause of neurological disability in young adults. Because not all patients respond the same way to a specific medication, physicians and MS patients often lose precious time searching for effective treatment with serially testing of costly medications. An individually tailored treatment can ensure early start of effective medication that can prevent relapse and progression of disability. Ultimately, this project will help gain insights into the factors that determine treatment response and enable physicians to match an individual MS patient's clinical and genomic profile with uniquely tailored therapy to maximize effectiveness, delay disease progression and reduce overall cost.",Integrating EHR and Genomics to Predict Multiple Sclerosis Drug Response,9358350,R01NS098023,"['Academic Medical Centers', 'Adopted', 'Affect', 'Algorithms', 'Biology', 'Chronic', 'Clinical', 'Clinical Data', 'Code', 'Collaborations', 'Computing Methodologies', 'DNA', 'Data', 'Diagnosis', 'Diagnostic', 'Diagnostic radiologic examination', 'Disease', 'Disease Progression', 'Effectiveness', 'Electronic Health Record', 'Ensure', 'Fumarates', 'Genomics', 'Genotype', 'Goals', 'Gold', 'Healthcare', 'Healthcare Systems', 'Individual', 'Informatics', 'Injectable', 'Interferon-beta', 'Knowledge', 'Life', 'Link', 'Longitudinal prospective study', 'Manuals', 'Medical', 'Mission', 'Modeling', 'Multiple Sclerosis', 'National Institute of Neurological Disorders and Stroke', 'Natural Language Processing', 'Neurologic', 'Neurologist', 'Oral', 'Outcome', 'Patients', 'Pharmaceutical Preparations', 'Pharmacogenomics', 'Phenotype', 'Physicians', 'Population', 'Positioning Attribute', 'Radiology Specialty', 'Recording of previous events', 'Registries', 'Relapse', 'Reporting', 'Research', 'Research Design', 'Retrospective Studies', 'Selection for Treatments', 'Standardization', 'Statistical Methods', 'System', 'Testing', 'Time', 'TimeLine', 'Treatment Cost', 'Treatment outcome', 'United States', 'Variant', 'biobank', 'clinical predictors', 'cohort', 'copolymer 1', 'cost', 'cost effective', 'disability', 'effective therapy', 'experience', 'genetic predictors', 'genetic variant', 'genome-wide', 'genomic data', 'genomic profiles', 'individualized medicine', 'insight', 'multiple sclerosis patient', 'multiple sclerosis treatment', 'nervous system disorder', 'neuroimaging', 'phenome', 'portability', 'precision medicine', 'predicting response', 'predictive modeling', 'prevent', 'public health relevance', 'response', 'socioeconomics', 'treatment group', 'treatment response', 'young adult']",NINDS,UNIVERSITY OF PITTSBURGH AT PITTSBURGH,R01,2017,344715,0.2864876921024999
"Statistical Methods for Multilevel Multivariate Functional Studies Abstract  While imaging studies are widely used in clinical practice and research, the number of neuroimaging- based biomarkers is small. For example, in clinical trials of immunomodulatory therapies for MS, the only commonly used imaging biomarkers are the total lesion volume and the number of new and en- hancing lesions. These biomarkers are essential, but do not capture the recovery process of lesions, which is thought to decline in more severe, progressive disease. The partial or complete recovery of lesions may depend both on the ability of the brain to heal and on external factors, such as treat- ment or environmental and behavioral exposures. In this proposal we take the natural next step of proposing imaging biomarkers for MS based on the formation and change of lesions as observed on multi-sequence structural MRIs. To solve this problem we propose to address several general method- ological problems: 1) develop models and methods for the longitudinal analysis of several images of the same brain; 2) identify and estimate the length of history that is necessary to estimate recovery; 3) study the association with known biomarkers of the disease (in this case total volume and number of new and enhancing lesions); 4) develop methods that are robust to changes in imaging protocols that inevitably arise in longitudinal neuroimaging studies; and 5) develop the computational tools that allow for sophisticated methods to be implemented seamlessly in practice. While our scientiﬁc problem is focused, the proposed statistical methods are general and can be applied to a wide variety of longitu- dinal neuroimaging studies. For example, there are many ongoing longitudinal neuroimaging studies, including the ADNI, AIBL, HBC, and MISTIE, where our methods could be used to study subtle or large changes in lesions or in white and gray matter intensities. Project narrative. The project provides statistical analysis methods for quantiﬁcation of the evolution in the intensity of brain lesions on multi-sequence Magnetic Resonance Imaging (MRI). Methods are motivated by the need to develop new neuroimaging-based biomarkers for multiple sclerosis (MS), but can be applied to other types of brain diseases including stroke, Alzheimer disease, and cancer.",Statistical Methods for Multilevel Multivariate Functional Studies,9378514,R01NS060910,"['Accounting', 'Address', 'Alzheimer&apos', 's Disease', 'Behavioral', 'Biological Markers', 'Brain', 'Brain Diseases', 'Brain imaging', 'Clinical Research', 'Clinical Trials', 'Computer software', 'Data', 'Databases', 'Disease', 'Enhancing Lesion', 'Event', 'Evolution', 'Funding', 'Grant', 'Graph', 'Image', 'Incidence', 'Length', 'Lesion', 'Machine Learning', 'Magnetic Resonance Imaging', 'Malignant Neoplasms', 'Mediation', 'Mediator of activation protein', 'Methodology', 'Methods', 'Modeling', 'Multiple Sclerosis', 'Multiple Sclerosis Lesions', 'Names', 'Natural History', 'Nature', 'Online Systems', 'Pattern', 'Population Heterogeneity', 'Problem Solving', 'Process', 'Progressive Disease', 'Protocols documentation', 'Randomized', 'Recording of previous events', 'Recovery', 'Research', 'Sampling', 'Statistical Data Interpretation', 'Statistical Methods', 'Stroke', 'Supervision', 'Techniques', 'Time', 'United States National Institutes of Health', 'Validation', 'base', 'clinical practice', 'computerized tools', 'design', 'gray matter', 'healing', 'high dimensionality', 'imaging biomarker', 'imaging study', 'immunoregulation', 'improved', 'insight', 'longitudinal analysis', 'longitudinal database', 'neuroimaging', 'non-Gaussian model', 'personalized approach', 'repaired', 'software development', 'treatment response', 'white matter']",NINDS,JOHNS HOPKINS UNIVERSITY,R01,2017,659178,0.1189814087701883
"Integrating EHR and Genomics to Predict Multiple Sclerosis Drug Response PROJECT SUMMARY The growing expansion of the approved multiple sclerosis (MS) disease-modifying treatments (DMTs) and the variable responses to MS treatment have created an unmet medical need to provide individually tailored therapy. Efforts to bring precision medicine to provide individualized MS treatment selection have been impeded by our limited understanding of the factors that determine treatment response. While genomics hold the promise for closing this knowledge gap, the insufficient number of patients with detailed treatment response data and the modest effect size of genetic variants that influence treatment responses are the main limiting factors in pharmacogenomics studies. As electronic health records (EHR) become widely adopted and increasingly standardized and as we implement sophisticated computational and statistical methods to harness the EHR data, EHR systems can become cost-effective platforms to perform large-scale treatment response studies in real-life settings. Our team with a history of productive collaborations and diverse expertise (led by PI Dr. Xia) previously developed robust algorithms to identify 5,495 MS patients from the Partners HealthCare EHR systems and then model MS disease activity in these patients using EHR data. The Partners EHR system contains longitudinal clinical information on thousands of MS patients from two large academic medical centers and is linked to a well-characterized MS patient research registry and biobanks with existing genomics data. For the proposed study, we will test the hypothesis that meaningful phenotypes of MS disease activity can be extracted from EHR data to inform treatment response, and that additional common genetic variants exist in the population and can predict therapeutic response in MS when combined with clinical features derived from EHR data. The proposed study has three aims with the overall goal to produce a computational and analytic approach capable of identifying MS disease activity in relation to treatment history using EHR data and integrate with genomics profile to develop a predictive model of therapeutic response to commonly prescribed DMTs in this cohort of 5,495 MS patients, including injectable (interferon-β, glatiramer acetate) and oral (fingolimod, dimethyl fumarate) options. Specifically, we will (1) leverage narrative electronic health records data (e.g., clinical notes, radiology reports) and natural language processing (NLP) to ascertain individualized response to DMTs (n=600 for each DMT); (2) Identify clinical features from electronic health record data (e.g., diagnoses, exposures) that predict response to DMTs using a systematic phenome-wide approach; (3) Develop and test a comprehensive predictive model of individualized response to DMTs that incorporates clinical and genetic predictors. This research has the potential impact to be transformative by contributing to a major knowledge gap regarding the factors that influence treatment response and bringing precision medicine closer to individualized MS treatment selection. PROJECT NARRATIVE AND PUBLIC HEALTH RELEVANCE Multiple sclerosis (MS) is a chronic neurological condition that affects over 400,000 individuals in the United States and creates a high socioeconomic burden as a leading cause of neurological disability in young adults. Because not all patients respond the same way to a specific medication, physicians and MS patients often lose precious time searching for effective treatment with serially testing of costly medications. An individually tailored treatment can ensure early start of effective medication that can prevent relapse and progression of disability. Ultimately, this project will help gain insights into the factors that determine treatment response and enable physicians to match an individual MS patient's clinical and genomic profile with uniquely tailored therapy to maximize effectiveness, delay disease progression and reduce overall cost.",Integrating EHR and Genomics to Predict Multiple Sclerosis Drug Response,9158403,R01NS098023,"['Academic Medical Centers', 'Adopted', 'Affect', 'Algorithms', 'Biology', 'Chronic', 'Clinical', 'Code', 'Collaborations', 'Computing Methodologies', 'DNA', 'Data', 'Diagnosis', 'Diagnostic', 'Disease', 'Disease Progression', 'Effectiveness', 'Electronic Health Record', 'Ensure', 'Fumarates', 'Genomics', 'Genotype', 'Goals', 'Gold', 'Healthcare', 'Healthcare Systems', 'Individual', 'Informatics', 'Injectable', 'Interferon-beta', 'Knowledge', 'Life', 'Link', 'Medical', 'Mission', 'Modeling', 'Multiple Sclerosis', 'National Institute of Neurological Disorders and Stroke', 'Natural Language Processing', 'Neurologic', 'Neurologist', 'Oral', 'Outcome', 'Patients', 'Pharmaceutical Preparations', 'Pharmacogenomics', 'Phenotype', 'Physicians', 'Population', 'Positioning Attribute', 'Prospective Studies', 'Radiology Specialty', 'Recording of previous events', 'Registries', 'Relapse', 'Reporting', 'Research', 'Research Design', 'Retrospective Studies', 'Statistical Methods', 'System', 'Testing', 'Time', 'TimeLine', 'Treatment outcome', 'United States', 'Variant', 'biobank', 'clinical predictors', 'cohort', 'copolymer 1', 'cost', 'cost effective', 'disability', 'effective therapy', 'experience', 'genetic predictors', 'genetic variant', 'genome-wide', 'genomic data', 'genomic profiles', 'individualized medicine', 'insight', 'multiple sclerosis patient', 'multiple sclerosis treatment', 'nervous system disorder', 'neuroimaging', 'phenome', 'portability', 'precision medicine', 'predicting response', 'predictive modeling', 'prevent', 'public health relevance', 'response', 'socioeconomics', 'treatment group', 'treatment response', 'young adult']",NINDS,UNIVERSITY OF PITTSBURGH AT PITTSBURGH,R01,2016,370421,0.2864876921024999
