text,title,id,project_number,terms,administration,organization,mechanism,year,funding,score
"Novel Strategies to Identify GxE Contributions to MS Pathogenesis    DESCRIPTION (provided by applicant):  Multiple sclerosis (MS) is a complex and heterogeneous inflammatory disorder of the central nervous system characterized by myelin loss, varying degrees of axonal pathology, and progressive neurological dysfunction. The combined effect of many genes, environmental exposures acting during defined periods of life, and their interactions in MS is strongly supported by our own work and others. The involvement of HLA class II genes within the major histocompatibility complex (MHC) on chromosome 6p21 is well-established. The identification of non-MHC determinants of MS susceptibility, while progressing, is far from complete. Similar to other complex diseases, genome-wide association studies (GWAS) have begun to unravel the polygenic etiology of MS. However, variants identified through several large GWAS, to date, explain only a very small proportion of MS heritability. The proposed study describes critical post-GWAS era steps to further our current understanding of MS pathogenesis. First, we will utilize next-generation DNA sequence data, high-throughput genotyping and state-of-the-art bioinformatics methods to fully characterize rare, less frequent and common variants within more than 30 MS genes established through recent GWAS and their contribution to the development of MS and disease expression (Aim 1). Next, we will also comprehensively investigate a number of important life-course exposures including prenatal, perinatal, childhood, adolescent and adult time periods, GxE interactions and risk of MS (Aim 2). Finally, we will study genome-wide DNA methylation profiles in a newly established cohort of clinically isolated syndrome (CIS)/early MS cases and matched controls to identify immune cell specific epigenetic influences on the development of MS (Aim 3). We will utilize extraordinary MS case-control resources nested within the large, population-based membership of Northern California Kaiser Permanente, as well as DNA, genetic and clinical data assembled for this project through the International Multiple Sclerosis Genetics Consortium; more than 10,000 individuals of White/European ancestry will be studied using a suite of statistical methods of analysis. Results from proposed epidemiologic studies of the most important MS genes and causal variants in the context of relevant environmental exposures will inform new functional studies, and have potential to support the development of more effective approaches for prevention, diagnosis and treatment.         The complete identification of genetic and environmental influences and how they contribute independently and jointly to the development of MS and expression of particular disease characteristics would play a major role in understanding disease etiology, and would contribute greatly to disease prevention strategies and development of targeted and more effective therapies.         ",Novel Strategies to Identify GxE Contributions to MS Pathogenesis,8463531,R01ES017080,"['6p21', 'Adolescent', 'Adult', 'Bioinformatics', 'Biological Assay', 'California', 'Cells', 'Central Nervous System Diseases', 'Childhood', 'Chromosomes', 'Chronology', 'Clinical Data', 'Clinical Management', 'Collaborations', 'Complex', 'DNA', 'DNA Methylation', 'DNA Sequence', 'Data', 'Data Set', 'Development', 'Diagnosis', 'Dimensions', 'Disease', 'Environmental Exposure', 'Epidemiologic Studies', 'Epidemiology', 'Epigenetic Process', 'Etiology', 'European', 'Foundations', 'Genes', 'Genetic', 'Genetic Variation', 'Genotype', 'Heritability', 'Immune', 'Individual', 'Inflammatory', 'International', 'Laboratories', 'Life', 'Life Cycle Stages', 'MHC Class II Genes', 'Machine Learning', 'Major Histocompatibility Complex', 'Meta-Analysis', 'Methods', 'Modeling', 'Multiple Sclerosis', 'Myelin', 'Neurologic Dysfunctions', 'Odds Ratio', 'Pathogenesis', 'Pathology', 'Perinatal', 'Phenotype', 'Play', 'Population', 'Predisposition', 'Prevention approach', 'Prevention strategy', 'Resources', 'Risk', 'Risk Estimate', 'Role', 'Sampling', 'Site', 'Statistical Methods', 'Surveys', 'Syndrome', 'Testing', 'Time', 'Trust', 'Variant', 'Work', 'base', 'case control', 'cohort', 'disease characteristic', 'disorder prevention', 'disorder risk', 'effective therapy', 'gene environment interaction', 'genome wide association study', 'genome-wide', 'insertion/deletion mutation', 'next generation', 'novel', 'novel strategies', 'outcome forecast', 'population based', 'prenatal', 'tool']",NIEHS,UNIVERSITY OF CALIFORNIA BERKELEY,R01,2013,587939,0.3246794658584835
"Molecular and Genetic Predictors of Disability Progression in MS    DESCRIPTION (provided by applicant):  Multiple Sclerosis (MS) is the most common cause of acquired neurological dysfunction during early and mid adulthood, and affects more than one million people in North America and Western Europe. Compelling data indicate that susceptibility and resistance to MS is partly inherited. The presence of brain inflammation, loss of myelin and neuro-axonal degeneration are hallmarks of the disease. However, the link between these pathological processes remains unknown. An emerging concept bridging this knowledge gap is the alteration of glutamate metabolism causing toxicity of the central nervous system. Clinically, the vast majority of MS patients will experience progressive worsening a decade after onset of the disease. The main goal of this study is to determine the level of brain glutamate in patients with MS using a novel molecular magnetic resonance imaging technique. This non-invasive in vivo methodology provides, for the first time, an estimate of glutamate levels over large brain regions of interest. Specifically, the authors hypothesized that an excess of glutamate levels in MS patient brains is a predictor of neuronal injury, brain atrophy and accumulation of chronic clinical disability. Lastly, the effort will focus on the discovery of patterns of gene expression in the peripheral blood of MS patients through the combined use of state-of- the-art genome wide analysis and molecular biology experimental tools to predict sustained disability progression of MS patients. The authors will use unsupervised and supervised machine learning algorithms to capture relationships between gene expression levels and disease progression.      PUBLIC HEALTH RELEVANCE:  The identification of specific molecular imaging and genetic predictive markers associated with disease progression of MS patients will accelerate advances in research and lead to better therapeutic strategies to prevent the biological process leading to brain inflammation, demyelination, axonal injury and consequent progressive neurological deficits.           PROJECT NARRATIVE The identification of specific molecular imaging and genetic predictive markers associated with disease progression of MS patients will accelerate advances in research and lead to better therapeutic strategies to prevent the biological process leading to brain inflammation, demyelination, axonal injury and consequent progressive neurological deficits.",Molecular and Genetic Predictors of Disability Progression in MS,8322120,R01NS062885,"['Acute', 'Adult', 'Affect', 'Algorithms', 'Area', 'Biological', 'Biological Process', 'Brain', 'Brain region', 'Build-it', 'Candidate Disease Gene', 'Chronic', 'Clinical', 'Cohort Studies', 'DLG1 gene', 'Data', 'Data Set', 'Demyelinations', 'Disease', 'Disease Progression', 'Encephalitis', 'Exhibits', 'Functional disorder', 'Gene Expression', 'Gene Expression Profile', 'Genes', 'Genetic', 'Genetic Variation', 'Glutamate Metabolism Pathway', 'Glutamate Receptor', 'Glutamates', 'Goals', 'Human', 'Image', 'Imaging Techniques', 'Inherited', 'Injury', 'Knowledge', 'Lead', 'Link', 'Machine Learning', 'Magnetic Resonance Imaging', 'Measurement', 'Measures', 'Methodology', 'Molecular', 'Molecular Biology', 'Molecular Genetics', 'Motivation', 'Multiple Sclerosis', 'Multiple Sclerosis Lesions', 'Myelin', 'N-acetylaspartate', 'Network-based', 'Neuraxis', 'Neurologic', 'Neurologic Dysfunctions', 'Neuronal Injury', 'North America', 'Onset of illness', 'Pathologic Processes', 'Pathway interactions', 'Patients', 'Positioning Attribute', 'Predictive Value', 'Predisposition', 'Receptor Gene', 'Research', 'Resistance', 'Resolution', 'Single Nucleotide Polymorphism', 'Spatial Distribution', 'Specimen', 'Surrogate Markers', 'Techniques', 'Technology', 'Therapeutic', 'Therapy Clinical Trials', 'Time', 'Tissues', 'Toxic effect', 'Variant', 'Visit', 'Western Europe', 'axonal degeneration', 'brain tissue', 'brain volume', 'cerebral atrophy', 'clinically relevant', 'cohort', 'design', 'disability', 'experience', 'genetic variant', 'genome wide association study', 'gray matter', 'in vivo', 'interest', 'magnetic resonance spectroscopic imaging', 'molecular imaging', 'novel', 'novel therapeutics', 'peripheral blood', 'prevent', 'public health relevance', 'spectroscopic imaging', 'time interval', 'tool', 'white matter']",NINDS,YALE UNIVERSITY,R01,2012,356041,0.3265579717812412
"Novel Strategies to Identify GxE Contributions to MS Pathogenesis    DESCRIPTION (provided by applicant):  Multiple sclerosis (MS) is a complex and heterogeneous inflammatory disorder of the central nervous system characterized by myelin loss, varying degrees of axonal pathology, and progressive neurological dysfunction. The combined effect of many genes, environmental exposures acting during defined periods of life, and their interactions in MS is strongly supported by our own work and others. The involvement of HLA class II genes within the major histocompatibility complex (MHC) on chromosome 6p21 is well-established. The identification of non-MHC determinants of MS susceptibility, while progressing, is far from complete. Similar to other complex diseases, genome-wide association studies (GWAS) have begun to unravel the polygenic etiology of MS. However, variants identified through several large GWAS, to date, explain only a very small proportion of MS heritability. The proposed study describes critical post-GWAS era steps to further our current understanding of MS pathogenesis. First, we will utilize next-generation DNA sequence data, high-throughput genotyping and state-of-the-art bioinformatics methods to fully characterize rare, less frequent and common variants within more than 30 MS genes established through recent GWAS and their contribution to the development of MS and disease expression (Aim 1). Next, we will also comprehensively investigate a number of important life-course exposures including prenatal, perinatal, childhood, adolescent and adult time periods, GxE interactions and risk of MS (Aim 2). Finally, we will study genome-wide DNA methylation profiles in a newly established cohort of clinically isolated syndrome (CIS)/early MS cases and matched controls to identify immune cell specific epigenetic influences on the development of MS (Aim 3). We will utilize extraordinary MS case-control resources nested within the large, population-based membership of Northern California Kaiser Permanente, as well as DNA, genetic and clinical data assembled for this project through the International Multiple Sclerosis Genetics Consortium; more than 10,000 individuals of White/European ancestry will be studied using a suite of statistical methods of analysis. Results from proposed epidemiologic studies of the most important MS genes and causal variants in the context of relevant environmental exposures will inform new functional studies, and have potential to support the development of more effective approaches for prevention, diagnosis and treatment.         The complete identification of genetic and environmental influences and how they contribute independently and jointly to the development of MS and expression of particular disease characteristics would play a major role in understanding disease etiology, and would contribute greatly to disease prevention strategies and development of targeted and more effective therapies.         ",Novel Strategies to Identify GxE Contributions to MS Pathogenesis,8303052,R01ES017080,"['6p21', 'Adolescent', 'Adult', 'Bioinformatics', 'Biological Assay', 'California', 'Cells', 'Central Nervous System Diseases', 'Childhood', 'Chromosomes', 'Chronology', 'Clinical Data', 'Clinical Management', 'Collaborations', 'Complex', 'DNA', 'DNA Methylation', 'DNA Sequence', 'Data', 'Data Set', 'Development', 'Diagnosis', 'Dimensions', 'Disease', 'Environmental Exposure', 'Epidemiologic Studies', 'Epidemiology', 'Epigenetic Process', 'Etiology', 'European', 'Foundations', 'Genes', 'Genetic', 'Genetic Variation', 'Genotype', 'Heritability', 'Immune', 'Individual', 'Inflammatory', 'International', 'Laboratories', 'Life', 'Life Cycle Stages', 'MHC Class II Genes', 'Machine Learning', 'Major Histocompatibility Complex', 'Meta-Analysis', 'Methods', 'Modeling', 'Multiple Sclerosis', 'Myelin', 'Neurologic Dysfunctions', 'Odds Ratio', 'Pathogenesis', 'Pathology', 'Perinatal', 'Phenotype', 'Play', 'Population', 'Predisposition', 'Prevention approach', 'Prevention strategy', 'Resources', 'Risk', 'Risk Estimate', 'Role', 'Sampling', 'Site', 'Statistical Methods', 'Surveys', 'Syndrome', 'Testing', 'Time', 'Trust', 'Variant', 'Work', 'base', 'case control', 'cohort', 'disease characteristic', 'disorder prevention', 'disorder risk', 'effective therapy', 'gene environment interaction', 'genome wide association study', 'genome-wide', 'insertion/deletion mutation', 'next generation', 'novel', 'novel strategies', 'outcome forecast', 'population based', 'prenatal', 'tool']",NIEHS,UNIVERSITY OF CALIFORNIA BERKELEY,R01,2012,615310,0.3246794658584835
"Molecular and Genetic Predictors of Disability Progression in MS    DESCRIPTION (provided by applicant):  Multiple Sclerosis (MS) is the most common cause of acquired neurological dysfunction during early and mid adulthood, and affects more than one million people in North America and Western Europe. Compelling data indicate that susceptibility and resistance to MS is partly inherited. The presence of brain inflammation, loss of myelin and neuro-axonal degeneration are hallmarks of the disease. However, the link between these pathological processes remains unknown. An emerging concept bridging this knowledge gap is the alteration of glutamate metabolism causing toxicity of the central nervous system. Clinically, the vast majority of MS patients will experience progressive worsening a decade after onset of the disease. The main goal of this study is to determine the level of brain glutamate in patients with MS using a novel molecular magnetic resonance imaging technique. This non-invasive in vivo methodology provides, for the first time, an estimate of glutamate levels over large brain regions of interest. Specifically, the authors hypothesized that an excess of glutamate levels in MS patient brains is a predictor of neuronal injury, brain atrophy and accumulation of chronic clinical disability. Lastly, the effort will focus on the discovery of patterns of gene expression in the peripheral blood of MS patients through the combined use of state-of- the-art genome wide analysis and molecular biology experimental tools to predict sustained disability progression of MS patients. The authors will use unsupervised and supervised machine learning algorithms to capture relationships between gene expression levels and disease progression.      PUBLIC HEALTH RELEVANCE:  The identification of specific molecular imaging and genetic predictive markers associated with disease progression of MS patients will accelerate advances in research and lead to better therapeutic strategies to prevent the biological process leading to brain inflammation, demyelination, axonal injury and consequent progressive neurological deficits.           PROJECT NARRATIVE The identification of specific molecular imaging and genetic predictive markers associated with disease progression of MS patients will accelerate advances in research and lead to better therapeutic strategies to prevent the biological process leading to brain inflammation, demyelination, axonal injury and consequent progressive neurological deficits.",Molecular and Genetic Predictors of Disability Progression in MS,8136044,R01NS062885,"['Acute', 'Adult', 'Affect', 'Algorithms', 'Area', 'Biological', 'Biological Process', 'Brain', 'Brain region', 'Build-it', 'Candidate Disease Gene', 'Chronic', 'Clinical', 'Cohort Studies', 'DLG1 gene', 'Data', 'Data Set', 'Demyelinations', 'Disease', 'Disease Progression', 'Encephalitis', 'Exhibits', 'Functional disorder', 'Gene Expression', 'Genes', 'Genetic', 'Genetic Variation', 'Glutamate Metabolism Pathway', 'Glutamate Receptor', 'Glutamates', 'Goals', 'Human', 'Image', 'Imaging Techniques', 'Inherited', 'Injury', 'Knowledge', 'Lead', 'Link', 'Machine Learning', 'Magnetic Resonance Imaging', 'Measurement', 'Measures', 'Methodology', 'Molecular', 'Molecular Biology', 'Molecular Genetics', 'Motivation', 'Multiple Sclerosis', 'Multiple Sclerosis Lesions', 'Myelin', 'N-acetylaspartate', 'Network-based', 'Neuraxis', 'Neurologic', 'Neurologic Dysfunctions', 'Neuronal Injury', 'North America', 'Onset of illness', 'Pathologic Processes', 'Pathway interactions', 'Patients', 'Pattern', 'Positioning Attribute', 'Predictive Value', 'Predisposition', 'Receptor Gene', 'Research', 'Resistance', 'Resolution', 'Single Nucleotide Polymorphism', 'Spatial Distribution', 'Specimen', 'Surrogate Markers', 'Techniques', 'Technology', 'Therapeutic', 'Therapy Clinical Trials', 'Time', 'Tissues', 'Toxic effect', 'Variant', 'Visit', 'Western Europe', 'axonal degeneration', 'brain tissue', 'brain volume', 'cerebral atrophy', 'clinically relevant', 'cohort', 'design', 'disability', 'experience', 'genetic variant', 'genome wide association study', 'gray matter', 'in vivo', 'interest', 'magnetic resonance spectroscopic imaging', 'molecular imaging', 'novel', 'novel therapeutics', 'peripheral blood', 'prevent', 'public health relevance', 'spectroscopic imaging', 'time interval', 'tool', 'white matter']",NINDS,YALE UNIVERSITY,R01,2011,354969,0.3265579717812412
"Novel Strategies to Identify GxE Contributions to MS Pathogenesis    DESCRIPTION (provided by applicant):  Multiple sclerosis (MS) is a complex and heterogeneous inflammatory disorder of the central nervous system characterized by myelin loss, varying degrees of axonal pathology, and progressive neurological dysfunction. The combined effect of many genes, environmental exposures acting during defined periods of life, and their interactions in MS is strongly supported by our own work and others. The involvement of HLA class II genes within the major histocompatibility complex (MHC) on chromosome 6p21 is well-established. The identification of non-MHC determinants of MS susceptibility, while progressing, is far from complete. Similar to other complex diseases, genome-wide association studies (GWAS) have begun to unravel the polygenic etiology of MS. However, variants identified through several large GWAS, to date, explain only a very small proportion of MS heritability. The proposed study describes critical post-GWAS era steps to further our current understanding of MS pathogenesis. First, we will utilize next-generation DNA sequence data, high-throughput genotyping and state-of-the-art bioinformatics methods to fully characterize rare, less frequent and common variants within more than 30 MS genes established through recent GWAS and their contribution to the development of MS and disease expression (Aim 1). Next, we will also comprehensively investigate a number of important life-course exposures including prenatal, perinatal, childhood, adolescent and adult time periods, GxE interactions and risk of MS (Aim 2). Finally, we will study genome-wide DNA methylation profiles in a newly established cohort of clinically isolated syndrome (CIS)/early MS cases and matched controls to identify immune cell specific epigenetic influences on the development of MS (Aim 3). We will utilize extraordinary MS case-control resources nested within the large, population-based membership of Northern California Kaiser Permanente, as well as DNA, genetic and clinical data assembled for this project through the International Multiple Sclerosis Genetics Consortium; more than 10,000 individuals of White/European ancestry will be studied using a suite of statistical methods of analysis. Results from proposed epidemiologic studies of the most important MS genes and causal variants in the context of relevant environmental exposures will inform new functional studies, and have potential to support the development of more effective approaches for prevention, diagnosis and treatment.      PUBLIC HEALTH RELEVANCE:  The complete identification of genetic and environmental influences and how they contribute independently and jointly to the development of MS and expression of particular disease characteristics would play a major role in understanding disease etiology, and would contribute greatly to disease prevention strategies and development of targeted and more effective therapies.            The complete identification of genetic and environmental influences and how they contribute independently and jointly to the development of MS and expression of particular disease characteristics would play a major role in understanding disease etiology, and would contribute greatly to disease prevention strategies and development of targeted and more effective therapies.         ",Novel Strategies to Identify GxE Contributions to MS Pathogenesis,8207321,R01ES017080,"['6p21', 'Adolescent', 'Adult', 'Bioinformatics', 'Biological Assay', 'California', 'Cells', 'Central Nervous System Diseases', 'Childhood', 'Chromosomes', 'Chronology', 'Clinical Data', 'Clinical Management', 'Collaborations', 'Complex', 'DNA', 'DNA Methylation', 'DNA Sequence', 'Data', 'Data Set', 'Development', 'Diagnosis', 'Dimensions', 'Disease', 'Environmental Exposure', 'Epidemiologic Studies', 'Epidemiology', 'Epigenetic Process', 'Etiology', 'European', 'Foundations', 'Genes', 'Genetic', 'Genetic Variation', 'Genotype', 'Heritability', 'Immune', 'Individual', 'Inflammatory', 'International', 'Laboratories', 'Life', 'Life Cycle Stages', 'MHC Class II Genes', 'Machine Learning', 'Major Histocompatibility Complex', 'Meta-Analysis', 'Methods', 'Modeling', 'Multiple Sclerosis', 'Myelin', 'Neurologic Dysfunctions', 'Odds Ratio', 'Pathogenesis', 'Pathology', 'Perinatal', 'Phenotype', 'Play', 'Population', 'Predisposition', 'Prevention approach', 'Prevention strategy', 'Resources', 'Risk', 'Risk Estimate', 'Role', 'Sampling', 'Site', 'Statistical Methods', 'Surveys', 'Syndrome', 'Testing', 'Time', 'Trust', 'Variant', 'Work', 'base', 'case control', 'cohort', 'disease characteristic', 'disorder prevention', 'disorder risk', 'effective therapy', 'gene environment interaction', 'genome wide association study', 'genome-wide', 'insertion/deletion mutation', 'next generation', 'novel', 'novel strategies', 'outcome forecast', 'population based', 'prenatal', 'tool']",NIEHS,UNIVERSITY OF CALIFORNIA BERKELEY,R01,2011,643215,0.3050156930958262
