text,title,id,project_number,terms,administration,organization,mechanism,year,cost,funding,score
"Leveraging modern analytic approaches to improve diabetes outcomes ABSTRACT Diabetic patients are at risk of developing diabetic heart disease, which may lead to complications in care. Diabetic heart disease patients not only have exceptionally high healthcare expenditures and resource utilization but also are likely to have poor patient outcomes. Studies have shown that early intervention of patients likely to develop diabetic heart disease is cost-effective and yields favorable health outcomes. Therefore, early identiﬁcation of diabetic patients at high-risk of developing diabetic heart disease is crucial to provide effective interventions. The commonly accepted methodology for diabetic heart disease risk prediction is the use of one or more risk scoring systems. However, these risk functions may not generalize well for the diabetes patient and may suffer from poor calibration when used on different cohorts. Moreover, the scoring systems have only been studied on coronary heart disease, one variant of diabetic heart disease while heart failure and diabetic cardiomyopathy remain important, yet insufﬁciently studied problems. Machine learning offers the ability to perform accurate predictive analytics and has been proposed as a way to identify and manage high-risk patients. The primary goal of this proposal is to develop a high-impact and practical risk prediction model that can be used to per- form early identiﬁcation of high-risk diabetic heart disease patients. Given the heterogeneity and complexity of patient information in electronic health records, the model needs to capitalize on the multi-dimensional temporal nature of pa- tient records to extract identifying characteristics of patients that will develop diabetic heart disease. To accomplish this, we will leverage modern machine learning approaches such as tensor factorization and natural language processing to model complex patient characteristics, provide a more complete representation of the patient, and uncover excellent predictors of diabetic heart disease risk. An existing dataset that contains the de-identiﬁed electronic health records of approximately 4,100 diabetic patients from the Emory Healthcare System to compare the predictive power of machine learning-based algorithms with the standard risk scoring systems. These algorithms will be evaluated on calibration, discrimination, and ease of interpretability. The results of this work will provide insight as to how to develop a machine learning–based prediction system that can identify high-risk diabetic heart disease patients. The study may also shed light on the best approaches for fusing data from multiple heterogeneous sources to build a better predictive model and potentially identify novel indicators of high- risk diabetic heart disease factors. Moreover, the work will help inform a larger multi-site study of diabetic heart disease risk prediction and develop methods to generalize the results to a broader spectrum of comorbidities. This project is consistent with the National Library of Medicine's mission to translate biomedical research into practice. PROJECT NARRATIVE Diabetic patients are risk of developing diabetic heart disease which can lead to high healthcare expenditure, high resource utilization, and poor patient outcomes. Existing diabetic risk prediction models can suffer from poor calibration and predictive accuracy. This project develops a novel and practical analytic tool to identify patients at high-risk of developing diabetic heart disease.",Leveraging modern analytic approaches to improve diabetes outcomes,9583770,K01LM012924,"['Adopted', 'Age', 'Algorithms', 'Biomedical Research', 'Calibration', 'Caring', 'Characteristics', 'Chronic Disease', 'Clinical', 'Clinical Data', 'Comorbidity', 'Complex', 'Complications of Diabetes Mellitus', 'Computer software', 'Congestive', 'Coronary', 'Coronary heart disease', 'Data', 'Data Set', 'Data Sources', 'Diabetes Mellitus', 'Diagnosis', 'Discrimination', 'Disease', 'Early Intervention', 'Early identification', 'Economic Burden', 'Elderly', 'Electronic Health Record', 'Epidemic', 'Evaluation', 'Future', 'Goals', 'Health', 'Health Expenditures', 'Healthcare', 'Healthcare Systems', 'Heart Diseases', 'Heart failure', 'Heterogeneity', 'Institution', 'Intervention', 'Lead', 'Light', 'Machine Learning', 'Methodology', 'Methods', 'Mission', 'Modeling', 'Modernization', 'Natural Language Processing', 'Nature', 'Outcome', 'Patient risk', 'Patient-Focused Outcomes', 'Patients', 'Pharmaceutical Preparations', 'Population', 'Predictive Analytics', 'Predictive Value', 'Prevalence', 'Prevention', 'Procedures', 'Records', 'Research Personnel', 'Resources', 'Risk', 'Site', 'Source', 'Structure', 'System', 'Translating', 'United States', 'United States National Library of Medicine', 'Variant', 'Work', 'analytical tool', 'base', 'clinical practice', 'cohort', 'computer science', 'cost effective', 'design', 'diabetic', 'diabetic cardiomyopathy', 'diabetic patient', 'effective intervention', 'electronic structure', 'epidemiologic data', 'heart disease risk', 'high risk', 'improved', 'insight', 'novel', 'open source', 'predictive modeling', 'prospective', 'prototype', 'research to practice', 'secondary analysis']",NLM,EMORY UNIVERSITY,K01,2018,180684,507546965,0.05283457544857333
"Novel Non-Invasive Coronary Flow Patterning to Predict Early Coronary Microvascular Disease PROJECT SUMMARY  Coronary microvascular disease (CMD) is notoriously difficult to diagnose non-invasively, and current methods of assessing CMD utilize only the peak velocity of the coronary flow pattern. While new imaging techniques such as cardiac magnetic resonance imaging (MRI) have improved the assessment coronary perfusion, there are currently no non-invasive methods that incorporate the coronary flow pattern over a complete cardiac cycle to definitively assess and predict the development of CMD.  Coronary blood flow (CBF) reflects the summation of flow in the coronary microcirculation, and our lab has begun to harness the full CBF pattern under varying flow and disease conditions (e.g. type 2 diabetes) to determine whether it might harbor novel clues leading to the early detection of CMD. Our past and preliminary data indicate an early onset of CMD in both type 2 diabetes mellitus (T2DM) and metabolic syndrome (MetS) that occurs prior to the onset of macrovascular complications and that are characterized by blood flow impairments and alterations in coronary resistance microvessel (CRM) structure, function, and biomechanics. Our data also uncovered innovative correlations between CRM structure/biomechanics and our newly-defined features of the coronary flow pattern, some of which were unique to normal or diabetic mice. We have initially utilized these CBF features, in the presence and absence of other factors such as cardiac function, to develop a mathematical model in collaboration with Drs. Christopher Bartlett and William Ray that to date demonstrated that 6 simple factors can predict a normal vs. diabetic coronary flow pattern with 85% predictive accuracy. Utilizing a multidisciplinary approach, these preliminary data strongly suggest that the coronary flow pattern and physiological modulators of it (e.g. coronary micovascular structure/function/biomechanics, cardiac function, etc), may be useful in directly diagnosing early CMD. Therefore, we hypothesize that dissecting the elements that influence coronary flow patterning will be critical determinants in the direct assessment of coronary microvascular disease using computational modeling. Using our previous publications and our preliminary data as guides, the hypothesis will be tested by addressing two specific aims: 1) Determine whether unique time-dependent CBF patterning in normal and T2DM is dictated by a combination of CRM remodeling and biomechanics, coronary flow pattern dynamics, and cardiac function, permitting the development of a computational model to accurately predict CMD; 2) Determine the reproducibility and robustness of the machine learning model in predicting CMD in a diet-induced obesity/diabetes mouse model. If successful, these studies will be the first to simultaneously examine the influence of CRMs, CBF, and cardiac structure/function on the distinct pattern of coronary flow, and it will determine whether a mathematical model may be useful in establishing a direct assessment of CMD to eventually enable clinicians to conduct a more direct non-invasive diagnosis of CMD for the prevention and/or treatment of heart disease. PROJECT NARRATIVE Coronary Artery Disease (CAD) is the leading cause of heart disease and is associated with hypertension, diabetes, and metabolic syndrome. Coronary Microvascular Disease (CMD) is comprised of structural and functional deficits of the tiny coronary arteries that may be an earlier indicator of disease prior to the onset of overt CAD. The proposed multidisciplinary research aims to develop a computational artificial intelligence model that will accurately predict CMD based on a non-invasive coronary flow pattern obtained by Doppler echocardiography.",Novel Non-Invasive Coronary Flow Patterning to Predict Early Coronary Microvascular Disease,9584176,R21EB026518,"['Address', 'Age', 'Artificial Intelligence', 'Biomechanics', 'Blood flow', 'Cardiac', 'Collaborations', 'Computer Simulation', 'Coronary', 'Coronary Arteriosclerosis', 'Coronary artery', 'Data', 'Development', 'Diabetes Mellitus', 'Diabetic mouse', 'Diet', 'Disease', 'Doppler Echocardiography', 'Early Diagnosis', 'Echocardiography', 'Elements', 'Heart Diseases', 'Hyperemia', 'Hypertension', 'Imaging Techniques', 'Impairment', 'Interdisciplinary Study', 'Laboratories', 'Machine Learning', 'Magnetic Resonance Imaging', 'Measures', 'Metabolic syndrome', 'Methods', 'Microcirculation', 'Microvascular Dysfunction', 'Modeling', 'Non-Insulin-Dependent Diabetes Mellitus', 'Obesity', 'Pattern', 'Physiological', 'Publications', 'Reproducibility', 'Resistance', 'Structure', 'Testing', 'Time', 'base', 'coronary perfusion', 'db/db mouse', 'diabetic', 'disorder prevention', 'early onset', 'experimental study', 'heart function', 'improved', 'innovation', 'interdisciplinary approach', 'macrovascular disease', 'mathematical model', 'noninvasive diagnosis', 'novel', 'pressure', 'prevent']",NIBIB,RESEARCH INST NATIONWIDE CHILDREN'S HOSP,R21,2018,190000,43994644,0.08143373604567099
"Real-time Monitoring of Zebrafish ECG with Automated Aberrant Pattern Detection Abstract Sensoriis, Inc is a company that, develops evidence-based sensing solutions to support biological investigations and address health care problems. The goal of this NIH STTR grant with University of Washington (UW) is to provide a flexible system to assess cardiac electrical activities in zebrafish models, supporting heart disease studies and drug screening. Unlike humans, zebrafish hearts can fully regenerate following cardiac injury, thereby providing a tractable model system to study endogenous heart regeneration. Zebrafish have also proven to be an ideal vertebrate model system for phenotype-based screening owing to their physiological similarity to mammals. Further, zebrafish model enables a forward genetic approach to reveal the genetic basis and underlying molecular mechanisms of numerous heart diseases. The conventional setup for cardiac phenotype acquisition in zebrafish (i.e. electrocardiogram – ECG) involves sedation causing variation in functionality. To date, there is no system which can offer cardiac phenotype monitoring in freely-swimming zebrafish, not to mention for multiple fish simultaneously. In this context, we propose and develop 1) a wireless flexible “jacket” to be worn by zebrafish for real-time assessment of electrical cardiac phenotypes, namely ECG; and 2) a simple-yet-novel apparatus to collect ECG of multiple awake fish. Our devices provide pivotal platforms for cardiac phenotype-related investigations. The obtained data will be processed by smart algorithms to detect aberrant ECG patterns in real time. The proposed systems will facilitate related studies using zebrafish models. Further, the success of this platform also paves the avenue for regenerative medicine and developmental biology studies as well as stem cell-based therapies for cardiac repair. In Phase I of this STTR grant, we will develop i) a polymer-based microelectrode array (MEA) jacket that could be comfortably worn by the zebrafish and provide wireless ECG acquisition; and ii) a 4-chamber apparatus for simultaneous recording of ECG in awake fish. Machine learning-based programs with embedded algorithms will be developed to distinguish ECG patterns such as heart rate, ST and QT intervals, thus can identify anomalies, such as arrhythmias or prolonged QTs. For proof of concept, the system will be validated and compared. PROJECT NARRATIVE In this Phase I STTR grant, Sensoriis, Inc and the University of Washington will develop 1) a world-first wireless flexible membrane for zebrafish with a micro-electrode array (MEA) for ECG measurement and electronics for wireless powering and communication with an external unit; 2) a simple-yet-novel 4-chamber apparatus to acquire ECG of 4 awake fish; and 3) Machine learning-based programs to process the data and detect desired patterns. The goal is to facilitate and reduce cost and time of cardiac phenotype-based screening in the zebrafish models, supporting numerous studies. The proposed system also pave the avenue for heart-disease investigations and stem cell-based therapy validation using zebrafish models.",Real-time Monitoring of Zebrafish ECG with Automated Aberrant Pattern Detection,9556073,R41OD024874,"['Address', 'Adult', 'Affect', 'Algorithmic Analysis', 'Algorithms', 'Amiodarone', 'Animals', 'Arrhythmia', 'Behavior', 'Biological', 'Biological Models', 'Cardiac', 'Cardiac development', 'Cell Therapy', 'Characteristics', 'Collaborations', 'Collection', 'Columbidae', 'Communication', 'Coupling', 'Custom', 'Data', 'Detection', 'Development', 'Developmental Biology', 'Devices', 'Discipline', 'Drug Screening', 'EKG P Wave', 'EKG QRS Complex', 'Electrocardiogram', 'Electrodes', 'Electronics', 'Embryo', 'Environment', 'Fishes', 'Generations', 'Genetic', 'Genetic Diseases', 'Goals', 'Grant', 'Healthcare', 'Heart', 'Heart Diseases', 'Heart Injuries', 'Heart Rate', 'Housing', 'Human', 'Human Genetics', 'Investigation', 'Machine Learning', 'Mammals', 'Manuals', 'Measurement', 'Membrane', 'Mental Depression', 'Microelectrodes', 'Modeling', 'Molecular', 'Molecular Biology', 'Monitor', 'Mutagenesis', 'Myocardium', 'Names', 'Natural regeneration', 'Neurobiology', 'Noise', 'Optics', 'Pattern', 'Pharmaceutical Preparations', 'Pharmacology and Toxicology', 'Phase', 'Phenotype', 'Physiological', 'Polymers', 'Process', 'Regenerative Medicine', 'Resources', 'Role', 'Sampling', 'Scientist', 'Sedation procedure', 'Signal Pathway', 'Signal Transduction', 'Sinus', 'Small Business Technology Transfer Research', 'Stem cells', 'Swimming', 'System', 'Systems Biology', 'Testing', 'Time', 'United States National Institutes of Health', 'Universities', 'Validation', 'Variant', 'Washington', 'Wireless Technology', 'Work', 'Zebrafish', 'awake', 'base', 'cardiac regeneration', 'cardiac repair', 'cost', 'drug use screening', 'evidence base', 'flexibility', 'gene function', 'genetic approach', 'heart electrical activity', 'injured', 'new technology', 'novel', 'programs', 'real time monitoring', 'screening', 'success', 'temporal measurement', 'tool']",OD,"SENSORIIS, INC.",R41,2018,224229,769421,0.08110758310047182
"System-independent quantitative cardiac CT perfusion System-independent quantitative cardiac CT perfusion Summary BioInVision, Inc. and Case Western Reserve University researchers will develop software for quantitative anal- ysis of cardiac CT perfusion (CCTP), creating an important tool for evaluation of cardiovascular disease. With this product, cardiologists will be able to identify functional flow deficits in coronary artery territories. When one combines functional myocardial blood flow (MBF) with coronary anatomy from computed tomography angi- ography (CTA), it provides needed information on the physiologic significance of a stenosis. The CTA+CCTP combo could provide an ideal gateway exam for deciding whether to send a patient for percutaneous invasive coronary angiography and potential intervention (e.g., stenting). In addition, if flow is low and no stenosis is present, it will suggest microvascular disease, a very prevalent ailment of growing concern, especially among women and in diabetes. CT compares favorably to all other non-invasive cardiovascular imaging techniques (SPECT, PET, and MRI). It is available in many settings, including emergency departments. It provides both MBF and reliable coronary anatomy, not available in any other single modality. It has excellent resolution ena- bling detection of endocardial perfusion deficit, thought to be an early disease indicator that is impossible to assess with SPECT. CT is cheaper and has higher patient throughput than MRI or PET. With inclusion of MBF, CT would have an excellent opportunity to disrupt the diagnostic pathway leading to percutaneous intervention, a pathway now dominated by SPECT myocardial imaging, which includes zero information about coronary anatomy. To achieve reliable, accurate CT MBF measurements, we will invoke innovations to reduce beam hardening and to make reliable estimates of flow. Currently, CT perfusion is done on different CT machines with manufacturers’ proprietary software, using algorithms that can give erroneous MBFs. Applicable to any commercial scanner; our solution would harmonize measurements across acquisition systems providing trust- worthy, standardized measurements to clinicians, thereby improving management of cardiovascular patients. Narrative We will develop software to enable reliable evaluation of blood flow in heart tissue using CT imaging. With suc- cess, our project could lead to an improved gateway examination that could reduce unnecessary invasive cor- onary angiography, thereby reducing costs, patient discomfort, patient risk, and possibly unnecessary interven- tional therapies.",System-independent quantitative cardiac CT perfusion,9622204,R41HL144271,"['Accident and Emergency department', 'Affect', 'Algorithms', 'Anatomy', 'Angiography', 'Attention', 'Benchmarking', 'Blood Vessels', 'Blood flow', 'Calibration', 'Cardiac', 'Cardiovascular Diseases', 'Cardiovascular system', 'Cause of Death', 'Chest Pain', 'Clinical', 'Clinical Data', 'Computer software', 'Confidence Intervals', 'Coronary', 'Coronary Angiography', 'Coronary artery', 'Cost Savings', 'Coupled', 'Data', 'Detection', 'Development', 'Diabetes Mellitus', 'Diagnostic', 'Disease', 'Dose', 'Electrocardiogram', 'Evaluation', 'Family suidae', 'Heart', 'Image', 'Imaging Techniques', 'Inferior', 'Intervention', 'Iodine', 'Lead', 'Machine Learning', 'Magnetic Resonance Imaging', 'Manufacturer Name', 'Measurement', 'Methods', 'Microvascular Dysfunction', 'Modality', 'Modeling', 'Morphologic artifacts', 'Myocardial', 'Myocardium', 'Obesity', 'Pathway interactions', 'Patient risk', 'Patients', 'Perfusion', 'Persons', 'Phase', 'Physiological', 'Physiology', 'Positron-Emission Tomography', 'Pre-Clinical Model', 'Prevalence', 'Quantitative Evaluations', 'Research', 'Research Personnel', 'Resolution', 'Source', 'Standardization', 'Stenosis', 'Stents', 'System', 'Test Result', 'Testing', 'Therapeutic Intervention', 'Tissues', 'Trust', 'Universities', 'Woman', 'X-Ray Computed Tomography', 'blood flow measurement', 'cardiovascular imaging', 'cost', 'design', 'detector', 'digital', 'imaging system', 'improved', 'innovation', 'noninvasive diagnosis', 'perfusion imaging', 'pre-clinical', 'prototype', 'research and development', 'single photon emission computed tomography', 'software development', 'success', 'tool', 'virtual']",NHLBI,"BIOINVISION, INC.",R41,2018,224240,0,0.049676136960376524
"Automated coronary artery calcification scoring for cardiovascular risk screening ABSTRACT The World Health Organization lists cardiovascular disease as the most common cause of death worldwide at 31% of all deaths. Coronary artery calcium (CAC) scoring has become the most reliable predictor of future coronary artery disease (CAD) events in the asymptomatic population. CAC scores are currently only reported on ECG-gated CT examinations that are ordered when the primary indication is cardiac in nature. However, in 2007 there were 7.1 million non-cardiac thoracic CT scans ordered with lungs as the primary indication where CAC scores could have been reported. An additional 7-10 million CT lung screening scans are expected to be ordered per year as lung screening programs grow. Because lung cancer risk factors and CAD risk factors overlap significantly, most these patients could benefit greatly from having their CAC score reported as part of their non-cardiac CT examination. This could dramatically improve decision making, quality of care, and lower expenses due to future CAD interventions and cardiac specific CT scans. The goal of this project is to develop a fully automated software application that can report CAC scores on both gated and ungated thoracic CT scans with seamless integration into the Radiology workflow. A successful completion of this project will deliver a product capable of dramatically increasing the number of people that receive early intervention for CAD, thereby increasing quality of care and lowering costs. This Phase I application proposes first creating an algorithm capable of automatically calculating global CAC scores from both ECG-gated and ungated CT scans using CAC segmentations performed by an expert physician. If successful, the Phase II project will perform robust clinical validation adequate for an FDA 510(k) submission. NARRATIVE The goal of this project is to develop a fully automated software application that can report CAC scores on both gated and ungated thoracic CT scans with seamless integration into the Radiology workflow. A successful completion of this project will deliver a product capable of dramatically increasing the number of people that receive early intervention for CAD, thereby increasing quality of care and lowering costs.",Automated coronary artery calcification scoring for cardiovascular risk screening,9555974,R43HL139273,"['Agatston Score', 'Algorithms', 'Bone Density', 'Calcium', 'Cardiac', 'Cardiovascular Diseases', 'Categories', 'Cause of Death', 'Cessation of life', 'Chest', 'Chronic Obstructive Airway Disease', 'Clinical', 'Computer software', 'Coronary Arteriosclerosis', 'Coronary artery', 'Correlation Studies', 'Data', 'Data Set', 'Decision Making', 'Detection', 'Development', 'Diagnostic', 'Dose', 'Early Intervention', 'Electrocardiogram', 'Event', 'Future', 'Goals', 'Human', 'Image', 'Interstitial Lung Diseases', 'Intervention', 'Label', 'Lesion', 'Literature', 'Lung', 'Lung CAT Scan', 'Lung nodule', 'Malignant neoplasm of lung', 'Manuals', 'Measures', 'Modeling', 'Multi-Ethnic Study of Atherosclerosis', 'Nature', 'Patients', 'Performance', 'Phase', 'Physicians', 'Population', 'Predictive Value', 'Preventive measure', 'Quality of Care', 'Radiology Specialty', 'Reporting', 'Risk Factors', 'Scanning', 'Techniques', 'Training', 'Validation', 'Vision', 'World Health Organization', 'X-Ray Computed Tomography', 'base', 'cardiovascular risk factor', 'clinical effect', 'clinically relevant', 'compliance behavior', 'coronary artery calcification', 'coronary artery calcium', 'coronary calcium scoring', 'cost', 'deep learning', 'imaging biomarker', 'improved', 'innovation', 'learning strategy', 'multitask', 'quantitative imaging', 'screening', 'screening program', 'smoking cessation', 'success']",NHLBI,"IMBIO, LLC",R43,2018,224403,930271,-0.024733728779266474
