text,title,id,project_number,terms,administration,organization,mechanism,year,cost,funding,score
"Prospective sudden cardiac death risk stratification using CMR and echocardiography machine learning in mitral valve prolapse PROJECT SUMMARY Mitral valve prolapse (MVP) is a common valvulopathy affecting over 170 million worldwide. Every year, 0.4- 1.9% of individuals with MVP will develop sudden cardiac arrest (SCA) or sudden cardiac death (SCD), and 7% of SCDs in the young are caused by MVP. However, predictors of this devastating outcome are not readily available, and indications for a primary prevention implantable cardioverter defibrillator (ICD) in MVP are lacking. Severe mitral regurgitation explains only 50% of SCA cases in MVP. SCD/SCA risk has also been linked to a bileaflet phenotype with mild MR, mitral annular disjunction (MAD), and left ventricular focal fibrosis on cardiac magnetic resonance (CMR)-late gadolinium enhancement (LGE) images. Such imaging parameters (including LGE) have not been evaluated prospectively. Moreover, they are not consistently found in SCA survivors, and diffuse fibrosis has been proposed as an alternative arrhythmic substrate by our group and others based on CMR/T1 mapping, strain echocardiography, and post-mortem data. Overall, it is challenging to pinpoint a unique imaging phenotype, and uncertainty exists about which MVP patients should undergo CMR. Regardless of arrhythmic phenotype, complex ventricular ectopy (ComVE - defined as frequent polymorphic PVCs, bigeminy or non-sustained ventricular tachycardia) is detected in 80-100% of MVP cases prior to SCA or SCD. ComVE, commonly associated with left ventricular fibrosis on CMR, is linked to higher all-cause mortality and SCA rates (20% versus 12% if no ComVE, p < 0.05) based on preliminary cross-sectional data. Our central hypothesis is that MVP patients with ComVE, because of the higher prevalence of either LGE or abnormal T1 mapping, represent ideal CMR candidates regardless of leaflet involvement or MAD, and can be rapidly identified by an automated “surveillance” tool within a large echocardiographic database. Moreover, we hypothesize that fibrosis is the strongest predictor of SCD/SCA in an unprecedented, multi-center effort to longitudinally assess clinical and CMR parameters of arrhythmic risk in MVP. Specifically, we aim to 1) Assess the role of CMR as a screening tool for fibrosis in MVP with ComVE incorporating T1 mapping in addition to LGE in an unselected MVP sample; 2) Develop an echo-based machine-learning algorithm to detect MVP with ComVE, test its association with myocardial fibrosis on CMR and longitudinal SCD/SCA risk; and 3) Build a novel prospective SCD/SCA risk prediction model in MVP. Better selection of CMR candidates and development of a SCD/SCA risk prediction tool inclusive of fibrosis by CMR are expected to dramatically improve risk stratification in MVP and establish future criteria for primary prevention ICD trials. PROJECT NARRATIVE Every year, 0.4-1.9% of individuals with mitral valve prolapse (MVP) will develop sudden cardiac death or arrest. In this application we propose to better identify those at risk by using cardiac magnetic resonance and echocardiography-based artificial intelligence, with the long-term goal of selecting those that may benefit most from a defibrillator. .",Prospective sudden cardiac death risk stratification using CMR and echocardiography machine learning in mitral valve prolapse,10034460,R01HL153447,"['Affect', 'Artificial Intelligence', 'Autopsy', 'California', 'Cardiac', 'Clinical', 'Clinical Markers', 'Complex', 'Data', 'Databases', 'Defibrillators', 'Development', 'Diffuse', 'Echocardiography', 'Fibrosis', 'Future', 'Gadolinium', 'Goals', 'Heart Arrest', 'High Prevalence', 'Holter Electrocardiography', 'Hybrids', 'Image', 'Image Enhancement', 'Implantable Defibrillators', 'Individual', 'Lead', 'Left', 'Link', 'Machine Learning', 'Magnetic Resonance', 'Mission', 'Mitral Valve Insufficiency', 'Mitral Valve Prolapse', 'Myocardial', 'Outcome', 'Patients', 'Phenotype', 'Population', 'Prevalence', 'Primary Prevention', 'Registries', 'Retrospective Studies', 'Risk', 'Risk stratification', 'Role', 'Sampling', 'San Francisco', 'Screening procedure', 'Survivors', 'Testing', 'Training', 'Uncertainty', 'United States National Institutes of Health', 'Universities', 'Validation', 'Ventricular', 'Ventricular Tachycardia', 'base', 'cardiovascular risk factor', 'coronary fibrosis', 'cost', 'extracellular', 'hemodynamics', 'high risk', 'improved', 'machine learning algorithm', 'mortality', 'neural network architecture', 'novel', 'prognostic significance', 'prospective', 'recurrent neural network', 'risk prediction model', 'secondary analysis', 'stem', 'sudden cardiac death', 'tool']",NHLBI,"UNIVERSITY OF CALIFORNIA, SAN FRANCISCO",R01,2020,810751,685608202,0.03558952914413229
"Computer-Assisted Histologic Evaluation of Cardiac Allograft Rejection Project Summary Though cardiac transplantation is a lifesaving intervention, cardiac allograft rejection (CAR) remains a relatively common and serious complication that confers an increased risk of acute graft failure and adverse patient outcomes. For three decades, endomyocardial biopsy (EMB) with histological grading, as recommended by the International Society of Heart and Lung Transplantation (ISHLT) has been the broadly applied standard for CAR diagnosis. However, it is widely appreciated that the ISHLT rejection grading standard lacks diagnostic accuracy and has limited ability to discern the mechanism of rejection. These limitations expose patients to risks of both over-treatment and under-treatment, and highlight the unmet need for more accurate and informative approaches to histopathologic analysis of EMB samples. Our team is a leader in computational pathology image analysis with over 200 papers and >30 issued patents in this area. We have already developed and evaluated a computer assisted histopathology grading evaluation (CACHE) scheme which (1) in N=205 patients, had an area under the receiver operating characteristic curve (AUC)=0.95 compared to two cardiac pathologists (mean AUC=0.74) in distinguishing normal from failing hearts and (2) could distinguish low and high ISHLT rejection grades in N=1109 patients with a performance that exceeds that of trained cardiac pathologists. Recognizing the frequent discordance between ISHLT rejection grade and the clinical trajectory of a rejection event, we will further develop and optimize CACHE to identify new “grade agnostic” morphologic biomarkers of clinically serious CAR. Our scientific premise is that morphologic biomarkers prioritized based on their correlation to patients’ clinical trajectories and underlying immunological disease mechanisms will generate an accurate, consistent and informative classifier for diagnosing allograft rejection. In service of this hypothesis, the proposed research will address three specific aims. In Aim 1, we will utilize computational image analysis to discover the morphologic biomarkers of rejection-related injury which are needed to develop a classifier capable of assessing the clinical trajectory of CAR. In Aim 2, we will provide mechanistic annotation of biomarkers identified in Aim 1 through correlation with in-situ immunologic markers using custom multi-parameter immunofluorescence panels. In Aim 3, we employ a multicenter, prospective cohort to validate the diagnostic and mechanistic accuracy of the new rejection classifier developed in Aims 1 and 2. Ultimately, development of a more accurate and mechanistically informative tool for morphologic diagnosis of CAR will improve patient outcomes by reducing over- and under- treatment and inspire applications in other organ transplants. Interestingly, development of a superior histologic diagnostic tool will empower development of alternative, biopsy-free diagnostic approaches that have been handicapped by the necessity of comparison with the flawed ISHLT rejection grade as a reference standard. Project Narrative For heart transplant recipients, allograft rejection remains a relatively common and serious complication associated with adverse patient outcomes. Shortcomings of the current rejection grading standard for heart biopsies leads to both over- and under-treatment, accordingly, this proposal will develop and validate a computer assisted rejection grading classifier that is more accurate, consistent and informative for diagnosing heart allograft rejection. Improved diagnostic accuracy will improve patient outcomes, inspire similar applications in other organ transplants and empower development of additional technologies that have been constrained by the current flawed rejection standard.",Computer-Assisted Histologic Evaluation of Cardiac Allograft Rejection,10070406,R01HL151277,"['Acute', 'Address', 'Allografting', 'Antibodies', 'Archives', 'Area', 'Benign', 'Biological Markers', 'Biopsy', 'Biopsy Specimen', 'Cardiac', 'Cells', 'Classification', 'Clinical', 'Clinical Trials Design', 'Complication', 'Computer Assisted', 'Computer Vision Systems', 'Custom', 'Data', 'Derivation procedure', 'Development', 'Diagnosis', 'Diagnostic', 'Disabled Persons', 'Disease', 'Evaluation', 'Event', 'Flow Cytometry', 'Functional disorder', 'Gene Expression Profiling', 'Graft Rejection', 'Guidelines', 'Heart', 'Heart Transplantation', 'Heart-Lung Transplantation', 'Histologic', 'Histopathologic Grade', 'Histopathology', 'Human', 'Image', 'Image Analysis', 'Immune', 'Immune System Diseases', 'Immunofluorescence Immunologic', 'Immunologic Markers', 'Immunologics', 'In Situ', 'Injury', 'International', 'Interobserver Variability', 'Intervention', 'Journals', 'Legal patent', 'Lymphocyte', 'Machine Learning', 'Malignant neoplasm of lung', 'Mediating', 'Medical', 'Methods', 'Molecular', 'Monitor', 'Morphology', 'Organ Transplantation', 'Outcome', 'Paper', 'Pathologist', 'Patient-Focused Outcomes', 'Patients', 'Pattern', 'Performance', 'Population', 'Prevention', 'Prospective cohort', 'Protocols documentation', 'ROC Curve', 'Recurrence', 'Reference Standards', 'Research', 'Retrospective cohort', 'Risk', 'Sampling', 'Scheme', 'Services', 'Severities', 'Slide', 'Societies', 'Stains', 'Syndrome', 'Technology', 'Testing', 'Therapeutic', 'Tissue imaging', 'Tissues', 'Training', 'Transplant Recipients', 'Transplantation', 'allograft rejection', 'base', 'biomarker discovery', 'biomarker validation', 'clinical predictors', 'clinically significant', 'cohort', 'diagnostic accuracy', 'feature detection', 'graft failure', 'heart allograft', 'heart imaging', 'improved', 'innovation', 'molecular marker', 'novel', 'outcome forecast', 'overtreatment', 'pathology imaging', 'phenotypic data', 'population based', 'post-transplant', 'prospective', 'screening', 'success', 'tool', 'transplant centers', 'treatment as usual', 'treatment choice']",NHLBI,UNIVERSITY OF PENNSYLVANIA,R01,2020,845590,593605914,0.061360585205331455
"HLS-Cardiac Safety AI Trained Human Heart and Micro Heart Model HLS17-12. The US FDA is considering to establish a new cardiac safety assessment approach  defined by a new paradigm called, “Comprehensive in vitro Proarrhythmia Assay (CIPA)”. The CIPA will 1) assess drug effects on each cardiac ion channel type individually using a high- throughput assay ion channel assays, 2) compute net effect on repolarization and risks for  torsade pointes (TdP) using a mathematical model, and 3) confirm the computational prediction by measuring the drug’s effects on action potentials in induced pluripotent stem cell (iPSC) derived human cardiac myocytes (CMs). This paradigm shift, if successful, could reduce the cost of  cardiac safety analyses by replacing or lowering the requirement to perform an expensive ($2-4 million) thorough QT study during clinical trials. Protecting consumers from drug induced  arrhythmia and sudden deaths is a paramount importance for the regulators and pharmaceutical companies as well as lowing the cost of drug development. Many cardiac safety scientists, however, are skeptical about CIPA’s approach since CMs derived from human iPSCs exhibit a poor excitation-contraction coupling due to their immaturity. In addition, a proposed CIPA mathematical model was developed to simulate electrophysiology of human adult CMs, so there is a mismatch between experimental system and computational tool. To address these concerns, we proposed three specific aims in tw0 phases by following Fast- Track SBIR processes. Phase I feasibility Aim 1 will measure drug-induced changes in AP and CaT using human adult heart slices isolated from human donors. Here we will confirm our  successful handling and analyzing human adult heart slices, which will be based on a recently  published protocol by our collaborator, Dr. Igor Efimov, at George Washington University. After this validation, we will move on to perform the following two studies: Aim 2. Compare drug-induced changes in AP and CaT in NuHearts generated from adult CMs and cardiac fibroblasts from same human donor hearts; Aim 3. Validate and improve the computational models and train an artificial intelligence to predict cardiac safety risks of unknow compounds. After our successful completion proposed projects, we can establish an unprecedented cardiac safety assessment platform that can predict safety issues using a well-trained AI without doing any experiments using human heart slices that are rarely accessible for most of the safety  laboratories or biotech firms. Because nearly one third of drug candidates fails to reach market due to its cardiac safety concerns, a better safety assessment approach without increasing its cost is needed to improve productivity of pharmaceutical industry. The proposed project combines computational and experimental analyses of cardiac safety parameters using adult heart cells isolated from a donor heart and its stem cell derived heart muscle cells to build a better but cost-effective cardiac safety assessment system. A successfully validated system enables drug developers to arcuately predict a new drug’s cardiac safety profile by only running cost-effective experiments using stem cell derived heart muscle cells that are accessible to many drug developers.",HLS-Cardiac Safety AI Trained Human Heart and Micro Heart Model,9948757,R44HL139248,"['3-Dimensional', 'Action Potentials', 'Address', 'Adult', 'Arrhythmia', 'Artificial Intelligence', 'Biological Assay', 'Biomedical Research', 'Biotechnology', 'Calcium', 'Cardiac', 'Cardiac Myocytes', 'Cardiotoxicity', 'Cells', 'Clinical', 'Clinical Trials', 'Communities', 'Computer Analysis', 'Computer Models', 'Contracts', 'Coupling', 'DNA Sequence Alteration', 'Data', 'Development', 'Dose', 'Drug Costs', 'Drug Industry', 'Electrophysiology (science)', 'Exhibits', 'Expert Systems', 'Fibroblasts', 'Gene Expression', 'Generations', 'Genetic', 'Genetic Predisposition to Disease', 'Guidelines', 'Heart', 'Human', 'In Vitro', 'Individual', 'Ion Channel', 'Laboratories', 'Marketing', 'Measures', 'Methods', 'Michigan', 'Mitochondria', 'Modeling', 'Pharmaceutical Preparations', 'Pharmacologic Substance', 'Pharmacology', 'Phase', 'Phenotype', 'Physiology', 'Population Heterogeneity', 'Preclinical Testing', 'Probability', 'Process', 'Productivity', 'Protocols documentation', 'Publishing', 'Pump', 'Reproducibility', 'Risk', 'Running', 'Safety', 'Sample Size', 'Sampling', 'Scientist', 'Shipping', 'Ships', 'Slice', 'Small Business Innovation Research Grant', 'Statistical Data Interpretation', 'Sudden Death', 'System', 'Testing', 'Tissues', 'Training', 'Universities', 'Validation', 'Washington', 'Work', 'base', 'cardiac tissue engineering', 'commercialization', 'computerized tools', 'cost', 'cost effective', 'data archive', 'drug candidate', 'drug development', 'drug discovery', 'experimental analysis', 'experimental study', 'heart cell', 'heart preservation', 'high throughput screening', 'human data', 'improved', 'in vitro Assay', 'induced pluripotent stem cell', 'mathematical model', 'novel therapeutics', 'personalized medicine', 'precision drugs', 'response', 'safety assessment', 'screening', 'side effect', 'simulation', 'stem cells', 'success']",NHLBI,"INVIVOSCIENCES, INC.",R44,2020,861204,861204,0.03208144194406395
"Cardiac CT Deblooming PROJECT SUMMARY/ABSTRACT Coronary artery disease (CAD) is the most common type of heart disease, killing over 370,000 Americans annu- ally2. Cardiac CT is a safe, accurate, non-invasive method widely employed for diagnosis of CAD and planning therapeutic interventions. With the current CT technology, calcium blooming artifacts severely limit the accuracy of coronary stenosis assessment. Similarly, stent blooming artifacts lead to overestimation of in-stent restenosis. As a result, many coronary CT angiography (CCTA) scans are non-diagnostic and result in patients receiving costly and invasive coronary angiography (ICA) procedures.  Based on extensive feasibility results, the goal of this project is to use deep learning innovations to fundamen- tally eliminate blooming artifacts without costly redesign of the CT hardware. A consortium between GE Re- search, Rensselaer Polytechnic Institute and Weill Cornell Medicine will develop dedicated imaging protocols and machine learning methods to avoid or minimize blooming artifacts and evaluate the clinical impact of the proposed solutions. In Aim 1, the CT scan protocol will be optimized and paired with deep learning reconstruc- tion and post-processing algorithms to generate high-resolution CT images and prevent blooming artifacts. In Aim 2, image-domain and raw-data-domain deep learning processing algorithms will be developed to correct for residual blooming. After successful demonstration of the proposed methods on phantom scans and emulated clinical datasets, in Aim 3 the proposed CT methods will be clinically demonstrated and optimized based on 100 patients with coronary artery disease, using intravascular ultrasound as the ground-truth reference.  At the end of the project, we will have demonstrated and publicly disseminated a systematic methodology to essentially remove blooming artifacts in cardiac CT without a costly hardware upgrade. This will be another suc- cess of deep learning, enabling accurate coronary stenosis assessment and eliminating many unnecessary diag- nostic catheterizations. PROJECT NARRATIVE Blooming artifacts severely limit the accuracy of coronary stenosis assessment with cardiac CT, leading to un- necessary invasive coronary angiography procedures. The goal of this project is to eliminate blooming artifacts without costly redesign of the CT hardware, but based on optimized scan protocols and deep-learning-based image reconstruction and post-processing techniques. The proposed CT methods will be clinically demonstrated and optimized based on CT scans of 100 patients with coronary artery disease and using intravascular ultrasound as the ground-truth reference.",Cardiac CT Deblooming,9943684,R01HL151561,"['Address', 'Algorithms', 'American', 'Angiography', 'Area', 'Attenuated', 'Calcium', 'Caliber', 'Cardiac', 'Cardiovascular Diseases', 'Clinical', 'Collaborations', 'Coronary', 'Coronary Angiography', 'Coronary Arteriosclerosis', 'Coronary Stenosis', 'Coronary artery', 'Data', 'Data Set', 'Diagnosis', 'Goals', 'Heart', 'Heart Diseases', 'High Resolution Computed Tomography', 'Hospitals', 'Image', 'In Vitro', 'Institutes', 'Lead', 'Measurement', 'Medicine', 'Metals', 'Methodology', 'Methods', 'Morbidity - disease rate', 'Morphologic artifacts', 'Motion', 'New York', 'Noise', 'Outcome', 'Patients', 'Physics', 'Plant Roots', 'Presbyterian Church', 'Prevention', 'Procedures', 'Protocols documentation', 'Recording of previous events', 'Research', 'Residual state', 'Resolution', 'Scanning', 'Speed', 'Stenosis', 'Stents', 'Techniques', 'Technology', 'Therapeutic Intervention', 'Training', 'Ultrasonography', 'Validation', 'X-Ray Computed Tomography', 'base', 'calcification', 'cohort', 'cost', 'deep learning', 'deep learning algorithm', 'diagnostic catheterization', 'image reconstruction', 'improved', 'in silico', 'in vivo', 'innovation', 'learning network', 'machine learning method', 'man', 'microCT', 'mortality', 'prevent', 'reconstruction', 'recruit', 'restenosis', 'simulation', 'success', 'temporal measurement', 'virtual', 'virtual reality simulation']",NHLBI,GENERAL ELECTRIC GLOBAL RESEARCH CTR,R01,2020,900092,9617133,0.027852416500335143
"Deep Learning for Automated Aortic Stenosis and Valvular Heart Disease Detection Using a Digital Stethoscope Abstract This SBIR Phase II project will develop a deep learning-based clinical decision support algorithm for detecting and diagnosing valvular heart disease based on heart sounds recorded using the Eko Core and Eko Duo Digital Stethoscopes. This screening tool will help to decrease the number of patients with valvular heart disease that remain undertreated simply because their condition is not diagnosed. Auscultation is commonly the method by which valvular heart disease is first detected, but cases often fail to be referred to echocardiography for diagnosis because clinicians fail to detect heart murmurs, particularly in noisy or rushed environments. To address this challenge, Eko had developed the Core, a digital stethoscope attachment that can be added in-line to a clinician’s existing stethoscope that amplifies heart sounds and Duo, a digital stethoscope in a handheld form factor with built-in single lead electrocardiogram. Both devices are designed to stream digitized phonocardiograms to a smartphone, tablet or personal computer. There, the signal can be analyzed with the decision support algorithm we will develop as part of this project. The specific aims of this study are: (1) to collect a database with condition- specific recording labels to enable deep learning for heart sounds though clinical data collection at six clinical sites, and (2) to develop and evaluate a collection of deep convolutional neural network-based algorithms trained on the database. These algorithms will (2a) distinguish between systolic, diastolic and continuous murmurs, (2b) classify aortic stenosis (AS), mitral regurgitation (MR), tricuspid regurgitation (TR), and innocent murmurs (2c) assess the severity of AS, MR and TR. By integrating these deep learning algorithms into Eko's mobile and cloud software platform, currently used by clinicians at over 1000 institutions worldwide, we anticipate this algorithm will enable more accurate screening for valvular heart disease in adult patients, leading to earlier diagnosis and better patient outcomes. Public Health Relevance Valvular heart disease is becoming an increasingly prevalent manifestation of poor cardiovascular health in both the developed and developing world. A highly-accurate clinical decision support algorithm that is able to detect and classify valvular heart disease will impact public health by reducing unnecessary referrals for echocardiography and promoting early and accurate diagnosis in underserved areas with limited access to specialty care.",Deep Learning for Automated Aortic Stenosis and Valvular Heart Disease Detection Using a Digital Stethoscope,10079904,R44HL144297,"['Address', 'Adopted', 'Adult', 'Algorithms', 'Aortic Valve Stenosis', 'Area', 'Auscultation', 'Cardiac', 'Caring', 'Cellular Phone', 'Clinic', 'Clinical', 'Clinical Data', 'Collection', 'Computer software', 'Data', 'Data Collection', 'Databases', 'Detection', 'Device Designs', 'Diagnosis', 'Disease', 'Early Diagnosis', 'Echocardiography', 'Eko', 'Electrocardiogram', 'Enrollment', 'Environment', 'Goals', 'Gold', 'Health Personnel', 'Heart Sounds', 'Heart Valve Diseases', 'Heart murmur', 'Institution', 'Label', 'Lead', 'Medical Device', 'Methods', 'Mitral Valve Insufficiency', 'Modeling', 'Network-based', 'Outcome Study', 'Pathology', 'Patient-Focused Outcomes', 'Patients', 'Performance', 'Personal Computers', 'Phase', 'Prevalence', 'Primary Health Care', 'Public Health', 'Reporting', 'Resources', 'Screening procedure', 'Sensitivity and Specificity', 'Severities', 'Signal Transduction', 'Site', 'Small Business Innovation Research Grant', 'Specificity', 'Stethoscopes', 'Stream', 'Supervision', 'System', 'Tablet Computer', 'Testing', 'Training', 'Tricuspid Valve Insufficiency', 'accurate diagnosis', 'algorithm training', 'automated algorithm', 'base', 'cardiovascular health', 'clinical decision support', 'clinical development', 'clinical research site', 'clinically significant', 'cloud software', 'convolutional neural network', 'cost', 'deep learning', 'deep learning algorithm', 'deep neural network', 'diagnosis standard', 'digital', 'experience', 'innovation', 'learning strategy', 'medical specialties', 'point of care', 'public health relevance', 'screening', 'sound']",NHLBI,"EKO DEVICES, INC.",R44,2020,938347,938347,0.06688897473078335
