text,title,id,project_number,terms,administration,organization,mechanism,year,cost,funding,score
"Novel Non-Invasive Coronary Flow Patterning to Predict Early Coronary Microvascular Disease PROJECT SUMMARY  Coronary microvascular disease (CMD) is notoriously difficult to diagnose non-invasively, and current methods of assessing CMD utilize only the peak velocity of the coronary flow pattern. While new imaging techniques such as cardiac magnetic resonance imaging (MRI) have improved the assessment coronary perfusion, there are currently no non-invasive methods that incorporate the coronary flow pattern over a complete cardiac cycle to definitively assess and predict the development of CMD.  Coronary blood flow (CBF) reflects the summation of flow in the coronary microcirculation, and our lab has begun to harness the full CBF pattern under varying flow and disease conditions (e.g. type 2 diabetes) to determine whether it might harbor novel clues leading to the early detection of CMD. Our past and preliminary data indicate an early onset of CMD in both type 2 diabetes mellitus (T2DM) and metabolic syndrome (MetS) that occurs prior to the onset of macrovascular complications and that are characterized by blood flow impairments and alterations in coronary resistance microvessel (CRM) structure, function, and biomechanics. Our data also uncovered innovative correlations between CRM structure/biomechanics and our newly-defined features of the coronary flow pattern, some of which were unique to normal or diabetic mice. We have initially utilized these CBF features, in the presence and absence of other factors such as cardiac function, to develop a mathematical model in collaboration with Drs. Christopher Bartlett and William Ray that to date demonstrated that 6 simple factors can predict a normal vs. diabetic coronary flow pattern with 85% predictive accuracy. Utilizing a multidisciplinary approach, these preliminary data strongly suggest that the coronary flow pattern and physiological modulators of it (e.g. coronary micovascular structure/function/biomechanics, cardiac function, etc), may be useful in directly diagnosing early CMD. Therefore, we hypothesize that dissecting the elements that influence coronary flow patterning will be critical determinants in the direct assessment of coronary microvascular disease using computational modeling. Using our previous publications and our preliminary data as guides, the hypothesis will be tested by addressing two specific aims: 1) Determine whether unique time-dependent CBF patterning in normal and T2DM is dictated by a combination of CRM remodeling and biomechanics, coronary flow pattern dynamics, and cardiac function, permitting the development of a computational model to accurately predict CMD; 2) Determine the reproducibility and robustness of the machine learning model in predicting CMD in a diet-induced obesity/diabetes mouse model. If successful, these studies will be the first to simultaneously examine the influence of CRMs, CBF, and cardiac structure/function on the distinct pattern of coronary flow, and it will determine whether a mathematical model may be useful in establishing a direct assessment of CMD to eventually enable clinicians to conduct a more direct non-invasive diagnosis of CMD for the prevention and/or treatment of heart disease. PROJECT NARRATIVE Coronary Artery Disease (CAD) is the leading cause of heart disease and is associated with hypertension, diabetes, and metabolic syndrome. Coronary Microvascular Disease (CMD) is comprised of structural and functional deficits of the tiny coronary arteries that may be an earlier indicator of disease prior to the onset of overt CAD. The proposed multidisciplinary research aims to develop a computational artificial intelligence model that will accurately predict CMD based on a non-invasive coronary flow pattern obtained by Doppler echocardiography.",Novel Non-Invasive Coronary Flow Patterning to Predict Early Coronary Microvascular Disease,10163298,R21EB026518,"['Address', 'Age', 'Artificial Intelligence', 'Biomechanics', 'Blood flow', 'Cardiac', 'Collaborations', 'Computer Models', 'Coronary', 'Coronary Arteriosclerosis', 'Coronary artery', 'Data', 'Development', 'Diabetes Mellitus', 'Diabetic mouse', 'Diet', 'Disease', 'Doppler Echocardiography', 'Early Diagnosis', 'Echocardiography', 'Elements', 'Heart Diseases', 'Hyperemia', 'Hypertension', 'Imaging Techniques', 'Impairment', 'Interdisciplinary Study', 'Laboratories', 'Machine Learning', 'Magnetic Resonance Imaging', 'Measures', 'Metabolic syndrome', 'Methods', 'Microcirculation', 'Microvascular Dysfunction', 'Modeling', 'Non-Insulin-Dependent Diabetes Mellitus', 'Obesity', 'Pattern', 'Physiological', 'Publications', 'Reproducibility', 'Resistance', 'Structure', 'Testing', 'Time', 'base', 'coronary perfusion', 'db/db mouse', 'diabetic', 'disorder prevention', 'early onset', 'experimental study', 'heart function', 'improved', 'innovation', 'interdisciplinary approach', 'macrovascular disease', 'mathematical model', 'noninvasive diagnosis', 'novel', 'pressure', 'prevent']",NIBIB,RESEARCH INST NATIONWIDE CHILDREN'S HOSP,R21,2020,75521,43994644,0.08143373604567099
"Refining repeat screening for coronary artery disease in kidney transplant candidates 7. Project Summary This K23 proposal will provide Xingxing S. Cheng, MD, MS with the protected time, mentorship, training, and research experience to become an independent clinical investigator. Dr. Cheng is a board-certified nephrologist and accredited transplant nephrologist, with a long-term vision of improving the effectiveness of health care for kidney transplant patients. She seeks to combine patient-oriented research and decision science to find innovative solutions to clinical problems. Skills she will acquire in this grant, under the guidance of a strong mentorship team, include 1) integration of patient-oriented research and decision analytic models; 2) assessing the heterogeneity of response in different patient subgroups; and 3) advanced modelling skills. This grant proposes to refine the process of screening of coronary artery disease in patients with chronic kidney disease on the wait-list awaiting kidney transplantation. Currently, patients undergo repeat cardiac screening tests at frequent intervals, few of which result in interventions. These tests impose a high treatment burden on patients and potentially delay time to transplant, while bringing unclear benefit to the patient. This grant proposes to refine the cardiac screening strategy and personalize it for specific patient subgroups (e.g. elderly patients with diabetes mellitus). It will examine strategies that vary the frequency of cardiac testing and risk stratification for cardiac testing based on a simple, inexpensive, and non-invasive test that can be performed in routine clinical settings, a 6-minute walk test (6MWT). This project will achieve this broad aim by three specific aims: 1) to characterize the 6MWT in identifying low-risk patients who do not additional cardiac testing; 2) to model strategies varying the frequency of cardiac testing and use of 6MWT; 3) to design strategies personalized for specific patient subgroups and model them in the entire kidney transplant candidate population of the United States (US). The first two aims will arise from a well-characterized cohort of patients at Dr. Cheng’s institution. Machine-learning systems will be used to identify which patient subgroups are best served by which strategies (i.e. the heterogeneity of response). The third aim will leverage the US Renal Data System, which Dr. Cheng’s mentors and institution has a track record of leveraging for innovative research. The proposed work has high potential to make a significant clinical impact. Its completion will enable the identification and characterization of rational strategies for pre-transplant screening of coronary artery disease that may be incorporated into clinical practice or pave the way for a future multi-center comparative effectiveness trial. The proposed work is realistic and feasible within the award period, and will allow Dr. Cheng to build research skills, advance and disseminate scientific knowledge, create additional collaborative networks, and compete for R01 or equivalent funding. In summary, the K23 award will provide the support to enable Dr. Cheng to become a successful independent clinical investigator. 8. Project Narrative Currently, patients on the kidney transplant waitlist undergo repeat cardiac screening tests at frequent intervals, but relatively few interventions result. This project proposes to refine the cardiac screening strategy and personalize it for specific patient subgroups (e.g. elderly patients without diabetes mellitus), by examining strategies that reduce the frequency of cardiac testing and use performance-based risk stratification to reduce the number of patients who need cardiac testing. If successful, this project will reduce the cardiac testing burden and facilitate activation for transplant for patients on the kidney transplant waitlist.",Refining repeat screening for coronary artery disease in kidney transplant candidates,9871208,K23DK123410,"['Accreditation', 'Age', 'Award', 'Cardiac', 'Cardiopulmonary', 'Caring', 'Characteristics', 'Chronic Kidney Failure', 'Clinical', 'Clinical Investigator', 'Coronary Arteriosclerosis', 'Diabetes Mellitus', 'Effectiveness', 'Eligibility Determination', 'Evaluation', 'Event', 'Frequencies', 'Funding', 'Future', 'Goals', 'Grant', 'Guidelines', 'Healthcare', 'Heterogeneity', 'Hybrids', 'Information Systems', 'Institution', 'Intervention', 'Intervention Trial', 'Kidney', 'Kidney Transplantation', 'Knowledge', 'Lead', 'Machine Learning', 'Measures', 'Mentored Patient-Oriented Research Career Development Award', 'Mentors', 'Mentorship', 'Modeling', 'Outcome', 'Patients', 'Performance', 'Phase', 'Physical Performance', 'Population', 'Process', 'Quality-Adjusted Life Years', 'Research', 'Risk', 'Risk Factors', 'Risk stratification', 'Science', 'Specificity', 'Sum', 'System', 'Testing', 'Time', 'Training', 'Transplant Recipients', 'Transplantation', 'United States', 'Vision', 'Wait Time', 'Waiting Lists', 'Walking', 'Work', 'analytical method', 'base', 'career', 'clinical practice', 'clinical risk', 'cohort', 'comparative effectiveness trial', 'cost', 'design', 'experience', 'fitness', 'follow-up', 'high risk', 'improved', 'innovation', 'older patient', 'patient oriented research', 'patient subsets', 'personalized strategies', 'predictive test', 'prognostic value', 'prospective', 'recruit', 'relative effectiveness', 'response', 'screening', 'skills']",NIDDK,STANFORD UNIVERSITY,K23,2020,166536,560644462,0.042418189915121765
"Early Diagnosis of Heart Failure: A Perioperative Data-Driven Approach PROJECT SUMMARY / ABSTRACT Candidate: Dr. Michael Mathis is a cardiothoracic anesthesiologist with board certification in anesthesiology and advanced perioperative echocardiography at the University of Michigan. Through completion of a T32 Research Training Grant, Dr. Mathis has developed expertise in perioperative outcomes research for patients with advanced cardiovascular disease. His long-term career goal is to improve care for patients with heart failure (HF) through harnessing perioperative electronic healthcare record (EHR) data for early diagnosis and management. This proposal builds on Dr. Mathis's expertise, providing protected time for training in data science methods necessary to drive forward the analytic techniques proposed for improving HF diagnosis. Environment: The University of Michigan is the coordinating center for the Multicenter Perioperative Outcomes Group (MPOG), an international consortium of over 50 anesthesiology and surgical departments with perioperative information systems. Dr. Sachin Kheterpal, MD, MBA is the primary mentor for Dr. Mathis, and is the Director for MPOG and member of the NIH Precision Medicine Initiative Advisory Panel. The proposed research will be completed under the guidance of Dr. Kheterpal, as well as co-mentors Milo Engoren, MD, Daniel Clauw, MD, and Kayvan Najarian, PhD. An advisory panel of experts in HF diagnosis and data science methodologies will provide Dr. Mathis with additional guidance. Background: HF is among the most common chronic conditions requiring hospitalization and carries high rates of mortality. In the perioperative period, HF is a risk factor for major cardiac complications. Despite advances in care, little progress has been made to reduce HF healthcare burden, with difficulties attributable to a lack of inexpensive, reliable diagnostic measures. Consequently, patients with HF can go unrecognized in early stages and do not receive treatments to reduce mortality. The perioperative period is an underutilized opportunity to improve HF diagnosis. Beyond the wealth of preoperative data available, the intraoperative period serves as a cardiac stress test through which hemodynamic responses to surgical and anesthetic stimuli are recorded with high resolution. Yet, this data remains an untapped resource for HF evaluation. Research: The goal of the proposed research is to incorporate the perioperative period as an opportunity for early diagnosis of HF. The two specific Aims are to develop a data-driven diagnostic algorithm for HF using preoperative EHR data (Aim 1) as well as intraoperative EHR data (Aim 2). Both aims will use automated techniques to extract features of HF from the perioperative EHR, developed at UM and scalable to multiple centers via the MPOG infrastructure. This work represents a paradigm shift in perioperative evaluation, using perioperative data as a diagnostic tool rather than a risk-assessment tool. The proposed research and training will provide Dr. Mathis with necessary data science computational experience to become an independent physician-investigator focused on improving perioperative management strategies for patients with HF. PROJECT NARRATIVE Public Health Relevance Statement: Heart failure is a common chronic condition affecting over 550,000 patients each year, with a 45–60% mortality rate at 5 years. Despite advances in treatment, little progress has been made to improve heart failure diagnosis, and thus patients in early heart failure stages do not receive appropriate life-extending therapies. Through robust data science methodologies, this study harnesses critically underutilized, high-fidelity data available during the perioperative period to improve diagnosis of heart failure .",Early Diagnosis of Heart Failure: A Perioperative Data-Driven Approach,9895469,K01HL141701,"['Affect', 'Algorithms', 'Anesthesia procedures', 'Anesthesiology', 'Anesthetics', 'Assessment tool', 'Award', 'Bayesian Analysis', 'Board Certification', 'Cardiac', 'Cardiovascular Diseases', 'Caring', 'Characteristics', 'Chronic', 'Clinic', 'Clinical', 'Computational Science', 'Consumption', 'Coronary Arteriosclerosis', 'Data', 'Data Science', 'Data Sources', 'Databases', 'Development Plans', 'Diabetes Mellitus', 'Diagnosis', 'Diagnostic', 'Discrimination', 'Disease', 'Doctor of Philosophy', 'Early Diagnosis', 'Echocardiography', 'Electronic Health Record', 'Entropy', 'Environment', 'Evaluation', 'Goals', 'Grant', 'Healthcare', 'Heart Rate', 'Heart failure', 'Hospitalization', 'Hypertension', 'Incidence', 'Information Systems', 'Infrastructure', 'International', 'Intraoperative Period', 'Knowledge', 'Laboratories', 'Learning', 'Life', 'Malignant Neoplasms', 'Measures', 'Medical History', 'Medical Records', 'Mentors', 'Methodological Studies', 'Methodology', 'Methods', 'Michigan', 'Modeling', 'Modernization', 'Natural Language Processing', 'Operative Surgical Procedures', 'Outcome', 'Outcomes Research', 'Patient Care', 'Patients', 'Performance', 'Perioperative', 'Physicians', 'Physiological', 'Positioning Attribute', 'Precision Medicine Initiative', 'Prevalence', 'Process', 'Research', 'Research Personnel', 'Research Training', 'Resolution', 'Resources', 'Retrospective Studies', 'Risk', 'Risk Assessment', 'Risk Factors', 'Sensitivity and Specificity', 'Statistical Models', 'Stimulus', 'Stress', 'Techniques', 'Testing', 'Thallium Myocardial Perfusion Imaging Stress Test', 'Time', 'Time Series Analysis', 'Training', 'United States National Institutes of Health', 'Universities', 'Work', 'adjudicate', 'algorithm training', 'base', 'blood pressure variability', 'care providers', 'career', 'career development', 'cohort', 'cost', 'cost effective', 'effective intervention', 'experience', 'hemodynamics', 'improved', 'large datasets', 'member', 'mortality', 'novel', 'outcome forecast', 'public health relevance', 'response', 'signal processing', 'skills', 'stressor', 'tool']",NHLBI,UNIVERSITY OF MICHIGAN AT ANN ARBOR,K01,2020,172274,641965656,0.10546033075698119
"Leveraging modern analytic approaches to improve diabetes outcomes ABSTRACT Diabetic patients are at risk of developing diabetic heart disease, which may lead to complications in care. Diabetic heart disease patients not only have exceptionally high healthcare expenditures and resource utilization but also are likely to have poor patient outcomes. Studies have shown that early intervention of patients likely to develop diabetic heart disease is cost-effective and yields favorable health outcomes. Therefore, early identiﬁcation of diabetic patients at high-risk of developing diabetic heart disease is crucial to provide effective interventions. The commonly accepted methodology for diabetic heart disease risk prediction is the use of one or more risk scoring systems. However, these risk functions may not generalize well for the diabetes patient and may suffer from poor calibration when used on different cohorts. Moreover, the scoring systems have only been studied on coronary heart disease, one variant of diabetic heart disease while heart failure and diabetic cardiomyopathy remain important, yet insufﬁciently studied problems. Machine learning offers the ability to perform accurate predictive analytics and has been proposed as a way to identify and manage high-risk patients. The primary goal of this proposal is to develop a high-impact and practical risk prediction model that can be used to per- form early identiﬁcation of high-risk diabetic heart disease patients. Given the heterogeneity and complexity of patient information in electronic health records, the model needs to capitalize on the multi-dimensional temporal nature of pa- tient records to extract identifying characteristics of patients that will develop diabetic heart disease. To accomplish this, we will leverage modern machine learning approaches such as tensor factorization and natural language processing to model complex patient characteristics, provide a more complete representation of the patient, and uncover excellent predictors of diabetic heart disease risk. An existing dataset that contains the de-identiﬁed electronic health records of approximately 4,100 diabetic patients from the Emory Healthcare System to compare the predictive power of machine learning-based algorithms with the standard risk scoring systems. These algorithms will be evaluated on calibration, discrimination, and ease of interpretability. The results of this work will provide insight as to how to develop a machine learning–based prediction system that can identify high-risk diabetic heart disease patients. The study may also shed light on the best approaches for fusing data from multiple heterogeneous sources to build a better predictive model and potentially identify novel indicators of high- risk diabetic heart disease factors. Moreover, the work will help inform a larger multi-site study of diabetic heart disease risk prediction and develop methods to generalize the results to a broader spectrum of comorbidities. This project is consistent with the National Library of Medicine's mission to translate biomedical research into practice. PROJECT NARRATIVE Diabetic patients are risk of developing diabetic heart disease which can lead to high healthcare expenditure, high resource utilization, and poor patient outcomes. Existing diabetic risk prediction models can suffer from poor calibration and predictive accuracy. This project develops a novel and practical analytic tool to identify patients at high-risk of developing diabetic heart disease.",Leveraging modern analytic approaches to improve diabetes outcomes,9939687,K01LM012924,"['Adopted', 'Age', 'Algorithms', 'Biomedical Research', 'Calibration', 'Caring', 'Characteristics', 'Chronic Disease', 'Clinical', 'Clinical Data', 'Complex', 'Complications of Diabetes Mellitus', 'Computer software', 'Congestive', 'Coronary', 'Coronary heart disease', 'Data', 'Data Set', 'Data Sources', 'Diabetes Mellitus', 'Diagnosis', 'Discrimination', 'Disease', 'Early Intervention', 'Early identification', 'Economic Burden', 'Elderly', 'Electronic Health Record', 'Epidemic', 'Evaluation', 'Future', 'Goals', 'Health', 'Health Expenditures', 'Healthcare', 'Healthcare Systems', 'Heart Diseases', 'Heart failure', 'Heterogeneity', 'Institution', 'Intervention', 'Lead', 'Light', 'Machine Learning', 'Methodology', 'Methods', 'Mission', 'Modeling', 'Modernization', 'Natural Language Processing', 'Nature', 'Outcome', 'Patient risk', 'Patient-Focused Outcomes', 'Patients', 'Pharmaceutical Preparations', 'Population', 'Predictive Analytics', 'Predictive Value', 'Prevalence', 'Prevention', 'Procedures', 'Records', 'Research Personnel', 'Resources', 'Risk', 'Site', 'Source', 'Structure', 'System', 'Translating', 'United States', 'United States National Library of Medicine', 'Variant', 'Work', 'advanced analytics', 'analytical tool', 'base', 'clinical practice', 'cohort', 'comorbidity', 'computer science', 'cost effective', 'design', 'diabetic', 'diabetic cardiomyopathy', 'diabetic patient', 'effective intervention', 'electronic structure', 'epidemiologic data', 'heart disease risk', 'heterogenous data', 'high risk', 'improved', 'insight', 'novel', 'open source', 'predictive modeling', 'prospective', 'prototype', 'research to practice', 'risk prediction model', 'secondary analysis', 'structured data']",NLM,EMORY UNIVERSITY,K01,2020,179604,507546965,0.05283457544857333
