text,title,id,project_number,terms,administration,organization,mechanism,year,cost,funding,score
"Bioenergetics and Rehabilitation in Older Patients with Acute Heart Failure ﻿    DESCRIPTION (provided by applicant): Older adults exhibit poor recovery and are at high risk for rehospitalization after acute heart failure. Current rehabilitation and clinical management strategies have shown only modest benefits because the mechanisms underlying poor outcomes remain under recognized and therefore unmitigated. The proposed study will address this critical knowledge gap by examining the role of systemic mitochondrial bioenergetic capacity as a fundamental factor underlying poor physical function in hospitalized acute decompensated heart failure, the success of rehabilitation, and the prognosis of patients following hospitalization. This will be accomplished in a highly translational and cost-effective manner as an ancillary study to REHAB-HF (R01AG045551; PI: Kitzman), a multi-center clinical trial funded by the NIA that tests the hypothesis that impaired physical function underlies adverse outcomes in older hospitalized ADHF patients and employs a novel rehabilitation program that targets multiple domains of physical function for 12 weeks beginning during hospitalization. The results of REHAB-HF can impact clinical practice; however, its outcomes do not directly address potential mechanisms of action. Mitochondrial function is likely candidate for mediating physiological decline in REHAB-HF participants, because these organelles are sensitive to a myriad of intrinsic and extrinsic factors related to aging, physical function, heart failure, and hospitalization.  Mitochondrial dysfunction across multiple tissues has been implicated in physiological decline associated with heart failure and is thought to be mediated by circulating factors that affect systemic bioenergetic capacity. Therefore, we propose that respirometric profiling of circulating cells can be used to report on systemic bioenergetic decline in heart failure patients and will be associated with physical function and long term outcomes - including rehospitalization rate. We will determine whether the REHAB-HF rehabilitation program increases bioenergetic capacity, compared to control, thereby improving functional outcomes. Bioenergetic profiling of multiple blood cell populations will enable us to identify the specific cell types and bioenergetic parameters, or patterns comprised of multiple variables, that are most closely associated with REHAB-HF outcomes such as physical function and quality of life. We will also determine the ability of blood cells to report on systemic bioenergetic decline y examining relationships with mitochondrial function measured in skeletal muscle. Successful strategies for mitigating poor physical function and improving long-term outcomes rely on the identification of mechanisms that contribute to the vulnerability of patients after discharge. Bioenergetic profiling may enable the identification of patients in need of more intensive management and targeted rehabilitation. The advancement of blood-based bioenergetic profiling will enhance the use of this promising test in future trials, and potentially, in the cliical care of older patients with the wide range of chronic medical conditions associated with physical disability and poor clinical outcomes.         PUBLIC HEALTH RELEVANCE: The proposed project will examine the role of mitochondrial bioenergetics in the physical function of older adults hospitalized for acute heart failure, and th long term rehabilitation outcomes of these patients. Understanding the mechanisms that underlie the success of recovery will lead to improved treatment strategies that can be personalized in order to maximize benefits for individual patients. The results of this study can improve the management of older adults hospitalized with acute heart failure and will be generalizable to the broader issues of age-related bioenergetic decline and post-hospitalization syndrome.        ",Bioenergetics and Rehabilitation in Older Patients with Acute Heart Failure,9112221,R21AG051077,"['Acute', 'Address', 'Affect', 'Aging', 'Ancillary Study', 'Bioenergetics', 'Blood', 'Blood Cells', 'Blood Platelets', 'Cardiac', 'Caring', 'Cells', 'Chronic', 'Clinical', 'Clinical Management', 'Clinical Trials', 'Comorbidity', 'Coupled', 'Data', 'Diagnosis', 'Elderly', 'Environment', 'Event', 'Exercise', 'Exercise stress test', 'Exhibits', 'Fatigue', 'Funding', 'Future', 'Genetic', 'Heart failure', 'Hormones', 'Hospitalization', 'Inflammation', 'Inflammatory', 'Intervention', 'Intervention Trial', 'Knowledge', 'Lead', 'Lymphocyte', 'Machine Learning', 'Measures', 'Mediating', 'Medical', 'Medicare', 'Mitochondria', 'Modeling', 'Monitor', 'Multi-Institutional Clinical Trial', 'Myocardium', 'Organelles', 'Outcome', 'Oxidation-Reduction', 'Oxygen Consumption', 'Parents', 'Participant', 'Patients', 'Pattern', 'Physical Function', 'Physically Handicapped', 'Physiological', 'Population', 'Protons', 'Quality of life', 'Recovery', 'Rehabilitation Outcome', 'Rehabilitation therapy', 'Reporting', 'Respiration', 'Role', 'Sampling', 'Signal Transduction', 'Skeletal Muscle', 'Stress', 'Syndrome', 'Testing', 'Time', 'Tissues', 'adverse outcome', 'age effect', 'age related', 'base', 'cell type', 'clinical practice', 'cost', 'cost effective', 'cytokine', 'exercise intolerance', 'follow-up', 'functional outcomes', 'high risk', 'improved', 'indexing', 'individual patient', 'insight', 'long-term rehabilitation', 'mitochondrial dysfunction', 'monocyte', 'novel', 'older patient', 'outcome forecast', 'primary outcome', 'programs', 'public health relevance', 'rehabilitation management', 'respiratory', 'success', 'treatment strategy']",NIA,WAKE FOREST UNIVERSITY HEALTH SCIENCES,R21,2016,190640,134382703,0.06578701049634979
"Machine learning with generative mixture models for fetal monitoring DESCRIPTION (provided by applicant): For many years, there has been a concerted effort to automate the analysis of fetal heart rate (FHR) rhythms. However, despite significant advances in biomedical signal analysis, there has not been any significant improvement in automated decision support systems. FHR monitoring is now ubiquitous throughout delivery rooms, especially using the non-invasive Doppler monitor, but also using the fetal scalp electrode. Physician classification of fetal heart rate patterns is known to be a non-trivial problem because of significant inter and intra-observer variability of diagnosis. This has led to a marked increase in the number of caesarean deliveries, thereby increasing risk to the fetus and mother in many cases. This has further motivated the machine learning community to automate the classification procedure in the interest of accuracy and consistency as well as robustness with respect to noise. Usual approaches to this involve some type of supervised classification procedure, where the algorithm output on training data is compared with a ""gold-standard"" physician classification, followed by testing and validation on new datasets. However, since physician classification can be unreliable in the presence of the aforementioned diagnostic variability, as well as significant tracing noise, we propose the use of unsupervised algorithms to cluster FHR data records into clinically useful categories. We use nonparametric Bayes theory and Markov-time-dependence models for the evolution of feature sequences to propose methods that will achieve improved accuracy. The methods involve extraction of feature sequences from FHR time series data, which are modeled as samples from finite or infinite Dirichlet mixture models. We then use Gibbs sampling to obtain the cluster probabilities for each dataset. Clustering outcomes are compared against direct physician diagnosis and our current results are seen to be in broad agreement with them, while still giving new information on the character of different sub-groups of FHR records. With the proposed research, further gains in classification performance will be made. PUBLIC HEALTH RELEVANCE: Fetal heart rate monitoring is now commonly used during childbirth and, at present, physicians read and interpret these data to classify fetal heart rate patterns and make sure that the baby is not in distress during the course of labor. However, there is great variability in how individual doctors interpret the tracings and this has led increases in the number of caesarean deliveries, thereby potentially increasing risk to both mothers and babies. Thus there has been a concerted effort from the machine learning community to develop an accurate automatic reading and classification procedure so that correct interpretation of fetal heart rates during labor is more diagnostic and consistent.",Machine learning with generative mixture models for fetal monitoring,9018050,R21HD080025,"['Agreement', 'Algorithms', 'Apgar Score', 'Bayesian Method', 'Behavioral', 'Birth', 'Categories', 'Cesarean section', 'Childbirth', 'Classification', 'Clinical', 'Consensus', 'Data', 'Data Set', 'Decision Support Systems', 'Delivery Rooms', 'Dependence', 'Dependency', 'Diagnosis', 'Diagnostic', 'Distress', 'Electrodes', 'Evolution', 'Feedback', 'Fetal Heart', 'Fetal Heart Rate', 'Fetal Monitoring', 'Fetus', 'Freedom', 'Gold', 'Health', 'Individual', 'Intraobserver Variability', 'Joints', 'Knowledge', 'Label', 'Learning', 'Litigation', 'Machine Learning', 'Measurement', 'Methodology', 'Methods', 'Modeling', 'Monitor', 'Monte Carlo Method', 'Mothers', 'Motivation', 'Noise', 'Outcome', 'Outcome Measure', 'Output', 'Pattern', 'Performance', 'Phase', 'Physicians', 'Probability', 'Procedures', 'Process', 'Reading', 'Records', 'Research', 'Risk', 'Sampling', 'Scalp structure', 'Series', 'Signal Transduction', 'System', 'Testing', 'Time', 'Training', 'Umbilical cord structure', 'Uncertainty', 'Uterine Contraction', 'Validation', 'Work', 'base', 'cost', 'fetal', 'heart rate monitor', 'improved', 'interest', 'learning community', 'pressure', 'stem', 'theories', 'vector']",NICHD,STATE UNIVERSITY NEW YORK STONY BROOK,R21,2016,193120,77607041,0.027603224027538616
"Computerized Visualization and Prediction of Coronary Artery Ischemia ﻿    DESCRIPTION (provided by applicant):  Coronary artery disease (CAD) is the principal cause of morbidity and mortality. In the US, CAD affects >16 million adults and accounts for >1/3 deaths annually. Recently, computed tomography (CT) has emerged as a non-invasive option for imaging coronary arteries and myocardial perfusion. Nevertheless, diagnosis of ischemic CAD based on CT alone is less robust due to the lack of lesion-specific physiologic information. Computational fluid dynamics (CFD) has been applied to image-based modeling of patient-specific geometry from CT data, which now allows for non-invasive calculation of coronary pressure, flow and shear stress, and thus lesion-specific evaluation of coronary ischemia in higher diagnostic accuracy than the strategy based on CT alone. There is a pressing need to incorporate CT imaging, image-based modeling, and CFD into clinical practice for better diagnosis of coronary ischemia. However, progress has been thwarted by three major challenges: (1) lack of integrated tools to visualize immense data to assist diagnosis, (2) inabiliy to quantify and select salient anatomic and physiologic features for optimal prediction of ischemia, and (3) lack of comprehensive clinically relevant evaluation. In this proposal, we will develop and evaluate a novel computerized system to improve visual and predictive assessment of coronary ischemia from CT imaging and CFD. To accomplish this goal: (1) We will create tools to visualize coronary anatomy, physiology and myocardial perfusion for routine diagnosis assistance; The evaluation will be performed by comparing the diagnostic performance of two experienced cardiologists using our visualization tool and the conventional workstation using invasive ground truths; (2) We will develop methods to automatically quantify and select salient anatomic and physiologic features for maximizing predictive accuracy using machine learning. The evaluation will be assessed through cross-validation on a large existing database with respect to invasive ground truths. If successful, our developments will provide a new computerized system to assist the diagnosis of coronary ischemia by visualizing the totality of anatomic and physiologic findings over current unassisted approaches, and predict ischemia by machine learning methods that are superior to current heuristic techniques, and ultimately accelerate the translation of diagnostic performance gain into routine clinical practice.         PUBLIC HEALTH RELEVANCE:  Coronary artery disease (CAD) is the principal cause of morbidity and mortality. Based on computed tomography and computational fluid dynamics, our proposed work will create and evaluate a new computerized system to improve the diagnosis of ischemic CAD by developing advanced visualization and prediction tools.        ",Computerized Visualization and Prediction of Coronary Artery Ischemia,9093071,R21HL132277,"['Accounting', 'Adult', 'Affect', 'Anatomy', 'Arterial Fatty Streak', 'Arteries', 'Biomechanics', 'Biomedical Engineering', 'Blood flow', 'Cardiology', 'Cardiovascular Diseases', 'Cardiovascular system', 'Cessation of life', 'Characteristics', 'Clinical', 'Clinical Research', 'Complex', 'Computer Simulation', 'Computer-Assisted Diagnosis', 'Computing Methodologies', 'Coronary', 'Coronary Arteriosclerosis', 'Coronary Artery Ischemia', 'Coronary Stenosis', 'Coronary artery', 'Data', 'Databases', 'Decision Making', 'Defect', 'Development', 'Diagnosis', 'Diagnostic', 'Echocardiography', 'Evaluation', 'Foundations', 'Functional Imaging', 'Future', 'Geometry', 'Goals', 'Hospitalization', 'Image', 'Imagery', 'Imaging Techniques', 'Individual', 'Ischemia', 'Lesion', 'Liquid substance', 'Machine Learning', 'Magnetic Resonance Imaging', 'Measures', 'Methods', 'Modality', 'Modeling', 'Morbidity - disease rate', 'Motion', 'Multicenter Trials', 'Myocardial perfusion', 'Nuclear', 'Patients', 'Performance', 'Physiological', 'Physiology', 'Radionuclide Imaging', 'Reproducibility', 'Rest', 'Severities', 'Stenosis', 'Stress', 'System', 'Techniques', 'Testing', 'Therapeutic', 'Three-Dimensional Image', 'Time', 'Translations', 'Validation', 'Visual', 'Work', 'X-Ray Computed Tomography', 'base', 'burden of illness', 'cardiovascular imaging', 'cardiovascular visualization', 'clinical practice', 'clinically relevant', 'computer science', 'computerized', 'design', 'diagnostic accuracy', 'experience', 'heuristics', 'imaging modality', 'improved', 'learning strategy', 'mortality', 'novel', 'pressure', 'prognostic value', 'prospective', 'public health relevance', 'shear stress', 'simulation', 'success', 'targeted treatment', 'tool']",NHLBI,WEILL MEDICAL COLL OF CORNELL UNIV,R21,2016,254250,227555357,-0.02238716125511628
"Comprehensive Cardiac Structure-Function Analysis in Heart Transplantation DESCRIPTION (provided by applicant): Heart transplant (Tx) surgery is a well-established life-saving procedure, but is associated with post- interventional risks such as acute cardiac rejection (ACR) which is one of the leading causes of death in the first year after transplant. Beyond the first year, cardiac allograft vasculopathy (CAV) is the single greatest risk factor for 5-year mortality. Monitoring the patient for post-transplant events is thus paramount. The standard monitoring strategy, however, relies on frequent (12-16 monitoring nodes during year 1 alone) invasive and costly procedures including endomyocardial biopsies (EMB) and catheter angiography. Since EMB and catheter angiography have limited sensitivity due to sampling errors (ACR) or the diffuse nature of the disease (CAV), a reliable non-invasive alternative for the early detection of ACR and CAV would be desirable to reduce the need for invasive procedures, improve sensitivity, and reduce cost. We have recently developed and applied cardiac MRI techniques for the non-invasive assessment of myocardial edema (T2-mapping), diffuse fibrosis (pre- and post-contrast T1-mapping), myocardial velocities (tissue phase mapping), and microvascular quantitative perfusion. We have shown that these techniques can identify distinct regional structural and functional alterations in the heart that correlate with te status of the allograft. Based on these findings, a detailed cost-effective analysis using Markov modeling and decision tree analysis has demonstrated that cardiac MR has tremendous potential to reduce monitoring costs by 40-50% during the first year after Tx alone. This proposal builds on these promising findings and our aim is to develop an new 15-minute structure-function cardiac MRI protocol for the improved detection regional abnormalities associated with ACR (edema, fibrosis, dysfunction) and CAV (perfusion, dysfunction). Integration of MRI with echocardiography and intravascular Ultrasound (IVUS) will provide unique multi-modality assessment of the allograft. The application in a longitudinal clinical study coupled with state-of-the-art cost-effectiveness analysis will allow redefining the most effective post-Tx mixed monitoring strategy. The aim is to to help clinicians identify the optimal mixed monitoring strategy, i.e. the optimal combination of multi-modality imaging (structure-function MRI, echo, IVUS) and invasive procedures (EMB, catheter angiography) which provide best outcome (quality adjusted life days) and lowest cost for the individual cardiac transplant patient. PUBLIC HEALTH RELEVANCE: We propose to develop a multi-modality imaging protocol for the non-invasive characterization of tissue and function of the left and right heart in patients after heart transplantation. Our aim is to develop a new non- invasive 15 minute diagnostic test in order to provide a previously unattainable quantitative characterization of myocardial structure-function deficits in cardiac transplant patients. The application in a longitudinal clinial study coupled with cost-effectiveness analysis and decision tree modeling will allow to improve current monitoring strategies by combining cardiac MRI, echocardiography, intravascular ultrasound and invasive tests (biopsy, catheter angiography) to provide the best outcome (quality of life days, mortality) and lowest cost for the individual cardiac transplant patient.",Comprehensive Cardiac Structure-Function Analysis in Heart Transplantation,9004651,R01HL117888,"['Acute', 'Allografting', 'Ambulatory Care Facilities', 'Angiography', 'Area', 'Biopsy', 'Blood Vessels', 'Cardiac', 'Catheters', 'Cause of Death', 'Clinical', 'Clinical Research', 'Coronary', 'Coronary Angiography', 'Cost Effectiveness Analysis', 'Cost utility', 'Coupled', 'Data', 'Decision Modeling', 'Decision Trees', 'Detection', 'Diagnostic', 'Diagnostic tests', 'Diffuse', 'Disease', 'Early Diagnosis', 'Echocardiography', 'Edema', 'Evaluation', 'Event', 'Fibrosis', 'Functional disorder', 'Goals', 'Gold', 'Health', 'Healthcare', 'Heart', 'Heart Transplantation', 'Impairment', 'Individual', 'Left', 'Life', 'Longitudinal Studies', 'Magnetic Resonance Imaging', 'Maps', 'Modality', 'Modeling', 'Monitor', 'Myocardial', 'Nature', 'Operative Surgical Procedures', 'Outcome', 'Patient Monitoring', 'Patients', 'Perfusion', 'Phase', 'Procedures', 'Protocols documentation', 'Quality of life', 'Reference Standards', 'Resources', 'Risk', 'Risk Factors', 'Risk Marker', 'Sampling Errors', 'Sensitivity and Specificity', 'Structure', 'Techniques', 'Testing', 'Thick', 'Time', 'Tissues', 'Transplant Recipients', 'Transplantation', 'Ultrasonography', 'Vascular Diseases', 'Visit', 'base', 'comparative', 'cost', 'cost effectiveness', 'extracellular', 'follow-up', 'heart allograft', 'imaging modality', 'improved', 'markov model', 'mortality', 'non-invasive imaging', 'novel', 'standard of care', 'two-arm study']",NHLBI,NORTHWESTERN UNIVERSITY AT CHICAGO,R01,2016,658634,367414121,0.09602910015701006
"High Performance Automated System for Analysis of Fast Cardiac SPECT DESCRIPTION (provided by applicant): Coronary artery disease remains a major public health problem worldwide. It causes approximately 1 of every 6 deaths in the United States. Imaging of myocardial perfusion (delivery of blood to the heart muscle) by myocardial perfusion single photon emission tomography (MPS) allows physicians to detect disease before a heart attack, and predict risk in millions of patients annually. This is currently limited by the need fo visual interpretation, which is highly variable and depends on the physician's experience. The long-term objective of this program is to improve the interpretation of this widely used heart imaging technique-achieving higher accuracy for disease detection than it is possible by the best attainable visual analysis. This proposal builds on our prior work in conventional myocardial MPS, and focuses on fast, low-radiation MPS imaging (fast-MPS) obtained by new high-efficiency scanners. Specifically, we aim to: 1) develop new image processing algorithms for a fully automated analysis of fast-MPS. The algorithms will include better heart muscle detection by training with correlated anatomical data and a novel approach for mapping the probability of abnormal perfusion for each location of the heart muscle; 2) enhance the diagnosis of heart disease from fast-MPS by machine- learning algorithms that integrate clinical data, stress test parameters, and quantitative image features; 3) demonstrate the clinical utility of the new algorithms applied to automatic canceling of the rest portion of the MPS scan, when not needed. The new system will be more accurate than the clinical expert analysis in the detection of obstructive coronary disease. By immediately indicating whether a stress scan is normal, the system will allow for the automatic cancellation of the rest imaging portion when it is not needed (estimated in over 60% of all MPS studies). Our research will demonstrate that the computer decision regarding rest-scan cancellation is safe for the patient, both from a diagnostic and prognostic standpoint. This will lead to a wide adoption of low-dose stress-only imaging for MPS studies, which would reduce the amount of radiation that patients are exposed to, and allow for significant healthcare savings. It will additionally lead to a paradigm shift in the practice of nuclear cardiology, which will ultimately result in better selection of patients who need intervention, and reduce the number of deaths due coronary artery disease. PUBLIC HEALTH RELEVANCE: Imaging of myocardial perfusion (heart muscle blood flow) at rest and stress allows physicians to detect disease and predict risk in millions of patients in the US each year, but it is currently limited by the need of visual interpretation, which is dependent on doctor's experience. The investigators propose to develop and validate an automated, highly-accurate and objective computer system which will outperform even experienced physicians in interpreting these images using latest generation scanners and novel machine learning computer tools. The computer will be able to better select patients needing treatment and automatically indicate the normal stress-scan immediately, and more accurately than physicians allowing automatic cancellation of the rest imaging, when not needed; this will result in large healthcare savings and reduced radiation to the patients.",High Performance Automated System for Analysis of Fast Cardiac SPECT,9064178,R01HL089765,"['Adoption', 'Algorithms', 'Blood', 'Blood flow', 'Cardiology', 'Cessation of life', 'Clinical', 'Clinical Data', 'Computer Systems', 'Computers', 'Coronary Arteriosclerosis', 'Coronary heart disease', 'Data', 'Detection', 'Diagnosis', 'Diagnostic', 'Disease', 'Dose', 'Generations', 'Health', 'Healthcare', 'Heart Diseases', 'Image', 'Imaging Techniques', 'Intervention', 'Lead', 'Location', 'Machine Learning', 'Maps', 'Myocardial', 'Myocardial Infarction', 'Myocardial perfusion', 'Myocardium', 'Nuclear', 'Patient Selection', 'Patients', 'Performance', 'Perfusion', 'Photons', 'Physicians', 'Probability', 'Public Health', 'Radiation', 'Research', 'Research Personnel', 'Rest', 'Risk', 'Savings', 'Scanning', 'Stress', 'Stress Tests', 'System', 'Systems Analysis', 'Training', 'United States', 'Visual', 'Work', 'cardiac single photon emission computed tomography', 'experience', 'heart imaging', 'image processing', 'improved', 'novel', 'novel strategies', 'prognostic', 'programs', 'quantitative imaging', 'tomography', 'tool']",NHLBI,CEDARS-SINAI MEDICAL CENTER,R01,2016,695446,90419233,0.07137552284788615
