text,title,id,project_number,terms,administration,organization,mechanism,year,funding,score
"Mitochondria as a novel biomarker of colorectal adenoma     DESCRIPTION (provided by applicant): Although early detection and removal of colorectal adenomas, the precursors of most colorectal cancers, has significantly reduced morbidity and mortality due to colorectal cancer, the disease remains the second leading cause of cancer mortality in the United States. There is increasing evidence that oxidative stress plays an important role in the pathogenesis of colorectal cancer. We recently found that increased circulating concentrations of oxidative stress biomarkers are associated with increased colorectal adenoma risk. Mitochondria (Mt) are the predominant source of intracellular reactive oxygen species (ROS) and a major cause of endogenous oxidative stress. Mitochondrial variations (mitochondrial DNA (mtDNA) copy number and mitochondrial polymorphisms) have been associated with increased ROS production. Despite the central role for mitochondria in ROS production, their role in pathogenesis of colorectal adenomas has not been evaluated. We hypothesize that mtDNA copy number and germline variations in the mitochondrial genome will be associated with colorectal adenoma risk. We propose to evaluate this hypothesis by measuring mtDNA copy number using real time polymerase chain reaction and genotyping mitochondrial tagging single nucleotide polymorphisms (tagSNPs) and D-loop polymorphisms in 392 colorectal adenoma cases and 565 controls collected from three methodologically very similar, colonoscopy-based case-control studies of incident, sporadic colorectal adenomas. We will use unconditional logistic regression to analyze the association between mtDNA copy number, mitochondrial polymorphisms and colorectal adenoma risk. This innovative epidemiologic study seeks to translate our understanding of mitochondrial biology into discovery of novel mitochondrial biomarkers that can inform strategies for the primary prevention of colorectal adenoma. Findings from this exploratory study will provide preliminary data to design a prospective study with adequate sample size to confirm the findings from this study and comprehensively evaluate the role of mitochondria in colorectal cancer etiology.          This application aims to evaluate the association between mitochondrial variants (mitochondrial DNA copy number and mitochondrial polymorphisms) and risk of colorectal adenoma is an existing dataset of 392 colorectal adenoma cases and 565 controls. The long-term goal of the proposed project is to further our understanding of the complex interactions between genetic and environmental/lifestyle factors that affect risk for incident, sporadic colorectal cancer.            ",Mitochondria as a novel biomarker of colorectal adenoma,8461528,R03CA167701,"['Address', 'Affect', 'Antioxidants', 'Area', 'Biological Markers', 'Biology', 'Cancer Etiology', 'Carotenoids', 'Case-Control Studies', 'Cells', 'Colonoscopy', 'Colorectal Adenoma', 'Colorectal Cancer', 'Commit', 'Complement', 'Complex', 'DNA', 'DNA copy number', 'Data', 'Data Set', 'Dietary Factors', 'Disease', 'Early Diagnosis', 'Epidemiologic Studies', 'Equilibrium', 'Etiology', 'Excision', 'F2-Isoprostanes', 'Genetic', 'Genetic Polymorphism', 'Genotype', 'Goals', 'Grant', 'Incidence', 'Individual', 'Laboratories', 'Leukocytes', 'Literature', 'Logistic Regressions', 'Measurement', 'Measures', 'Micronutrients', 'Minnesota', 'Mitochondria', 'Mitochondrial DNA', 'Morbidity - disease rate', 'North Carolina', 'Oxidative Stress', 'Parents', 'Pathogenesis', 'Peripheral', 'Play', 'Polymerase Chain Reaction', 'Population Control', 'Population Study', 'Positioning Attribute', 'Predisposition', 'Prevention strategy', 'Primary Prevention', 'Production', 'Prospective Studies', 'Reactive Oxygen Species', 'Reporting', 'Research', 'Research Design', 'Research Personnel', 'Risk', 'Role', 'SECTM1 gene', 'Sample Size', 'Sampling', 'Series', 'Single Nucleotide Polymorphism', 'Solid Neoplasm', 'Source', 'South Carolina', 'Strategic Planning', 'Time', 'Tocopherols', 'Training', 'Translating', 'United States', 'United States National Institutes of Health', 'Variant', 'base', 'cancer epidemiology', 'cancer risk', 'case control', 'design', 'experience', 'innovation', 'insight', 'lifestyle factors', 'malignant breast neoplasm', 'mitochondrial genome', 'mortality', 'novel', 'oxidation', 'oxidative damage', 'peripheral blood', 'population based']",NCI,UNIVERSITY OF MINNESOTA,R03,2013,71440,0.10009984392140334
"Virtual Fly-Over Colonoscopy System for Clinical Test-SBIR Phase 1     DESCRIPTION (provided by applicant): Colorectal cancer is the third most common form of cancer and the second leading cause of cancer-related death in the US. Yet, if polyps are detected and removed early, colorectal cancer is largely preventable. Although optical colonoscopy (OC), the current gold standard, detects more than 90% of colorectal neoplasms; it is invasive and can be uncomfortable, inconvenient, and perceived as undesirable by patients. Furthermore, even experienced endoscopists may have difficulty reaching the cecum, resulting in incomplete visualizations of the colon. As a consequence, virtual colonoscopy (VC) has emerged as an alternative to OC. During VC, a virtual camera is used to view the internal walls of a virtual colon, reconstructed from CT scans of the abdominal cavity. However, current VC systems have had limited clinical appeal, as they are limited to specific types of polyps, may generate a large number of false positives, or have poor detection rates for significant polyps in the size range of 5-9 mm. The new technology we propose to commercialize through this SBIR work is a game changing, patented, visualization technique for VC, called the ""virtual fly-over"" technique. The technique is sensitive, effective, and efficient for detecting colon polyps. The overall objective of this proposal is to complete the development and validation of a novel visualization technique for virtual colonoscopy, which was patented by the University of Louisville. The hypothesis is that the new visualization technique will enable better viewing of the complex colonic topology, and hence a better capability to detect polyps, especially those that may be hidden behind haustral folds. The current prototype has been utilized to evaluate twenty clinical datasets, with excellent results. However, artifact removal and user friendly features must be incorporated prior to Phase II, in which the technology will be utilized in a larg scale clinical validation trial leading to a commercial product. Also, we propose to (1) generate more convincing preliminary data in a pilot study of 160 datasets, and (2) introduce several phantom polyps, in the size range of 5-9 mm, into the clinical datasets, in order to provide statistical significance of the technology's effectiveness. The phantom polyps will be placed in traditionally difficult-to-analyze positions, which pose significant detection problems for both OC and current VC methods. According to the literature, current OC methods result in a 61-91% (average 80%) viewing of the Colon. The University of Louisville's work in the ""fly-through VC method"", which mimics classic OC, results in 93.4 percent viewing, and the new ""fly-over"" method results in 97.5% percent viewing. Even more important is the improved point of view (""eye-in-the-sky""), the lack of optical distortion, and enhanced CAD functionality that will increase polyp recognition dramatically, especially when detecting small colon polyps, polyps hidden behind haustral folds, and polyps in folded colonic segments at anatomical inflection points. We anticipate the overall improvement in the ability to visualize difficult polyps to be upwards of 30% compared to today's methods, and we are excited about commercializing this technology with the University of Louisville.         PUBLIC HEALTH RELEVANCE: Colorectal cancer is the third most common form of cancer and the second leading cause of cancer-related death in the US with only approximately 50% of the eligible population take advantage of current screening methods. The importance of this proposed technology is the early detection of colon cancer, in an acceptable manner that the general population will agree to, and without the associated morbidity of sedation that is required for the vast majority of endoscopic colonoscopy. We believe our technology has the potential to serve as a foundation for a huge step forward in automating and facilitating large scale screening of human colons, providing a more effective and much more acceptable method to the general population, than the currently invasive optical colonoscopy, which 50 % of the population still refuses to undergo.            ",Virtual Fly-Over Colonoscopy System for Clinical Test-SBIR Phase 1,8586142,R43CA179911,"['Abdominal Cavity', 'Area', 'Cancer Etiology', 'Cecum', 'Cessation of life', 'Clinical', 'Clinical Trials', 'Colon', 'Colon Carcinoma', 'Colonic Polyps', 'Colonoscopy', 'Colorectal Cancer', 'Colorectal Neoplasms', 'Complex', 'Computed Tomographic Colonography', 'Computer Graphics', 'Computer Vision Systems', 'Data', 'Data Set', 'Databases', 'Detection', 'Development', 'Early Diagnosis', 'Effectiveness', 'Engineering', 'Excision', 'Eye', 'Flying body movement', 'Foundations', 'Funding', 'General Population', 'Goals', 'Gold', 'Helicopter', 'Human', 'Imagery', 'Implant', 'Kentucky', 'Lead', 'Legal patent', 'Literature', 'Location', 'Medial', 'Medical center', 'Methods', 'Morbidity - disease rate', 'Morphologic artifacts', 'Optical Methods', 'Optics', 'Patients', 'Phase', 'Pilot Projects', 'Polyps', 'Population', 'Positioning Attribute', 'Procedures', 'Reading', 'Rivers', 'Science', 'Second Primary Cancers', 'Sedation procedure', 'Small Business Innovation Research Grant', 'Surface', 'System', 'Techniques', 'Technology', 'Testing', 'Universities', 'Validation', 'Work', 'X-Ray Computed Tomography', 'base', 'clinically significant', 'design', 'experience', 'fly', 'improved', 'new technology', 'novel', 'prototype', 'public health relevance', 'research clinical testing', 'screening', 'three-dimensional modeling', 'user-friendly', 'virtual']",NCI,"KENTUCKY IMAGING TECHNOLOGIES, LLC",R43,2013,148821,0.04517635759209886
"Genetic risk factors in African American colorectal cancer patients    DESCRIPTION (provided by applicant): Colorectal cancer (CRC) represents a serious public health problem that affects African Americans (AA) disproportionately. Both incidence rates and morbidity and mortality is higher in AAs than in other Americans. Family history, that is, genetic risk, remains one of the most important factors in recommendations for screening. Recent genome-wide association studies have identified 10 independent regions harboring genetic risk factors in CRC in populations of European ancestry. Using single-nucleotide polymorphisms (SNPs) from these studies, we have obtained evidence of association in four of these regions in AA CRC. Our goal is to identify the functional genetic risk factors, quantify their effects, and determine their functions. To pursue this goal, we propose four Aims. (1) We will validate previously identified candidate CRC-associated regions in AA CRC cases and controls. We will use Sequenom genotyping and tag SNPs from these regions to identify SNPs associated with CRC in AAs. We will use 100 ancestry informative markers to perform a structured logistic regression analysis that takes into account possible population stratification based on ancestry. Because AAs are more diverse than European Americans, these studies will very likely lead to better localization of the genetic risk factors. (2) We will use Next Generation Sequencing (NGS) technology to conduct a resequencing analysis of each candidate genetic region in 96 (48 CRC and 48 controls) persons with CRC. The region that we resequence will be guided by the genes and linkage disequilibrium observed in each CRC-associated region. (3) We will better quantify the effects of the genetic risk factors in each region. We will perform a bioinformatics analysis to identify putative functional variants. These functional candidates along with our novel genetic variants in CRC-associated regions will be genotyped in up to 2000 AA cases and 2000 AA control. We will perform structured logistic regression analysis to obtain the strongest genotype relative risks in each CRC-associated regions. (4) The foregoing analyses will provide a short-list of candidate genetic risk factors for each CRC-associated region. We will begin to characterize the molecular basis of CRC risk for each region by functional assays designed based on the putative mechanism caused by the genetic variants (regulatory or enzymatic). Molecular assays (for example, luciferase reporter assays) will be designed to determine the functional impact of candidate genetic risk factors.      PUBLIC HEALTH RELEVANCE: Colorectal cancer affects African Americans disproportionately relative to other Americans. The discovery of genetic risk factors associated with colorectal cancer predisposition is tantamount to a fundamental understanding of the etiology of this significant health problem and to recommendations for cancer screening. We have found several candidate regions that contain genetic risk factors in African Americans. These and other regions have been implicated in colorectal cancer risk by validated genetic associations. We will determine the functional genetic variants that increase risk by genetic and functional studies. These studies will have important implications for early detection and possibly therapeutic intervention among African Americans.          n/a",Genetic risk factors in African American colorectal cancer patients,8545719,U01CA153060,"['15q23', '8q24', 'Accounting', 'Affect', 'African American', 'American', 'Bioinformatics', 'Biological Assay', 'Cancer Patient', 'Cell model', 'Colorectal Cancer', 'Communities', 'DNA Resequencing', 'Data', 'Databases', 'Early Diagnosis', 'Etiology', 'European', 'Factor Analysis', 'Family', 'Frequencies', 'Future', 'Genes', 'Genetic', 'Genetic Risk', 'Genotype', 'Goals', 'Health', 'Incidence', 'Lead', 'Linkage Disequilibrium', 'Logistic Regressions', 'Luciferases', 'Measurement', 'Messenger RNA', 'Molecular', 'Morbidity - disease rate', 'Persons', 'Population', 'Predisposition', 'Principal Investigator', 'Proteins', 'Public Health', 'Recommendation', 'Recording of previous events', 'Regression Analysis', 'Relative (related person)', 'Relative Risks', 'Reporter', 'Risk', 'Risk Factors', 'Screening for cancer', 'Series', 'Signal Transduction', 'Single Nucleotide Polymorphism', 'Stratification', 'Structure', 'Targeted Resequencing', 'Technology', 'Testing', 'Therapeutic Intervention', 'Variant', 'base', 'cancer risk', 'case control', 'design', 'gene function', 'genetic association', 'genetic risk factor', 'genetic variant', 'genome wide association study', 'in vitro Assay', 'mortality', 'next generation sequencing', 'novel', 'public health relevance', 'screening', 'validation studies']",NCI,UNIVERSITY OF ILLINOIS AT CHICAGO,U01,2013,180004,0.13328881064337603
"Development of a comprehensive model for colorectal cancer risk prediction     DESCRIPTION (provided by applicant): Risk of colorectal cancer (CRC) varies widely across the population. Statistical models have shown that there must be wide variation in the underlying 'familial risk profile' necessary to explain the well-established familial risks of CRC. On top of this, CRC risk is determined by personal characteristics and exposures to many environmental factors. Current screening guidelines use only age and rudimentary metrics of family history to stratify individuals to different regimens. To date, there are no CRC risk prediction models that integrate data on family history (including ages, ages at diagnoses, and relationships across multiple generations) and all known genetic factors, let alone environmental factors and personal characteristics associated with CRC risk. Our goal is to develop a comprehensive risk prediction model that will deliver an accurate individual risk prediction across the full spectrum of risk by using explicit family history data, as well as data on the presence or absence of all known genetic and environmental risk factors. This model will facilitate more appropriate screening recommendations to reduce the burden of disease. We will do this using data from a fully characterized, population-based study with comprehensively measured known and suspected risk factors including personal characteristics, environmental risk factors, complex family history, and measured genetic variants. We have at our disposal the Colon Cancer Family Registry, a large, prospective, international resource of families and individuals who span the continuum of risk for CRC, recruited from the USA, Canada, Australia and New Zealand since 1998. Participants have: (i) been tested for mutations in the mismatch repair genes (MLH1, MSH2, MSH6 and PMS2) and MUTYH, and measured for the single nucleotide polymorphisms (SNPs) known to be associated with CRC; (ii) provided a multi-generational pedigree and family cancer history which has been validated where possible; and (iii) completed a risk factor questionnaire at baseline and every five years. We will accomplish our goal by addressing two aims. The first is to develop the CRC risk prediction model using measured genetic information, the multi-generational cancer family history data, and the information on all known risk factors. We will apply segregation analysis and logistic regression to data from 29,701 individuals from 12,902 population-based families. The second aim is to test the validity of the CRC risk prediction model and to determine its incremental value over existing models using prospective data. We will determine how well, in terms of calibration and predictive capacity, the model's predicted CRC risks (based on their baseline data) predict the CRC diagnoses occurring during the follow-up of the sub-cohort individuals with no history of CRC at baseline (19,390 with five-year follow-up of which 8,657 have 10-year follow-up). This comprehensive CRC risk prediction model will have many uses, including helping the development of targeted, population-wide screening strategies in which recommendations as to initiation age, frequency and modality, are tailored appropriately to predicted risks so as to increase the value and cost-effectiveness of screening.         PUBLIC HEALTH RELEVANCE: The proposed project will develop a comprehensive CRC risk prediction model that will accurately stratify individuals according to their levels of risk, basedon all known risk factors including genetic, environmental and personal characteristics. This model will aid the development of more appropriate screening recommendations and facilitate the application of mutation testing in a more effective manner. Our model is timely and offers the potential to change clinical practice and direct public health initiatives by moving resources to those people more likely to benefit from specific surveillance protocols or genetic tests.                ",Development of a comprehensive model for colorectal cancer risk prediction,8544444,R01CA170122,"['Address', 'Age', 'Australia', 'Calibration', 'Canada', 'Cancer Prognosis', 'Categories', 'Characteristics', 'Clinical', 'Colorectal Cancer', 'Complex', 'Data', 'Development', 'Diagnosis', 'Disease', 'Environmental Risk Factor', 'Evaluation', 'Exposure to', 'Family', 'Family Cancer History', 'Family Characteristics', 'Family history of', 'Frequencies', 'Funding Opportunities', 'Future', 'Generations', 'Genes', 'Genetic', 'Genetic Risk', 'Genetic screening method', 'Goals', 'Guidelines', 'Individual', 'International', 'Intervention', 'Joints', 'Knowledge', 'Logistic Regressions', 'MLH1 gene', 'MSH2 gene', 'MSH6 gene', 'Measures', 'Metric', 'Mismatch Repair', 'Modality', 'Modeling', 'Mutation', 'New Zealand', 'PMS2 gene', 'Participant', 'Population', 'Protocols documentation', 'Proxy', 'Public Health', 'Questionnaires', 'Recommendation', 'Recording of previous events', 'Recruitment Activity', 'Regimen', 'Research', 'Resources', 'Risk', 'Risk Factors', 'Single Nucleotide Polymorphism', 'Statistical Models', 'Target Populations', 'Techniques', 'Testing', 'Theoretical model', 'Translating', 'Variant', 'Work', 'base', 'burden of illness', 'cancer diagnosis', 'cancer risk', 'clinical practice', 'clinically relevant', 'cohort', 'colon cancer family registry', 'cost effectiveness', 'follow-up', 'genetic pedigree', 'genetic risk factor', 'genetic variant', 'mortality', 'population based', 'prevent', 'prospective', 'public health relevance', 'screening', 'segregation']",NCI,FRED HUTCHINSON CANCER RESEARCH CENTER,R01,2013,277734,0.12800475176176462
