text,title,id,project_number,terms,administration,organization,mechanism,year,funding,score
"Optimizing cervical cancer screening for HPV-vaccinated women: Evaluation of post-vaccination cervical cancer screening test ABSTRACT The HPV vaccine is highly effective in clinical trials, with an absolute risk of persistent (6+ months) infection with vaccine-type high-risk HPV of only 1.4% among vaccinated women. As prevalence of HPV infection decreases, the risk of false positive cervical cancer screening results increases. However, current cervical cancer screening guidelines do not differentiate between vaccinated and unvaccinated women. Data cannot be extrapolated from other countries with different HPV vaccination coverage, as cross-protection against non- vaccine type HPV infection varies by population vaccination rates, and are likely to affect screening test performance. Major challenges in development of new U.S. guidelines are anticipated for the following reasons: 1) large U.S. population-based data on HPV infection rates and cervical cancer screening test statistics are currently not available, and likely vary by regional vaccination rates; 2) most studies evaluating cervical cancer screening results in vaccinated women do not differentiate between those who have received only 1 dose of the vaccine and those who have completed the 2-3 dose series; 3) few studies have evaluated differences in outcomes by age at HPV vaccine initiation or interval between doses. The overarching aim of the proposed research is to determine an optimal cervical cancer screening strategy for women vaccinated against HPV. The objectives of this pilot research are to 1) determine if the prevalence of cervical dysplasia has decreased with HPV vaccination and resultantly changed the PPV of cervical cancer screening tests, and 2) determine if cervical cancer screening test performance varies by age at HPV vaccine initiation, number of doses, or interval between HPV vaccine doses. Aim1: Determine if the decrease in prevalence of cervical dysplasia among vaccinated women has resulted in a decrease in the positive predictive value of cervical cancer screening tests. A cross-sectional study will be conducted to compare cervical cancer screening and diagnostic test results among HPV-vaccinated and unvaccinated women. Positive predictive values for positive HPV tests and abnormal cytology results to predict high-grade dysplasia will be compared by HPV vaccination status. Aim2: Determine if cervical cancer screening test accuracy varies by age at vaccine initiation, number of doses received, and/or interval between doses. The positive predictive value of positive HPV tests and abnormal Pap test results among vaccinated women will be compared by the number of vaccine doses received (1 vs. 2+), age at vaccine initiation, and interval between doses using logistic regression. Project Narrative Current cervical cancer screening guidelines do not differentiate between women who have and have not been vaccinated to prevent human papillomavirus (HPV) infection. United States data to inform changes to cervical cancer screening guidelines for vaccinated women are urgently needed to ensure that harms of screening these women at low risk for cancer do not outweigh the benefits. The results of this research will provide an estimate of the positive predictive value of cervical cancer screening tests (Pap tests, HPV tests) post-vaccination, and define a population of women who are adequately vaccinated (based on age at vaccine initiation, number of vaccine doses, and interval between doses) to benefit from what will likely be decreased cervical cancer screening without significant increase in cancer risk.",Optimizing cervical cancer screening for HPV-vaccinated women: Evaluation of post-vaccination cervical cancer screening test,9936304,R03HS026982,[' '],AHRQ,UNIVERSITY OF MINNESOTA,R03,2020,45234,0.010091001531574974
"Diabetes, Medications and the Cost-Effectiveness of Screening for Colorectal Neoplasia Project Summary/Abstract: The candidate's long-term career goal is to become an independent investigator with transdisciplinary expertise in cancer epidemiology, biomedical informatics, pharmacoepidemiology, and health economic modeling and evaluation. The focused didactic training, mentorship, and experiential learning through research activities proposed in this award will facilitate the development of critical skills in the pursuit of knowledge to inform and improve cancer prevention and screening. The candidate's research is motivated by the recognition that type-2 diabetes mellitus (T2DM) patients are at a 30-40% increased risk for colorectal cancer (CRC), and that anti-diabetic drugs may also alter CRC risk. Thus, this high-risk group presents an opportunity for targeted screening and early detection of CRC. Currently, CRC screening is based on age and family history, with no consideration for comorbidities, including T2DM. Building on her previous work in cancer epidemiology, the candidate seeks to determine the association between T2DM and risk of colorectal polyps: overall, by subtypes, and by lesion severity, individually reflecting different molecular pathways (Aim 1); and to examine the risk for colorectal polyps associated with anti-diabetic therapy: overall, by subtypes, and by lesion severity (Aim 2). These aims will be addressed by leveraging the rich resources of an existing colonoscopy- based cohort at the University of Washington Medical Center's (UWMC) Gastroenterology clinic established during 2003-2011. Demographics, select lifestyle factors, and detailed histopathology have been previously abstracted from UWMC's electronic medical records (EMR) database. The candidate proposes to extend this cohort through 2017 (N~38,000), and enhance it by linking existing data with diabetes-related variables from the EMR database using biomedical informatics (e.g., natural language processing, clinical text mining) to estimate the risk for colorectal neoplasia. Using these empirical estimates derived from Aims 1 and 2, the candidate will then build a microsimulation model projecting the risk for colorectal neoplasia in T2DM patients, accounting for their diabetes therapy. Alternative screening and treatment strategies, including altering the screening start-age, modifying diabetes treatment, or altering screening modality among T2DM patients, will be evaluated for their cost-effectiveness (Aim 3). This work may help inform targeted screening recommendations that could, in turn, lower the incidence and mortality of CRC among persons with T2DM, and improve the cost- effectiveness of CRC screening. The candidate has proposed a training and career development plan that builds upon her prior skills in cancer epidemiology to gain experience and proficiency in biomedical informatics, pharmacoepidemiology, and health economic modeling and evaluation, including cost-effectiveness approaches. The transdisciplinary mentorship team, comprised of national and international experts, will provide the necessary expertise to ensure the success of this proposal, as well as facilitate the candidate's transition into an independent translational investigator in the field of cancer prevention and screening. PROJECT NARRATIVE This study aims to determine the link between clinically diagnosed type-2 diabetes mellitus, use of anti-diabetic medications, and risk of colorectal polyp subtypes, including differences by lesion severity. Evaluating the cost- effectiveness of CRC screening among persons with type-2 diabetes may help inform targeted screening recommendations, which could, in turn, lower the incidence and mortality of CRC among persons with T2DM, and improve the cost-effectiveness of CRC screening.","Diabetes, Medications and the Cost-Effectiveness of Screening for Colorectal Neoplasia",9998913,K07CA222060,"['Accounting', 'Active Learning', 'Address', 'Adult', 'Age', 'Antidiabetic Drugs', 'Award', 'Chemopreventive Agent', 'Chronic', 'Clinic', 'Clinical', 'Code', 'Colonoscopy', 'Colorectal Adenoma', 'Colorectal Cancer', 'Colorectal Neoplasms', 'Colorectal Polyp', 'Computerized Medical Record', 'Data', 'Databases', 'Development', 'Development Plans', 'Diabetes Mellitus', 'Diagnosis', 'Diet', 'Early Diagnosis', 'Economic Models', 'Ensure', 'European', 'Family', 'Gastroenterology', 'Goals', 'Height', 'Histopathology', 'Hyperplastic Polyp', 'Incidence', 'Individual', 'Inflammation', 'Insulin', 'International', 'Intervention', 'Knowledge', 'Laboratories', 'Lesion', 'Light', 'Link', 'Literature', 'Malignant Neoplasms', 'Medical center', 'Mentorship', 'Meta-Analysis', 'Metformin', 'Modality', 'Modeling', 'Molecular', 'Natural Language Processing', 'Non-Insulin-Dependent Diabetes Mellitus', 'Obesity', 'Pathway interactions', 'Patients', 'Persons', 'Pharmaceutical Preparations', 'Pharmacoepidemiology', 'Pharmacology', 'Pharmacotherapy', 'Pharmacy facility', 'Polyps', 'Positioning Attribute', 'Prevalence', 'Procedures', 'Public Health', 'Recording of previous events', 'Records', 'Regimen', 'Reporting', 'Research', 'Research Activity', 'Research Personnel', 'Resources', 'Risk', 'Risk Estimate', 'Risk Factors', 'Role', 'Severities', 'Smoking History', 'Subgroup', 'Sulfonylurea Compounds', 'Testing', 'Thiazolidinediones', 'Time', 'Training', 'Training Activity', 'Type 2 diabetic', 'Universities', 'Washington', 'Weight', 'Work', 'adenoma', 'base', 'biomedical informatics', 'cancer epidemiology', 'cancer prevention', 'career', 'career development', 'case control', 'clinical Diagnosis', 'cohort', 'colorectal cancer progression', 'colorectal cancer risk', 'colorectal cancer screening', 'comorbidity', 'cost effective', 'cost effectiveness', 'cost-effectiveness evaluation', 'demographics', 'diabetes mellitus therapy', 'diabetes risk', 'diabetic', 'economic evaluation', 'experience', 'health economics', 'high risk population', 'improved', 'lifestyle factors', 'mortality', 'non-diabetic', 'personalized screening', 'screening', 'screening guidelines', 'skills', 'success', 'text searching', 'translational scientist', 'treatment strategy']",NCI,UNIVERSITY OF UTAH,K07,2020,158153,0.1501205117697242
"Optimizing long-term post-polypectomy surveillance for colorectal cancer prevention using a prediction rule developed from a large, community-based cohort PROJECT SUMMARY AND ABSTRACT The purpose of this K07 proposal is to provide Jeffrey Lee, MD, MAS with the protected time and resources to pursue the additional training needed to reach his long-term goal of becoming an independent clinical investigator, focused on colorectal cancer (CRC) prevention. Screening has been shown to reduce the incidence and mortality for CRC. However, screening has resulted in a growing cohort of patients with adenomatous polyps (adenomas) and little is known about effectively managing their post-polypectomy surveillance. With limited data available in the literature to determine the appropriate timing and frequency of follow-up colonoscopy for patients after adenoma removal, recommendations for post-polypectomy surveillance from our national guidelines have been imprecise at best. For example, the currently recommended range of 5-10 years for a surveillance colonoscopy for patients with a single adenoma covers a two-fold difference in exam frequency, with resultant two-fold impact on patient risk, cost, and colonoscopy capacity. To help optimize the timing of colonoscopic surveillance and guide appropriate utilization of this invasive and costly resource, stratification of CRC risk after colonoscopic polypectomy from a large community-based cohort with long-term follow-up is needed. Building on his prior work in CRC screening, Dr. Lee seeks to fill this knowledge gap by optimizing surveillance practices in post-polypectomy patients according to patient-, polyp-, and colonoscopy exam-related factors. Specifically, he will determine the long- term CRC risk in patients after colonoscopic polypectomy in a very large “real world” community-based population (Aim 1). He will also identify patient-, polyp-, and exam-related risk factors associated with incident CRC in these patients (Aim 2). Finally, he will develop a CRC risk prediction model that will identify post- polypectomy patients at high and low risk for developing subsequent CRC (Aim 3). To achieve these goals, Dr. Lee and his mentors have designed a career development plan for research and educational training to obtain: 1) knowledge and expertise in advanced epidemiologic methods for design and analysis of cohort studies; 2) knowledge in medical informatics methods; and 3) predictive modeling skills. To achieve the proposed research aims, Dr. Lee will leverage the rich electronic health records of Kaiser Permanente Northern California, a large community-based healthcare system, in which data on patient, physician, colonoscopy, pathology, and CRC status have been collected since 1994. In addition, Dr. Lee will use an established natural language processing tool to efficiently collect data and evaluate potential confounding variables from more than 600,000 colonoscopy reports in order to address one of the main practical challenges that have limited the feasibility of large-scale population-based studies. Thus, completion of these aims has the potential to improve prevention and early detection of CRC, impact current surveillance guidelines for post-polypectomy patients, and reduce overuse and underuse of surveillance colonoscopy. Importantly, this proposal is realistic and feasible within the award period and will allow Dr. Lee to continue to build research skills, generate preliminary data, create additional collaborative relationships, and compete for R01 funding. In summary, this K07 award will support and accelerate the career development activities of Dr. Lee and allow him to successfully launch into the next phase of his career as an independent investigator. PROJECT NARRATIVE Randomized controlled trials have shown that screening reduces the incidence of and mortality from colorectal cancer (CRC), the second leading cause of cancer deaths in the United States. However, screening has resulted in a growing cohort of patients with adenomatous polyps and little is known about effectively managing their post-polypectomy surveillance. Thus in this proposal, we will determine the long-term risk and risk factors of CRC after colonoscopic polypectomy, and develop a CRC risk prediction model to tailor surveillancein post- polypectomy patients using a large, community-based cohort.","Optimizing long-term post-polypectomy surveillance for colorectal cancer prevention using a prediction rule developed from a large, community-based cohort",9986702,K07CA212057,"['Address', 'Adenomatous Polyps', 'Adherence', 'Age', 'Award', 'California', 'Cancer Etiology', 'Cessation of life', 'Chemopreventive Agent', 'Clinical Investigator', 'Cohort Analysis', 'Cohort Studies', 'Colonoscopy', 'Colorectal Cancer', 'Communities', 'Confounding Factors (Epidemiology)', 'DNA', 'Data', 'Development', 'Development Plans', 'Electronic Health Record', 'Epidemiologic Methods', 'Excision', 'Frequencies', 'Funding', 'Future', 'Goals', 'Grant', 'Guidelines', 'Health Care Costs', 'Healthcare Systems', 'Incidence', 'Knowledge', 'Lead', 'Link', 'Literature', 'Longterm Follow-up', 'Malignant Neoplasms', 'Medical Informatics', 'Mentors', 'Mentorship', 'Methods', 'National Cancer Institute', 'Natural Language Processing', 'Outcome', 'Pathology', 'Patient risk', 'Patients', 'Phase', 'Physicians', 'Policies', 'Polypectomy', 'Polyps', 'Population', 'Population Research', 'Population Study', 'Prevention', 'Randomized Controlled Trials', 'Recommendation', 'Regimen', 'Reporting', 'Research', 'Research Personnel', 'Resources', 'Risk', 'Risk Factors', 'Risk stratification', 'Scheme', 'Stratification', 'Surveillance Modeling', 'Surveillance Program', 'Testing', 'Time', 'Training', 'United States', 'United States National Institutes of Health', 'Unnecessary Procedures', 'Work', 'Writing', 'adenoma', 'base', 'career', 'career development', 'cohort', 'colorectal cancer prevention', 'colorectal cancer risk', 'colorectal cancer screening', 'community based participatory research', 'cost', 'design', 'evidence base', 'follow-up', 'high risk', 'improved', 'mortality', 'multidisciplinary', 'population based', 'predictive modeling', 'premalignant', 'risk prediction model', 'screening', 'skills', 'surveillance strategy', 'tool']",NCI,KAISER FOUNDATION RESEARCH INSTITUTE,K07,2020,171720,0.1424142379658928
"Improving Cancer Screening Through A Tailored Technology-Based Intervention Cancer is the second leading cause of death in the United States. Health disparities exist in cancer screening and mortality. Although cancer mortality rates have decreased steadily over the past 25 years, the racial gap persists, and socioeconomic disparities are widening. Improved early detection and treatment can decrease cancer mortality, but many barriers exist to screening uptake. Cancer screening is often a trade-off for both patients and clinicians among different cancer screenings and other preventive opportunities, each of which have their own barriers to completion. This study seeks to improve quality of care and reduce health disparities in cancer mortality by using informatics to better tailor clinical discussions in order to enhance patient motivation to receive screening services and help overcome barriers to screening. The study has the following aims: 1) to develop a predictive model that identifies patients > 50 years old eligible for lung, breast and colorectal cancer screening who are at high-risk for missing these screenings; 2) to develop and pilot test a prototype shared decision-making support tool for patients and clinicians that will increase screening uptake; 3) to perform a pragmatic trial of the refined multilevel intervention that utilizes a shared decision-making support tool for patients and clinicians.  During the planning phase, data from the electronic health record (EHR) will be combined with supplementary data sources (e.g. Area Health Resource File, LexisNexis) to identify patients at risk of not completing recommended screening for these cancers. Hold-out cross-validation will be used to estimate model accuracy. Machine learning model building following feature selection will utilize logistic regression and decision trees to ensure the models are easily transferable to other healthcare settings and interpretable. This predictive model will be used to develop and pilot test an application that will (A) utilize predictive modeling to identify eligible patients likely to miss screening; (B) determine, after providing patient education, patient preferences and concerns regarding screening through self-report augmented by predictive modelling; (C) identify available community resources to facilitate screening; (D) provide this information to patients and to clinicians in the EHR prior to clinical visits to assist shared decision-making conversations and support active problem solving of identified barriers. This multilevel intervention will be pilot-tested and refined within 4 academic primary care practices over 6 months (N=24 clinicians; 8181 potential screenings yearly). A pragmatic trial will be conducted during the R33 phase using a stepped wedge cluster randomized design (N=45 clinicians; 11,239 potential screenings yearly). Completed cancer screening will be the primary outcome. Patient experience, clinician satisfaction and utilization will also be assessed. If successful, this approach will lead to an intervention tailored to the patient and their community that leverages information technology in a scalable way that is transferrable to other clinical settings and types of preventive services. PROJECT NARRATIVE Significant disparities exist in breast, colorectal and lung cancer, the leading causes of cancer mortality, requiring the development of new interventions that increase screening uptake in diverse populations. We propose an intervention that employs a multilevel approach that leverages the Electronic Health Records (EHR) and supplementary data sources to develop a predictive model to identify eligible patients at high-risk of not obtaining screening and to facilitate improved shared decision-making conversations using an EHR based decision-making support tool that interacts with patients and clinicians. By personalizing the approach to screening and improving the quality of patient-clinician interactions, we hope to enhance patient motivation to receive screening services and reduce health disparities.",Improving Cancer Screening Through A Tailored Technology-Based Intervention,10051055,R61AG068951,"['Advisory Committees', 'African American', 'Age', 'Area', 'Cancer Etiology', 'Cause of Death', 'Clinic', 'Clinical', 'Colorectal Cancer', 'Communities', 'Data', 'Data Sources', 'Decision Making', 'Decision Trees', 'Development', 'Early Diagnosis', 'Early treatment', 'Electronic Health Record', 'Ensure', 'Ethnic Origin', 'Ethnic group', 'Health', 'Health Resources', 'Hispanics', 'Individual', 'Informatics', 'Information Technology', 'Intervention', 'Logistic Regressions', 'Machine Learning', 'Malignant Neoplasms', 'Malignant neoplasm of lung', 'Modeling', 'Motivation', 'Patient Education', 'Patient Preferences', 'Patient Self-Report', 'Patients', 'Phase', 'Population Heterogeneity', 'Preventive', 'Preventive screening', 'Preventive service', 'Primary Health Care', 'Problem Solving', 'Quality of Care', 'Race', 'Randomized', 'Resources', 'Risk', 'Rural Community', 'Screening for cancer', 'Services', 'Source', 'Technology', 'Testing', 'United States', 'Validation', 'Visit', 'base', 'cancer health disparity', 'cancer type', 'colorectal cancer screening', 'design', 'electronic data', 'experience', 'feature selection', 'health care settings', 'health disparity', 'high risk', 'improved', 'low socioeconomic status', 'malignant breast neoplasm', 'model building', 'mortality', 'personalized approach', 'pragmatic trial', 'predictive modeling', 'preference', 'primary outcome', 'prototype', 'racial and ethnic', 'regression trees', 'satisfaction', 'screening', 'screening guidelines', 'sex', 'shared decision making', 'socioeconomic disparity', 'support tools', 'tool', 'treatment as usual', 'uptake']",NIA,MEDICAL UNIVERSITY OF SOUTH CAROLINA,R61,2020,279223,0.050914118166908266
