text,title,id,project_number,terms,administration,organization,mechanism,year,funding,score
"Bacterial Vaginosis and Spontaneous Abortion   DESCRIPTION: Bacterial vaginosis (BV) is extremely prevalent among low-income,       urban pregnant women. The current standard of medical care does not involve          screening pregnant women for BV unless clinical symptoms are reported; however,      the majority of pregnant women with BV are asymptomatic. A number of studies         have found associations between BV and late pregnancy outcomes; such as,             preterm labor, premature rupture of membrane, chorioamnionitis, and low birth        weight. The impact of BV on the risk for spontaneous abortion (SAB) is unclear.      In the proposed prospective cohort study, all women will be screened for BV          early in pregnancy regardless of symptoms. The specific aims of this study are       to: 1) characterize the prevalence and predictors of BV in women early in            pregnancy and 2) evaluate whether BV during pregnancy is an important,               independent predictor of SAB. Women attending their first clinical prenatal          care visit at the Hospital of the University of Pennsylvania Obstetric Clinic        with a pregnancy of 12 weeks gestation or less as determined by last menstrual       period will be recruited. We will screen all women for bacterial vaginosis and       follow-up through 22 weeks gestation to identify women experiencing a                spontaneous abortion. We will enroll 2200 women over a three year period arid        compare SAB rates for the estimated 400 women found to test positive for BY (20      percent of patients) and the 1600 women found to test negative for By. Baseline      data collection will be standardized and include a structured in-person              interview, a vaginal smear used to detect By, and urine analysis to determine        alcohol, cocaine and cotinine. Follow-up telephone interviews will be conducted      at 22 weeks gestation to determine the status of pregnancy (SAB vs. non-SAB)         and BV diagnosis and treatment. Pregnancy outcome status will also be                ascertained through ongoing review of medical records, pathology logs and birth      certificates. Initial analyses will be exploratory and descriptive,                  characterizing the prevalence and predictors of BV and the risk factors for          SAB. The primary analysis will be logistic regression, with relative risks and       95 percent confidence intervals, to explore whether BV is an independent             predictor of SAB. This study will provide a unique opportunity to evaluate the       prevalence of BV among pregnant women and to determine the relationship between      BV and incident SAB.                                                                                                                                                      n/a",Bacterial Vaginosis and Spontaneous Abortion,7142772,R01HD038856,"['African American', 'bacterial disease', 'caucasian American', 'cervical /vaginal smear', 'disease /disorder proneness /risk', 'drug detection', 'gestational age', 'human pregnant subject', 'interview', 'mass screening', 'patient oriented research', 'pregnancy', 'spontaneous abortion', 'statistics /biometry', 'telecommunications', 'urinalysis', 'vaginitis', 'women&apos', 's health']",NICHD,TEMPLE UNIVERSITY,R01,2004,138339,0.1823776460912379
"Bacterial Vaginosis and Spontaneous Abortion   DESCRIPTION: Bacterial vaginosis (BV) is extremely prevalent among low-income,       urban pregnant women. The current standard of medical care does not involve          screening pregnant women for BV unless clinical symptoms are reported; however,      the majority of pregnant women with BV are asymptomatic. A number of studies         have found associations between BV and late pregnancy outcomes; such as,             preterm labor, premature rupture of membrane, chorioamnionitis, and low birth        weight. The impact of BV on the risk for spontaneous abortion (SAB) is unclear.      In the proposed prospective cohort study, all women will be screened for BV          early in pregnancy regardless of symptoms. The specific aims of this study are       to: 1) characterize the prevalence and predictors of BV in women early in            pregnancy and 2) evaluate whether BV during pregnancy is an important,               independent predictor of SAB. Women attending their first clinical prenatal          care visit at the Hospital of the University of Pennsylvania Obstetric Clinic        with a pregnancy of 12 weeks gestation or less as determined by last menstrual       period will be recruited. We will screen all women for bacterial vaginosis and       follow-up through 22 weeks gestation to identify women experiencing a                spontaneous abortion. We will enroll 2200 women over a three year period arid        compare SAB rates for the estimated 400 women found to test positive for BY (20      percent of patients) and the 1600 women found to test negative for By. Baseline      data collection will be standardized and include a structured in-person              interview, a vaginal smear used to detect By, and urine analysis to determine        alcohol, cocaine and cotinine. Follow-up telephone interviews will be conducted      at 22 weeks gestation to determine the status of pregnancy (SAB vs. non-SAB)         and BV diagnosis and treatment. Pregnancy outcome status will also be                ascertained through ongoing review of medical records, pathology logs and birth      certificates. Initial analyses will be exploratory and descriptive,                  characterizing the prevalence and predictors of BV and the risk factors for          SAB. The primary analysis will be logistic regression, with relative risks and       95 percent confidence intervals, to explore whether BV is an independent             predictor of SAB. This study will provide a unique opportunity to evaluate the       prevalence of BV among pregnant women and to determine the relationship between      BV and incident SAB.                                                                                                                                                      n/a",Bacterial Vaginosis and Spontaneous Abortion,6719659,R01HD038856,"['African American', 'bacterial disease', 'caucasian American', 'cervical /vaginal smear', 'disease /disorder proneness /risk', 'drug detection', 'gestational age', 'human pregnant subject', 'interview', 'mass screening', 'patient oriented research', 'pregnancy', 'spontaneous abortion', 'statistics /biometry', 'telecommunications', 'urinalysis', 'vaginitis', 'women&apos', 's health']",NICHD,UNIVERSITY OF PENNSYLVANIA,R01,2004,266169,0.1823776460912379
"COMMUNITY INTERVENTION TO INCREASE MAMMOGRAPHY SCREENING Low-income African American women are at relatively high risk for breast cancer mortality, due in part to their limited mammography use.  The purpose of the proposed stud is to compare the effect of a tailored interactive computer program with a culturally appropriate video on mammography use.  Secondly, this study will assess the effect of a booster tailored interactive computer programed and booster video program that is delivered one year after the initial intervention to improve interval mammography screening.  Finally, the cost effectiveness of both delivery methods will be explored. The design for this study contrasts three groups randomly allocated to tailored interactive computer, video, or control.  Subjects will include 625 African American women ages 41 to 75 years and at 150% poverty or below who have not had a mammogram in the last 18 months. A network of multi service centers located in the poorest areas of a large metropolitan are will serve as resources for recruitment and intervention delivery.  The interactive computer and video programs will build on concepts found to be predictive of mammography in prior work.  The intervention will be delivered to appropriate groups after a baseline interview and again at 12 months for women who are randomly assigned to receive a booster intervention. Only have of the women initially assigned to receive the interactive computer program or video will receive the booster in order to compare the women receiving the booster intervention with women who receive only the initial intervention.  Baseline interviews prior to intervention) will take place in the multi service center and telephone interviews will take place a three times following intervention delivery. l. Women will receive $25.00 following each interview, for a total of $100. This study is developed to have 90% power to detect overall differences in compliance at six months and 21 months.  Mammography compliance will be measured through self-report and facility verification.  Belief variables built into the intervention and measured through validity and reliability.  The primary outcomes at six month and 21 months will be tested by a chi-square statistic using logistic regression with two degrees of freedom.  Cost effectiveness analysis is planned for the third aim.  n/a",COMMUNITY INTERVENTION TO INCREASE MAMMOGRAPHY SCREENING,6774611,R01CA077736,"['African American', ' behavioral /social science research tag', ' behavioral medicine', ' clinical research', ' community health services', ' computer assisted instruction', ' culture', ' disease /disorder prevention /control', ' health behavior', ' health care cost /financing', ' health care service utilization', ' health services research tag', ' human subject', ' interactive multimedia', ' interview', ' longitudinal human study', ' low socioeconomic status', ' mammography', ' neoplasm /cancer education', ' videotape /videodisc', "" women's health""]",NCI,INDIANA UNIV-PURDUE UNIV AT INDIANAPOLIS,R01,2003,112420,0.20278302995351974
"GESTATIONAL DIABETES:  DIAGNOSTIC CRITERIA AND OUTCOMES   DESCRIPTION: (Adapted from Investigator's Abstract) Gestational diabetes             mellitus (GDM) is associated with increased risk of several adverse infant and       maternal outcomes and its clinical recognition can reduce these risks. There is      concern that the current criteria for GDM may be to restrictive and that             residual excess risk of perinatal complications exists below present cutoff          values. The proposed study will evaluate whether among women without GDM (as         defined by current criteria), increasing levels of maternal glycemia are             associated with increased risk of selected perinatal complications: infant           severe macrosomia, severe hyperbilirubinemia, hypoglycemia, respiratory              distress syndrome, and maternal preeclampsia/eclampsia. To accomplish this, the      investigators propose to conduct five nested case-control studies, one for each      of the complications of interest, within a large multiethnic cohort of               approximately 74,000 women who were screened at 24 to 28 weeks of gestation at       Kaiser Permanente, Northern California between 1995 and 1998. In this setting        nearly 94 percent of the pregnant women are screened for GDM by a 50 gm., 1 hr.      oral glucose tolerance test (50 g, 1-h OGTT) and approximately 15 percent have       are abnormal screening and go on to receive the diagnostic (100-g, 3-h OGTT)         test. Potential cases of each type of complication will be identified by             searching computerized hospitalization and laboratory databases. For each of         the infant complications, 500 cases will be randomly selected without knowledge      of the maternal glucose values. A single control group for the infant                complication case groups will be 1,000 infants randomly selected from all            births and frequency matched on gestational age to the distribution of the           combined case group. Five hundred women with either preeclampsia or eclampsia        and 500 age-matched controls will be randomly selected. The medical records of       the 3,000 mother-infant pairs in the four case-control studies on infant             complications, and 1,000 women for the case-control study of                         preeclampsia/eclampsia, will be abstracted to confirm eligibility, and, if so,       to ascertain data on possible maternal and infant covariates. Logistic               regression will be used to estimate the odds ratios associated with several          levels of pregnancy glycemia and perinatal complications. The investigators          state that the proposed study will provide important knowledge about the             magnitude of the risk of severe perinatal complications associated with degrees      of maternal hyperglycemia below the glucose cutpoints currently used to              diagnose GDM.                                                                                                                                                             n/a",GESTATIONAL DIABETES:  DIAGNOSTIC CRITERIA AND OUTCOMES,6650183,R01DK054834,"['blood glucose', ' clinical research', ' diagnosis design /evaluation', ' diagnostic tests', ' disease /disorder proneness /risk', ' embryo /fetus disorder', ' epidemiology', ' female', ' gestational diabetes mellitus', ' human pregnant subject', ' human subject', ' mother /infant health care', ' outcomes research', ' preeclampsia']",NIDDK,KAISER FOUNDATION RESEARCH INSTITUTE,R01,2003,368323,0.1002808931751271
"AUTOMATED TELE COUNSELING FOR SCREENING MAMMOGRAPHY   DESCRIPTION (adapted from investigator's abstract): The goal of this project is      to evaluate the effectiveness and acceptability of a computer-based                  telecommunications system for increasing of regular screening mammography among      women ages 50-74. The Telephone-Linked-Communications for Mammography Screening      (TLC-M) is designed to educate, advise and motivate women to have regular            screening mammograms. There will be two versions of the TLC-M: one for women         who are coming due for their annual screening mammogram (""pre-due"" women) and a      second version for women who missed their annual mammogram and who are               ""past-due"" (""past-due"" women). The TLC technology supporting TLC-M has been          successfully used to positively affect patient behavior in medication                compliance, diet and exercise. It uses real human voice to speak over the            telephone; the users communicate by using the touch tone keypad on their             telephones. TLC-M will consist of up to three automated telephone                    conversations. The content of these conversations is based on the                    Transtheoretical Model in which a women's readiness to obtain routine screening      mammograms is assessed. Depending upon the women's intention, barriers for           having mammography are identified and addressed.                                                                                                                          In the proposed project, the investigators will (1) modify a current version of      TLC-M, (2) pretest and modify the system accordingly, and (3) conduct two            linked randomized controlled trials of the effectiveness of TLC-M in increasing      mammography rates in ""pre-due"" and ""past-due"" women. Eligible women will be          ages 50-74 and will have received a screening mammogram six months prior to          entering the study. The researchers will recruit 1,050 participants over 12          months from a general medical practice, using the computer system of an              affiliated radiology department to screen for potentially eligible women,            followed by a telephone and office interviews to determine final eligibility         and to collect baseline data. One month prior to their due date for annual           screening mammography, these women will receive a reminder letter to schedule a      mammogram. In addition, a random sample of 150 of them will use TLC-M. All           participants in this 'pre-due"" intervention will be evaluated 4 months after         their intervention to determine whether they obtained a mammogram. Women who         received the letter only and who did not obtain a mammogram during the               observation period (estimated to be 360 [40 percent of 900]} will enter a            ""past-due"" reminder letter or to use TLC-M. Four months after the                    interventions, participants will be evaluated to determine whether they had a        mammogram. Mammography rates will be determined and compared using logistic          regression to control for potential demographic, medical and behavioral              confounders. TLC-M users in both studies will be queried regarding their             satisfaction with TLC-M.                                                                                                                                                  n/a",AUTOMATED TELE COUNSELING FOR SCREENING MAMMOGRAPHY,6603279,R01CA084447,"['behavioral /social science research tag', ' biomedical automation', ' clinical research', ' clinical trials', ' computer assisted patient care', ' counseling', ' female', ' human subject', ' mammography', ' telecommunications', "" women's health""]",NCI,BOSTON MEDICAL CENTER,R01,2003,428953,0.21630803419164815
"Bacterial Vaginosis and Spontaneous Abortion   DESCRIPTION: Bacterial vaginosis (BV) is extremely prevalent among low-income,       urban pregnant women. The current standard of medical care does not involve          screening pregnant women for BV unless clinical symptoms are reported; however,      the majority of pregnant women with BV are asymptomatic. A number of studies         have found associations between BV and late pregnancy outcomes; such as,             preterm labor, premature rupture of membrane, chorioamnionitis, and low birth        weight. The impact of BV on the risk for spontaneous abortion (SAB) is unclear.      In the proposed prospective cohort study, all women will be screened for BV          early in pregnancy regardless of symptoms. The specific aims of this study are       to: 1) characterize the prevalence and predictors of BV in women early in            pregnancy and 2) evaluate whether BV during pregnancy is an important,               independent predictor of SAB. Women attending their first clinical prenatal          care visit at the Hospital of the University of Pennsylvania Obstetric Clinic        with a pregnancy of 12 weeks gestation or less as determined by last menstrual       period will be recruited. We will screen all women for bacterial vaginosis and       follow-up through 22 weeks gestation to identify women experiencing a                spontaneous abortion. We will enroll 2200 women over a three year period arid        compare SAB rates for the estimated 400 women found to test positive for BY (20      percent of patients) and the 1600 women found to test negative for By. Baseline      data collection will be standardized and include a structured in-person              interview, a vaginal smear used to detect By, and urine analysis to determine        alcohol, cocaine and cotinine. Follow-up telephone interviews will be conducted      at 22 weeks gestation to determine the status of pregnancy (SAB vs. non-SAB)         and BV diagnosis and treatment. Pregnancy outcome status will also be                ascertained through ongoing review of medical records, pathology logs and birth      certificates. Initial analyses will be exploratory and descriptive,                  characterizing the prevalence and predictors of BV and the risk factors for          SAB. The primary analysis will be logistic regression, with relative risks and       95 percent confidence intervals, to explore whether BV is an independent             predictor of SAB. This study will provide a unique opportunity to evaluate the       prevalence of BV among pregnant women and to determine the relationship between      BV and incident SAB.                                                                                                                                                      n/a",Bacterial Vaginosis and Spontaneous Abortion,6637934,R01HD038856,"['African American', ' bacterial disease', ' caucasian American', ' cervical /vaginal smear', ' disease /disorder proneness /risk', ' drug detection', ' gestational age', ' human pregnant subject', ' interview', ' mass screening', ' patient oriented research', ' pregnancy', ' spontaneous abortion', ' statistics /biometry', ' telecommunications', ' urinalysis', ' vaginitis', "" women's health""]",NICHD,UNIVERSITY OF PENNSYLVANIA,R01,2003,611480,0.1823776460912379
"COMMUNITY INTERVENTION TO INCREASE MAMMOGRAPHY SCREENING Low-income African American women are at relatively high risk for breast cancer mortality, due in part to their limited mammography use.  The purpose of the proposed stud is to compare the effect of a tailored interactive computer program with a culturally appropriate video on mammography use.  Secondly, this study will assess the effect of a booster tailored interactive computer programed and booster video program that is delivered one year after the initial intervention to improve interval mammography screening.  Finally, the cost effectiveness of both delivery methods will be explored. The design for this study contrasts three groups randomly allocated to tailored interactive computer, video, or control.  Subjects will include 625 African American women ages 41 to 75 years and at 150% poverty or below who have not had a mammogram in the last 18 months. A network of multi service centers located in the poorest areas of a large metropolitan are will serve as resources for recruitment and intervention delivery.  The interactive computer and video programs will build on concepts found to be predictive of mammography in prior work.  The intervention will be delivered to appropriate groups after a baseline interview and again at 12 months for women who are randomly assigned to receive a booster intervention. Only have of the women initially assigned to receive the interactive computer program or video will receive the booster in order to compare the women receiving the booster intervention with women who receive only the initial intervention.  Baseline interviews prior to intervention) will take place in the multi service center and telephone interviews will take place a three times following intervention delivery. l. Women will receive $25.00 following each interview, for a total of $100. This study is developed to have 90% power to detect overall differences in compliance at six months and 21 months.  Mammography compliance will be measured through self-report and facility verification.  Belief variables built into the intervention and measured through validity and reliability.  The primary outcomes at six month and 21 months will be tested by a chi-square statistic using logistic regression with two degrees of freedom.  Cost effectiveness analysis is planned for the third aim.  n/a",COMMUNITY INTERVENTION TO INCREASE MAMMOGRAPHY SCREENING,6579722,R01CA077736,"['African American', ' behavioral /social science research tag', ' behavioral medicine', ' clinical research', ' community health services', ' computer assisted instruction', ' culture', ' disease /disorder prevention /control', ' health behavior', ' health care cost /financing', ' health care service utilization', ' health services research tag', ' human subject', ' interactive multimedia', ' interview', ' longitudinal human study', ' low socioeconomic status', ' mammography', ' neoplasm /cancer education', ' videotape /videodisc', "" women's health""]",NCI,INDIANA UNIV-PURDUE UNIV AT INDIANAPOLIS,R01,2002,110007,0.20278302995351974
