text,title,id,project_number,terms,administration,organization,mechanism,year,funding,score
"Deep radiomic decision support system for colorectal cancer Project Summary/Abstract Computer-aided detection (CADe) has been shown to increase readers’ sensitivity and reduce inter-observer variance in detecting abnormalities in medical images. However, they prompt relatively large numbers of false positives (FPs) that readers find tedious to review and, during this process, the readers can incorrectly dismiss true lesions prompted correctly to them by CADe systems. Thus, there is a demand for an advanced decision support system that would provide not only high detection sensitivity, but also high specificity while being able to explain why a specific location was prompted as a lesion. In this project, we propose to improve the detection specificity of CADe by deep convolutional neural networks (DCNNs) that can analyze the extrinsic radiomic phenotype, such as the context of local anatomy, of target lesions, whereas current CADe systems consider only the intrinsic radiomic phenotype, such as the shape and texture of detected lesions. Further, we can use DCNNs to provide an explanation of why a specific location was prompted by using anatomically meaningful object categories with similar-image retrieval of past diagnosed cases. In this project, we will focus on computed tomographic colonography (CTC), which is a minimally invasive screening method for early detection of colorectal lesions to prevent colorectal cancer (CRC), which is the second leading cause of cancer deaths in the United States. Historically, however, only adenomas were believed to be precursors of CRC. Recent studies have revealed a molecular pathway where also serrated lesions can develop into CRC. Recent studies have indicated that CTC can detect serrated lesions accurately based upon the phenomenon called contrast coating. Thus, the goal of this project is to develop a deep radiomic decision support (DeepDES) system that leverages deep learning for providing high sensitivity and specificity in the detection of colorectal lesions, in particular, serrated lesions, and for providing diagnostic information that explains why a specific location was prompted as a lesion to assist readers in assessing detected lesions correctly. To achieve the goal, we will explore the following specific aims: (1) Develop a radiomic deep-learning (RAID) scheme for the detection of colorectal lesions, (2) develop a DeepDES system for diagnosis of detected lesions, and (3) evaluate the clinical benefit of DeepDES system. Successful development of the proposed DeepDES system will provide an advanced decision support that addresses the current concerns about CADe by yielding both high detection sensitivity and high specificity while being able to explain why a specific location was prompted as a target lesion. Broad adoption and use of the DeepDES system will advance the prevention and early diagnosis of cancer, and thus will ultimately reduce mortality from colorectal cancer in the United States. Project Narrative Successful development of the proposed deep radiomic decision support (DeepDES) system will provide an advanced decision support that addresses the current concerns about computer-aided detection (CADe) by yielding both high detection sensitivity and high specificity while being able to explain why a specific location was prompted as a target lesion. Such a system is expected to outperform current state-of-the-art CADe systems in the diagnosis of colorectal lesions, in particular, serrated lesions. Broad adoption and use of the DeepDES system will advance the prevention and early diagnosis of cancer, and thus will ultimately reduce mortality from colorectal cancer in the United States.",Deep radiomic decision support system for colorectal cancer,9288493,R01EB023942,"['3-Dimensional', 'Address', 'Adoption', 'Anatomy', 'Big Data', 'Biological Neural Networks', 'Biopsy', 'Cancer Etiology', 'Carcinoma', 'Categories', 'Cessation of life', 'Clinical', 'Colonoscopy', 'Colorectal', 'Colorectal Cancer', 'Computed Tomographic Colonography', 'Computer Simulation', 'Databases', 'Decision Support Systems', 'Detection', 'Development', 'Diagnosis', 'Diagnostic', 'Early Diagnosis', 'Evaluation', 'Goals', 'Guidelines', 'Human', 'Image', 'Learning', 'Lesion', 'Location', 'Machine Learning', 'Medical Imaging', 'Methods', 'Molecular', 'Multi-Institutional Clinical Trial', 'Optics', 'Pathway interactions', 'Performance', 'Phenotype', 'Prevention', 'Problem Solving', 'Process', 'Psychological Transfer', 'Reader', 'Retrieval', 'Safety', 'Scheme', 'Sensitivity and Specificity', 'Shapes', 'Specificity', 'System', 'Testing', 'Texture', 'Time', 'Training', 'United States', 'adenoma', 'base', 'cancer diagnosis', 'computer aided detection', 'cost', 'improved', 'innovation', 'minimally invasive', 'mortality', 'prevent', 'radiologist', 'radiomics', 'screening', 'success']",NIBIB,MASSACHUSETTS GENERAL HOSPITAL,R01,2017,436007,0.050692208890453706
"Comprehensive Colorectal Cancer Risk Prediction to Inform Personalized Screening PROJECT SUMMARY The guidelines for initiation of colorectal cancer (CRC) screening are currently based on two risk factors: attained age and family history of CRC. Using the principles of precision medicine, we will individually tailor CRC screening recommendations based on the enormous knowledge we now have on genetic and non- genetic factors that predict risk for this disease. This strategy will reduce under and over-utilization of CRC screening, because individual risks vary substantially in the population, and over 80% of all CRC cases occur in those without a positive family history. In Aim 1 we will develop predictive models for CRC, based on genetic (~30M common and rare genotyped or imputed genetic variants) and clinico-epidemiologic variables (over 70 harmonized characteristics), derived from over 40,000 colorectal tumor cases and 46,000 controls. We will identify key predictors, and derive efficient personalized risk-prediction models for early detection of more treatable CRCs as well for CRC prevention, through the identification of advanced colorectal adenomas. In Aim 2 we will calibrate and validate these models in two prospective cohorts of >120,000 participants, including 40,000 minority members, diversity representing racially/ethnically and socioeconomically. These two cohorts (Research Program on Genes, Environment and Health and the Women's Health Initiative Minority cohort) contain genome-wide genotype array and comprehensive risk factor data coupled to data on screening and outcome data, allowing us to test the model's ability to predict risk for CRC and advanced colorectal adenoma across a broadly defined community-based population, and to personalize decision on starting age of screening based on individually specific genetic and environmental risk factors. In Aim 3 we will estimate the population benefit of our risk-stratified screening strategy, based on our risk prediction methods, compared with the current screening recommendations. This comparison will employ the well-tested decision model currently used to inform the United States Preventive Services Task Force CRC screening guidelines. Accomplishing these three aims, our research has the potential to accelerate the translation of a large amount of genetic and epidemiologic research to patient care by predicting advanced adenoma risk, for cancer prevention, and predicting cancer risk, for early cancer detection. Genetic testing is becoming part of routine care and genetic data will increasingly become part of an individual's medical record. Using genetic and non-genetic risk-factor information in clinical and preventive settings is a critical step towards developing precision medicine. Our models will provide recommendations for individually tailored CRC screening and interventions and, because they are personalized, may also increase adherence, maximize the appropriate use of invasive technologies, and guide important next steps towards public health policy development and clinical translation.   PROJECT NARRATIVE Screening for colorectal cancer (CRC) saves lives, but current recommendations for initiation of CRC screening do not use important information on individual genetic, lifestyle and environmental risks for this disease. Our research, in large CRC consortia will accelerate the translation of several decades of genetic and epidemiologic research on CRC risks, to allow for personalized screening decisions, based on an individual's specific genetic and environmental risk factor distributions. This work will ensure that the most comprehensive information will inform novel precision medicine strategies for CRC.  ",Comprehensive Colorectal Cancer Risk Prediction to Inform Personalized Screening,9237818,R01CA206279,"['Adherence', 'Advisory Committees', 'Age', 'Alcohols', 'California', 'Cancer Etiology', 'Cancer Intervention and Surveillance Modeling Network', 'Case-Control Studies', 'Cessation of life', 'Characteristics', 'Clinical', 'Colon', 'Colorectal Adenoma', 'Colorectal Cancer', 'Colorectal Neoplasms', 'Communities', 'Cost Effectiveness Analysis', 'Coupled', 'Data', 'Decision Modeling', 'Diet', 'Early Diagnosis', 'Early identification', 'Ensure', 'Environment', 'Environmental Risk Factor', 'Epidemiology', 'Ethnic Origin', 'Evaluation', 'Excision', 'Family', 'Family history of', 'Genes', 'Genetic', 'Genetic Research', 'Genetic Risk', 'Genetic screening method', 'Genotype', 'Guidelines', 'Health', 'Individual', 'Intervention', 'Knowledge', 'Life Expectancy', 'Life Style', 'Machine Learning', 'Malignant Neoplasms', 'Medical Records', 'Methods', 'Minority', 'Modeling', 'National Cancer Institute', 'Obesity', 'Outcome', 'Participant', 'Patient Care', 'Persons', 'Pharmaceutical Preparations', 'Physical activity', 'Physicians', 'Policy Developments', 'Population', 'Predictive Factor', 'Preventive', 'Preventive service', 'Primary Prevention', 'Prospective cohort', 'Public Health', 'Recommendation', 'Recording of previous events', 'Research', 'Resources', 'Risk', 'Risk Factors', 'Sampling', 'Science', 'Screening for cancer', 'Secondary Prevention', 'Signal Transduction', 'Smoking', 'Technology', 'Testing', 'Training', 'Translations', 'United States', 'Variant', 'Women&apos', 's Health', 'Work', 'adenoma', 'base', 'cancer prevention', 'cancer risk', 'clinical practice', 'clinical translation', 'cohort', 'colorectal cancer prevention', 'colorectal cancer screening', 'community based participatory research', 'comparative', 'cost', 'cost effective', 'cost effectiveness', 'demographics', 'disorder risk', 'epidemiologic data', 'epidemiology study', 'ethnic minority population', 'functional genomics', 'gene environment interaction', 'genetic variant', 'genome sequencing', 'genome wide association study', 'genome-wide', 'genomic data', 'health care delivery', 'member', 'non-genetic', 'novel', 'personalized decision', 'personalized medicine', 'personalized screening', 'population based', 'precision medicine', 'predictive modeling', 'programs', 'racial and ethnic', 'rare variant', 'routine care', 'screening', 'socioeconomics', 'tool', 'whole genome']",NCI,FRED HUTCHINSON CANCER RESEARCH CENTER,R01,2017,738377,0.1939778835202958
"Scalable Clinical Decision Support for Individualized Cancer Risk Management Project Summary / Abstract We propose to enable a scalable clinical decision support (CDS) platform that helps clinicians and patients select cancer screening strategies that are best suited to each individual. This kind of CDS is important because increased evidence supports personalizing cancer screening decisions according to each individual's unique cancer risks. While a highly desired goal, individualizing screening at a population scale requires the implementation of patient-specific risk assessments for several types of cancer. This is quite challenging in today's overwhelmed primary care environment. Our proposed CDS platform addresses this challenge by (i) automating the risk stratification process at the population level based on EHR data and patient reported data; (ii) prioritizing patients for case review by genetic counselors; and (iii) automatically communicating risk and screening recommendations with primary care providers and their patients. We will integrate the CDS platform with the Epic EHR and test it at the University of Utah Health Care community clinics and the Huntsman Cancer Institute. We will assess the generalizability of the CDS platform with a different EHR (Cerner) at a different institution (Intermountain Healthcare). To maximize the dissemination potential for the proposed cancer risk screening platform, we will extend two well-established open source CDS platforms: OpenCDS and OpenInfobutton. These platforms are reference implementations of international EHR standards that are required for EHR certification in the US. We will also obtain software certification from the Open Source EHR Alliance, share the CDS platform and our experiences with other awardees in the ITCR Program, present the CDS platform at national and international cancer and informatics conferences; and engage with relevant stakeholders through a technical expert panel. Any healthcare organization with a certified EHR will be able to use the proposed CDS platform. Therefore, if successful, this proposal can have a significant impact on disseminating individualized cancer screening practices according to the best available evidence. The proposed research addresses the need for individualizing cancer screening according to the risk of an individual. We propose to enable software that scans electronic health records of entire patient populations to automatically detect those at a high risk to develop specific types of cancer according to cancer guidelines. Genetic counselors will review patients identified by the software, and discuss optimal cancer screening strategies with the patient and their primary care providers.",Scalable Clinical Decision Support for Individualized Cancer Risk Management,9295773,U24CA204800,"['Address', 'Adoption', 'Algorithms', 'Architecture', 'Breast Cancer Detection', 'Certification', 'Clinic', 'Clinical', 'Colorectal Cancer', 'Community Healthcare', 'Computer software', 'Coupled', 'Data', 'Data Reporting', 'Detection', 'Documentation', 'Ecosystem', 'Electronic Health Record', 'Environment', 'Family', 'Goals', 'Guidelines', 'Healthcare', 'Healthcare Systems', 'Incentives', 'Individual', 'Informatics', 'Information Retrieval', 'Institutes', 'Institution', 'International', 'Intervention', 'Logic', 'Malignant Neoplasms', 'Modality', 'National Comprehensive Cancer Network', 'Natural Language Processing', 'Patient Care', 'Patient risk', 'Patients', 'Population', 'Primary Health Care', 'Process', 'Provider', 'PubMed', 'Recommendation', 'Recording of previous events', 'Research', 'Research Infrastructure', 'Risk', 'Risk Assessment', 'Risk Management', 'Risk stratification', 'Scanning', 'Screening for cancer', 'System', 'Technology', 'Testing', 'Universities', 'Utah', 'base', 'cancer risk', 'cancer type', 'design', 'experience', 'genetic counselor', 'healthcare community', 'high risk', 'improved', 'malignant breast neoplasm', 'online course', 'online resource', 'open source', 'patient population', 'personalized screening', 'primary care setting', 'programs', 'screening', 'support tools', 'symposium', 'web services']",NCI,UNIVERSITY OF UTAH,U24,2017,766250,0.03925990116146956
"The Electronic Medical Records and Genomics (eMERGE) Network, Phase III ﻿    DESCRIPTION (provided by applicant): This application from the Group Health (GH)/University of Washington (UW) eMERGE team proposes specific aims designed to advance integration of genomic data into clinical practice with a focus on clinical discovery and implementation on Mendelian forms of colorectal cancer and/or polyposis (CRC/P) and incidental findings in other actionable genes. Our aims will also allow us to address challenges involved in bringing genomic medicine into standard medical care. Our focus on CRC/P, and quantitative traits and incidental findings (IF) in other actionable genes represents a unique opportunity to move the field forward towards the goal of bringing genomic medicine into effective, standard medical practice in an everyday community practice setting. We have 3 Aims. Aim 1: Genomic medicine discovery and implementation focused on CRC/P, Triglycerides (TG), and neutrophil count (NPC). We proposed sequencing of 1000 CRC and 1000 Asian ancestry participants, to achieve sub- aims of understanding the genetic basis of CRC, TG, and NPC. Aim 2: Integrate genomic information into GH-wide clinical care and the EMR. We will develop intuitive, comprehensive reports to return CRC and other genes deemed actionable by the American College of Medical Genetics and Genomics (ACMG). We will incorporate stakeholder input and then to implement integrated processes and tools into an integrated delivery system with a focus on CRC/P and Long QT syndrome. We will develop and evaluate educational outreach and online resources. Aim 3: Evaluate the effectiveness and economic impact of result return to patients and their families. We will implement a novel tool to increase family communication of CRC genetic results and evaluate the economic impact and cost effectiveness of this tool as well as of returning IFs. Completion of the work in this eMERGE III proposal will guarantee that the Seattle site remains an engaged and effective leader in the eMERGE network in support of NHGRI's mission to ensure that barriers to successful integration of genomic medicine in clinical care are overcome. PUBLIC HEALTH RELEVANCE: This eMERGE III proposal builds on past discoveries and research designed to translate genomic advances into clinical care involving clinicians, patients and families. This phase focuses on traits associated with preventable health concerns: colon cancer, triglycerides, and immunity. We address optimal methods to share information across families and whether other information found by genomic tests impact the care, health, and medical costs of individuals.","The Electronic Medical Records and Genomics (eMERGE) Network, Phase III",9551116,U01HG008657,"['Address', 'Algorithms', 'Amendment', 'American', 'Asians', 'Blood', 'Cardiovascular Diseases', 'Caring', 'Clinical', 'Collaborations', 'Colon Carcinoma', 'Colorectal Cancer', 'Communication', 'Community Practice', 'Community of Practice', 'Complex', 'Computerized Medical Record', 'Coupled', 'Data', 'Development', 'Digital Libraries', 'Disease', 'Disease Resistance', 'Economics', 'Education', 'Effectiveness', 'Ensure', 'Evaluation', 'Family', 'General Population', 'Genes', 'Genetic', 'Genomic medicine', 'Genomics', 'Goals', 'Health', 'Health system', 'Hereditary Disease', 'Herpes zoster disease', 'Immunity', 'Incidental Findings', 'Individual', 'Integrated Delivery Systems', 'Intuition', 'Laboratories', 'Leadership', 'Link', 'Long QT Syndrome', 'Malignant Neoplasms', 'Medical', 'Medical Genetics', 'Medical Libraries', 'Methods', 'Mission', 'Modeling', 'Morbidity - disease rate', 'National Human Genome Research Institute', 'Natural Language Processing', 'Other Genetics', 'Participant', 'Pathogenicity', 'Patient Care', 'Patients', 'Penetrance', 'Pharmacogenetics', 'Phase', 'Phenotype', 'Physicians', 'Policy Developments', 'Population', 'Predisposition', 'Preventive screening', 'Primary Health Care', 'Process', 'Provider', 'Randomized Controlled Trials', 'Records', 'Reporting', 'Research Design', 'Resources', 'Risk', 'Site', 'Social Impacts', 'Technology', 'Testing', 'Translating', 'Triglycerides', 'Universities', 'Variant', 'Washington', 'Work', 'age related', 'base', 'clinical care', 'clinical practice', 'cost', 'cost effectiveness', 'design', 'economic cost', 'economic impact', 'economic outcome', 'genetic association', 'genetic variant', 'genome wide association study', 'genomic data', 'improved', 'innovation', 'interest', 'medical schools', 'medical specialties', 'mortality', 'neutrophil', 'novel', 'online resource', 'outreach', 'polyposis', 'prevent', 'public health relevance', 'rare variant', 'screening', 'tool', 'trait']",NHGRI,KAISER FOUNDATION RESEARCH INSTITUTE,U01,2017,842722,0.12705061473138904
"miRNA and colorectal cancer: associations with tumor phenotype and survival DESCRIPTION (provided by applicant): MicroRNAs (miRNA) are a class of small regulatory RNAs that mediate post-transcriptional silencing of specific target mRNAs. Our overall hypotheses are that miRNA expression is unique to tumor molecular phenotype; that miRNA expression levels at time of diagnosis predicts survival; and that miRNA expression is associated with inflammation-related genetic and lifestyle factors key to colorectal cancer (CRC). This study takes a two pronged approach to addressing our hypotheses. While we propose to validate previously identified miRNAs that have been identified as associated with CRC (either by differential expression or from assessment of mutations), we will add to the field through discovery of new and important associations that may be unique to specific molecular phenotypes, to polyp to cancer progression, and to survival. We will analyze the expression of 866 human miRNAs using data derived from tumor and paired normal tissue at time of diagnosis from: 1660 people with incident colon cancer; 840 people with incident rectal cancer; and 350 polyps from our colon and rectal cases who reported a prior polyp; 5% of tumors, will be analyzed for quality control. Our total assessment will be on 5475 samples. We will extend the validation of previously identified mutated miRNAs and differentially expressed miRNAs to determine if these alterations are associated with specific tumor molecular phenotype, inflammation-related factors, clinical factors and survival. Important miRNAs will be validated using TaqMan-based assays. Associations will be tested based on differential expression for both individual and groups of miRNAs using recent extensions of several statistical methods including ANOVA, logistic regression, and Cox proportional hazards models. Our sample size allows for both a training and validation component, and provides sufficient statistical power to meet the study goals. MiRNAs that are differentially expressed in polyps and in subsequent tumors will provide new insights into targets for screening and treatment and differential miRNAs that function as the ""driver"" vs. the ""passenger"" in the carcinogenic process. Testing of mutated miRNAs identified from sequencing in conjunction with tumor phenotype, clinical, and survival data will further validate the importance of these miRNAs, and provide insight as to which CRC molecular pathway the miRNAs function. Our rich dataset of lifestyle, genetic, clinical and prognosis, and tumor molecular phenotype on 2500 CRC and paired normal tissue allows us to examine factors that are associated with miRNAs in a large set of population-based cases. The miRNAs identified in these analyses will elucidate pathways important in the etiology of CRC and will provide insight into potential targets for screening and treatment. Our rich dataset of lifestyle, genetic, clinical and prognosis, and tumor molecular phenotype on 2500 CRC (colorectal cancer) and paired normal tissue allows us to examine factors that are associated with miRNA expression and mutation in a large sample of population-based cases. Having data available on polyps from those cases who developed cancer, will help us determine ""drivers"" vs. ""passengers"" in the carcinogenic process. The miRNAs identified in these analyses will elucidate pathways important in the etiology of CRC and will provide insight into potential targets for screening and treatment.",miRNA and colorectal cancer: associations with tumor phenotype and survival,9284425,R01CA163683,"['Address', 'Analysis of Variance', 'Aspirin', 'Biological Assay', 'Clinical', 'Colon', 'Colon Carcinoma', 'Colonic Neoplasms', 'Colonic Polyps', 'Colorectal Cancer', 'Cox Proportional Hazards Models', 'Data', 'Data Set', 'Diagnosis', 'Disease', 'Etiology', 'Family', 'Genes', 'Genetic', 'Genetic Transcription', 'Genetic Variation', 'Goals', 'Human', 'IL6 gene', 'IL8 gene', 'Individual', 'Inflammation', 'KRAS2 gene', 'Lead', 'Life Style', 'Link', 'Logistic Regressions', 'Malignant Neoplasms', 'Mediating', 'Messenger RNA', 'MicroRNAs', 'Molecular', 'Mutate', 'Mutation', 'Normal tissue morphology', 'Obesity', 'PTEN gene', 'Pathway interactions', 'Phenotype', 'Polyps', 'Population', 'Prevention Research', 'Process', 'Quality Control', 'Rectal Cancer', 'Rectal Neoplasms', 'Rectal Polyp', 'Reporting', 'Sample Size', 'Sampling', 'Signal Pathway', 'Signaling Protein', 'Statistical Methods', 'TNF gene', 'TP53 gene', 'Testing', 'Time', 'Tissues', 'Training', 'Tumor-Derived', 'Validation', 'base', 'cancer prevention', 'cancer risk', 'carcinogenicity', 'deep sequencing', 'differential expression', 'follow-up', 'genetic variant', 'insight', 'lifestyle factors', 'molecular phenotype', 'outcome forecast', 'population based', 'rectal', 'screening', 'survival prediction', 'tumor', 'tumor progression']",NCI,UNIVERSITY OF UTAH,R01,2017,1124223,0.09610752936043986
