text,title,id,project_number,terms,administration,organization,mechanism,year,funding,score
"Factors Associated with Mailed Return of Self-Sampling for Human Papillomavirus (HPV) Testing Project Summary/Abstract Cervical cancer disproportionately affects women who are low-income and never/underscreened (never screened or under screened) especially in Indiana, where cervical cancer incidence and mortality are higher than the US national average, and screening is lower than the US national average. Women who are low- income have structural and intrapersonal barriers to screening that may prevent them from obtaining provider- based screening. Although HPV testing is now accepted by USPTF guidelines, it is only endorsed for provider- collected sampling. Self-sampling for HPV testing, a method for women to collect their own cervico-vaginal sample, has been established as a feasible and acceptable alternative to provider-based cervical cancer screening in other countries and is supported by US pilot studies. HPV self-sampling is likely to be implemented as a screening option in the US in the future due to its comparable sensitivity to provider- collected HPV samples, acceptability, and potential to reach populations who are never/underscreeners. Self- sampling may overcome barriers to provider-based cervical cancer screening experienced by women who are low-income and never/underscreened and provide a convenient way to access screening. Studies testing mailed HPV kits, however, have demonstrated that 30-50% of women do not return a mailed HPV kit. Prior to widespread implementation, research is needed to identify characteristics of returners and non-returners of mailed HPV self-sampling kits. The purpose of this descriptive study is to identify factors associated with mailed return of HPV self-sampling kits using concepts from the Diffusion of Innovations Theory (advantages, compatibility, complexity, and self-efficacy) while controlling for sociodemographic, healthcare, and health behavior variables in a group of low-income and never/underscreened women. Data for this cross-sectional study will be collected at time of study consent from women (n=200) at a food pantry and nonadherent to cervical cancer screening using valid and reliable instruments. Self-sampling kits will be mailed to the women’s home within one week of consent, and women will have 4 weeks to return the kit to be considered “returners”. Logistic regression analyses will be used to analyze the relationship between the data collected at baseline consent (attributes of innovation-advantages, compatibility, complexity, and self- efficacy) and return of the self-sampling kit via mail (y/n). The results of this study will provide knowledge about factors associated with return of self-sampling kits to better understand the characteristics of returners and non-returners. Results of this project will help guide implementation of HPV self-sampling in populations who are low-income and never/underscreened whom self- sampling may most likely benefit. This study will provide a foundation for the applicant’s long-term goal of reducing morbidity and mortality from cervical cancer through increasing cervical cancer screening rates with an innovative technology, self-sampling for HPV testing. Project Narrative Women who are low-income and never/underscreeners are unequally burdened by cervical cancer. This study will be one of the first to identify factors associated with mailed return of a cervical cancer screening tool, self- sampling for HPV self-testing, that will provide an alternative to traditional cervical screening by removing barriers for women most at risk for cervical cancer (women who are low-income and never/underscreeners).",Factors Associated with Mailed Return of Self-Sampling for Human Papillomavirus (HPV) Testing,10025580,F31NR018791,"['Advisory Committees', 'Affect', 'Age', 'Appointment', 'Atopobium vaginae', 'Behavior', 'Belief', 'Cervical', 'Cervical Cancer Screening', 'Characteristics', 'Clinic', 'Clinical', 'Consent', 'Country', 'Cross-Sectional Studies', 'Cytology', 'Data', 'Diffusion of Innovation', 'Failure', 'Food', 'Foundations', 'Fright', 'Future', 'Goals', 'Guidelines', 'Health behavior', 'Health system', 'Healthcare', 'Home environment', 'Human Papillomavirus', 'Incidence', 'Income', 'Indiana', 'Knowledge', 'Literature', 'Logistic Regressions', 'Low income', 'Malignant neoplasm of cervix uteri', 'Methods', 'Morbidity - disease rate', 'Netherlands', 'Nurses', 'Pain', 'Pap smear', 'Participant', 'Patients', 'Persons', 'Physicians', 'Pilot Projects', 'Population', 'Poverty', 'Preventive', 'Privacy', 'Privatization', 'Provider', 'Regression Analysis', 'Research', 'Risk', 'Sampling', 'Screening procedure', 'Self Efficacy', 'Socioeconomic Status', 'Structure', 'Testing', 'Time Study', 'United States', 'Ursidae Family', 'Woman', 'base', 'cervicovaginal', 'cost effective', 'experience', 'health belief', 'implementation research', 'improved', 'innovation', 'innovative technologies', 'instrument', 'medically underserved', 'mortality', 'prevent', 'screening', 'screening guidelines', 'sociodemographics', 'success', 'theories', 'therapy development']",NINR,INDIANA UNIV-PURDUE UNIV AT INDIANAPOLIS,F31,2020,32590,0.054876993744607375
"Predictive modeling of peripartum depression ABSTRACT Psychiatric problems surrounding parturition affect both the mother’s health and her child’s developmental trajectory. Peripartum depression (PPD), referring to a depressive episode occurring during pregnancy or after childbirth, is both common and morbid. PPD has been implicated in various short and long term adverse outcomes, including preterm delivery and heightened risk for mental illness in the adult offspring. In extreme cases, PPD can lead to maternal suicide and/or infanticide. Although an estimated 760,000 American women (and children) suffer from PPD each year and screening for PPD has been recommended by the USPTF, no accurate screening tool is available to adequately identify women at risk of PPD. This novel study will capitalize on the rich clinical, demographic, and laboratory information in patients’ electronic medical reports (EMRs) to improve screening for PPD. We propose to implement advanced machine learning methods to build a model to optimize identification of women at risk for PPD. We we will adopt a psycho-social- biological approach of mental illness to prospectively explore the combined effect of various disease-related factors in improving the accuracy of PPD prediction. Our dataset will make use of a sample of 20,000 women who have been followed during their obstetrical care in two leading academic hospitals in Boston. We will gather information concerning socioeconomic factors, relevant obstetric factors, and mental and physical conditions in pregnancy and disease history, as derived from laboratory test results and the patient’s report. We expect our findings to advance scientific knowledge of women at risk for PPD. Our work may lead to the development of a screening protocol that is low-cost and easily performed by health providers in clinical settings. Early identification of women at risk could potentially allow targeted interventions to reduce the prevalence and morbidity of PPD in the US. This in turn could reduce treatment costs, avoid a potentially preventable disease, and improve the quality of care and health outcomes of mothers and their children. Our study accords with the NICD high priority area of research aimed at improving the health of women during and after pregnancy and improving pregnancy outcomes. The proposed project will further the NICHD mission that women suffer no harmful effects from reproductive processes, and that children achieve healthy and productive lives. PROJECT NARRATIVE Peripartum depression (PDD) referring to the occurrence of depressive episode during pregnancy or following childbirth is a common and serious illness. While the US Preventive Services Task Force recommends universal screening for PPD, there is no accurate tool to predict women who would be at risk of suffering from PPD. The goal of this study is to test a machine learning predictive model of PPD using information in patients’ medical records to decrease PPD’s prevalence and ultimately prevent it.",Predictive modeling of peripartum depression,9958240,R03HD101724,"['Adopted', 'Adult Children', 'Advisory Committees', 'Affect', 'American', 'Anxiety', 'Area', 'Biological', 'Birth', 'Boston', 'Caring', 'Child', 'Child Development', 'Child Health', 'Childbirth', 'Classification', 'Clinical', 'Clinical Research', 'Complex', 'Computerized Medical Record', 'Data', 'Data Set', 'Development', 'Diagnostic', 'Discipline of obstetrics', 'Disease', 'Early identification', 'Educational Intervention', 'Eligibility Determination', 'Etiology', 'Feeling suicidal', 'Future', 'Goals', 'Health', 'Health Personnel', 'Hospitals', 'Infanticide', 'Intervention', 'Knowledge', 'Laboratories', 'Lead', 'Learning', 'Low income', 'Machine Learning', 'Medical', 'Mental Health', 'Mental disorders', 'Methods', 'Mission', 'Modeling', 'Morbidity - disease rate', 'Mothers', 'National Institute of Child Health and Human Development', 'Newborn Infant', 'Outcome', 'Patients', 'Perinatal', 'Postpartum Period', 'Pregnancy', 'Pregnancy Outcome', 'Premature Birth', 'Prevalence', 'Preventive Intervention', 'Preventive service', 'Primigravidities', 'Psyche structure', 'Quality of Care', 'Recording of previous events', 'Reporting', 'Reproductive Process', 'Research', 'Research Project Grants', 'Risk', 'Risk Factors', 'Sampling', 'Scientific Advances and Accomplishments', 'Screening procedure', 'Socioeconomic Factors', 'Suicide', 'Test Result', 'Testing', 'Third Pregnancy Trimester', 'Time', 'Training', 'Traumatic Stress Disorders', 'Treatment Cost', 'Woman', 'Women&apos', 's Health', 'Work', 'adverse outcome', 'antenatal', 'antepartum depression', 'base', 'cost', 'depressive symptoms', 'health of the mother', 'holistic approach', 'improved', 'insight', 'machine learning method', 'novel', 'obstetric care', 'patient health information', 'peripartum depression', 'physical conditioning', 'predictive modeling', 'predictive test', 'predictive tools', 'prevent', 'primipara', 'prospective', 'psychosocial', 'screening', 'sociodemographic factors', 'tool']",NICHD,MASSACHUSETTS GENERAL HOSPITAL,R03,2020,84000,0.08428996879963242
"Obesity Prevention in Postpartum Women at High-Risk of Cardiovascular Disease PROJECT SUMMARY  Obesity is a significant risk factor for cardiovascular (CV) disease that affects 39% of adults in the U.S. Obesity rates are disproportionately rising among women and contribute to increasing rates of diabetes and CV mortality among women younger than 55 years. Pregnancy represents a life transition when many women gain excess weight. The effect of obesity is further magnified in women with preeclampsia, an independent and underappreciated risk factor for future CV disease. There is a pressing need to better understand predictors of excessive postpartum weight retention in order to deliver effective and scalable weight loss interventions during a period when women at highest risk may be particularly receptive to lifestyle change.  Social incentives, or the influences that impact behavior change based on relationships, are strong motivators of healthy behavior. The use of game design elements, such as goal-setting, has been successfully combined with social incentives to enhance healthy behavior in other disease settings. The central hypothesis of this proposal is that a behavioral intervention using these novel approaches, combined with an established behavioral weight loss program, will provide an effective, and scalable solution to reduce the incidence of postpartum obesity. This proposal will leverage mentorship of senior investigators (Drs. Michal Elovitz and Peter Groeneveld) and Penn’s mature research programs in cardiovascular medicine, maternal fetal medicine, and behavioral economics. Research will be conducted in an urban and racially diverse population since these women are most likely to benefit from interventions to reduce CV risk. Aim 1 will use robust statistical methods and machine learning to create a clinical prediction tool for postpartum weight retention in an existing electronic health record database enriched with neighborhood-level data. Aim 2 will use qualitative and mixed methods to identify strategies to enhance the design of a pilot intervention using patient feedback. Aim 3 will implement a 2-arm single site randomized clinical trial to achieve weight loss in women with preeclampsia or gestational hypertension participating in an online behavioral weight loss program using remote technology and social feedback from other postpartum women.  This proposal will identify women at an early stage in life who will benefit the most from intensive lifestyle changes and will test and refine interventions that are able to be disseminated to postpartum women remotely. Dr. Lewey is a general cardiologist trained in women’s health and population science with established expertise in pregnancy associated cardiovascular disorders. The training she proposes in advanced statistical methods, qualitative analysis, and behavioral clinical trial design will position her to become a leader in women’s cardiovascular health. By the conclusion of this program, she will be able to independently design, target, and evaluate behavioral interventions to prevent heart disease in women. The results of the proposed K23 will be invaluable pilot work for a planned R01-level application. PROJECT NARRATIVE The postpartum period represents a unique time in a women’s life when many women gain excess weight and make the transition to becoming overweight or obese. We propose to rigorously study predictors of postpartum obesity and evaluate an innovative approach to improve weight loss in the postpartum period using an online behavioral weight loss program and social feedback from a team of other postpartum women. By identifying women at an early stage in life who will benefit the most from intensive lifestyle changes and testing interventions that are low cost, sustainable, and remotely delivered, we hope to significantly improve cardiovascular health and reduce the burden of cardiovascular disease in women, which is a central mission of the National Heart, Lung, and Blood Institute (NHLBI).",Obesity Prevention in Postpartum Women at High-Risk of Cardiovascular Disease,10040416,K23HL153667,"['Accountability', 'Address', 'Adult', 'Affect', 'Award', 'Behavior', 'Behavior Therapy', 'Behavioral', 'Body Weight decreased', 'Cardiovascular Diseases', 'Cardiovascular system', 'Censuses', 'Clinical', 'Clinical Trials Design', 'Data', 'Databases', 'Diabetes Mellitus', 'Diagnosis', 'Disease', 'Electronic Health Record', 'Elements', 'Face', 'Feedback', 'Future', 'Goals', 'Health Sciences', 'Health behavior', 'Heart Diseases', 'High Risk Woman', 'Hypertension', 'Incentives', 'Incidence', 'Individual', 'Infrastructure', 'Institution', 'Intervention', 'Knowledge', 'Lead', 'Life', 'Life Style', 'Link', 'Machine Learning', 'Maternal-fetal medicine', 'Medicine', 'Mentors', 'Mentorship', 'Methods', 'Mission', 'Modeling', 'Mothers', 'National Heart, Lung, and Blood Institute', 'Nature', 'Neighborhoods', 'Obesity', 'Outcome', 'Overweight', 'Patients', 'Pennsylvania', 'Perinatal', 'Persons', 'Physical activity', 'Physical environment', 'Population Heterogeneity', 'Population Sciences', 'Positioning Attribute', 'Postpartum Period', 'Postpartum Women', 'Pre-Eclampsia', 'Pregnancy', 'Qualitative Methods', 'Randomized Clinical Trials', 'Research', 'Research Personnel', 'Rewards', 'Risk Factors', 'Site', 'Social Characteristics', 'Social Environment', 'Statistical Methods', 'Techniques', 'Technology', 'Testing', 'Time', 'Training', 'Universities', 'Vulnerable Populations', 'Weight', 'Weight Gain', 'Woman', 'Women&apos', 's Health', 'Work', 'arm', 'base', 'behavior change', 'behavioral clinical trial', 'behavioral economics', 'cardiovascular disorder risk', 'cardiovascular health', 'cardiovascular risk factor', 'career', 'career development', 'cohort', 'cost', 'design', 'gestational weight gain', 'health care service utilization', 'healthy lifestyle', 'high risk', 'improved', 'innovation', 'mortality', 'neighborhood disadvantage', 'novel strategies', 'obesity prevention', 'patient oriented', 'peer support', 'postpartum weight', 'prediction algorithm', 'predictive modeling', 'predictive tools', 'pregnancy disorder', 'pregnancy hypertension', 'prevent', 'programs', 'racial diversity', 'recruit', 'secondary outcome', 'skills', 'social', 'tool', 'weight loss intervention', 'weight loss program']",NHLBI,UNIVERSITY OF PENNSYLVANIA,K23,2020,175248,0.11988065046923657
"Development of a biomarker panel for minimally-invasive screening and diagnosis of gynecological disease PROJECT SUMMARY One-third of all women of reproductive age will experience nonmenstrual pelvic pain at some point in their lives and one-third of outpatient visits to gynecologists in the U.S. are for evaluation of abnormal uterine bleeding. For many women, these symptoms accompany infertility which is reported in ~10% of all US women and even higher percentages worldwide. For almost all of these women, these conditions result in a diagnostic odyssey wherein women struggle through multiple physicians over many years for a definitive diagnosis, frequently culminating in invasive laparoscopy or hysteroscopy with dilation and curettage (D&C) for definitive diagnosis. To reduce the burden of diagnosis and enable early treatment, MDDx, Inc. is developing the first biomarker- based diagnostic test to enable minimally invasive simultaneous diagnosis of four of the most common causes which together result in chronic pain, uterine bleeding and infertility: adenomyosis, endometrial polyps, leiomyoma, and endometriosis. MDDx, Inc. has been leveraging access to >12 years of longitudinally collected and deeply annotated biobanked uterine lavage samples from the Gynecologic Cancer Translational Research Program (Icahn School of Medicine at Mount Sinai; New York, NY and Nuvance Health; Danbury, CT) to identify diagnostic autoantibodies (AAb) that could serve as diagnostic biomarkers for these benign gynecological diseases. By performing AAb profiling against the entire human proteome and applying our novel machine-learning based method for classification of molecular profiles we have determined that there is a common set of ~200 biomarkers that could be used to diagnose women with adenomyosis, endometrial polyps, leiomyoma, or endometriosis. The goal of Phase I is to finalize and validate the optimized set of ~200 diagnostic AAbs, while Phase II will focus on validation of the commercial diagnostic assay. In Aim 1 we will expand our proprietary database of uterine lavage autoantibody profiles to ensure that we have a sample size (~935) that will enable us to confidently apply our machine learning approaches to identifying the minimal panel of AAbs for the diagnostic. We will use this enhanced database to identify a prototype panel of ~200 AAbs for construction of classification scoring functions to distinguish between adenomyosis, endometrial polyps, leiomyoma, and endometriosis. In Aim 2 we will perform a blinded validation and performance study using an independent set of 300 uterine lavage samples to provide proof-of- concept for clinically useful sensitivity and specificity prior to large scale prospective validation in Phase II. Successful completion of this Phase I program will identify the optimized panel of AAbs for an affordable, laboratory-based diagnostic test that will significantly reduce the number of women who will need to undergo laparoscopy or hysteroscopy with D&C for definitive diagnosis, enabling early treatment of disease and reducing the significant psychological and financial burden of diagnoses that otherwise can take years. PROJECTIVE NARRATIVE Nearly half of all women of reproductive age will experience some combination of nonmenstrual pelvic pain, abnormal uterine bleeding, and infertility in their lifetimes, yet there are no non-invasive methods to definitively diagnose the primary causes of these symptoms. MDDx, Inc. is developing the first laboratory diagnostic test to enable minimally invasive simultaneous diagnosis of four common causes of these often debilitating symptoms and infertility: adenomyosis, endometrial polyps, leiomyoma, and endometriosis. This test will enable early detection, early treatment, and reduce the physical, emotional, and financial burden of obtaining a diagnosis for women suffering from these common yet disruptive symptoms.",Development of a biomarker panel for minimally-invasive screening and diagnosis of gynecological disease,10146682,R41HD104402,"['Address', 'Age', 'Algorithms', 'Anesthesia procedures', 'Antigens', 'Area', 'Atypical Endometrial Hyperplasias', 'Autoantibodies', 'Benign', 'Biological Markers', 'Blinded', 'Categories', 'Classification', 'Clinical', 'Complex', 'Data', 'Data Set', 'Databases', 'Development', 'Diagnosis', 'Diagnostic', 'Diagnostic Procedure', 'Diagnostic tests', 'Dilatation and Curettage', 'Disease', 'Early Diagnosis', 'Early treatment', 'Emotional', 'Endometrial Carcinoma', 'Ensure', 'Entropy', 'Evaluation', 'Female Genital Diseases', 'Financial Hardship', 'General Anesthesia', 'Goals', 'Gynecologist', 'Health', 'Healthcare Systems', 'Hemorrhage', 'Human', 'Hysteroscopy', 'Image', 'Infertility', 'Irrigation', 'Laboratories', 'Laparoscopy', 'Leiomyoma', 'Liquid substance', 'Machine Learning', 'Malignant Female Reproductive System Neoplasm', 'Malignant neoplasm of ovary', 'Methods', 'Molecular', 'Molecular Profiling', 'New York', 'Operating Rooms', 'Outpatients', 'Pain', 'Patients', 'Pelvic Pain', 'Performance', 'Phase', 'Physicians', 'Polyps', 'Population Control', 'Positioning Attribute', 'Preneoplastic Conditions', 'Probability', 'Procedures', 'Process', 'Proteins', 'Proteome', 'Recording of previous events', 'Reporting', 'Risk', 'Sample Size', 'Sampling', 'Sensitivity and Specificity', 'Specificity', 'Structure', 'Surgeon', 'Symptoms', 'System', 'Test Result', 'Testing', 'Time', 'Training', 'Triage', 'United States', 'Uterine Polyp', 'Uterine hemorrhage', 'Uterus', 'Validation', 'Visit', 'Woman', 'Work', 'base', 'biobank', 'biomarker panel', 'chronic pain', 'clinically relevant', 'cost', 'diagnostic assay', 'diagnostic biomarker', 'diagnostic panel', 'disabling symptom', 'disease diagnosis', 'endometriosis', 'experience', 'improved', 'large datasets', 'medical schools', 'minimally invasive', 'novel', 'phase 1 study', 'programs', 'prospective', 'prototype', 'psychologic', 'reproductive', 'screening', 'translational research program', 'uterus endometriosis']",NICHD,"MDDX, INC.",R41,2020,299998,0.006255215872766739
