text,title,id,project_number,terms,administration,organization,mechanism,year,funding,score
"Reducing disparities in colorectal cancer screening in Vietnamese Americans DESCRIPTION (provided by applicant): Colorectal cancer (CRC) screening rates in Vietnamese Americans are lower than those in non-Hispanic whites. Consistent with our long-term goal of reducing morbidity and mortality caused by colorectal cancer, we propose to disseminate an evidence-based lay health worker (LHW) intervention supported by a media campaign (Media) to increase CRC screening in this poor and medically underserved population. We will use the Pathways Framework, Community-Based Participatory Research process, and Diffusion of Innovations Theory to guide our approach to the intervention, community participation, and dissemination. The specific aims of this study are to: 1) evaluate the effectiveness of a CRC LHW + Media intervention in increasing CRC screening among Vietnamese Americans aged 50 to 74 who have never had a CRC screening test, 2) identify predictors of CRC screening, and 3) evaluate the process of community participation. Following formative research using a cognitive testing approach to develop culturally and linguistically appropriate health education materials and survey instruments, we will conduct a cluster randomized trial among Vietnamese Americans aged 50-74 in Santa Clara County California, who have never had a CRC screening test prior to recruitment. We will follow two longitudinal cohorts among whom we will conduct a pre-intervention survey of participants' knowledge, intention, and behavior as regards CRC screening; implement CRC screening educational sessions in an experimental group and nutrition educational sessions in a comparison group; and conduct a post-intervention survey. Each of the two cohorts will include 150 men and 150 women to have a total sample size of 600. The media intervention component will distribute Vietnamese-language health education materials through print and electronic media. We will evaluate the effectiveness of the intervention by comparing the frequency of screening using pre- and post-intervention surveys. To test our primary hypothesis regarding the effects of the intervention on screening activity, we will use Z-tests. We will also employ logistic regression models to test the effects of the intervention and to identify predictors for CRC screening. In addition, we will conduct process evaluation of the intervention and community participation. If this intervention is found to be effective, this LHW model could be applied in health promotion programs to further reduce disparities in CRC screening in Vietnamese Americans and evaluated in other behavioral objectives and settings to reduce health disparities in other poor and underserved populations. PUBLIC HEALTH RELEVANCE: Colorectal cancer (CRC) screening rates in Vietnamese Americans are lower than those in non-Hispanic whites. Relative to non-Hispanic whites, Vietnamese Americans are both poorer and less well medically served and have special language and cultural issues related to cancer screening that cannot be addressed though interventions aimed at the general population. Consistent with our long-term goal of reducing morbidity and mortality caused by colorectal cancer, we propose to disseminate an evidence-based lay health worker (LHW) intervention supported by a media campaign (Media) to increase CRC screening in this poor and medically underserved population. If this intervention is found to be effective, it could be applied in other health promotion programs throughout the United States to further reduce disparities in CRC screening in Vietnamese Americans. In addition, this LHW model could be evaluated in other populations, such as other racial and ethnic, poor, or immigrant communities; in other behavioral objectives, such as other forms of cancer, cardiovascular health, or tobacco, diabetes and obesity control; and in other settings, such as community health clinics and hospitals. Public Health Relevance: Colorectal cancer (CRC) screening rates in Vietnamese Americans are lower than those in non-Hispanic whites. Relative to non-Hispanic whites, Vietnamese Americans are both poorer and less well medically served and have special language and cultural issues related to cancer screening that cannot be addressed though interventions aimed at the general population. Consistent with our long-term goal of reducing morbidity and mortality caused by colorectal cancer, we propose to disseminate an evidence-based lay health worker (LHW) intervention supported by a media campaign (Media) to increase CRC screening in this poor and medically underserved population. If this intervention is found to be effective, it could be applied in other health promotion programs throughout the United States to further reduce disparities in CRC screening in Vietnamese Americans. In addition, this LHW model could be evaluated in other populations, such as other racial and ethnic, poor, or immigrant communities; in other behavioral objectives, such as other forms of cancer, cardiovascular health, or tobacco, diabetes and obesity control; and in other settings, such as community health clinics and hospitals. n/a",Reducing disparities in colorectal cancer screening in Vietnamese Americans,7585754,R01CA132660,"['Address', 'Adopted', 'Age', 'American', 'Behavior', 'Behavioral', 'Birds', 'Breast', 'California', 'Cardiovascular system', 'Cervical Cancer Screening', 'Clinics and Hospitals', 'Cognitive', 'Colonoscopy', 'Colorectal Cancer', 'Communities', 'Community Health', 'Community Participation', 'County', 'Diabetes Mellitus', 'Diffusion of Innovation', 'Early Diagnosis', 'Effectiveness', 'Effectiveness of Interventions', 'Electronics', 'Evaluation', 'Familiarity', 'Fecal occult blood', 'Female', 'Frequencies', 'Gender', 'General Population', 'Goals', 'Health', 'Health Promotion', 'Health education', 'Hearing', 'Immigrant', 'Intention', 'Intervention', 'Israel', 'Knowledge', 'Language', 'Logistic Regressions', 'Malignant Neoplasms', 'Media Campaign', 'Media Intervention', 'Mediator of activation protein', 'Modeling', 'Morbidity - disease rate', 'Not Hispanic or Latino', 'Obesity', 'Participant', 'Pathway interactions', 'Phase', 'Population', 'Printing', 'Process', 'Randomized Controlled Clinical Trials', 'Relative (related person)', 'Reporting', 'Research', 'Sample Size', 'Screening for cancer', 'Screening procedure', 'Sigmoidoscopy', 'Source', 'Surveys', 'Testing', 'Tobacco', 'Translating', 'Underserved Population', 'United States', 'Woman', 'aged', 'base', 'cohort', 'colorectal cancer screening', 'community based participatory research', 'community intervention', 'community organizations', 'comparison group', 'evidence base', 'health disparity', 'improved', 'innovation', 'insight', 'intervention effect', 'male', 'medically underserved', 'medically underserved population', 'men', 'mortality', 'nutrition', 'post intervention', 'programs', 'public health relevance', 'racial and ethnic', 'theories']",NCI,CANCER PREVENTION INSTIT OF CALIFORNIA,R01,2009,584019,0.21898728904493417
"Genetic Association Study in African-American Colorectal Cancer Patients    DESCRIPTION (provided by applicant): Colorectal cancer (CRC) is a significant cause of cancer morbidity and mortality in the US. Determining who is at higher risk is especially important in CRC because screening tests are available that are proven to reduce death. Risk of CRC development is due to both hereditary and environmental factors which are not uniformly shared between all populations. To date, the field of CRC genetics has focused largely on Caucasian populations, while few studies have included African-American (AA) patients. Determining risk factors in AAs is an especially important goal because both incidence and mortality in this population are not decreasing as they are in all other US populations. At the University of Chicago, we are uniquely equipped to address genetic factors in AAs because we have assembled a large AA CRC case-control series. The main purpose of this study is to identify CRC-susceptibility alleles using a candidate gene screen approach and test for association in AA CRC patients and controls. CRC is particularly amenable to candidate gene studies because biologically relevant pathways have been identified in hereditary CRC syndromes and in the analysis of carcinogenesis in the adenoma to carcinoma sequence. The base excision repair pathway is especially interesting because recent work has elucidated a recessive polyposis syndrome associated with mutations in the gene MYH. Thus, genes involved in this pathway are biologically plausible candidates for harboring CRC-susceptibility alleles, but they have not been adequately identified or characterized in AAs to date. Our hypothesis is that novel susceptibility alleles in base-excision repair genes contribute to risk of CRC development in African-Americans. To test this hypothesis, we will screen candidate base-excision repair genes using high throughput heteroduplex analysis and use sequencing to characterize DNA changes (Specific Aim 1). To control for population stratification in our admixed AA population, we will determine individual ancestry estimates using a set of high informative ancestry informative markers (Specific Aim 2). Finally, we will genotype our putative CRC-susceptibility alleles identified in our candidate gene screens in a series of 400 AA CRC cases and 400 controls and then test for association by logistic regression (Specific Aim 3). With improved understanding of individual risk and proper screening, colorectal cancer is largely a preventable disease. The goal of our study is to better understand hereditary factors that increase risk especially in African-Americans who have the highest incidence and death from this cancer.           n/a",Genetic Association Study in African-American Colorectal Cancer Patients,7531036,F32CA132493,"['Address', 'African American', 'Alleles', 'Base Excision Repairs', 'Cancer Etiology', 'Cancer Patient', 'Candidate Disease Gene', 'Carcinoma', 'Caucasians', 'Caucasoid Race', 'Cessation of life', 'Chicago', 'Colorectal Cancer', 'DNA', 'Development', 'Disease', 'Environmental Risk Factor', 'Genes', 'Genetic', 'Genotype', 'Goals', 'Heteroduplex Analysis', 'Incidence', 'Individual', 'Inherited', 'Logistic Regressions', 'Malignant Neoplasms', 'Morbidity - disease rate', 'Mutation', 'Pathway interactions', 'Patients', 'Population', 'Population Control', 'Predisposition', 'Purpose', 'Risk', 'Risk Factors', 'Screening procedure', 'Series', 'Stratification', 'Syndrome', 'Testing', 'Universities', 'Work', 'adenoma', 'cancer genetics', 'carcinogenesis', 'case control', 'colorectal cancer screening', 'gene repair', 'genetic association', 'improved', 'interest', 'mortality', 'novel', 'polyposis']",NCI,UNIVERSITY OF CHICAGO,F32,2008,12818,0.17801751164779436
"Identifying Receipt of Colorectal Cancer Screening    DESCRIPTION (provided by applicant): Colorectal cancer (CRC) is the second leading cause of cancer death in the United States. Regular screening for CRC leads to early detection and a substantial reduction in CRC-related morbidity and mortality. Despite this evidence, adherence to CRC screening recommendations remains poor. Given the benefits of screening for CRC, interventions need to be developed that will ultimately increase its utilization. These interventions must be targeted towards individuals who have never been screened or are not current with their screening, and must take into account risk factors [e.g., family history, inflammatory bowel disease, history of previous adenomas]. A significant barrier to applying CRC screening interventions is the ability to accurately and quickly identify patients in need of screening. In our proposed project, we will create and evaluate an innovative electronic data collection system to enhance our understanding of the delivery and utilization of CRC screening. We will use as a test site the primary care clinics affiliated with Vanderbilt University Medical Center, but the approach developed will be general enough to work wherever adequate electronic records are available. This data collection system will build upon our prior work using the Knowledge Map Concept Identifier (KMCI), which was originally developed to extract biomedical concepts represented in the medical school curriculum at Vanderbilt University School of Medicine. We will build a tool using KMCI as its core to detect receipt of CRC screening and to provide its context (e.g., individual risk factors, which CRC test was performed, when, and the results). Utilizing information from the electronic records and billing (claims) records, this system will allow for rapid and accurate identification of which patients have and have not received CRC screening tests, and for identification of those patients that require follow-up after their screening tests. We will determine the test characteristics of KMCI (sensitivity, specificity) for identifying receipt of CRC screening, and compare this to an automated review of billing records. We hypothesize that KMCI will perform better than an automated review of billing records in detecting receipt of CRC screening, and will provide richer, contextual information regarding the screening tests.           n/a",Identifying Receipt of Colorectal Cancer Screening,7340158,R21CA116573,"['Academic Medical Centers', 'Accounting', 'Adherence', 'Cancer Etiology', 'Cancer Intervention', 'Cessation of life', 'Characteristics', 'Clinic', 'Clinical', 'Colorectal Cancer', 'Complex', 'Computerized Medical Record', 'Data', 'Data Collection', 'Early Diagnosis', 'Educational Curriculum', 'Electronics', 'Family history of', 'Gold', 'Guidelines', 'Health system', 'Individual', 'Inflammatory Bowel Diseases', 'Intervention', 'Knowledge', 'Maps', 'Measures', 'Monitor', 'Morbidity - disease rate', 'Natural Language Processing', 'Patients', 'Physicians', 'Polyps', 'Primary Health Care', 'Process', 'Rate', 'Recommendation', 'Recording of previous events', 'Records', 'Risk Factors', 'Screening Result', 'Screening procedure', 'Sensitivity and Specificity', 'Site', 'Specificity', 'Standards of Weights and Measures', 'Symptoms', 'System', 'Testing', 'United States', 'Universities', 'Word Processing', 'Work', 'adenoma', 'billing data', 'cancer risk', 'colorectal cancer screening', 'concept', 'follow-up', 'improved', 'innovation', 'medical schools', 'mortality', 'novel', 'tool', 'trend']",NCI,VANDERBILT UNIVERSITY,R21,2008,121564,0.223047678226812
"Reliable Performance of Cancer Screening using a Computer-based Monitoring System    DESCRIPTION (provided by applicant): Despite their potential to reduce cancer burden through early detection, the effectiveness of screening programs is often undermined by systems-based factors and human factors. The broad aims of this application are to develop and evaluate a computer-based technology called TRACS to monitor the process of cancer screening in individual patients and intervene as necessary to ensure that the screening is conducted reliably and effectively. Interventions in TRACS consist of reliable notifications to clinicians and/or patients. However, unlike many other reminder systems, TRACS continues to monitor the care of the patient subsequent to the notification.       In this phase of the application, TRACS will be used to address the reliability of follow up of abnormal or equivocal results from screening mammography for breast cancer. A knowledge module will be created in TRACS knowledge base for the monitoring of the follow up of abnormal screening mammograms. A knowledge module comprises the process definition that specifies the appropriate course of actions for a clinical scenario and logical rules for making decisions within the process. In the next phase, additional knowledge modules will be included for comprehensive support for screening of breast cancer, cervical cancer, and colon cancer.       An important feature of TRACS will be the ability to extract information from clinical text documents using a natural language processing engine called HITex. Reports of several cancer screening tests, such as mammography, cervical smear, and colonoscopy, are in the form of text documents. Thus it is important to be able to extract relevant information from these documents for use by TRACS. HITex will be customized to extract the recommendations of the radiologist from screening mammogram reports. Specifically, it will extract whether the radiologist recommends a non-routine follow up. If that is the case, HITex will extract the recommended follow up (e.g., diagnostic mammogram, ultrasound, or needle biopsy).       TRACS will be deployed and evaluated at the New England Medical Center (NEMC), a large urban medical center in Boston. The first step in the evaluation will be to confirm that information from screening mammogram reports from NEMC can be extracted accurately by HITex. During this phase, the TRACS software and the abnormal mammography follow up knowledge module will be tested in a simulated setting at NEMC. The tests will be conducted using records of patients who had previously undergone screening mammography at NEMC. The behavior of TRACS for these cases will be rated by a panel of experts from NEMC. In the next phase, TRACS will be deployed operationally at NEMC. Project Narrative The software proposed to being developed under this project aims to improve the early identification of a number of commonly occurring cancers. It will do so by following up reliably on the management of those patients that have abnormal results in cancer screening tests.          n/a",Reliable Performance of Cancer Screening using a Computer-based Monitoring System,7481710,R43CA134042,"['Academic Medical Centers', 'Address', 'Behavior', 'Boston', 'Breast Cancer Detection', 'Cancer Burden', 'Cancer Control', 'Cervical', 'Cessation of life', 'Clinical', 'Clinical Data', 'Closure', 'Colon Carcinoma', 'Colonoscopy', 'Complex', 'Computer software', 'Computers', 'Cytology', 'Data', 'Decision Making', 'Diagnostic', 'Diagnostic tests', 'Disease', 'Early Diagnosis', 'Early identification', 'Early treatment', 'Effectiveness', 'Ensure', 'Evaluation', 'Failure', 'Foundations', 'Goals', 'Guidelines', 'Human', 'Individual', 'Intervention', 'Invasive', 'Knowledge', 'Lesion', 'Life Cycle Stages', 'Malignant Neoplasms', 'Malignant neoplasm of cervix uteri', 'Mammography', 'Medical center', 'Monitor', 'Natural Language Processing', 'New England', 'Notification', 'Numbers', 'Pap smear', 'Patient Care', 'Patient Noncompliance', 'Patients', 'Performance', 'Phase', 'Policies', 'Process', 'Puncture biopsy', 'Rate', 'Recommendation', 'Records', 'Reminder Systems', 'Reporting', 'Schedule', 'Screening Result', 'Screening for cancer', 'Screening procedure', 'Simulate', 'Specific qualifier value', 'System', 'Technology', 'Testing', 'Text', 'Time', 'Ultrasonography', 'Work', 'base', 'compliance behavior', 'computer generated', 'design', 'disease natural history', 'follow-up', 'improved', 'knowledge base', 'malignant breast neoplasm', 'pressure', 'prevent', 'programs', 'radiologist', 'response', 'satisfaction', 'software development', 'software systems', 'tool']",NCI,U.S. CARELINK,R43,2008,122518,-0.010702114821679303
"Mammography Visits to Improve Colon Cancer Screening    DESCRIPTION (provided by applicant): Overall goal: to explore behavioral correlations between colorectal cancer (CRC) screening and screening mammography and develop an innovative approach for reducing barriers to CRC screening in women, using screening mammography, an existing non-colon cancer related screening test that has widespread public acceptance, as a ""teachable moment (TM).""  This study will be the first prospective study to evaluate the effectiveness of an educational intervention designed to increase CRC screening administered at a cancer screening visit unrelated to CRC. Specific alms: 1) To evaluate screening mammography as a setting (or ""teachable moment"") for administering CRC education; 2) To identify psychosocial barriers to colorectal cancer screening in women undergoing screening mammography; Aim 1 includes two separate randomized clinical trials to evaluate the effect of a CRC educational video on CRC screening adherence in women (aims 1A/1B) and an observational study evaluating screening mammography as a TM.  Aim 1A tests the efficacy of the CRC educational video intervention when administered during a screening mammography appointment.  Aim 1B tests the efficacy of the CRC educational video intervention when administered during a general medicine clinic visit.  Aim 1C tests the moderator effect of screening mammography on the effect of the educational intervention on CRC adherence using a quasi-experimental design by comparing the group receiving the CRC education intervention during screening mammography and the group who receive the same intervention during a noncancer screening-related clinic visit.  The primary outcome for aim 1 is the proportion of women due for CRC screening who complete screening within 6 months of the intervention.  Aim 2 uses survey methods to identify psychosocial barriers to CRC screening, based on the integrated TM-preventive health model.  A questionnaire will be prospectively administered to the participants prior to and immediately after the educational intervention.  Baseline information elicited from the study questionnaire and demographic characteristics will be used as independent variables in a series of multivariable analyses to assess the impact of each predictor on the non-adherence to CRC screening.  Predictor variables achieving statistical significance in the bivariate analyses (p<0.05) of non-adherence status and each of the potential predictor variables will be entered into a logistic model to determine independent variables associated with non-adherence to CRC screening. Forward stepwise logistic regression analysis will be used to determine factors predictive of non-adherence to any CRC screening strategy.  The project culminates in development and submission of an R-01 grant for development and testing of tailored messages directed at barriers identified in aim 2 and the development, testing and evaluation of a tailored education intervention to be delivered in a ""teachable moment"".             n/a",Mammography Visits to Improve Colon Cancer Screening,7425095,K07CA108664,"['Adherence', 'American', 'American Cancer Society', 'Appointment', 'Awareness', 'Behavior Therapy', 'Behavioral', 'Benefits and Risks', 'Characteristics', 'Clinic Visits', 'Colon Carcinoma', 'Colonoscopy', 'Colorectal Cancer', 'Condition', 'Cues', 'Development', 'Disease', 'Education', 'Educational Intervention', 'Effectiveness', 'Effectiveness of Interventions', 'Experimental Designs', 'Fecal occult blood', 'Flexible fiberoptic sigmoidoscopy', 'Foundations', 'Funding', 'Future', 'Goals', 'Grant', 'Guidelines', 'Health', 'Health behavior', 'Incidence', 'Insurance Coverage', 'Intervention', 'Knowledge', 'Learning', 'Lesion', 'Logistic Models', 'Logistics', 'Mammography', 'Medicine', 'Methods', 'Modeling', 'Observational Study', 'Outcome', 'Participant', 'Patients', 'Perception', 'Physicians', 'Policies', 'Predictive Factor', 'Preventive', 'Prospective Studies', 'Questionnaires', 'Randomized Clinical Trials', 'Rate', 'Recommendation', 'Regression Analysis', 'Relative (related person)', 'Research', 'Research Methodology', 'Screening for cancer', 'Screening procedure', 'Series', 'Survey Methodology', 'Surveys', 'Testing', 'Time', 'Translating', 'Treatment Protocols', 'Visit', 'Woman', 'Women&apos', 's Health', 'base', 'cancer education', 'cancer risk', 'career', 'colorectal cancer screening', 'disease natural history', 'evaluation/testing', 'health care delivery', 'health care service utilization', 'improved', 'innovation', 'malignant breast neoplasm', 'mortality', 'point of care', 'psychosocial', 'theories', 'therapy design', 'transmission process']",NCI,UNIVERSITY OF MICHIGAN AT ANN ARBOR,K07,2008,136080,0.14998800176594718
