text,title,id,project_number,terms,administration,organization,mechanism,year,funding,score
"Human Microbiome and Perinatal Depression Project Summary/Abstract Depression is the most common complication of pregnancy and affects 10-20% of women. Up to 75% of women with perinatal depression do not receive mental health care. In lower income African American and Hispanic women, the prevalence of perinatal depression (PND) is particularly high and the treatment rates are lower. Cognitive behavioral therapy (CBT) is an effective treatment but practical barriers such as time commitment, insurance coverage, and transportation, as well as stigma, limit uptake of CBT particularly for minority women. Similarly, concern about the adverse effects of antidepressant treatment on maternal and infant outcomes limits uptake of pharmacological treatments. A novel avenue for the development of safe therapeutics for depression focuses on the brain-gut axis and is supported by initial demonstrations that probiotics can improve mood symptoms. Our long-term goal is to assist in the discovery of potential microbes that are correlated with PND, and could be novel biomarkers for the diagnosis and treatment of this disorder, particularly in minority women. As a first step, we propose a multi-PI feasibility study involving the implementation and optimization of processes for participant recruitment and stool sample collection, as well as the initial assessments of longitudinal differences in gut microbiota between pregnant women with and without major depressive disorder (MDD). To meet these goals, we will leverage an established research infrastructure to conduct a prospective, nested case-control study. We will prospectively collect depression diagnoses and gut microbiome samples on 300 women at four points during pregnancy and after delivery to yield a total of 58 women, 29 cases with MDD and 29 controls without MDD. The two groups will be matched on key covariates (e.g., age, race, socio- economic status, gestational age, health). At their scheduled usual care, prenatal appointment, consented participants will complete mental health, demographics, microbiome-related, and dietary and physical habits questionnaires and provide a fecal sample either at that time of their appointment or at home. To achieve our first aim - to determine the feasibility of a larger similarly designed study - we will estimate the total number of potential participants, the number assessed and not assessed for eligibility (and reasons), the number excluded and reasons for exclusion, the number lost to follow-up, and the data available for analysis at each of the 4 visits. To achieve our second aim - to determine whether the gut microbiome dynamically differs in pregnant women with and without MDD - we will employ a suite of systems level approaches, including multivariate statistical techniques, network modeling and machine learning techniques. This R03 will allow us to optimize our research processes for the prospective collection of stool samples and mental health data in preparation for larger nested case-control studies, and ultimately clinical trials of probiotic therapies for PND. Project Narrative Up to 75% of women diagnosed with depression during pregnancy and the postpartum receive inadequate treatment, in large part due to concerns about the safety of antidepressants. Here we propose a feasibility study in preparation for a larger study to determine whether women with depression during their pregnancy and after their delivery have alterations in the bacterial communities in their intestine. Identifying which bacteria are associated with depression is a critical first step in the development of safe probiotic treatments for depression during pregnancy. !",Human Microbiome and Perinatal Depression,9767273,R03HD095056,"['Address', 'Adherence', 'Adverse effects', 'Affect', 'African American', 'Age', 'Antidepressive Agents', 'Appointment', 'Bacteria', 'Behavioral', 'Bioinformatics', 'Child', 'Clinical', 'Clinical Research', 'Clinical Trials', 'Cognitive Therapy', 'Collection', 'Complex', 'Complication', 'Consent', 'Data', 'Depressed mood', 'Development', 'Diagnosis', 'Diet', 'Disease', 'Eligibility Determination', 'Endocrine system', 'Epidemiology', 'Exclusion', 'Family', 'Feasibility Studies', 'Feces', 'Germ-Free', 'Gestational Age', 'Goals', 'Guidelines', 'Habits', 'Health', 'Healthcare', 'Hispanics', 'Home environment', 'Hormonal', 'Human', 'Human Microbiome', 'Immune system', 'Immunology', 'Infant', 'Insurance Coverage', 'Intestines', 'Knowledge', 'Link', 'Longitudinal Studies', 'Low income', 'Machine Learning', 'Major Depressive Disorder', 'Mental Depression', 'Mental Health', 'Microbe', 'Microbiology', 'Minority', 'Monitor', 'Mothers', 'Mus', 'Nested Case-Control Study', 'Neurologic', 'Neurotransmitters', 'Nutritional', 'Observational Study', 'Participant', 'Patient Recruitments', 'Perinatal', 'Pharmaceutical Preparations', 'Pharmacological Treatment', 'Phenotype', 'Postpartum Period', 'Pregnancy', 'Pregnancy Complications', 'Pregnant Women', 'Premature Birth', 'Prenatal care', 'Preparation', 'Prevalence', 'Probiotics', 'Process', 'Prospective cohort study', 'Questionnaires', 'Race', 'Reporting', 'Research', 'Research Design', 'Research Infrastructure', 'Risk', 'Role', 'Safety', 'Sample Size', 'Sampling', 'Schedule', 'Socioeconomic Status', 'Structure', 'System', 'Systems Biology', 'Techniques', 'Testing', 'Therapeutic', 'Time', 'Transportation', 'Visit', 'Woman', 'Work', 'adverse outcome', 'alternative treatment', 'antepartum depression', 'antidepressant effect', 'bacterial community', 'demographics', 'depressive symptoms', 'drug development', 'dysbiosis', 'effective therapy', 'fecal microbiome', 'fecal transplantation', 'follow-up', 'gut microbiome', 'gut microbiota', 'gut-brain axis', 'health data', 'improved', 'infant outcome', 'insight', 'maternal stress', 'microbial', 'microbial community', 'microbiome', 'microbiome analysis', 'microorganism', 'mood symptom', 'network models', 'neuropsychiatry', 'novel', 'novel marker', 'nutrition', 'perinatal mental health', 'peripartum depression', 'probiotic therapy', 'process optimization', 'programs', 'prospective', 'relating to nervous system', 'sample collection', 'social stigma', 'stool sample', 'targeted treatment', 'treatment as usual', 'uptake']",NICHD,UNIVERSITY OF ILLINOIS AT CHICAGO,R03,2019,83193,0.08052773058125262
"Towards Clinically Effective AI for Screening Mammography Abstract Breast cancer is the most common cancer among women and a leading cause of cancer mortality. Early detection of breast cancer can reduce mortality and morbidity, which has led to widespread mammography screening, recommended for women ages 50-74 on a yearly or bi-yearly basis. Reading the mammogram images to decide if cancer may be present is difficult due to the rarity of occurrence – in a screening population, 99.5% of women do not have cancer – and the visual challenge of finding what can be a very subtle abnormality on a complex background. This difficulty, combined with the high volume of mammograms – 39 million per year in the US – has led to a variety of proffered solutions including software known as computer-aided diagnosis (CAD). Despite early promise, such solutions have not fulfilled their potential in improving outcomes and are largely thought to increase interpretation times. Productivity is increasingly a concern due to the rapidly growing use of digital breast tomosynthesis (DBT or “3D” mammography), which has demonstrated higher cancer detection rates than traditional 2D mammography, but also takes much longer to interpret. As a potential solution, there has been significant interest in applying deep learning to mammography. Deep learning (DL) is a powerful field of machine learning which learns image features in an end-to-end fashion from data, and has been used to achieve human level performance on a number of imaging pattern recognition tasks. This proposal seeks to create DL-based software for mammography that can be effective in a clinical setting through (1) accurate and robust predictions on a diverse population of patients, (2) interpretable results from the DL model (no “black box” answers), and (3) applicability to both 2D mammography and DBT. In Phase I, the aim is to improve model performance by training on additional data and incorporating additional algorithmic advances. Phase I will conclude with a clinical reader study comparing performance of the software to radiologists. In Phase II, the aim is to improve the clinical effectiveness of the software by automating quality detection, incorporating prior exams into the model, and expanding the training dataset to ensure results generalize to any woman eligible for screening mammography. These improvements will apply to both 2D and DBT. Achieving the desired performance levels will enable a product that will improve productivity for radiologists and ensure consistent and accurate interpretations for patients. Success in this project would be a large step towards translating state-of- the-art artificial intelligence to clinically effective tools for screening mammography. Project Narrative Though mammography screening is widely considered beneficial for women ages 50-74, the varied challenges with reading the images lead to missed cancers or over-diagnosis, which in turn result in shorter length of life or unnecessary invasive procedures for many women. The goal of this project is use recent breakthroughs in artificial intelligence to create a tool for doctors that will help them interpret mammograms more accurately and efficiently. These improvements will enable better outcomes for women by improving access to quality mammography interpretations, especially in resource-constrained areas.",Towards Clinically Effective AI for Screening Mammography,9847578,R44CA240022,"['3-Dimensional', 'Age', 'Algorithms', 'American College of Radiology', 'Area', 'Artificial Intelligence', 'Asians', 'Award', 'Benchmarking', 'Breast Cancer Early Detection', 'Callback', 'Cancer Detection', 'Cancer Etiology', 'Clinical', 'Clinical effectiveness', 'Complex', 'Computer software', 'Computer-Assisted Diagnosis', 'Data', 'Data Set', 'Detection', 'Diagnosis', 'Digital Breast Tomosynthesis', 'Digital Mammography', 'Early Diagnosis', 'Educational workshop', 'Ensure', 'Funding', 'Goals', 'Grant', 'Hispanics', 'Human', 'Illinois', 'Image', 'Image Analysis', 'Improve Access', 'Institute of Medicine (U.S.)', 'Intelligence', 'Lead', 'Learning', 'Lesion', 'Longevity', 'Machine Learning', 'Malignant Neoplasms', 'Mammographic screening', 'Mammography', 'Massachusetts', 'Measures', 'Modeling', 'Morbidity - disease rate', 'Not Hispanic or Latino', 'Oregon', 'Outcome', 'Paper', 'Participant', 'Patients', 'Pattern Recognition', 'Peer Review', 'Performance', 'Phase', 'Population', 'Population Heterogeneity', 'Positioning Attribute', 'Preparation', 'Procedures', 'Productivity', 'Publications', 'Reader', 'Reading', 'Reporting', 'Research', 'Resources', 'Running', 'Screening procedure', 'Sensitivity and Specificity', 'Site', 'Technology', 'Testing', 'Time', 'Training', 'Translating', 'Validation', 'Variant', 'Visual', 'Woman', 'Work', 'base', 'breast imaging', 'clinical development', 'commercialization', 'deep learning', 'experience', 'improved', 'improved outcome', 'innovation', 'interest', 'malignant breast neoplasm', 'mortality', 'patient population', 'radiologist', 'screening', 'screening guidelines', 'success', 'symposium', 'three-dimensional modeling', 'tool']",NCI,"DEEPHEALTH, INC.",R44,2019,252810,0.04483916160991403
"ChartGlucose4Moms: Characterizing, by Trimester, Continuous Glucose Monitoring Measurements for determining effects on Maternal & Offspring Metabolic Sequelae PROJECT SUMMARY/ABSTRACT: Gestational diabetes (GDM) rates are on the rise in the US, particularly among racial and ethnic minorities. GDM is associated with higher rates of large for gestational age (LGA) infants, C-section, and serious perinatal complications, and increased long-term risks of Type 2 diabetes and morbidity in both mothers and infants. Women who get treatment for GDM are less likely to experience perinatal complications and give birth to LGA infants than those who do not; therefore, rapid detection of GDM may be critical to reducing perinatal complications and disparities in birth outcomes. GDM is normally diagnosed by oral glucose tolerance testing (OGTT) at 24-28 weeks gestation, but clinically important insulin resistance and metabolic dysfunction may be missed by not testing earlier. A metabolically unhealthy uterine environment in early pregnancy may lead to long-term negative impacts on mother and child, but how and when to test for insulin resistance and associated metabolic dysfunction in pregnancy is poorly defined. More data are needed on how glucose levels and other metabolic measures change across pregnancy to better evaluate women's metabolic risks and how those risks relate to perinatal and long-term outcomes. Using continuous glucose monitoring (CGM) and metabolic biomarker assays, we will describe detailed metabolic phenotype profiles over the course of pregnancy and examine how they are associated with perinatal and postpartum outcomes. We propose to recruit a diverse sample of 400 women in their first trimester from Kaiser Permanente Northwest and Kaiser Permanente Hawaii and to perform CGM, OGTT, and obtain biomarkers at 12 weeks, 20 weeks, and 28 weeks of gestation to examine how these measures relate to each other and to perinatal outcomes. Aim 1 and Aim 3 will assess the effects of CGM variables (Aim 1) and OGTT and other biomarkers (Aim 3) at each time point on the risk of LGA, other perinatal outcomes, and postpartum diabetes. Aim 2 will assess the relationship between CGM variables and diagnosis of GDM by OGTT, as well as the relationship between CGM variables and other metabolic biomarkers. We hypothesize that dysglycemia is just one marker of a much larger metabolic dysregulation that can be characterized through the work of this consortium. Characterizing a broader spectrum of metabolic dysregulation and its association with adverse perinatal outcomes will lead to improved screening regimens and treatments for pregnant women and better outcomes for both mothers and babies. PROJECT NARRATIVE Gestational diabetes (GDM) is a type of diabetes that develops during pregnancy that increases the risk of pregnancy and birth complications. New tests may allow doctors to identify women with GDM earlier and more accurately than the tests currently being used, but we need to understand them better. We will recruit 400 pregnant women and screen them using both traditional and new GDM screening tools at 12, 20, and 28 weeks of pregnancy to determine how well these tools identify women who are at risk of complications and need treatment.","ChartGlucose4Moms: Characterizing, by Trimester, Continuous Glucose Monitoring Measurements for determining effects on Maternal & Offspring Metabolic Sequelae",9900630,U01DK123791,"['Adipose tissue', 'Affect', 'Age', 'Biological Assay', 'Biological Markers', 'Birth', 'Brachial plexus structure', 'C-Peptide', 'C-reactive protein', 'Cesarean section', 'Child', 'Clinical', 'Data', 'Deposition', 'Detection', 'Development', 'Diabetes Mellitus', 'Diagnosis', 'Dystocia', 'Ensure', 'Environment', 'Fasting', 'First Pregnancy Trimester', 'Fracture', 'Functional disorder', 'Future', 'Gestational Age', 'Gestational Diabetes', 'Glucose', 'Glycosylated hemoglobin A', 'Hawaii', 'Health', 'Hyperglycemia', 'Hypertriglyceridemia', 'Infant', 'Inflammation', 'Injury', 'Insulin Resistance', 'Laboratories', 'Lead', 'Life Style', 'Machine Learning', 'Measurement', 'Measures', 'Metabolic', 'Metabolic dysfunction', 'Modeling', 'Morbidity - disease rate', 'Mothers', 'Non-Insulin-Dependent Diabetes Mellitus', 'Nonesterified Fatty Acids', 'OGTT', 'Oral Diagnosis', 'Organogenesis', 'Outcome', 'Outpatients', 'Participant', 'Perinatal', 'Phenotype', 'Placenta', 'Plasma', 'Postpartum Period', 'Pre-Eclampsia', 'Pregnancy', 'Pregnancy Complications', 'Pregnant Women', 'Regimen', 'Risk', 'Sampling', 'Screening procedure', 'Shoulder', 'Symptoms', 'Technology', 'Testing', 'Third Pregnancy Trimester', 'Time', 'Triglycerides', 'Uterus', 'Woman', 'Work', 'biomarker identification', 'delivery complications', 'early pregnancy', 'ethnic minority population', 'experience', 'fetal', 'glucose monitor', 'high risk', 'improved', 'metabolic phenotype', 'metabolic profile', 'mortality', 'neonatal death', 'obesogenic', 'offspring', 'perinatal complications', 'perinatal outcomes', 'polypeptide C', 'pregnancy hypertension', 'primary outcome', 'racial minority', 'rapid detection', 'recruit', 'reproductive', 'screening', 'stillbirth', 'tool']",NIDDK,KAISER FOUNDATION RESEARCH INSTITUTE,U01,2019,800511,0.08536924874298052
"Hypertensive Medication Adherence in Young African American Women Project Abstract Uncontrolled hypertension [HTN] due to poor blood pressure [BP] medication adherence in young and early middle age African American [AA] women is a leading contributor for the sustained hypertension disparities in the US. AA women in the US 20-44 years of age, have the highest prevalence of Hypertension [HTN] when compared to White women of the same age group. Uncontrolled HTN is a significant risk factor for stroke, heart failure, kidney disease, and early mortality, especially in this at-risk group. Barriers prohibiting BP medication adherence have been well characterized across the AA population except in young AA women who bear an unequal and different burden of stressors than older AA women. However, important underlying factors including HTN illness perceptions/representations, unique psychosocial factors including resilient coping, and their influence on good BP medication adherence have not been sufficiently studied among this vulnerable group. Evidence indicating that AAs acquire HTN at younger ages, are less adherent, and are more resistant to treatment compared to other ethnic groups provides a compelling impetus to identify positive and modifiable factors that contribute to BP medication adherence. The specific aims of this cross-sectional dissertation study are to examine the relationships among sociodemographic & clinical profiles, HTN illness perceptions, and BP medication adherence; and examine the relationships between psychosocial factors, resilient coping style, and BP medication adherence when controlling for sociodemographic factors in a sample of young hypertensive AA women. An exploratory aim will examine the relationship of resilient coping as a potential moderator of high or low adverse stress exposure and its effect on BP medication adherence to elicit understanding of variability in BP medication adherence among this subgroup of hypertensive women. A total of 110 AA women diagnosed with HTN, 18-45 years of age, will be recruited through an ongoing community health heart screening project which is targeting AA women diagnosed with HTN, at-risk for HTN, and other cardiovascular disease risk factors in a large southern urban setting. Descriptive, bivariate correlation, and logistic regression will be used for statistical analysis of the aims. Completion of the proposed study is the first step towards understanding the impact of modifiable factors such as HTN illness perceptions and resilient coping, and their impact on BP medication adherence in this vulnerable population. This study will provide important data to inform development and testing of effective and targeted interventions to reduce HTN disparities while improving health outcomes in a population predisposed to adverse cardiovascular events. Project Narrative Young and early middle age adult AA women represent a growing group of ethnic minority women diagnosed with hypertension in the United States. This study will examine novel constructs (HTN illness Perceptions and Resilient Coping) and psychosocial factors in relation to hypertension medication adherence to determine their importance in facilitating medication adherence in a population for whom limited information is known regarding factors associated with increased levels of medication adherence. Information gained from this study may advance the field of cardiovascular research and ethnic minority hypertension disparities and may help develop culturally targeted interventions to reduce poor medication adherence, thus improving rates of uncontrolled hypertension in the future.",Hypertensive Medication Adherence in Young African American Women,9541705,F31NR017348,"['Address', 'Adherence', 'Adult', 'Affect', 'African American', 'Age', 'Age-Years', 'Behavioral', 'Belief', 'Blood Pressure', 'Cardiac health', 'Cardiovascular system', 'Clinical', 'Cognitive', 'Community Health', 'Comorbidity', 'Complex', 'Coping Behavior', 'Cross-Sectional Studies', 'Data', 'Death Rate', 'Development', 'Diagnosis', 'Education', 'Ethnic group', 'Event', 'Exposure to', 'Future', 'Gender', 'Health', 'Health Insurance', 'Health behavior', 'Heart Diseases', 'Heart failure', 'High Prevalence', 'Hypertension', 'Income', 'Intervention', 'Kidney Diseases', 'Knowledge', 'Life', 'Link', 'Logistic Regressions', 'Measures', 'Modeling', 'Morbidity - disease rate', 'Occupations', 'Outcome', 'Patients', 'Perception', 'Pharmaceutical Preparations', 'Play', 'Population', 'Poverty', 'Predictive Factor', 'Prevalence', 'Process', 'Psychosocial Factor', 'Research', 'Resistance', 'Risk', 'Risk Factors', 'Role', 'Sampling', 'Sex Discrimination', 'Single Parent', 'Social Class', 'Social support', 'Statistical Data Interpretation', 'Stress', 'Stress and Coping', 'Stroke', 'Subgroup', 'Support System', 'Testing', 'Time', 'United States', 'Ursidae Family', 'Vulnerable Populations', 'Well in self', 'Woman', 'age group', 'associated symptom', 'blood pressure medication', 'blood pressure regulation', 'cardiovascular disorder risk', 'coping', 'depressive symptoms', 'effective intervention', 'enhancing factor', 'ethnic minority population', 'high risk', 'illness perceptions', 'improved', 'insight', 'lifestyle factors', 'medication compliance', 'middle age', 'mortality', 'neighborhood disadvantage', 'novel', 'prevent', 'psychosocial', 'racial discrimination', 'recruit', 'resilience', 'response', 'screening', 'socioeconomics', 'stressor', 'success', 'theories', 'urban setting', 'young woman']",NINR,EMORY UNIVERSITY,F31,2018,44524,0.07860041461953825
