text,title,id,project_number,terms,administration,organization,mechanism,year,award_amount,cong_dist,score
"Population Genetics Theory    DESCRIPTION (provided by applicant): Four areas of theoretical population genetics will be studied. In the first, we will develop mathematical and statistical framework for studying the evolution of genes that affect how other sets of genes interact with one another. This theory helps in understanding conditions under which the genome can be expected to become modular in its production of phenotypes, as well as when synergy between mutations in different genes should be produced by evolution. We shall study how the pattern of interaction between deleterious mutations evolves as a function of the mutation rate, the recombination rate, and the degree of fitness loss of each mutation. We shall also study buildup of statistical association between genes that influence culturally transmitted traits that are associated either through transmission or through fitness. The second area of study concerns the evolution of pathogens such as influenza. Here we build models to predict the accumulation of mutations during epidemics and pandemics in a way that can assist in guiding vaccination strategies. We will develop algorithms that search for potential recombinants and reassortants among a collection of up to 1000 viral sequences. Here we aim to devise a statistical test to indicate whether identified recombinants or reassortants are spurious or statistically significant. Our recent theory of niche construction will form the basis of studies of how pathogens might evolve in response to human actions that they induce, such as use of antibiotics. The final research area will develop multiple-gene models for sex-linked control of genomic imprinting. These will include cis and trans modifiers of imprinting. Fertility selection as well as sex- specific viabilities will be studied in order to clarify the role of multiple paternities, which has been proposed as a driving force in the evolution of genomic imprinting. Genomic data from mammalian species will be analyzed using tools from statistical learning in order to predict which genes are likely to be imprinted. Correlations between DMA sequence properties and predicted imprinting status based on life history characteristics will also be sought.           ",Population Genetics Theory,7986659,R01GM028016,"['genome sequencing ', ' Epidemic ', ' fitness ', ' Genetic Epistasis ', ' genetic epistases ', ' gene x gene interaction ', ' Interaction Deviation ', ' Epistatic Deviation ', ' Epistasis ', ' Data ', ' Recombinants ', ' Taxon ', ' Collection ', ' transmission process ', ' Transmission ', ' Evolution ', ' Characteristics ', ' sex ', ' Modification ', ' Development ', ' developmental ', ' Fertility ', ' Fecundity ', ' Fecundability ', ' pandemic disease ', ' pandemic ', ' DNA Sequence ', ' Affect ', ' Genes ', ' Population Genetics ', ' Genome ', ' base ', ' Haploidy ', ' Haploid ', ' Human ', ' Modern Man ', ' Man (Taxonomy) ', ' Algorithms ', ' Area ', ' Specific qualifier value ', ' Specified ', ' Variant ', ' Variation ', ' Alleles ', ' Allelomorphs ', ' Link ', ' Influenza ', ' influenza infection ', ' flu infection ', ' Grippe ', ' Laboratories ', ' Genomic Imprinting ', ' Parental Imprinting ', ' Genetic Imprinting ', ' Mammals ', ' Mammalia ', ' Genetic Models ', ' Mutation ', ' genome mutation ', ' Genetic defect ', ' Genetic Change ', ' Genetic Alteration ', ' Organism ', ' living system ', ' Phenotype ', ' Genetic ', ' gene function ', ' Antibiotics ', ' Miscellaneous Antibiotic ', ' Antibiotic Drugs ', ' Antibiotic Agents ', ' Antigens ', ' immunogen ', ' ATGN ', ' Production ', ' tool ', ' Genetic Recombination ', ' Recombination ', ' DNA recombination (naturally occurring) ', ' DNA Recombination ', ' Research ', ' Role ', ' social role ', ' Machine Learning ', ' support vector machine ', ' statistical learning ', ' kernel methods ', ' Testing ', ' Time ', ' Tweens ', ' Vaccination ', ' Virus ', ' General Viruses ', ' Complex ', ' Pattern ', ' Bacteria ', ' Bacteriophages ', ' bacterial virus ', ' Phages ', ' Viral ', ' Drug Formulations ', ' Formulation ', ' life history ', ' trait ', ' father role ', ' paternity ', ' research study ', ' experimental study ', ' experimental research ', ' experiment ', ' social ', ' influenza epidemic ', ' Flu epidemic ', ' Modeling ', ' Property ', ' LOINC Axis 2 Property ', ' response ', ' theories ', ' Genomics ', ' vaccination strategy ', ' pathogen ', ' driving force ', ' imprint ', ' Computers ', ' ']",NIGMS,STANFORD UNIVERSITY,R01,2010,142237,CA-18,0.14029551827638234
"Population Genetics Theory    DESCRIPTION (provided by applicant): Four areas of theoretical population genetics will be studied. In the first, we will develop mathematical and statistical framework for studying the evolution of genes that affect how other sets of genes interact with one another. This theory helps in understanding conditions under which the genome can be expected to become modular in its production of phenotypes, as well as when synergy between mutations in different genes should be produced by evolution. We shall study how the pattern of interaction between deleterious mutations evolves as a function of the mutation rate, the recombination rate, and the degree of fitness loss of each mutation. We shall also study buildup of statistical association between genes that influence culturally transmitted traits that are associated either through transmission or through fitness. The second area of study concerns the evolution of pathogens such as influenza. Here we build models to predict the accumulation of mutations during epidemics and pandemics in a way that can assist in guiding vaccination strategies. We will develop algorithms that search for potential recombinants and reassortants among a collection of up to 1000 viral sequences. Here we aim to devise a statistical test to indicate whether identified recombinants or reassortants are spurious or statistically significant. Our recent theory of niche construction will form the basis of studies of how pathogens might evolve in response to human actions that they induce, such as use of antibiotics. The final research area will develop multiple-gene models for sex-linked control of genomic imprinting. These will include cis and trans modifiers of imprinting. Fertility selection as well as sex- specific viabilities will be studied in order to clarify the role of multiple paternities, which has been proposed as a driving force in the evolution of genomic imprinting. Genomic data from mammalian species will be analyzed using tools from statistical learning in order to predict which genes are likely to be imprinted. Correlations between DMA sequence properties and predicted imprinting status based on life history characteristics will also be sought.           ",Population Genetics Theory,7869395,R01GM028016,"['genome sequencing ', ' Epidemic ', ' fitness ', ' Genetic Epistasis ', ' genetic epistases ', ' gene x gene interaction ', ' Interaction Deviation ', ' Epistatic Deviation ', ' Epistasis ', ' Data ', ' Recombinants ', ' Taxon ', ' Collection ', ' transmission process ', ' Transmission ', ' Evolution ', ' Characteristics ', ' sex ', ' Modification ', ' Development ', ' developmental ', ' Fertility ', ' Fecundity ', ' Fecundability ', ' pandemic disease ', ' pandemic ', ' DNA Sequence ', ' Affect ', ' Genes ', ' Population Genetics ', ' Genome ', ' base ', ' Haploidy ', ' Haploid ', ' Human ', ' Modern Man ', ' Man (Taxonomy) ', ' Algorithms ', ' Area ', ' Specific qualifier value ', ' Specified ', ' Variant ', ' Variation ', ' Alleles ', ' Allelomorphs ', ' Link ', ' Influenza ', ' influenza infection ', ' flu infection ', ' Grippe ', ' Laboratories ', ' Genomic Imprinting ', ' Parental Imprinting ', ' Genetic Imprinting ', ' Mammals ', ' Mammalia ', ' Genetic Models ', ' Mutation ', ' genome mutation ', ' Genetic defect ', ' Genetic Change ', ' Genetic Alteration ', ' Organism ', ' living system ', ' Phenotype ', ' Genetic ', ' gene function ', ' Antibiotics ', ' Miscellaneous Antibiotic ', ' Antibiotic Drugs ', ' Antibiotic Agents ', ' Antigens ', ' immunogen ', ' ATGN ', ' Production ', ' tool ', ' Genetic Recombination ', ' Recombination ', ' DNA recombination (naturally occurring) ', ' DNA Recombination ', ' Research ', ' Role ', ' social role ', ' Machine Learning ', ' support vector machine ', ' statistical learning ', ' kernel methods ', ' Testing ', ' Time ', ' Tweens ', ' Vaccination ', ' Virus ', ' General Viruses ', ' Complex ', ' Pattern ', ' Bacteria ', ' Bacteriophages ', ' bacterial virus ', ' Phages ', ' Viral ', ' Drug Formulations ', ' Formulation ', ' life history ', ' trait ', ' father role ', ' paternity ', ' research study ', ' experimental study ', ' experimental research ', ' experiment ', ' social ', ' influenza epidemic ', ' Flu epidemic ', ' Modeling ', ' Property ', ' LOINC Axis 2 Property ', ' response ', ' theories ', ' Genomics ', ' vaccination strategy ', ' pathogen ', ' driving force ', ' imprint ', ' Computers ', ' ']",NIGMS,STANFORD UNIVERSITY,R01,2010,261556,CA-18,0.14029551827638234
"Informatic profiling of clinically relevant mutation    DESCRIPTION (provided by applicant):       Informatic profiling of clinically relevant mutation      Many approaches have been developed to predict whether a mutation associated with a disease is actually causative. In contrast to other approaches to predicting deleterious mutations, our approach, called in silico functional profiling, starts with learning residue-specific protein function and then estimates when it is disrupted. This research will continue our efforts to characterize what the underlying molecular disruption a mutation is causing and thereby improve accuracy of these approaches. We will do this by building a database that links clinical observation with molecular phenotype and using this to develop bioinformatic models of mutation. This is particularly relevant to cancer, since many mutations in cancer are both poorly understood and simply associated with cancer. The hypothesis of this proposal is that computational methods that predict a specific residue function using protein sequence and structure can classify known disease-associated mutations based on their function better than existing computational methods, and less expensively than experimental assays. In short, we will describe each phenotypically annotated mutation as possibly affecting catalysis, protein interactions, posttranslational modification and stability of the protein. The structural environments around disease associated mutations can be characterized using a combination of computational biochemical methods based on first principles of biomolecular structure and function and statistical informatics methods. We will continue this research by implementing the following steps: First, we will build a database of how often mutations in cancer, pharmacogenetics, Mendelian and complex disease are disrupted by phosphorylation, stability, catalysis, protein interaction and other posttranslational modifications. Second, we will build a bioinformatic model of disruption using machine learning methods trained with these and other commonly used features. Finally, we will link these to clinical observation by annotating disease causing mutation with an ontology of diseases and integrate these predictions into databases of mutation. Thus, we will link clinical observation with molecular phenotypes by building a useful database and new models of how mutations cause disease.          ",Informatic profiling of clinically relevant mutation,7929905,R01LM009722,"['Acetylation ', ' Bioinformatics ', ' Bio-Informatics ', ' Disease ', ' disease/disorder ', ' Disorder ', ' DNA-Binding Proteins ', ' Environment ', ' Address ', ' Data Set ', ' Dataset ', ' protein structure ', ' Data ', ' Mutation Spectra ', ' Ontology ', ' Ubiquitination ', ' ubiquitin conjugation ', ' ubiquination ', ' Ubiquitinoylation ', ' Ubiquitilation ', ' Principal Investigator ', ' Molecular ', ' protein function ', ' Affect ', ' base ', ' Goals ', ' improved ', ' Hereditary Disease ', ' hereditary disorder ', ' genetic disorder ', ' Molecular Disease ', ' Genetic Diseases ', ' Genetic Condition ', ' Site ', ' Clinical ', ' Variant ', ' Variation ', ' Biochemical ', ' Link ', ' Training ', ' Laboratories ', ' Laboratory Research ', ' Learning ', ' Databases ', ' data repository ', ' clinical data repository ', ' Electronic Database ', ' Electronic Databank ', ' Databanks ', ' Data Bases ', ' Data Banks ', ' Funding ', ' Medicine ', ' Amino Acid Sequence ', ' protein sequence ', ' Primary Protein Structure ', ' Methods ', ' Mutation ', ' genome mutation ', ' Genetic defect ', ' Genetic Change ', ' Genetic Alteration ', ' Collaborations ', ' Pharmacogenetics ', ' Genetic ', ' Phosphorylation ', ' Protein Phosphorylation ', ' Productivity ', ' Post-Translational Protein Processing ', ' Protein Modification ', ' Posttranslational Protein Processing ', ' Posttranslational Modifications ', ' Post-Translational Protein Modification ', ' Post-Translational Modifications ', ' Post-Translational Modification Protein/Amino Acid Biochemistry ', ' tool ', ' Proteins ', ' gene product ', ' Research ', ' Research Personnel ', ' Researchers ', ' Investigators ', ' Resources ', ' Research Resources ', ' Machine Learning ', ' support vector machine ', ' statistical learning ', ' kernel methods ', ' Computational Biology ', ' programs ', ' Testing ', ' Variation (Genetics) ', ' allelic variant ', ' Genetic Variation ', ' Genetic Diversity ', ' Gene variant ', ' Work ', ' Inherited ', ' Hereditary ', ' Complex ', ' Amino Acid Substitution ', ' Biological Assay ', ' Biologic Assays ', ' Bioassay ', ' Assay ', ' Biology ', ' experience ', ' protein structure function ', ' computer science ', ' Informatics ', ' Catalytic Domain ', ' Catalytic Subunit ', ' Catalytic Site ', ' Catalytic Region ', ' Catalytic Core ', ' Structure ', ' Basic Science ', ' Basic Research ', ' Malignant Neoplasms ', ' neoplasm/cancer ', ' malignancy ', ' Malignant Tumor ', ' Cancers ', ' Human Resources ', ' personnel ', ' Manpower ', ' Positioning Attribute ', ' Position ', ' Catalysis ', ' Peptide Sequence Determination ', ' Protein Sequencing Molecular Biology ', ' Protein Sequencing ', ' Protein Sequence Determinations ', ' Amino Acid Sequence Determinations ', ' falls ', ' Modeling ', ' protein protein interaction ', ' Clinical Informatics ', ' cancer classification ', ' disease phenotype ', ' computerized tools ', ' computational tools ', ' novel strategies ', ' novel strategy ', ' novel approaches ', ' new approaches ', ' innovation ', ' innovative ', ' innovate ', ' clinically relevant ', ' clinical relevance ', ' translational medicine ', ' disease-causing mutation ', ' clinical care ', ' molecular phenotype ', ' Computer Simulation ', ' virtual simulation ', ' in silico ', ' computerized simulation ', ' computerized modeling ', ' computer based models ', ' computational simulation ', ' computational models ', ' computational modeling ', ' Mathematical Models and Simulations ', ' Mathematical Model Simulation ', ' Computerized Models ', ' Computer based Simulation ', ' Computer Models ', ' Computing Methodologies ', ' computer methods ', ' computational methods ', ' computational methodology ', ' ']",NLM,BUCK INSTITUTE FOR RESEARCH ON AGING,R01,2010,383293,CA-02,0.2831497919721447
"Improve predictions of structure and function by PredictProtein    DESCRIPTION (provided by applicant):       SUMMARY: Over 25,000 researchers in the US and over 50,000 in 120 other countries have exploited the PredictProtein (PP) Internet server to analyze proteins by homology-transfer and by eye novo predictions of protein structure and function. Here, we propose technical and scientific solutions that will improve the functionality of PP and its extension portal META-PP. Many technical changes will remain hidden to users and are required to increase the maintainability, scalability, and portability of these servers. New Graphical User Interfaces are one proposed solution that will visibly impact the service. The scientific solutions address two related tasks pertaining to the prediction of structure and function. The first is to predict the effect of mutations. We propose the development of novel machine learning-based methods to distinguish between mutations that affect structure, function, or have no apparent phenotype. Our final method will be applied to the screening of SNP data from our experimental colleagues at Columbia, as well as to the prediction of SNP effects in public databases. The second major task is the identification of natively unstructured regions and their functional classification. Proteins that do not adopt regular structures in isolation are increasingly becoming an important research area; they may provide a key to the evolution of complexity from prokaryotes to eukaryotes. We propose the development of a machine learning-based identification of features specific to this important class of molecules. We also plan to attack the problem from a very different angle by using predictions of interaction densities inside proteins. The resulting novel tools will allow a proteome-wide analysis of the role of these molecules. All methods will be made available through PP.      RELEVANCE: Information about protein structure adds an entire dimension to protein analysis and genome annotation. This addition is often essential to infer function even for natively unstructured proteins. The PredictProtein server is unique in its combination and exploitation of evolution, structure, and function; many thousands of theoretical, experimental, and clinical researches have benefited from this. The long-term goal of the research proposed here is to improve our ability to use the evolutionary record of amino acid substitutions, i.e. to ultimately understand the amino acid ""language"". The short-term goal is to address two tasks that are closely related to human diseases, namely the distinction between silent and important mutations and the mapping of unstructured proteins onto networks and diseases.          ",Improve predictions of structure and function by PredictProtein,7842572,R01LM007329,"['Services ', ' Membrane ', ' membrane structure ', ' protein structure function ', ' Budgets ', ' Structure ', ' novel ', ' Eukaryota ', ' Eukaryote ', ' Devices ', ' Proteome ', ' Code ', ' Coding System ', ' Property ', ' LOINC Axis 2 Property ', ' protein protein interaction ', ' portability ', ' Genomics ', ' Classification ', ' Systematics ', ' Clinical Research ', ' Clinical Study ', ' Communities ', ' data modeling ', ' protein structure prediction ', ' design ', ' designing ', ' Linux ', ' Plug-in ', ' graphical user interface ', ' graphic user interface ', ' Graphical interface ', ' human disease ', ' density ', ' Goals ', ' Grant ', ' improved ', ' Area ', ' Medical ', ' Screening procedure ', ' screenings ', ' screening ', ' Training ', ' Language ', ' Databases ', ' data repository ', ' clinical data repository ', ' Electronic Database ', ' Electronic Databank ', ' Databanks ', ' Data Bases ', ' Data Banks ', ' Progress Reports ', ' Funding ', ' Maintenance ', ' Maps ', ' Amino Acids ', ' aminoacid ', ' Methods ', ' Mutation ', ' genome mutation ', ' Genetic defect ', ' Genetic Change ', ' Genetic Alteration ', ' Internet ', ' world wide web ', ' web ', ' WWW ', ' Nucleotides ', ' Phenotype ', ' Prokaryotic Cells ', ' prokaryote ', ' Prokaryotae ', ' tool ', ' Proteins ', ' gene product ', ' Research ', ' Research Personnel ', ' Researchers ', ' Investigators ', ' Role ', ' social role ', ' Machine Learning ', ' support vector machine ', ' statistical learning ', ' kernel methods ', ' Solutions ', ' Testing ', ' Adopted ', ' Investigation ', ' Dimensions ', ' Country ', ' Amino Acid Substitution ', ' Biology ', ' Disease ', ' disease/disorder ', ' Disorder ', ' Address ', ' Data Set ', ' Dataset ', ' protein structure ', ' Data ', ' Induced Mutation ', ' Induced Sequence Alteration ', ' Induced DNA Alteration ', ' Protein Analysis ', ' Resolution ', ' Evolution ', ' protein function ', ' Development ', ' developmental ', ' Eye ', ' Eyeball ', ' Point Mutation ', ' Sequence Analysis ', ' Sequence Analyses ', ' SEQ-AN ', ' Output ', ' Affect ', ' Genome ', ' base ', ' ']",NLM,COLUMBIA UNIV NEW YORK MORNINGSIDE,R01,2010,327180,NY-13,0.09494687745204326
"Informatic profiling of clinically relevant mutation    DESCRIPTION (provided by applicant): Our group focuses on genetic variants that disrupt molecular functions that cause human disease. In this renewal R01 application, we propose to begin the process of realizing our long-term goals, and to expand our original scope of research to include the challenge of understanding genetic disease mutations and polymorphisms that affect gene expression regulation in noncoding regions. Additionally, we have formed collaborations with genetic data managers and will apply these methods to aid in their research and identify new testable hypotheses. We will do this in three aims. First, we will integrate predictions of protein-disease associations with mutation predictions to develop a new quantitative model of genotype and phenotype. Second, we will integrate each of these together to develop a systems level, molecular function genome annotator with functionality to import into the genome databases. Finally, we will continue to build new methods for characterization of mutations using sequence, function and structure and begin testing our published hypotheses. Each of these aims will include collaboration with the maintainers of genetic datasets to better understand their underlying molecular effects.           PrjctNrrative Tis cmetigrnwlR1aims t nerstn owgntic vritindat iscvrdi gnom sqecin  effortsdisrpts mlclr fnctinad te tsts wetertesemlclr fnctindisrptigvrintsar  mreliklytola to umn gneticdisaseusigbiiformtics.",Informatic profiling of clinically relevant mutation,8238173,R01LM009722,"['cancer genome ', ' Amino Acid Substitution ', ' Untranslated Regions ', ' UTRs ', ' Pharmacogenetics ', ' disease-causing mutation ', ' Computer software ', ' computer program/software ', ' Software ', ' multidisciplinary ', ' Leadership ', ' Left ', ' Bioinformatics ', ' Bio-Informatics ', ' Structure ', ' Individual ', ' protein structure function ', ' Variant ', ' Variation ', ' career ', ' Feedback ', ' Letters ', ' Inherited ', ' Hereditary ', ' Science ', ' genetic regulatory protein ', ' regulatory gene product ', ' Regulatory Protein ', ' human disease ', ' Disease ', ' disease/disorder ', ' Disorder ', ' Internet ', ' world wide web ', ' web ', ' WWW ', ' Molecular ', ' Modeling ', ' Genomics ', ' Genes ', ' Laboratories ', ' Meta-Analysis ', ' Meta-Analyses ', ' Data Pooling ', ' Clinical Trial Overviews ', ' Genome ', ' clinically relevant ', ' clinical relevance ', ' genome database ', ' Genetic ', ' Affect ', ' Genotype ', ' Mutation ', ' genome mutation ', ' Genetic defect ', ' Genetic Change ', ' Genetic Alteration ', ' Methods ', ' Informatics ', ' tool ', ' Publishing ', ' innovation ', ' innovative ', ' innovate ', ' Algorithms ', ' Staging ', ' Phenotype ', ' Performance ', ' Code ', ' Coding System ', ' Resources ', ' Research Resources ', ' System ', ' LOINC Axis 4 System ', ' Focus Groups ', ' Funding ', ' Goals ', ' novel strategies ', ' novel strategy ', ' novel approaches ', ' new approaches ', ' Malignant Neoplasms ', ' neoplasm/cancer ', ' malignancy ', ' Malignant Tumor ', ' Cancers ', ' Proteins ', ' gene product ', ' Scientist ', ' Machine Learning ', ' support vector machine ', ' statistical learning ', ' kernel methods ', ' Disease Association ', ' genome sequencing ', ' software development ', ' developing computer software ', ' develop software ', ' disease phenotype ', ' DNA Resequencing ', ' Resequencing ', ' exome ', ' exomes ', ' Classification ', ' Systematics ', ' Human Genome ', ' human whole genome ', ' Biomedical Research ', ' data management ', ' Functional RNA ', ' Non-Coding RNA ', ' Non-Coding ', ' Genetic Polymorphism ', ' polymorphism ', ' Polymorphism (Genetics) ', ' user-friendly ', ' Disease model ', ' disorder model ', ' Paper ', ' Research Proposals ', ' Hereditary Disease ', ' hereditary disorder ', ' genetic disorder ', ' Molecular Disease ', ' Genetic Diseases ', ' Genetic Condition ', ' genetic variant ', ' Human ', ' Modern Man ', ' Man (Taxonomy) ', ' Testing ', ' Transcript ', ' Collaborations ', ' Process ', ' Data ', ' Area ', ' novel ', ' Research Personnel ', ' improved ', ' Research ', ' Researchers ', ' Investigators ', ' base ', ' Gene Expression Regulation ', ' Gene Regulation Process ', ' Gene Regulation ', ' Gene Action Regulation ', ' Data Set ', ' Dataset ', ' Work ', ' Role ', ' social role ', ' Complex ', ' Mutation Analysis ', ' Genetic Sequence Databases ', ' ']",NLM,BUCK INSTITUTE FOR RESEARCH ON AGING,R01,2011,500661,CA-02,0.1954144328615251
