text,title,id,project_number,terms,administration,organization,mechanism,year,award_amount,cong_dist,score
"Unraveling molecular and system-level mechanisms of human disease-associated protein mutations Project Summary Although a quickly expanding catalogue of protein mutations have been discovered, including those that cause human diseases or confer drug resistance, mechanistic understanding and prediction of functional consequences of these mutations remain rather limited. There is a critical need to develop novel, multiscale computational frameworks that are rigorous and generalizable to help close the ever-increasing gap between phenotypic data and mechanistic knowledge about the mutations and to develop effective therapeutic strategies.  My long-term research goals are two folds: (1) to unravel how a change in protein sequence ripples through various aspects of molecular and system-levels to a change in cellular function and cause human diseases or confer drug resistance; and (2) to translate learned mechanistic knowledge to effective drug-design strategies for human diseases and drug resistance. Toward these goals I propose to advance and combine the strengths of computational molecular biology (structural modeling and design for proteins or protein interactions) and computational systems biology (pathway/network-level topology and dynamics) and follow a novel, formal paradigm to develop methods that systematically identify mechanisms underlying various stages of consequence propagation (from conformation, molecular and system-level variables, to cellular functions, where intermediates can be skipped if necessary). In the forward direction of propagating consequences, I will determine, explain and understand mutational consequences at various levels with machine learning, causal analysis, and combinatorial optimization, starting with known or modelled changes at various levels. In the inverse direction of designing consequences, I will follow known or learned mechanistic hypotheses and develop efficient combinatorial optimization methods to design mutagenesis experiments or screen / design ligands for desired perturbations at various levels, which would test and refine corresponding hypotheses directly and translate mechanistic hypotheses to therapeutic strategies. Mechanisms underlying distal (potentially allosteric) mutations, multiple mutations within a protein or across proteins as well as systems pharmacology strategies will also be rigorously determined in the process.  The expected outcomes from the innovative project will include two main components. The first will be both biophysical principles of proteins and integrative understanding of biomedical systems, which will be organized in a database for public access. The second will be translating mechanistic insights into therapeutic intervention strategies to treat diseases. In particular, targeted experiments (mutagenesis or ligand-binding) will be designed following known or discovered mechanistic hypotheses. This project will involve close collaboration with structural biologists and clinician-scientists who are active collaborators of the PI. Project Narrative Genetic mutations, many of which lead to protein mutations, are often associated with human diseases: they often directly cause diseases or contribute to their progressions. Understanding mechanisms by which these mutations lead to significant functional consequences is of extreme importance to developing effective therapeutics to cure diseases and ameliorate drug resistance.",Unraveling molecular and system-level mechanisms of human disease-associated protein mutations,9774239,R35GM124952,"['Amino Acid Sequence ', ' protein sequence ', ' Primary Protein Structure ', ' Biophysics ', ' biophysical sciences ', ' biophysical principles ', ' biophysical foundation ', ' Subcellular Process ', ' Cellular Process ', ' Cellular Physiology ', ' Cellular Function ', ' Cell Process ', ' Cell Function ', ' Cell physiology ', ' Disorder ', ' Disease ', ' Drug Design ', ' resistant to Drug ', ' resistance to Drug ', ' drug resistant ', ' Drug resistance ', ' Goals ', ' heavy metal lead ', ' heavy metal Pb ', ' Pb element ', ' Lead ', ' Ligands ', ' Methods ', ' Structural Models ', ' conformational state ', ' conformation ', ' Molecular Stereochemistry ', ' Molecular Configuration ', ' Molecular Conformation ', ' genome mutation ', ' Genetic defect ', ' Genetic Change ', ' Genetic Alteration ', ' Mutation ', ' Pharmacology ', ' protein design ', ' genetic protein engineering ', ' Protein Engineering ', ' Proteins ', ' Research ', ' Testing ', ' Translating ', ' Mutagenesis Molecular Biology ', ' Genetics-Mutagenesis ', ' Mutagenesis ', ' Distal ', ' insight ', ' Databases ', ' data base ', ' Data Bases ', ' Collaborations ', ' Therapeutic ', ' Machine Learning ', ' support vector machine ', ' statistical learning ', ' kernel methods ', ' Knowledge ', ' Catalogs ', ' Scientist ', ' System ', ' novel ', ' Therapeutic Intervention ', ' intervention therapy ', ' Modeling ', ' Intervention ', ' interventional strategy ', ' Intervention Strategies ', ' Disease Resistance ', ' resistant to disease ', ' resistant disease ', ' resistance to disease ', ' Computational Molecular Biology ', ' Systems Biology ', ' DNA Sequence Alteration ', ' genomic alteration ', ' Sequence Alteration ', ' Genetic mutation ', ' DNA mutation ', ' DNA Alteration ', ' Structural Biologist ', ' Ligand Binding ', ' Molecular ', ' Process ', ' Pathway interactions ', ' pathway ', ' computer framework ', ' computational framework ', ' design ', ' designing ', ' Treatment Efficacy ', ' therapy efficacy ', ' therapeutically effective ', ' therapeutic efficacy ', ' intervention efficacy ', ' Outcome ', ' innovation ', ' innovative ', ' innovate ', ' human disease ', ' Combinatorial Optimization ', ' phenotypic data ', ' experimental study ', ' experimental research ', ' experiment ', ' ']",NIGMS,TEXAS ENGINEERING EXPERIMENT STATION,R35,2019,335245,TX-17,0.18895753745202024
"Molecular Characterization of Joubert Syndrome Project Summary Congenital ataxia presents in early childhood with non-progressive hypotonia, gross motor, fine motor and cognitive delays. These disorders are distinct from the progressive ataxias because of the presence of congenital cerebellar malformations and because they are typically inherited recessively. Joubert Syndrome and Related Disorders (JSRD) constitute a major subset of these conditions, consisting of a cerebellar midline (vermis) malformation, a nearly pathognomonic Molar Tooth sign on brain Imaging (MTI) and co-existent oculomotor apraxia and episodic breathing dysrhythmias. In our published data, we have: 1] Identified ten unique genetic causes of JSRD (nearly half of the published causes), 2] Generated genotype-phenotype correlations involving cerebellar, retinal, renal, hepatic, digit, and cerebral manifestations. 3] Identified common founder mutations that allow for population-based screening. 4] Discovered that JSRD encoded proteins frequently localize to the cilium. 5] Identified ciliary transition zone (TZ) defects in cells with JSRD mutations. 6] Performed siRNA cell-based screens for defective ciliogenesis to prioritize candidate JSRD genes. 7] Generated and characterized multiple zebrafish, mouse and human cell culture models for JSRD. 8] Defined the concept of Ciliary localization model, in which one JSRD gene is required for ciliary localization of other JSRD proteins. In our unpublished data we have: 1] Recruited an additional 200 JSRD patients without molecular diagnosis. 2] Performed whole exome (WES) and whole genome sequencing (WGS) on an additional 100 JSRD families. 3] Identified an additional 12 novel likely JSRD candidate genes. 4] Generated IPSCs and cerebellar organoids from mutation-positive and negative families to aid in functional analysis and gene discovery using RNAseq. 5] Begun functional validation of the putative mutations. 6] Developed methods to interrogate ciliary structure in a high-throughput fashion with electron microscopy (EM). The goal of this competing renewal is to identify the remaining discoverable genes that lead to JSRD when lost, functionally validate mutations within the pathogenetic framework, and test the hypothesis that mutations in JSRD genes lead to collapse of the ciliary TZ. Because the majority of patients still have unknown cause of disease, this renewal aims to advance knowledge through molecular characterization of new genes, using newly evolving high-throughput techniques, integrated bioinformatics, and a unique resource of consanguineous families recruited world-wide. We further aim to validate these mutations in patient cells, within a mechanistic framework that JSRD genes are required for essential ciliary structural components during cerebellar development. Project Narrative Joubert syndrome is a genetically and phenotypically heterogeneous neurodevelopmental disorder unified by defects of the cellular primary cilium. This work will identify new genetic causes and dissect ciliary defects associated with genetic mutations.",Molecular Characterization of Joubert Syndrome,9749889,R01NS048453,"['Termination of pregnancy ', ' Apraxias ', ' apraxia ', ' Dyspraxia ', ' Breathing ', ' inspiration ', ' Respiratory Inspiration ', ' Respiratory Aspiration ', ' Ataxia ', ' Dyssynergia ', ' Coordination Impairment ', ' Ataxy ', ' cell culture ', ' Cell Culture Techniques ', ' Cell Body ', ' Cells ', ' Cultured Cells ', ' Cilia ', ' granule ', ' Cytoplasmic Granules ', ' Disorder ', ' Disease ', ' Negatrons ', ' Negative Beta Particle ', ' Electrons ', ' Embryonic ', ' Embryo ', ' facial ', ' faces ', ' Face ', ' Family ', ' Genes ', ' Genotype ', ' Goals ', ' Gold ', ' Modern Man ', ' Human ', ' renal ', ' Kidney Urinary System ', ' Kidney ', ' heavy metal lead ', ' heavy metal Pb ', ' Pb element ', ' Lead ', ' Methods ', ' Electron Microscopy ', ' Scanning Electron Microscopy ', ' Middle East ', ' Molar tooth ', ' Morphogenesis ', ' Murine ', ' Mice Mammals ', ' Mice ', ' Mus ', ' Muscular Hypotonia ', ' Muscle Tone Poor ', ' Muscle Hypotony ', ' Hypotonia ', ' Hypomyotonia ', ' Decreased Muscle Tone ', ' Muscle hypotonia ', ' genome mutation ', ' Genetic defect ', ' Genetic Change ', ' Genetic Alteration ', ' Mutation ', ' Organoids ', ' Patients ', ' Phenotype ', ' Probability ', ' Proteins ', ' Publishing ', ' Research Resources ', ' Resources ', ' Risk ', ' biological signal transduction ', ' Signaling ', ' Signal Transduction Systems ', ' Intracellular Communication and Signaling ', ' Cell Signaling ', ' Cell Communication and Signaling ', ' Signal Transduction ', ' Sonication ', ' Mass Spectrum Analyses ', ' Mass Spectrum ', ' Mass Spectroscopy ', ' Mass Spectrometry ', ' Mass Photometry/Spectrum Analysis ', ' Mass Spectrum Analysis ', ' Syndrome ', ' Testing ', ' Work ', ' Zebra Fish ', ' Zebra Danio ', ' Danio rerio ', ' Brachydanio rerio ', ' Zebrafish ', ' base ', ' Brain imaging ', ' brain visualization ', ' Hepatic ', ' Clinical ', ' Microscopic ', ' Variant ', ' Variation ', ' Series ', ' Training ', ' Cerebellar vermis structure ', ' vermis ', ' insight ', ' Individual ', ' Cerebrum ', ' cerebral ', ' Databases ', ' data base ', ' Data Bases ', ' Congenital cerebellar hypoplasia ', ' Cerebellar hypoplasia ', ' Genetic ', ' Morphology ', ' Machine Learning ', ' support vector machine ', ' statistical learning ', ' kernel methods ', ' Knowledge ', ' Joubert syndrome ', ' cerebelloparenchymal disorder IV ', ' cerebellar vermis agenesis ', ' Joubert-Boltshauser syndrome ', ' Inherited ', ' Hereditary ', ' Severities ', ' cell type ', ' Techniques ', ' fetal ', ' Digit structure ', ' Digit ', ' Gene Mutation ', ' Gene Alteration ', ' mutant ', ' early childhood ', ' cohort ', ' Transmission Electron Microscopy ', ' Structure ', ' Genetic screening method ', ' genetic testing ', ' gene-based testing ', ' gene testing ', ' novel ', ' Modeling ', ' affection ', ' oculomotor ', ' ocularmotor ', ' ocular motor ', ' disorder subtype ', ' disease subtype ', ' disease subgroups ', ' Small Interfering RNA ', ' siRNA ', ' Short interfering RNA ', ' Pathogenicity ', ' Bioinformatics ', ' Bio-Informatics ', ' cilium biogenesis ', ' ciliogenesis ', ' genome sequencing ', ' Candidate Disease Gene ', ' Candidate Gene ', ' Length ', ' Defect ', ' DNA Sequence Alteration ', ' genomic alteration ', ' Sequence Alteration ', ' Genetic mutation ', ' DNA mutation ', ' DNA Alteration ', ' Data ', ' Molecular Diagnosis ', ' Motor ', ' Protein Analysis ', ' Cognitive ', ' Enrollment ', ' enroll ', ' Validation ', ' WNT Signaling Pathway ', ' WNT signaling ', ' Molecular ', ' Knock-out ', ' Knockout ', ' Development ', ' developmental ', ' Neurodevelopmental Disorder ', ' Neurological Development Disorder ', ' Cerebellar malformation ', ' Cerebellum malformation ', ' reconstruction ', ' knock-down ', ' knockdown ', ' Three-dimensional analysis ', ' 3D analysis ', ' 3-dimensional analysis ', ' 3-D analysis ', ' Retinal ', ' loss of function mutation ', ' founder mutation ', ' malformation ', ' gene discovery ', ' discover genes ', ' population based ', ' stem cell biology ', ' genome-wide ', ' genomewide ', ' genome scale ', ' exome ', ' exomes ', ' transcriptome sequencing ', ' RNAseq ', ' RNA sequencing ', ' RNA Seq ', ' exome sequencing ', ' exome-seq ', ' screening ', ' Clustered Regularly Interspaced Short Palindromic Repeats ', ' CRISPR/Cas system ', ' CRISPR ', ' accurate diagnosis ', ' consanguineous family ', ' consanguineous\xa0kindreds ', ' consanguineous pedigree ', ' whole genome ', ' full genome ', ' entire genome ', ' recruit ', ' ']",NINDS,"UNIVERSITY OF CALIFORNIA, SAN DIEGO",R01,2019,510012,CA-52,0.20843462185098818
"Understanding modifiers of mendelian mutation penetrance using familial hypercholesterolemia as a model PROJECT SUMMARY / ABSTRACT Rare monogenic forms of common diseases have provided key fundamental insights about common disease. However, genetic, environmental, and stochastic elements influence risk for disease. Familial hypercholesterolemia (FH), an autosomal dominant disorder afflicting 1 in 250 linked to severe increases in LDL cholesterol and premature coronary heart disease (CHD) risk, is an ideal model to characterize modifiers of disease. Despite the presence of a strong genetic driver of hypercholesterolemia from FH mutations, we recently observed that half do not have the expected severe hypercholesterolemia. In this proposal, we outline several methods to discover and dissect the genetic and non-genetic factors influencing CHD risk conferred by FH mutations in humans and determine whether knowledge of these factors can improve risk discrimination among those with FH mutations. Our approach harnesses several multi-dimensional datasets: whole genome sequences, metabolomics, and cross-sectional and longitudinal cardiovascular phenotypes. In Aim 1, we will aggregate and curate 75,000 deep (30X) whole genome sequences and cardiovascular phenotypes. In Aim 2, we will discover genetic and non-genetic modifiers of LDL cholesterol and CHD risk in FH and evaluate their metabolomic consequences. In Aim 3, we will develop a method incorporating genetics and longitudinal non- genetic exposures for CHD risk stratification among ~4,000 with FH mutations in the Million Veteran Program. In addition to the proposed Aims, this five-year proposal outlines a comprehensive strategy for the principal investigator's (PI's) scientific and professional development in academic cardiovascular medicine. The research strategy builds upon the PI's prior research experience and clinical training. In addition to an undergraduate degree in Molecular Biology and master's degree in Biomedical Informatics, he completed post- graduate medical training in Internal Medicine and Cardiovascular Medicine. He recently developed a new preventive/genetic cardiology clinic focusing on the evaluation and management of those with or a family history of premature CHD, including those with FH, at Massachusetts General Hospital (MGH). This proposal now focuses on expanding his scientific skills in human genetics and genomics into new domains: integrative genomics, statistical genetics, clinical informatics, and risk modeling. The career development goals will be at achieved through a multi-faceted approach involving mentorship, collaboration, didactic coursework, conferences, and scientific investigation. This work will take place in a unique training environment comprised of MGH and the Broad Institute. Successful completion of this career development award will result in improved fundamental understanding of the determinants of CHD, result in the PI's transition to an independent physician-scientist, and provide a solid foundation from which he will apply for R01-level funding. PROJECT NARRATIVE / PUBLIC HEALTH RELEVANCE Cardiovascular disease, largely due to coronary heart disease (CHD), remains the leading cause of death in the United States and now worldwide despite current advances. Familial hypercholesterolemia is a relative common genetic disorder characterized by severe hypercholesterolemia and premature CHD but many carrying these mutations do not develop these consequences. This proposal seeks to define and characterize the factors modifying CHD risk among those with FH mutations; success has the potential to broadly identify new mechanisms of CHD and novel strategies for prevention.",Understanding modifiers of mendelian mutation penetrance using familial hypercholesterolemia as a model,9609507,K08HL140203,"['Adult ', ' adulthood ', ' Adult Human ', ' 21+ years old ', ' Affect ', ' Cardiology ', ' Cardiovascular Diseases ', ' cardiovascular disorder ', ' Cardiovascular system ', ' circulatory system ', ' Heart Vascular ', ' Cardiovascular Organ System ', ' Cardiovascular Body System ', ' Cardiovascular ', ' Cause of Death ', ' Clinical Informatics ', ' virtual simulation ', ' in silico ', ' computerized simulation ', ' computerized modeling ', ' computer based models ', ' computational simulation ', ' computational models ', ' computational modeling ', ' Mathematical Models and Simulations ', ' Mathematical Model Simulation ', ' Computerized Models ', ' Computer based Simulation ', ' Computer Models ', ' Computer Simulation ', ' coronary arterial disease ', ' atherosclerotic coronary disease ', ' Coronary Atherosclerosis ', ' Coronary Artery Disorder ', ' Coronary Artery Disease ', ' Coronary Arteriosclerosis ', ' coronary disorder ', ' atherosclerotic heart disease ', ' Coronary Disease ', ' Coronary heart disease ', ' Cognitive Discrimination ', ' Discrimination ', ' Disorder ', ' Disease ', ' Elements ', ' Environment ', ' Foundations ', ' Genetic Counseling ', ' Genotype ', ' Goals ', ' Gold ', ' General Hospitals ', ' Modern Man ', ' Human ', ' Human Genetics ', ' Hypercholesteremia ', ' hypercholesterolemia ', ' familial hyperlipoproteinemia type II ', ' familial hyperlipoproteinemia type 2 ', ' familial hypercholesteremia ', ' familial hyperbetalipoproteinemia ', ' Type II Hyperlipidemia ', ' Type 2 Hyperlipidemia ', ' Hyperlipoproteinemia Type II ', ' Hyperlipoproteinemia Type 2 ', ' Hyperbetalipoproteinemia ', ' Essential Hypercholesterolemia ', ' Familial Hypercholesterolemia ', ' Institutes ', ' Internal Medicine ', ' heavy metal lead ', ' heavy metal Pb ', ' Pb element ', ' Lead ', ' Leadership ', ' Lipids ', ' beta-Lipoproteins ', ' LDL Lipoproteins ', ' LDL ', ' Low-Density Lipoproteins ', ' beta-Lipoprotein Cholesterol ', ' Low Density Lipoprotein Cholesterol ', ' LDL Cholesterol ', ' LDL Cholesterol Lipoproteins ', ' Massachusetts ', ' Medicine ', ' Mentorship ', ' Methods ', ' statistical linear models ', ' statistical linear mixed models ', ' Probability Models ', ' Probabilistic Models ', ' Statistical Models ', ' DNA Molecular Biology ', ' Molecular Biology ', ' genome mutation ', ' Genetic defect ', ' Genetic Change ', ' Genetic Alteration ', ' Mutation ', ' National Institutes of Health ', ' NIH ', ' United States National Institutes of Health ', ' Phenotype ', ' Physicians ', ' Quality Control ', ' Research ', ' Risk ', ' Technology ', ' Testing ', ' Time ', ' United States ', ' Veterans ', ' Work ', ' Generations ', ' symposia ', ' summit ', ' convention ', ' conference ', ' symposium ', ' health care ', ' Healthcare ', ' Dataset ', ' Data Set ', ' base ', ' improved ', ' Solid ', ' Clinical ', ' premature ', ' prematurity ', ' Variant ', ' Variation ', ' Physiological ', ' Physiologic ', ' Biochemical ', ' Medical ', ' Link ', ' Evaluation ', ' Training ', ' insight ', ' Individual ', ' African ', ' Amish ', ' European ', ' Family history of ', ' Family Medical History Epidemiology ', ' Family Medical History ', ' Funding ', ' Ethnic Origin ', ' Ethnicity ', ' Collaborations ', ' Genetic ', ' Exposure to ', ' Knowledge ', ' Catalogs ', ' programs ', ' Scientist ', ' Investigation ', ' Clinic ', ' Penetrance ', ' experience ', ' Gene Mutation ', ' Gene Alteration ', ' success ', ' cohort ', ' trait ', ' skills ', ' novel ', ' Prevention strategy ', ' Preventive strategy ', ' Preventative strategy ', ' disorder risk ', ' disease risk ', ' Environmental Risk Factor ', ' environmental risk ', ' Environmental Factor ', ' Prevention ', ' Positioning Attribute ', ' Position ', ' genetic analysis ', ' Genetic analyses ', ' Pathway Analysis ', ' Network Analysis ', ' Modeling ', ' career development ', ' Genomics ', ' heart disease risk ', ' heart disorder risk ', ' cardiac disorder risk ', ' cardiac disease risk ', ' Pathogenicity ', ' metabonomics ', ' metabolism measurement ', ' metabolomics ', ' genome sequencing ', ' Mediator of activation protein ', ' Mediator of Activation ', ' Mediator ', ' Preventive ', "" Bachelor's Degree "", ' Undergraduate Degree ', ' Baccalaureate Degree ', ' Data ', ' Disease Pathway ', "" Master's Degree "", ' K-Series Research Career Programs ', ' Research Career Program ', ' K-Awards ', ' Career Development Programs K-Series ', ' Career Development Awards and Programs ', ' Career Development Awards ', ' in vivo ', ' lifestyle factors ', ' life-style factor ', ' Principal Investigator ', ' Development ', ' developmental ', ' Electronic Health Record ', ' electronic healthcare record ', ' electronic health care record ', ' Pathway interactions ', ' pathway ', ' National Heart, Lung, and Blood Institute ', ' NHLBI ', ' National Human Genome Research Institute ', ' National Center for Human Genome Research ', ' NHGRI ', ' biomedical informatics ', ' biomed informatics ', ' next generation ', ' novel strategies ', ' novel strategy ', ' novel approaches ', ' new approaches ', ' Population ', ' Prevalence ', ' Network-based ', ' human disease ', ' high risk ', ' public health relevance ', ' non-genetic ', ' nongenetic ', ' biobank ', ' biorepository ', ' Cloud Computing ', ' cloud computer ', ' Cloud Infrastructure ', ' cloud based ', ' precision medicine ', ' precision-based medicine ', ' genomic variation ', ' Mendelian disorder ', ' single-gene disorder ', ' single-gene disease ', ' monogenic disorder ', ' monogenic disease ', ' Mendelian genetic disorder ', ' Mendelian disease ', ' human genomics ', ' whole genome ', ' full genome ', ' entire genome ', ' Preventive therapy ', ' Preventative therapy ', ' Trans-Omics for Precision Medicine ', ' TOPMed ', ' Risk stratification ', ' DNA sequencing ', ' DNAseq ', ' DNA seq ', ' Genetic Diseases ', ' genetic disorder ', ' genetic condition ', ' machine learning algorithm ', ' risk prediction model ', ' ']",NHLBI,MASSACHUSETTS GENERAL HOSPITAL,K08,2019,170003,MA-08,0.12664327181676716
