text,title,id,project_number,terms,administration,organization,mechanism,year,award_amount,cong_dist,score
"Unraveling molecular and system-level mechanisms of human disease-associated protein mutations Project Summary Although a quickly expanding catalogue of protein mutations have been discovered, including those that cause human diseases or confer drug resistance, mechanistic understanding and prediction of functional consequences of these mutations remain rather limited. There is a critical need to develop novel, multiscale computational frameworks that are rigorous and generalizable to help close the ever-increasing gap between phenotypic data and mechanistic knowledge about the mutations and to develop effective therapeutic strategies.  My long-term research goals are two folds: (1) to unravel how a change in protein sequence ripples through various aspects of molecular and system-levels to a change in cellular function and cause human diseases or confer drug resistance; and (2) to translate learned mechanistic knowledge to effective drug-design strategies for human diseases and drug resistance. Toward these goals I propose to advance and combine the strengths of computational molecular biology (structural modeling and design for proteins or protein interactions) and computational systems biology (pathway/network-level topology and dynamics) and follow a novel, formal paradigm to develop methods that systematically identify mechanisms underlying various stages of consequence propagation (from conformation, molecular and system-level variables, to cellular functions, where intermediates can be skipped if necessary). In the forward direction of propagating consequences, I will determine, explain and understand mutational consequences at various levels with machine learning, causal analysis, and combinatorial optimization, starting with known or modelled changes at various levels. In the inverse direction of designing consequences, I will follow known or learned mechanistic hypotheses and develop efficient combinatorial optimization methods to design mutagenesis experiments or screen / design ligands for desired perturbations at various levels, which would test and refine corresponding hypotheses directly and translate mechanistic hypotheses to therapeutic strategies. Mechanisms underlying distal (potentially allosteric) mutations, multiple mutations within a protein or across proteins as well as systems pharmacology strategies will also be rigorously determined in the process.  The expected outcomes from the innovative project will include two main components. The first will be both biophysical principles of proteins and integrative understanding of biomedical systems, which will be organized in a database for public access. The second will be translating mechanistic insights into therapeutic intervention strategies to treat diseases. In particular, targeted experiments (mutagenesis or ligand-binding) will be designed following known or discovered mechanistic hypotheses. This project will involve close collaboration with structural biologists and clinician-scientists who are active collaborators of the PI. Project Narrative Genetic mutations, many of which lead to protein mutations, are often associated with human diseases: they often directly cause diseases or contribute to their progressions. Understanding mechanisms by which these mutations lead to significant functional consequences is of extreme importance to developing effective therapeutics to cure diseases and ameliorate drug resistance.",Unraveling molecular and system-level mechanisms of human disease-associated protein mutations,9564155,R35GM124952,"['Amino Acid Sequence ', ' protein sequence ', ' Primary Protein Structure ', ' Biophysics ', ' biophysical sciences ', ' biophysical principles ', ' biophysical foundation ', ' Cell physiology ', ' Subcellular Process ', ' Cellular Process ', ' Cellular Physiology ', ' Cellular Function ', ' Cell Process ', ' Cell Function ', ' Disease ', ' Disorder ', ' Drug Design ', ' Drug resistance ', ' resistant to Drug ', ' resistance to Drug ', ' drug resistant ', ' Goals ', ' Lead ', ' heavy metal lead ', ' heavy metal Pb ', ' Pb element ', ' Ligands ', ' Methods ', ' Structural Models ', ' Molecular Conformation ', ' conformational state ', ' conformation ', ' Molecular Stereochemistry ', ' Molecular Configuration ', ' Mutation ', ' genome mutation ', ' Genetic defect ', ' Genetic Change ', ' Genetic Alteration ', ' Pharmacology ', ' Protein Engineering ', ' protein design ', ' genetic protein engineering ', ' Proteins ', ' Research ', ' Testing ', ' Translating ', ' Mutagenesis ', ' Mutagenesis Molecular Biology ', ' Genetics-Mutagenesis ', ' Distal ', ' insight ', ' data base ', ' Data Bases ', ' Databases ', ' Collaborations ', ' Therapeutic ', ' Machine Learning ', ' support vector machine ', ' statistical learning ', ' kernel methods ', ' Knowledge ', ' Catalogs ', ' Scientist ', ' System ', ' novel ', ' Therapeutic Intervention ', ' intervention therapy ', ' Modeling ', ' Intervention ', ' interventional strategy ', ' Intervention Strategies ', ' Disease Resistance ', ' resistant to disease ', ' resistant disease ', ' resistance to disease ', ' Computational Molecular Biology ', ' Systems Biology ', ' DNA Sequence Alteration ', ' genomic alteration ', ' Sequence Alteration ', ' Genetic mutation ', ' DNA mutation ', ' DNA Alteration ', ' Structural Biologist ', ' Ligand Binding ', ' Molecular ', ' Process ', ' pathway ', ' Pathway interactions ', ' computational framework ', ' computer framework ', ' designing ', ' design ', ' therapy efficacy ', ' therapeutically effective ', ' therapeutic efficacy ', ' intervention efficacy ', ' Treatment Efficacy ', ' Outcome ', ' innovative ', ' innovate ', ' innovation ', ' human disease ', ' Combinatorial Optimization ', ' phenotypic data ', ' experimental research ', ' experiment ', ' experimental study ', ' ']",NIGMS,TEXAS ENGINEERING EXPERIMENT STATION,R35,2018,335245,TX-17,0.18895753745202024
"APPLYING ERROR-CORRECTED SEQUENCING TO DETECT MINIMAL RESIDUAL IN THE AAML 1031 STUDY Abstract  Acute myeloid leukemia (AML) accounts for half of all pediatric leukemia deaths and is the leading cause of leukemia-related death in adulthood. One reason for worse outcomes is the inability to properly assess for minimal residual disease (MRD) following therapy. Unlike ALL, AML presents with multiple subclonal populations without a singular clonal surface marker, and surface markers can change during therapy. The current gold standard for AML MRD is multi-parameter flow cytometry (MPFC), which is predictive of outcomes to frequencies of 0.001, yet 30% of MPFC-MRD-negative patients still relapse. Alternatively, every AML case harbors leukemia-specific mutations that could be markers of disease, except that next-generation sequencing has high error rate of ~1%. In this proposal, we will implement a novel, validated error-corrected sequencing (ECS) strategy, developed by the Druley lab in collaboration with Illumina, to improve MRD assessment of AML subclonal heterogeneity in 990 pediatric de novo AML cases from the Children's Oncology Group AAML1031 study. We hypothesize that using a highly sensitive sequencing method will improve identification of residual AML, provide important insights on subclonal heterogeneity in pediatric AML, improve understanding of the role of germline variability and gene function on relapses or refractory disease and facilitate personalized medicine. To interrogate this hypothesis, we propose the following aims: 1. Define subclonal heterogeneity at diagnosis and end of Induction 1 (EOI1) in 990 pediatric de novo  AML patients (n=1890). By using the largest prospective study of pediatric AML that has ever been  performed, we will perform ECS on 94 genes that are the most frequently mutated genes in pediatric and  adult AML at diagnosis and EOI1 to identify patterns of mutation associated with relapsed disease, FAB  subtypes or other cytogenetic features. 2. Correlate ECS-MRD with existing EOI1 MPFC-MRD for all participants in the COG AAML1031 study.  A major question is whether the different from normal cell population identified as residual disease by  MPFC is actually the same population(s) identified by ECS. We will define residual disease by ECS and  compare results to MPFC status (positive/negative), actual MPFC percentages (<0.001) and the clinical  outcomes (relapse risk, disease-free survival and overall survival) of study participants. 3. Integrate germline variation and all subclonal mutations into mechanistic groups that are frequently  mutated in pediatric AML and correlate with outcomes using unbiased machine learning  algorithms. Preliminary data tells us that every patient will have multiple subclones at diagnosis and EOI1  as well as germline variants in AML-associated genes, which may be important for outcome. In this aim, we  will take these mutations into account as well as MPFC, clinical features and cytogenetics for probabilistic  risk assessment using unsupervised machine learning algorithms for improved outcome prognostication. Narrative We have developed Error-Corrected Sequencing (ECS) that enables the highly accurate detection of leukemia- specific mutations in heterogeneous DNA samples to a limit of 0.0001. We will perform ECS with a panel of 94 frequently mutated genes in adult and pediatric AML in matched diagnostic and end of Induction 1 bone marrow samples from 990 pediatric de novo AML patients enrolled on the Children's Oncology Group AAML1031 protocol, which is the largest pediatric AML trial ever performed in North America. With these data, we can truly understand subclonal heterogeneity in pediatric AML, significantly improve minimal residual disease testing in pediatric AML, and integrate these data into an unbiased multivariate probability platform taking into account individual sequencing, flow cytometry, cytogenetic and clinical features to provide truly personalized cancer care.",APPLYING ERROR-CORRECTED SEQUENCING TO DETECT MINIMAL RESIDUAL IN THE AAML 1031 STUDY,9395904,R01CA211711,"['Adult ', ' adulthood ', ' Adult Human ', ' 21+ years old ', ' Algorithms ', ' Alleles ', ' Allelomorphs ', ' Bone Marrow ', ' Bone Marrow Reticuloendothelial System ', ' Cytogenetics ', ' Cessation of life ', ' Death ', ' Diagnosis ', ' Disease ', ' Disorder ', ' DNA ', ' Deoxyribonucleic Acid ', ' Exons ', ' Family ', ' Flow Cytometry ', ' flow cytophotometry ', ' Flow Microfluorometry ', ' Flow Microfluorimetry ', ' Flow Cytofluorometry ', ' Flow Cytofluorometries ', ' Future ', ' Genes ', ' Goals ', ' Gold ', ' leukemia ', ' Acute Myelocytic Leukemia ', ' acute myeloid leukemia ', ' acute granulocytic leukemia ', ' Acute Myelogenous Leukemia ', ' Acute Myeloblastic Leukemia ', ' AML - Acute Myeloid Leukemia ', ' Methods ', ' Methodology ', ' Mutation ', ' genome mutation ', ' Genetic defect ', ' Genetic Change ', ' Genetic Alteration ', ' United States National Institutes of Health ', ' National Institutes of Health ', ' NIH ', ' North America ', ' Oncogenes ', ' Transforming Genes ', ' Cancer-Promoting Gene ', ' Cancer Genes ', ' Patients ', ' Protein phosphatase ', ' Protein Phosphatase-2A ', ' Protein Phosphatase-1 ', ' Protein Phosphatase Gene ', ' Protein Phosphatase C ', ' Phosphoprotein Phosphohydrolase ', ' Phosphoprotein Phosphatase-2C ', ' Phosphoprotein Phosphatase ', ' Probability ', ' Prospective Studies ', ' Protein Tyrosine Kinase ', ' tyrosyl protein kinase ', ' hydroxyaryl protein kinase ', ' Tyrosylprotein Kinase ', ' Tyrosine-Specific Protein Kinase ', ' Tyrosine-Protein Kinase Receptor EEK ', ' Tyrosine Kinase ', ' Protein Tyrosine Kinase EEK ', ' Ephrin Type-A Receptor 8 Precursor ', ' Ephrin Type-A Receptor 8 ', ' EPH-and ELK-Related Kinase ', ' EPH- and ELK-Related Tyrosine Kinase ', ' Reagent ', ' Relapse ', ' Risk ', ' Role ', ' social role ', ' Testing ', ' Time ', ' transcription factor ', ' Transcription factor genes ', ' Transcription Factor Proto-Oncogene ', ' General Transcription Factors ', ' General Transcription Factor Gene ', ' Basal transcription factor genes ', ' Basal Transcription Factor ', ' Immunophenotyping ', ' immunophenotype ', ' Immunologic Subtyping ', ' Measures ', ' falls ', ' Risk Assessment ', ' Point Mutation ', ' Spliceosomes ', ' analytical method ', ' base ', ' improved ', ' Site ', ' Surface ', ' Clinical ', ' Residual ', ' Residual state ', ' Phase ', ' Variation ', ' Variant ', ' Adult Acute NonLymphocytic Leukemia ', ' Adult Acute NonLymphoblastic Leukemia ', ' Adult Acute Non-Lymphocytic Leukemia ', ' Adult Acute Non-Lymphoblastic Leukemia ', ' Adult Acute Myeloid Leukemia ', ' Adult Acute Myelogenous Leukemia ', ' Adult Acute Myelocytic Leukemia ', ' Adult Acute Granulocytic Leukemia ', ' Adult ANLL ', ' Adult AML ', ' Adult AGL ', ' Adult Acute Myeloblastic Leukemia ', ' Pediatric Acute Myeloid Leukemia ', ' Pediatric Acute Myelogenous Leukemia ', ' Pediatric Acute Myelocytic Leukemia ', ' Pediatric Acute Myeloblastic Leukemia ', ' Pediatric AML ', ' Childhood Acute Myelogenous Leukemia ', ' Childhood Acute Myelocytic Leukemia ', ' Childhood Acute Myeloblastic Leukemia ', ' Childhood Acute Granulocytic Leukemia ', ' Childhood AML ', ' Childhood Acute Myeloid Leukemia ', ' prognostic ', ' pediatric ', ' Childhood ', ' insight ', ' Individual ', ' Minimal Residual Disease ', ' Detectable Residual Disease ', ' Residual Neoplasm ', ' Gene Targeting ', ' Event-Free Survival ', ' Disease-Free Survival ', ' Relapsed Disease ', ' Recurrent disease ', ' Collaborations ', ' Genetic ', ' gene function ', ' Diagnostic ', ' Machine Learning ', ' support vector machine ', ' statistical learning ', ' kernel methods ', ' Investigation ', ' Frequencies ', ' Complex ', ' Protocols documentation ', ' Protocol ', ' Pattern ', ' Residual Tumors ', ' residual disease ', ' Tumor Suppressor Proteins ', ' tumor suppressor ', ' cohesion ', ' functional group ', ' novel ', ' Participant ', ' Categories ', ' Sampling ', ' response ', ' nucleocytoplasmic transport ', ' Nucleocytoplasmic Shuttling ', ' Nuclear Transport ', ' Cell Nucleus Active Transport ', ' Bortezomib ', ' Normal Cell ', ' Childhood Leukemia ', ' leukemia in children ', ' children with leukemia ', ' Pediatric Leukemia ', ' FLT3 gene ', ' Stem Cell Tyrosine Kinase 1 ', ' STK1 ', ' Fms-Related Tyrosine Kinase 3 ', ' FLT3 ', ' FLK2 ', ' DNA Sequence Alteration ', ' genomic alteration ', ' Sequence Alteration ', ' Genetic mutation ', ' DNA mutation ', ' DNA Alteration ', ' Data ', ' Detection ', ' Disease Marker ', ' Mutate ', ' Refractory Disease ', ' Resolution ', ' Sorafenib ', ' BAY 54-9085 ', ' Clinical Data ', ' enroll ', ' Enrollment ', ' Epigenetic Mechanism ', ' Epigenetic Change ', ' Epigenetic ', ' Epigenetic Process ', "" Children's Oncology Group "", ' Pediatric Oncology Group ', ' Monitor ', ' digital ', ' designing ', ' design ', ' next generation ', ' therapy efficacy ', ' therapeutically effective ', ' therapeutic efficacy ', ' intervention efficacy ', ' Treatment Efficacy ', ' Outcome ', ' Population ', ' prospective ', ' chemotherapy ', ' biomarker ', ' biologic marker ', ' bio-markers ', ' Biological Markers ', ' Randomization trial ', ' randomized trial ', ' nextgen sequencing ', ' next gen sequencing ', ' NGS system ', ' NGS Method ', ' next generation sequencing ', ' personalized treatment ', ' personalized therapy ', ' personalization of treatment ', ' personalized medicine ', ' child patients ', ' pediatric patients ', ' leukemia treatment ', ' personalized cancer care ', ' predictors of outcomes ', ' predictive outcomes ', ' outcome prediction ', ' specific biomarkers ', ' improved outcome ', ' relapse risk ', ' sub-clonal heterogeneity ', ' subclonal heterogeneity ', ' Risk stratification ', ' DNAseq ', ' DNA seq ', ' DNA sequencing ', ' unsupervised machine learning ', ' unsupervised learning ', ' ']",NCI,WASHINGTON UNIVERSITY,R01,2018,352587,MO-01,0.07065056628137568
"Massively parallel functional analyses of human PTEN variants Project Summary  We are now able to routinely sequence human genomes at single-base resolution. However, our ability to interpret the functional consequences of detected mutations has lagged behind. Computational approaches scale well but have poor accuracy, whereas retrospective analysis of detected variants has high accuracy but does not scale well. In order to solve this problem, a new experimental paradigm has emerged to empirically characterize the effects of mutations with high accuracy at scale. This approach takes advantage of recent and ongoing improvements in DNA synthesis and sequencing, and has the potential to offer unprecedented insight into protein biochemistry and human disease. We believe these insights will prove to be critical for unlocking the potential of genomic medicine.  In this project we seek to comprehensively assess multiple molecular effects of PTEN mutations on protein function, and assess the utility of this data as a predictor for human clinical phenotype. The PTEN protein is a tumor suppressor that is frequently mutated in diverse human cancers and in the germline of some individuals with overgrowth disorders, cancer predisposition syndromes, or autism. Currently, it is impossible to predict the effects of the vast majority of PTEN germline mutations. Since the phenotypic spectrum of PTEN mutation carriers is broad, it would be highly valuable to understand the ways in which phenotypic outcomes arise from PTEN mutation genotypes.  In Aim 1, we will first employ a yeast-based screen to assess the effects all PTEN single amino acid mutations on lipid phosphatase activity, the primary biochemical function of PTEN protein. It is known that several pathogenic variants are destabilized. Therefore, in Aim 2, we will perform a second, independent screen to assess the steady state protein stability of all PTEN single amino acid mutations. In Aim 3, we will use the data derived from this study as well as publically available biochemical information to train a classifier model to predict the relationship between the mutation genotypes and clinical phenotypes observed in humans. These data will increase our fundamental understanding of PTEN function and the role of mutations in diverse disorders, and could provide a valuable clinical tool that would increase the quality of life for PTEN mutation carriers. Project Narrative  Mutations in the gene PTEN are causal for a diverse set of clinical disorders ranging from cancer to autism spectrum disorder. Here, we seek to gain new fundamental insights into the functional relationships between PTEN mutations and clinical presentations by prospectively characterizing the effects of all single amino acid PTEN mutations in parallel. These data will allow the creation of new models that can predict risk of specific PTEN mutations for different clinical outcomes and potentially lead to personalized therapies, early interventions, and optimal outcomes for PTEN mutation carriers.",Massively parallel functional analyses of human PTEN variants,9794010,F31HD095571,"['Affect ', ' Amino Acids ', ' aminoacid ', ' Biochemistry ', ' Biological Chemistry ', ' Biological Assay ', ' Biologic Assays ', ' Bioassay ', ' Assay ', ' Biology ', ' Biophysics ', ' biophysical sciences ', ' biophysical principles ', ' biophysical foundation ', ' Malignant Neoplasms ', ' neoplasm/cancer ', ' malignancy ', ' Malignant Tumor ', ' Cancers ', ' Cataloging ', ' cell sorting ', ' Cell Separation Technology ', ' Cell Segregation ', ' Cell Isolation ', ' Cell Separation ', ' Cell Viability ', ' Cell Survival ', ' Cell Body ', ' Cells ', ' Disorder ', ' Disease ', ' Fluorescence ', ' Genes ', ' Genome ', ' human whole genome ', ' Human Genome ', ' Genotype ', ' Goals ', ' ontogeny ', ' Tissue Growth ', ' Generalized Growth ', ' Growth ', ' Modern Man ', ' Human ', ' Human Genetics ', ' heavy metal lead ', ' heavy metal Pb ', ' Pb element ', ' Lead ', ' Photoradiation ', ' Light ', ' Lipids ', ' Metabolic Processes ', ' Intermediary Metabolism ', ' Metabolism ', ' genome mutation ', ' Genetic defect ', ' Genetic Change ', ' Genetic Alteration ', ' Mutation ', ' Patients ', ' Phenotype ', ' PtdIns ', ' Phosphoinositides ', ' Phosphatidyl Inositol ', ' Inositol Phospholipids ', ' Inositol Phosphoglycerides ', ' Inositide Phospholipids ', ' Phosphatidylinositols ', ' Phosphomonoesterases ', ' Phosphohydrolases ', ' Phosphatases ', ' Phosphoric Monoester Hydrolases ', ' Play ', ' Problem Solving ', ' Proteins ', ' QOL ', ' Quality of life ', ' Risk ', ' social role ', ' Role ', ' Signal Pathway ', ' biological signal transduction ', ' Signaling ', ' Signal Transduction Systems ', ' Intracellular Communication and Signaling ', ' Cell Signaling ', ' Cell Communication and Signaling ', ' Signal Transduction ', ' Syndrome ', ' Temperature ', ' Testing ', ' Time ', ' Yeasts ', ' Measures ', ' Dataset ', ' Data Set ', ' base ', ' improved ', ' Site ', ' Clinical ', ' Variant ', ' Variation ', ' Biochemical ', ' Pythons ', ' Germ-Line Mutation ', ' Hereditary Mutation ', ' Germline Mutation ', ' Predisposition ', ' Susceptibility ', ' Training ', ' insight ', ' Individual ', ' Early Intervention ', ' tool ', ' Machine Learning ', ' support vector machine ', ' statistical learning ', ' kernel methods ', ' Catalogs ', ' Complex ', ' Clinic ', ' Reaction ', ' Techniques ', ' Tumor Suppressor Proteins ', ' tumor suppressor ', ' DNA biosynthesis ', ' DNA Synthesis ', ' DNA Replication ', ' novel ', ' PTEN gene ', ' Phosphatase and Tensin Homolog Deleted on Chromosome 10 ', ' Phosphatase and Tensin Homolog ', ' PTEN1 ', ' PTEN Hamartoma Tumor Syndrome With Granular Cell Tumor ', ' PTEN Hamartoma Tumor Syndrome ', ' PTEN ', ' PHTS protein ', ' PHTS gene ', ' Mutated in Multiple Advanced Cancers 1 ', ' MMAC1 ', ' Therapeutic Intervention ', ' intervention therapy ', ' Modeling ', ' high throughput technology ', ' Genomics ', ' Pathogenicity ', ' FRAP1 gene ', ' mammalian target of rapamycin ', ' mTOR ', ' RAFT1 ', ' Mechanistic Target of Rapamycin ', ' FRAP2 ', ' FRAP1 ', ' FKBP12 Rapamycin Complex Associated Protein 1 ', ' FK506 Binding Protein 12-Rapamycin Associated Protein 1 ', ' fitness ', ' autism spectrum disorder ', ' autistic spectrum disorder ', "" Kanner's Syndrome "", ' Infantile Autism ', ' Early Infantile Autism ', ' Autistic Disorder ', ' Autism ', ' Data ', ' Deletion Mutation ', ' Mutate ', ' Protein Biochemistry ', ' Protein/Amino Acid Biochemistry ', ' Resolution ', ' Ubiquitination ', ' ubiquitin conjugation ', ' ubiquination ', ' Ubiquitinoylation ', ' Ubiquitilation ', ' Yeast Model System ', ' yeast model ', ' Characteristics ', ' Molecular ', ' Process ', ' protein function ', ' Development ', ' developmental ', ' PTEN protein ', ' phosphatase and tensin homologue on chromosome ten ', ' mutated in multiple advanced cancers 1 protein ', ' MMAC1 protein ', ' Pathway interactions ', ' pathway ', ' clinical phenotype ', ' predictive modeling ', ' prognostic model ', ' prediction model ', ' computer based prediction ', ' next generation ', ' Outcome ', ' tumorigenic ', ' prospective ', ' Coupled ', ' Coupling ', ' synthetic biology ', ' open source ', ' human disease ', ' mutation carrier ', ' screening ', ' personalized medicine ', ' personalized treatment ', ' personalized therapy ', ' personalization of treatment ', ' accurate diagnosis ', ' genomic variation ', ' Genomic medicine ', ' prediction algorithm ', ' predictor algorithm ', ' predictive algorithm ', ' genomic signature ', ' genomic classifier ', ' experimental study ', ' experimental research ', ' experiment ', ' DNA sequencing ', ' DNAseq ', ' DNA seq ', ' ']",NICHD,OREGON HEALTH & SCIENCE UNIVERSITY,F31,2019,45016,OR-03,0.26862667958260855
