text,title,id,project_number,terms,administration,organization,mechanism,year,award_amount,cong_dist,score
"High-resolution map of human germline mutation patterns and inference of mutagenic mechanisms     DESCRIPTION (provided by applicant): Mutations are the ultimate source of genetic variation and one of the driving forces of evolution. Both the absolute mutation rate and the relative rate among mutation subtypes fluctuate along the genome, affected by adjacent nucleotide motifs and local features such as GC content and replication timing. Characterizing regional variation of mutation patterns is critical for understanding genome evolution and to identify variants causing genetic diseases. However, mutation rate and molecular spectrum are difficult to measure at high resolution, genomewide, and in an unbiased fashion. Estimates based on common variants and between- species substitutions are confounded by natural selection, population demographic history, and biased gene conversion (BGC). Methods relying on incidence rates of monogenic diseases or finding de novo variants by trio sequencing can inform global trends, but do not provide sufficient data to assess fine-scale local parameters. This study will overcome these limitations by using the extremely rare variants (ERVs) as a new data source to characterize patterns of recent germline variation in humans. ERVs, defined in this study as singletons in 30,000 samples, are becoming available via large-scale whole-genome sequencing (WGS) of population samples. Unlike common variants or substitutions, ERVs arose very recently and are largely unaffected by selection, BGC, etc. We will analyze 200-300 million singleton variants observed in 30,000 subjects at 20-30X coverage. The regional distribution of ERV subtypes will establish a quantitative atlas of the rate and spectrum of human germline mutations mostly unaltered by selection. We will share this resource with the research community and apply it to determine the impact of local genomic features and epigenomic attributes. We will use the systematic departures between ERVs and variants of higher frequencies (polymorphisms and substitutions) to infer local effects of selection, and this may uncover hitherto unknown functional regions of the genome. By comparing mutation signatures in ERVs with those in somatic variations observed in diverse cancers we will attribute distinct mutational signatures to known biochemical processes and thus infer the major contributors to new germline mutations in the human genome. This subtype-specific atlas will also be used to predict the probability of observing every possible single-base mutation in the genome, thus facilitating the interpretation of candidate causal variants of human diseases. We will assess mutation pattern differences among European Americans, African Americans and Latinos, and seek to discover genetic modifiers of germline mutation rate by finding functionally damaging mutations that show increased ERV counts in the surrounding genomic region, potentially identifying both known and previous unknown ""mutator"" genes that play a role in transmission fidelity in humans. This research will provide an essential resource to study the genesis and maintenance of germline mutations in humans. Understanding such a fundamental process will be the basis for a deeper understanding of human evolution and diseases.         PUBLIC HEALTH RELEVANCE: We will study the patterns of inherited mutations in humans using approximately 250 million extremely rare DNA variants in human populations. Our results will allow the prediction of the rate of new mutations at every site in the genome based on features of the surrounding DNA sequence, thus providing a common resource to study the arrival and maintenance of mutations in humans. Understanding such a basic process is important for answering fundamental questions in human evolution, the cause of inherited diseases, and the role of DNA abnormality in cancer and aging.            ",High-resolution map of human germline mutation patterns and inference of mutagenic mechanisms,9083570,R01GM118928,"['Affect ', ' Aging ', ' Algorithms ', ' Allelomorphs ', ' Alleles ', ' Atlases ', ' Biologic Factor ', ' Biological Factors ', ' Biology ', ' neoplasm/cancer ', ' malignancy ', ' Malignant Tumor ', ' Cancers ', ' Malignant Neoplasms ', ' youngster ', "" childrens' "", ' children ', ' Children (0-21) ', ' Child Youth ', ' 0-11 years old ', ' Child ', ' Chromatin ', ' Communities ', ' data interpretation ', ' Data Analysis ', ' Data Analyses ', ' Data Sources ', ' Demographic Factors ', ' Disorder ', ' Disease ', ' Deoxyribonucleic Acid ', ' DNA ', ' Evolution ', ' Family ', ' Foundations ', ' Future ', ' Gene Conversion ', ' Genes ', ' Genome ', ' human whole genome ', ' Human Genome ', ' hereditary disorder ', ' genetic disorder ', ' Molecular Disease ', ' Genetic Diseases ', ' Genetic Condition ', ' Hereditary Disease ', ' History ', ' Recording of previous events ', ' Modern Man ', ' Human ', ' Human Genetics ', ' Incidence ', ' Maintenance ', ' Maps ', ' Methods ', ' genome mutation ', ' Genetic defect ', ' Genetic Change ', ' Genetic Alteration ', ' Mutation ', ' Nucleotides ', ' Parents ', ' Play ', ' polymorphism ', ' Genetic Polymorphism ', ' Probability ', ' Recombination ', ' DNA Recombination ', ' Genetic Recombination ', ' Research ', ' Research Resources ', ' Resources ', ' Rest ', ' social role ', ' Role ', ' Selection Bias ', ' Technology ', ' Time ', ' Body Tissues ', ' Tissues ', ' Variation (Genetics) ', ' Genetic Variation ', ' Genetic Diversity ', ' Weight ', ' Generations ', ' Measures ', ' Mutagenesis ', ' Mutagenesis Molecular Biology ', ' Genetics-Mutagenesis ', ' African American ', ' black American ', ' Black Populations ', ' Afroamerican ', ' Afro American ', ' Latino ', ' Natural Selections ', ' Data Set ', ' Dataset ', ' DNA Sequence ', ' base ', ' density ', ' improved ', ' Site ', ' Variation ', ' Variant ', ' Hereditary Mutation ', ' Germline Mutation ', ' Germ-Line Mutation ', ' Individual ', ' European ', ' Biological Function ', ' Biological Process ', ' world wide web ', ' web ', ' WWW ', ' Internet ', ' Genetic ', ' support vector machine ', ' statistical learning ', ' kernel methods ', ' Machine Learning ', ' Frequencies ', ' Hereditary ', ' Inherited ', ' Complex ', ' Dependence ', ' Source ', ' Pattern ', ' Techniques ', ' Somatic Mutation ', ' American ', ' environmental risk ', ' Environmental Factor ', ' Environmental Risk Factor ', ' Position ', ' Positioning Attribute ', ' Modeling ', ' Sampling ', ' repository ', ' Genomics ', ' Guanine + Cytosine Content ', ' GC Content ', ' GC Composition ', ' G+C Content ', ' G+C Compositions ', ' Guanine + Cytosine Composition ', ' Pathogenicity ', ' Post-Replication Mismatch Repair ', ' Mismatch Repair ', ' genetic evolution ', ' genome sequencing ', ' Address ', ' Biochemical Process ', ' Data ', ' Resolution ', ' Resource Sharing ', ' genomic region ', ' Genomic Segment ', ' Transmission ', ' transmission process ', ' trend ', ' Molecular ', ' Process ', ' epigenomics ', ' Population ', ' driving force ', ' human disease ', ' prototype ', ' public health relevance ', ' genome-wide ', ' genomewide ', ' genome scale ', ' sharing data ', ' next generation sequencing ', ' nextgen sequencing ', ' next gen sequencing ', ' NGS system ', ' NGS Method ', ' rare variant ', ' rare allele ', ' High-Throughput Nucleotide Sequencing ', ' High-Throughput Sequencing ', ' Mendelian disorder ', ' single-gene disorder ', ' single-gene disease ', ' monogenic disorder ', ' monogenic disease ', ' Mendelian genetic disorder ', ' Mendelian disease ', ' actionable mutation ', ' driver mutation ', ' whole genome ', ' entire genome ', ' ']",NIGMS,UNIVERSITY OF MICHIGAN AT ANN ARBOR,R01,2016,300999,MI-12,0.19527015365396436
"Functional Annotation of Natural and Disease Variants in Tryosine Kinases     DESCRIPTION (provided by applicant): Protein tyrosine kinases are dynamic molecular switches that toggle between a catalytically ""on"" and ""off"" state to turn on and off signals responsible for cell growth and survival. While the tyrosine kinase switch is tightly regulated by  diverse array of structural mechanisms in normal states, in many disease states, the switch is permanently turned on or off due, in part, to mutations in the tyrosine kinase domain. Although genome sequencing studies have revealed the mutational patterns of tyrosine kinases from many different disease types, understanding the structural and functional impact of these mutations is a challenge because many recurrent mutations occur far from the active site (distal mutations) and the residue networks that contribute to the complex modes of tyrosine kinase allosteric regulation are not fully understood. Our long term goal is to understand the relationships connecting sequence, structure, function, regulation and disease in protein kinases using a combination of computational and experimental approaches. Our objective in this proposal, which is the next logical step toward attainment of our long-term goal, is to delineate the residue interaction networks that contribute to the unique modes of allosteric regulation in tyrosine kinases, and to develop a computational framework for predicting mutation impact using the evolutionary and allosteric properties encoded in three dimensional structures. The central hypothesis is that distal mutations alter evolutionarily conserved allosteric networks in tyrosine kinases, and delineating the allosteric networks unique to tyrosine kinases will provide context for predicting and testing disease mutation impact. The specific aims are: * To identify and characterize natural sequence and structural variants associated with tight  allosteric control of tyrosine kinase activity * To develop a computational framework for predicting mutation impact on kinase activation and to  experimentally validate computational predictions using selected receptor tyrosine kinases as  model systems Successful completion of these aims is expected to reveal novel activating mutations in putative allosteric sites in the tyrosine kinase domain, and pinpoint key residues and interactions for functional studies. These outcomes, in turn, are expected to have major biomedical impact by accelerating the functional characterization of the mutated tyrosine kinome, which is emerging as a major target for personalized medicine. Finally, by providing detailed mechanistic annotation of mutations identified in genome sequencing studies, this proposal will address a fundamental NIH roadmap problem in translational medicine of converting genomic discoveries into therapeutic strategies. PUBLIC HEALTH RELEVANCE: Protein tyrosine kinases are a biomedically important class of proteins that are abnormally regulated in many human diseases including cancer, diabetes, and inflammatory disorders, to name but a few. They have been the focus of many drug discovery efforts and genome sequencing studies because of the therapeutic potential of targeting mutated tyrosine kinases for personalized therapy. By providing functional annotation of natural and disease mutations in tyrosine kinases, the proposed studies will accelerate the targeting of mutated tyrosine kinases for drug discovery and personalized therapy.",Functional Annotation of Natural and Disease Variants in Tryosine Kinases,9301599,R01GM114409,"['Allosteric Regulation ', ' Allosteric Site ', ' anticancer drug ', ' anticancer agent ', ' Tumor-Specific Treatment Agents ', ' Neoplastic Disease Chemotherapeutic Agents ', ' Cancer Drug ', ' Antineoplastics ', ' Antineoplastic Drugs ', ' Anti-Cancer Agents ', ' Antineoplastic Agents ', ' Biologic Assays ', ' Bioassay ', ' Assay ', ' Biological Assay ', ' neoplasm/cancer ', ' malignancy ', ' Malignant Tumor ', ' Cancers ', ' Malignant Neoplasms ', ' Cellular Growth ', ' Cellular Expansion ', ' cell growth ', ' Cell Viability ', ' Cell Survival ', ' Communities ', ' diabetes ', ' Diabetes Mellitus ', ' Disorder ', ' Disease ', ' resistant to Drug ', ' resistance to Drug ', ' drug resistant ', ' Drug resistance ', ' drug/agent ', ' Pharmaceutic Preparations ', ' Medication ', ' Drugs ', ' Pharmaceutical Preparations ', ' Foundations ', ' Genes ', ' human whole genome ', ' Human Genome ', ' Goals ', ' In Vitro ', ' Biological Models ', ' Model System ', ' Biologic Models ', ' Mutation ', ' genome mutation ', ' Genetic defect ', ' Genetic Change ', ' Genetic Alteration ', ' Names ', ' United States National Institutes of Health ', ' National Institutes of Health ', ' NIH ', ' Organism ', ' living system ', ' Peptides ', ' Phosphotransferases ', ' Transphosphorylases ', ' Phosphotransferase Gene ', ' Kinases ', ' Protein Kinase ', ' phosphorylase b kinase kinase ', ' hydroxyalkyl protein kinase ', ' glycogen synthase a kinase ', ' Kinase Family Gene ', ' ATP-protein phosphotransferase ', ' Protein Tyrosine Kinase ', ' tyrosyl protein kinase ', ' hydroxyaryl protein kinase ', ' Tyrosylprotein Kinase ', ' Tyrosine-Specific Protein Kinase ', ' Tyrosine-Protein Kinase Receptor EEK ', ' Tyrosine Kinase ', ' Protein Tyrosine Kinase EEK ', ' Ephrin Type-A Receptor 8 Precursor ', ' Ephrin Type-A Receptor 8 ', ' EPH-and ELK-Related Kinase ', ' EPH- and ELK-Related Tyrosine Kinase ', ' Proteins ', ' Publishing ', ' Recurrence ', ' Recurrent ', ' Signal Transduction ', ' biological signal transduction ', ' Signaling ', ' Signal Transduction Systems ', ' Intracellular Communication and Signaling ', ' Cell Signaling ', ' Cell Communication and Signaling ', ' Testing ', ' Tyrosine ', ' Threonine Kinase ', ' Serine/Threonine Protein Kinase Gene ', ' Serine-Threonine Kinases ', ' Serine Kinase ', ' Protein-Threonine Kinase ', ' Protein-Serine Kinase ', ' Protein-Serine-Threonine Kinases ', ' base ', ' improved ', ' Distal ', ' Site ', ' Variation ', ' Variant ', ' Active Sites ', ' Tyrosine Kinase Receptors ', ' Tyrosine Kinase Linked Receptors ', ' Transmembrane Receptor Protein Tyrosine Kinase ', ' Receptor Tyrosine Kinase Gene ', ' PTK Receptors ', ' Receptor Protein-Tyrosine Kinases ', ' insight ', ' Therapeutic ', ' Inflammatory ', ' Machine Learning ', ' support vector machine ', ' statistical learning ', ' kernel methods ', ' Complex ', ' Pattern ', ' System ', ' molecular dynamics ', ' Molecular Dynamics Simulation ', ' mutant ', ' Structure ', ' novel ', ' Regulation ', ' Modeling ', ' Property ', ' Genomics ', ' drug discovery ', ' Pathogenicity ', ' Binding ', ' Molecular Interaction ', ' genome sequencing ', ' Address ', ' Drug Binding Site ', ' Mutate ', ' Ontology ', ' Tyrosine Kinase Domain ', ' Molecular ', ' computational framework ', ' computer framework ', ' Outcome ', ' three dimensional structure ', ' 3D structure ', ' 3-dimensional structure ', ' 3-D structure ', ' translational medicine ', ' human disease ', ' public health relevance ', ' personalized medicine ', ' personalized treatment ', ' personalized therapy ', ' personalization of treatment ', ' ']",NIGMS,UNIVERSITY OF GEORGIA,R01,2017,300000,GA-10,0.253183175078445
"High-resolution map of human germline mutation patterns and inference of mutagenic mechanisms     DESCRIPTION (provided by applicant): Mutations are the ultimate source of genetic variation and one of the driving forces of evolution. Both the absolute mutation rate and the relative rate among mutation subtypes fluctuate along the genome, affected by adjacent nucleotide motifs and local features such as GC content and replication timing. Characterizing regional variation of mutation patterns is critical for understanding genome evolution and to identify variants causing genetic diseases. However, mutation rate and molecular spectrum are difficult to measure at high resolution, genomewide, and in an unbiased fashion. Estimates based on common variants and between- species substitutions are confounded by natural selection, population demographic history, and biased gene conversion (BGC). Methods relying on incidence rates of monogenic diseases or finding de novo variants by trio sequencing can inform global trends, but do not provide sufficient data to assess fine-scale local parameters. This study will overcome these limitations by using the extremely rare variants (ERVs) as a new data source to characterize patterns of recent germline variation in humans. ERVs, defined in this study as singletons in 30,000 samples, are becoming available via large-scale whole-genome sequencing (WGS) of population samples. Unlike common variants or substitutions, ERVs arose very recently and are largely unaffected by selection, BGC, etc. We will analyze 200-300 million singleton variants observed in 30,000 subjects at 20-30X coverage. The regional distribution of ERV subtypes will establish a quantitative atlas of the rate and spectrum of human germline mutations mostly unaltered by selection. We will share this resource with the research community and apply it to determine the impact of local genomic features and epigenomic attributes. We will use the systematic departures between ERVs and variants of higher frequencies (polymorphisms and substitutions) to infer local effects of selection, and this may uncover hitherto unknown functional regions of the genome. By comparing mutation signatures in ERVs with those in somatic variations observed in diverse cancers we will attribute distinct mutational signatures to known biochemical processes and thus infer the major contributors to new germline mutations in the human genome. This subtype-specific atlas will also be used to predict the probability of observing every possible single-base mutation in the genome, thus facilitating the interpretation of candidate causal variants of human diseases. We will assess mutation pattern differences among European Americans, African Americans and Latinos, and seek to discover genetic modifiers of germline mutation rate by finding functionally damaging mutations that show increased ERV counts in the surrounding genomic region, potentially identifying both known and previous unknown ""mutator"" genes that play a role in transmission fidelity in humans. This research will provide an essential resource to study the genesis and maintenance of germline mutations in humans. Understanding such a fundamental process will be the basis for a deeper understanding of human evolution and diseases. PUBLIC HEALTH RELEVANCE: We will study the patterns of inherited mutations in humans using approximately 250 million extremely rare DNA variants in human populations. Our results will allow the prediction of the rate of new mutations at every site in the genome based on features of the surrounding DNA sequence, thus providing a common resource to study the arrival and maintenance of mutations in humans. Understanding such a basic process is important for answering fundamental questions in human evolution, the cause of inherited diseases, and the role of DNA abnormality in cancer and aging.",High-resolution map of human germline mutation patterns and inference of mutagenic mechanisms,9275505,R01GM118928,"['Affect ', ' Aging ', ' Algorithms ', ' Allelomorphs ', ' Alleles ', ' Atlases ', ' Biologic Factor ', ' Biological Factors ', ' Biology ', ' neoplasm/cancer ', ' malignancy ', ' Malignant Tumor ', ' Cancers ', ' Malignant Neoplasms ', ' youngster ', "" childrens' "", ' children ', ' Children (0-21) ', ' Child Youth ', ' 0-11 years old ', ' Child ', ' Chromatin ', ' Communities ', ' data interpretation ', ' Data Analysis ', ' Data Analyses ', ' Data Sources ', ' Demographic Factors ', ' Disorder ', ' Disease ', ' Deoxyribonucleic Acid ', ' DNA ', ' Evolution ', ' Family ', ' Foundations ', ' Future ', ' Gene Conversion ', ' Genes ', ' Genome ', ' human whole genome ', ' Human Genome ', ' hereditary disorder ', ' genetic disorder ', ' Molecular Disease ', ' Genetic Diseases ', ' Genetic Condition ', ' Hereditary Disease ', ' History ', ' Recording of previous events ', ' Modern Man ', ' Human ', ' Human Genetics ', ' Incidence ', ' Maintenance ', ' Maps ', ' Methods ', ' Mutation ', ' genome mutation ', ' Genetic defect ', ' Genetic Change ', ' Genetic Alteration ', ' Nucleotides ', ' Parents ', ' Play ', ' Genetic Polymorphism ', ' polymorphism ', ' Probability ', ' Genetic Recombination ', ' Recombination ', ' DNA Recombination ', ' Research ', ' Resources ', ' Research Resources ', ' Rest ', ' Role ', ' social role ', ' Selection Bias ', ' Technology ', ' Tissues ', ' Body Tissues ', ' Genetic Diversity ', ' Genetic Variation ', ' Weight ', ' Generations ', ' Measures ', ' Mutagenesis Molecular Biology ', ' Genetics-Mutagenesis ', ' Mutagenesis ', ' black American ', ' Black Populations ', ' Afroamerican ', ' Afro American ', ' African American ', ' Latino ', ' Natural Selections ', ' Dataset ', ' Data Set ', ' DNA Sequence ', ' base ', ' density ', ' improved ', ' Site ', ' Variation ', ' Variant ', ' Hereditary Mutation ', ' Germline Mutation ', ' Germ-Line Mutation ', ' Individual ', ' European ', ' Biological Function ', ' Biological Process ', ' world wide web ', ' web ', ' WWW ', ' Internet ', ' Genetic ', ' Machine Learning ', ' support vector machine ', ' statistical learning ', ' kernel methods ', ' Frequencies ', ' Inherited ', ' Hereditary ', ' Complex ', ' Dependence ', ' Source ', ' Pattern ', ' Techniques ', ' Somatic Mutation ', ' American ', ' Environmental Risk Factor ', ' environmental risk ', ' Environmental Factor ', ' Positioning Attribute ', ' Position ', ' genetic analysis ', ' Genetic analyses ', ' Modeling ', ' Sampling ', ' repository ', ' Genomics ', ' Guanine + Cytosine Composition ', ' Guanine + Cytosine Content ', ' GC Content ', ' GC Composition ', ' G+C Content ', ' G+C Compositions ', ' Pathogenicity ', ' Mismatch Repair ', ' Post-Replication Mismatch Repair ', ' genome sequencing ', ' Address ', ' Biochemical Process ', ' Data ', ' Resolution ', ' Resource Sharing ', ' genomic region ', ' Genomic Segment ', ' Transmission ', ' transmission process ', ' trend ', ' Molecular ', ' Process ', ' epigenomics ', ' genomic variant ', ' allelic variant ', ' allele variant ', ' Gene variant ', ' genetic variant ', ' Population ', ' driving force ', ' human disease ', ' prototype ', ' public health relevance ', ' genome-wide ', ' genomewide ', ' genome scale ', ' sharing data ', ' next generation sequencing ', ' nextgen sequencing ', ' next gen sequencing ', ' NGS system ', ' NGS Method ', ' rare variant ', ' rare allele ', ' High-Throughput Nucleotide Sequencing ', ' High-Throughput Sequencing ', ' Mendelian disorder ', ' single-gene disorder ', ' single-gene disease ', ' monogenic disorder ', ' monogenic disease ', ' Mendelian genetic disorder ', ' Mendelian disease ', ' actionable mutation ', ' driver mutation ', ' whole genome ', ' entire genome ', ' ']",NIGMS,UNIVERSITY OF MICHIGAN AT ANN ARBOR,R01,2017,300742,MI-12,0.19527015365396436
