text,title,id,project_number,terms,administration,organization,mechanism,year,funding,score
"Enhanced x-ray angiography analysis and interpretation using deep learning Enhanced x-ray angiography analysis and interpretation using deep learning Over 1 Million diagnostic X-ray angiograms are performed annually in the US to guide treatment of coronary artery disease (CAD) and cost over $12 billion. Despite being the clinical standard of care, visual interpretation is prone to inter- and intra-observer variability. Recently as part of the NHLBI supported Prospective Multicenter Imaging Study for Evaluation of Chest Pain (PROMISE) trial, our research team showed that cardiologists misinterpreted over 19% of angiograms obstructive CAD (greater than 50% vessel stenosis). Given the centrality of angiographic interpretation to the development of a treatment plan, reduced accuracy can lead to unnecessary poor outcomes and increased costs to our healthcare system. The potential impact is significant given that increasing interpretation accuracy by 1% could positively benefit over 10,000 patients each year in the US alone. Thus, our team is developing an X-ray angiographic analysis system (DeepAngio) driven by deep learning technology to enhance physician interpretation. In Phase I, the PROMISE dataset of over 1,000 angiograms was used to build our Convolutional Neural Network (CNN) based deep learning model. We achieved a 0.89 Area Under the Receiving Operating Characteristic (AUROC) for identifying obstructive CAD in images with expert scored ground truth (exceeding our proposed Phase I milestone of >0.85 AUROC). Now in Phase II, we present an innovative image learning pipeline to incorporate anatomical and spatiotemporal information from video sequences (similar to a cardiologist reader). A full end to end X-ray angiography video processing pipeline will be developed and tested in a new cohort of 10,000 patient angiograms with normal and graded abnormal CAD. Our patch-based frame analysis model will advance to CNN full frame-based classification of angiographic views (left heart vs. right heart) and segmentation of coronary vessels (LAD, LCx, and RCA). A multiple frame analysis approach enabled by a Recursive Neural Network (RNN) will equip our model with dynamic temporal information to estimate lesion presence accurately. Our goal for Phase II is to improve reading specificity and translate our Phase I proof of concept research findings into a clinically meaningful tool. A multi-reader, multi-case evaluation by a group of interventional cardiologists interpreting with and without DeepAngio predictions will assess clinical usability to improve coronary stenosis estimation. In the long term, we hope the combination of a cardiologist with DeepAngio as an assistive tool will improve the clinical accuracy of angiographic interpretation. PROJECT NARRATIVE In this project, we will develop DeepAngio, a novel computer-assistive technology to enhance cardiologist’s angiographic reading process. It is our hope that this technology will increase the accuracy of diagnosing obstructive coronary artery disease and, ultimately, improve patient outcomes.",Enhanced x-ray angiography analysis and interpretation using deep learning,9777388,R44HL140794,"['3-Dimensional', 'Address', 'Anatomy', 'Angiography', 'Anterior', 'Architecture', 'Area', 'Cephalic', 'Characteristics', 'Chest Pain', 'Classification', 'Clinical', 'Computer Vision Systems', 'Computers', 'Coronary', 'Coronary Arteriosclerosis', 'Coronary Stenosis', 'Coronary Vessels', 'Cost of Illness', 'Data', 'Data Set', 'Development', 'Diagnosis', 'Diagnostic radiologic examination', 'Engineering', 'Evaluation', 'Evaluation Studies', 'Goals', 'Gold', 'Healthcare Systems', 'Heart', 'Image', 'Institutional Review Boards', 'Intervention', 'Intraobserver Variability', 'Lateral', 'Lead', 'Learning', 'Left', 'Lesion', 'Methodology', 'Modeling', 'Morbidity - disease rate', 'National Heart, Lung, and Blood Institute', 'Network-based', 'Neural Network Simulation', 'Observational Study', 'Outcome', 'Pathway Analysis', 'Patient-Focused Outcomes', 'Patients', 'Performance', 'Phase', 'Physicians', 'Procedures', 'Process', 'Reader', 'Reading', 'Reporting', 'Research', 'Roentgen Rays', 'Self-Help Devices', 'Severities', 'Specificity', 'Stenosis', 'Structure', 'Systems Analysis', 'Technology', 'Testing', 'Translating', 'Trees', 'Visual', 'Visual Aid', 'Work', 'base', 'clinically relevant', 'cohort', 'computer aided detection', 'convolutional neural network', 'coronary lesion', 'cost', 'deep learning', 'deep neural network', 'diagnostic accuracy', 'group intervention', 'image processing', 'imaging study', 'improved', 'innovation', 'novel', 'prospective', 'recursive neural network', 'spatiotemporal', 'standard of care', 'tool', 'treatment planning', 'usability']",NHLBI,"VIGILANT MEDICAL, INC.",R44,2019,24447,0.05529620517879528
"Clinical and Molecular Epidemiology of High Risk Coronary Plaque Although current practice focuses largely on the detection and management of obstructive coronary artery disease (CAD), there is marked heterogeneity in the relationship between CAD and risk for cardiovascular (CV) events. Some patients, despite having obstructive CAD, do not experience cardiovascular events, while others with non-obstructive CAD do. The mechanisms of this high risk coronary plaque (HRCP) development are incompletely understood; application of emerging imaging and molecular technologies holds great promise for simultaneously identifying underlying biological pathways, markers for early noninvasive detection, and novel therapeutic targets for HRCP. Thus, we propose to (1) determine the role of inflammation and other candidate biological pathways in the pathophysiology of HRCP; (2) identify novel biological pathways mediating development of HRCP through machine learning analyses of integrated metabolomic, proteomic and transcriptomic profiling; and (3) determine the incremental prognostic value of these imaging and molecular biomarkers over clinical factors and create an integrated clinico-molecular model of CV event risk prediction. We will accomplish these goals by, for the first time, integrating advanced CTA-based phenotyping of HRCP with molecular profiling and adjudicated CV events, leveraging the robust, existing resources of a large, unique NIH-funded clinical trial of imaging in chest pain patients (PROMISE). This proposal holds great public health significance by augmenting current population- and ischemia- based approaches and more precisely and preemptively identifying those patients at highest risk. Our findings will provide a critical foundation for the development of diagnostics and therapeutics targeted at specific, culprit atherosclerotic phenotypes and molecular pathways. Patients who develop blockages in the arteries around their hearts (termed coronary artery disease or CAD) often suffer from heart attacks and death due to these blockages. However, some patients who do not have significant CAD also suffer from these events. These patients are felt to have likely had “vulnerable” or “high risk” coronary plaque (HRCP). We do not understand well what types of patients develop HRCP or the biology as to why some patients develop HRCP. In this grant, we will analyze data on patients with and without HRCP (identified through a CT scan) who were enrolled in the PROMISE clinical trial to understand which patients develop HRCP and then analyze the blood from these patients. These studies hold potential for helping us understand and identify those patients at greatest risk of HRCP and subsequent heart attacks and death, and to evaluate the biological reasons that these patients develop HRCP.",Clinical and Molecular Epidemiology of High Risk Coronary Plaque,9817023,R01HL146145,"['Algorithms', 'Angiography', 'Arterial Fatty Streak', 'Arteries', 'Biological', 'Biological Markers', 'Biology', 'Blood', 'Cardiovascular Models', 'Cardiovascular system', 'Caring', 'Cessation of life', 'Characteristics', 'Chest Pain', 'Clinical', 'Clinical Data', 'Clinical Trials', 'Coronary', 'Coronary Arteriosclerosis', 'Coronary Stenosis', 'Data', 'Detection', 'Development', 'Diagnostic', 'Enrollment', 'Epidemiology', 'Event', 'Extracellular Matrix', 'Foundations', 'Functional disorder', 'Funding', 'Future', 'Goals', 'Grant', 'Heart', 'Heterogeneity', 'Image', 'Individual', 'Inflammasome', 'Inflammation', 'Inflammatory', 'Ischemia', 'Lipids', 'Machine Learning', 'Mediating', 'Modeling', 'Molecular', 'Molecular Epidemiology', 'Molecular Profiling', 'Morphology', 'Myocardial Infarction', 'Non-Invasive Cancer Detection', 'Participant', 'Pathway interactions', 'Patients', 'Phenotype', 'Population', 'Proteomics', 'Public Health', 'Race', 'Reporting', 'Resources', 'Risk', 'Risk Factors', 'Risk stratification', 'Role', 'Smooth Muscle', 'Systems Biology', 'Techniques', 'Technology', 'Time', 'United States National Institutes of Health', 'Validation', 'X-Ray Computed Tomography', 'adjudicate', 'base', 'cardiovascular risk factor', 'clinical epidemiology', 'cohort', 'coronary plaque', 'endoplasmic reticulum stress', 'high risk', 'imaging biomarker', 'improved', 'metabolomics', 'molecular imaging', 'molecular marker', 'molecular modeling', 'neglect', 'new therapeutic target', 'novel', 'pain patient', 'patient stratification', 'predictive modeling', 'prognostic value', 'therapeutic target', 'transcriptomics']",NHLBI,DUKE UNIVERSITY,R01,2019,1485906,0.03646091648011688
"Computer-Aided Diagnosis of Pulmonary Embolism Project Summary/Abstract: The US Surgeon General has declared pulmonary embolism (PE) a major national health problem, causing more deaths than breast, colon, and lung cancers. The current diagnostic standard for suspected PE is CT pulmonary angiography (CTPA). However, the number of CTPA examinations is increasing dramatically, and incorrect CTPA interpretations are frequent in general practice (10-14% over/under-diagnosis). There is a clinical need to improve the efficiency and accuracy of PE diagnosis at CTPA. Our central hypothesis is that this clinical need can be addressed by exploiting computer-radiologist synergy. However, existing computer-aided diagnosis (CAD) methods for PE have serious deficiencies: they are limited in sensitivity and specificity, incapable of handling PE over-diagnosis, and operating only at the embolus level―localizing individual emboli, but PE diagnosis is rendered at the patient-level―excluding non-PE patients and dispatching PE-patients to treatment. Therefore, our objective is to overcome these deficiencies with a new methodology. We have built a strong interdisciplinary team, developed an innovative prototype, and evaluated it through our pilot clinical studies, demonstrating outstanding performance. This proposed research has three specific aims: 1) boost our current system’s embolus-level performance with our newly proposed strategies, assisting radiologists in accurately localizing emboli and facilitating precision medicine through risk stratification; 2) achieve patient-level diagnosis through our newly developed algorithms, assisting radiologists in quickly excluding negative patients and improving diagnostic efficiency; and 3) demonstrate clinical benefits of our system by testing specific clinical hypotheses. This research is innovative because (1) our approach to embolus-level detection fundamentally differs from prior approaches in that it requires no vessel segmentation, overcoming their limitations; (2) we are pioneering two uncharted areas: PE patient-level diagnosis and over-diagnosis prevention; we do not perceive any similar objectives in existing NIH grants or publications in the literature; and (3) this project utilizes our original algorithms and will yield multiple novel algorithms. Our project is significant because it (1) addresses a major national health problem; (2) develops a new methodology that transcends the current paradigm from mere detection of emboli to simultaneous patient-level diagnosis, embolus-level detection, and over-diagnosis prevention, overcoming the deficiencies of the current PE CAD systems; and (3) delivers a next- generation, high-performance PE CAD system that quickly excludes non-PE patients, accurately localizes emboli, and actively prevent PE over-diagnosis, thereby enhancing radiologists’ diagnostic capabilities and supporting precision medicine through risk stratification. Successful completion of the project is expected because (1) we have already made good progress in algorithm development and clinical evaluation; (2) our approach is carefully crafted on solid algorithmic and mathematical foundations; (3) our clinical evaluation is rigorously designed; and (4) our team is uniquely capable and well prepared to conduct this project, which builds upon our innovative research in CAD, pioneering research in deformable models, and world-renowned PIOPED trials. This research is expected to have important impact on PE- related clinical practice, development of decision support systems for many diseases, and medical education. Project Narrative Behind the great success of biomedical imaging, a crisis is looming: the number of imaging studies is growing exponentially; the workload of radiologists is increasing dramatically; the health-care cost related to imaging is rising rapidly—We are facing a grant new challenge: “image data explosion” (a manifestation of big data in biomedical imaging): Modern imaging systems generate enormous data, far exceeding human abilities for interpretation, but what is paramount are not the images themselves, rather the clinically relevant information contained within the images; therefore, our long-term goal is to develop and validate comprehensive, high-performance computational tools that automatically and quantitatively extract clinically relevant information from images to support clinical decision making and facilitate precision medicine. To demonstrate the immediate, measurable impact of our research, we have chosen pulmonary embolism as our initial research platform because the Surgeon General has declared pulmonary embolism a major national health problem, causing more deaths than breast cancer, AIDS, and motor vehicle accidents combined; with laudable efforts to diagnose pulmonary embolism, the number of CT studies for suspected pulmonary embolism has been increasing dramatically, while incorrect CT interpretations are frequent in general practice (10-14% over/under-diagnosis); therefore, there is a clinical need to (1) mitigate radiologists’ workloads and (2) improve the efficiency and accuracy for pulmonary embolism diagnosis using CT. Our objective is to address this clinical need by exploiting radiologist-computer synergy, delivering two important outcomes: (a) a new methodology that transcends the current paradigm from mere detection of emboli to simultaneous patient-level diagnosis, embolus-level detection, and over-diagnosis prevention; and (b) a next-generation, high- performance system that will be able to assist radiologists in quickly excluding negative patients without overlooking positive patients, accurately localizing individual emboli to support personalized treatments through risk stratification, and actively preventing PE over-diagnosis, exerting an important positive impact on clinical practice associated with pulmonary embolism—a life-threatening condition.",Computer-Aided Diagnosis of Pulmonary Embolism,9741795,R01HL128785,"['Acquired Immunodeficiency Syndrome', 'Address', 'Algorithms', 'Anatomy', 'Angiography', 'Area', 'Arteries', 'Big Data', 'Cessation of life', 'Clinical', 'Clinical Research', 'Colon Carcinoma', 'Computer-Assisted Diagnosis', 'Computers', 'Data', 'Decision Support Systems', 'Detection', 'Development', 'Diagnosis', 'Diagnostic', 'Disease', 'Effectiveness', 'Embolism', 'Ensure', 'Equilibrium', 'Explosion', 'Foundations', 'General Practices', 'Goals', 'Grant', 'Health', 'Health Care Costs', 'Human', 'Image', 'Individual', 'Learning', 'Legal patent', 'Life', 'Literature', 'Lung', 'Malignant neoplasm of lung', 'Mathematics', 'Measurable', 'Medical', 'Medical Education', 'Methodology', 'Methods', 'Modeling', 'Modernization', 'Organism', 'Outcome', 'Patient-Focused Outcomes', 'Patients', 'Peer Review', 'Performance', 'Pilot Projects', 'Prevention', 'Publications', 'Pulmonary Embolism', 'Research', 'Research Personnel', 'Risk stratification', 'Sensitivity and Specificity', 'Social Impacts', 'Solid', 'Surgeon', 'System', 'Technology', 'Testing', 'Traffic accidents', 'Training', 'Transcend', 'United States National Institutes of Health', 'Validation', 'Veins', 'Visualization software', 'Workload', 'base', 'bioimaging', 'clinical decision support', 'clinical decision-making', 'clinical practice', 'clinically relevant', 'computerized tools', 'design', 'experience', 'imaging study', 'imaging system', 'improved', 'innovation', 'malignant breast neoplasm', 'next generation', 'novel', 'off-patent', 'personalized medicine', 'precision medicine', 'prevent', 'prototype', 'radiologist', 'research clinical testing', 'success', 'supervised learning', 'synergism', 'vehicular accident']",NHLBI,ARIZONA STATE UNIVERSITY-TEMPE CAMPUS,R01,2019,586687,0.0913233119376511
"A Computer Aided Diagnosis(CAD) Algorithm for Identification of Dysplasia in Patients with Barrett Esophagus ABSTRACT The goal of this project is to develop a based computer aided diagnosis (CAD) algorithm for identification of regions at risk for developing esophageal adenocarcinoma (EAC) in optical coherence tomography (OCT) scans of the esophagus. EAC is one of the deadliest cancers with a 5-year survival rate of less than 20%; yet the standard of care for detecting precursors to EAC is widely recognized to be inadequate. Just recently, a study found that 25% of patients who underwent a standard endoscopic surveillance exam which was found to be ‘clear’ then went on and progressed to EAC within one year. Clearly today’s approach is not working and a significant percentage of disease is being missed. While comprehensive esophageal OCT imaging has shown great potential in addressing this unmet clinical need, one of the main limiters to wider adoption and impact of this technology is the challenge of interpreting the large volume of high-resolution images in real-time. A CAD algorithm would allow OCT to realize its promise in this field and significantly improve the standard of care. Here we propose the development of a deep learning CAD algorithm which will operate on a full patient level volumetric dataset with awareness of the anatomy, robust against image quality and motion artifacts, and trained and validated against a large dataset (>1000 patients). We will aim to reach a sensitivity and specificity of 90/80% based on a threshold set by the American Society for Gastroenterology (ASGE) for the performance of advanced imaging in the detection of high grade dysplasia in BE. PROJECT NARRATIVE The goal of this project is to develop a computer aided diagnosis (CAD) algorithm for use with the NinePoint Medical OCT imaging system and provide early detection of pre-cancerous lesions. Earlier detection leads to earlier treatment, more positive health outcomes for patients and lower healthcare system costs.",A Computer Aided Diagnosis(CAD) Algorithm for Identification of Dysplasia in Patients with Barrett Esophagus,9622504,R43CA232860,"['Address', 'Adoption', 'Algorithms', 'American', 'Anatomy', 'Architecture', 'Awareness', 'Barrett Esophagus', 'Biopsy', 'Classification', 'Clinical', 'Computer-Assisted Diagnosis', 'Data', 'Data Set', 'Detection', 'Development', 'Diagnostic', 'Disease', 'Dysplasia', 'Early Diagnosis', 'Early treatment', 'Epithelium', 'Esophageal', 'Esophageal Adenocarcinoma', 'Esophageal Diseases', 'Esophageal Intraepithelial Neoplasia', 'Esophagus', 'Gastroenterology', 'Gland', 'Goals', 'Health', 'Health Care Costs', 'Healthcare Systems', 'Image', 'Lesion', 'Machine Learning', 'Malignant Neoplasms', 'Medical', 'Morphologic artifacts', 'Motion', 'Optical Coherence Tomography', 'Patient-Focused Outcomes', 'Patients', 'Performance', 'Phase', 'Physicians', 'Premalignant', 'Risk', 'Sample Size', 'Scanning', 'Sensitivity and Specificity', 'Societies', 'Software Tools', 'Squamous Epithelium', 'Surface', 'Survival Rate', 'System', 'Techniques', 'Technology', 'Time', 'Training', 'base', 'case-based', 'cost', 'deep learning', 'diagnosis quality', 'effective therapy', 'gastric foveola', 'gastric rugae', 'high resolution imaging', 'imaging system', 'improved', 'in vivo', 'interest', 'software development', 'standard of care', 'stomach cardia']",NCI,"NINEPOINT MEDICAL, INC.",R43,2018,217888,0.14640052264899556
"Deep radiomic colon cleansing for laxative-free CT colonography Project Summary/Abstract Colon cancer, the second leading cause of cancer deaths for men and women in the United States, can be prevented by early detection and removal of its precursor lesions. Computed tomographic colonography (CTC), also known as virtual colonoscopy, could substantially increase the capacity, safety, and patient compliance of colorectal examinations. However, an FDA panel has recently identified two remaining concerns about CTC: patient adherence, and the detection of small polyps and flat lesions. Our clinical multi-center trial showed that laxative-free preparation by oral ingestion of a contrast agent (iodine) to indicate fecal materials for electronic cleansing (EC), followed by computer-aided detection (CADe), makes CTC easy to tolerate for patients while enabling the detection of ≥10 mm lesions at sensitivity comparable to that of optical colonoscopy. However, small polyps and flat lesions were a significant source of false negatives, because EC produced image artifacts that imitated such lesions. Because laxative-free CTC addresses the concern of patient adherence, the only remaining concern about CTC is the detection of small polyps and flat lesions. The goal of this project is to develop a novel multi-material deep-learning scheme, hereafter denoted as Deep- ECAD, that integrates EC and CADe for the detection of small polyps and flat lesions in laxative-free spectral CTC (spCTC), where spectral imaging and deep learning will be used to overcome the above limitations of conventional CTC. Our specific aims are to (1) establish a laxative-free ultra-low-dose spCTC image database, (2) develop a multi-material deep-learning method for EC, (3) develop deep radiomic detection of small polyps and flat lesions, and (4) evaluate the clinical benefit of Deep-ECAD with laxative-free cases. Successful development of the proposed Deep-ECAD scheme will substantially improve human readers’ performance in the detection of small polyps and flat lesions while minimizing the inconveniences of bowel preparation and radiation risk to patients. Such a scheme will make laxative-free spCTC a highly accurate and acceptable screening option for large populations, in particular, Medicare population, leading to an increased screening rate, promoting early diagnosis of colon cancer, and ultimately reducing mortality due to colon cancer. Project Narrative Successful development of the proposed deep-learning EC-CADe scheme for detecting small polyps and flat lesions in ultra-low-dose laxative-free spCTC (Deep-ECAD) will substantially improve reader performance in the detection of small polyps and flat lesions while minimizing the inconveniences of bowel preparation and radiation risk to patients. Such a scheme will make laxative-free CTC a highly accurate and acceptable screening option for large populations, in particular, Medicare population, leading to an increased screening rate, promoting early diagnosis of colon cancer, and ultimately reducing mortality due to colon cancer.",Deep radiomic colon cleansing for laxative-free CT colonography,9523172,R21EB024025,"['Address', 'Advisory Committees', 'Air', 'Area', 'Benefits and Risks', 'Cancer Etiology', 'Carcinoma', 'Cessation of life', 'Clinical', 'Colon', 'Colon Carcinoma', 'Colonoscopy', 'Colorectal', 'Colorectal Cancer', 'Computed Tomographic Colonography', 'Computer Assisted', 'Consensus', 'Contrast Media', 'Databases', 'Dehydration', 'Detection', 'Development', 'Diagnosis', 'Diarrhea', 'Dose', 'E-learning', 'Early Diagnosis', 'Excision', 'Feces', 'Goals', 'Guidelines', 'Height', 'Human', 'Image', 'Intestines', 'Iodine', 'Learning', 'Lesion', 'Low Dose Radiation', 'Malignant Neoplasms', 'Medical Societies', 'Medicare', 'Methods', 'Morphologic artifacts', 'Multi-Institutional Clinical Trial', 'Optics', 'Oral Ingestion', 'Osmolar Concentration', 'Patients', 'Performance', 'Polypectomy', 'Polypoid Lesion', 'Polyps', 'Population', 'Preparation', 'Problem Solving', 'Radiation', 'Reader', 'Risk', 'Safety', 'Scheme', 'Societies', 'Source', 'Thinness', 'United States', 'Woman', 'base', 'compliance behavior', 'computer aided detection', 'cost', 'deep learning', 'image processing', 'improved', 'laxative', 'learning strategy', 'men', 'minimally invasive', 'mortality', 'novel', 'older patient', 'prevent', 'radiation risk', 'radiologist', 'radiomics', 'screening', 'soft tissue', 'spectrograph', 'virtual']",NIBIB,MASSACHUSETTS GENERAL HOSPITAL,R21,2018,213750,0.009107739366362224
