text,title,id,project_number,terms,administration,organization,mechanism,year,funding,score
"Developing Virtual Colonoscopy for Cancer Screening    DESCRIPTION (provided by applicant):    Colorectal carcinoma is the third most commonly diagnosed cancer and the second leading cause of death from cancer in the United States. Often it is diagnosed at an advanced stage, after the patient has developed symptoms, explaining its high mortality rate. Since most cancers arise from polyps over a 5 to 15 year period of malignant transformation, screening programs to detect small polyps less than 1 cm in diameter have been advocated. Unfortunately most people do not follow this recommendation. The health relatedness of this project is to dramatically increase the number of people willing to participate in screening programs by using a convenient, nearly risk-free procedure.      Virtual colonoscopy (VC) is a new procedure in which computed tomographic (CT) images of the patient's abdomen are taken and a computer visualization system is used to virtually navigate within a constructed 3-D image model of the colon, mimicking the current gold-standard optical colonoscopy (OC). The broad, long-term objective of this project is to develop VC as an accurate, cost-effective, minimalinvasive, least-stressful technique to screen large segments of the population.      To further advance this technology, the specific aims of this project renewal are: (1) to investigate low-dose CT techniques for VC towards massive screening of colonic polyps; (2) to extend electronic colon cleansing strategies to extract the colon mucosa layer by mixture-based image segmentation; (3) to investigate integrated feature-extraction techniques for polyp modeling towards computed aided detection (CAD) of colonic polyps; and (4) to extend our current real-time volume-rendering based navigation algorithms to include CAD and interactive virtual biopsy means for analysis of suspected abnormalities.      The research design and methodology will include evaluating from low-dose CT images the ability to electronically clean the colon lumen and extract the mucosa layer with less-stressful bowel preparation; the feasibility of bringing the technology to a readily accessible environment by documenting VC speed and quality with CAD and interactive virtual biopsy tools through the entire colon; and the accuracy by comparing virtual and optical colonoscopy polyp detection in the same patient using a pilot study.         n/a",Developing Virtual Colonoscopy for Cancer Screening,7237911,R01CA082402,"['Abdomen', 'Advocate', 'Affect', 'Algorithms', 'Area', 'Barium', 'Biopsy', 'Caliber', 'Cause of Death', 'Clinical', 'Colon', 'Colonic Polyps', 'Colonoscopy', 'Computed Tomographic Colonography', 'Computer Assisted', 'Computer software', 'Computers', 'Data', 'Detection', 'Development', 'Diagnosis', 'Diatrizoate Meglumine', 'Diatrizoate Sodium', 'Dose', 'Effectiveness', 'Electronics', 'Ensure', 'Environment', 'Exposure to', 'Facility Construction Funding Category', 'Feces', 'Genus Cola', 'Gold', 'Health', 'Image', 'Imagery', 'Intervention', 'Intestines', 'Iodine', 'Laboratory Research', 'Large Intestine Carcinoma', 'Licensing', 'Liquid substance', 'Long Island', 'Machine Learning', 'Malignant - descriptor', 'Malignant Neoplasms', 'Manufacturer Name', 'Marketing', 'Methodology', 'Modality', 'Modeling', 'Morphologic artifacts', 'Mucous Membrane', 'Nature', 'Navigation System', 'Noise', 'Numbers', 'Optics', 'Patients', 'Physicians', 'Pilot Projects', 'Polishes', 'Polyps', 'Population', 'Preparation', 'Principal Investigator', 'Procedures', 'Progress Reports', 'Protocols documentation', 'Purpose', 'Radiation', 'Rate', 'Reading', 'Recommendation', 'Reporting', 'Research Design', 'Resolution', 'Risk', 'Scanning', 'Screening for cancer', 'Screening procedure', 'Second Primary Cancers', 'Slice', 'Solutions', 'Speed', 'Staging', 'Standards of Weights and Measures', 'Surface', 'Symptoms', 'System', 'Techniques', 'Technology', 'Texture', 'Three-Dimensional Imaging', 'Time', 'Tissues', 'Training', 'Tube', 'United States', 'Universities', 'Validation', 'X-Ray Computed Tomography', 'base', 'cancer diagnosis', 'cost', 'data acquisition', 'density', 'detector', 'digital imaging', 'healthy volunteer', 'imaging Segmentation', 'improved', 'mortality', 'programs', 'prototype', 'radiologist', 'technology development', 'tool', 'virtual']",NCI,STATE UNIVERSITY NEW YORK STONY BROOK,R01,2007,304959,0.06716355573083116
"Texture-Based CAD for Cancer Screening from 3D Images    DESCRIPTION (provided by applicant): Colorectal carcinoma is the third most commonly diagnosed cancer and the second leading cause of death from cancer in the United States. Bladder cancer is the fifth cause of cancer deaths in the United States. Often the cancers are diagnosed at an advanced stage after the patients have developed symptoms, explaining their high mortality rates. Since most colon cancers arise from polyps over a 5 to 15 year period of malignant transformation, screening programs to detect small polyps less than 1 cm in diameter have been advocated. Unfortunately most people do not follow this recommendation. A similar situation exists for bladder tumor staging. The health relatedness of this project is to dramatically increase the number of people willing to participate in screening programs by offering a convenient, nearly risk-free procedure. Virtual colonoscopy (VCon) and virtual cystoscopy (VCys), as new procedures in which computed tomographic (CT) or magnetic resonance (MR) images of the patient's abdomen are taken and a computer visualization system is used to virtually navigate within a constructed 3D model of the colon or bladder, has demonstrated the potential for colon cancer screening and bladder tumor evaluation. We have been contributing the VCon and VCys development for several years. The broad, long-term objective of this project is to develop 3D texture-based computer aided detection (txCAD) techniques to facilitate VCon and VCys as accurate, cost-effective, non-invasive, comfortable techniques to screen large segments of the population. The Phase I specific aims are: (1) To develop tissue-mixture image segmentation mitigating the partial volume effect. (2) To extract the mucosa layer and cleanse the lumen space of the hollow organs from the segmentation. (3) To identify suspicious patches in the mucosa layer with high sensitivity and reasonable false negatives. (4) To obtain the entire volume of each suspicious patch. The Phase II aims are: (5) To extract 3D geometrical, morphological and texture information from each suspicious volume. (6) To classify the extracted features using learning machine to eliminate false positives. (7) To evaluate the performance of the proposed txCAD on a patient database of over 200 cases. It is hypothesized that the proposed txCAD will significantly improve the detection performance compared to previous geometry-based CAD (sfCAD), and dramatically reduces the physician's interaction time with our developed VCon and VCys systems.           n/a",Texture-Based CAD for Cancer Screening from 3D Images,7196610,R21CA120917,"['Abdomen', 'Address', 'Advocate', 'Algorithms', 'Attention', 'Bladder', 'Bladder Neoplasm', 'Caliber', 'Cancer Etiology', 'Cause of Death', 'Cessation of life', 'Characteristics', 'Class', 'Classification Scheme', 'Clinical Trials', 'Clinical assessments', 'Colon', 'Colon Carcinoma', 'Colonic Polyps', 'Computed Tomographic Colonography', 'Computer Assisted', 'Computers', 'Cystoscopy', 'Data', 'Data Set', 'Databases', 'Detection', 'Development', 'Diagnosis', 'Diagnostic Neoplasm Staging', 'Digital Mammography', 'Ensure', 'Evaluation', 'Face', 'Fiber Optics', 'Genus Cola', 'Global Change', 'Health', 'Histocompatibility Testing', 'Image', 'Imagery', 'Imaging Device', 'Invaded', 'Invasive', 'Large Intestine Carcinoma', 'Learning', 'Machine Learning', 'Magnetic Resonance', 'Magnetic Resonance Imaging', 'Malignant - descriptor', 'Malignant Neoplasms', 'Malignant neoplasm of urinary bladder', 'Measures', 'Methodology', 'Morphologic artifacts', 'Morphology', 'Motion', 'Mucous Membrane', 'Nature', 'Noise', 'Numbers', 'Optics', 'Organ', 'Outcome', 'Patients', 'Performance', 'Personal Satisfaction', 'Phase', 'Physicians', 'Polyps', 'Population', 'Procedures', 'Property', 'Range', 'Rate', 'Recommendation', 'Research', 'Research Personnel', 'Resolution', 'Risk', 'Sampling', 'Scanning', 'Screening for cancer', 'Screening procedure', 'Second Primary Cancers', 'Sensitivity and Specificity', 'Shapes', 'Staging', 'Structure', 'Surface', 'Symptoms', 'System', 'Tail', 'Techniques', 'Technology', 'Texture', 'Thinking', 'Three-Dimensional Image', 'Three-Dimensional Imaging', 'Time', 'Tissues', 'Tumor stage', 'United States', 'Urine', 'Validation', 'Variant', 'Weight', 'X-Ray Computed Tomography', 'base', 'cancer diagnosis', 'cost', 'day', 'density', 'desire', 'expectation', 'feeding', 'imaging Segmentation', 'improved', 'mortality', 'programs', 'prototype', 'relating to nervous system', 'three-dimensional modeling', 'tumor', 'vector', 'virtual']",NCI,STATE UNIVERSITY NEW YORK STONY BROOK,R21,2007,241745,0.04742784004507504
"Information-Theoretic Based CAD in Mammography DESCRIPTION (provided by applicant):    The purpose of the study is to develop and evaluate a novel computer-assisted decision (CAD) scheme for improving the clinical detection of breast masses in screening mammograms. The CAD scheme combines information-theoretic similarity metrics with knowledge-based decision algorithms. It will help radiologists scrutinize mammograms providing evidence-based decision support. Given a query mammographic region, the CAD system will interrogate a database of archived mammograms, examine similar eases, and assign a likelihood measure regarding the presence of a potentially malignant mass.  The study proposes the formulation of information-theoretic metrics to quantify the similarity of two mammographic regions. The similarity metrics are based on Sharmon's entropy; a measure of complexity (or information) contained in an image. Theoretically, if two mammographic regions depict similar structures, they should contain diagnostic information for each other. The amount of relevant diagnostic information can be measured by entropy-based similarity metrics that are computed directly from the images without requiring segmentation or feature extraction. Using the similarity metrics and an image databank of mammographic cases with known truth, a knowledge-bussed CAD scheme will be implemented for the detection of masses in screening mammograms. Preliminary studies have established that standard mutual information (MI) is an effective similarity metric for the task.  The specific aims of the study are: (1) To fully exploit information-theoretic metrics that measure the similar content of two mammographic regions, (2) To optimize their contributions in an evidence-based decision algorithm for the early detection of potentially malignant masses, and (3) To perform preliminary clinical evaluation of the CAD system.  As digital image libraries are an upcoming trend in radiology, the proposed CAD system will take advantage of continuously deposited mammograms with established ground truth. The system aims to reduce the interpretation error associated with screening mammograms and/or the false positives generated by cuing CAD schemes, Overall, the study aims to improve the sensitivity while maintaining or improving the specificity of screening mammography for masses. n/a",Information-Theoretic Based CAD in Mammography,7162911,R01CA101911,"['Algorithms', 'Archives', 'Artificial Intelligence', 'Classification', 'Clinical', 'Computer Assisted', 'Computer Interface', 'Cues', 'Databases', 'Deposition', 'Detection', 'Diagnosis', 'Diagnostic', 'Drug Formulations', 'Early Diagnosis', 'Entropy', 'Image', 'Information Theory', 'Knowledge', 'Knowledge Base (Computer)', 'Libraries', 'Malignant - descriptor', 'Mammography', 'Mass in breast', 'Measures', 'Metric', 'Physicians', 'Purpose', 'Radiology Specialty', 'Scheme', 'Screening procedure', 'Specificity', 'Standards of Weights and Measures', 'Structure', 'System', 'Techniques', 'Uncertainty', 'base', 'concept', 'digital imaging', 'improved', 'knowledge base', 'novel', 'radiologist', 'research clinical testing', 'statistics', 'trend']",NCI,DUKE UNIVERSITY,R01,2007,230712,0.17980146228722915
"New Century Breast Cancer Diagnostics System    DESCRIPTION (provided by applicant):    In this project we hypothesize that a comprehensive clinical case library with intelligent agents can sort and render clinically similar cases and present clinically significant features, to assist the radiologist in interpreting mammograms. This computer library system is designed to integrate, search, and analyze clinical data that are analogous to the study case. In normal clinical practice, experienced radiologists often refer to their personal mental images of previous proven cases in making diagnoses and patient management decisions.  Providing a computerized library can refresh a radiologist's mental memory with a broad array of proven cases and concrete visualizations. The system can also assist less experienced radiologists in making diagnoses by referring them not only to histologically proven cases but also to the statistical distribution of features. Freed from bias induced by their recent experience, radiologists can use such a library system to improve the diagnostic accuracy at large. This approach differs greatly from conventional computer-aided detection (CAD) or computer-aided diagnosis (CADx) methods. One can also expect that by adding the radiologist's guidance - for example BI-RADS descriptors - into the proposed mammographic library system will lead to increase the searching accuracy and achieve a greater diagnostic outcome.  Technically speaking, this project differs from previous mammographic CADx and image-based retrieval methods in its emphasis on using local vector features and sector fuzzy features of the mammographic masses supported by our newly-invented maximum likelihood fuzzy shadow techniques and multiple circular path convolution neural network. In addition, the recent technical advances in image retrieval using the fuzzy feature matching method and hyper-space analysis techniques have made the success of the proposed approach highly possible.  This computer-based library system can be extended to include other imaging modalities for breast care.  It is conceivable that this comprehensive breast care database can further link local breast care centers through the coming high-speed network system. In addition, this system could also serve as a learning center for clinicians and scientists. This project represents a significant trend in the development of a comprehensive image data system for breast care in the next several decades.            n/a",New Century Breast Cancer Diagnostics System,7497321,R33CA102960,"['Academic Medical Centers', 'Algorithms', 'Archives', 'Area', 'Artificial Intelligence', 'Arts', 'Back', 'Ballistics', 'Benign', 'Biological Neural Networks', 'Breast', 'Cancerous', 'Caring', 'Case Study', 'Categories', 'Clinical', 'Clinical Data', 'Clinical Trials', 'Communication', 'Computer Assisted', 'Computer-Assisted Diagnosis', 'Computers', 'Data', 'Data Set', 'Databases', 'Descriptor', 'Detection', 'Development', 'Diagnosis', 'Diagnostic', 'Digital Mammography', 'Disease', 'Educational workshop', 'Evaluation Studies', 'Face', 'Film', 'Fingers', 'Future', 'Goals', 'Government', 'Hand', 'Heterogeneity', 'Histologic', 'Human', 'Image', 'Imagery', 'Information Systems', 'Intelligence', 'Law Enforcement', 'Lead', 'Learning', 'Lesion', 'Libraries', 'Link', 'Malignant - descriptor', 'Malignant Neoplasms', 'Mammography', 'Maryland', 'Medical Imaging', 'Medical Informatics', 'Medical center', 'Memory', 'Methods', 'Michigan', 'Monitor', 'Nodule', 'One-Step dentin bonding system', 'Other Imaging Modalities', 'Outcome', 'Patients', 'Pattern', 'Personal Satisfaction', 'Phase', 'Printing', 'Psyche structure', 'Radiology Specialty', 'Rate', 'Records', 'Research', 'Research Personnel', 'Retrieval', 'Science', 'Scientist', 'Screening procedure', 'Security', 'Shadowing (Histology)', 'Sorting - Cell Movement', 'Specificity', 'Speed', 'Standards of Weights and Measures', 'Statistical Distributions', 'Structure', 'Subcategory', 'Supervision', 'Support System', 'System', 'Techniques', 'Telemedicine', 'Teleradiology', 'Testing', 'Text', 'Thoracic Radiography', 'Tissues', 'Today', 'Training', 'United States Food and Drug Administration', 'Universities', 'Variant', 'Work', 'base', 'breast cancer diagnosis', 'breast lesion', 'cancer imaging', 'clinical application', 'clinically significant', 'computerized', 'concept', 'design', 'diagnostic accuracy', 'digital', 'experience', 'gun control laws', 'improved', 'interest', 'malignant breast neoplasm', 'member', 'next generation', 'pre-clinical', 'programs', 'radiologist', 'research clinical testing', 'success', 'trend', 'vector']",NCI,GEORGETOWN UNIVERSITY,R33,2007,560186,0.015825444336580438
"Digital Mammography: Advanced Computer-Aided Breast Can* DESCRIPTION (provided by applicant): The major goals of the proposed research are (1) to develop a computer-aided diagnosis (CAD) system for full field digital mammography (FFDM) using advanced computer vision techniques and (2) to evaluate the effects of CAD on interpretation of DMs. Previous CAD methods for lesion (mass and microcalcification) detection and characterization have been designed for digitized film mammograms and have generally been based on image features extracted from a single view. Our proposed approach is distinctly different from the previous approaches in that image information from two-view mammograms and bilateral mammograms will be fused using machine intelligence techniques. This fundamental change will expand the amount of information utilized in CAD and is expected to improve lesion detection and characterization. New computer vision techniques will be specifically designed for FFDM in order to exploit the advantages offered by digital detectors. This will produce a CAD system that is integrated with and takes full advantage of the latest imaging technologies to further improve the health care of women. We hypothesize that these advanced multiple-image information fusion techniques will lead to a more effective CAD system for FFDMs in comparison to a single-image approach, and that the CAD system will significantly improve radiologists' accuracy in the four most important areas of mammography: (i) detection of masses, (ii) classification of masses, (iii) detection of microcalcifications, and (iv) classification of microcalcifications. A database of digital mammograms (DMs) with malignant and benign lesions and a set of normal cases will be collected. We will first adapt our current film-based CAD algorithms to DMs in each of the four areas, taking into account the differences in the imaging characteristics between DMs and digitized mammograms. New computer vision techniques will then be developed to improve upon the current methods and to exploit the potential advantages of the high contrast sensitivity, high detective quantum efficiency, wide dynamic range, and the linear response to x-ray intensity of digital detectors. Novel regional registration methods for identifying corresponding lesions on CC and MLO views and for comparing the density symmetry on bilateral mammograms will be developed. Innovative fuzzy classification schemes will be designed to fuse multiple-image information and one-view information to reduce false positives and to improve detection sensitivity. Multiple-view morphological and texture features of a lesion will be merged using neural networks or other statistical classifiers for characterization of malignant and benign lesions. To test the hypotheses, we will (1) compare the performance of the multiple-image fusion CAD algorithm for DMs in each area to that of the corresponding one-view algorithm, (2) compare the detection accuracy of masses and microcalcifications on DMs with and without CAD by observer ROC studies, and (3) compare the classification accuracy of masses and microcalcifications on DMs with and without CAD by observer ROC studies. It is expected that this research will not only lead to an effective CAD system for FFDM, the multiple-image fusion approach and the new computer vision techniques will also advance CAD technology for mammography in general. n/a",Digital Mammography: Advanced Computer-Aided Breast Can*,7088818,R01CA095153,"['artificial intelligence', 'bioimaging /biomedical imaging', 'breast neoplasms', 'calcification', 'clinical research', 'computer assisted diagnosis', 'computer system design /evaluation', 'data management', 'diagnosis design /evaluation', 'diagnosis quality /standard', 'digital imaging', 'human data', 'information systems', 'mammography', 'mathematics', 'neoplasm /cancer diagnosis', 'neoplastic growth']",NCI,UNIVERSITY OF MICHIGAN AT ANN ARBOR,R01,2006,565364,0.24526110907162538
"Computer-Aided Detection of Pulmonary Embolism on CT Pulmonary Angiography    DESCRIPTION (provided by applicant): Pulmonary embolism (PE) is a leading cause of death in the United States if untreated. Prompt diagnosis and treatment can dramatically reduce the mortality rate and morbidity of the disease. Computed tomographic pulmonary angiography (CTPA) has been reported to be an effective means for clinical diagnosis of PE. Interpretation of a CT scan for PE demands extensive reading efforts from a radiologist who has to visually track a large number of vessels in the lungs to detect suspected PEs. Despite the efforts, the sensitivities were reported to range from 53% to 100%. Preliminary results from the PIOPED II study indicated a sensitivity of 83% by multi-detector CTPA. Computer-aided diagnosis (CAD) can be a viable approach to improving the sensitivity and efficiency of PE detection in CTPA images, as well as reducing inter-observer variability. The overall goal of the proposed project is to develop a robust CAD system that can provide a systematic screening of PE on CTPA scans and serve as a second opinion by automatically alerting the radiologists to suspicious locations on 2D slice and 3D volume rendering display of the CTPA images. We will develop advanced computer vision techniques to enhance the characteristics of vessels, automatically extract the pulmonary vessels, reconstruct the vessel tree, detect candidate PEs, differentiate PE from normal pulmonary structures, and identify the true PEs. The techniques will be specifically designed for analysis of the complex vascular structures on CTPA images. The specific aims of this project include: (1) developing image preprocessing method to enhance vessel characteristics, (2) developing a new rolling balloon technique in combination with structure analysis to track vessels accurately, including vessels partially or completely occluded by PEs, (3) developing multi-prescreening method for the identification of suspicious PEs at different levels of artery branches, especially for PEs in small subsegmental arteries, (4) analyzing PE features for development of classification methods, (5) developing false positive reduction method based on feature analysis and fuzzy rule-based, linear, or neural network classifiers, (6) exploring performance evaluation methodology for computerized detection of PEs, and (7) performing observer ROC study to evaluate the effects of CAD on radiologists' accuracy in PE diagnosis. The relevance of this research to public health lies in the fact that there is substantial false-negative diagnosis of PEs. CAD will potentially reduce missed PEs and improve the chance of timely treatment of patients, thus reducing the mortality rate and speed up recovery from this condition.         n/a",Computer-Aided Detection of Pulmonary Embolism on CT Pulmonary Angiography,7015959,R21EB005851,"['angiography', 'artery', 'classification', 'computers', 'diagnosis', 'health science profession', 'information systems', 'performance', 'radiology', 'vision']",NIBIB,UNIVERSITY OF MICHIGAN AT ANN ARBOR,R21,2006,217615,0.16206079661155146
