text,title,id,project_number,terms,administration,organization,mechanism,year,funding,score
"Cloud-computer-aided diagnostic imaging decision support system     DESCRIPTION (provided by applicant): High-performance cloud computing (HPCC) is an integration of high-performance computing (HPC) with cloud computing that provides an alternative informatics infrastructure to deliver the supercomputer power needed for developing and reading high quality, multidimensional diagnostic images on desktop or mobile devices. Such infrastructure would advance the use of high-throughput cancer screening like virtual colonoscopy (VC), also known as computed tomography colonography (CTC). The goals of this proposal are to develop and validate the clinical benefits of a mobile HPCC-Virtual Colonoscopy decision support system (HPCC-VC) that integrates novel high-performance electronic cleansing and computer-aided detection schemes. The combination of high performance electronic cleansing (hpEC) with high performance computer aided detection (hpCAD) will allow visualization of the entire mucosal surface of the colon without artifact. Specifically, we hypothesize that the mobile HPCC-VC system will improve the quality of electronic cleansing of non-cathartic CTC (ncCTC) images, will deliver images 100 times faster than conventional approaches, and will improve reader performance in the detection of colonic lesions in the images analyzed on mobile high-resolution display devices.  To achieve these goals, an HPCC platform will be established by use of a CPU-cluster-based supercomputing and parallel image processing libraries. Then, an hpEC scheme will be developed that effectively removes the residual fecal materials in ncCTC images. In parallel, a high-resolution hpCAD scheme will be developed to support high-performance detection of colonic lesions in ncCTC. These schemes will be integrated into a mobile HPCC-VC system on the HPCC platform. Necessary preliminary studies in the development of computed EC and CAD schemes show promise; and the development and deployment of the HPCC platform will advance the quality, speed, and utility of high performance, multidimensional imaging for colon cancer screening. A comprehensive reader performance study will be conducted to determine the clinical application and benefit of images analyzed and delivered through an HPCC platform.  Successful development of HPCC-VC will demonstrate the clinical benefit of the platform for improved diagnostic imaging and facilitation of accurate, high-throughput colon cancer screening that is highly acceptable to patients. In the longer term, broad adoption and use of the HPCC-VC system will facilitate early and accurate diagnoses, and thus reduce mortality from colon cancer.          Successful development of the HPCC-VC system will demonstrate the clinical benefit of HPCC platform for diagnostic imaging, and will provide a high-throughput colon cancer screening scheme for colorectal lesions that is highly acceptable to patients and highly accurate. Such a system will promote the early diagnosis of colon cancer, and ultimately reduce the mortality due to colon cancer.                ",Cloud-computer-aided diagnostic imaging decision support system,8657936,R01CA166816,"['Adoption', 'American Cancer Society', 'Bayesian Modeling', 'Caring', 'Cathartics', 'Climate', 'Clinical', 'Cloud Computing', 'Collaborations', 'Colon', 'Colon Carcinoma', 'Colonoscopy', 'Colorectal', 'Complex', 'Computed Tomographic Colonography', 'Computer Assisted', 'Computer Vision Systems', 'Computer software', 'Decision Support Systems', 'Densitometry', 'Detection', 'Development', 'Devices', 'Diagnosis', 'Diagnostic Imaging', 'Early Diagnosis', 'Economics', 'Electronics', 'Elements', 'Excision', 'Goals', 'High Performance Computing', 'Image', 'Image Analysis', 'Imagery', 'Imaging Device', 'Imaging Techniques', 'Informatics', 'Investments', 'Lesion', 'Libraries', 'Machine Learning', 'Methods', 'Modeling', 'Morphologic artifacts', 'Morphology', 'Mucous Membrane', 'Patient Care', 'Patients', 'Performance', 'Persons', 'Physicians', 'Polyps', 'Population', 'Preparation', 'Process', 'Reader', 'Reading', 'Research Infrastructure', 'Residual state', 'Resolution', 'Resources', 'Risk', 'Sampling', 'Scheme', 'Screening for cancer', 'Specialist', 'Speed', 'Supercomputing', 'Surface', 'System', 'Techniques', 'Testing', 'Time', 'Time Factors', 'United States', 'base', 'clinical application', 'clinical practice', 'colorectal cancer screening', 'computer aided detection', 'design', 'handheld mobile device', 'high end computer', 'high throughput screening', 'image processing', 'improved', 'mortality', 'novel', 'processing speed', 'scale up', 'screening', 'supercomputer']",NCI,MASSACHUSETTS GENERAL HOSPITAL,R01,2014,350219,0.058594072920564635
"Improvement of microcalcification detection in digital breast tomosynthesis DESCRIPTION (provided by applicant): Screening mammography has limited sensitivity and specificity. Digital Breast Tomosynthesis (DBT) is an emerging modality that has been shown to significantly improve the detection and characterization of soft- tissue lesions. However, initial studies have shown that subtle microcalcification (MC) clusters, which are often the only sign of early breast cancer, can be difficult to visualize in DBT. Some have suggested that DBT be used in parallel with FFDM in screening, (i.e., adding one- or two-view DBT to the two-view FFDMs so that FFDM could be used for MC detection while DBT could be used for mass detection). This approach would increase imaging costs, reading time, and patient dose, which are all major concerns with regards to introducing DBT into clinical practice. The main goal of the proposed Partnership between the University of Michigan Computer-Aided Diagnosis Research Laboratory (UM) and GE Global Research (GE) is to develop an integrated practical approach to resolving the MC visualization and detection problems in DBT without increasing patient dose, thereby facilitating the eventual replacement of FFDM by DBT. To achieve this goal, we propose two Specific Aims: (SA1) to develop specially designed MC enhancing methods to improve human and machine visualization of MCs in DBT and develop a computer-aided detection (CAD) system to highlight significant MC clusters, and (SA2) to implement the developed MC-enhancing and CAD reading tools in a DBT workstation and conduct observer performance studies to compare MC detection in DBT with that in FFDM. The following tasks will be conducted to accomplish the specific aims: (1) perform phantom studies to determine the best set of image acquisition parameters for data collection, (2) collect a database of human subject DBTs for development of algorithms and observer study, (3) develop lesion-specific reconstruction and MC enhancing methods to improve the visibility of MCs in DBT for radiologist's reading and computerized detection, (4) develop computer-vision methods to detect MC candidates, (5) develop MC analysis method to reduce false positives (FPs) and insignificant CAD marks, (6) design two-view analysis to further reduce FPs, (7) study dependence of MC detection on reconstruction methods and tomosynthesis acquisition parameters, and (8) design a DBT workstation implemented with the MC-enhancing and CAD- assisted tools to highlight significant MCs for radiologist's reading. We hypothesize that the specially designed DBT display system can assist radiologists in detection of MCs in DBT with accuracy at least comparable to that in FFDM. To test this hypothesis, we will (9) conduct observer ROC studies to compare the detection accuracy of MCs under three conditions: (a) two-view DBT without CAD vs. two-view FFDM without CAD, (b) two-view DBT with CAD vs. two-view FFDM with CAD, and (c) a special protocol of CC-view FFDM plus MLO-view DBT with CAD vs. two-view FFDM with CAD. DBT is a promising modality for improving breast cancer detection. It is widely regarded that DBT is superior to FFDM for detecting soft-tissue lesions. This Partnership between UM and GE aims at finding an integrated, effective solution to address the critical remaining issue of MC visualization and detection in DBT. The partners bring unique and complementary capabilities to the proposed program. GE has expertise in the design of DBT systems, image analysis, workstation implementation, and most importantly, limited-angle tomosynthesis and full-angle CT reconstruction in practical commercial imaging systems. UM has extensive experience in development of CAD methods and DBT imaging, medical physicists with expertise in the evaluation of x-ray systems, and strong clinical support from the Breast Imaging Division within one of the top academic radiology departments in the country. Together, UM and GE have the full complement of skills, experience, and resources required for success on this important public health project. If we are successful in achieving our aims, we will have a practical solution to the MC detection problems in DBT. We will produce an MC-enhanced and CAD-assisted reading protocol that will serve as a model for DBT system and workstation design. This will pave the way for the acceptance of DBT for clinical use, thereby improving the sensitivity and specificity of breast cancer screening which will benefit all women.",Improvement of microcalcification detection in digital breast tomosynthesis,8701878,R01CA151443,"['Address', 'Affect', 'Algorithms', 'Area', 'Benchmarking', 'Breast', 'Breast Cancer Detection', 'Breast Microcalcification', 'Clinical', 'Complement', 'Computer Vision Systems', 'Computer-Assisted Diagnosis', 'Country', 'Data Analyses', 'Data Collection', 'Data Set', 'Databases', 'Dependence', 'Detection', 'Development', 'Digital Breast Tomosynthesis', 'Digital Mammography', 'Dose', 'Evaluation', 'Freezing', 'Goals', 'Human', 'Image', 'Image Analysis', 'Imagery', 'Label', 'Laboratory Research', 'Lesion', 'Mammography', 'Medical Imaging', 'Methods', 'Michigan', 'Modality', 'Modeling', 'Patients', 'Performance', 'Process', 'Protocols documentation', 'Public Health', 'Publications', 'ROC Curve', 'Radiology Specialty', 'Reader', 'Reading', 'Reporting', 'Research', 'Research Design', 'Resources', 'Scanning', 'Sensitivity and Specificity', 'Simulate', 'Solutions', 'System', 'Testing', 'Time', 'TimeLine', 'Tissues', 'Training', 'Universities', 'Woman', 'base', 'clinical practice', 'computer aided detection', 'computerized', 'cost', 'design', 'experience', 'human subject', 'improved', 'malignant breast neoplasm', 'prevent', 'programs', 'radiologist', 'reconstruction', 'screening', 'skills', 'soft tissue', 'success', 'tool']",NCI,UNIVERSITY OF MICHIGAN AT ANN ARBOR,R01,2014,589382,0.1564759110383413
"Computer-Aided Detection of Urinary Tract Cancer on MDCT Urography    DESCRIPTION (provided by applicant): Urinary tract neoplasm is a common type of cancer that can cause substantial morbidity and mortality among patients.  Bladder and upper urinary tract cancer causes 14800 deaths per year in the United States. It is expected that 71100 new bladder and upper urinary tract cancer cases would be diagnosed in 2008. Multi-detector row CT (MDCT) urography is currently a very promising imaging modality for early detection of bladder and upper urinary tract cancer, which can be a cause of hematuria.  The prevalence of hematuria can be as high as 19% in elderly patients.  Interpretation of MDCT urograms (CTU) that commonly exceeds 400 slices is a demanding task for radiologists who have to visually track the upper and lower urinary tract and look for lesions which usually are small in size. In addition, some bladder lesions can be in the bladder area filled with contrast and some in the area without contrast. The long term goal of the project is to develop an effective computer-aided diagnosis (CADx) system to assist radiologists in interpretation of CTUs.  In this proposed project, we will concentrate on the development of the first computer-aided detection (CAD) system for the detection of bladder and upper urinary tract lesions on CTU images.  We hypothesize that the use of CAD system can improve the radiologists' accuracy in detecting bladder and upper urinary tract cancer on CTUs.  To test this hypothesis, we will perform the following specific tasks: (1) collect a database of bladder and upper urinary tract malignant and benign lesions; (2) develop new computer vision techniques to process 3-dimensional (3D) volumetric CTUs; (3) develop algorithms to detect bladder lesions; (4) develop algorithms to detect upper urinary tract lesions; and (5) compare the detection accuracy of bladder and upper urinary tract lesions on CTUs with and without CAD by observer ROC studies. In order to accomplish these tasks, we will develop new image analysis techniques for automated tracking of the ureter and segmentation of the inner and outer walls of the bladder and the ureter. New methods will be designed specifically for detection of lesion candidates in the bladder and the ureter. We will design methods and 3D measures for estimating asymmetries of the bladder wall thickness and detection of ureteral wall thickening.  Feature extraction techniques and robust classification methods will be developed for identification of true positive and elimination of false positive lesions using the extracted features. If successfully developed, the CAD system can potentially improve the performance of the radiologists in detecting urothelial neoplasm as well as in interpreting CTU for patients with hematuria, allowing the detection of additional cancers at earlier stage. Early detection can improve the prognosis and survival of the patients.         PUBLIC HEALTH RELEVANCE:  The main goals of this project are (1) to develop a computer aided detection (CAD) system to assist radiologists in detection of bladder and upper urinary tract abnormalities on multi-detector row CT urography (CTU) using advanced computer vision techniques and (2) to evaluate the effects of CAD on radiologists' detection of lesions on CTUs. The proposed CAD system for CTU will be a new and unique application of computerized techniques for analysis of urothelial neoplasms. The relevance of this project to public health is that CAD can potentially increase the efficacy of CTU for urothelial neoplasm detection by improving the performance and reducing the variability of both the experienced and the less experienced radiologists. Accurate identification of the cause of disease such as hematuria by CTU can spare the patient considerable effort of undergoing a potentially large number of imaging studies, and thus reduce cost by eliminating the additional imaging. Early detection can improve the prognosis and survival of the patients.         ",Computer-Aided Detection of Urinary Tract Cancer on MDCT Urography,8665805,R01CA134688,"['3-Dimensional', 'Algorithms', 'Area', 'Benign', 'Bladder', 'Cancer Detection', 'Cancer Etiology', 'Cessation of life', 'Characteristics', 'Classification', 'Collection', 'Computer Vision Systems', 'Computer-Assisted Diagnosis', 'Computers', 'Database Management Systems', 'Databases', 'Detection', 'Development', 'Diagnosis', 'Disease', 'Early Diagnosis', 'Evaluation', 'Future', 'Goals', 'Hematuria', 'Image', 'Image Analysis', 'Investigation', 'Knowledge', 'Left', 'Lesion', 'Lower urinary tract', 'Malignant - descriptor', 'Malignant Neoplasms', 'Malignant neoplasm of lung', 'Measures', 'Methods', 'Modeling', 'Morbidity - disease rate', 'Patients', 'Performance', 'Prevalence', 'Process', 'Public Health', 'Reading', 'Resources', 'Scanning', 'Slice', 'Staging', 'System', 'Techniques', 'Testing', 'Thick', 'Time', 'TimeLine', 'Training', 'United States', 'Ureter', 'Urinary tract', 'Urography', 'Urologic Cancer', 'Urologic Neoplasms', 'Urothelial Neoplasm', 'base', 'cancer type', 'computer aided detection', 'computerized', 'cost', 'design', 'detector', 'experience', 'graphical user interface', 'imaging modality', 'improved', 'innovation', 'malignant breast neoplasm', 'mortality', 'older patient', 'outcome forecast', 'public health relevance', 'radiologist', 'tool']",NCI,UNIVERSITY OF MICHIGAN AT ANN ARBOR,R01,2014,353464,0.2185806726388087
"Cloud-computer-aided diagnostic imaging decision support system     DESCRIPTION (provided by applicant): High-performance cloud computing (HPCC) is an integration of high-performance computing (HPC) with cloud computing that provides an alternative informatics infrastructure to deliver the supercomputer power needed for developing and reading high quality, multidimensional diagnostic images on desktop or mobile devices. Such infrastructure would advance the use of high-throughput cancer screening like virtual colonoscopy (VC), also known as computed tomography colonography (CTC). The goals of this proposal are to develop and validate the clinical benefits of a mobile HPCC-Virtual Colonoscopy decision support system (HPCC-VC) that integrates novel high-performance electronic cleansing and computer-aided detection schemes. The combination of high performance electronic cleansing (hpEC) with high performance computer aided detection (hpCAD) will allow visualization of the entire mucosal surface of the colon without artifact. Specifically, we hypothesize that the mobile HPCC-VC system will improve the quality of electronic cleansing of non-cathartic CTC (ncCTC) images, will deliver images 100 times faster than conventional approaches, and will improve reader performance in the detection of colonic lesions in the images analyzed on mobile high-resolution display devices.  To achieve these goals, an HPCC platform will be established by use of a CPU-cluster-based supercomputing and parallel image processing libraries. Then, an hpEC scheme will be developed that effectively removes the residual fecal materials in ncCTC images. In parallel, a high-resolution hpCAD scheme will be developed to support high-performance detection of colonic lesions in ncCTC. These schemes will be integrated into a mobile HPCC-VC system on the HPCC platform. Necessary preliminary studies in the development of computed EC and CAD schemes show promise; and the development and deployment of the HPCC platform will advance the quality, speed, and utility of high performance, multidimensional imaging for colon cancer screening. A comprehensive reader performance study will be conducted to determine the clinical application and benefit of images analyzed and delivered through an HPCC platform.  Successful development of HPCC-VC will demonstrate the clinical benefit of the platform for improved diagnostic imaging and facilitation of accurate, high-throughput colon cancer screening that is highly acceptable to patients. In the longer term, broad adoption and use of the HPCC-VC system will facilitate early and accurate diagnoses, and thus reduce mortality from colon cancer.          Successful development of the HPCC-VC system will demonstrate the clinical benefit of HPCC platform for diagnostic imaging, and will provide a high-throughput colon cancer screening scheme for colorectal lesions that is highly acceptable to patients and highly accurate. Such a system will promote the early diagnosis of colon cancer, and ultimately reduce the mortality due to colon cancer.                ",Cloud-computer-aided diagnostic imaging decision support system,8494421,R01CA166816,"['Adoption', 'American Cancer Society', 'Belief', 'Caring', 'Cathartics', 'Climate', 'Clinical', 'Collaborations', 'Colon', 'Colon Carcinoma', 'Colonoscopy', 'Colorectal', 'Complex', 'Computed Tomographic Colonography', 'Computer Assisted', 'Computer Vision Systems', 'Computer software', 'Decision Support Systems', 'Densitometry', 'Detection', 'Development', 'Devices', 'Diagnosis', 'Diagnostic Imaging', 'Early Diagnosis', 'Economics', 'Electronics', 'Elements', 'Excision', 'Goals', 'High Performance Computing', 'Image', 'Image Analysis', 'Imagery', 'Imaging Device', 'Imaging Techniques', 'Informatics', 'Investments', 'Lesion', 'Libraries', 'Machine Learning', 'Methods', 'Modeling', 'Morphologic artifacts', 'Morphology', 'Mucous Membrane', 'Patient Care', 'Patients', 'Performance', 'Persons', 'Physicians', 'Polyps', 'Population', 'Preparation', 'Process', 'Reader', 'Reading', 'Research Infrastructure', 'Residual state', 'Resolution', 'Resources', 'Risk', 'Sampling', 'Scheme', 'Screening for cancer', 'Specialist', 'Speed', 'Supercomputing', 'Surface', 'System', 'Techniques', 'Testing', 'Time', 'Time Factors', 'United States', 'base', 'clinical application', 'clinical practice', 'colorectal cancer screening', 'computer aided detection', 'design', 'high end computer', 'high throughput screening', 'image processing', 'improved', 'mortality', 'novel', 'processing speed', 'scale up', 'screening', 'supercomputer']",NCI,MASSACHUSETTS GENERAL HOSPITAL,R01,2013,339387,0.058594072920564635
